speaker,words,tags,timestamp
CS,"is. Well, my mother's father was brought up in New England, and they",,
CS,"all had buttries, and it was just a place to keep the supplies, that",,
CS,were kept like flour and sugar and that sort of supplies. The big sup,,
CS,"ply, and then you'd carry it into the smaller containers in the kit",,
CS,"chen. And then, I went from kerosene lamps to electricity. And our",,
CS,"first lights were just a drop cord, you know, with a bulb on the end",,
CS,"of it, before we had any fixtures. But, the lamps, the coal oil lamps",,
CS,that was a hard time. My father was great on having every room,,
CS,"lighted, in the house. And, so, that meant maybe several lights,",,
CS,"like in our, we called it the frontroom then, it was the livingroom,",,
CS,"several lamps there and then in the room, the diningroom probably",,
CS,"where the studying was done at night around the diningroom table, you",,
CS,know. And she had at least ten or twelve lamps every morning to fill,,
CS,"and wash the chimneys, and trim the wicks. And it took one hour of",,
CS,"her morning, every morning, to prepare the lamps for the evening's light",,
CS,"ing session. The chimneys had to be cleaned, too, you know, no lint",,
CS,"or anything on 'em, they had to be sparkling. And then we burned—",,
CS,"in the frontroom, the livingroom, we had a great huge heater, and the",,
CS,wood had to be brought in every night after school. And under one,,
CS,"kitchen table, it wasn't the work table, but another kitchen table,",,
CS,"was filled with wood every night for the heater. But, then, finally",,
CS,we started burning coal so it just meant just getting in scuttles of,,
CS,"coal. But, that job fell to me after my brother was— had gone from",,
CS,home. I was the youngest so I fell heir to the job of bringing in the,,
CS,wood and mowing the lawn in the summer.,,
LS,Was the wood split already?,,
CS,"Well, regular cord wood, that's the way my father bought it, he bought",,
CS,"nine or ten cords every fall, was stacked in our alley. I think it",,
CS,"was about four foot lengths, and then the wood sawyer came in with a",,
CS,"mechanical saw and sawed it, and then it was carried into the woodshed.",,
CS,We had a great big woodshed and it was stacked clear to the ceiling.,,
CS,"That supplied us until wood had to be purchased the next summer. But,",,
CS,"of course, kindling would have to be split for the kitchen stove to",,
CS,"ignite the but, before we burned coal though, the wood had to be",,
CS,split for the kitchen stove'cause there was a woodbox we had to fill,,
CS,behind the stove.,,
LS,When you were talking about going around for the—,,
CS,Red Cross?,,
LS,Yes. Did most people here really support the war?,,
CS,"Oh, yes. And as I say, those Scandivanian people, they didn't— I",,
CS,"couldn't converse with 'em, but they knew what we needed, and, boy,",,
CS,did they turn out the socks and things.And a lot of women couldn't—,,
CS,they had in their toe and hee,,
LS,", it was a special toe and a",,
LS,heel they — the heel was kind of like this— indicates with hands—,,
LS,"shaped, not just— and a lot of people couldn't do those, and so, I",,
LS,know my mother used to — I'd bring them to my mother after the long,,
LS,leg was— and I think they made 'em pretty long— and she'd put in the,,
LS,in the toe and heel..,,
LS,Would she take out what had been done?,,
CS,"No, no, she'd just go right on and finish the foot, you see, the heel",,
CS,"and the foot. The knitting was just the same, but she did that for",,
CS,many.,,
LS,Were there other things ?,,
CS,About the Red Cross?,,
LS,Yeah.,,
CS,"Well, Mrs. Laney was head of the Red Cross here, then, and she just",,
CS,turned her home over. They made hospital gowns out of muslin. I never,,
CS,got in on that part 'cause I was just a young woman and I didn't know,,
CS,"about that, but I was a good errand girl. Bu then ftjr different churches",,
CS,"they'd roll bandages. Instead of a Ladies Aid meeting tip something,",,
CS,the time was spent rolling bandages. Moscow responded very well. In,,
CS,"later years I was secretary of the Red Cross here, and Moscow always",,
CS,responded well to the Red Cross.,,
CS,"Well, I believe maybe one reason— well, I don't know either—",,
CS,"Dean Eldridge was in the YMCA— and that First World War, that was",,
CS,"such a big thing, you know, the Young Mens Christian Association, and",,
CS,he was sent to France. But there were so many local people in it here,,
CS,that Moscow felt a great interest. I think the things that were,,
CS,"accomplished, Moscow wasn't near as big then, were really quite remarkable",,
CS,for a town of this size. And this being the County Seat it,,
CS,went out to all the county from here. In every town there'd be a wo,,
CS,man wo'd set it up and tend to it. The response was splendid.,,
LS,Was there- the Ladies Aid? What was the Ladies Aid then?,,
CS,"What was the Ladies Aid? Well, in our church there was— the Ladies",,
CS,Aid that really was just the organization in the church that kinda,,
CS,"tended to the local wants of the church, you know. Gave icecream",,
CS,"socials and so on, to raise money to augment the minister's salary or",,
CS,"if they needed something in the Sunday School,why the money was used",,
CS,"for that. And then, we had a minister's wife who felt that that wasn't",,
CS,"sufficient, Mrs. Gormley, and so, she started a Women's Missionary",,
CS,"Society. Well, the women began to think — a lot liked to go to the",,
CS,"Ladies's Aid, that was more or less social, you see, and when they put",,
CS,"on these special events, they all liked to work at them. But nobody",,
CS,"wanted to belong to the Missionary Society, and so she got the bright",,
CS,"idea of combining them, so it's been that way in our church to this",,
CS,"day. It's all one organization. 'Course, it's that way nationally",,
CS,"now, in my church, the Presbyterian Church. But, Mrs. Gormley had a",,
CS,"very far vision by putting those into one organization, 'cause she",,
CS,"made the Missionary Society as strong as the Ladie$ Aid, then, you",,
CS,"see, because they all belonged to both.",,
LS,"Well, did most of the women in the church belong?",,
CS,"Uh-huh, because that was a big part of the social life of the town.",,
CS,"Later on clubs started, various women's clubs, but in the early days",,
CS,that was the social light of the town.,,
LS,Would each church have something like that?,,
CS,Yes.,,
LS,It wasn't just the Presbyterian Church?,,
CS,"No, no. They all had their women's organizations. And I think a good",,
CS,many ministers might have been hungry if those women hadn't of helpeed,,
CS,raise money on the side to help out the church budget.,,
LS,Were there other things about the church that you remember?,,
CS,"Yes. 'Course, my mother was a great church woman and my father always",,
CS,"went to church, too. He made a Presbyterian of her, she'd been brought",,
CS,"up something else. But, we all— my mother had six children, I was",,
CS,"the baby, and I know she used to say she started taking me to church",,
CS,when I was six months old to Sunday School. She believed in the parents,,
CS,"going to Sunday School. I don't remember my father ever going, but",,
CS,she managed to get six children ready and to get to Sunday School herself.,,
CS,"So, we were brought up to think that was the thing to do. And",,
CS,"then, my father would come on to church service at eleven, you see.",,
CS,The Sunday School was  and then he would come on and join,,
CS,my mother for church.,,
LS,She went— did she always do that?,,
CS,Always. Always.,,
LS,Would many of the other parents go?,,
CS,"Quite a few. I think, like the Davids, they.all went to Sunday School,",,
CS,any many of the families in the church. Most of them. That was just,,
CS,"a part of church life, too. And they're coming back to that now, which",,
CS,is very nice.,,
LS,Were there other activities for the young people?,,
CS,"In the church? Well, yes, my oldest brother and my oldest sisters,",,
CS,"they had a Christian Endeavor, which is a young people's organization",,
CS,that met in the evening. And then they had— that was their social,,
CS,"life, to a great extent. 'Course, on Sunday night it was a religious",,
CS,"service of sorts, you know. And, then, they'd have parties during",,
CS,the week. That was the social life of the town. You belonged to the,,
CS,"Christian Endeavor— it was called other things in other churches, but",,
CS,in my church—,,
LS,"Did you belong to that, too?",,
CS,"I never did, uh-huh. That had stopped by the time I on. Well,",,
CS,"you see, by that time we were having other interests. Being the tailend",,
CS,"of the family, you know, it was developing into, like you know—",,
CS,"I always went to Sunday School, but we didn't have any of this sort",,
CS,"of thing or young people's meetings in my time. But later on, my sister,",,
CS,"not the one who's living in Lewiston, but the next one who always made",,
CS,"her home with us, Myra, went into religious education and she was the",,
CS,"director in our church here. And, she started that again; the minister",,
CS,"saw the need i the campus for that, and so it was started again. And",,
CS,"she started a Westminster Guild for young college girls. But, really",,
CS,this is outside the scope of this— what you want. But that was con,,
CS,"sidered an extra curricular activity on the campus, and it was accepted",,
CS,as that. And girls who participated in that got credit for their ex,,
CS,"tra curricular activities, like in sororities and things.",,
LS,Did people from the University always come down to the churches?,,
CS,"Yes, uh-huh, uh-huh.^ I think now— there isn't— although they're com",,
CS,"ing real well at our church, but they do have— like the Catholics",,
CS,"have their center on the campus, and they have the Christian Center",,
CS,"on the campus, and I think the young people pretty much go to those.",,
CS,"And then they have, during the week, these bullfests, or whatever they",,
CS,call 'em. That's out of the realm of what you want.,,
CS,"quite small, because, we had gone on a camping trip up near Bovill",,
CS,"and I remember, I was this small that in the morning I rode in the",,
CS,"horse and buggy with my mother and father, and they carried me out in",,
CS,"my nightgown, because it was early when we started, you see, so I must",,
CS,"have been not too big. But we had our camping trip out there, and as",,
CS,"we came home in two weeks, it was a Sunday, and there was a place half",,
CS,"way out there, and a negro family lived there, it was kind of a half",,
CS,"way house and the people used to stop on the way— the White Pines, we",,
CS,"called it, around Bovill you know. People had timber claims up there.",,
CS,"In fact, Carol writes about that in her book. And, so they told us,",,
CS,"or I think somebody drove up while we were there with a team of horses,",,
CS,"and told us what had happened in Moscow. So, of course, we were all",,
CS,"very much excited about it. Well, by the time we got in there, the",,
CS,house where it happened was right down here where this service station,,
CS,"catty-cornered— 'course, that was the only road into town and the",,
CS,"highway wasn't here, so we had to go right by it, of course,",,
CS,"all traces of the tragedy were gone by then. But, 'course, there were",,
CS,"bullett holes in the house. I don't know that I actually saw 'em,",,
CS,"but that was what they said. But, that happened very much as it was",,
CS,"in the book. And this man who went berserk, had been told by Dr. Wat",,
CS,"kins that he thought he should be committed to Orofino to the asylum,",,
CS,because he beat up and was so cruel to his mother. And this man's,,
CS,"father, I think, had been a Mason along with Dr. Watkins.",,
CS,"And, so,",,
CS,Dr. Watkins was sort of taking him— I don't know how old he was—,,
CS,"under his — you know, trying to do what was the right thing. So, he",,
CS,"just went berserk that particular day, and Dr. Watkins went to his of",,
CS,"fice every Sunday morning, and he shot him. Came ulfan his horse and",,
CS,"shot him— Dr. Watkins. But the horse just kept going, and went down",,
CS,"and stopped in front of the— his office as it was used to doing, you",,
CS,"see. That was so matter of fact, the horse could — as it was it's",,
CS,"habit to do. And, pretty soon somebody saw Dr. Watkins slumped, and",,
CS,"then this fellow went on down the street on his horse, and Mr. Creigh",,
CS,"ton, who owned the store where Creighton's is now, he always carried",,
CS,"a cane, not for need, but for looks, and a hat, and so on. And he shot",,
CS,"at Mr. Creighton, I don't know what his grudge was against Mr. Creigh",,
CS,"ton, but he just hit him in the arm, and then he went on down and came",,
CS,up Eighth Street to where a deputy sheriff lived and he stopped there,,
CS,and asked for a drink of water. And he had intended to shoot the deputy,,
CS,"sheriff, but he had his baby in his arms and I know those girls real",,
CS,"well, they don't live here any more— and so he didn't shoot him. And",,
CS,"then, he had, oh, there were several men on his list— as he came in",,
CS,"towards the Presbyterian Church he came in Eighth Street, what Eighth",,
CS,"street is now, and stopped at the Harold home, which I know, 'cause",,
CS,"I was born in that neighborhood, and Mrs. Harold said that Mr. Harold",,
CS,"was not at home, so he went on then, and got Dr. Watkins. And, so, by",,
CS,"the time this had all happened, the posse had gotten together and they'd",,
CS,"opened the hardware stores and got guns for all the men, and they came",,
CS,"up by foot, If course, 'cause he'd come out to his home and barricaded",,
CS,"himself in the upstairs. And so, they just poured the shot into that",,
CS,"house and finally his old mother came out and said, ""Don't shoot any",,
CS,"more, he's dead."" And one man in Moscow claimed that he'd fired the",,
CS,"bullet that had killed him, you know, but nobody ever knew. And that's",,
CS,"in, which one of Carol's books? Have you read any?",,
LS,Yeah.,,
CS,"Yeah, that's what I thought.",,
LS,Is that mainly what you remember it from?,,
CS,"No, I remembered it. Well, 'course, it's mainly from Carol's book and",,
CS,"then our talk in the home when I was a child, you see. But, I remember",,
CS,"of going on that camping trip, although I don't remember any of the",,
CS,But I remember of coming back and going by that house.,,
CS,Were there actually any other things like that that happened in town?,,
CS,"Well, of course, — was it in Buffalo Coal- where the minister's daugh",,
CS,ter went to Orofino— that was in the same story. That actually hap,,
CS,"pened, too, you know. The minister's daughter went down to Orofino,",,
CS,"with this doctor, and a murder-suicide, you know. No, I don't rememb",,
CS,er of anything real tragic like that ever happening.,,
CS,"Oh, there were farm accidents and things that were bad, sometimes",,
CS,"you know, but nothing that was just actual planned out like this was.",,
CS,Were there many trials that were ?,,
CS,"Oh, yes, yes. Of course, in the old courthouse— what was that trial?",,
CS,But that was after this time you're wanting. But there were trials,,
CS,"here. Then the Federal Court was here, you see, and the Indians were",,
CS,"always brought here for their misdemeanors, because they had to appear",,
CS,"in Federal Court, you see. And that was one of the talking points against",,
CS,"has always been,",,
CS,"our old post office, The Indians didn't like to climb those stairs",,
CS,up to the court. That always tickled me. (chuckles),,
CS,Did you go to a dentist?,,
CS,"Oh, yes. I think Harry had dentist on his list. But dentistry— the",,
CS,dentists we went to— I think he must have been a pretty crude dentist—,,
CS,but he was a big man and he had such huge hands. It was old-style den,,
CS,"tistry, of course, but I remember once— I had to have one of my molars",,
CS,"pulled, and I just fought that man terribly. And ffitnally, I just wig",,
CS,gled out of his chair and he pulled the tooth— I was on the floor when,,
CS,he pulled . But he gave me the tooth and I know I had it in alittle,,
CS,"box for years. Well, we didnt know anything about the Tooth Fairy then",,
CS,either. (chuckles) But dentistry was so crude and it hurt so.,,
CS,How would they do?,,
CS,"Well, I don't think they ever— 'course, I was so young then, I was",,
CS,"just— I think they just pulled the teeth, but, later on, this would",,
CS,"still be in the time you want, I guess, the dentist we came to, he was—",,
CS,by then they were putting cocaine- I don't think it was novacaine— but,,
CS,"something in, you know, if they did work. But his procedure on dent",,
CS,"istry was, if you got a cavity in a tooth, was to extract the nerve of",,
CS,"the tooth and then fill it. And, I know he used that, he'd run this",,
CS,little wire in and twist it around the nerve some way and jerk it out.,,
CS,"You felt one terrible excruciating pain, you know, and, of course, the",,
CS,"tooth was dead then, because I know I had a dead tooth.in the front be",,
CS,fore I got dentures that finally gave me trouble. But that was his,,
CS,method to extract the nerve from the tooth and then fill it. He ran a,,
CS,"little wire, he'd drill and then put this in and pull the nerve out.",,
CS,"doesn't that sound crude? Well, it was crude. But he was considered",,
CS,a very good dentist. I remember him so well because he hummed all the,,
CS,time he worked on you. His daughter was one of my best friends. He,,
CS,"extracted my mother's teeth, and my father was going to be up there to",,
CS,"be with her during the ordeal, and he was late, something happened, and",,
CS,he didn't get there in time. Just as he came in the waiting room doorthe,,
CS,"dentist's waiting room door— he heard Dr. Watkins, his name was",,
CS,"Watkins, too, but it was no relation— he said, ""I'll never pull another",,
CS,"tooth for Mrs. Moody."" And it scared my father to death, he thought",,
CS,"she'd died or something, and he just meant he'd finished the job. But",,
CS,she was very uncomfortable I remember after that. And.they waited sev,,
CS,"eral months before they put the new teeth in, you know, 'cause I know",,
CS,"when I had to have my upper teeth extracted, they put the teeth in im",,
CS,mediately because they'd taken a mold already and made them.,,
LS,Can you tell me about your grandmother who lived out on—,,
CS,"Well, yes, that was the grandmother, that was my mother's mother who",,
CS,"lived in Salubria, where I said my mother came to. And she married",,
CS,"Mr. Smith, we always called him, we never called him grandpa or any",,
CS,"thing but Mr. Smith. And they bought a place down on Fix Ridge, and",,
CS,Grandma was just sort of the do-gooder on that ridge. Anybody was sick,,
CS,"they'd call Grandma, 'cause she had all these old time remedies, you",,
CS,"know. And anybody died}Grandma had to go and help lay them out, as",,
CS,"she called it. But, they did have phones, but they had a signal that",,
CS,if anything happened central rang this one ring and everybody took,,
CS,"their phones down, so they would know whatever had happened, you know.",,
CS,"And that always seemed like that was quite neat to me, when I was a",,
CS,"child. Mama went down several times during the good part of the year,",,
CS,"the weather, and Iwas alittle girl and Iwent with her. But, we had",,
CS,"to ford a little stream out here someplace beyond Lgnnville, and we'd",,
CS,start out early in the morning 'cause it took us pretty near all day to,,
CS,"get there, because the horse never went at avery good gait for my",,
CS,"mother, kinda walked all the way. An my mother always hoped that I'd",,
CS,"be having anap when we came to the stream, because, as Iremember you",,
CS,"could- it was just like that- but it scared me, anyway, that bumping",,
CS,"across the rocks. And, I've never found the place where that was, but",,
CS,"of course, it's so different now. Then I'd get out at the top of the",,
CS,"hill above Grandma's house, they lived kind of down in alittle valley",,
CS,"and go down through the orchard and beat Mama there, of course, 'cause",,
CS,she'd have to go around and go through the lane to get to the house.,,
CS,"But, Grandma had feather beds and we didn't have feather beds, we just",,
CS,"had mattresses, and Ohhh, Ithought that was just heaven to sleep in a",,
CS,feather bed.,,
LS,You'd stay over night?,,
CS,"Oh, yes, we'd stay several days when we'd go like that, 'cause it was",,
CS,"an all-day trip almost for my mother to get there, and we stayed several",,
CS,"days. Iknow we often went when the peaches were ripe down there. And,",,
CS,Grandma— they had quite a prune orchard. They had quite a business,,
CS,"of drying prunes, that was quite the thing here in the early days. Peo",,
CS,"ple would grow prunes and dry 'em. And, I think they must have sold",,
CS,"them to the stores. But they had a house dryer, where they had some",,
CS,"kind of fire, I don't know what it was, and the prunes would be put in",,
CS,on chicken wire racks and they'd dry them. I don't know why they,,
CS,"didn't taste smokey, but they didn't, they were delicious. 'Cause we",,
CS,"always had a sack hanging in the buttry, when I was a child, and we'd",,
CS,"play sort of 'cops and robbers', you know, and the buttry was always",,
CS,"the jail, but there was kind of an advantage to being in jail, because",,
CS,"you could eat dried prunes and dried apples, (chuckles)",,
LS,"Did your mother dry the apples, too?",,
CS,Yes. I remember she did. They'd put sheets up on the wood house roof,,
CS,and we'd spread just think of peeling all those apples— and then,,
CS,"my brother, probably, was sent up to spread them out and then they put",,
CS,"a net- what is this window netting, what did they call that?",,
LS,Mosquito?,,
CS,"Mosquito net over them, to keep the bugs off. But they never thought",,
CS,"about the dust, because our street wasn't paved and the dust would get",,
CS,about that in the summer. And a vehicle happened to go by the,,
CS,dust would roll in. But we always sprinkled down our road— the street,,
CS,"in front of our house; ^several of the neighbors did, but on beyond us",,
CS,"they never sprinkled, so we always managed to get quite a bit of dust.",,
CS,"That was one job I had to do, was sweeping off the veranda every day,",,
CS,"and it was quite a job, all that dust. But people then used to sit out",,
CS,"on their porch in the evenings, you know, it was hot, but you sat out",,
CS,there and the neighbors would come over and visit. My father always,,
CS,sat out and read his paper in the evening until it got too dark to,,
CS,"read. But, you used your porches a great deal in those days. And, so,",,
CS,"that was one of my jobs, was to sweep off the veranda every morning.",,
LS,Did you have other jobs?,,
CS,"Well, filling the woodbox, and then sprinkling the lawn.",,
LS,How would you do that?,,
CS,"Well, we had a sprinkler, but, to get the edges I would hold the hose",,
CS,"and sprinkle. And I know if I was anxious to go someplace, if I'd make",,
CS,"it look awfully wet on the sidewalks and everything, my father'd think",,
CS,"I'd done a pretty good job of sprinkling, so I could get going, but,",,
CS,"actually it was just all surface. But, I was really supposed to start",,
CS,the hose late in the afternoon and give the lawn a good watering.,,
LS,Did you have much of a garden?,,
LS,"Oh, yes. We had these two lots, you see, south of our house, and there",,
LS,"were trees, and then in the center was all open with a garden spot. We",,
LS,"always had our own potatoes and peas and beans and things, and corn,",,
LS,and my father used to hire the next door neighbor to come over and spade,,
LS,it up for him and then he'd plant it. Every evening he'd go out and hoe,,
LS,and work In the garden. And it was always a delight to go down in,,
LS,fruit cellar in the fall after everything was harvested. There were,,
LS,sacks and sacks of potatoes and all the shelves full of can,,
LS,"ned fruit, because the stores— you just could only buy oranges and ban",,
LS,"anas in the winter, you know, that was all you could ever buy. We didn't",,
LS,"even have head lettuce or anything like that in the winter, then. But",,
LS,we had our own beets and carrots and they were stored and parsnips and,,
LS,"all the things that you could grow that would keep, you know. But, I",,
LS,"don't remember, we never grew our own tomatoes in those days. We always",,
LS,had to buy them. But several gardeners around town would— out in the,,
LS,"country grew tomatoes. But, I don't know why we never thought we could",,
LS,"have tomatoes in our garden. We thought they wouldn't ripen, you know",,
LS,"the frost came. But, I think the varieties are better now and",,
LS,"are earlier and so on, and so we can ripen tomatoes easily in Moscow.",,
LS,Did you can any meat or anything like that?,,
CS,"No. We never did. We never did that, I know lots of people did. What",,
CS,"we did do: in the spring of the year, my grandmother would always give",,
CS,"us two little pigs. Our lot was big so we had a pigpen, you know, and",,
CS,"we had our own chickens. But then, in the early winter, later than this",,
CS,"when it started to get real cold, my father'd have a man come and butcher,",,
CS,"but they never smoked the meat. It was packed down in barrels with salt, and so that",,
CS,"made it- always had to be parboiled, you",,
