speaker,words,tags,timestamp
CS,"sit at that little table. And, we bought sundaes more than anything,",,
CS,you know. We'd have ice cream with pineapple or strawberry or some,,
CS,"thing over it, and that was quite the thing.",,
LS,Did they make their own ice cream?,,
CS,"Yes, I think they did and it was very good ice cream, too.",,
LS,Did they have a lot of flavors?,,
CS,"Well, not too many flavors. It was mostly just vanilla and chocolate,",,
CS,"I think, maybe strawberry some of the times. Then you could have it",,
CS,made into a sundae. But I remember the one time befote my husband,,
CS,"and I were married, we went into one of the confectionery stores,",,
CS,"and ice cream parlors, that's the way they usually called them, be",,
CS,"cause they made their candy too, much like Mrs. Hunter makes today",,
CS,"their candies, you know. And we used to, in the winter, we d go in",,
CS,"there and get oyster cocktail , oh, we just thought that was wonder",,
CS,"ful. It was cold, you know, and why we'd like it in the winter I",,
CS,"don't know, but we did.",,
LS,What was it?,,
CS,"Well, it was oysters, raw oysters, with a spicy sauce over it. I",,
CS,"supposCketchup was the foundation of the sauce. But, we thought that",,
CS,was fun.,,
CS,"In our high school days we had lots of sleigh rides, because our",,
CS,"snow seemed to stay so much longer than it does now. And, that was",,
CS,quite a popular form of entertainment in the winter to go on a sleigh,,
CS,"ride party. hire either the livery stable or some farmer, and",,
CS,"he'd put a hayrack on runners, and put straw in, and we'd all take",,
CS,"our blankets, Sometimes we would go to Pullman and have oyster",,
CS,"stew at some eating place over there. 'Course, that would take the",,
CS,"whole evening to go over there and back, and that was quite an enter",,
CS,"tainment, we thought that was a lot of fun. Or we'd go to somebody",,
CS,"who lived in the country, and sometimes each of us took along some",,
CS,"refreshments like a cake or something, and quite often they'd have",,
CS,"hot cocoa for us. But, I remember one time, when I was in high",,
CS,"school, Moscow was playing Genesee High School, and Mr.  took",,
CS,"a group of us over, we started out right after school. We drove",,
CS,"over the mountain road because, he went over that wav, it was shorter",,
CS,I think in order to get us there in time for the game. And we all,,
CS,"were supposed to take along a sandwich to eat, because we would 'just",,
CS,have to go to the game as we took our sand-,,
CS,wich in a bag and ate it on the way over.,,
CS,"And, the game was played",,
CS,"and, I don't know whether it was in a warehouse, but they didn't have",,
CS,"a gym or anything, you know, and while we were at the game a Chinook",,
CS,"wind came up, o you know what they are? A warm wind,tfnd the snow",,
CS,"all disappeared, and so we started home, and Mr. then came—",,
CS,"the highway isn't as it is now, but there ' a more level road— and",,
CS,he came that way. from four or five miles out from Moscow we all,,
CS,"had to get out and walk, because those horses couldn't pull — those",,
CS,runners wouldn't go with that many— twenty or twenty-five young people,,
CS,"in the wagon. Of course, it took most of the night, walking so far",,
CS,because I know my mother wasn't concerned about me because I was going,,
CS,"home to stay all night with one of my friends, io when I came ia walk",,
CS,"ing in about seven o'clock in the morning, she wondered why I came",,
CS,"home so early, and I told her we were just getting home from Genesee.",,
CS,But we had a bad misfortune out where the railroad tracks cross down,,
CS,"South Main, you know, fhe runner on the sled got caught in the track",,
CS,"and Mr.  was driving the sled and we were all trailing behind,",,
CS,"of course, but we were pretty weary by that time, and the sled being",,
CS,"caught in the track, it threw him out and he hit his head and it knock",,
CS,"ed him out. Well, we were all very frightened I don't think he was",,
CS,"knocked out for long, but it was fortunate that he was so near his",,
CS,"livery barn. And I don't even remember who won the game, (chuckles)",,
CS,after the experience of that.,,
LS,What kind of game was it?,,
CS,Basketball. They were playing basketball then. And we were in that,,
CS,"old, old high school, you know, that I told you about on Third Street.",,
CS,"And there was no place there, of course, so they rented a warehouse",,
CS,"down on Main Street, where one of the grain companies is now,",,
CS,"it was just a big wooden building, you know, and that's where they",,
CS,played basketball. I used to play girls basketball in that place.,,
LS,basketball very popular then?,,
CS,"Well, it was then, and then it went out and now, of course, it's back",,
CS,again. They had us play six girls to a team then. The rules were a,,
CS,"little different than boys, but we wanted to play boys rules, but we",,
CS,weren't permitted to.,,
LS,Would you play around with different school?,,
CS,"i never was on the team, I wasn't good enough, but they did play the",,
CS,"other teams around. Mrs.  was the center because she was so tall,",,
CS,she was Mabel Drury. They did play different towns around. I don't,,
CS,"think there were too many outside games played, and there weren't too",,
CS,many girls involved in the basketball program.,,
LS,Something you said?,,
LS,"Our parties— sometimes, I know when I was a senior in high school",,
LS,"we used to have parties there in the old school house, but there was",,
LS,"no recreation room or anything, we just had to play Skip-to-my-Lou,",,
LS,and so on in the halls. They were that sort of parties. But the,,
LS,"school would let us use the building. Of course, we had to always",,
LS,"ask some teacher to chap«rone us. But, the year I was a senior in",,
LS,"high school, there wasn't room for us to have a study hall, so we",,
LS,just had to kind of stick around in the halls and keep our books on,,
LS,"the window sills someplace, you know. It was great fun (chuckles)",,
LS,"but we didn't get any studying done in school time, we had to do our",,
LS,"studying at home, because we had no place to go, although we did hang",,
LS,"out down in the school superintendent's office, and how he ever stood",,
LS,"twenty— there were twenty in my class— all of us in there, I'll never",,
LS,"know, but he was a very good natured man. The new building, which is",,
LS,"the office building on Third Street now, was being built then, and he",,
LS,"was so, Mr. Randall, was so wrapped up in that new building. I don't",,
LS,think that he actually knew that we were he was over to the,,
LS,new building so much— that he actually knew that we were just making,,
LS,"use of his office like we did. So, we sort of had open campus then,",,
LS,(chuckles) the senior class.,,
LS,What were some of the social events? Do you remember?,,
CS,"Well, Fourth of July, they made a great deal of Fourth of July here",,
CS,"with a big parade, and the stores would have floats, you know, and",,
CS,"the band would play, and then, usually, they would have several dance",,
CS,halls where the bands would play during the afternoon and evening. I,,
CS,"remember one Fourth of July, they had draped all the store fronts with",,
CS,"bunting, red, white and blue bunting, and it rained just terrifically.",,
CS,"Well, the bunting would drip down on all the white dresses, you know?",,
CS,"But the dance halls were very popular that year, because people, even",,
CS,"if they weren't dancing ' crowd in, so the floor space was very",,
CS,"sparce, because there were so many people standing around the edges",,
CS,to get out of the rain. We had our special friends that we had par,,
CS,"ties in our homes. I remember, I belonged to a club— and I don't",,
CS,"know, there must have been twenty or twenty-five of us boys and girls",,
CS,"and we called it the QAE Club, and that meant quit at eleven!! We",,
CS,"had to go home at eleven, that was the rule., And, we were always say",,
CS,"ing, we wished our mothers would let us change it to the QAT Club,",,
CS,"twelve or two, then we could stay 'til twelve, you see. We",,
CS,"were grade schoolers, what would be junior high, and those parties",,
CS,"were in our homes. I remember I had a Halloween party one time, and",,
CS,"it made a house full, but, of course, everybody came^masquarade and",,
CS,"we had great fun pretending we didn't know who people were, and so on,",,
CS,"and ducking for apples, I guess you called it, and bittg ^a dough nut",,
CS,"tied to a string, and all the Halloween stunts we used to do.",,
LS,Were there many tricks played on Halloween?,,
CS,"Well, of course, there were privies in those days. And the bigger",,
CS,"boys would tip over the privies, or steal the gates — the front gate",,
CS,"off of the fence. There was always quite a bit of that, so it was",,
CS,"pretty wise to put your gate away for the evening, but the privy—",,
CS,"there wasn't much you could do about that!! (chuckles) But, our",,
CS,next door neighbor was always so concerned— my dad never seemed,,
CS,"to be too concerned, but he sort of patrolled his property the whole",,
CS,"night, I think. And, of course, the kids, knowing that, would always",,
CS,do something to him. I don't remember of being mixed up in anything,,
CS,"very much. We didn't trick or treat, we just didn't know about that",,
CS,"in Moscow then. But, we'd make tick-tacks. We'd notch a spool, and",,
CS,"my brother usually made mine, and put it on a little stick or pencil",,
CS,then wrap a string around it and go up to someone's window and pull,,
CS,"the string, and, of course, the spool would turn and make quite a",,
CS,"racket. Or, we'd ring somebody's doorbell and run, that was the ex",,
CS,"tent of our mischief, I think. But, we just didn't know about knock",,
CS,"ing on a door and saying, ""Trick or treat."" I don't know why we went.",,
CS,"If somebody didn't have a party, we'd go out with out jack-o-lanterns",,
CS,"around our own neighborhoods, of course, but we didn't expect them to",,
CS,give us anything at all.,,
CS,I think one of the nicest childhood parties I remember was the one,,
CS,"that Carol Rttrie's mother gave her, and she shipped in the ice cream",,
CS,"that came on the noon train from Spokane, as I told you, it had all",,
CS,"been molded like little animals rabbits or chickens or so on, and",,
CS,"we thought that was the most elegant party, because we had never seen",,
CS,ice cream molded like that before.,,
LS,"Was that QAE Club, was that at all formal?",,
CS,"Oh, no, no.",,
LS,Anyone could come?,,
CS,"Oh, no, we had a membership. Yes, it was a membership club. And",,
CS,"I think there were about twenty to twenty-five of us, and we never",,
CS,"went home with a boy, or anything, we'd just all go in groups, you",,
CS,"know. And, the fellow that lived the farth est, I suppose, he had",,
CS,to tackle the last part of the way by himself.,,
LS,Did you dance?,,
CS,"Well, we did. We didn't go to dances like children do now, even in",,
CS,"high school. But, if we had older brothers and sisters we'd just",,
CS,"gradually learn how to dance at home, you know. I have a terrible",,
CS,"story to tell, but I don't know whether you would want to tape it or",,
CS,not.,,
CS,"It was— I don't believe we were — well, we must have been in",,
CS,high school— but we had a Leap Year Sunday School party. The girls,,
CS,"class in the Presbyterian Sunday School and a boys' class, they were",,
CS,"about the same size, so each girl asked a boy to go to this Leap Year",,
CS,"party. Well, there was a woman teacher for the boys' class and we",,
CS,"had a man teacher, the girls class, and so we went to — this girl",,
CS,"was a niece living with her aunt that year, going to school— it was",,
CS,"the Day home, we went there to the party. That was the big home of",,
CS,"the city. So, we had sort of made a plan that after the party was",,
CS,"over and the refreshments were done, we'd all start home, and then",,
CS,"we d go back and dance. always bothered me, and I don't believe",,
CS,"our nice Sunday School teacher ever knew what we had done, because,",,
CS,"this girl, her aunt was away, and she'd asked the next door — a young",,
CS,lady and her fiancee to come in and chaparone— but our dancing was,,
CS,"very hoppity, I imagine, (chuckles) But that always bothered me, be",,
CS,"cause this Sunday School teacher, he was such a peach, and we'd have",,
CS,"Sunday School parties, and he played the piano, and that was such a",,
CS,"great thing to do in those days, to stand around the piano and sing.",,
CS,"Well, he'd play all these popular songs, sheet music, you know, and",,
CS,"we'd sing, and he was so good to play for us to sing, and then we",,
CS,treated him that way. always kind of bothered me. (chuckles),,
CS,"He was always one of my good friends, but I had a guilty feeling.",,
CS,Were there any circuses?,,
CS,"Oh, yes, that was a big day when the circus came to town. And, of",,
CS,"course, they traveled by train. And we'd have our alarm clock waken",,
CS,"us, and several friends, we'd get together and go down to watch",,
CS,"the train come in, and it usually came in around four o'clock in the",,
CS,"morning, and it'd be cold, you know, but it was",,
CS,"They would take off the elephants first, becausi",,
CS,"big poles and the tents, the canvasses, to wherever the circus was to",,
CS,"be. And we had several big open spaces, qijite close downtown in those",,
CS,"days where the circus could be. And, so, after we'd watch the circus",,
CS,"wagons, all painted, you know, beautifully painted. And, of course,",,
CS,"very interesting,",,
CS,"e they had to pull the animals inside, we could hear",,
CS,"tigers, and so on. They weren't open, because we weren't supposed to",,
CS,"see them until- Would hurry and go out to the circus grounds, because if they carried",,
CS,"water to the elephants by pails and that's the way they had to do it,",,
CS,"from hydrants, you know, nearby hydrants, why, they'd get a ticket to",,
CS,"the circus. And, Harry did that, and I know my brother used to do",,
CS,that. And he 'd get a ticket for admission to the circus..,,
CS,"But even,",,
CS,"though we didn't have too much money, my father thought we should al",,
CS,ways go to the circus. He thought that was a very important thing for,,
CS,us to do. So there was always money for us to go to the circus. And,,
CS,"we'd always go early, because, they had the animals: in one big tent",,
CS,the lions and the,,
CS,"with the cages around the sides, and you could walk around and",,
CS,look at them before you went into the main tent to take your seat.,,
CS,"And, of course, I don't remember of ever sitting in a reserved seat,",,
CS,which had a little back and was right at the center ring. These were,,
CS,"usually three ring circuses. But, you'd try to get as near that as",,
CS,"you could find a seat, you know, so you could see better. And",,
CS,"then they opened the circus with a grand entry, you know, the parade.",,
CS,"The bespangled girls riding on the elephants' heads, and the riders",,
CS,"on the horses, and the cages coming around. But, in the morning, a",,
CS,"thing which they never do any more, they'd have a parade on Main",,
CS,"street, and that was one reason that. came to town so early, and",,
CS,"of course, many children, that would be all they'd get to see",,
CS,"ithe parade, because, the country people would drive in for the parade.",,
CS,I think it was usually scheduled for ten o'clock and it never came,,
CS,along til about eleven. And that was the one day of the year that,,
CS,"didn't my father wouldn't.come home for the noon meal. So, my mother would,",,
CS,"oh, I thought this was lovely, she'd buy buns and balogna when we'd",,
CS,go to town and we'd have cookies or something and we'd go to my fath,,
CS,er's place of business and eat. But every other working day of the,,
CS,"year, he came home for his noon meal. But circus day, because of",,
CS,"the parade, he didn't expect anyone to stay home to get him a meal.",,
CS,"And, oh, that was very thrilling to have the parade go down Main",,
CS,Street.,,
LS,(very noisy) Was there only one circus?,,
CS,"Yes,one. Oh, well,^sometimes we used to have-Ringling Circus",,
CS,"first wasn't with Barnum and Bailey, you know. And we didn't get both",,
CS,"big ones, every year, but then they— they were talking about it on",,
CS,"""What's My Line?"" the other night— I've forgotten the name of the",,
CS,"smaller circus that used to come, and then we used to have dog and",,
CS,"pony shows come. Well, they just had dog and pony performOnS.And",,
CS,"they were delightful shows. They'd have a band, but oh, the ponies",,
CS,"would perform, you know, and they had white ponies and little dark",,
CS,"ponies and Shetland ponies. Horses. And, then, the little dogs, you",,
CS,"know, would go through all their a , jumping through hoops. Course,",,
CS,we loved dog and pony shows. I think its too bad children don't get,,
CS,"to see them now, because they really are a rather tranquil show for",,
CS,a child to see. They were delightful. One thing that the circuses,,
CS,used to have and it was quite the highlight for me— they would have,,
CS,"the statues. Have you ever heard of that? Well, in one end of the",,
CS,tent they'd have this big thing all covered with white canvas or mus,,
CS,"lin, or something, and then at this time of the show the big lights",,
CS,"would focus on that, and they'd raise this and here would be about",,
CS,"five performers in tights all perfectly white, their faces and all,",,
CS,"and they'd pose as the Three Graces, or something, you know, and the",,
CS,"band would play appropriate music, and then the cover would come down",,
CS,"and they'd pose for another, and to me, that was just most exquisite.",,
LS,if.,,
CS,"Well, I don't think they ever do that any more.",,
LS,Did they have acrobats?,,
CS,"Oh, yes. And, of course, they always had nets below 'em. But then",,
CS,"the crowd'd always go, ohhhhhh! you know, for fear they wouldn't",,
CS,"catch the— some  through the air, you know. I",,
CS,"Never remember of seeing anyone hurt, at all, because they always",,
CS,"used nets. r6ourse, I think some of the performers today, especially",,
CS,"European circuses, don't use careful care— they're so sure of",,
CS,"themselves, or they're so much better trained, perhaps.",,
LS,Did you ever see medicine shows?,,
CS,"Yes, I remember one, that came to town, and it's right where Short's",,
CS,"Chapel is. I don't know what the medicine was. But they had this,",,
CS,"sort of like a minstrel show, you know, two or three actors would",,
CS,"put it on, and then the salesman would go through the crowd",,
CS,"the medicine. I don't remember that the Moddy family ever bought any,",,
CS,"I can't remember that we did. And, I think that it was just mostly",,
CS,children ' went to the medicine show.,,
LS,They just put on a little skit?,,
CS,"Yes, just a tiny little stage built",,
CS,"And, then a hypnotist would come to town. And they'd always put",,
CS,"somebody to sleep in their store window,",,
CS,I think at one time they got a big block of granite from my father,,
CS,"to go on this hyptnotized person's stomach.^ And then, perhaps, at",,
CS,"a certain time they'd have a show, the hypnotist would in the Opera",,
CS,"House or the GAR Hall, or wherever it was, and wake them from the stage",,
CS,"you see. He'd have an accomplise there with him, but he'd awaken them",,
CS,"from the stage and then he'd do all of his disappearing tracks, you",,
CS,"know— soom. Then, we used to have chautauquas here at one time.",,
CS,"Well, we did in Moscow, too. And, I I was of high school age",,
CS,"then, and it lasted a week, and it was morning and afternoon. And,",,
CS,"oh, people would just flock to the chautauqua , you know. They'd put",,
CS,"uf in our city park a tent, ""There the chautauqua would be, and you",,
CS,bought your ticket for the whole week. I don't think they sold tickets,,
CS,"for each event,",,
LS,Did you go?,,
CS,"Oh, yes, oh, yes, we went. We thought we were very well educated.",,
CS,"They'd have lectures, you know, and then maybe a musical group. It",,
CS,was all brought in talent.,,
LS,What would the lectures be on?,,
CS,"Oh, I don?t even remember that.",,
LS,Were they religious?,,
CS,"Well, no, I don't believe they were religious. Margaret J^iaoke",,
CS,"gave a program the other night on revival here, and I'd forgotten all",,
CS,"about it, but it seems all the Protestant churches had gone in on",,
CS,"this. And right back of the old post office, where the old Christian",,
CS,"Church used to be, it's a parking lot now, they built a wooden taber",,
CS,"nacle, they called it, just of boards, you know. And, she said in",,
CS,"her story the other night that she went every night after school, they",,
CS,"had a childrens'— well, I think I was enough older that— I'm enough",,
CS,"older than Margaret, because I never went there to any children^ meet",,
CS,ing. I don't even remember of going at all. But Margaret said she,,
CS,"and Marguerite jlin went every night after school, and Lillian Ottness",,
CS,to this childrens' meeting. But I think that I was probably,,
CS,"enough older that I would look down on that sort of thing, you know,",,
CS,I was too big.,,
LS,Do you remember the revival?,,
CS,"Uh-huh. Well, I don4t think Presbyterians ever went in so much for",,
CS,"that sort of thing, as some denominations. I don't believe",,
CS,"we did. So, that's kind of a blank, but, I thought, maybe, when she",,
CS,"gave this paper, she was talking about where she'd lived before she",,
CS,"came to Moscow. But she said, ""No, that was right here in Mos",,
CS,"cow.""",,
LS,Do you remember when Armistice Day was?,,
CS,"Oh, yes, I was a young woman then. And the fa",,
LS,"e Armistice came first,",,
LS,"And, we all went down town, and then learned that it wasn't true.",,
LS,How did you hear about it?,,
CS,"Well, I don't know. We didn't have radios. I don't know how we",,
CS,knew.,,
LS,Just word of mouth.,,
CS,"Probably, uh-huh, because everybody went down town. But it wasn t",,
CS,many days before- probably there were rumors^hat it was to be signed.,,
CS,"And then, on the real Armistice Day, we all went down town, and I",,
CS,"think my sister—my mother died in 1918, and my sister, my older sis",,
CS,ter and I were at home with my dad— and she'd been sick and I think,,
CS,probably she had what we call 'flu now— well they did have 'flu on,,
CS,"the campus up here. And it was very cold on November 11th, and she",,
CS,was ill most of the winter from going to that. She had a relapse from,,
CS,But that's another interesting thing. The University,,
CS,"was a barracks, you see, for training soldiers for several years here.",,
CS,"And when that flu epidemic came, thgy just they asked me to do the",,
CS,"calling for the Red Cross in our neighborhood, and I went from door to",,
CS,"door and got blankets and pillows, and the people were all asked to",,
CS,mark them so they could get them back. Because they had boys in the,,
CS,"gymnasium, even in one of the livery stables here and the Elks Temple—",,
CS,sick boys. And Harry was in David's store then and they had to buy,,
CS,their own uniforms I guess just the officers had to buy their own,,
CS,"uniforms. He would go up to take the measurements, he was",,
CS,"man, and he was supposed to wear a mask. Well, it was so much trouble",,
CS,"that he'd take the mask off, and he never got it, but several he took",,
CS,measurements for.died before their uniforms even came. It was a ter-,,
CS,"rible thing. And one of the big homes here in Moscow, the M. E. Lewis",,
CS,"home, they used as a kitchen, and women went in to prepare the soup",,
CS,"and so on. They transported it— 'course, we had cars by then— around",,
CS,to these places where the sick boys were. But  many died. It was a,,
CS,terrible thing.,,
LS,Was it mainly just the army?,,
CS,"Uh-huh, army R.O.T.C., the infantry was what was here.",,
LS,And they were the main ones that got the flu?,,
CS,"Uh-huh, isn't that terrible? 'Course, we had R.O.T.C. here in World",,
CS,"War II, but then we had all brances of the services and accommodations",,
CS,were much better and those things didn't happen then. But in that,,
CS,"First World War, the women knitted, you know, and because I was young,",,
CS,"and foot free, I would carry yarn around to the women who",,
CS,knitted. They knitted socks and gloves and mufflers.,,
CS,"No,the Red Cross brought the yarn in and it was given out. And, I know",,
CS,"I'd take it to— so many of the Scandivanian women knitted, you know,",,
CS,"and I lived in that part of town, so I would carry them the directions.",,
CS,But those women were such good knitters.,,
CS,"Conversation concerning cookies was left out, and when the tape resumed the sub",,
CS,ject matter had changed.,,
CS,I went to an outside water hydrant to carry water into the house,,
CS,"to be heated in a coal range with a water front in it, to heat the water,",,
CS,"and then put in the reservoir to keep it hot, to indoor— the water",,
CS,"brought inside, and then a hotwater tank heated by the kitchen range,",,
CS,"and with sewer, and from an outside toilet to an inside toilet, and a",,
CS,"bathroom with a bathtub, before that it was— we never bathed in tubs,",,
CS,"as I remember, we had a big bathpan that was brought in. And that bathpan",,
CS,"always hung out in the buttry. Now, you don't know what a buttry",,
