speaker,words,tags,timestamp
AA,"Oh, that I did? Oh, that was in— oh, let me see, I guess that was in the",,
AA,"'20's, the early 20's, I think.",,
LS,Would you make it back to camp every night?,,
AA,"Oh, we found a you know , where there'd be some stone and timber",,
AA,you could take a stone and timber claim and do a little bit of improvement,,
AA,"and you get a patent on it from the government. Well, there was a lot of",,
AA,"them cabins there, you could always find a place to stay. They were gone",,
AA,but the cabin was there.,,
AA,"We stayed about half way between Elk River and Orofino. That man there,",,
AA,his name was Neitzer. He was clerking in a store there.later. And we,,
AA,"found his cabin, it was a heck of a nice cabin. They had built it— set",,
AA,"the posts up and down, all of them. By golly, was a nice cabin, and the inside with",,
AA,"newspaper, stuck on the wall all around it.",,
AA,"(Chuckles) Well, we must have stayed there— good roof on it— we put in",,
AA,"weeks there in that cabin, then we found another one; moved. Worked",,
AA,"from this one as far as we could, you know, go back and forth, evening",,
AA,"morning, snowshoeing. We were on snowshoes all winter.",,
SS,"So those old timber claims, stone and timber claims were sold to Potlatch?",,
SS,Potlatch bought 'em?,,
AA,"Uh-huh. Sometimes Potlatch bought 'em, and some other feller, and some of",,
AA,"'em go back to the state, never know. If they didn't keep on paying taxes,",,
AA,"you know, they finally go back to the state, or something, somebody bought",,
AA,it. They go in and sell it to the company. Homesteaders and timber claims.,,
AA,I never had sense enough to get in on that. (Chuckles),,
SS,Did you see many wild animals when you were out there? In the woods?,,
AA,"Oh, you bet. Oh, yes, they were all around there. Elk, deers, bears and",,
AA,coyotes. Once in a while you could get a glimpse of a wildcat. Not very,,
AA,"often, they were shy. They stayed away, and so were the coyotes, they didn't",,
AA,"get very close. But the deer, you know, they stop and look at you. First",,
AA,"moose cow I ever saw up there, that was out from AveryAftn Windy Peak near",,
AA,lookout and it scared the hell out of me. was the most,,
AA,ugliest thing that I ever seen. I come walking down the trail and the,,
AA,"huckleberry bushes, you know, were grown over, the trail was pretty near",,
AA,"filled up, and I come on down and I saw that damn face looking at me, and",,
AA,"I tell you, I didn't know what to do. So I stood still and finally she",,
AA,turned and boy I did move. I got out of there in a hurry. But they're,,
AA,"ugly. When they look at you, they don't look good.",,
AA,One held me there in Avery after we got up there logging. That time I,,
AA,"was looking for a campground, before we got started up in there, see where",,
AA,we could build a campground and be pretty well in the center of us when we,,
AA,"get the road in. But later after we got the road in and I had a pickup,",,
AA,driving up along the road and there was that moose in front of me. She run,,
AA,for a ways and then finally she laid down right in the middle of the road,,
AA,"and I got pretty near up to her, you know, she'd face me and her eyes was",,
AA,"just red, just like two red— they were just shiny. She'd tackle a car,",,
AA,"so I'd wait and, by God, I sat there, I think I was on the road there for",,
AA,two hours that night. I didn't get up to camp until after midnight. So,,
AA,"I told Dooley, he was my assistant, and I told him what happened that night",,
AA,I said I was down there 'til pretty near two o'clock before I got.there. He,,
AA,"says, ""She won't do that to me."" ""Ok,"" I says, ""but I had lots of respect",,
AA,"I waited, I wasn't going to tackle her."" He said,""I'd take the axe and go",,
AA,"after her."" I said, ""Maybe you would, but I wouldn't."" I waited, I took",,
AA,"my time and„it wasn t but a few days later, you know I went out there and",,
AA,"I looked at his pickup and I say, ""What happened to the hood?"" And he said,",,
AA,"""That Goddamned moose got on it."" (Laughs) he thought he could make it",,
AA,"afraid, you know, she turned around and she just caved thedjfcop right in!!",,
AA,"But I was wishing if I had a gun I'd ashot that damn thing, but I didn't",,
AA,"have anything. I had an axe alright, but I wasn't gonna tackle her with",,
AA,"the axe. The cow was worse than the bull. The bull,he'd run, you know.",,
AA,cut Did you ever go up and see in Bovill?,,
SS,"No, I've talked to him on the phone, but I haven't visited him. I plan to",,
SS,see him.,,
AA,"He's about the only one there in Bovill now, isn't he? Him and Old Ernie",,
AA,"Smith. Oh, yes, you've got a couple of them Carlins there.",,
SS,Right.,,
AA,The they're all gone I guess. I don't know.,,
AA,But the oldtimers that I knew theyA practically all out of there.,,
LS,"When you were out, you know, in the woods and around camp and saw a deer",,
LS,"or an elk, would you try to shoot it to have the meat for camp?",,
AA,"No, no. huh-uh. I shot one deer one time to put it in in the mulligan,",,
AA,"the cook did. Nobody ever mentioned it. The cookhouse bunch, me included,",,
AA,"we had a few steaks out of it, but the rest of it they threw it in that",,
AA,"stew pot. (Chuckles) No,never shot any meat for the camp, no. We did in",,
AA,Minnesota. I boarded at the sectionhouse there one time and we had the,,
AA,meat three times a day all winter. The section boss there he'd take a,,
AA,couple of his men and send 'em out there in the swamp and they come home,,
AA,"with two-three deers. Had a little bit of sowbelly, you know, a little",,
AA,"bacon, not much, mostly deer meat.",,
SS,Was there mu£t\ bear hanging around the camps.,,
AA,It was up at Avery there. We had a dump there where we put the garbage over,,
AA,"the sidehill there, just throwed out the garbage not too far from the camp.",,
AA,You could count twenty of them or more or less. They were there all day,,
AA,digging. They kept it pretty well cleaned up. But finally they got too,,
AA,"close, so they— started to come into camp A they had to move that. The",,
AA,"garbage wagon went out, you know, go about a mile away and dump it. And",,
AA,"when that garbage truck come, you know, by go they was sitting all around",,
AA,"there waiting for him, and just as soon as he had unloaded they took over.",,
AA,"They didn't try to fight us any, they stay at a safe distance. My wife was",,
AA,with me there one summer and we had a cabin there and bear come up,,
AA,"there, by God, -- the other door open— the bear come",,
AA,there and she had a shotgun she popped 'em right in the belly with that,,
AA,"little birdshot, but he didn't tear the cabin down, he took off. I think",,
AA,"they, I believe they shot that bear there in the fall and when they skinned",,
AA,"him— them little birdshot, you know, they just go through the skin, that",,
AA,"was all. They fell out when they was skinnin'him, them little pebbles were",,
AA,falling all over the floor. (Chuckles) They had that shotgun of mine up,,
AA,there at the kitchen and the flunkies were out there popping at 4fa -Ik-a,,
AA,all the time. (Chuckles) We had the lady flunkies there at one time and,,
AA,I come walking down the camp and I saw two bear cubs heading for the camp,,
AA,"and I watched 'em and they got under the diningcar, you know, so I went in",,
AA,"the kitchen and I told 'em, the cook and the flunkies—No, I got in there",,
AA,"and they all of them was right in the middle of the floor,Awhen they scrub",,
AA,"bed the floor, you know, they had a hole in there so they could let the",,
AA,"water run through, and they were all—— the whole bunch of them laying down",,
AA,"there looking, and I say, ""What the hell you got?"" I was going to tell 'em",,
AA,about those bear cubs— they were feeding them!! They had 'em underneath—,,
AA,them little bear cubs knew where they were going. Them flunkies had been,,
AA,"feeding them, you know, there for probably for weeks!! (Chuckles) And they",,
AA,"were looking at 'em, you know. You could see— the buildings on skids,",,
AA,"daylight under them, so they could see them, and they were giving them cookies",,
AA,"and stuff Myou know, that's why they come there, they knew it. The only",,
AA,"time they got mad at 'em was when they dump the garbage barrels, you know,",,
AA,"had there. Some morning when they come up, you know, they were all",,
AA,"scattered all over the kitchen, the platform there back of the kitchen, so",,
AA,then we had to move and get the garbage way out. And we had to tie them,,
AA,barrels to the wall so they couldn't tip 'em. They got up there in the,,
AA,night after everything quiet and then the bear come around and they'd tip,,
AA,them barrels over and pick what they wanted and the rest was left.,,
LS,Did they have many women flunkies in the beginning when you were in the,,
LS,woods?,,
AA,"Not in the beginning. No. But after the World War I, you see, then they",,
AA,during that time they started it in the camps. See all the young fellers,,
AA,"were gone, and the old fellers- they wouldn't— they were too slow to be",,
AA,"around in the kitchen, only cooking. But the flunkies, you know, they had",,
AA,"to be light on their foot and could travel. And the young fellow, you",,
AA,"know, there were all out in the war and in the army, so they to get...",,
LS,Were some cooks in camps and some foremen didn't want to have women flunkies?,,
AA,"Oh, yes, yes. There was a lot of thf, too.",,
LS,"But why didnlr, they want them?",,
AA,"I don't know. Well, Iwas with afeller, he's alive now, too. He lives",,
AA,in Lewiston. We worked together in the CC camp up there on the St. Joe.,,
AA,"And one night, you know, he lived in Bovill, we went home one time, both",,
AA,"of us, and they had trouble in the camp while we were gone, so Itold him,",,
AA,"Isays, ""After this, we never go together, you and I1,' he was my assistant,",,
AA,"so Isaid, ""now you take, if you want to go to Maries, all right, you go",,
AA,"down and I'll stay. Next Sunday, if Iwant to go,then £ou stay.""",,
AA,"was lit up and he was singing, he said, ""if there was no womens,",,
AA,"we'd ahad no war."" And maybe that was the idea in the camp, too, where",,
AA,"there is womensconnected there is more or less trouble; jealousy, or some",,
AA,thing. And in the kitchen crew they show favorslndgfess that made,,
AA,"more difficulties for the cook, Ithink. That's why they 'em",,
AA,"you know, in the camp. Otherwise, Icouldn't see anything wrong. For my",,
AA,"part it was all right. But Icould see the cook's idea, alright. You know,",,
AA,they could make a little jealousy in the camp.,,
SS,I've heard that alot of the cooks were touchy. They were asort of touchy,,
SS,"bunch about their cooking, and they'd get pretty sensitive.",,
AA,"Oh, yes, yes, you bet.",,
LS,"You mean, if someone complained they'd get mad, or something?",,
SS,"Yeah,I don't know— Yeah, they were just a pretty touchy bunch.",,
AA,"Well, you know, you take— even at home— you can start tacjh-f from home.",,
AA,You know you eat at home all the time and you get out and buy a meal and it,,
AA,"isn t any better, but, boy, you think that tasted good, and boy, how you",,
AA,eat. Ain't that right? You eat your own cooking and you get tired of it.,,
AA,Don't you feel that way?,,
LS,I get tired of cooking. (Chuckles),,
AA,"Yes, yes, and you're tired of your own cooking, in other uords, don't you?",,
AA,"Well, that's the same in the camp, you know. You sit with the same cook,",,
AA,"you know, he'll be there and he cook every day for the whole year, you know",,
AA,"he can't change it very much, where you have a hundred and fifty up to two",,
AA,"hundred people to cook for. No, you can't change your menu too much and",,
AA,it got to be the same thing over and over and over again. Every morning,,
AA,you have bacon and eggs and hotcake and the next morning you have ham and,,
AA,"eggs and hotcake, next day, you know, you go back to the ham and eggs again",,
AA,"or bacon and eggs and sometime you have sausage and it's all alike, isn't",,
AA,"it? And a bowl of mush. (Chuckles) And for dinner, you know, well, that's",,
AA,"the same, a big roast or a big mulligan or stew or something. Supper tha",,
AA,"same thing. Steak. But, you know, you can't change it. It's so big, you",,
AA,"know, you gotta have so much of it, so you can't change it, you gotta stay",,
AA,"with— and they get tired of it. And the crew they say, that old mulligan",,
AA,"mixer, it's no good, and it never was any good. And it is good.",,
AA,End Side 1,,
AA,"And the cook, you know, if they want to take off, or take a vacation and",,
AA,"stay away a few days, you know, somebody come in — and well his ideas were",,
AA,a little bit different and it was a little different. Probably wasn't half,,
AA,"as good as what they had before and not enough of it, and so forth, and they",,
AA,"say, ""Now, boy, there's a good cook! That is a good one! That tasted good.",,
AA,"That was fine."" Few days, you know, and then by golly, then it was different.",,
AA,"But for a few days, you know everything tasted good, it was a little dif",,
AA,"ferent, see. They have a little different way of seasoning or something.",,
AA,That was quite a job. Albert was good. I don't think I ever heard anybody,,
AA,kick on him.,,
SS,You said the men talked a lot about the chuck in the camps.,,
AA,"Oh, you bet. Well, that was the main thing was the chuck What they",,
AA,"had in the camp. That what held 'em. If you were feeding good, you know,",,
AA,"by God, the crew stayed. Yeah, if you didn't have a good cookhouse boy,",,
AA,then you were up — you were in a heck of a place.,,
AA,"You know, that's quite a job. There like we had over three hundred",,
AA,or three hundred and fifty men and Albert stayed there all the way through.,,
AA,"That whole winter he had a helper, he had an assistant, second cook, and a",,
AA,baker.,,
LS,Is that all? Just one assistant cook?,,
AA,"Well, they were two of them. The stove was only so big you know. I think",,
AA,there were three ovens in that one. I guess— Well the lange stoves therefired,,
AA,"with wood. Oh, I don t know, there must have been eight-nine feet long,",,
AA,"I think, maybeAten foot, I don't know. There were three ovens, two fire",,
AA,"places and the top, you know, was big enough— 'course we had hotcake grid",,
AA,"dles, you know, that they could put on. and they had room for all of that",,
AA,you know when they made hotcakes for probably around two hundred and fifty,,
AA,"was in for breakfast, the rest of 'em was probably sleeping, working nights",,
AA,"you know, and they were probably in bed. Train crews out, so forth, either",,
AA,"come in later or had had it in the night. That bakeV you know, he served",,
AA,"dinner at midnight. He worked nights, he didn't work in the daytime, there",,
AA,"were not room enough, the stove wasn't big enough. Kitchen wasn't big",,
AA,"enough, you know, so the baking was always done at night, after they got",,
AA,cleaned up in the evening and the table set then he went to work. And he,,
AA,"was there all night. He made- oh, he must have made around anywhere from",,
AA,"seventy to ninety loaves of bread every day, every night. Three-four doz",,
AA,"en pie and that many cakes, and I don't know how much doughnut, they make",,
AA,"hundreds of them and cookies and so forth, you know. He worked all night",,
AA,"and at the same time, you know, he fed the night crew that was on— there",,
AA,"was jotae4sta twenty or more that he had to feed in the middle of the night,",,
AA,when they come in for dinner. That was quite a chore. And all night and,,
AA,"all day, you know, everybody come in for lunch, -fhey had a cup of coffee and",,
AA,"a donut, piece of pie. One go and another one come in, sometime three or",,
AA,"four of them. The cook never say anything, they go and help themself. They",,
AA,know where it was: In between meals. I did. I think I had more meals be,,
AA,tween meals than I did at the table. (Chuckles) I go in the kitchen and,,
AA,have something and then I probably wouldn't see them there until long after,,
AA,"supper was over, and I come in and I go get a little something, whatever I",,
AA,can pick up.,,
LS,"Were they starting to use some machinery by that time? You know, chainsaws?",,
AA,"No, they didn't come for— after World War II, in the '40's. I saw one, we",,
AA,"went to Winchester one time up there A Craigmont, that's",,
AA,"up there somewhere on top of the, well you can Lewiston,, where",,
AA,"they were logging, or you can go up through Cul de Sac and go on up the hill",,
AA,"there and get up to Craigmont, but I think when we went op there we went in",,
AA,"around through Lewiston, what do you call that lake up there on top? When",,
AA,you go to Lewiston and then on up—,,
LS,Waha.,,
AA,"Waha Lake,A something like that. Well, they were logging in there, and we",,
AA,went out there and they had a power saw. I forget whether that was — but I,,
AA,"think that was a gas one they had. But they had a five foot blade, I think",,
AA,"one on each end, Cutting titiber with. They just knocked 'em down; felled 'em",,
AA,you see. And they had cats and they pulled 'em in the tree lengths in to,,
AA,"the landing and barked 'em off. But then shortly after that, you know,",,
AA,"they come with those little fellows, where you could stay on the landing",,
AA,"and bark 'em off, you know, that's where the saving come in, and just one",,
AA,man then. That when they start to come in fast. But that was later in the,,
AA,'40's.,,
SS,"Were they gas powered, the first ones you saw?",,
AA,"Yah. We had one, the first one was electric. We had a little generator on",,
AA,the little cat there and pulled it along. That was pretty good too. But,,
AA,"not so handy as the later one. Now they're prefect, you know. We built a",,
AA,"bridge there one time, that was the last work I done there— we built a",,
AA,"bridge across the North Fork, three hundred and fifty feet across the river,",,
AA,"drove piling and that was thirty-five feet up in the air, and we cut all",,
AA,"the timber in the woods, leveled 'em off with the power saw. Had the chalk",,
AA,"line, you know how a chalk line is, how they work to get the straight line",,
AA,to cut the top off it—,,
SS,I don't think I do.,,
AA,"Well, we made it anyway. We used a powersaw, level 'em off. And you know,",,
AA,"by God, it was just as straight as if you'd a cut it with a bandsaw in the",,
AA,middle. and then they chopped it down and set the cap on the pil,,
AA,ing. That's quite an undertaking to bend that over— in the middle of it,,
AA,"there was a big bench of rock, bedrock, under the river, under the gravel,",,
AA,used the dozer and shoved the river over this way and banked her up so that,,
AA,it run there and then we dozed on the other side and drove pilings- we,,
AA,drilled that eleven foot holes and loosen up that rock and then drove piling,,
AA,"in it. And they were using it up 'til—now I guess it's under water, if",,
AA,"they didn't tear it down. That was up near Bole's cabin, way up. Three",,
AA,"hundred feet across there,we had, oh, I don't know how many pilings. We",,
AA,drove a lot of them. But it stayed during high water for a truck road.,,
AA,"That road come up to— we crossed the river twice, crossed over, and then",,
AA,"about ten miles farther up we crossed back again, and hit Cedar Creek—",,
AA,that went up there to Bossereau's then way up there in there in the moun,,
AA,tain toward Avery.,,
SS,Do you remember when they took the horses out the last time?,,
AA,"I see they're coming back now. I see in the paper today, oh, not today, yesterday,",,
AA,"Awhere there's an outfit there in Montana, they took one job there,",,
AA,"a million and a half, and they're going to log it with horses. Now that",,
AA,"was in '39 there, now wait a minute— yeah, '39, I think it was, we were",,
AA,"out on Mason Meadow when we got the first cats. Well, we had a few be",,
AA,"fore then, but after that they let loose of the horses and so when we moved -fe",,
AA,"35 we had no horses, and I was wishing we had the old horses back. The",,
AA,"old cat was sitting tn the sidehill, stuck, mired down, couldn't get up the",,
AA,"hill, and if I'd a had horses there I could a got oodles of sawlogs.",,
AA,.'Here's a ing I carried for over fifty years.,,
SS,What's it say?,,
AA,"That's a Mason You're a Catholic, ain't you? No? I thought",,
AA,you said you were a — down to the,,
SS,"Oh, I just went over —",,
AA,"Oh, just went over. That was when Joe and his wife had their anniversary.",,
AA,Joe Holland. That was in the Hall there. Few years ago. Not so many,,
AA,is it?,,
AA,No.,,
AA,"How long ago is that? Five years, four years? Five years isn't it?",,
AA,I don't know.,,
AA,I went over there. I met quite a few. That's where I saw again Jack,,
AA,Downey. He was gray headed. Is he white now?,,
SS,Uh-huh.,,
AA,"He's pretty white. I think I'm older than he is, I'm sure I am, by several",,
AA,"years. Oh, yes, I went down to esncii's store yesterday and there was a",,
AA,"lady sitting in a pickup there, and I parked next to her and when I opened",,
AA,"the door, she says, ""How old are you?"" (Laughs) I said, I'm pretty old.""",,
AA,"She said, ""Are you seventy-one?"" And I said, ""Yes, I'm seventy-one, I've",,
AA,"seen that."" (Chuckles) I sat there and I talked to her quite a while.",,
AA,"She said she had to get out, she says she don't like the town, ""I got to",,
AA,"get out in the woods."" And I said, ""Well, that's where I was raised,"" and",,
AA,"I said, ""I've put in lots and lots of years in the woods."" She said, ""You",,
AA,"feel good yet?"" And I said, ""Yeah, I feel fine, I feel fine."" ""But,"" I",,
AA,"said, ""my legs are wore out, that's all."" Oh, I don't know, she said she",,
AA,"gotta get out in the woods and get away from town, ""I don't like it.""",,
AA,"(Oh, looka there, that's high, ain't? — sound of plane) (See it, that",,
AA,"plane? Does he go through that cloud? No, he's under it. Well, I'll be",,
AA,"golldarned, he's under that cloud. I can still see it. I can see it,",,
AA,"but I can't hear it now. That's pretty good for an old buck, like me?",,
AA,"That's many miles away ain't it? Ya, I sit there once in a while and I",,
AA,"test myself that way and see if I can see them, then I lose the sound of",,
AA,"'em. I can see 'em a little bit farther, if it's clear, if he don't get",,
AA,"into a cloud. The sound'11 die out, you know, but I still can see them.",,
AA,"No glasses. Is there somethingthat, you know, they tell me now, my hair don't turn",,
AA,"gray very fast, you know, there probably solid concrete under, nothing",,
AA,under it. Is that right? (Chuckles) That the hair keep growin'— nothing,,
AA,under it. (Chuckles),,
LS,I never heard that.,,
AA,Might be something to it.,,
SS,"That's true though, your hair is- Well— Lot of it's—",,
AA,"I had it cut yesterday. That here is gray, white.",,
SS,"Laura's getting white hairs already, too. A few.",,
AA,"Oh, well, some people get gray hair when— before thirty, in thirtie s..",,
AA,"I guess the change of color, it don't hurt nothing. It don't hurt any",,
AA,"thing, does it? I know I can't feel anything bad over it. A lot of people",,
AA,"ask me, ""How come your hair stay so good?"" ""Well,"" I said, ""that's a",,
AA,"reason for everything."" I say, ""There's nothing under it,just growing there",,
SS,I was wondering about the strike of '36. You talked just a little bit about,,
SS,it before. I was wondering about what caused it and what you remember from,,
SS,it.,,
AA,I don't know what caused it. I could not tell you. They were striking for,,
AA,"higher wages. And there was nobody in the camp that worked, really, for a",,
AA,"hourly wage only the cookhouse, the section crews and the train crews; they",,
AA,were the only ones that worked hourly wages. The others had contract or,,
AA,"gyppo and they made twice what the wages was, and they didn't strike. They",,
AA,"was satisfied where they were. So what put it on, I don't know.",,
LS,Well who struck then?,,
AA,"Well, the lumberjacks did, they walked out, see on us, or started to. But",,
AA,"as I said, they was striking over wages. The ones that worked for day wages",,
AA,"they weoe. satisfied, they wasn't even in on it. Well, they were in the camp.",,
AA,"They had, I think, just agitators, you know, worked the crew up. Agitators,",,
AA,"you know, where they'd go around from one camp to the other and preach, you",,
AA,"know, how they didn't get enough when they was too damn old, and all of this",,
AA,"and that. I never knew what it was, and as it turned out to be there, we",,
AA,didn't have no strike. We give 'em that week of lay off over the Fourth of,,
AA,"Tuly, and when they come back, they kept a working and along towards the",,
AA,"fall, you know, the camp was full again. We never stopped. They did on",,
AA,"the Clearwater side, they were shut down for a while, but on the Potlatch",,
AA,end there we kept agoing.,,
SS,You shut down a week at the Fourth of July just to stop a strike?,,
AA,"No, the Fourth of July was coming, and I talked to Nogle there, he was the",,
AA,"superintendent, and I said, ""Give 'em ten days, or something like that—",,
AA,"Fourtn of July vacation,"" and I said, ""they'll go out anyway, and so, let's",,
AA,"give it to 'em, now."" And, we did. I told 'em, the crew there, I called",,
AA,"up the camp up above there, run that, I said, ""Tell",,
