speaker,words,tags,timestamp
AA,"'em the same thing."" And I told 'em here that if they want to go out, OK,",,
AA,"we'll pay them all off, pay them all off, and I said, ""Anybody wants to",,
AA,"come back after the Fourth of July, we'll have the train crew in Bovill",,
AA,"two days after the Fourth was over"", I said, ""we'll have plenty flatcar,""",,
AA,"I said, ""bring 'em all backagain, take 'em home."" -vgive 'em a ride out,",,
AA,"too. Went up there about noon, if you have a train ready, let us know when",,
AA,"you have the checks ready for them, let us know, and I'll send the train crew",,
AA,up. Keep feeding 'em. Nothing ever happened. Breakfast the next morning,,
AA,"and dinner the same as usual and put 'em all on the train, And, by God, I",,
AA,"got 'em all back but seven. The whole crew come back. Seven men, all",,
AA,that stayed out. I got the whole crew back in there after the ten days,,
AA,"was over. I don't know, if you give a 'jack ten dollars and he's hard to",,
AA,"talk to. I said, ""Let'em stay in town and blow it all in,"" I said, ""by",,
AA,"God, we can all talk to 'em.""",,
AA,"I said, ""They'll .""... be back. They'll be",,
AA,"back."" They did, too. No, we had no trouble, I got a little Pamphlet every",,
AA,"day, however it come in there, I don't know, that the strikers— the Wobblies",,
AA,were putting out. I think— I don't know if they come from Spokane or—,,
AA,"I don't know where it come from, where they printed it. But I got one",,
AA,every day. They always see to it that I got one. And they said Axel,,
AA,"and the finks, (chuckles) They called 'em all finks. Towards the end",,
AA,"there, you know, we send out thirty-two carloads every day from them two",,
AA,"camps. And they said, ""It won't be long now, he's got nothing; only college",,
AA,"kids, and they'll be gone, they'll be out of there."" And, by God, we never",,
AA,"slowed up. There was a few, we had a lot of college kids there. Then there",,
AA,was had a crew all the,,
AA,Did some of the other camps around have more trouble?,,
AA,"Well, on the Clearwater side they did have.",,
AA,Not on the Potlatch?,,
AA,"We only had the two camps, and they were both together, they were only two",,
AA,"miles apart. They were on the rail there, and them two camps there they run,",,
AA,they kept agoing.,,
SS,"The pamphlets said, ""Axel""— right in the pamphlets? That you got, they",,
SS,talked about you?,,
AA,"Yes. ""Axel and his Finks"" (Chuckles) No, they were a little—that evening",,
AA,"they talked. Nogle come in, he was the superintendent, and the sheriff come",,
AA,"in, and that's why they thought I had— I knew that they were coming; and",,
AA,"I didn't, I didn't know that the sheriff was coming, and I don't think Nogle",,
AA,"did either. But he must have had a Sheriff Summerfield and Moody, and",,
AA,what's the other—?,,
SS,Jordan?,,
AA,Jordan. Moody and Jordan and Summerfield. They were all there and they,,
AA,"popped up there— and I didn't know— but lots of them blamed me, they",,
AA,"thought that I had called 'em in, and I had not asked anybody. I was in",,
AA,nocent on that one. But they started to have a fight there and then— tare,,
AA,"was them three, there were three loaded gravel cars there, gondolas, they",,
AA,"were standing on top of that. So Summerfield holler out and he says, ""No",,
AA,and,,
AA,"fighting,"" he says, ""be quiet  disperse, "" he says, ""or I'll throw—,""",,
AA,some of,,
AA,"he had them smoke bombs with them, and he said, ""I'll throw this into you.""",,
AA,"By God, they quieted down. All over. But they were going to set out—",,
AA,"they wanted my crew to go with them other ones, but they didn't. So both",,
AA,"crews come back after all the talking there, they done.",,
SS,Did the sheriffs make arrests?,,
AA,No. No. 'Course they had their pickets on every road leading in. And,,
AA,a tent,,
AA,"Moody he come out, for one,he stayed there in ..about— the road",,
AA,"leading to Southwick, him and another feller. I guess must have been there",,
AA,'til late in the fall; two months or more that he sit up there. We carried,,
AA,"chuck up to him every day, from the camp. And then we had another one on",,
AA,the railhead down to Round Meadow. That was the only two roads leading in,,
AA,"there, you see on the railroad. But they never bothered us any.",,
SS,Who? The pickets or the police?,,
AA,No. Pickets. They never bothered anys They never come in. I used to,,
AA,"go through them, talk to them, every so often. I knew all of them. On the",,
AA,Clearwater they had a little trouble. I guess they had a few fights there.,,
AA,"But their camps were shut down there, I guess, for a couple of months or",,
AA,more. But there was nothing settled. The next winter— in the fall there,,
AA,"I think they shut down. They shut down in November, the next fall. There",,
AA,was nothing settled,,
SS,Did you say that there were guys that quit that wanted to come back and you,,
SS,"wouldn't let 'em? I wasn't thinking of any names, but I—?",,
AA,No.,,
SS,I was thinking of guys that changed their minds about that strike.,,
AA,"No, I think that most of 'em was back. Yeah, I think they all come back,",,
AA,"most of them. 'Course, it just blew over, there was no settlement in that",,
AA,"strike at all. They just had to walk out, and after they come back in",,
AA,they were all satisfied. Same thing. We didn't change anything in the,,
AA,"camp, that I know of.",,
LS,Do you know anything about the bullpens in that first strike?,,
AA,"No, I was in France.",,
LS,"So, that was after—?",,
AA,"I was gone then. I was here, I was working when they struck, but I heard",,
AA,"about it. But, no, I didn't know anything, 'cause I was out of the country.",,
AA,"I had— my good chum there in France, and the Wobblies killed him. He was",,
AA,"from Centralia, Washington. Dale Hubbard. He got in a fight with somebody",,
AA,he 'em,,
AA,and took after — just what I read in the paper. But there was kind,,
AA,"of a hw-oc or something. I went through Centralia a few times, but I",,
AA,"couldn't tell you anything— but anyway, he took after one there and I'll",,
AA,"be damned if they got doos? there in the woods, in the brush, you know, and",,
AA,tee shot him.,,
SS,"The last time you heard pretty much of the Wobblies, that '36 strike?",,
AA,"Oh we had a little strike up there in '48, I think it was. We were shut",,
AA,"down for, oh, for a couple of months. But that ended about the same way.",,
AA,"That's the last, I guess I ever heard of the Wobblies. The CIO come in and",,
AA,the AFL and took over. I guess that was the last real Wobbly talk we,,
AA,"ever heard of. Some way— they wanted to have one big union,/;they said—",,
AA,I guess that ended it. It didn t pan out. Nobody knows what they really,,
AA,was after. But they done one good thing that we all got to give 'em credit,,
AA,"for, they took out the blankets, out of there. The companies had to buy",,
AA,the blankets and clean up the cars and make more room; make better living,,
AA,in the camp. That much they did. That was during the War I. I know when,,
AA,"I left fox France, and left the camp there, I think we had sixteen bunks in",,
AA,"each car. When I come back they were down to eight, half of that. And",,
AA,the company was furnishing all the beddings; clean sheets and pillow slips.,,
AA,"Oh, that madequite a difference in the camp, you bet you. It was needed,",,
AA,it was necessary. I don't think the company felt bad over it either. And,,
AA,they got the eight hour day. That come in at that time. We was on daylight,,
AA,"to dark, you know before, when I left, and when I come back there were",,
AA,"the, eight hours. I just got started when I— and crew come in eight",,
AA,"hours up. Four o'clock, and hell, you know, the sun was up too high for me —",,
AA,"When I left you know,Ahad a couple good hours work after that. So the",,
AA,"Wobblies done a lot of good. When I come back, they had a union there,",,
AA,they called it the Four L's (LLLL). That wore out. They tried anything,,
AA,"to hold a crew. And it didn't work out, that died out, and then after",,
AA,"that they come with the— I can't tell you, I don't know what the hell they",,
AA,called that union. But it didn't seem to work out 'til they the got the,,
AA,"AFL in. Then it kind of settled down again , quite a bit, that was pret",,
AA,"ty good. I never belonged to a union in my life, in any of 'em. If you",,
AA,"were in the supervisory end you couldn't, they wouldn't let you.",,
LS,"Would the men complain to you about, you know, something that was bothering",,
LS,in the camp?,,
AA,"Yes, yes.",,
LS,What did they usually complain about?,,
AA,"If I heard anything I tried to correct it. Oh, I don't know what they'd —",,
AA,had nothing in particular—,,
LS,"If a guy couldn't work with someone else, would you transfer him?",,
AA,"Oh, yes, we try to change him, change him around. Yes there was one—",,
AA,"one morning he come in, that was Charlie. You talked about",,
AA,"him the other day, didn't you? He come in one morning and he says, ""I'm",,
AA,"bunching it. ""I'm going down."" I said, ""What's wrong9 Charlie?"" ""Oh,""",,
AA,"he said, ""nothing. I just quitting."" And I said, ""I don't think so."" I",,
AA,"said, ""Charlie, you want a different swamper, don't you?"" I said, ""You",,
AA,"want a different man to work with you. That it?"" ""No, no, I'm quitting.",,
AA,"""Well,"" I said— there was a fellow working with him, his name was Bill",,
AA,"Zimmerman. They were, oh, I don't know if they went to school togetherbut",,
AA,one was raised out on Cedar Creek and the other one- Charlie,,
AA,"was raised at Park, you know, only a few miles apart, where their folks",,
AA,"lived. So, I said, ""I'll take Bill away from you,"" I said, ""I'll send",,
AA,"so-and-so,go on out."" And he took the team and he went back to work.",,
AA,No more said about it. They got so much a thousand. They wasn't working,,
AA,"by the hourly rate, theyAworking by so much a thousand. The more logs they",,
AA,"get in the more money they made. And morethey could get, the cheaper you",,
AA,got 'em. That didn't cut too much difference on the price. If they give,,
AA,"you lots of logs, you know, you can pay them more, and you still got cheap",,
AA,"logs. The idea was, the more logs you get in the camp, it cut down on over",,
AA,"head, that'd cut down— you know everything was based on the logs you put",,
AA,"in. The cost of the log- that was the base of all the logging, in the camps,",,
AA,"and everywheres, so-",,
AA,"More logs you could get, you know, they could spread out and they could cut",,
AA,"produce down, all over. I didn't any logs, I was just marking down there, and",,
AA,"you know, the more logs they get, you know, they cut down on paying my sal",,
AA,"ary— whatever I got. Cut down on everybody, now like the blacksmith, they",,
AA,didn't produce anything. Cookhouse crew didn't produce anything. They,,
AA,"didn't pull in any logs, so the base was to get more logs, the cheaper logs",,
AA,"we had. The logs didn't come in, you know, everything is run up. The",,
AA,"last log is the one to get, if they were gyppoing, you know, if they tried",,
AA,"to get as many logs as they possibly could, you know, then we got cheap logs.",,
AA,"And if you were going the other way and tried to just put the day in, you",,
AA,didn't get any sawlogs. That what the foreman's job is to try to see that,,
AA,he get all the sawlogs that he possibly can get out of the woods.,,
LS,Were your camps largely gyppo? Or would they be—?,,
AA,"Well towards the - the later years they, mostly gyppos. I don't know for",,
AA,"some reason, you know, when it started,just after the World War I, we used",,
AA,to let a contract andApay them day wages as long as they were working and,,
AA,"we set a price on 'em, on the logs to them, but we didn't— at the end- at",,
AA,"the end of the job when they were finished, theft you called it a bonus, see.",,
AA,"Everybody was paid just the same as if they worked by the day, their daily",,
AA,"wages, and then at the end of the job, when they were done, then they divide",,
AA,up the bonus according to days they work— days that they put in on the,,
AA,"whole job. A man that quit in the meantime, he didn't get none of that,",,
AA,"he didn't get— that was the bonus, that was left for the other fellows to",,
AA,"divide up. So we had one job there in particular, that I remember",,
AA,"I think that lasted eighteen months, and I hdiv, there was something around",,
AA,thirty thousand dollars worth of bonus there when they ended up. In them,,
AA,"days, you know, that was a hell of a lot of money, that was in the 20's,",,
AA,and that was a lot of money.,,
LS,How big a crew would work together?,,
AA,"I think they had a highline donkey— there were twenty-one, I think. I",,
AA,"think there were three gangs of sawyers, that's six, and, let's see, there",,
AA,"was a fireman, engineer, was two, that would be eight- a toploader, be nine,—",,
AA,How in the hell did that figure out? See the engineer and the fireman and,,
AA,"the toploader, two hookers, they were on the landing and then they had four",,
AA,"to six saw gangs in the woods, and punk, and the hook tenders and",,
AA,"two, that'd be four more— there were around twanty men, anyway in",,
AA,that crew.,,
SS,How many in a saw gang?,,
AA,Two. One on each end of the crosscut saw.,,
SS,"Was this Pelton's operation, you're thinking of.",,
AA,"Yeah, that was one of 'em.",,
LS,What did the hook tender do?,,
AA,"Well, he's the one that— he's the bossman on the job, you see, on that par-",,
AA,"ticular job, He see that the rigging is set up and kept running. It's two",,
AA,"of them, they're the one that run the machine and the hooktender, that's the",,
AA,"two head men on the crew, you see. Yeah, they  they worked. Adrian",,
AA,"Pelton, he run the donkey and Homer was hooktender, the one that's in Pot",,
AA,"latch. And the brother Luther, he was the best— no he was the hoister.",,
AA,"I believe theold man was the punk, he blew the whistle out in the",,
AA,"woods Pelton, the old man. And there was one more, by God, there",,
AA,"was still another Pelton in there. And Adrian was married, and she run",,
AA,the cookhouse. They done their own cooking. They really did gyppo. They,,
AA,"called that place there the gyppoville, or- Peltonville. Peltonville, what",,
AA,"they called it. Mostly— well the whole family there, the whole Pelton",,
AA,"family, they stayed there in tents and stayed pretty close to the job. There",,
AA,"was a few more in there but— in the camp, at the cookhouse. Now that was",,
AA,"a big donkey, they went out a mile, they had a mile of cable- tightline out",,
AA,to get the sawlogs. That was the last donkey they stripped and sent to the,,
AA,scrap pile. They called that a Potlatch special— I guess that's the only,,
AA,one they ever made. I think that had five drums on it.,,
SS,"you tell us a story of the time that you got hurt, in the snowplow?",,
AA,"I think I did, didn't I? Well, they ain't much to tell about it. We went",,
AA,"over the side of the bridge. I went down in the river, and two more in it",,
AA,"with me. And I still have it, I can't raise that arm, only that far, that's",,
AA,it. That's as far as I can get that. And that was hanging there for two,,
AA,"years, pretty near. Oh, I went to a lot of doctors, and all of them told",,
AA,"me the same story, if you ever want to get any good out of it, you got to",,
AA,"do it yourself, I can't help you. I went in there to see a bone specialist,",,
AA,"I forget his name now, he' in the Medical Building. And I drove from Bovill",,
AA,"down, and I got in pretty late, I guess I was late, it was in the afternoon.",,
AA,"But I had no appointment with him, see I just to see him, and the",,
AA,"girl asked me, said. ""Have you got an appointment?"" And I said, ""No, I got",,
AA,"no appointment."" Well she said, ""You have to have an appoint ment."" And I",,
AA,"said is, ""Is Dr. so-and-so in?"" ""Oh, yes, yes, he's here."" And I said, ""I",,
AA,"come a hundred and fifty miles to see him."" And, I said, ""I'd like to see",,
AA,"him."" ""Well, but it's after hours."" I said, ""That's too bad, I come all",,
AA,"the way ,"" and I said, ""won't you even let me see him?"" She say, ""No, it's",,
AA,"after hours. The office is closed."" And I said, ""Well, is the doctor in",,
AA,"there now?"" And she said, ""Yes."" I said, ""This is the only way out, he",,
AA,"come out this way?"" She said, ""Yes."" ""Well,""I said, ""You tell him.""",,
AA,"""Anyway,"" I said, ""I want to see him. I'm gonna stay right here.""(Chuckles.)",,
AA,She laughed a little bit she walked in there and the two of them,,
AA,"come out, and they were both laughing. Well, esaid, Here I amM I come",,
AA,"a long ways to see you. I don't know if you can do me any good or not,""",,
AA,"""but,"" I said, ""I thought I'd see you anyway. Even if you do anything or",,
AA,"not."" He says, ""Come on in."" ""OK"". So he examined me and took a picture",,
AA,"and so forth. Said, ""No, I can't do nothing for you."" So when I got out",,
AA,"of there he V twenty dollars, and I left. (Chuckles) But anyway I got",,
AA,the satisfaction of seeing him. I saw him anyway. Old Gibson told me,,
AA,"that in Potlatch. And then I saw Armstrong there in Moscow, he told me",,
AA,"the same thing. I went to Jacobson down in Lewiston, he told me the same",,
AA,"thing. I went to Murray up to Wallace, he told me the same thing. All of",,
AA,"them told me exactly the same thing, they said, ""Nobody can do anything for",,
AA,"you."" Said, ""You've got to do it."" So I did. I got a pretty good grip",,
AA,"on it. I Could get that back. I was sure, you know, they thought I never",,
AA,come out of it . They thought I was gone. I think Gibson was sure that I,,
AA,"wouldn't make it. They never— if they'd of put me in a cast, you know,",,
AA,"put that up I think, and worked them muscles out a little bit, I Mkvt they",,
AA,"could have done something, maybe, that's my idea, that they could have helped",,
AA,"me to get to get that back. But they just hung it up like this, you know,",,
AA,and from there on it was up to me. I only stayed in the hospital three,,
AA,weeks over it.,,
SS,"Do you know how the accident happened? I mean, what caused it?",,
SS,"We were out of air, you see.",,
AA,Yeah. W£ were out of air. The front dropped down on the rail in the mid,,
AA,"dle of the bridge, and it caught somewheres, see. I didn't know, but I",,
AA,seen it. See I tried to blow the whistle and no air. They didn't blow.,,
AA,"Someway, something went wrong with the air- it's hard to say. It was all",,
AA,"done. You know that could have been the engineer's fault, and mine, too,",,
AA,"just as well, I had a gauge up there in the— and I didn't watch it. But",,
AA,I think that was it.,,
SS,How did they get you—? Did they just get you down to Potlatch from there,,
SS,right away?,,
AA,"Yeah, they come and helped me and the you see, that engin",,
AA,eer hau presence of mind enough to force that lever over and get the locomotice,,
AA,"in reverse motion so when the snowplow uncoupled you see, when it",,
AA,"broke over it uncoupled from the locomotive, and the snowplow and us we",,
AA,"went down in the river and the engine backed down the road again, back the",,
AA,"way she come. So they come and helped us. Oh, I remember part of the",,
AA,"way, when I walked away, they were telling me the snowplow was afire, and",,
AA,"I said, ""Put it out, there's no use to let it burn up."" I remember that.",,
AA,"And remember when they got down to the locomotive, they helped me up and",,
AA,I don't know how in the heck I got up in there. I couldn't tell you how I,,
AA,"got up in that— on the locomotive, up in the cabin there. I don't know.",,
AA,"In the cab, I don't know. But I was sitting on the sandbox there— I",,
AA,"come to again. And I come to again when we got up to the switch, up to the",,
AA,mainline. Had a telephone there they could call Bovill. And they had that,,
AA,"little bug there on the rail, you knowM but they had the little bug there",,
AA,"to haul passengers you know from Palouse and the mail from Palouse to Bovill,",,
AA,"A little car they had on the rail, little Buick they had on the rail. Steel",,
AA,"wheels on it. So they held that up in Bovill til I got up there, I rem",,
AA,"ember that. And I remember when they packed me, lifted me out of the",,
AA,cabin and down on the platform and laid me on the platform there. It was,,
AA,"cold, I didn't feel no cold or anything, but I was in and out.",,
AA,I remember,,
AA,a tew times I remember when they got to Potlatch. A couple of days,,
AA,there I was in and outu. But I only stayed three weeks. I took the bug up,,
AA,"to Bovill and the doc told me, said, ""Don't take the car."" And I said,",,
AA,"""No."" f] I lived in Elk River see. h said, ""Don't touch that car."" And I",,
AA,"said, 'No, I won't."" So the first thing I did when I went there, that had",,
AA,been settin' there for them three weeks. I went out and started it. We,,
AA,"had a little cabin there, I lived in. I went in there and built a fire and",,
AA,sat there a while and got out and shut off the car. I was thinking about,,
AA,"it— I was gonna take the Goddamn car, you know, lived at Southwick, see,",,
AA,"above Kendrick, between Kendrick and Ah''/ki:- that where I lived. But",,
AA,"my intention was to take that car, but somehow I was sittin' there, around",,
AA,"the fire. There was a feller come in there, he was the tire man for the",,
AA,"company, and his name was Banks, I think, or something. John Banks, I for",,
AA,"get now. But he happened to come in and so I asked him, I says, ""You going",,
AA,"to Lewiston?"" and he said, ""Yes."" I said, ""Would you mind hauling me up",,
AA,"to Southwick on your way home?"" He had a car and he was going to Lewiston.",,
AA,"""No, heck, no,"" he said, ""fine."" So, I said, ""OK."" And you know when I",,
AA,"got down on Kendrick I passed out. i was dead to the world, going",,
AA,"down the hill there. Coming from Deary down to Kendrick, down that hill.",,
AA,"I woke up again, come to again after we crossed the bridge and going up on",,
AA,out,,
AA,the other sidef Kendrick. I come to again. I don't know—something—,,
AA,you know,,
AA,so after I got home . the wife had a little store there she was running.,,
AA,So I asked her if she had any bandage there; wide bandage. And she said,,
AA,"""Yes."" So we got that and I stripped, and I told her, ""You wrap me up.""",,
AA,The ribs were broken. And Goddammit the doctor never looked at that for,,
AA,"some reason. That on the back, you know, that's where I was hurt rr tty bad.",,
AA,"So I had that on for a long time,Cvvi GcX.I didn't pass out any more.",,
AA,"Nose was broke head was split, forehead was split. Yeah, that was a tough",,
AA,"one.But I'm still here. That makes me think, you know, by God, that our",,
AA,"days is counted. My days was not out yet. I'm still here, and that was",,
AA,"in '43. Quite a ways back, ain't it? Seventy-three, thirty years then.",,
LS,Did you see many accidents in the woods?,,
AA,"Oh, lots of them. You bet. Lots of them. Oh, not too many, but I've seen",,
AA,"quite a few, yeah.",,
LS,How would they usually happen?,,
AA,"Simplest thing you ever saw, all of them, mostly. You know they all",,
AA,could be prevented. This one if I'd - I blame myself just as much as any,,
AA,body else for mine. If I'd a been awake and looked at that little clock,,
AA,"up there on the wall you know, that showed me where the air was, we could",,
AA,have stopped down on the flat you know and took care of before we went over,,
AA,"that bridge. But, you know, you're always in a hurry, want to go places,",,
AA,"that's it. Oh most of them,iX simple. I've a man cut in two with a snag, root",,
AA,"from a stump come and cut him in two. If he'd a stood still, but he was",,
AA,"running, and looking at it, and they both made it at the same time. He",,
AA,"got just there in time, that root come through the air and just knocked",,
AA,him cuckoo right there. And he must have run two hundred feet to get there.,,
AA,"If he'd a stood still he was all right, nothing'd have happened. I saw",,
AA,"another saw gang there one time, I didn't see it but I see it afterwards they",,
AA,"felled a tree and it Wcked cw-hs another one, bent over and come backwards",,
AA,"and he run about forty feet back, you know just in time fore the snag",,
AA,to hit him. If he'd a stood still nothing happen. So you never know. That,,
AA,"what make me think that our days is counted before we wh come, and we're",,
AA,"gonna die- some die in bed, some die at something else, that's it. When",,
AA,the days are over— when your day's work is done you're gonna leave. And,,
AA,I think — I believe that.,,
AA,END OF REEL,,
AA,"if you make any history or use it, I mean. I don't want to say anything",,
AA,"here, in my 'bobble senseless talking— just rattling along.",,
SS,"I can't think of anything that you said that would be like that, but, I'll",,
SS,tell you— I'll make sure that nothing like that—,,
AA,Anybody that'd be implicated in it— like I said something that the company,,
AA,orouttit that I worked for— anything that they would object to. Because,,
AA,you know I've been rattling along here now for quite a bit of time.,,
AA,"'Cause Iwas satisfied with them, they done fine with me all the way or else",,
AA,"I wouldn't have been there, and I guess in other things I think I done the",,
