speaker,timestamp,End Time,words
Laura Schrager,00:00:00:00,00:00:34:01,"On this tape, Ernie Johnson Butterfield reminisces about a wide variety of subjects. She recalls her mother's routine prohibition, good dresses and lodging. There would. She describes dances, the courtship with her husband, and her life after marriage. So, one of the. I told you on the phone that one of the reasons we got hung up and didn't, I didn't make it up here was we were talking to Glen elder, and he mentioned a few things that he really wanted me to ask you about."
Laura Schrager,00:00:34:04,00:00:41:06,"Things. The you didn't really know the stories about, but he thought you might remember them pretty well."
Laura Schrager,00:00:41:27,00:01:08:28,"And, one of them is, he remembered there was a shooting over a poker game at Jack Connors place team. Do you ever remember that story? No, I don't. Okay. And then another one was, the there was a feud between the duffs and the Wagners."
Edna Johnson Butterfield,00:01:08:29,00:01:23:22,"Oh, yes. What was the oldest, neighborhood scrap about to, you know. They were both all bachelors, and they just couldn't get along. I know my father used to pack stuff up to them."
Laura Schrager,00:01:23:24,00:01:28:07,"They lived up, hoodoo."
Unknown Speaker,00:01:28:09,00:01:30:00,Hmhm.
Edna Johnson Butterfield,00:01:30:02,00:02:01:07,"And this. This Charlie Wagner, he was in an old country. German. German. And of course, he would have his only. And show us the other fella. And I think they make trouble on this over a little land. And I told you how they used to take up land, you know, on homestead. Well, there was the chapel and my father grew up in who did the both of,"
Laura Schrager,00:02:01:09,00:02:09:04,One of them. They thought that the other person was taking some of their land. They had a gunfight over that.
Edna Johnson Butterfield,00:02:09:06,00:02:22:11,I don't know what they did. I don't remember that part. But I do know that my father said he he had to be awful careful not get this stuff fixed up right.
Laura Schrager,00:02:26:01,00:02:30:06,What happened? Did they just stay there and keep fighting it out?
Edna Johnson Butterfield,00:02:30:09,00:02:45:17,"Or am I just know? But both eventually died. They stayed there, but they were elderly men. And I knew them. And they and they died there."
Laura Schrager,00:02:45:19,00:02:48:24,You probably really enjoyed fighting.
Unknown Speaker,00:02:50:04,00:02:52:02,but.
Laura Schrager,00:02:52:04,00:03:00:05,"And they, the other thing he mentioned was, the Admis liner shooting."
Edna Johnson Butterfield,00:03:00:07,00:03:01:22,"No, I,"
Edna Johnson Butterfield,00:03:03:16,00:03:05:05,"Agnes was liner, you see?"
Laura Schrager,00:03:05:07,00:03:05:23,Yes.
Edna Johnson Butterfield,00:03:06:00,00:03:23:04,"No, I don't remember. No. If my brother next to me next older than me was alive, he could tell you all them thing. I expect he was three years older than I was, but he had a, a great memory."
Edna Johnson Butterfield,00:03:23:06,00:03:28:19,And he could tell her anything.
Edna Johnson Butterfield,00:03:28:22,00:03:37:04,"Okay, but he's been gone now for seven years."
Laura Schrager,00:03:37:07,00:04:00:09,"You were there any, People that you remember from, the past that were real characters, which was that were real characters that, you know, did stand out in your memories? no special."
Edna Johnson Butterfield,00:04:00:11,00:04:17:22,"I can do this. I think this landmark can tell you so much about outstanding things which anyone, just mentioned. And,"
Edna Johnson Butterfield,00:04:17:25,00:04:55:10,"They love it, fellas. With the, old bachelors. Oh, my. There's one fella. His name was, Dick Richard Gray. And he was a hoodoo. And he, yeah, a little family up there. And they had six children. And finally they he didn't get them out to go to school. And I know the county commissioners took it up, made me him, you know, him out of there, but I could go to school."
Edna Johnson Butterfield,00:04:55:13,00:05:06:07,"And the main thing that was he you run for legislature and got elected, and he got you. Children weren't even in school."
Edna Johnson Butterfield,00:05:06:09,00:05:20:21,"That was over. And if the remote in the neighbors thought that was something terrible, well, but you know, about same county, just like. So that was it."
Edna Johnson Butterfield,00:05:20:24,00:05:33:02,I'm sure Glen Guillory could remember that little kid.
Edna Johnson Butterfield,00:05:33:04,00:05:34:28,Would you like a cup of coffee?
Laura Schrager,00:05:35:01,00:05:37:16,"Oh, no, thanks. I just had lunch."
Laura Schrager,00:05:39:28,00:05:42:00,I've been drinking too much coffee today.
Laura Schrager,00:05:43:00,00:05:45:01,I've been drinking too much coffee today.
Edna Johnson Butterfield,00:05:45:03,00:05:47:22,Oh.
Laura Schrager,00:05:49:27,00:06:03:08,"last time when I was here, your, one of your daughters mentioned to me about the routine your mother had. The what? The routine that your mother had for doing things on different days."
Edna Johnson Butterfield,00:06:03:08,00:06:03:28,Yes.
Laura Schrager,00:06:04:00,00:06:06:20,Can you tell that to me again?
Edna Johnson Butterfield,00:06:06:22,00:06:40:27,"Well, on Saturday, the house had to be all scrubbed. Cleaned. And Sunday and Monday it all washed. It no matter what to do. And we had to work on Monday and then Tuesday with ironed. And then Wednesday she generally went, oh, she bathed in and went through the things that she had to do. And she, she go through she had her day to do what needed doing."
Edna Johnson Butterfield,00:06:40:27,00:07:10:06,"Said. And Friday was to sweep and clean the house again. And then Saturday she baked up something they didn't do, like no canned goods store. Get it? And they did go to, you see, it was 30 miles to go to a store. And then on Sunday, and my mother and my grandmother were two people that never worked. And they did absolutely what they had to."
Edna Johnson Butterfield,00:07:10:06,00:07:42:20,"On Sunday. And my grandmother had knit. Oh, she had made an awful lot of lace and things like that. But Saturday night her needles laid down and they weren't picked up again on Monday morning. She never, never donated stitch, and if anything needed mending unless it was absolutely necessary there. Stayed there on Monday morning. People don't do that these days, but that's the way that they did."
Laura Schrager,00:07:42:22,00:07:44:28,Did you go to Sunday school? You know?
Edna Johnson Butterfield,00:07:45:00,00:08:04:18,"Well, at one time we had a Sunday school up there in our old school, and that was the most that I ever went to school because I was so far in a row. But in our school with our shop there, it was a couple of years that they also had Sunday school, and that was all that I can remember."
Laura Schrager,00:08:04:20,00:08:13:16,"Did your, is there anywhere that you celebrated Sunday, especially in the family?"
Edna Johnson Butterfield,00:08:13:18,00:08:49:25,"Yes. We ours. I have a. I have, and my mother always tried to get the family together at Thanksgiving time, which I have held up so far, and I hope to be able to do it again this year. We have our family gathering on Thanksgiving Day, and, used to be that to wasn't too many others, but the last two years I've had 45 and that's just home family that we were outside and now I'm planning it again."
Edna Johnson Butterfield,00:08:49:27,00:09:17:09,"If a good lord says I can and I'm relatives, come. I have some nephews at Pierce and they come my way, some from Spokane. We have, we just have a a family get together and they all bring us something. You know, and they come at noon and generally straddle it after eating in the evening."
Laura Schrager,00:09:18:17,00:09:20:03,That must be pretty nice.
Edna Johnson Butterfield,00:09:20:03,00:09:28:28,It is. And it being that's the family we consider that or a family once a year. And of course this.
Edna Johnson Butterfield,00:09:29:01,00:09:36:29,"It seems pretty nervy year that somebody's taken out of it. Oh and you know, I know that number."
Laura Schrager,00:09:37:02,00:09:39:14,And a few additions maybe.
Edna Johnson Butterfield,00:09:39:14,00:09:57:00,"Yeah a few days. And last year this year, this year we've had one new I have had one new great grandson here this year, a year old the 4th of December."
Edna Johnson Butterfield,00:09:58:11,00:10:09:08,"You know, I was just trying to think of the immediate family so far been taken this year."
Laura Schrager,00:10:09:10,00:10:18:00,"Did you, for any of the holidays, like Easter? Christmas? Would you go to church in town?"
Edna Johnson Butterfield,00:10:18:03,00:10:41:20,"No, no, we never did that. and I don't think you find a lot of them here that do. Did you might find some, I think now I'm sure Mrs. Van Hart down here. Oh, of course, church on Sunday."
Laura Schrager,00:10:41:23,00:10:49:23,"Do you think religion was more of, private impact? Do you think religion was more private then, or."
Edna Johnson Butterfield,00:10:49:24,00:11:15:13,"Well, people were more neighborly. People are not neighborly. Not like they were in those days. People go back and forth and take the noon hour, like go to lunch now. They'd have their own dinner. but no, nobody does that anymore."
Edna Johnson Butterfield,00:11:15:15,00:11:36:21,"And would just get ready and go for dinner. And they give you half or whatever they pay for that they'd planned for themselves. And, you know, I think it was really nice. But the day it passed."
Laura Schrager,00:11:36:23,00:11:43:28,Did you you and your brothers and sisters visit other? Just go over to other families often.
Edna Johnson Butterfield,00:11:44:00,00:12:14:06,"Well they do, yes. Oh, we used to quite often, of course, there's quite a difference in age. My oldest brother is 17 years or was 17 years older than my youngest brother. So you see, the older ones have grown out before the best friends. Because of course, I've got nothing to say about that. But 11 years between my, my, my first and last."
Laura Schrager,00:12:16:12,00:12:28:03,or is there anything that stands out in your mind as important differences in the way children were raised when you were a kid and the way they're raised now?
Edna Johnson Butterfield,00:12:28:05,00:12:51:25,"Yeah. Well, I ought to tell you, the children had to mind a lot better than they do today. Their parents made it very. It seems the parents raised the children, and today the children are raised. And the parents. That is the one thing that I could and think about."
Laura Schrager,00:12:51:27,00:12:59:23,"You'd never think of, disobeying something that your parents told you to do or."
Edna Johnson Butterfield,00:12:59:25,00:13:26:18,"No, I don't, I don't think I do. My parent, they were both quite strict, those children. But they, you know, they weren't outstanding, stricter. When they told us anything. We had to do it as children. And I think most of the children in those days."
Edna Johnson Butterfield,00:13:26:20,00:13:34:11,And.
Laura Schrager,00:13:34:13,00:13:46:20,"Is there any reason that, you believe the, that there are more divorces now than there used to be more divorces?"
Edna Johnson Butterfield,00:13:46:26,00:14:04:16,"Oh, I believe more divorces now than they used to be. The trouble is, I think there's just too many of these young marriages. And, of course, so many, many. And in."
Edna Johnson Butterfield,00:14:04:19,00:14:22:27,"Baby comes alone over time, and they don't always turn out. Yes, I know there's been, some of them, I won't say several, but there's been some in our own community."
Laura Schrager,00:14:22:29,00:14:25:29,Do you think it's mainly that people get married sooner.
Edna Johnson Butterfield,00:14:26:01,00:14:34:22,"Than I think? They get married too young. And then as they get a little older, they change their mind."
Edna Johnson Butterfield,00:14:34:24,00:14:39:17,And see somebody else that.
Laura Schrager,00:14:39:19,00:14:41:22,How did you meet your husband?
Edna Johnson Butterfield,00:14:41:25,00:15:25:02,"Well, he's people or Minnesota. And they came out here. Well, the truth would he got sick. And so, he had been working up, and his father and mother had been. Oh, living around different places. And then, they found out that this place here was for sale. And, his father bought it, and they were here two years when I married him, and I got married, he came up to my father's to buy a cow, his father, and came up to my father's to buy a cow."
Edna Johnson Butterfield,00:15:25:04,00:15:34:00,"Well, and two years after that, we were married. that would be. That's where we got acquainted."
Laura Schrager,00:15:34:03,00:15:39:23,"Did you used to do anything together before you got married? How did it caught you? I mean, would it come over."
Edna Johnson Butterfield,00:15:39:23,00:16:07:02,"There at team, men had at, of our, our system. But meat and take it. I know before I was married, my husband and I went clear to clues to the 4th of July celebration, and, I in the wintertime, a soldier danced in French movement camp mudville. Up there, down Frenchman to the dance."
Laura Schrager,00:16:07:05,00:16:09:14,He'd come up and pick you up. Yeah.
Edna Johnson Butterfield,00:16:09:17,00:16:17:26,"He come from here. Okay. Yeah. And then after that, sometimes we get home 5:00 in the morning."
Edna Johnson Butterfield,00:16:17:29,00:16:22:06,Yeah. I think it sounds kind of unbelievable that some of these others.
Laura Schrager,00:16:22:09,00:16:24:08,"Oh, it sounds great."
Edna Johnson Butterfield,00:16:24:11,00:16:29:01,Yeah.
Laura Schrager,00:16:31:26,00:16:34:17,Would you just dance with him when you went over the dance?
Edna Johnson Butterfield,00:16:34:17,00:16:42:21,"Oh, no. They crowd out mixed after they get."
Edna Johnson Butterfield,00:16:42:24,00:16:51:26,But I like their motor dancing at that time a whole lot better than they do now. I don't think much of their way of dancing nowadays. Do you?
Laura Schrager,00:16:51:29,00:16:56:26,"Oh, well, I I'm, that's the way I was brought up."
Edna Johnson Butterfield,00:16:56:26,00:17:01:01,"So with every kind of dance, the way they dance now."
Laura Schrager,00:17:01:03,00:17:02:20,Yeah.
Edna Johnson Butterfield,00:17:02:23,00:17:41:04,"Well they didn't dance that way too much then. Yeah. And when we were young and I'd go to these dances, sometimes they'd get a girl to take, Oh, sure. Okay. Couples would take some things long to at midnight for lunch. not very often, but sometimes. And then to pay the musicians for. Why? Yeah, they'd take a collection."
Edna Johnson Butterfield,00:17:41:04,00:17:58:21,"The men could put it on a dime or a quarter or whatever. They wanted to, to pay the musicians for their work. And now that wouldn't sound like much, would it? And,"
Edna Johnson Butterfield,00:17:58:23,00:18:05:25,I can remember that.
Edna Johnson Butterfield,00:18:05:27,00:18:32:25,"Oh, my. My brother. It would have been good to take this, girls, before we sold enough to boyfriends, to things going on. they people danced it, and then I don't think you'd go anywhere. They'd take the wraps off and throw them on in on the bed. And when you got ready to go home, I think you might have."
Edna Johnson Butterfield,00:18:32:27,00:18:59:03,"No other. And the school. Did you know that one stayed every year when school was out for the. I'd have a picnic, and the parents and children would go to the picnic the last day of school, and they don't have that anymore. And that was quite a thrill for the children looking forward to. They referred to a school picnic."
Laura Schrager,00:18:59:05,00:19:06:22,"When you were young, were you told not to leave the the house where the dance was being held?"
Edna Johnson Butterfield,00:19:06:25,00:19:08:11,Yeah.
Laura Schrager,00:19:08:13,00:19:10:08,Why was that? Why were we.
Edna Johnson Butterfield,00:19:10:13,00:19:30:28,"Well, they weren't supposed to go alone. The 2 or 3 could go together and leave the hall if they want to, but, oh. A girl wasn't supposed to go out on the dance. well, they weren't. I don't say they weren't allowed to, but they weren't supposed."
Edna Johnson Butterfield,00:19:31:00,00:19:51:23,"Just like it is now. You don't know. You might run across out there. If you hadn't have to go out or something. And they didn't all have toilets to go to. We, they like to do now at those days there was no outside or the toilets were all outside toilets. Do you remember that?"
Laura Schrager,00:19:51:25,00:19:58:09,"Well, yeah. I've lived in houses, you know, the have had outhouses."
Edna Johnson Butterfield,00:20:03:02,00:20:08:08,And there for nursing at the fast.
Laura Schrager,00:20:08:24,00:20:14:08,"so if you wanted to go to, to the outhouse, you had. Yeah. To get someone to go with."
Edna Johnson Butterfield,00:20:14:08,00:20:17:02,You supposed to get a girl to college. Yeah.
Edna Johnson Butterfield,00:20:18:17,00:20:27:10,Well. Of course. What was that for you to say? Forget it.
Edna Johnson Butterfield,00:20:27:12,00:20:36:22,Because you don't know who you might run into.
Laura Schrager,00:20:36:25,00:20:39:21,Did you go slow riding much in the winter?
Edna Johnson Butterfield,00:20:39:21,00:20:59:14,"Oh, yes. That's all we had to travel. And, I've still got my, Husband's bobsled that he used to have. We went in, and then we had our horses and."
Edna Johnson Butterfield,00:20:59:16,00:21:24:04,"And, as I tell my, there's one thing that I want to keep in. One of the neighbors was here one day. We had a fire out here not too far. And barn and he said I worked harder to save that barn. do you save that old hag? Because he says it's really a relic. And that was one that his, that my father in law bought when he first come here."
Edna Johnson Butterfield,00:21:24:07,00:21:37:25,"And I still got that. And that's a price to my son, too, that he thinks just as much. Yeah, of course I he was. And, he was,"
Edna Johnson Butterfield,00:21:38:02,00:21:47:12,"oh. The son, won't have one found. No, the other one died. And."
Edna Johnson Butterfield,00:21:47:14,00:22:06:06,"Yeah. We used to go on the bobsled, but wherever we went, we and the women had electric blankets. And women could sit on the bottom of the sleigh and keep the children covered up and keep warm."
Edna Johnson Butterfield,00:22:06:08,00:22:23:21,"You know, the first, first automobile that my husband owned was in 1970."
Edna Johnson Butterfield,00:22:23:23,00:22:26:05,Have you made many calls today?
Laura Schrager,00:22:26:08,00:22:28:14,"No, just the aunts."
Edna Johnson Butterfield,00:22:29:04,00:22:33:10,Yes. I know they could both give you old time stories.
Unknown Speaker,00:22:33:12,00:22:34:03,Yeah.
Edna Johnson Butterfield,00:22:34:05,00:22:55:00,"You see, she used to. My dad used to teach my, Brothers. I don't, and she might have taught my sisters, but she taught my brother. I if she didn't teach me."
Laura Schrager,00:22:55:02,00:22:57:23,"Yeah, she taught up in Woodville. I."
Edna Johnson Butterfield,00:22:57:25,00:23:15:26,"Yeah, that's what she taught. Yeah. Oh, I should I should tell my sisters to. But I was out of school before she taught there fact yet. I guess I wasn't even living up there when she taught."
Laura Schrager,00:23:15:28,00:23:21:07,How did you and your husband get started when you. After you got married?
Edna Johnson Butterfield,00:23:21:09,00:23:49:08,"Oh, they they only he was the only boy they had. And his father wasn't able to farm and do things like that, and, they, they come, brought me up me right here as a bride and right here. I've never since we've in a different house. But aside from that, I've been right here in this one place ever since I was married in 1910."
Edna Johnson Butterfield,00:23:49:10,00:24:04:07,We built a bamboo house. This house. We built that house 2320 b 23 years. And so I've been here ever since.
Laura Schrager,00:24:04:10,00:24:08:03,So his his mother and father lived with you where?
Edna Johnson Butterfield,00:24:08:03,00:24:34:24,"We lived with them? Yeah. Yes. And. We were all living together at the time. Our first three children were born. But they're my son. I have here now. He, quite a lot younger than the other children. He was born after his grandpa Butterfield died."
Laura Schrager,00:24:34:26,00:24:48:11,Did people. Where were your children born with? with a midwife rather than a doctor around. Was a midwife around rather than a doctor when your children were born?
Edna Johnson Butterfield,00:24:48:12,00:25:18:14,"Oh, my mother knew. well, my two brothers were born in Michigan. Of course, she had doctors then, but we. And, she never had a midwife for this for another four. And, now this Cochran's this mine attorney. Maybe she'll. There you, there was ten of them born over there. Yeah, well, we all they they joined us here, and they never had a doctor in the house at birth."
Edna Johnson Butterfield,00:25:18:14,00:25:38:10,"If any of them children that were just midwives. And, of course, my husband always had a doctor when I was born, the last one on the doctor didn't get there for a baby, did, but he was on the the destitution and wave and the baby go. So he took care of me afterwards."
Edna Johnson Butterfield,00:25:41:00,00:25:49:20,"Yeah. There's a when you live that far away, you just couldn't make it. Sometimes."
Laura Schrager,00:25:49:22,00:25:52:08,I imagine some of the midwives were pretty good.
Edna Johnson Butterfield,00:25:52:12,00:26:09:23,"Oh, yes, they were. They were right. They were. I don't think there were any, as far as I know. I don't think there's any mothers that was lost through the midwives at that time."
Edna Johnson Butterfield,00:26:09:26,00:26:26:07,"And as far as I know, there weren't any of the babies lost either up in this country."
Laura Schrager,00:26:26:09,00:26:31:12,Your your husband. Then he took over his father's farm and farmed it.
Edna Johnson Butterfield,00:26:31:14,00:26:47:16,"Yeah, well, his father, let's see, his father was born."
Edna Johnson Butterfield,00:26:47:19,00:27:14:09,We took over the farm in here in. 1900 and we were married in 1910. He went to work for to kind of took over his father's farm. Right. Think. And his father died in 1919.
Laura Schrager,00:27:14:12,00:27:18:07,How much land did your husband farm when he farmed here?
Edna Johnson Butterfield,00:27:18:09,00:27:30:21,"Well, we all had, at the time he was here. We don't like farming. 200. 217 acres. But,"
Laura Schrager,00:27:30:23,00:27:33:16,Was he farming that much in 1910?
Edna Johnson Butterfield,00:27:33:18,00:28:14:02,"Yeah. No, we were 1910. When you was farming. they were farming 100, 120 acres. And then, yeah. After he died, my husband bought another hundred acres. And, so therefore let them. We farmed beef until, well, my son here went, bought some land after that. Right. And he he's them he farmed. I don't know, I won't say so much."
Edna Johnson Butterfield,00:28:14:02,00:28:24:11,"Good Lord, I don't know. I think he farmed around 2000 acres. Him and him and his boy."
Laura Schrager,00:28:24:13,00:28:25:15,It's a lot.
Edna Johnson Butterfield,00:28:25:17,00:28:38:02,"It changed a lot. Of course, during some of the season I have to hire him. But. And now his youngest boy has got three boys."
Edna Johnson Butterfield,00:28:42:12,00:28:53:08,"No, I have one grandson now that works for the bankers cooperative. Okay. he's been in here. She made a tractor known."
Edna Johnson Butterfield,00:28:53:11,00:28:54:06,And how long?
Unknown Speaker,00:28:54:06,00:28:55:02,Oh.
Laura Schrager,00:28:55:05,00:28:58:12,How long a day would your husband put in working?
Edna Johnson Butterfield,00:28:58:14,00:29:25:08,"We all know I'd like to do now. He used to, when I worked with the horses. He thought ten hours was a big day for horses. And now it's, about 15 hours a day with the machinery. And the man I really think tell the truth to shorten their own lives. But I just work in that much harder."
Laura Schrager,00:29:25:10,00:29:31:21,When would he be done? By work? By when would he quit? In the fields.
Edna Johnson Butterfield,00:29:31:24,00:29:37:26,Over. Got dark.
Edna Johnson Butterfield,00:29:42:14,00:30:06:13,"Yes. One of the engine crap crap season and all that. He never quit. And he his family's just the same. Say, well, the neighbors around here do the same. They work from as long as they can see."
Laura Schrager,00:30:06:16,00:30:09:01,Did you ever help in the fields in any way?
Edna Johnson Butterfield,00:30:09:05,00:30:28:27,"Yes, I have, I'm a lot more. Not sure if you know, and skiing and all that. They did it all with horses. I never did with machinery, but I did with horses. And, I used so grass seed and."
Edna Johnson Butterfield,00:30:29:00,00:30:34:02,I run away with it. Horses on a rake one hand.
Laura Schrager,00:30:34:05,00:30:35:26,What have.
Edna Johnson Butterfield,00:30:35:28,00:30:59:22,"Well, the brush got her foot over time, and she ran away and I guess doing away. I saved my life. I threw myself backwards. Oh, thank you. Big. And she she come and they come on and run into the barn. But my oldest boy was here and and he headed him off. Did a lot of gone to the barn or I, I don't know what old."
Edna Johnson Butterfield,00:30:59:24,00:31:13:29,"But it didn't. Oh it hurt me some of course, but nothing serious like, you know, for the operation or for how you live now, do you, do you have any home out here?"
Laura Schrager,00:31:14:01,00:31:21:03,"Well, we just rent a place we'd like to find an old place to farm."
Edna Johnson Butterfield,00:31:21:08,00:31:23:18,cost something nowadays to get started.
Laura Schrager,00:31:23:20,00:31:29:20,"Yeah, well, you don't particularly want a farm, but we would like to have a little house of our own."
