speaker,timestamp,words
Lola Gamble Clyde,0:32:31,"And she said, well mine's the first one. She was the Madame. And but the tales of her great generosity, her great kindness to people in trouble, the miners that she fed, the miners that she staked, and the poor and the people who were down in luck. One of the famous stories is how a woman was giving birth to a child out along the Fourth of July Canyon in the snow and cold. And Molly Bedem came upon them and took off her luxurious fur coat and wrapped the mother and baby in her coat, put them on her horse, and she walked beside them and brought them into Murray. There are many other stories to that effect. She didn't live to be a very old woman. She was still young when she died, but up in the little weed infested cemetery at Murray, there's a little wooden headstone and on the slab it says Molly Bedem. And the interesting thing about it is I was there about a year ago and among all the weeds and the swirls and the trash in that cemetery, the only grave that's been cleaned off is Molly Bedem. And it was all cleared off of weeds and there was a little, a few little plastic flowers laid on it. And in an empty beer bottle, there were three or four little wildflowers that had been stuck in water on her grave. So I thought after a hundred years, there were still people remembering Molly Bedem."
Sam Schrager,0:34:15,"What is it about Molly Bedem that made her such so well known up there? I mean, why, why has she stayed in people's imaginations?"
Lola Gamble Clyde,0:34:26,"Well, I think probably it was the many, many acts of kindness. The kindness is something that goes on living, you know, and that never dies. You've touched people's lives. And of course the stories may get better with the telling, you know, too, down through the years, but there are many, many fabulous stories about how she took in the sick and the old and the disinherited and the dispossessed and grubstaked them, started them over again with the money that she accumulated in devious ways. And I think those things people remember."
Sam Schrager,0:35:07,"Is there any, any knowledge passed on or lore passed on about how she treated the women who worked for her?"
Lola Gamble Clyde,0:35:16,"Well, I think they were of the same sisterhood, you know, and there is a feeling of comradery, a feeling of sisterhood maybe among them. Anyway, Molly Bedem has become just a legendary lady of, a legendary lady of loveliness and kindness and all the sweet, fine things that she did. And it is proved by the little bunch of wildflowers in an empty beer bottle."
Lola Gamble Clyde,0:35:56,Now there's one other person that I was going to ask you about.
Lola Gamble Clyde,0:36:01,"That was Jane Silcott. Oh yes, little Jane Silcott, because she antedates all of these three women because she was, she was the daughter of old Timothy and old Timothy was Henry Harmon Spaulding's first Christian convert. And Timothy of course lived down at Silcott, Washington, which is also known as Wawawee. It is also, it is also a Red Wolf's camping ground. And he, it got, it came to be called Alpawa because the Christians weren't allowed to work on Sunday. And Alpawa meant the place of Sabbath rest. And I'm interested to know that they saved the Timothy Bridge down there, the old Timothy Bridge that goes across the Alpawa Creek. And so once they put in this dam, you know, and flooded Silcott and they have a little park there now. And that's to, to, it's in memory of old Timothy who was a friend of the white men. Of course the, the Nesperces themselves, they considered old Timothy the greatest Uncle Tom Tom of them all because on so many, many occasions he did befriend the white man. It was he that, that Mrs. Harmon, Mrs. Henry Harmon Spaulding sent to Walla Walla at the time of the Whitman massacre to see how the little daughter, young Eliza, had fared. And he went down to try to, to buy her freedom from the captors."
Sam Schrager,0:37:45,Was he successful?
Lola Gamble Clyde,0:37:47,"No, he didn't. No, he didn't get her. But later on she was rescued. But you did tell me that, that he had, she had agreed to take the Pierce party across. Oh yes, that's right. Yes, yes, little Jane. Well, little Jane was old Timothy's daughter and Timothy's wife was a sister to old Chief Joseph of the beloved Wallawas. And to them, to Timothy and, and Tamir was born little Jane. And little Jane was a very bright, fine looking little girl. And at about 17, E .D. Pierce came in to this country looking for gold. He got as far as the Red Wolf campground. He thought that old Timothy would have some of the Indians ferry him across at Walla Walla. We had to come on up Steptoe Canyon into this country. When they got there, Timothy said, well, you don't dare go on up through the Nez Perce country, up through Lapwai and Lilliston because there's great unrest and the Nez Perces don't want so many white people coming through their country. So he wanted to know how otherwise he could go. Well, he said, if you ferried across here from Silkout across the river, you could go on up the grade. And he said he didn't know the way. Well, little Jane, who was about 17, said, well, she knew the way and she would go with them and show them the way. So the E .D. Pierce party stayed overnight there and the next morning the Indians ferry them across the Snake River. He went up through Steptoe Canyon. He came through Steptoe Canyon on, on between Colton about in Uniontown, on down until he struck the Tenet Panup about four miles, about halfway between where Moscow and Pullman now are. When they got to the Tenet Panup or the South Palouse River, then they followed that on up out to where Troy now stands, on down to Kendrick. And from Kendrick they went on out over the, the plateau country on up to Orphenovar Gold was discovered. And Jane Silkout was very, very astute and very lovely little person. And a few years later, when the army put up the fort at Lapway, with the party came young John Silkout. Now John Silkout was an engineer. He was a Harvard graduate. He was a very smart, intelligent man. And he fell in love with the little Jane Silkout and they were married. And for a time they lived at Silkout and ran the Silkout ferry across the river. And later on they went up to Lewiston itself and right at the foot of the bluff and right at the foot of Fifth Street where the Fifth Street Railroad Bridge was built. They ran what was called the Silkout ferry. It wasn't down at Silkout, but it was run by Jane and John Silkout and was there where Fifth Street goes over to the, crosses the Clearwater River. And they ran it there many, many years and all the early timers, the Clydes and the Snows and the Martin Andersons, all the people from this vicinity that used to have business going to Lewiston, many of them crossed there at the Silkout ferry. And they said when John Silkout himself became a very bad drinker and when he'd be too drunk to go, Jane would get out the ferryboat herself and work it across the river for them. And often she had coffee ready. The old yellow house that they built there on the banks of the river, it's only been gone maybe 20 years. It was there for many years. I remember it well. And she was very friendly and hospitable, make coffee for the visiting people while they waited for the ferryboat to come back or to go over. And lots of folks remember her with great gratitude and that sort of thing. She didn't live to be a real old woman. And they had an open fireplace in the house and it caught fire and she was burned so badly that she died. And she was only I think about 53 or something like that when she died. But little Jane will be remembered long as the daughter of old Timothy and who led the E .D. Pierce party and as the wife of John Silkout who ran the ferry there across the underwater river at the very first coming of the first settlers into this community. When she died, John Silkout, the husband, erected a very lovely white marble shaft there on the hillside. They buried her right there on their own land just above where the ferry house stood. And all of us here in this community remember seeing the white monument there. I've been there at it many times. And a few years ago when we moved old Timothy and the bones of old Timothy and all his family from Silkout down the river when it was going to be flooded up to the Beachview Park at Lewiston, we talked then about moving Jane's bones from the bluff there along the Clearwater River, moving it over and burying it with the families and John Silkout too because he was buried there too, burying them with old Timothy's family. And when they went over to find the bones, Marcus Ware, who was one of the instrumental people in this, found nothing but broken redwood splinters off the coffin. And the grave had been robbed and the bones and everything were gone. Just the broken splinters of the redwood coffin were left. And that's one of the sad travesties of the world is how people will go and rob Indian graves for the little trinkets and things that were buried with them. Did Jane Silkout continue to be close to her people or did she spend more time with the No. No, it was a very friendly relation and they were all very much accepted down there because Jane and all her family had been friends of the whites and they were very compatible and I think John Silkout thought a lot of his little wife, everybody said that he did. He said he was just simply a drinking man, that was one of his failings and he would beat her when he got drunk but that was one of the ways of the world of that time, you know."
Lola Gamble Clyde,0:44:54,"Grace Wicks told me a story about Jane and, well it was really about him, John, that when his sister came out to visit him, he took her around but never did bring her home to meet Jane."
Sam Schrager,0:45:11,Have you heard that story?
Lola Gamble Clyde,0:45:12,"Yes, I've heard that and I think that that's probably true."
Lola Gamble Clyde,0:45:20,"He probably knew that the sister wouldn't be able to accept in the right light and that was probably the way it was. I wouldn't be surprised that he, I wouldn't be a bit surprised if that's the way it was, all right."
Sam Schrager,0:45:42,Would you consider Jane Silkout one of the outstanding early women?
Lola Gamble Clyde,0:45:46,"Yes, yes, I think she was one of the early women -livers. I think all four of these were. She wasn't a bit afraid to go with this bunch of mining men on this trek up into the orifinal country. I think she must have been a women's liver."
Sam Schrager,0:46:04,Do you know about heart and hand marriages?
Lola Gamble Clyde,0:46:09,"No, I really don't know. I've heard of them. I've heard of them."
Sam Schrager,0:46:15,But you don't know of yourself of instances where that's the way that people got married?
Lola Gamble Clyde,0:46:22,"No, no I really don't. I've heard of such things and I've heard of these heart and hand advertising agencies you know where you put an ad in the paper that you'd like a husband. I guess it's still going on today as far as that goes. But I think that this marriage business is so very important that I believe they ought to do a little bit better when they go out to find mates. They ought to look the situation over a little more carefully."
Sam Schrager,0:46:57,"Speaking about women who were women's livers, what about all the women who homesteaded out in the Clearwater country, took up homesteads, the kind that Carol Brink writes about in Strangers of the Moon?"
Lola Gamble Clyde,0:47:11,"Yes, I think all of those were quite women's livers and some of them, yes I knew many of them, and I think they were. They all believed in women's rights and they were. In those days we heard a little more discussion of women's rights too, probably because they didn't have them. Nowadays we feel that we've had them so long we take them for granted you know. We just take our rights for granted. We can't realize there ever was a day that we were chattel and belonged to our husbands and we obeyed our husbands and so on you know. We've become so used to being co -partners and helping make the decisions and I think that that's the way it goes."
Sam Schrager,0:47:54,"Do you remember when you were young, young women talking about women's rights?"
Lola Gamble Clyde,0:48:01,Yes I do. My mother was a great woman's libert. She never missed a time going to town. She went twice a year. She went to see Santa Claus and bring something home and she went to vote and those were two very important things and the women's right to vote was very important with her and she never missed a chance to go to vote and she thought that that was the salvation of the country was when women could vote and help make the decisions.
Sam Schrager,0:48:33,What were the attitudes of you and your friends when you were young? Did you feel that women had an important role to fill that was being denied them?
Lola Gamble Clyde,0:48:49,Oh yes I remember definitely. I thought I would be a lawyer. If I didn't have enough money I'd have been a lawyer. I was always on the debate teams. My husband says the debate's still going on after all these years but I was going to be the first woman lawyer to graduate from the University of Idaho. It just simply took more money than I had. Didn't have enough money to do it but I would like to have been a lawyer and I would have been championing women's rights because I always maintained they certainly should vote and get out and know what was going on and be equal partners with their husbands. I think that's right.
Sam Schrager,0:49:30,"Were the women, young women organized at all when you were young or was it just a very, an individual and a private attitude that people had? Do you know what I mean?"
Lola Gamble Clyde,0:49:41,Yes.
Lola Gamble Clyde,0:49:42,"Well I think largely it was kind of just an individual attitude that people had. My mother was an educated woman too and that helped influence us that we should grow up and learn and be educated and make a contribution to the world and not just do it through our husbands. There were so many of the early day women their husbands said and they just did and they never thought it through, you know, themselves. But many of them had no education and didn't have much background for it. But as far back as I can remember I believed in women's voting and women holding office and women being on equal terms with their husbands and able to enter into the problem solving."
Sam Schrager,0:50:39,Do you think that as a rule Lola that women did not have equal responsibility in marriage relationships that the men really did make the decisions and the women did not?
Lola Gamble Clyde,0:50:55,"Yes I think so. As I look back on it that was the way I remember it. They believed in us, let the women be silent all you know. And I think that was the way it was. They were sort of considered inferior and they were to obey their husbands and be subservient and make him king of the castle. And I've always said that these big decisions that are made like who should be president of the United States and what we should do about Russia and China, I leave all that up to my husband. But the little things like how we're going to spend our money and how we're going to raise the kids, those are the things I decide."
Sam Schrager,0:51:46,Well in the early days do you think that pioneering women had more or less equality? Were they really subservient or did they have a more important role to play?
Lola Gamble Clyde,0:52:02,"Well they certainly had an important role because most of them did the raising of the king, there was food on the table and all that sort of thing. While the husbands did of course the outside work like the sowing and the harvesting, most of them had plenty of hard time making a living. But keeping food on the table and the kids washed and scrubbed and cleaned and seeing that they got some form of education, some form of training, I think the women pretty much did that."
Sam Schrager,0:52:42,"Well I'm just wondering, was that an equal relationship? Did they have equal responsibility in that way or were they still strictly second class?"
Lola Gamble Clyde,0:52:58,"Well, yes I know what you're driving at but I think it was just up to the husbands. Some educated husbands felt that their wives were on an equal basis with them but some of them, many of them in our community were from the old country and the more, the farther back the line, the closer they were to the old country, the more they felt that the woman's place was in the home and to run and wait on them and see that their food was ready on time and that sort of thing. I think they were part of the chattel, part of their lord and masters, what they owned and the women were to keep the thing running for them, you know, and the home was for them and they were to stay right in there and it always seemed to me that the real, the buns who were closer to the immigrant stock felt more that way than the people who had grown up in America and been educated here. They felt a little differently about it."
Sam Schrager,0:54:04,"Do you think that the women in general went along with this and accepted their being chattel, not knowing, really not having thought of it any differently?"
Lola Gamble Clyde,0:54:20,"Well, some of them were smart enough not to let anybody ever know that they had any other thoughts, you know, about what every woman knows. Men who have climbed to the high places in the world like to think that they did it all by themselves and we who are their wives smile and let them think so. That's what every woman knows and a lot of them were smart enough, you know, to, I've heard many of the women from the old country say, oh, I wouldn't know anything about that. You'll have to ask my husband. He knows all about that, you know. It gave the men a great build up. I wouldn't know. I couldn't answer it. Just ask my husband. He'll tell you. He knows how it should be done. I think they were just smart enough to play the game, you know. They were just kind of going along with it."
Sam Schrager,0:55:19,"After the women's rights struggle was won, the right to vote, I think, in Idaho, there really weren't many advances soon after that, were there? I mean, wasn't that sort of the end of the women's movement for the time being?"
Lola Gamble Clyde,0:55:34,"Well, a lot of them got very concerned with the prohibition. The people who had headed women's rights, a lot of them took up prohibition and became very much in favor of prohibition until finally they got it through, you know, under the Wilson presidency. But it led to such bootlegging and so on that it was, after all, it had to be thrown out. After that, it was thrown out again. But for a long time, we did have prohibition. And I think that came after women's rights. All right."
Sam Schrager,0:56:10,Why were women so attuned to that idea? Why did they think that prohibition was the answer to the world's ills?
Lola Gamble Clyde,0:56:21,"Well, I think that many of them had seen all what they had saved for. Maybe the men would ride off to town and get drunk and spend what they'd been saving for and what they'd been trying to get ahead with. And the women had so little control over money of any kind. And if the men wanted to go and drink it all up, it was just done. That was it. And I think that they felt that the men just couldn't get it so easily, that that would make a better life and a better family life. And they would... So I think that that was what prompted the great drive for prohibition."
Sam Schrager,0:57:09,Was drinking much more of a problem then than it is now?
Lola Gamble Clyde,0:57:12,"Yes, I do. I think so. There were open saloons everywhere and they were the gathering places of the men. They were there. That was their club. It was their pastime. It was everything. They could go and it was a sort of a fellowship. They could get together and talk. Talk men's talk and not have to have the women around, you know. And I think that it was really much more of a problem than it is now where social drinking is accepted, where the woman sits and has a cocktail and the men sit and have a cocktail together or go to an eating house and have a cocktail with their meal. This was... The drinking the men did in those days was done largely on their own. And the women stayed home and took care of the kids while the men went off and got on a big spree and come home and beat up on the children, beat up on their wives and that sort of thing. And I think it took a lot of work on the part of people like May Arkwright Hutton, for example, to call attention to the things that were going on."
Sam Schrager,0:58:27,Do you think that the isolation of a pioneer in rural life made drinking more of a problem?
Lola Gamble Clyde,0:58:33,"I do. I think that the isolation, there was nothing else to do and the hard work and the men felt that they just had this coming and they could go off to town and leave the kids and the wife at home. And for a little while they could forget their cares and their worries and their sorrows and in the fellowship of other men. And I think that that was one place the men could go and there wouldn't be women and children following them too, you know. And there were problems in more than one way. Uh -huh."
Sam Schrager,0:59:10,Just an impossibility? Was the WCTU and all that just a failure?
Lola Gamble Clyde,0:59:19,"Well, I don't think it's been just a failure. I think it's all a matter of education. If they can learn when to stop, you know. If they take a little drink to warm them up or a little drink to cheer them up, I always say I don't need a single drink. I can say enough stupid, crazy, irresponsible things without anything, you know. I am stimulated by talking to other people and enjoy it so much. But some people are so inhibited they can neither talk nor feel at ease. And those people have a definite need of something to take the edge off, as they say."
Lola Gamble Clyde,1:00:00,"And uh -huh. It's been said to me that Prohibition led to more drinking because when liquor became forbidden fruit it reached many, many people, women and upper class people socially who never thought of drinking before."
Sam Schrager,1:00:18,Do you think that that's true?
Lola Gamble Clyde,1:00:19,"Well, I suppose so. But I don't think there was as much drinking under Prohibition as there had been in the days earlier than that. People have, as Roosevelt got in such trouble for saying, the people learn to hold their liquor well, you know. And of course that was trouble with WCTU. But if they could take a drink and know when to quit, you know, it's the drinking beyond all sense of responsibility where you don't care what happens. I think that was where the trouble lay. And I think that during the Prohibition it wasn't quite so easy to get. Men didn't just go off to town and stay there two or three days at a time dead drunk because there was no place for them to stay. There were no saloons. If they wanted to get drunk and lie out on the road, that'd be about all. I think there was less drinking during Prohibition than there was before Prohibition came in. But it was far from the real answer. The whole thing was a matter of education, really. And if some people wanted to waste their lives that way, you can't make it fit everybody. But it's a matter largely of education. I want to ask you a little about the women homesteaders that you knew and what their homesteading was like."
Sam Schrager,1:01:55,Can you tell me about that?
Lola Gamble Clyde,1:01:56,"Oh, yes. Well, the ladies that went up around Collins, those were all quite society ladies from Moscow. There was Mrs. Thorsen, who was the milliner. There was Iona Dare, who was Dr. Adare's daughter. There was the McConnell girls, who were the governor's daughters. And they went up around Collins, Idaho. And Joe Collins was one of the early day forest rangers that took people out and settled them. And he would find a good place for them to settle. And there were many folks that went up there. They endured much of the hardships of the early days, although as Carol Mireille Brink had so well put it in her Strangers in the Forest. And her Auntie Elsie Watkins was one of the women who went up there in homesteading. They had lots of hardships and bringing in their own food and packing back into the hills. And many of them spent much of their time down, though, at the Boville Hotel. That was quite a fancy, warm, comfortable place. And a lot of them went in there and did some of their homesteading by long range from there. And there was some sort of a deal on when they got these white pine homesteads proved up on. They could be sold. They could be sold to the big Potlatch Forest Lumber Company. It wasn't called that then, but who, whatever it was. These timber claims that they took up, nearly all of them didn't really do anything with them. They were just sold to the big lumber company that went in and harvested the white pine."
Sam Schrager,1:03:41,How much of the time were these women occupied with being on the homestead?
