speaker,timestamp,words
Sam Schrager,0:00:00,"And I thought perhaps, perhaps one at a time, I was thinking of starting with Polly Bemis, and who she was and what there is that's important to remember about her."
Lola Gamble Clyde,0:00:15,"Well, Polly Bemis was Idaho's little China doll. She was born in the caves of Hong Kong, and at 15 she was sold into slavery to the great King Kong of San Francisco's Chinatown and the Barbary Coast. And after a short session there, it was Warren's Diggings and the Mining Saloons of North Idaho. They settled at Warren's, and here King Kong ran a saloon with Polly as the cook and as a chief attraction and as a chief supplier of all the comforts of home to the early day miners. And she was only four feet, about five inches tall, weighed about 85 pounds."
Lola Gamble Clyde,0:01:08,"And one of her favorite gags was to grab up a great big cleaver and come out into the saloon and say, anyone here know likey, know likey my chop suey?"
Lola Gamble Clyde,0:01:16,"And of course, they all liked it very much. Now also mining in this country and running a saloon was a gentleman named Charlie Bemis, and he too was a gambler. So one night the great King Kong, the great Chinese riddle, Chinese puzzle, King Hong, and Charlie sat down for a little friendly game of poker. Well, they gambled away at pretty high stakes. And Charlie had a little sack of gold nuggets that he'd picked up out on his claim out on the Salmon River. And along toward morning, with all the chips down, it was the sack of gold nuggets against little Polly Bemis, the China doll herself. They played, and the great King Hong lost. But he had still had one trump up his sleeve. He whipped out his gun, shot Charlie Bemis in the eye, grabbed the bag of gold nuggets, and ran out the door into oblivion. But that was the way the great Chinese fortune cookie crumbled. And the story tells it that the bullet, while it went into the eye, it went under the eyeball, and Polly took her crochet hook, dug out the bullet, packed the eyeball with herbs, and nursed Charlie back to health. And then Charlie Bemis done right by that gal. He married her and gave her a little wedding certificate that she could hang up over their neutral bed, stating the fact to all the world that they were married. And this marriage certificate can still be seen up at the museum among the good sisters at St. Gertrude's Academy on the Camas Prairie. Polly lived out on the gold beginnings with Charlie for many years, and there's a creek there to this day that flows into the Salmon River, and it's called Polly Creek in her honor. She held open house there for all the river men. There was always food to eat and great kindness shown. After 28 years of married life, Charlie Bemis died and was buried at Grangeville. Polly made two trips to the outside world. She went to Grangeville to get her teeth fixed one time. She went to Boise at one time, and the rest of her life was spent there. They had 15 acres on Polly Creek, and this she gave to her neighbors, the Shep and the Clinkhammer people, who had a great cattle spread there in the country. And it was understood that they were to take care of her till she died, and they did. They put in the telephone line into her house so they could talk to her every day and see how she was getting along. She finally got sick, and they took her out to Grangeville where she died. The people from the Shep and Clinkhammer Ranch weren't there, so they gave her a pauper burial there in the Grangeville cemetery. The land passed into the Shep spread. Moscow always feels it has an interest in the great Shep Ranch out there because in later years, our own Bill Renfrew went to Alaska and organized a group of millionaire mining people, and they bought out all the Shep land for about six million dollars. And it belonged to that corporation for many, many years, and of course it's doubled and tripled in value since then. But it's one of the historic places of Idaho. Polly also left another museum piece. It was a blue silk dress. The silk had come from Hong Kong, and it was lined with flour sacks that had held flour made at the Grangeville flour mill. All down the front were little two and a half and five dollar gold pieces that formed the buttons on this dress. But the Polly Creek that's still flowing is in honor of our own little Polly Beamus, the little China doll."
Lola Gamble Clyde,0:05:47,That's really interesting.
Sam Schrager,0:05:49,What do you know about this King Hong fellow?
Lola Gamble Clyde,0:05:56,You say he was a great enigma.
Sam Schrager,0:05:58,Why is that?
Lola Gamble Clyde,0:05:59,"Well, he was very, very wealthy, and he was a great, and he promoted many of the illegal goings on of the Barbary Coast, and he wanted to be quite anonymous, you know. So nothing much is known of him except that he did come to Warren's Diggings during the gold days and brought Polly with him and ran this gambling place there and disappeared after he thought he had killed Charlie Beamus. No one ever heard of him since. So we call him the big, the Greek -Chinese puzzle and that sort of thing. These Warren Diggings at the time were really quite a large gold dress. Yes, it was quite active, and a lot of gold I think was taken out of the Warren's Diggings out in that country."
Sam Schrager,0:06:53,What about Charlie Beamus? Is there any reason to think that he had an eye out for Polly before this gambling? Was he stuck on her?
Lola Gamble Clyde,0:07:06,"No, I think not. I think it was just part of the game, you know. Part of the Chinese puzzle was, and women weren't valued much in those days, and it was just, she was just put up as any other chattel that belonged to the great King Hong, and he lost, and Charlie Beamus won it."
Sam Schrager,0:07:29,Was Charlie Chinese?
Lola Gamble Clyde,0:07:31,"No, he was the white man."
Sam Schrager,0:07:33,"And what about Polly as far as her character goes, or her spirit? What would you say about the kind of person she was?"
Lola Gamble Clyde,0:07:42,"Well, they said she was very hardworking and had a cute sense of humor and very kind, and she did all the things she did do just from force and necessity. She'd been brought up a little bigger on the streets of Hong Kong, and when she was sold into slavery, she just took it into inner stride. That was what the women were for, and I think that that's just about all there is to it, and all the men of that era testified to what fun she was and what a good little cook she was and how loyal she was to Charlie Beamus. And I think that's about all we know about her, you know, that she's one of the folk lore figures from the Salmon River."
Sam Schrager,0:08:33,"What about the idea of her self -sufficiency, or looking out for herself? Was she considered to be very independent?"
Lola Gamble Clyde,0:08:44,"Yes, she was. Yes, she lived alone there in the shack on Polly Peak all those years, you know, and she always managed to make out and never wanted for anything, and there was always food for the wayfaring men that came along that passed along that way. She was quite famous as a Salmon River character."
Sam Schrager,0:09:08,She lived there for a long time after Charlie died then?
Lola Gamble Clyde,0:09:12,Yes.
Lola Gamble Clyde,0:09:14,"I've forgotten just what year it was, she died now, but it was many years anyway."
Sam Schrager,0:09:22,"Was she, you know, did she still keep some sort of a wayfaring house after all this death going on? How she managed to survive there?"
Lola Gamble Clyde,0:09:34,"Well I think that these neighbors, these ships and clinkhammers from the big cattle spread, down through the years they certainly befriended her and brought her food up the river for her and fretted things out for her all the time. It was they who took her to get her teeth fixed to Grangeville, and I've always hoped someday maybe they would take the Polly Bemis body back from where it's buried at Grangeville, take it back and bury it alongside of Charlie out on Polly Creek, but that would be a nice thing for the women's clubs to do. I think so."
Lola Gamble Clyde,0:10:14,And I imagine that she learned to speak very good English.
Lola Gamble Clyde,0:10:21,"Yes, I think so. I think so. Of course all this is really before my time, I just know what the old historians tell about it and the old time stories, but she was definitely one of the early, I think she was one of the first women libbers of Idaho."
Sam Schrager,0:10:38,What makes her a woman's libber?
Lola Gamble Clyde,0:10:39,"Well, because she came up such a hard way, but she managed to become self -supporting and lived alone and kept her little garden and fed the people who passed by, and I think she's someone in early history that we need to think about."
Sam Schrager,0:10:58,How about Mary Arkwright?
Lola Gamble Clyde,0:11:00,"Well, she was a character. That's a gripping, exciting story too. She was born from, yes, oh yeah, she was born in the coal mines fields in Ohio, and she was the unregistered daughter of an itinerant preacher, to put it politely. The Arkwright name had come down through her mother's family, and they seemed to be people of some consequence from England. At very early age, the father was glad to get rid of her, so he sent her to take care of his father, who was blind and a very, very old man. So at 10 years old, we see Mary Arkwright Hutton leading the blind grandfather out into the public parks to listen to the soapbox orators or about lack of work and conditions in the coal mines and the hard life of the laborers. So when Mary Arkwright Hutton was still a young girl, she encouraged about 40 miners from the Ohio country to come in boxcars to the great Coeur d 'Alene country of Idaho, where gold had been found. History says she didn't ride in the boxcar with the 40 men. She had to ride in the coach, but if she'd been given her choice, she'd have ridden right along with the miners as they came west. When she arrived, she'd like to tell later that she rode in on the hurricane deck of a Cayuse, and she got as far as the Lake Coeur d 'Alene. From there, she went up into the mining country at Wardner and at Kellogg. Here she opened a boarding house, and she was a great cook. She was proof of her good cooking. She weighed nearly 300 pounds. It was a gigantic mountain of a woman in her own right. And a fine cook, the meals were served with great abundance. And they said what she lacked in good looks, she made up in her good cooking, and that the men thought there was no more beautiful sight in the world. And when a 285 -pound Mary Arkwright, May Arkwright Hutton entered the dining room carrying an enormous platter with a big pot roast surrounded by vegetables, it was the finest thing they could think of. She ran this boarding house and made quite a little money of her own by careful management and hard work. And then about 1900, she married Al Hutton, who was the railroad, an engineer on the railroad that carried the men between Cataldo and Kellogg. And he was a very fine man too, who'd been orphaned very young and had come up the very hard way. And he certainly appreciated and enjoyed May Arkwright Hutton's fine hospitality and her fine cooking. So he married her. And it was a wedding to remember. They got out invitations to it. Everybody was invited. May cooked her own wedding dinner, and it was all the things that the mining community liked. And they made it a double wedding. And their bridesmaid and best man decided they'd get married right at the same time and save the wedding expenses. They'd share the cost to the minister, and the best man thought they ought to share the wedding presents that May and Al had already collected. But Al Hutton drew the line of that. He thought that was going a little too far. So they kept their own wedding presents. But it was a gala affair. They shot off the fireworks all night, and there was much dancing in the streets to celebrate this very happy occasion. Now Al Hutton made a substantial salary as an engineer on the railroad, and they saved everything they made. And there was a group of them that met at the boarding house, and each of them was saving a little money, and they were buying up mining stocks. A lot of them didn't amount to anything and petered out, and they lost. But each year they kept saving and adding to it and investing in some other stock. And then finally, one lovely, lovely day, two men were walking through the hillside, and they noticed a different looking seam along the line. And they kicked it up and say they had discovered a galina mine too. And it was, they didn't know what to call it, but lying along the edge of the seam, there was an empty powder box, and on it it said Hercules. So they said, we'll call this the Hercules Mine. And the great Hercules Mine came in. And it was a mine that belonged to the butcher, the baker, and the candlestick maker. Everybody that could spare a few dimes had invested in it. And it was dancing in the streets that night. And it was even better than they had dreamed. The two men who discovered it went back out and surveyed and staked it out. And when it was assayed, it was decided that it really was a fine. And down through the years, it has proved that way. And it's still a very much a going concern. Here in Moscow, we have a special stake in the Hercules Mine because Jerry Day of Moscow, who married one of our own mix girls, was one of the organizers and promoters of the mine. And of course, Harry Day has been a great friend of the University of Idaho. Many, many of the wonderful books we have in the library are all presents from Henry Day. And Moscow, too, stood by to profit."
Sam Schrager,0:17:32,Did May Arkwright -Hutton invest in this one?
Lola Gamble Clyde,0:17:36,"Oh yes, she'd invested and so had the husband. And at the end of the first year, their share was over $2 million. So May retired from the cooking business and they built a lovely home in Kellogg. And May started in dressing up and fixing up. And at first, the ladies sort of looked down their noses at her, you know, but she went on to bigger, better things. She became interested in women's libs. She'd always been a women's liberator in her own right, in her independence and in her ability to do things. So she set out to bring liberation to Idaho's women. And of course, in 1895, all the women in Idaho were allowed to vote. We were the second state in the union to see that women were given equal suffrage. So when she had that conquered, she thought she'd go over into Washington and do a little women's libbing over there because women had been given the right to vote in 1883. But about 1890 had been taken away from them again. So to Spokane came May Arkwright Hutton and they built downtown the great Hutton Building. And it was the first penthouse they ever had because the top floor was all made into a huge ornate apartment for Al and May Hutton. Now May was, they called her May Arkwright. She wore the pants Hutton because she believed in wearing men's attire. Not the graceful, dainty little slack suits that you see them wearing today, but the plain old blue surge suits and three cigars in the breast pocket and one cigar in her mouth. She was famous at the women's libs meetings and on the street corners of Spokane. But she felt rather, she felt a little lacking in the proper culture. So she took up studying Shakespeare. She wrote poetry and we have a few samples of that left. But she would hold receptions and she was a great one to patronize all the charities. And the greater the patronage, the more acceptance she gained. The church ladies were all delighted to see her come to those silver teas, you know, because when the rest of them put in their little silver dime or 25 cents, well she just dropped in a five dollar gold piece. So she was very welcome at all those, at all that sort of thing."
Sam Schrager,0:20:22,Did she have much of an effect in Spokane on Al's rights?
Lola Gamble Clyde,0:20:26,"Yes, I think she really did. She really did because she got out and she wasn't afraid to spend money and she wrote and she entertained all the leading political figures of the time. She had Teddy Roosevelt there for dinner and very friendly with him until he made his famous remark about a woman's name should only appear in the newspapers twice, when she gets married and when she dies. So that finished Teddy Roosevelt with May Arkwright Hutton. But she was very friendly with Clarence Darrow when he came to try the Steubenburg murderers, the Hayward, Moyer and Pettibone cases. She was a great admirer of his and also a great admirer of Senator Boras who had done the prosecuting in that very famous case. She was a friend to all the United Mine Workers and contributed money to their fight for better working conditions. She was definitely a woman in her own right. She had very poor taste in dressing, such an enormous figure. She would get out big plushy dresses with wild flowers all splattered over it in great dimensions to match her own. And the Spokane women of that time looked down their noses greatly. One of them said, you know, I think I knew someone that used to board in your boarding house. And May said, yes, your father was the only one that ever went away and didn't pay his board bill."
Sam Schrager,0:22:10,"And once when she appeared in a beautiful new silk dress, another of the society ladies, oh, is that your first silk dress?"
Lola Gamble Clyde,0:22:20,"Oh, no, she said, your husband bought me one 25 years ago. So she had a way of putting the ladies in their places, you know. And some of the poetry was out of this world. One she wrote for an elks convention. And it was something about this was out at Wallace. She said, here in this northern land, the elks come down to drink beside the real. The elks come down to drink their fill. The woods are gone and so is the real. But the elks still come to drink their fill. And this was greatly appreciated. She attended many of the political rallies and was ready to put up money for them. And one of the people wrote a poem for her. It was something about our May, hooray, our gal. Our gal may not be so good looking, but she's going to win this here fight. Words to that effect. And she was very, very prominent anyway in all of these, all of the things that had to do with women's rights and equal suffrage and so on. But time ran out on her in about 1916, the beginning of the World War. She went from women's rights to peace, to trying to keep peace. And she did a lot of work in various peace organizations. But time was running out on her and she sickened and died. But not before Al Hutton had built her a very, very beautiful home up on the south side of Spokane. And it too was designed by this cutter who designed the Davenport Hotel and many of Spokane's very lavish homes. And she continued to entertain there in most lavish style to the consternation of a few other people that lived out on the South Hill. I think she died about 1916 and Al Hutton then fulfilled the dream that they'd had together. And as a memorial to her, he established out on the lovely banks of the little Spokane River a gorgeous place for orphans. He called it the Hutton Settlement. There are four beautiful, beautiful houses out there. Each one has room for 20 children and house parents. And there's orchard, there's farmland, there's garden, there's cows for them to milk, horses for them to ride. There was even a swimming pool and a tennis court. And all these things were most elaborate when he built them back about the time of the First World War. And the interesting thing is that after all these years, there's still a very going concern. It's just a beauty spot out there. Beautiful buildings, beautiful everything. And as a little extra touch, the Northern Pacific Railroad brought in the old engine bell off the engine that Al Hutton had piloted. And it hangs there in the yard at Hutton Settlement to call children who lived there at the settlement in to the different meals. And it's something worth seeing. And out in the beautiful Fairmount Cemetery are two beautiful pink marble monuments that stand to Mr. and Mrs. Al Hutton, lovers of little children."
Lola Gamble Clyde,0:26:13,"One thing that I wonder about with her, the story that you tell, is that if she was such a friend of the laboring man, I'm surprised that she could get along with the rich so well. Because you don't think of them as having the same interests at all. You think of the, I would think that the wealthy people wouldn't want to have much to do with her kind of politics."
Lola Gamble Clyde,0:26:36,"Well, I think there were a lot of people interested in women's right to vote. And of course, she didn't live to see it become a part of an amendment to the United States Constitution in 1920, that all women would have the right to vote. And I think there were a lot of wealthy people at that time who wanted to see this past. And she had a big following. She was a character, but she had a heart to match her physical size. And I think that she made a great contribution to the welfare of the world in promoting the women's right to vote and women's right to share in the decision making of the world. And I certainly have always thought that Al Hutton must have been a very fine, wonderful man, because he stood right by her through all her work and all the glory and the dreams he shared with her."
Lola Gamble Clyde,0:27:45,"Did she play a role in the Idaho women's suffrage movement, or was that a little before she... No, she did. She led it for Idaho."
Lola Gamble Clyde,0:28:01,"And Susan B. Anthony was one of the people that she entertained a lot. All the things that had to do with women. Carrie Chapman Catt, all the early day people that dealt with women's rights and prohibition and that sort of thing, knew May Arkwright Hutton. And she seemed to share the common dream that they all had of doing this for women."
Lola Gamble Clyde,0:28:33,"Yes, you know, yes. The year of the bullpens, when all our boys from the university were sent up there to guard the laborers, they rounded up a thousand of them and had them in what they call the bullpen. And she printed leaflets and got out for them. And she would go out to the stockades and bring in dozens and dozens of pies that she baked for them. And she was continually visiting to cheer them, bring them news from the outside world, and to protest loudly and longingly the treatment of the miners. And of course, when they commandeered the train, you know, and ran it down off the hills, they carried, they had it loaded with dynamite, and they ran it down through the mine and exploded and blew the whole thing up. May Arkwright Hutton and her husband were foremost in organizing it and getting it going. They were definitely, they were very definitely friends of the laboring people. And it had been ground into her from infancy because she had been born and abandoned back in the coal mines of Ohio."
Sam Schrager,0:29:58,Did she go back to Kellogg to live or did she go into Spokane?
Lola Gamble Clyde,0:30:04,"No, after she went into Spokane, she became one of the leading figures in Spokane. She was one of the real characters of Spokane. And she did go home once. And she was very good to these half brothers and sisters of hers. She shared her wealth with them and that was, all those things were certainly to her credit, very much so."
Lola Gamble Clyde,0:30:35,"Okay, now I want to ask you about Molly Bedem."
Lola Gamble Clyde,0:30:39,"Oh yes, she's another lady from the mines. And Molly Bedem is one of the great characters of the Murray mining country. Tradition at least has it that she was a very young, innocent, loving and lovely wife. And her husband got terribly in debt and got into many, a lot of trouble in other ways. And she wanted to get him out of prison and help pay off his debts. So there was only one way open to women at that time and that was through prostitution. That's the only way women knew to make money at that time. So she too entered the field of prostitution and she came to Murray. And the story is, the story is that the owner of the saloon, her name was Molly Burham."
Sam Schrager,0:31:43,"Burham, is that right?"
Lola Gamble Clyde,0:31:47,"And he took her into the saloon to introduce her to all the miners gathered there. And he wanted to say that this was Molly Burden of the Madame of Murray, just to identify her so the men would know who she was. So he did, he said he wanted to present to them Molly Burden, the Madame of Murray. But the miners thought he was saying Molly Bedem. So Molly Bedem, she became and she ran the little houses of prostitution that lined the row."
Sam Schrager,0:32:29,"And someone asked her once, now where do you live?"
