speaker,timestamp,words
Lola Gamble Clyde,1:32:29,"About 1200. Oh, we had more than that. For a while we had over 2000 through those bad years when you couldn't make expenses. See, we had about 2000 acres and there'd be nothing left, just nothing. We didn't have fertilizer in those days. If we got 40 bushels, we just thought we were in heaven. We just thought we had the most wonderful crop. We didn't fertilize. But there was no market for your weed. Oh no, 22 cents a bushel. You know, no, there was no market. So no wonder we all thought that Franklin Roosevelt was the most wonderful person that ever lived. It was the first light in the tunnel, at the end of the tunnel, was Franklin Roosevelt. I remember him saying, we have nothing to fear but fear itself. I just sat here and heard it on the radio. Oh dear. No wonder it was God to us. He was God to us."
Sam Schrager,1:33:32,Was that hard for you?
Lola Gamble Clyde,1:33:34,You came out of a real Republican family.
Sam Schrager,1:33:36,Was that hard?
Lola Gamble Clyde,1:33:38,"No, I became a Roosevelt. I became a Roosevelt Republican right then and there and I have been ever since. Oh, I tell you, he was wonderful. It was the first caring for the common man that we'd seen and with the coming of electricity. It just revolutionized life on the farm. No water, no electric iron, no heat, no nothing, no lights. And here came, we could read again, the children. They couldn't tell the difference between the country children and the town children in the town schools anymore. Before the dirty ones, the big gravel ones, the ones with dirty hair and dirty necks. Those were the country kids. And now here they were as clean and sparkling as anybody. Little dresses washed in iron until they shone, you know. And no more of that ironing on those old wood stoves and couldn't get the irons hot. And oh dear."
Sam Schrager,1:34:39,When did that come in?
Lola Gamble Clyde,1:34:40,"About 37, about 37. And it just revolutionized life. The water, we had running water in the house, toilets in the house, no more going out to Mrs. Jones through four feet of snow and dragging the babies with you. Oh, you will never, no one who hasn't gone through it can know what it meant. Why, no wonder we thought Franklin Roosevelt was God. It's just no wonder. And we had begged Washington Water Power to give us some, the line, Washington Water Power went right through our land. We gave them an easement to go through the land. And we asked, we said we don't want any money for an easement. Give us some electricity off of it. Well, if we put in our own transformer, they would give us 500, they would charge us $500. Well, nobody had $500."
Sam Schrager,1:35:33,"500 for what, just to hook you up?"
Lola Gamble Clyde,1:35:35,"Yeah, to hook us up. We'd have to build a line and part ways and put in a transformer to bring the high -powered electricity down to our unit. Well, we didn't have it. So when REA came with that electricity, oh, it just made a new life for everybody. It was just wonderful. No one, go out to the barn at night without that lantern, go out and turn on a switch and there were your cows and your horses and you could take care of them. No one will know what a difference it made. Oh, dear. I think that instead of the before BC and after BC, it should be before electricity and after electricity. I really do. It was wonderful."
Lola Gamble Clyde,1:36:20,It made a new world for us.