speaker,timestamp,End Time,words,tags
,,,,
Doug Exton,[00:00:00:00],00:00:15:20,"So I want to say thank you to everyone for joining tonight. And thank you to Dan for joining us from the Wassmuth Center. Dan, if you want to just introduce yourself really quick.",
Dr. Dan Prinzing,[00:00:15:22],00:00:21:23,Hi. Dan Prince in the executive director at the Wassmuth Center for Human Rights. And delighted to be with you this evening.,
Doug Exton,[00:00:22:00],00:00:37:23,"Awesome. So tonight we'll be talking about the Anne Frank Memorial downtown Boise. So I guess my opening question is, do you wanted to talk about how it how the memorial itself got created, the purpose behind it?",
Dr. Dan Prinzing,[00:00:38:00],00:01:01:00,"Well, it's a great question, Doug, and actually very timely because it was actually 25 years ago that the national exhibit and Frank in the world was brought to Boise. That exhibit was attended by over 50,000 people from throughout the state in one month's time. And it was the exhibit that planted the seeds for building a memorial to human rights in downtown Boise.",
Dr. Dan Prinzing,[00:01:01:02],00:01:23:24,"So we are, in fact, celebrating the 25th anniversary of the idea, the importance of what would a memorial to human rights say and represent within the state of Idaho. And so it is really out of that history of how and an exhibit that was so well attended. And, you know, frankly, I get a lot of questions, especially from students.",
Dr. Dan Prinzing,[00:01:24:00],00:01:41:01,"Well, when did Anne Frank come to Idaho? Why Idaho with. Yeah. Well, as we know, she never came to Idaho. But something in her story that so resonated with those who attended the exhibit that that's what fueled the idea for a permanent tribute.",
Doug Exton,[00:01:41:03],00:01:56:23,"Nice. Oh, that actually answered the follow up question, which was why? And Frank specifically, is there any other reason, actually, why Anne Frank, was used as the inspiration icon for Human Rights Memorial?",
Dr. Dan Prinzing,[00:01:57:00],00:02:28:03,"I mean, I always tell groups that are on docent led tours of the memorial that really the memorial is a tribute not to the person, but to the power of her words. It was the words that and crafted in her diary that so resonate. It is her hope for humanity. Yeah. Was in this un speakable horrors of the Holocaust in which she had crafted such an important message for who and what are we?",
Dr. Dan Prinzing,[00:02:28:05],00:02:55:18,"You know, I there's one particular diary entry, and we actually have it etched into the stone of the memorial, which she questions, why is this happening? Just because we are Jews, where she really begins to question when we begin to target the other. And of course, we define the there as someone targeted, demeaned, marginalized by race, religion, orientation, ethnicity, gender, ability, whatever factor be in there.",
Dr. Dan Prinzing,[00:02:55:19],00:03:28:02,"And she really begins to question that. And I think it was in that that her story resonated that people began to identify with, here was this young lady, a teenager in captivity or hiding for two years. Before being rounded up by the secret police and sent to the concentration camps, who had captured so much in her diary. And once again, it's the power of those words that I think really resonated with visitors to the exhibit.",
Doug Exton,[00:03:31:17],00:03:44:13,"Given Idaho's history with hate groups, especially in northern Idaho. Do you mind touching on just that history a little bit? If you're able to.",
Dr. Dan Prinzing,[00:03:44:15],00:04:13:16,"But I think that adds significance to the presence of the memorial. The if we take it back historically. So it was the late 70s and early 80s when that Aryan compound existed in North Idaho. And it's when we're name to film. We are as a center for human rights. Well, Bill was the Catholic priest in Portland who was asked to be the spokesperson for the Kootenai County Task Force on Human Relations.",religion;conflict
Dr. Dan Prinzing,[00:04:13:18],00:04:41:08,"It is said he was a very charismatic priest, and he chronicles in his book Hate Is My Neighbor, which I highly recommend for folks that are not familiar with this chapter in our history. It is a wonderful look at what was actually transpiring in North Idaho that really impacted throughout the state. But in his book, he actually talks about the part of the reason that he may have been approached to become the spokesperson was the fact that he was a priest.",religion
Dr. Dan Prinzing,[00:04:41:13],00:05:06:02,"He did not have family because they knew ultimately, if he was put in on the front line there, his life would be in danger. And so which obviously then as part of his life story, he became certainly that which we model our work after. What do you do when you're confronted by hate? Well, Bill never shrunk. He never stepped back.",
Dr. Dan Prinzing,[00:05:06:06],00:05:34:06,"He got louder. He got more passionate. He said, how do we confront hate with it? So I think it begins to tell us a very interesting story of how did the memorial came to be. When we come out of that history of the compound, we come out of the history of those in Coeur d'Alene who stood up against the, and then we have to, bring the story a little forward to 1993, when there was an initiative on ballot.",
Dr. Dan Prinzing,[00:05:34:08],00:06:03:10,"It was called proposition one, and it was an anti-gay initiative. In other words, really restricting, rights of the LGBT community in the work force and in housing in any service is with it. And what we saw at the time was that the general populace react to that and said, no, this is not who we are. We are not a state of hate.",
Dr. Dan Prinzing,[00:06:03:15],00:06:25:15,"Even though we seem to have this preponderance of folks that are wanting to craft us as that. And so the populace gathered up and formed a no on one campaign. It's actually when the Ada County Human Rights Task Force coined the phrase that we still use today. Not in my town, not in my state. Idaho is too great for hate.",
Dr. Dan Prinzing,[00:06:25:17],00:06:53:20,"And proposition one was defeated at the ballot. So it was after that then that this exhibit that was traveling the United States initially, those that were, advertising the exhibit made contact with Marilyn Schuler. She was that then director of the state's human Rights Commission and asking if we might be interested in the state of Idaho to bring the exhibit to town.",
Dr. Dan Prinzing,[00:06:53:22],00:07:22:01,"Well, Marilyn, as we do, and all nonprofit work began fundraising because it was a pricey exhibit. But with some corporate support and an extensive volunteer network, it brought the exhibit to Boise for one month's time. We talked to about those who had attended, but what it also did was it created this force within the community to say, hey, this is really who and what we are.",boise
Dr. Dan Prinzing,[00:07:22:03],00:07:47:05,"It is not that branding that came from an Oregon compound. It is not this branding that, dare I say, was being proposed by the state legislature. It is, in fact, that we are much greater than hate. And let's create this symbol a the memorial as something of our shared values, that this is really who and what we are.",
Doug Exton,[00:07:47:07],00:08:12:02,"What so I guess my follow up question would be, is that the fact that the population is centered in Boise, and that's considered like the main hub of Idaho? Is that the reason why the memorials in Boise, rather than up north, where the Oregon compound was kind of as this sign, like even here where this hate is centered, we are still about who.",
Dr. Dan Prinzing,[00:08:12:04],00:08:36:21,"Yes. Well, and I think there's a two parter to that, Doug, because what we do in quarterly has a human rights institute. They were founded out of the the confrontation with the King compound to really become that education force in North Idaho for human rights education within schools, then great car. Major Idaho philanthropist devoted to human rights.",
Dr. Dan Prinzing,[00:08:36:21],00:09:02:01,"And of course, we know more. Great story today saving the country of Mozambique and is working Gorongosa National Park. But Greg actually provided the funding for the purchase of the former Aryan compound to become a peace park in North Idaho. And so there's always been that presence. Now back to your question. I think it's always been symbolic that a human rights memorial would be built in the state's capital city.",
Dr. Dan Prinzing,[00:09:02:03],00:09:34:15,"Yeah, I like to reference actually that because of our location right in the heart of the city, that we are, in fact, the heart of the state, that we are where we are. The beating behind this force for good, that what does the memorial represent? What does it say about us as a people? You know, so often when I give tours in the memorial, I introduce the fact that the Idaho and Frank Human Rights Memorial is the only and frank memorial in the United States.",
Dr. Dan Prinzing,[00:09:34:17],00:09:53:24,"It's also one of the few places in the world where the entire text of the Universal Declaration for Human Rights is on public display. And it's also recognized as an international site of conscience. So usually when I have introduced that in the tour, the first question I get is, well, how the hell did that happen in Boise, Idaho?",boise
Dr. Dan Prinzing,[00:09:54:03],00:10:26:20,"And I think it speaks to that history that that put it in place, that there was an import and a statement that was made. Now, with your question, with the I think we also have to recognize the nature of Boise and the nature of those folks that live here, that so embrace the idea of the memorial. I'm always apt to share it that the memorial was not built by the city of Boise, nor was it built by the state of Idaho.",environment;boise
Dr. Dan Prinzing,[00:10:26:22],00:10:57:03,"It was built and funded by individuals, businesses and foundations who said, yes, this is who we are. And I think it is that nature of something that was such a a start from a grassroots campaign that that's why it has such import today. I've often said that had it been built by a state or a municipality, almost like a top down approach with it, it would have been an imposed idea, but rather this was a groundswell.",environment
Dr. Dan Prinzing,[00:10:57:05],00:11:25:15,"This was an idea that germinated and said, yes, we support this. I've often credited to the our initial board, the first board of the business center, and really crafting the vision for the memorial. And we recognize we have two visionary or excuse me, three visionary founders. Affectionately I call they are our founding mothers. It was their idea that generated what we have become.",
Dr. Dan Prinzing,[00:11:25:17],00:11:47:13,"Well, it was really that support that they were able to garner from a population for an idea. Nobody knew what the memorial was going to be. They were putting out an idea for this symbol, this place that now in many terms, for many folks in the valley, it's sacred. This is sacred land for what it represents with it.",education
Dr. Dan Prinzing,[00:11:47:19],00:12:09:04,"But I've often thought how they were able to fundraise for an idea. I can tell you just a couple of years ago, when we had the Maryland Schuler request for human rights within the memorial, it was a lot easier fund raising for that classroom than it was for the initial funding of the memorial, because we weren't we weren't selling an idea.",education
Dr. Dan Prinzing,[00:12:09:04],00:12:14:13,We were selling an actual this is what exists now. Can we expand upon it?,
Doug Exton,[00:12:14:15],00:12:25:00,"Going off of that? Do you have any future plans for the memorial, or do you have to wait to see what happens with the potential downtown library expansion or anything?",
Dr. Dan Prinzing,[00:12:25:02],00:12:52:18,"That's a good question. Actually, I do appreciate. Shortly after she took off as mayor, McLean, called me in, and we actually talked about because if you're familiar with our physical location of the memorial, but also our office, the joints, the memorial. So we're right there within that hub. And so the mayor really wanted to examine not only all of that property and space, but then that to your question, what are our future plans?",
Dr. Dan Prinzing,[00:12:52:20],00:13:15:15,"Well, what we have promised the city is we have tapped up the space at the memorial that when we added the Marilyn's to the classroom for Human Rights, we actually expanded the memorial, almost a third in size. What we have with the city is a licensing agreement. Okay, it is city land. That's why it is recognized as a public park.",education
Dr. Dan Prinzing,[00:13:15:17],00:13:39:04,"But we control all the messaging and the programing within that. Now that also comes with the caveat. Even with the addition of the Marilyn Schuler classroom, I had to go to the city for approval. We wanted to add this physical structure within it. Know I had to get the approval of the city. And with their blessing, then they said, now go out and fundraise for it.",education
Dr. Dan Prinzing,[00:13:39:06],00:14:09:17,"In other words, they were not going to fund it, but they had to certainly be in the loop to approve it and what it would be within the city. So that all occurs within our licensing agreement. Now, what we're very excited about is this city has now agreed to expand that license agreement, and we are in preparation to fundraise and physically build a new was in the center for Human Rights.",
Dr. Dan Prinzing,[00:14:09:19],00:14:31:11,"Within that licensing agreement will actually where our current office is located, in a small parking lot that adjoins the memorial. The city is providing a piece of a parcel of land that joins right to the back side of the memorial, and that's where will actually build the new office with it. Well, what I'm excited about is what it couples together.",
Dr. Dan Prinzing,[00:14:31:13],00:15:11:20,"So here we have the only and free memorial in the United States. And now imagine a comprehensive human rights education center located within that physical licensing of a memorial. No other city, no other state can say that. Yeah. And I said, if we really want to protect ourselves as a welcoming and a compassionate community, what a positive statement to have not only the memorial, but this education entity that is devoted to that, devoted to taking the memorials message and sharing it with communities in classrooms around the state?",
Doug Exton,[00:15:11:22],00:15:33:13,"Yeah, I think that's a really interesting. I never knew that. And I also never knew until I honestly, until I worked at the HCA, I never knew the walls of the center was a thing. I never thought, oh, look, this is a memorial, but it's also owned by the city, but it still has, you know, a private entity governing it, essentially.",
Dr. Dan Prinzing,[00:15:33:15],00:15:54:23,"Well, and actually, you're not unique in that. And that has always been one of our greatest challenges, because the center has never operated under the same name as the memorial. Even though we are two entities. It is us and we are it. And we were found. So as I said, it was 25 years ago that exhibit came to town.",
Dr. Dan Prinzing,[00:15:55:00],00:16:19:00,"Well we were founded a year later. Next year is our 25th anniversary as an organization, because we were founded for the purpose of constructing a memorial to human rights. And then once the memorial was dedicated to the public in 2002, we then became recognized as the memorial's education arm, that we are in charge of the programing on site, off site and online.",
Dr. Dan Prinzing,[00:16:19:02],00:16:46:18,"But many people know, especially in the education community, they know our work as the Wassmuth Center without the memorial. Most folks know the memorial without the realization that there is an education center behind it. And so, yes, you've just spoken to one of our greatest obstacles as an organization is just messaging that fact that it's us and we are it.",
Doug Exton,[00:16:46:20],00:16:51:07,How did you actually end up getting involved with the center?,
Dr. Dan Prinzing,[00:16:51:09],00:17:14:00,"Well, I am old, you know, so I've been around a long time in the valley with it. It actually goes back to when I was a classroom teacher in the Boise district, when that first exhibit was going to come to Boise, a volunteer group formed a committee of educators to write classroom lessons to prepare students for coming to that exhibit.",education;boise
Dr. Dan Prinzing,[00:17:14:05],00:17:46:16,"I was on that first curriculum team when I left the classroom and went to the state Department of Education. I then drafted the first joint project between the state and the center, in creating a scope and sequence of human rights lessons for the classroom. When I left state government at the end of Doctor Marilyn Howard's administration, I came to the center as the education director.",education
Dr. Dan Prinzing,[00:17:46:18],00:18:12:02,"And coincidentally, Marilyn Howard came on to the board of directors. So we continued to work together in the capacity or under the umbrella of the Cosmos Center. So I've often said I have been around since day one, before there was a memorial. And now, as I proudly tell my board, I am not their oldest employee, although I am their longest employee.",
Doug Exton,[00:18:12:04],00:18:29:22,"Now, with your expansion and also the Wilson Center's 25th anniversary, are there any plans for special programing? So I know right now you offered the certificate to Human Rights? Yes. So is there any additional programing coming down the road that you can let us in on?",
Dr. Dan Prinzing,[00:18:29:24],00:18:58:05,"Well, there is, and actually, with the added environment of Covid, we've been it's really looking at what we do and how we do it. How do we continue to engage participation and our broader donor base. So we've got a couple of pieces for it. I've said. I just completed drafting our summer newsletter, and as I was reporting, there's only one piece of our operation that we're not able to do right now.",
Dr. Dan Prinzing,[00:18:58:10],00:19:19:13,"And those are the physical tours in the memorial. We suspended all physical programing in the site, just simply because I did not want our docents exposed to something I did not want participate. We have a phenomenal summer reading program for ages 4 to 8. Well, we just did not quite know how we were going to social distance four year olds.",
Dr. Dan Prinzing,[00:19:19:15],00:19:45:20,"And so we we adapted. And that volunteer committee has done phenomenal work in creating a brand new resource for us. So by the end of this month, rather than the summer read the summer reading program occurring, we have now finalizing the production of 25 videos. The readers engaged in that program reading the stories for children. The backdrop is always the memorial.",
Dr. Dan Prinzing,[00:19:45:21],00:20:17:13,"They're filmed in the memorial, and they're sharing stories of hope and kindness, diversity, inclusion, empathy, mindfulness, young literature with it. So now we've created a whole new series that will be posting on human rights for young listeners. Well, myself, I was a single father for a number of years when my daughter was very young, and this was something I would have loved to have had with, okay, let's dial up and listen to this story together, rather than me always finding the books that I had to read each evening.",culture;literature
Dr. Dan Prinzing,[00:20:17:19],00:20:44:01,"Here was something that we could have shared and then talked about. So we're really seeing this as a phenomenal resource to share. And of course, as you well know, what's the anything goes online. It's not just local, it's a national or international resource. So that's part of our new program. We are also finalizing the pieces that we'll be distributing in to the schools in the fall of our Upstander toolkit.",
Dr. Dan Prinzing,[00:20:44:03],00:21:07:10,"If you're not familiar with it, borne out of the messaging in the memorial, the center has two key programs the Spiral of Injustice. It's really how we look at and how do we frame the discussion of injustice as it devolves in a community. And it's a whole model that we created that really demonstrates that injustice starts with words.",
Dr. Dan Prinzing,[00:21:07:12],00:21:41:15,"It's language. It's the essence that them, when we begin to target the other, devolving from language to avoidance, discrimination, violence, elimination. Well, the companion piece to that was our Upstander program, that how do we confront injustice, we confront or interrupted by being an upstander. Now it's clarification. As a center, we never really developed an anti-bullying campaign. We're not really a good on the anti message.",
Dr. Dan Prinzing,[00:21:41:19],00:22:24:12,"What we wanted to look at were the positive actions that each of us can take when we hear or witness injustice. Even now, this was really born to us. Not to get political, but after the, campaigning in 2016, schools became just this battleground of words. And we had many parents or counselors or teachers calling us, saying, my student has just been targeted at school and being told they need to leave the country, that he or she is not welcome here, and we're building a wall.",education
Dr. Dan Prinzing,[00:22:24:14],00:22:50:08,"I mean, this was rhetoric that coming out, and we have to remember that whatever is playing out nationally, it's going to come into schools. Yeah. Kids here kids bring it with them into the classroom. And one mother called me just distraught with a year. Her son, a young fifth sixth grader, is on the playground surrounded by his classmates, taunting him.",education
Dr. Dan Prinzing,[00:22:50:10],00:23:17:01,"You need to leave this country. You're not welcome here anymore. And she said, what so bothered them at the moment is there wasn't a single classmate who stood up in his defense. There were no up standards at that moment. And she said, and you know what further exacerbates it? We're Native American, and we were here first. And she said, here is this whole concept of where are the up standards?",
Dr. Dan Prinzing,[00:23:17:01],00:23:38:05,"Where are those who are going to be willing to say, hey, wait a minute. That's that's not cool. That's not right. We don't do that here. So back to the point with so this summer we're finalizing our Upstander toolkit. It's a new classroom poster, a student brochure, student takeaways, that they can keep with them to remind them.",education
Dr. Dan Prinzing,[00:23:38:07],00:24:01:23,"And a brand new video. We're in production this month on a new seven minute video on really? How do I act as an upstander? Now we use the acronym Act. The act as our action to be an Upstander. The A is ask. Okay, when you just said that joke or said that word, did you mean to be cruel?",
Dr. Dan Prinzing,[00:24:01:23],00:24:26:15,"Do you really know what that means? In other words, can we ask questions to create good conversations? What we're also working with is programing that can we confront injustice without becoming confrontational? Can we create a conversation? I still believe as a career educator that oftentimes things are set in ignorance. People don't realize the impact of the words. So can we call them out?",
Dr. Dan Prinzing,[00:24:26:16],00:24:59:13,"Can we have a conversation? So that's the ask. The C is choose. You choose to be an Upstander. It is a choice that is made that we actually reference in the memorial. When we were adding the Maryland Schuler Classroom for Human Rights, we had a funder from the East Coast. He wanted to find a special rock, tribute plan with a tree to add a message into it.",education
Dr. Dan Prinzing,[00:24:59:14],00:25:37:21,"Well, this funder is a descendant of a survivor, Descartes from the Holocaust. His family survived the Holocaust because an evangelical Christian man in Poland who owned a glass factory saved or protected his employees. And he's descended from that. And there was one key word that he wanted on the tribute in the memorial. He said, can you highlight the word that this man, Reinhold Christman, chose to make a difference?",labor;religion;migration
Dr. Dan Prinzing,[00:25:37:23],00:25:59:11,"So that's our whole attitude between that attitude of being a upstander is that it is a choice just as much as being a bystander is a choice. It is that point of reckoning where I have to decide, am I going to step in or am I going to be silent? Well, what we also showcase is silence is also a form of agreement.",
Dr. Dan Prinzing,[00:25:59:13],00:26:40:12,"So if injustice is happening and I say nothing, it's as if I am standing there in agreement with what is occurring. The rest of the acronym for T is teach, teach by example of how you lead your life. I'm always taken back to Martin Luther King Jr in his Drum Major Instinct sermon. He used the line that he said, when I pass, when someone is asked to give my eulogy, do not let them say, I won the Nobel Peace Prize or let them recount that I loved and served humanity.",religion
Dr. Dan Prinzing,[00:26:40:14],00:27:05:17,"It was how he lived his life. So that is the T. Not only we do, we choose to be an Upstander but we live that. We, we're always happy to say that upstander is not a noun. Or if it is a noun, it's also a verb. And in other words, if you never see me as an upstander, how dare I call myself that?",
