speaker,timestamp,End Time,words,tags
Raffi Andonian,[00:25:11:19],00:25:45:15,"Virginia Declaration, independence, complete the ideals that Thomas Jefferson wrote about. Complete the ideals that if we go before United States, folks like John Edwards and John Winthrop, we're talking about that new birth that both Edwards and later, Abraham Lincoln, the new birth of freedom, referred to while still providing an economic opportunity for everyone. As we saw with Jamestown, having that economic opportunity be a key part, because remember, at the time, England was a poor nation.",
Raffi Andonian,[00:25:45:17],00:26:11:15,"So whether we're looking at the colonial era, looking at the revolution, looking at the expansion West, the Civil War, the Second World War, the Army of Liberation, the civil rights, and today, with the money in our pocket, we see these themes of the American Dream being defined, redefined from any. My thought process. And of course, having folks raise the questions of who gets to participate.",history;conflict
Raffi Andonian,[00:26:11:17],00:26:34:15,"I want to cover these issues a lot, and you can find me in doing so on television, but also for free, both on my own TV show and local TV stations. If you check out the YouTube channel Celebrity History, and you see a lot of my content posted there with my appearances across the country or any of the websites you see down the middle there, more about me at Rothesay and Domain.com.",
Raffi Andonian,[00:26:34:20],00:26:58:01,"Or if you want to watch my TV show where I deal with some of these issues in the present day with interviews of live people. Today you can go to the museum slash watch free access as well, or celebrity historian.com to find more of the variety of things I put together to help us discuss how we remember historic sites and how history tells the stories of the American Dream and who gets to participate.",
Raffi Andonian,[00:26:58:03],00:27:24:16,"And so with that, we'll bring this tie to a conclusion, to tie together and understand that across the centuries, we've always been debating the meanings of the American dream. It is nothing new to do. So today it's been going on for centuries, and we'll continue on. And that's why in the United States we have such wonderful dialog on these issues.",
Doug Exton,[00:27:24:18],00:27:47:11,"Wonderful. Thank you so much for the wonderful presentation. And, you know, the journey you took us through, you know, throughout the history of the US and the different people involved, but also the different perspectives, as you mentioned, with that one painting of manifest Destiny, who was it you know, serving and who was it hurting and who was being left out in that notion of the American dream in that time?",
Doug Exton,[00:27:47:13],00:28:06:09,"So one of the questions that I do have for you, what role do formal organizations such as museums and archives play in contributing to the belief of the American dream? And I know you spoke on how you've served your multiple various capacities, both at Gettysburg and also at Martin Luther King Junior's house.",
Raffi Andonian,[00:28:06:11],00:28:29:07,"Yeah. I mean, I think that the museums and archives, I mean, are critical. I mean, for example, one of the documents I pulled up was the Virginia Declaration. Right. An image of the document. Right. That's from an archive. But museums tell these stories, right? Museums are artifacts. I pulled out a couple of these right here. And this, you know, to me, they're not exactly artifacts, but they are material things that connect us to the past.",
Raffi Andonian,[00:28:29:09],00:28:59:02,"Now, of course, to get actual artifacts. These things are a way to tell the story and convey and help people remember that, you know, these issues are ongoing, have been happening in the past. But also, I think people forget the power that museums have to construct a narrative. And I think museums need to take that very carefully, because what happens is, you know, if you have inaccuracies in there, it starts to become a problem because there's credibility to an institution.",literature
Raffi Andonian,[00:28:59:02],00:29:19:23,"Right? So we have to be very careful as institutions, whether we're doing programing or have artifacts or whatever it is, we're doing public facing stuff to make sure that, we're being accurate. But also, I think multi-layered. There are multiple perspectives that are correct. Right. And those perspectives all should be represented, both the George Washington and Maya Angelou.",
Raffi Andonian,[00:29:19:23],00:29:45:07,"Right. And so I think that museums and, and archives and public sites are critical to doing so, as you saw with the story, with the slaves that I met, you know, look how important the public site was to them in interacting with the American dream. Right? That is what makes it real. I love reading, I have 3000 books, but there is a difference between that which you need to do also, but making it come alive.",
Raffi Andonian,[00:29:45:07],00:30:13:10,"My interest in history came when I was a little kid in fifth grade, going to Philadelphia, seeing Constitution Hall and seeing the old rowhouses. To me, that made history come alive. I was a kid in California. I had no connections to the East Coast. My parents are immigrants. I have no connections to the American Revolution. From a family lineage standpoint, I'm the first generation born in the United States, but when I went to Philadelphia, history came alive for me.",education;conflict;history
Raffi Andonian,[00:30:13:12],00:30:30:21,"And it's from that moment, obviously, that look what I have grown into, right? Having an interest in this and trying to do it for the public. So that's the power that these sites, museums and archives have been telling these stories, inspiring people and also making sure that we have degrees of accuracy with multiple perspectives.",
Doug Exton,[00:30:30:23],00:30:52:00,"And how is nationalism and symbolism, you know, impacted the American dream as a concept? You know, I definitely think this, you know, circles right back to the painting. You show it as one of those examples. I was wondering if you can expand further and maybe talk about some other examples that have been really dominant throughout history. You know, like Uncle Sam, you know, the little Uncle Sam, once you poster stuff like that.",
Raffi Andonian,[00:30:52:02],00:31:10:19,"Yeah. World War Two is very much, you know, has nationalism involved. Right. It's Western expansion, Cold War. Right. You think about the Cold War that I think needs its own treatment. Nationalism is a big part of the American dream. Think about, for example, in the context of the Cold War. In the Cold War, you had these this binary, right.",conflict
Raffi Andonian,[00:31:10:21],00:31:31:16,"You have the stark contrast right, between the United States, which is the land of liberty. And of course, you know, the evil empire is where you call it with the USSR. Right? Doesn't end there. There's a series of, you know, engagements and all kinds of foreign operations that we as the United States are involved in because we're worried about the spread of communism.",
Raffi Andonian,[00:31:31:20],00:31:54:00,"Right. There's a domino theory, which was what, you know, is partly what leads to the war in Vietnam or some of our relations in Latin America for decades. So it's not just about Russia, right. And the Russian Empire, but really what I think is that in that process, you have a nationalism that's developing that says, look, our way in the United States is the right way.",conflict
Raffi Andonian,[00:31:54:00],00:32:18:09,"And those that other way, the contrast is the wrong way. Right. And in that process, the very famous moment I remember is the kitchen debates. Now, I don't remember it personally. I was not around, but but you have U.S. President Nixon meeting with the leader of the USSR. And what's happening is, you know, in the USSR, in the Soviet Union, you have, I think it's like three choices for the for the, kitchen gadgets.",labor
Raffi Andonian,[00:32:18:09],00:32:39:02,"Right. And the kitchen appliances in the US, you have, you know, countless choices and one is saying you don't need that many choices and the other is saying no part of what freedom means that you have all those choices. So if you like. So that again is both ideology and economics, right. Like these things are connected like Virginia and Massachusetts in the colonial days because the ideology of freedom.",history
Raffi Andonian,[00:32:39:02],00:32:58:19,"Right. Well, what if we the mean it means I can consume more, I can consume differently. Right? And I can have these gadgets in my kitchen. And that is what the kitchen debate symbolizes, this way of life argument. And there's a material part attached to that because there's prosperity. And you saw in the Virginia the Declaration of Rights, they're talking about life, liberty, pursuing happiness and property.",
Raffi Andonian,[00:32:58:19],00:33:34:22,"These things are connected, right. Or if I'm going to come out of school and buy a house, well, that's again property. We're talking about material things. This is always been part of the American dream. Right. And so the nationalism part to me is often used to contrast against other ways that are incorrect, whether it's the, perceived savages of the West who are one with nature and not civilized in the perspective of these folks, of course, to the to the fight we have, you know, with the Soviet Union in the Cold War, two, of course, ourselves being the Liberation Army in World War two with issues that were not directly connected to us, but eventually",education;environment;labor;conflict
Raffi Andonian,[00:33:34:22],00:33:52:23,"kind of come into our scope, in part because of diplomatic alliances, because but you cannot separate diplomatic alliances and nationalism altogether. And that's part of the reason we come into the war later, this Second World War. We coming to it later compared to much of the rest of the world. So nationalism is intimately intertwined. And I finally had more recently.",conflict
Raffi Andonian,[00:33:52:23],00:34:11:24,"When you look at presidential slogans, they're very much playing on nationalism. Right? And when you think about, you know, Donald Trump and you think about Make America Great Again, Make America Great Again is, of course, a reference to many things, but it is referring specifically to an image that is how that is being portrayed of making the United States great.",
Raffi Andonian,[00:34:11:24],00:34:29:05,"Again. That is some kind of you know, I think that's a, to me, an echo of the city on a hill, right. You're thinking about the shining moment that we had or and you want to bring it back. And what that means also, though, is nationalistic because it's an America first policy. Right. That's that's literally what he would say is America first.",
Raffi Andonian,[00:34:29:10],00:34:36:21,"So the nationalism and that opportunity are very much intertwined. It's not always in war, but also just in our rhetoric.",conflict
Doug Exton,[00:34:36:23],00:35:14:02,"In America has always kind of been described as, you know, a melting pot for various cultures as a way of kind of defining what American culture means, you know, just given the history being so unique compared to, you know, European countries or other countries across the world. but historically, when those various cultures, you know, enter the melting pot, they're not always represented in the national rhetoric or the national imagery, you know, because as you're saying, a lot of it's more of the, oh, if you were a white, not oh, if you were Irish or French or German or something like that, you kind of it forces that, you know, blending inherently.",
Doug Exton,[00:35:14:04],00:35:31:24,"So in your opinion, to that notion, kind of always go hand in hand with the American dream of, you know, pseudo forced assimilation of, you know, leaving all of your, you know, your heritage behind to become part of America and the American dream.",
Raffi Andonian,[00:35:32:01],00:35:52:08,"I don't think it always goes hand in hand. I think it often does. I wouldn't I wouldn't use the word always. And the reason I say that is because it depends who you ask, right? Part of the what's interesting about the American Dream is I don't think we all agree on what the American dream is, right? We have this broad notion that we've been kind of touching on to, you know, prosperity, access, you know, these kinds of things.",
Raffi Andonian,[00:35:52:08],00:36:10:04,"But what does that mean? Right? Like, what does it mean to, you know, should we have equal opportunity or equal outcomes? Right? Is one of the things that we debate all the time. Right. So I think that depending on who you ask, there is more to some people are going to say, well, yeah, assimilation is part of, you know, the American dream.",
Raffi Andonian,[00:36:10:04],00:36:29:01,"That's how we come together. But others are going to say, no, well, this is diversity and there's multiculturalism that helps make the United States, I think, at different points, you know, both have some kind of perspective. As usual. The reality is some kind of complicated synthesis of all these. And it also depends on your perspective, your world, your experience and your community.",culture
Raffi Andonian,[00:36:29:01],00:36:47:04,"For example, my dad, who I mentioned is an immigrant, escaped from a communist regime in Romania. you know, he his family came here for opportunity because of the American dream. I mean, it's very personal for me. Right? And he started a business in that right away. But shortly after that was successful for decades. And that's how I grew in the middle.",
Raffi Andonian,[00:36:47:07],00:37:12:21,"I grew up in a middle class family. You ask him what that American dream means. I think it's going to mean something different to compared to, for example, a former sharecropper in Georgia who I remember would be was a janitor in the building I used to work at. In the conversations I had with him. versus you ask someone who maybe lives in New York City and comes from an affluent family like, say, the Roosevelt family came, you know what I mean?",
Raffi Andonian,[00:37:13:02],00:37:30:19,"So depending on who you ask, I think they're going to have different versions of the American dream and different desires for the level of assimilation or not. And I think that's part of the reason we go into these clashes sometimes because we don't always agree. So I wouldn't say always it's required. I think it depends on the perspective and the community you draw around you.",
Raffi Andonian,[00:37:30:20],00:38:00:01,"Right. Yeah. You know, where you live has something to do with that. The local community that you have. Are you an ethnic neighborhood? Are you not? You know, all these different perspectives really come in coming to play. Now, I will point out it's also fluid. So for example, you think about, Mexicans in California in the 1940s, Mexican Americans, but people of Mexican descent and sometimes, Mexican immigrants are being classified and all kinds of different ways in a period of like ten years.",culture
Raffi Andonian,[00:38:00:03],00:38:24:08,"There's a point where they're classified as white and they're classified as Mexican. They're classified as not white. And all these different classifications, all the people are the same people. All we're doing is moving the identification boundaries that we box people into according to our social categories. Right. So when I think of a segment when I hear the term assimilation and multiculturalism, I also think that it's not entirely up to you, but it's these kind of systems.",culture
Raffi Andonian,[00:38:24:08],00:38:45:03,"We have these social categorizations. We have that could make you assimilated or not, depending on how we classify you in a different in different circumstances. Right. So, so that I think that these situations are always fluid. And you know, there's think about the Irish you a much worse shape in the 19th century than they are in the 20th century as far as how they're accepted.",
Raffi Andonian,[00:38:45:03],00:39:20:07,"Right. How about Catholics, which is connected to why the Irish were not like that? The only reason, but there are other Catholics that are dislike like Italians and and German Catholics. Okay. what? You know, that's not so much an issue anymore, right? Being Catholic, although before it was. Right. So, you know, and it connects to the American dream because there was this notion that Catholics are, loyal to a foreign prince, which is the pope, that foreign prince is what the term a lot of founding generation use and that maybe made them so that their loyalties or, you know, questions.",
Raffi Andonian,[00:39:20:07],00:39:37:07,"So there's that nationalism part again. Right. And how how poorly can they participate in the American dream now? We don't think of it so much that way. It does. I feel like occasionally it rarely does pop up here and there, but it's of course not as prominent as it was. My point, though, is a fluidity. These things change across time as well, so I should.",
Raffi Andonian,[00:39:37:07],00:39:43:11,"I hesitate to use the term always, but all these things can be true at once.",
Doug Exton,[00:39:43:13],00:40:15:10,"And this program is funded under the a more perfect Union initiative from the National Endowment for the Humanities, with the goal to help celebrate the 250th anniversary of the signing of the Declaration of Independence. How do you think the American Dream can be used moving forward to help create a more perfect union and bring, you know, again to that melting pot of our country, you know, together, rather than the way it's been sometimes used in the past of, you know, creating divides, whether intentionally or not.",
Raffi Andonian,[00:40:15:12],00:40:46:16,"Yeah, absolutely. And it has been used to create divide, right? For many times, I think the way I mean, you know, it's funny, I think again at that quarter. Right. I think it's telling more inclusive stories. Right. Quarter now has, you know intentionally with the American Women Quarters program. both, you know, father of our country, George Washington, who I don't think we have to necessarily bash in order to make room for Maya Angelou and other historic women.",
Raffi Andonian,[00:40:46:16],00:41:07:01,"Both things can be true. And so I think the way forward is to play a game of addition, not subtraction, is to not necessarily, you know, say, well, we have to, you know, you win, I lose, or you lose, I win, right? It's not a zero sum game to me. We can just grow the pie. I think the stories are infinite.",
Raffi Andonian,[00:41:07:03],00:41:29:03,"you know, we have so many ways to tell these stories, so many ways to commemorate whether it's two sides of a quarter or many, many other ways. Right. So I would like to see for the American dream, you know, when we're thinking about it, to understand, number one, that everyone's American dream is a little bit different based on their position and their situation as I just described earlier, what my family situation and other family situations.",
Raffi Andonian,[00:41:29:05],00:41:51:17,"But number two, now that we have these perspectives on the American dream based on their experiences, their lived experiences are going to be different, right? Because you and I are to have different lived experiences, different geographies, different all kinds of things. Now, how do we make room in our public forums and discussions and dialog and symbols such as currency, our public squares, the cities, etc.?",
Raffi Andonian,[00:41:51:22],00:42:15:00,"How do we make room for all of them? And I do think that we can do that without saying we have to take this down to put that up or vice versa. Right? It's kind of like in any relationship, I think if you try to win at the expense of someone else, I think that's problematic. And I feel like that can be an endless cycle where, well, now, next time you win.",
Raffi Andonian,[00:42:15:00],00:42:40:18,"No, I'm not. So imagine you stick it to me, you know. So now what we do, we actually, like, get anywhere constructive and build. Whereas I think if you just keep growing the pie and doing that addition that I'm describing, then we can say, okay, there is room for all these different stories and all these different stories allow more people to engage with the American dream and history, which I think to me is important because I don't want history to feel like it's exclusive.",
Raffi Andonian,[00:42:40:23],00:42:44:03,"So to me, it's a game of inclusion.",culture
Doug Exton,[00:42:44:05],00:42:54:05,So and I think that's a wonderful way to close out the talk that you just gave. And thank you again for all of your insight and all of your your knowledge that you just shared.,
Raffi Andonian,[00:42:54:07],00:42:57:16,Thank you.,
