speaker,timestamp,End Time,words,tags
Dr. Russell Meeuf,[00:22:00:28],00;22;21;08,"I think that's one of the kind of the most amazing things about horror films, its ability to take these, really big, messy concepts and try to, like, find a metaphor or an allusion or something that's similar to that. That allows us to look at it. But at its core is, I think, American cultures, reluctance to actually grapple with our own history.",literature
Dr. Russell Meeuf,[00:22:21:10],00;22;41;28,"And I think that's, that's a kind of a common theme throughout, the book is this this question of why it is we don't actually talk about the real history. The horror films are about the past and about how we grapple with the past. But oftentimes we keep that past at a distance. So we reflect. We kind of just, you know, refract it in a particular way without actually grappling with it.",literature
Dr. Russell Meeuf,[00:22:42:05],00;23;02;01,"And I think, you know, this this is, absolutely key to, I think the future for, American society and culture is to have open and honest, frank conversations about the histories of race, the histories of racial violence, which are not that far in the past for our culture. And so I think horror films are one of the few places where we're seeing some of that kind of happen.",
Dr. Russell Meeuf,[00:23:02:01],00;23;21;07,"There's a kind of a, a displaced, focus on that. But because we haven't had those, those conversations, we end up again, kind of circling back on these same anxieties about what cultural change means, about what it means when the idea of privilege changes, rather than kind of taking a direct look at them.",
Johanna Bringhurst,[00:23:21:09],00;23;50;15,"There is something really satisfying about analyzing a film with, you know, your friends or family that you saw the film with. And maybe that's just we wish we could actually analyze what we want to talk about, and we have this kind of safe space to do that. You mentioned so many, home invasion, creepy house turns on its owners films because of the home recession in 2008.",
Johanna Bringhurst,[00:23:50:18],00;24;12;02,"What else happened during the Obama years to kind of fuel this idea of white fear? It seems counterintuitive when we've elected our first, president, Black president, president of African descent, that we we we are now past racism. And it definitely didn't work out that way.",
Dr. Russell Meeuf,[00:24:12:04],00;24;37;20,"Yeah. So, yeah, I mean, obviously in the in the aftermath of, the election of Obama, there was a lot of kind of self-congratulatory media discourse around, oh, okay, racism solved that problem. We've got our first Black president. And so, yeah, there was a lot of very premature discussions around post-racial ism and this idea that we've kind of finally moved past into a different era, of thinking about race relations, in the US.",
Dr. Russell Meeuf,[00:24:37:22],00;24;57;18,"And I think there's yeah, there's a lot of that kind of self-congratulatory discourse. But at the same time, this was a moment that we saw a lot of, really spiking of, White racial anxiety. I relied a lot on, Michael Tesla's, great book called, post-racial or most racial. He's a public opinions, analyst.",
Dr. Russell Meeuf,[00:24:57:20],00;25;20;20,"And to looking at a lot of kind of public opinion polling. And, what he found was that throughout the Obama era, one of the things that happened in American politics was that issues that hadn't been really defined by racial anxiety or racial resentment suddenly became more racialized, and that someone's politics could be, guessed, with a great higher degree of accuracy.",education
Dr. Russell Meeuf,[00:25:20:23],00;25;40;17,"If you knew how they felt about race in America. Right. So in the ways that, health care, which has always been a divisive issue, hadn't in the past really been organized by white racial anxiety, right? So if somebody, somebody was really anxious about kind of whiteness and the status of whites that didn't necessarily tell you how they would feel about, you know, revisions to our health care system.",
Dr. Russell Meeuf,[00:25:40:22],00;26;12;08,"But in the Obama era, it did. And so it started becoming, becoming a system where, political power and political critique became organized around white racial resentment. And so I think, that I think was one of the kind of the, the biggest issues, that there was this kind of major cultural shift in thinking about whiteness and thinking about, we started really activating and elevating more conversations about, the idea of white victimization or the idea that, white folks were becoming the minority.",
Dr. Russell Meeuf,[00:26:12:08],00;26;35;25,"We started seeing, and we still see these kind of anxious, you know, demographic projections like, oh, by next year, white folks are going to be the minority in the US. And what is that going to mean? And that gets kind of, kind of projected on to a whole host of political issues around how you think about, you know, really mundane things like our education system in school funding, or health care, or tax policy.",education
Dr. Russell Meeuf,[00:26:35:25],00;26;50;05,"Suddenly things started becoming reflected through the lens of race. Much more. So, and so I think that that's, that I think led to these kind of, these kind of more anxious kind of conversations about white racial standing.",
Johanna Bringhurst,[00:26:50:08],00;27;04;09,And that set the stage for a candidate like Donald Trump to appeal to voters. Do we see evidence of that in this snapshot that we're looking at through the lens of horror films?,
Dr. Russell Meeuf,[00:27:04:11],00;27;14;04,"Yeah. So, I mean, I, I tried to be careful in the book and that I'm not I'm not saying that horror films gave us Trump. But what I'm trying to say is that.",
Johanna Bringhurst,[00:27:14:04],00;27;16;15,You did not say that. You did not say that.,
Dr. Russell Meeuf,[00:27:16:15],00;27;47;26,"Good, I did not want that to come across as the argument. What I was trying to capture was that, horror films were capturing the same kinds of cultural shifts that were happening that were going to lead us to a politician like Trump, a politician who I think, whatever you think of his politics, saw a moment in our, in our kind of cultural in our culture and decided like, okay, the that there was a, there was a moment for a politics that was much more overtly racialized, that was going to give voice to white racial anxiety and white racial resentments.",
Dr. Russell Meeuf,[00:27:47:29],00;28;13;26,"That was going to give voice to kind of the anger of white racial resentment, and take, take on this form of, yeah, this kind of angry, we need to get back to some sort of mythological past, and could capture some of that kind of anxiety and rage that was being felt, by a lot of white folks who felt left behind in the wake of all of these kind of congratulatory narratives about, race and diversity.",culture
Dr. Russell Meeuf,[00:28:13:28],00;28;35;01,"So, I think they were both kind of capturing that same moment. I think the chapter where I think I'm really most closely looking at how Trump's rhetoric aligns with or is in the discussion of remakes, so that during the Obama period, we did see a lot of kind of remaking of, classic, horror films, which is, not unique to the horror genre.",
Dr. Russell Meeuf,[00:28:35:01],00;28;59;07,"This is something that Hollywood does. You own intellectual property. You might as well get your bang, get, get more bang for your buck and remake it and remake it, remake it. But in a lot of these remakes, there was this kind of, tapping into that same kind of like, angry nostalgia, for the, that, saw the past as both, kind of a nightmare that we need to shift away from, but also something we should celebrate.",
Dr. Russell Meeuf,[00:28:59:07],00;29;33;14,"So there's this kind of weird, weird dynamic in thinking about the past, these remakes where we're like, okay, how do we go back and remake something like Nightmare on Elm Street? And oftentimes, what we see in these horror remakes is this idea that we take these stories and we're making them darker and grittier, and there's a kind of, a harder edge to them, that, that didn't exist in the, in the originals, that I think really reflect this kind of idea of past and how we deal with the nostalgia of the pass it align nicely with, I think, what Trump was doing rhetorically in terms of this invocation",
Dr. Russell Meeuf,[00:29:33:14],00;29;52;02,"of making America great again. Right. Which isn't really a call to celebrate the greatness of America's past as to say our present is really messed up. And so we have to change that. So I think we saw that same thing in the horror film that the the presents that these horror films imagined were far worse, far grittier, for far darker than what we had seen in the past.",cinema
Dr. Russell Meeuf,[00:29:52:05],00;30;17;19,"So if you look at like Nightmare on Elm Street, for example, the original, 1984 Nightmare on Elm Street, it's very much still invested in a lot of kind of dark, interesting things happening in American culture around, kind of the satanic panic of the 1980s around fears around childhood sexual assault and sexual molestation. All of those themes are present, but it's also a slasher film about teenagers and their sex lives and trying to have fun.",cinema
Dr. Russell Meeuf,[00:30:17:21],00;30;35;24,"And then you look at the, the, the remake that I think was in, I can't remember the year on the more contemporary remake with Rooney Mara in it. Mara Rooney sorry, gotta say that right. But that one is a much more depressing film. It takes a lot of the subtext of the original one, and, makes it, brings it to the surface.",cinema
Dr. Russell Meeuf,[00:30:35:24],00;31;02;17,"And it's about sad, depressed teenagers who can't get ahead in life, who are struggling to cope with being traumatized in their past. And it's a much a darker film. And so I think there's that we see in that, that sense that there's something wrong with our present, and that it gets manifested in these films that's really, tightly aligned with that, that Trumpian rhetoric around making America great again, which is why I called the chapter Making Horror Great again.",cinema
Johanna Bringhurst,[00:31:02:20],00;31;24;15,"I'm wondering, I know your book is specifically about kind of those Obama years, but in recent years, with the Covid-19 pandemic, another election, economic woes and frustrations, are you seeing that reflected in horror films that have come out in the last like five years?",
Dr. Russell Meeuf,[00:31:24:17],00;31;48;00,"Yeah, absolutely. So I do think, not just those issues, but also issues of race. So part of this is the Jordan Peele effect in that, the success of Get Out, I think really, both crystallized the industry and the culture to recognize that there was a market for horror films that more directly addressed race in America, and there was a historical moment that was ready for those as well in the in the early Trump years.",
Dr. Russell Meeuf,[00:31:48:03],00;32;04;03,"So I do, I think I talk about this a little bit in the conclusion, and we see this kind of playing out in, the horror storytelling today that we do see, a marked increase in horror storytelling, made by, for and about people of color, which is telling a kind of a more diverse range of stories.",
Dr. Russell Meeuf,[00:32:04:05],00;32;27;17,"And those stories are kind of engaging with kind of a more diverse set of histories about America's past, and about, what kind of the racial issues of America. Now that said, those are still a kind of a smaller trend, right? We still are seeing, continuation of a lot of the things that I've seen around economic anxieties, and white racial anxieties, but there's just a little bit more diversity in there.",culture
Dr. Russell Meeuf,[00:32:27:19],00;32;42;18,"It'll be interesting to see how this plays out. Over the next I think some of the trends that we see that were certainly alive in the Obama year have continued on. We're still seeing pretty wide scale popularity of haunted house films as a kind of a way to to have that anxiety, but is tapering a little bit.",
Dr. Russell Meeuf,[00:32:42:25],00;33;08;18,"I think one of the more interesting ones, too, is, the ones maybe intensified the most, are, narratives about creepy children and motherhood, have, been persistently popular. We've seen sequels made of Orphan, even though the lead, actor in that film is now an adult. They brought her back and made a prequel film, where they put all the actors on stilts around her to make her look like she's still a small child.",cinema
Dr. Russell Meeuf,[00:33:08:20],00;33;25;09,"Popular films like Megan, which is about the AI, bot who, kind of turns on their family. We, we're still seeing a lot of these types of narratives that are angst anxious about, like, white mothers in particular, in this idea of white motherhood as being kind of under siege.",
Johanna Bringhurst,[00:33:25:12],00;33;51;27,"I couldn't even watch the trailers for Megan. I was terrified. I'm a mother. I do not I do not like that one. I do not like the mirror. On mothers. That is creepy. Children are terrifying. In that same vein, I've been really excited to see more, horror films and television programming featuring Indigenous storytelling and actors.",
Johanna Bringhurst,[00:33:51:29],00;34;17;17,"Like the television show Dark Waters. Can you talk a little bit beyond, just our racial challenges, but also our history of sidelining indigenous storytelling? It feels really of the moment, right now, too, with Lily Gladstone winning awards for her amazing performance in Killers of the Flower Moon.",
Dr. Russell Meeuf,[00:34:17:19],00;34;33;21,"Yeah, and I think those are, and I should say, two. Part of one of the limitations of the books is that I am talking about movies. Just movies. And so I think a lot of really dynamic, interesting horror storytelling has been happening on TV. And just for the, you know, I couldn't write about everything for the book.",
Dr. Russell Meeuf,[00:34:33:21],00;34;35;21,So that's I think that's an area where we are seeing.,
Johanna Bringhurst,[00:34:35:24],00;34;37;25,"You can fit everything in, could.",
Dr. Russell Meeuf,[00:34:37:25],00;35;00;12,"Not fit everything in one bit nice and tight. But yeah, I think we are seeing, more of that both in film and television. Again, a more of a reflection on, indigeneity and indigenous issues. There's a, a great film called Blood Quantum, which is a really interesting, indigenous based like zombie narrative that's thinking about those questions of indigeneity.",cinema;indigenous;literature
Dr. Russell Meeuf,[00:35:00:14],00;35;17;12,"And, yeah, I think those are kind of playing out. I mean, part of it, I think, is also we're seeing a little bit more narratives about indigeneity in general, that are I think are really welcome. Right. I'm a big fan of, not a horror film or TV show, but Reservation Dogs is, a great show of kind of grappling with some of these issues.",cinema;indigenous
Dr. Russell Meeuf,[00:35:17:17],00;35;34;28,"I'm excited to see what the new season of HBO's True Detective, which always has a little bit of a horror bent, has in mind. I think it's going to engage a little bit more with issues of Indigenous communities in Alaska. So I think, yeah, I think we're seeing more of those histories coming to bear and some of these storytelling.",indigenous
Dr. Russell Meeuf,[00:35:35:01],00;35;52;21,"And yeah, and I think it'll be welcome to see some of that play out. And I would love it to see it manifest in like, mainstream theatrical horror as well, to have more of that engagement. When we see a conjuring film that actually engages with, kind of the brutal histories of colonization, in our country, I think that will be that will be great.",cinema;migration
Dr. Russell Meeuf,[00:35:52:23],00;36;07;10,"You know, one of the things I talked about in the book is that we kind of have this stereotype, this, this idea that like, oh, you know, or we tell all these horror stories about, you know, somebody who builds their build their home on a Native American burial ground and the ghosts from the past come and haunt them.",
Dr. Russell Meeuf,[00:36:07:12],00;36;31;13,"But oftentimes that that's actually not represented in a lot of mainstream horror. Even people hold up, the film Poltergeist as an example of that, but that's actually not set on a Native American burying ground, it's just a regular cemetery. And so, I would I would love to see more of our engagement with the past in that sense, and the kind of our past and our present with indigenous communities reflected in horror.",cinema;indigenous
Johanna Bringhurst,[00:36:31:16],00;36;48;07,"Thank you so much. Thank you for sharing your insights with us. And again, Doctor Meeuf's book is called White Terror, the horror film from Obama to Trump favorite. I really enjoyed it. I think you listeners will, to thank you so much for being with us today.",
Dr. Russell Meeuf,[00:36:48:07],00;36;49;16,Yeah. Thanks for chatting with me.,
