speaker,timestamp,End Time,words,tags
,,,,
Doug Exton,[00:00:00:00],00:00:23:08,"Thank you so much for joining us for tonight's Connected Conversation. A program conducted by the Idaho Humanities Council. If you're not familiar with our organization, I encourage you to check out our website, Idaho humanities.org. I'd like to remind you all that you may submit any questions using the Q&A feature located at the bottom of the screen, or the chat feature also at the bottom of the screen.",
Doug Exton,[00:00:23:10],00:00:30:10,With me today is Erik Hadley from Boise State. It's an honor to have you with us today. And I turn it over to you.,
Dr. Erik Hadley,[00:00:30:12],00:00:50:16,"Thank you Doug and thank you to the Idaho, Humanities Council, for inviting me back to do a presentation. I did, I was have I was lucky enough to be able to do one in February on the topic of, of, Hawaiian and, Native American, connections in terms of land sovereignty movements and, that worked out really well.",
Dr. Erik Hadley,[00:00:50:16],00:01:13:09,"And I'm pleased to have been invited back to talk about something maybe a little closer in my wheelhouse in terms of work I've been doing over the last few years, and that is on, festivals in Europe in particular. So, I'm joining you from Elmo, Idaho, at the visitor center for the City of Rocks National Reserve, where they have graciously granted me access to their WiFi and the nice place to sit.",
Dr. Erik Hadley,[00:01:13:21],00:01:30:02,"While I'm down here on vacation with my family. So, thank you all for attending. And, I've got a PowerPoint I will share with you.",
Dr. Erik Hadley,[00:01:30:04],00:01:51:23,"All right. Hopefully you can all see that, the topic of my, presentation today is, a series of festivals that I'm studying, currently in Belgium and writing about and doing active research on, for a dramatic title. I went with this the the Gilles, Giants and Dragons Oh My, the reinvention of folkloric festivals in Belgium.",culture;education
Dr. Erik Hadley,[00:01:52:14],00:02:12:01,"And I'll get into each what each of these, terms are, over the next hour. First, a brief introduction to Belgium. I usually do this because Belgium people send a note for chocolate or fries or waffles, but, not a whole lot more. Belgium is a small country of about 11 million people.",
Dr. Erik Hadley,[00:02:12:01],00:02:42:06,"It's in Western Europe, centered, between France, Holland and Germany, and is often considered to be the battlefield of Europe for much of of European history at least, from the mid 15th to the mid 20th centuries. It is a, it's a monarchy, so it's government is very similar to that of Great Britain in the sense that it has a, puppet elected parliament with, with a head of state, which is a, hereditary monarchy.",
Dr. Erik Hadley,[00:02:42:14],00:03:00:05,"However, it's in some ways more like the United States or even Germany, and that it's a federal system. It's divided up into three federal regions. And these are really divided up. Two of the three are divided up based on language. The northern half of Belgium is, is called Flanders. It's Flemish, based language. There are five provinces there.",
Dr. Erik Hadley,[00:03:00:07],00:03:21:14,"And then the southern half of the country, is called Wallonia. And it is French speaking. You can see the dividing line here. It's also made up of five provinces. In the middle is the capital, the city of Brussels, which is a separate federal region. It is officially bilingual. Both, Flemish, which is basically Dutch, and French speaking, although it's about 85% French speaking.",
Dr. Erik Hadley,[00:03:22:01],00:03:44:24,"Presently, my work centers in the province of Hino or Aino, which is in the, in the western, part of Wallonia, you can see that, there at borders against it's right up against the border of France. A brief history. I'll try to keep this as, brief as possible, but it's really important, I think, to understand, the significance of the rituals I'm looking at.",
Dr. Erik Hadley,[00:03:45:17],00:04:03:09,"The Low Countries, it shows a map of Low Countries from the mid 16th or mid 15th, mid-16th against to mid 17th centuries. And you can see it's a, kind of complicated series of provinces squeezed, between, the modern state of France and, to the east would be Germany or at the, at the time, the Holy Roman Empire.",
Dr. Erik Hadley,[00:04:04:22],00:04:27:13,"And it was made up of a series of provinces, which, which were not controlled by either the, the German states or the French king. They were independent. Eventually they would, consolidate leadership under a single family. Many people would know this family is one of the most powerful families in European history. And that would be the Habsburgs.",
Dr. Erik Hadley,[00:04:27:20],00:04:48:09,"This man here, Charles the fifth, was born in Belgium, in Ghent. Through family alliances and marriages. He would, rise to become one of the most powerful rulers in Europe in the, in the, late 16th, well, mid to late 16th century. He would be the Holy Roman Emperor of the German lands. He would also be king of Spain.",
Dr. Erik Hadley,[00:04:48:12],00:05:11:20,"His son Philip the Second is the one who, since the great Armada, against England. And he also is, of course, the overlord of these low countries, these kind of small, very wealthy, highly populous states. In between, France and the German states, two important things have happened to create the modern state of Belgium. This shows this is the domination of the House of Habsburg.",
Dr. Erik Hadley,[00:05:11:22],00:05:31:08,"And you can see up in the north, the Netherlands or Low Countries here. And then, to the, to the east, the Holy Roman Empire and to the south, the Spanish lands. On the death of, Charles the Fifth, his son Philip would take control of Spain in the Spanish dominions. And while his brother Ferdinand would take control of the Holy Roman Empire.",
Dr. Erik Hadley,[00:05:31:08],00:06:01:24,"But both. So you'd have two different lines of the same Habsburg family. The Low Countries stayed with with the Spanish. And the first major historical development, happened also during the reign of Charles the Fifth and that is the advent of Protestantism, particularly Calvinism, which took over the northern provinces. And eventually, they wrote rebellion against the very pious and Spanish kings, who were deeply Catholic and over an 80 year period.",conflict;religion
Dr. Erik Hadley,[00:06:02:19],00:06:31:02,"From the 1570s to the 1640s, they fought for independence. And by the 1640s you have an independent Dutch Republic to the north. The Spanish are able to hold on to what are what would be considered the state of Belgium. And this map here kind of shows you, this is in late 18th century, but what's called the Austrian Netherlands, there are the parts of, of, the Low Countries which remain Catholic, and their Catholic identity is really central, to my work, to the north is the Protestant Dutch.",
Dr. Erik Hadley,[00:06:31:08],00:06:57:05,"And then you can see the Holy Roman Empire and the French squeezed in there. The second significant impact is the French Revolution. The Austrian countries were seen as eventually, after the die off of the last of the Spanish bourbon. So the Spanish, Habsburg kings, the Belgium lands were turned over to the Austrian Habsburg branch in the 18th century, and so they became the Austrian Netherlands.",conflict
Dr. Erik Hadley,[00:06:57:09],00:07:21:22,"But they retained a lot of their independence, a lot of their autonomy. They were ruled by Regency, but they were really self-governing, and left alone. And again, these were very strategic areas of Europe, very wealthy areas of Europe, and highly prized. And so, a number of major battles and many people are familiar with, stretching from Waterloo in 1815 to, the battle of the bulge in 1944, early 45.",conflict
Dr. Erik Hadley,[00:07:23:07],00:07:52:08,"The Battle of Epe during the First World War, Belgium becomes this kind of staging ground between, the British and the French and, and, and, the, different German, German states over this period. So back to where we are. Belgium becomes an independent state in 1830. After the end of the Revolution, the Napoleonic Wars and, I'm studying a series of festivals in this province of.",conflict;culture
Dr. Erik Hadley,[00:07:52:13],00:08:11:04,"Hainaut Why? Well, I was doing work in Belgium in the early 2000 on, on a, doctoral research project for my dissertation. And I was actually studying the French Belgian borderland and the communities on the borderland. And in the course of that, I made a number of friends in Belgium, and they kept inviting me to different.",education
Dr. Erik Hadley,[00:08:11:04],00:08:28:02,"Over the course of the year, I was living there to many different festivals. And, it was something of a distraction from my, doctoral work, but a really pleasant, welcoming distraction. And I, I started asking questions. Why? Why are they dressed this way? Why do they have giants? Why is there why, why, why is there a Saint Roch statue?",culture
Dr. Erik Hadley,[00:08:28:02],00:08:57:08,"Why do all these things exist? Why is there so much popular participation in them? And when I finished my dissertation, I was looking for a second project, and, kind of lit on the idea of of looking at something that had received relatively little, interest, at least in, English speaking, history. So, I formulated a research project presentation for the Fulbright organization, which is part of the U.S. State Department in 2018 and made my application.",
Dr. Erik Hadley,[00:08:57:10],00:09:18:13,"And in 2019, I was granted a six month, research grant starting in, January 1st of 2020. Lasting six months. And I arrived in, Belgium shortly there, shortly before that and began my research. And I was able to research there for about two and a half months until the middle of March 2020. I think we all know what happened at that point.",
Dr. Erik Hadley,[00:09:19:01],00:09:47:00,"On March 12th and 13th, Belgium basically shut down completely. The Fulbright program also shut down and all grantees were sent home, and then international travel was suspended. So I didn't wasn't able to complete my project. And I'm hoping to return next next summer or even potentially in a future Fulbright to, to complete my research. But what I wanted to present today was a brief version of what, of what I managed to accomplish in the time I was there.",
Dr. Erik Hadley,[00:09:47:08],00:10:05:11,"So we're going to look at, a few different types of festivals in Belgium. I've divided up into and what I will call three different regions of this one little province of Hainaut in the far western areas is the region of the giants West Hainaut, the. And there are two we can look at briefly today. They're called a Ducasse.",culture
Dr. Erik Hadley,[00:10:05:18],00:10:27:03,"Ducasse is a, a French word which which comes from the word delicacy. And a delicacy is a is a saint processional or a ritual? A ritualized, communal religious processional carrying typically either a relic of a saint or a statue of a saint, or sometimes both around the city, typically on the saints special day of the year.",religion
Dr. Erik Hadley,[00:10:27:03],00:10:55:10,"It's a very Catholic thing. It's in some ways it's it relates to what's called the the cult of saints. I'm starting with Saint Mary, but all sorts of other saints. And in this western area, what we see in these ... or the Ducasse is they evolve into these giant festivals. In one case in the, in the city of, at Giants, as in the Goliath, and Samson and then person playing David fighting Goliath and then in the city of Mons, dragons.",culture;religion
Dr. Erik Hadley,[00:10:55:16],00:11:23:24,"And what eventually evolves in that from that Saint processional is a ritualized combat between a giant green dragon in the city and and someone playing Saint George on horseback in the middle of the of the province. It's the region of Carnival, and it's centers on a small, beautiful medieval town called Binche and they're very famous, marchers of their, of their carnival celebration who are called Gilles.",conflict;culture
Dr. Erik Hadley,[00:11:25:01],00:11:53:02,"And we'll talk a bit about the origin and peculiar ness, and uniqueness of the Gilles. It starts in Binche, but the, the Binche tradition of Carnival, a very specific. When we think of Carnival, we typically think of Mardi Gras as in New Orleans, Mardi Gras with floats, and different crews doing these folks in marching bands or for in South America, the, the Rio based one or elsewhere in Europe would be the Venetian, version of Carnival with the comedia del arte masking.",culture
Dr. Erik Hadley,[00:11:53:22],00:12:14:17,"This is a very unique, the most well-known carnival in Belgium, and it's spread from Binche throughout the region. And, kind of other towns began imitating that carnival. And then to the farthest east of the region, we call it the region of saint military marches. Again, these are like .... They they start out as marches dedicated to a specific saint.",conflict
Dr. Erik Hadley,[00:12:15:21],00:12:41:02,"In this area was a very militarized area and, a lot of warfare happened. It was very strategic. It fell fell on the line of the Meuse River and the Somme River, which eventually feed into the Rhine. That's a mountainous area around the Ardennes and there are big fortresses there. And so when they did these saint marches there, they wanted protection, military protection of the marchers and most importantly, of the relics and statues themselves.",conflict
Dr. Erik Hadley,[00:12:41:04],00:13:07:00,"So what you see in this area are dozens, if not a hundred different marches, military marches that spanned from late spring all the way to early fall. Every year. Why did I pick these? I pick them because they, fit a standardized model of research. All of them have been given UNESCO cultural heritage status as intangible heritage of humanity.",conflict;education;history
Dr. Erik Hadley,[00:13:07:07],00:13:30:20,"The carnival Binche, first in 2003, followed by the Ducasse, is that of Mons and at in 2005 and eight, and then eventually six of the military marches of Saint Roch in 2012. All of these festivals are still celebrated today. They all have museums dedicated to them, they have folklore commemorative organizations, and they've been given formal recognition both locally within their region.",conflict;culture
Dr. Erik Hadley,[00:13:32:16],00:13:52:15,"Like in their federal region, at a national level. And then even with UNESCO at an international level. So let's get into it. Here's the first of the four. This is, in the city of Mons. What you're looking at is a, a gothic, collegial church. It's not a cathedral. It's a gorgeous church.",religion
Dr. Erik Hadley,[00:13:52:15],00:14:11:02,"I lived in the city of Mons during my Fulbright. In fact, I walked by this church almost every single day. In the, on Trinity Sunday, which is typically the first Sunday in, June. They have what's called the processional of mons, the returning of this special carriage with, with, the relics of a saint to the church.",religion
Dr. Erik Hadley,[00:14:11:02],00:14:50:07,"And this church is named after the saint, to which is dedicated Saint Waudru, who was a woman, from the seventh century. And they still have a relic remains today, which is quite amazing. This is the the Ducasse part of it, the beginning of it. It what that is to say that what happened in this town is each year, starting with the Black Death in, 1349, they began carrying the relics of the saint around the city, physically creating a protective layer or prophylactic, protection around the city by marching through all of the major, avenues, within the city walls, and then eventually even outside the city walls to",religion
Dr. Erik Hadley,[00:14:50:07],00:15:09:07,"protect it, in after from disease, but also from warfare. At the end of this processional, the, the the chariot, which you'll see shortly is pushed back up a ramp into the church and the, the local folklore tradition is you can't stop if it pauses. Something bad will happen to the town in the next year.",religion;culture
Dr. Erik Hadley,[00:15:09:09],00:15:32:10,"And, local tradition holds. The last time it stopped was in 1940, just before, the war. Shortly thereafter, it's followed by what's called Le Lumecon. More, typically in English be The Combat of Saint George and the Dragon. And here we see, the dragon is being held by a bunch of, men dressed in white.",culture;conflict
Dr. Erik Hadley,[00:15:32:12],00:15:57:09,"There's also what are called wild men or leaf men. They're dressed in green. They help carry the tail at the back of it. They are opposed, by a group of men called .... And I'll show you, pictures of them as well as Saint George, on horseback is played by a human actor. In this combat, it takes place in the Grand plaza or the central plaza of the city on the same day as the procession.",conflict
Dr. Erik Hadley,[00:15:58:04],00:16:22:09,"And you can see that that there that there's virtually no, cordon between the, the participants of the ritual and the spectator, up to, upwards of over 10,000 people in this plaza alone. And the closest circle are typically young men. Typically, they take their shirts off and they try to fight to to steal the hair of the dragon, but on its tail, which is made of horsehair.",religion
Dr. Erik Hadley,[00:16:22:15],00:16:41:20,"And it's considered a great honor to be able to pull a chunk of horse hair out. So they spin this dragon around the circle while people, grab and push and and, jostle with one another to get this hair. I was supposed to. I was invited to participate in this, of course, in 2020, that this festival didn't happen.",
Dr. Erik Hadley,[00:16:42:03],00:17:05:22,"Eventually, after a series of mock, ritualized combat moves between Saint George and the dragon, the dragon is dispatched, with a pair of pistols, which tells you that this is not just a medieval, processional. And then it's put back in the church in a cave underneath the church to wait for the following year. The origins of this, date to this woman, Saint Waudru, who is a very interesting saint.",conflict;religion
Dr. Erik Hadley,[00:17:05:22],00:17:28:19,"She lived in the seventh century in, the city of Mons. She was, mother she was married, she had two daughters. You can see them here in this 18th century, painting. Eventually she, retires, and and forms a monastic style community known as a canons, which is, has a quite a little less rigor to it than than being a formal nun.",
Dr. Erik Hadley,[00:17:28:21],00:17:53:07,"It's a religious community where you still take vows, but it's it's more open to to it's not a cloistered system where, where you live within a walls and never emerge. And, upon her death, she was named a saint and her body was preserved in relic form. And then commemorated eventually with the great, neural net Cathedral, non cathedral, church of Saint Waudru.",religion
Dr. Erik Hadley,[00:17:53:18],00:18:14:02,"This is her body was separated between the head and the regular body. The head, also known as the chest, is and the body are on display in the church, all year long. And then on the on the day before the processional, they are descended, brought down into this chariot here, which was made in the 18th century.",religion
Dr. Erik Hadley,[00:18:14:04],00:18:41:24,"And they're put inside this chariot, and then they go around this community, in the Middle Ages, the following this chariot would be, all the guilds of the city, dressed in their medieval or early Renaissance and in some ways, gear or costuming, and they would follow along behind, the religious processional and that would declare to the community their importance, their worth, their status.",religion
Dr. Erik Hadley,[00:18:42:06],00:19:06:22,"Typically they would also be aligned with certain saints, most notably Saint Roch, who's the patron saint of disease. And as I said, this really originated as a processional during, the Black Death. So there are some connections between the, the, the epidemic of 2020 and malls. And what happened, in 1348, 1349, so if you were watching this and say, okay, what's going on here?",
Dr. Erik Hadley,[00:19:06:22],00:19:30:08,"On the one hand, we have this we have this, veritable relic, of this, holy woman who was named a saint. How did that get to a dragon? And that goes in a different direction. This is a, 15th century painting of Saint George slaying the dragon. Saint George was, would have lived in modern day Turkey at the time, under the Roman Empire.",religion
Dr. Erik Hadley,[00:19:31:17],00:19:57:18,"And, he supposedly, well, while stationed there, fought and killed, Dragon and then, also was canonized as a saint and became, notably associated with the kings of England in the Middle Ages. Saint George is still patron saint of England. The Red cross flag of England. And in the, at the time, the Middle Ages in this community, the County of Hanover was a very powerful county.",
Dr. Erik Hadley,[00:19:57:18],00:20:19:24,"And eventually Edward the Third, the King of England, Mary, the daughter of the Count of Hainault. And so there's this English influence into the counties. And that's how we begin to associate this, this, noble order of Saint George in the City of Morals. And then an a more strange thing happens, supposedly this, man named Jules, the chin.",
Dr. Erik Hadley,[00:20:19:24],00:20:40:11,"Notice the commonality of the name Jesus will reference that back to, the carnival about later. This is a 12th century knight who also went on crusade to Egypt, with the Count of hanno. And on his return, he supposedly killed a dragon outside of Mons. This is, in the in the museum for, the the Dukes of Mons.",
Dr. Erik Hadley,[00:20:40:11],00:21:18:03,"They have, brought in his, funerary statue so you can view it. And then also the mummified head of a crocodile known as the Dragon's head, which we believe he brought back from, Egypt. On crusade. We know that's documented as early as 1409. And so two things are happening here. On the one hand, we have this, the canons chapter of Saint Law, drew, and this and then the the Black Death in the 14th century, on the other hand, we also have this highly noble order dedicated to dragon killing that eventually want to bring that into this, this processional.",
Dr. Erik Hadley,[00:21:18:12],00:21:48:03,"Here's the city of Mons. You can see, the ground plus here and the, great cathedral up here. And, so it would emerge from this cathedral, move through these different, squares, and then the combat would take place on the ground. Plus, after the processional, one of the earliest images we have of it is this picture or this painting, from the late 18th century, in 1795 says that in the mons at the bottom, this is during the French Revolution.",conflict
Dr. Erik Hadley,[00:21:48:05],00:22:07:23,"It's a minimized painting, but you can see on the ground plus of this town, you can see Saint George with his lance. You can also see the dragon. There are, some of the wild men and devils or also devils that carry these little inflated bags to their dressed in black. And they are they're a common element in popular, festivals in Europe.",culture
Dr. Erik Hadley,[00:22:08:00],00:22:39:16,"And then over here, the protector of Saint George, ..., named after the chin himself. And so you see that here? And it, well, one common element we'll see in all of these rituals is they run into some difficulties in the 18th century with religious authorities and with secular authorities. Almost all these rituals will start out as, as obviously as religious processions, marching people with relics through cities and then popular.",culture;religion
Dr. Erik Hadley,[00:22:39:16],00:23:00:08,"You see this popular attachment on to it with the with the dragon example. What we see is kind of a noble, attachment to it. The Order of Saint George, which had its, its, chapter house on the ground plus itself, which has this connection back to Jules Chin, the Dragon Killer, and back to Edward the third, who had a presence in malls.",
Dr. Erik Hadley,[00:23:00:10],00:23:28:20,"And so, the dragon aspect has no religious, aspect to the, the to the, the processional itself, but becomes in some ways far more popular than the than the, than the the Saint Audrey processional. So in the late 18th century, it becomes these become kind of, chaotic and, uncontrolled. Groups of people get very excited about it.",religion
Dr. Erik Hadley,[00:23:28:20],00:23:59:11,"They start to actually look at the picture I showed you. They start to break down rules. We see reports of dancing and drunkenness in the streets, lots of music, multiple day festivals. And the religious authorities get really upset about this. This is supposed to be a pious ritual, not a profane ritual. It's supposed to be a positive ritual, meaning you're doing something and you're doing something to protect this community, and it's being co-opted by this popular secular element, both high society in terms of the Saint George people and low society in terms of the spectators.",music;culture;religion
Dr. Erik Hadley,[00:23:59:13],00:24:23:15,"And so these begin to see increasing regulation of this, and this regulation occurs, and all of these festivals are actually up in the 20 years before the French Revolution by, by, local authorities, particularly in this case, the Austrian authorities, who are controlling the low Countries. And then, of course, the French Revolution will come in. And in 1794, these revolutionary armies will sweep through, Belgium and conquer it.",culture;conflict;history
