speaker,timestamp,End Time,words,tags
Caroline Heldman,[00:25:31:11],00:26:03:21,"And I bring this up because I think that the Supreme Court, which is, you know, it's packed, meaning it's not it's not legitimate in its numbers. Right. And its ideal, it's ideological balance. Does not reflect well, it's out of step with the American public. Right. So for the first time in, in US history, we actually have a, minority court, meaning that their, their, out of step with most, major public opinion, whether it's the environment, whether it's voting rights, whether it's abortion, whether it's gay rights.",environment
Caroline Heldman,[00:26:03:23],00:26:33:16,"This particular court has been packed and they're out of line, out of sync with the American public. And I think that they are likely to uphold a lot of these states decisions to roll back voting rights. For example, there is the Arizona case, which was heard before the Supreme Court last week. Arizona has passed a number of restrictions that on voting that disproportionately affect Native Americans and disproportionately affect Latinx Americans, both of whom are more likely to vote Democratic.",
Caroline Heldman,[00:26:33:16],00:26:56:06,"And these are Republicans who have pushed these laws. And what was interesting is during the hearing, Amy Coney Barrett, the newest Supreme Court justice, actually pushed the Republican Party of Arizona and said, why are you here? Right? Like, why are you testifying about this? And the representative from the state party said, oh, well, because it effect it benefits our party.",
Caroline Heldman,[00:26:56:12],00:27:21:09,"It affects the partizan balance in the state. So he was very open about the partizan nature of, of essentially eroding our democracy in the name of winning elections. And yet I think the Supreme Court will likely uphold all of this because I think they're they're pretty out of step because of the rule bending with Mitch McConnell. And I actually will just say on the filibuster, I don't think getting rid of the filibuster is going to make things better.",environment
Caroline Heldman,[00:27:21:09],00:27:37:07,"It'll swing it to the Democrats for right now, and then the Republicans will get in power, and they'll pass legislation that the Democrats don't like. So that this idea that the Senate has to work together, is is going to be gone probably within the next year.",
David Adler,[00:27:37:09],00:28:31:11,"Well, those are powerful points. And I would just add, a couple of others, I think that the Congress needs to exercise its full authority under the elections clause of the Constitution found in article one, section four, which provides that, in fact, the time, place and manner of election shall be regulated by states except Congress is free to alter and essentially override those decisions except with respect, except with respect to the places, where those elections will be held, indicating ironically, to those who today are arguing that states should have full authority to regulate elections and that any congressional effort to pass legislation to override the state efforts, constitute an invasion of",conflict
David Adler,[00:28:31:11],00:29:07:23,"states rights. Our our saying that without merit, because the Founding Fathers wrote that clause making the final placing, the final decision making authority in the hands of Congress. And so I think, Caroline, it's imperative for Congress in the name of democracy, in the name of voting rights to, in fact, exercise that authority and pass H.R. one, now SR one in front of the Senate, because if it does not, then I think the future of democracy, through the future of voting rights is very, very grim.",
David Adler,[00:29:08:00],00:29:37:00,"And that's why I think that there will be great pressure, to abandon the filibuster, because without it, all of the possible protections for voting rights will fall by the wayside. Because of your astute point, I think that, the court is likely to uphold those state laws. So if Democrats don't act now to exercise the power that they enjoy by the slimmest of slim margins.",
David Adler,[00:29:37:02],00:30:03:11,"Not only will they rue the day that they, failed to act, but America will pay a terrible price. And when and I'm glad you mentioned Mitch McConnell, because he did carve out an exception to the filibuster, so that it didn't apply to Supreme Court nominations made it easy, as you point out, to pack the court, in a historically, untenable method.",
David Adler,[00:30:03:13],00:30:36:02,"And today, when he threatens, a scorched earth policy in the Senate if the Democrats should drop the filibuster, that's what you would expect of him, because as leader of the party trying to suppress the vote, what would we expect him to say? He doesn't want Congress to exercise its full authority. So I think in the as a democratic imperative, and in my view, even as a moral imperative, it's important for and I see we have a very important audience.",
David Adler,[00:30:36:02],00:30:36:21,Member.,
Caroline Heldman,[00:30:36:23],00:30:40:04,This is Dora. She agrees with you. Doctor Adler.,
David Adler,[00:30:40:06],00:31:06:21,"I appreciate that. That's good to have. We they have one, one supportive voice. So I think in the name of democracy and as a as a moral imperative, as I say, Congress must act. Otherwise, we will see a very large number of American people, people of color, largely, denied their voting rights. And and one more point on that.",
David Adler,[00:31:06:23],00:31:44:12,"And maybe we even have some questions here soon. But, one more point. When I hear state legislators saying, the voting should not be easy. I'm so perplexed. The Senate majority leader here in Idaho and a couple of weeks ago was quoted in some news stories, because he introduced a bill that would deny, people the right to bring more than, return more than one ballot, because he, he feared voter fraud, which we've had like none in Idaho.",
David Adler,[00:31:44:14],00:32:23:17,"He said voting. So what? That means you've got to make two trips to the post office one day, pick up your ballot, another to mail in. And he said, quote, voting shouldn't be easy. But again, why shouldn't it be easy if we truly believe in democracy? And I repeat myself and saying that it's important for citizens to understand that state legislatures across the country, which are enacting these voter repression laws in the name of non-existent fraud, are doing so to exalt their power over and above, the principles of democracy.",
Caroline Heldman,[00:32:23:19],00:32:46:24,"I couldn't agree more, David. And also just, you know, it sounds like we're being alarmist, but at what point do you blow the whistle on one person, one vote, you know, do you do you blow the whistle when, you know, when all of a sudden, the Voting Rights Act of 1965 is gutted and you see a slew immediately see a slew of laws put into place to make voting harder.",
Caroline Heldman,[00:32:46:24],00:33:08:24,"And all of a sudden, you see a decline and a disenfranchisement of black voters, of Latinx voters, of Native American voters, of older voters. At what point do you blow the whistle? You certainly blow the whistle. You know, when you have, 44 states doing this right now, capitalizing on the the big lie, right, that the the 2020 election was fraudulent.",
Caroline Heldman,[00:33:08:24],00:33:40:23,"That is a big lie. It's a demonstrable lie. What I and I just really do to to stress this point in and bring it home, we if your political party is contingent upon keeping people from the polls, you need to rethink your party platform. If your party has become the party of white ethno nationalism, and because of that, it's only appealing to a fraction of the population.",
Caroline Heldman,[00:33:41:00],00:34:10:02,You've got to shift your policy agenda. You must widen your tent. It's not so set partizanship aside. It's actually not sustainable for voter disenfranchisement to be the way that the Republican Party moves forward. They have to get a bigger tent. They have to appeal to more people. So using these more narrow appeals and kind of entrenching as as Donald Trump did has profoundly harm the Republican Party.,
Caroline Heldman,[00:34:10:08],00:34:20:24,"And I would love to see how they reinvent themselves so that they don't have to disenfranchize voters, but rather will inspire voters to go to the polls as a way of winning elections.",
David Adler,[00:34:21:01],00:34:49:16,"I, I agree, I think the, the failure to, to adopt or to create a broader tent so as to bring in, voters that might enable them to win future elections. Is, in fact, a, is exactly why they're trying to suppress votes. I'm reminded as by way of analog to to your point about why James Madison opposed, any state aid to religions.",
David Adler,[00:34:49:18],00:35:20:09,"Because he said if a religion requires aid from the state, it shows a failure on the part of that religion to appeal to potential parishioners. And they either need to change their approach and their doctrines, or they need to get out of the business, but they should not rely upon state assistance. So, here it's pretty clear, what the incentive and the motivation, frankly, are on the on behalf of the Republicans.",
David Adler,[00:35:20:09],00:36:06:16,"And to your point, on the very day that the Supreme Court rendered, the very shameful decision in Shelby County, Texas, the state of Texas legislature passed a voter suppression law that evening, meaning that those states were ready. They were poised to, to get into action. And it's very sad because we've seen that the very valuable, protections, provided by, the Voting Rights Act under section five, which required, state communities or states which, had demonstrated a pattern of races, I had to receive, preclearance from the Justice Department before they could revamp their election laws.",
David Adler,[00:36:06:18],00:36:30:23,"Were were stymied by that statute until the court dropped it. And then, as you say, some three dozen states moved very quickly, to enact suppression laws. So it's a critical time. And you ask, when should we blow the whistle if you don't blow it before, the storm comes, then it's too late. Doug, do we have questions?",
Doug Exton,[00:36:31:00],00:36:42:12,"We do. So the first question is from Walt, and they say it seems like at least one Democratic senator will not go along with any attempt to rid of the filibuster. What do we do about that?",
David Adler,[00:36:42:14],00:36:50:05,"You. What do you think, Caroline? What's your response?",
Caroline Heldman,[00:36:50:07],00:37:32:13,"So I have a moral response, which is that I don't want to get rid of the filibuster. My moral response is, I don't think the answer to the scorched earth, rule bending policies of Mitch McConnell is to engage in the same behavior. And even though I know it would be very painful, and I know that for Democrats who are in power now to not be able to pass major legislation during a period of time when there's not a lot of bipartisanship, and I'm even convinced that when Republicans take the reins of power again in the Senate, that they might do away with the filibuster because everything is just two sided, you know, talking out both",
Caroline Heldman,[00:37:32:13],00:37:50:12,"sides of your mouth. Nothing. And Mitch McConnell, no words that are coming from our political leaders, mouth mouths in the Senate mean anything. So Mitch McConnell saying he won't get, you know, he won't get rid of the filibuster now and standing against it means nothing if he gets into power and then decides to do that in a few years.",
Caroline Heldman,[00:37:50:14],00:38:13:02,"But my thought is that I don't want extreme government. I actually want to return to some form of bipartisanship. And I assume, you know, Dianne Feinstein has come out and talked about the importance of maintaining the filibuster. And she was ridiculed during Amy Coney Barrett's hearing because she hummed, you know, Senator Lindsey Graham from across the Partizan aisle.",
Caroline Heldman,[00:38:13:04],00:38:36:18,"And I, I'm not being naive here. Like, oh, everyone should hold hands and sing Kumbaya. But I actually don't know where this ends. If we keep bending the rules and getting rid of these institutions and the institutional rules that we've had to hold us in place, I think we've just been through four years of Donald Trump taking the rules and norms of the presidency and bending them every which way.",
Caroline Heldman,[00:38:36:20],00:38:56:17,"And I don't think that that's the answer. And I wish there was something else that we could do here to appeal to the better angels of Republican leadership to say, look, and maybe I'm being naive, but but you shouldn't be placing party power over democracy.",
David Adler,[00:38:56:19],00:39:39:23,"Well, the other side, of course, is that the filibuster was not part of the Constitution. It was created much later in our history and often, as you well know, was exercised by Southerners to maintain segregation. And so it was used in an immoral way. So maybe it's the case that by abandoning the filibuster, we have the opportunity to actually promote a greater morality in it in the context of democracy, by empowering the majority, duly elected by the American people, to promote their own version of what constitutes the general welfare writ large.",
David Adler,[00:39:40:00],00:40:20:02,"And I think you're right to point out that we would not know what, Mitch McConnell and the Republicans might do, when when they do regain power. But isn't it interesting to contemplate how to respond to a Senate leader in this case? Now, the minority leader who has no interest in maintaining traditions and processes? Allegedly so near and dear to his heart, which is frankly preposterous because he's willing to violate all the norms and traditions to, to achieve his ends.",history
David Adler,[00:40:20:04],00:40:54:22,"How to handle somebody like that? Is there an overriding? I'm glad you raised that great ethical question. Is there an overriding concern to, to abide by rules which in the end, would undermine the Democrats ability to pass landmark legislation and make much necessary reform and to achieve goals, which, frankly, will serve the great interests of those who have been underserved and ignored for so many years.",
David Adler,[00:40:54:24],00:41:15:06,"It reminds me of some of the classical, platonic dialogs on how do you treat your opponent when your opponent doesn't play by the rules? Great subject for debate in the classroom that you and I have asked our students to participate in many times. And that's a great question.",education
Caroline Heldman,[00:41:15:08],00:41:30:05,"Isn't there? There is no answer. There's no right answer. I think the point you made about, like, maybe you've been the rule this time in order to save democracy, I mean, maybe, maybe that is that's an ethical. Yes. Yeah, it's hard to say.",
David Adler,[00:41:30:07],00:41:53:01,"Or maybe you don't even have to say that we're going to bend the rule to save democracy because programs, policies and laws are changed all the time. And really, hasn't that quote unquote rule already been bent, seven ways from Sunday? If isn't that some old phrase or maybe it's eight ways from Sunday? I don't know. This is Thursday.",
David Adler,[00:41:53:01],00:42:01:09,"I'm not even there yet. That was a great question. What a thought provoking question from well, that's terrific.",
Doug Exton,[00:42:01:11],00:42:21:00,"And the next question we have is from Donald. And they ask, is it accurate to characterize all 250 plus bills filed in state legislatures as voter suppression? Can there be any changes in voting procedures that would be meritorious or at least non objectionable?",
Caroline Heldman,[00:42:21:02],00:42:42:16,"So yes, absolutely. So I should say that the 250 plus, bills that have been deemed voter suppression have been deemed so by the Brennan Center for justice. So there are actually more than 250 bills that pertain to voting that have been proposed. But these specific bills are about rolling back, making it more difficult to vote.",
Caroline Heldman,[00:42:42:21],00:43:08:02,"So are there things that I would endorse ethically? Absolutely. Anything that makes voting easier would be laws that I would endorse, but also in terms of of the voter suppression laws, we have pressing issues, right? We're in a global pandemic. We have folks experiencing homelessness, who are houseless at very high rates. We have racial injustice.",
Caroline Heldman,[00:43:08:02],00:43:35:13,"We have major problems in our society that need to be addressed. So why our state legislatures spending time and energy and money on passing laws that address something where there is no problem. So it's objectionable from many different standpoints. One from a you know, taxpayer standpoint that I don't want to fund bills that suppress the vote and don't do anything to improve democracy and do not address the problem.",
Caroline Heldman,[00:43:35:15],00:43:48:01,"But two, I definitely don't want to support any bills, you know, on moral grounds that make it more difficult to engage in the most fundamental right of our of our country, which is voting.",
David Adler,[00:43:48:03],00:44:13:03,"Yeah. And you're and and by the way, and since people in, in the audience often ask, where should we look for, reliable information? The Brennan Center for justice is reliable for all of you who wonder where you can turn to valuable information and insights and analysis about these bills, go to the Brennan Center for justice.",
David Adler,[00:44:13:05],00:44:19:00,"Excellent. And, it's got a great reputation.",
Doug Exton,[00:44:19:02],00:44:20:02,The next question.,
David Adler,[00:44:20:03],00:44:22:09,"From. Oh, I'm sorry. Go ahead. Doug. Oh.",
Doug Exton,[00:44:22:11],00:44:37:11,"Yes. The next question from Theresa is with the, the moves of so many states to suppress the vote, do you see any chance that those actions can be subsequently rolled back? You know, more towards the lens of, you know, easier access to voting?",
Caroline Heldman,[00:44:38:14],00:44:59:22,"If H.R. one passes and, the Senate and it passes in the Senate, so. Well, it's passed in the House. If the filibuster is removed, it'll pass in the Senate and then it'll go to the states and will be tied up in court, probably for the next decade, with a conservative Supreme Court that is likely to uphold states pushing back against H.R. one.",
Caroline Heldman,[00:44:59:22],00:45:18:04,"Right. So I would say maybe a little bit of hope that there would be some positive movement on this. But again, the Supreme Court, we've we have a packed court for the next three decades. It's going to be it's going to make national politics look differently than, than a democratically elected government.",
David Adler,[00:45:18:06],00:45:42:15,"Yeah, it's a really good question. I think if if Congress were to pass H.R. one and, Congress exercises its full authority to govern the time, place and manner, of these elections, then the court would be hard pressed to strike down these measures because it's not the classic case of asking, is this a federal or state authority?",
David Adler,[00:45:42:15],00:46:05:15,"Because the plain text of article one, section four, makes it, very clear that Congress has the ultimate authority that in this case, the framers to the Constitution were weighing in on the side of federal authority, not state authority, a point which would tie advocates of states rights in, many, many not uncommon.",
Caroline Heldman,[00:46:05:18],00:46:10:07,David is more optimistic than I am. That's a good thing. That's a very good sign.,
David Adler,[00:46:10:09],00:46:14:20,It doesn't cost any more to be optimistic.,
Caroline Heldman,[00:46:14:22],00:46:15:22,Right.,
Doug Exton,[00:46:15:24],00:46:23:05,Then what is the role that gerrymandering plays into voter suppression and voter apathy as well?,
Caroline Heldman,[00:46:23:07],00:46:48:04,"One important aspect of H.R. one that I didn't mention was that it would establish nonpartisan commissions to set up the boundaries for various voting districts. So gerrymandering is where you get these districts that look like little snakes or dragons. I mean, they're very cute. But they're also very specifically drawn so that they can, make a district, a Republican district or a Democratic district.",
Caroline Heldman,[00:46:48:06],00:47:11:20,"And what happened, in California, about a decade ago, is Arnold Schwarzenegger the recall election? Right. He he, our first recall election, he replaces gray Davis gets in and all of a sudden acts like a centrist Democrat and says, look, we're going to have nonpartisan redistricting in this state. And so we establish that commission, and all of a sudden our elections became more competitive.",
Caroline Heldman,[00:47:11:20],00:47:32:12,"Why? Because the districts were drawn in a way that didn't particularly benefit one party or another. They weren't drawn in a way in order to limit, for example, and marginalize Republican voting in the state of California. And in most states, how Partizan commissions. And so they draw the districts to benefit whatever party happens to have the majority on that commission.",
Caroline Heldman,[00:47:32:12],00:47:45:15,"So that's a really long way of saying if H.R. one passes, which it may, that it would actually address gerrymandering, and that would be an important step toward actually having better representation.",
David Adler,[00:47:45:17],00:48:13:19,"I agree that would be a very healthy point. For democracy. And I'm reminded of the fact that just a few years ago, a ballot initiative in the state of Arizona was passed, which in fact transferred, Jerry, redistricting from the legislature to an independent commission of the very kind that Caroline mentions is embodied in H.R. one, the state of Arizona.",
David Adler,[00:48:13:19],00:48:47:11,"The legislature came to the Supreme Court and wanted the court to strike down, the ballot initiative. And the court ruled against the legislature, saying, in effect, that when the Constitution provides that, state state legislatures may in fact make the decision regarding time, place and manner of elections, it's referring to the law making body, which, in the case of a ballot initiative, is the people, the people, as a, as a collective whole.",
David Adler,[00:48:47:13],00:49:10:19,"And so that's healthy because that tells us, that if, there are more lawsuit votes, that in fact, the the court could follow a very recent precedent and uphold, the efforts to render these, commissions independent, free of the very kind of Partizan politics that Caroline mentions.",
Doug Exton,[00:49:10:21],00:49:37:16,"And taking more of a local spin on things. Caroline, with the graph you showed, it definitely showed that uptick for 2020. But I also know there is sometimes a trend of just doing the presidential vote and then not even looking at the rest of your ballot, just handing it in, going home. Do you know, with 2020, was there that trend still kind of a thing, or was there still a lot of interaction with the local down ballot measures?",
Caroline Heldman,[00:49:37:18],00:50:01:23,"That's a great question. So, that happens, as you noted, Doug, in every election, it happened more so in the presidential election, and specifically it happened on the Democratic side. So there was a larger pattern than we've seen in modern, you know, in the modern era of politics, a larger pattern of Democrats going in. And just for the folks going in and just voting for Joe Biden and Kamala Harris.",
Caroline Heldman,[00:50:01:23],00:50:10:12,"Right. Just voting for that ticket and not voting further down the ballot. But, David, perhaps you have more information about what happened in Idaho.",
David Adler,[00:50:10:14],00:50:43:14,"No, I think that what you say applies to Idaho and across the nation. And I wanted to turn on that a little bit, to direct our conversation for a second to the problem of apathy. Even though we had a great turnout in the 2020 election across the nation and in here in Idaho specifically, 81% of the voters turned out a record and more voters than ever used, mail in ballot or absentee ballots.",
David Adler,[00:50:43:16],00:50:59:08,"We still see across the nation, the fact that, what, 48% or so of the American people choose not to vote. How do you explain that problem of apathy when so much is on the line?",
Caroline Heldman,[00:50:59:10],00:51:27:12,"Well, I wrote some, chapters of my dissertation on this, this idea that and I'm chuckling because it, it just it's a depressing but it holds true even many years later. Having looked at this, that, that, we had so we used to have what I call a producer, approach to citizenship. Right. So producer citizen. So the, the ad, the call, the clarion call.",migration
Caroline Heldman,[00:51:27:12],00:51:55:22,"Right. Ask not what your country can do for you. Ask what you can do for your country. Right. Turn that on its head. We see the rise of consumerism in the 60s and 70s, which shifted the ways in which we view our relationships to government, view our relationships to other human beings, view our relationships to institutions. So instead of asking, you know what you can do for your country, we ask our the standard is to ask what our government and everyone else can do for us.",
Caroline Heldman,[00:51:55:22],00:52:15:18,"It's we are much more self-focused as a country and it sounds like I'm wagging my moral finger. It's not so much that I mind the shift in the brand of human being, if you will. It's what it's found in democracy. And so, the very first thing that I do with my students is, you know, in my one on one classes, I say, how has government affected you today?",
