speaker,timestamp,End Time,words,tags
Caroline Heldman,[00:52:15:18],00:52:36:11,"And it they're hard pressed to think about ways. And I'm like, well, did you brush your teeth? Did you die from the toothpaste? No, the FDA did you hop on the road? Did your car, you know, did your tire get punctured? No, because the roads were maintained and you were able to stop at stop signs and, you know, just going through all the basic things, you were able to breathe the air, especially in Los Angeles.",
Caroline Heldman,[00:52:36:11],00:52:58:05,"Right? Our air quality is much better than it was in the 70s and 80s. And so this, this idea that government doesn't affect our lives, I think that's a pretty common thing. Another thing that that, comes along with consumer citizenship, and perhaps the failings of the moral failings of our leaders, which it's hard to say because they've always kind of failed us.",migration
Caroline Heldman,[00:52:58:05],00:53:21:11,"So it's not like it's worse today than it was during the Teapot Dome scandal 100 years ago. But this idea that, you know, Americans have low political efficacy, which is the belief that their voice matters in politics. So I think we have a really hard time seeing how government affects our lives, because we are very self-focused and don't view ourselves as part of a community that has to contribute to a broader culture and a broader citizenry and a broader democracy.",
Caroline Heldman,[00:53:21:17],00:53:45:03,"And also, you know, we don't think our voice matters that much. And this is especially pronounced with more marginalized Americans. So, people of color, transgender Americans, women, there's this idea that our voices matter less because we have less social standing in the world. That translates into how we interact with politics. So, yeah, David, apathy is still a really big issue.",
Caroline Heldman,[00:53:45:03],00:53:52:11,"And I wish we could, you know, wave a magic wand and get folks thinking about themselves as contributing members of a democracy.",
David Adler,[00:53:52:16],00:54:19:12,"And, you know, isn't it interesting, Caroline, you and I both live in states, in which a large number of voters believe that their voice is irrelevant. It doesn't matter. Republicans in your state of California, Democrats and here in Idaho. And so how do we try to persuade people, to participate in politics when they're so vastly outnumbered by the majority party?",
David Adler,[00:54:19:12],00:54:23:12,That's that's a tough road to hoe. Yeah.,
Caroline Heldman,[00:54:23:14],00:54:42:10,"Yeah, it surely is. I mean, what we saw in 2020 is, a lot of people were voting against rather than voting for. So that getting back to that question you asked Doug about the phenomenon of people going in and just voting for the presidency. A shocking number. Were just doing that for Biden. And I initially said, oh, Democrats were doing that.",
Caroline Heldman,[00:54:42:11],00:54:58:17,"It wasn't just Democrats. And it was voting against. Right. There was a big push to vote against. So the more lightning rod candidates you can, put into office who folks want to vote against. I mean, that's how we increase participation, which is really a sad statement. Right?",
David Adler,[00:54:58:19],00:55:17:02,"And isn't isn't it the case, Caroline, that disenfranchisement is perpetuated by the Electoral College. It would be different in your state and mine, at least. People in the minority party could feel as though they were contributing and participating. If we had a direct popular vote for the presidency, right?",
Caroline Heldman,[00:55:17:04],00:55:36:03,"Absolutely. I mean, the Electoral College was put into place to give slave owning states more of a vote and to maintain their power in the Congress. We know the history of it is, you know, very problematic and racist. Today you're right that it functions. So for folks who are unfamiliar with the Electoral College, the presidential election isn't really a popular election.",
Caroline Heldman,[00:55:36:03],00:56:00:05,"It's not even a national election. It's election a it's an election of 50 states, 48 of which if you get 50% plus one vote, you get the entire slate and the Electoral College or Maine and Nebraska are exceptions to that. And by and large, they shake out to be, you know, a winner take all situation to. And so, yeah, why would a Republican in California, in California it's 2 to 1 Democrats over Republicans.",
Caroline Heldman,[00:56:00:07],00:56:23:01,"Republicans. Why would what's your incentive to go to the polls? What's the incentive to go to the presidential polls in Idaho? So if we made it really, truly a national referendum, we would have a set of issues that would arise, mainly that presidential candidates would hop between like Philly and New York and LA. Right. Maybe with the stop in Chicago and maybe one in Atlanta, but it would just be kind of a big city swing.",
Caroline Heldman,[00:56:23:01],00:56:28:00,"But you're right, David, that at least people would feel like their vote mattered.",
David Adler,[00:56:28:02],00:56:38:23,"Every vote within count, every vote would count. Which would be the goal in a democracy, right? One person, one vote in a different context. Doug, do we have a few more questions?",
Doug Exton,[00:56:39:00],00:56:48:10,"We do. Ingrid asks, how can the legislators decrease opportunity for citizen initiatives?",
David Adler,[00:56:48:12],00:56:50:19,To decrease or increase.,
Doug Exton,[00:56:50:21],00:57:06:10,"To that just decrease. So we'll move on to another question, giving great a chance to clarify a little bit. How can we protect the vote from Partizan groups like the if that influences the legislators.",
David Adler,[00:57:06:12],00:57:32:08,"Well, legislatures across the country are trying to make it more and more difficult for people to act as lawmakers through ballot initiatives. That's the case here in Idaho, as as the questioner may have, may have addressed, and one of those reasons, one of the reasons for legislatures making it more difficult is they're able to concentrate power in their own hands.",
David Adler,[00:57:32:10],00:58:12:03,"And then, for example, in a state like Idaho, where a ballot initiative last time out, nearly made it to the ballot, and that would, that was to approve, that was to approve recreation, use of marijuana, which rankled the powers in the legislature. And I think that's a major reason why the legislature in this very session has a draconian, bill before it that would make it very, very difficult, for ballot initiatives to, be successful, to even make it to the ballot, I should say, and then be successful.",
David Adler,[00:58:12:05],00:58:24:05,"Maybe maybe that's the case. But California's a case where there's a state where there's a lot of initiatives, right? You you all in California like to exercise your lawmaking power, right, doctor Heldman?",
Caroline Heldman,[00:58:24:07],00:58:49:03,"Well, yeah, we'll call them citizen initiatives in quotes. Right. Because the average amount that it takes to get a citizen initiative on the ballot is $12 million. So it means it's not really coming from citizens. By and large, our citizen initiatives are it it's but it's, interest groups, mostly corporate interest groups going to manipulate, public, the public to pass things that the legislature won't pass.",
Caroline Heldman,[00:58:49:05],00:59:06:20,"And I know I'm being too simplistic about that, but unfortunately, I don't know of a state that has a true citizen initiative process. I would love to see one. And I think they're, you know, they're wonderful. They're a way for citizens to enact policy directly when the legislature is not responsive. Right. It's another check on government here.",
David Adler,[00:59:06:20],00:59:33:00,"Again, just very quickly, Doug. The even though the Idaho Legislature is attempting to make it very difficult, to move forward with citizen initiatives or ballot initiatives there, again, they would be surprised to learn that the founders of our nation, we're we're we're embracing the concept of citizen initiatives. They called them out of doors conventions, out of doors conventions.",
David Adler,[00:59:33:06],00:59:46:02,"Another factoid, for those who advocate states rights to realize they're running, they're swimming upstream against the current established by the framers.",
Doug Exton,[00:59:46:04],00:59:55:13,And it looks like the last question that we all have time for tonight is who is still excluded from voting?,
Caroline Heldman,[00:59:55:15],01:00:26:15,"Well, felons, are excluded from voting in I believe it's still 19 states. And that disproportionately affects, black people, black men in particular and Latinx Americans. I wish that, you know, if I had a magic wand, I would get rid of that. I mean, what better way of feeling like you are part of the the country, part of the citizenry, part of your state, your locality, then casting a vote?",
Caroline Heldman,[01:00:26:17],01:00:51:04,"Once you, you know, have, been released from prison, I can't imagine a better way to infiltrate somebody's back into a community than through exercising your basic democratic right. And yet, in almost half the states in the union, we restrict that. That's the only voting. I mean, obviously, if you're not a citizen, you can't vote. There are groups that are disproportionately affected by all of these laws.",labor
Caroline Heldman,[01:00:51:04],01:01:10:18,"Right. And we've mentioned, people of color, certainly transgender individuals, students also in some parts, because they're in different parts of the country. Right. And they've got their student IDs, but then their, their state IDs are from different states, like in the state of Texas. You can vote with your, your, your gun permit, but you can't vote with your student.",education
Caroline Heldman,[01:01:10:18],01:01:27:16,"ID think about that for a minute. So they're they're definitely folks who are disproportion affected by this. And then older Americans. Right. How discrimination. If you are no longer driving, why would you need a license? And if your licenses are not to date in some states you can't vote.",
David Adler,[01:01:27:18],01:01:57:18,"I think that's well-said. And so the real question now is not merely who is prohibited from voting, but in fact, who might be, in a find themselves in a very difficult position and unable to exercise their fundamental right to vote. You know, I'm always reminded that Aristotle, who was the great Athenian champion of democracy, said, democracy is a system in which we try to spread political power as widely as possible.",
David Adler,[01:01:57:24],01:02:24:15,That's not what state legislatures are doing across the country. It's not what Mitch McConnell and his colleagues in the Republican Party are doing. They are acting in a fundamentally undemocratic way to make voting difficult and to concentrate governmental power in the hands of those who do not favor democracy.,
Doug Exton,[01:02:24:17],01:02:37:04,"Well said. And unfortunately, that is all the time we have for tonight. So thank you to everyone for attending. And thank you to both of you for such a wonderful and engaging conversation today.",
David Adler,[01:02:37:06],01:02:44:23,"Great to be with you and always a joy to share the podium with my colleague and friend, Doctor Caroline Heldman. Good to see you, Caroline.",
Caroline Heldman,[01:02:45:00],01:02:51:08,"It's good to see you, Doctor Adler. And thank you, Doug, for hosting us. This is a wonderful presentation.",
