speaker,timestamp,End Time,words,tags
,,,,
Doug Exton,[00:00:00:00],00:00:29:05,"Thank you so much for joining us for tonight's conversation on voter apathy and disenfranchisement. This is a program conducted by the Idaho Humanities Council and funded by the. Why it matters Civic and Electoral participation initiative administered by the. Found by the Federation of State Humanities Councils and funded by the Andrew W Mellon Foundation. If you're not familiar with our organization, I encourage you to check out our website, idahohumanities.org.",
Doug Exton,[00:00:29:07],00:00:40:13,"I'd like to remind you all you may submit any questions using the Q&A feature located at the bottom of the screen. With me tonight, our two wonderful guest, Doctor David Adler and Doctor Caroline Heldman.",
David Adler,[00:00:40:15],00:00:45:05,Great. Nice to be with both of you tonight. Good evening. Caroline.,
Caroline Heldman,[00:00:45:07],00:00:52:01,"Hello, Doctor Adler. Thank you, doc, for hosting us.",
David Adler,[00:00:52:03],00:01:20:20,"I just dug this. I can't, I have to say, this is such a timely, subject for our conversation tonight. Here in Idaho and across the nation. People are greatly concerned about. Particularly about disenfranchisement. I know Caroline follows this closely on a daily basis, and we see, Congress up in arms about it. We see state legislatures trying to suppress the vote.",
David Adler,[00:01:20:22],00:01:35:05,"Democrat fighting back. This is this is a time when the forces are gathering on on both sides. Don't you think, Caroline, for this is this is the battle for the continuation of democracy?",
Caroline Heldman,[00:01:35:07],00:01:58:22,"Indeed, David. I mean, I think we've seen, a bigger push and rollback. In the modern political era than we have seen really, since the push for Jim Crow. And I'm going to start us off with a PowerPoint presentation. Just looking at a brief history of voter suppression in the United States just to to get everyone on the same page.",
Caroline Heldman,[00:01:58:24],00:02:26:17,"And this is I'm going to say it's five slides, so not very, detailed, but it gives you a really good sense of where we started and where we've come in terms of voter rights and then voter suppression efforts that are happening right now. So at the founding, we like to think of, you know, our country as being this grand experiment where we are extending the franchise and we're including all of these people in this new form of governance.",
Caroline Heldman,[00:02:26:17],00:02:59:16,"But in reality, not only were women not able to vote and, Native American people and black people not able to vote and other people of color, but even most white men, were not able to vote. Right? So only about 10% of the nation's population at the time of the founding was able to vote. And if you recall, you know, there at the start of, of the founding of our, our nation, when we started having those conversations, we had about 4 million people.",
Caroline Heldman,[00:02:59:18],00:03:22:05,"And then within a matter of decades, we had about 13 million people, but still only about 1 in 10, was able to vote. So I'll start by, by really level setting here that we baked voter suppression into our founding documents. So we have these ideas about what constitutes democracy, right. And of course, people will quibble. And so no, we live in a republic.",
Caroline Heldman,[00:03:22:05],00:03:45:15,"Well, that's a form of a democracy, right? It's one where you elect, representatives, to represent you rather than, you know, a direct. We tend to think of democracy as being direct, but republic democracy, whatever term you want to use, the three really primary guiding principles. The first is political equality. And we tend to think of this as the cliche of one person, one vote.",
Caroline Heldman,[00:03:45:21],00:04:06:11,"So, the who gets to vote is fundamental to how we think about democracy and of course, political liberty. You know, the idea of freedom from government interference and the rights that go with being a full citizen. And then a popular sovereignty, which is the idea that government only has legitimacy if the people decide the government is legitimate.",
Caroline Heldman,[00:04:06:11],00:04:28:08,"So if you only have a sliver of the population who is able to vote, that means that popular sovereignty is by definition limited, that political equality is by definition limited. So we started off with these grandiose ideas about what our democracy would be, but we actually baked in limitations on who counted as a full citizen very, very early on.",
Caroline Heldman,[00:04:28:10],00:04:48:00,"So if you look at the history of our country in terms of democracy, I like to think of it as, a constant push for the expansion of democracy in the sense that more and more people are allowed into the franchise. More and more people are allowed to cast their vote, which over time strengthens our democracy considerably.",
Caroline Heldman,[00:04:48:00],00:05:11:07,"So when you look at the big kind of burst expansions of voting rights, first, you have the property requirements drop for white men. This happened at the state level initially. And then happened, it happened nationally, in the last kind of barrier to fall was in 1850. So the first, extension of voting rights is for white men.",
Caroline Heldman,[00:05:11:09],00:05:38:09,"So, it goes from being, you know, 10% of the population to over 50% of the population being able to vote. And then in 1870, you have the 15th amendment that extends, the vote to male citizens of any race. And I'll put an asterisk on that, because we wouldn't need a voting Rights amendment, Voting Rights Act of 1965, if the 15th amendment, you know, after the Civil War, if that amendment had actually been put into place.",conflict
Caroline Heldman,[00:05:38:11],00:05:57:24,"But what we actually see is an informal system where black men and, black women don't have the vote yet, but black men, have their voting rights curtailed through a series of Jim Crow laws that extend to voting. And we'll look at that in a moment. Then the next big push is the 20th amendment that extends the vote to women.",
Caroline Heldman,[00:05:57:24],00:06:21:24,"But again, for black women, we would need the Voting Rights Act of 1965 because, voting restrictions in the form of grandfather clauses, in the form of poll taxes, so having to pay money, not being able to vote unless your grandfather was able to vote, and then literacy tests. So, for example, tests asking black voters, how many, how many bubbles are on a bar of soap.",education
Caroline Heldman,[00:06:21:24],00:06:48:00,"So impossible questions to ask. Again. So even though we see this formal extension with the 15th amendment allowing male citizens of any race to vote, and then the extension of voting rights to women with the 20th amendment, with goodness, that's a reversal. Sorry, the 19th amendment in 1920. We actually do not see voting rights formally put into place, for black Americans until 1965.",
Caroline Heldman,[00:06:48:04],00:07:13:15,"And it's worth noting that Native Americans were granted citizenship and voting rights, in 1924, they're allowed to vote in federal elections. We've also at this time, as I mentioned, we have this rollback, this restriction of voting rights happening at the same time. So as our country is becoming more democratic, there's also a backlash against certain, groups actually fully participating in democracy.",migration
Caroline Heldman,[00:07:13:17],00:07:52:03,"So, in 1889, we see, the first Florida becomes the first state to pass, a poll tax that specifically affects black Americans. And very quickly, we seen nine other southern states pass, poll tax laws. And then Mississippi passes the first literacy tests in 1890. And so, again, the voter the Voting Rights Act of 1965, which followed on the heels of the civil rights Act of 1964, was put into place in order to reverse all of the restrictions, on voting that have been placed informally and sometimes formally, on Black Americans.",education
Caroline Heldman,[00:07:52:05],00:08:16:16,"Once they got the right to vote after the Civil War. It is worth noting that the Voting Rights Act has been gutted with the Shelby decision. In 2013, the Shelby provisions. So essentially, we had a system where, the Voting Rights Act allowed the federal government to scrutinize states, any states that had a history of disenfranchizing black voters.",conflict
Caroline Heldman,[00:08:16:18],00:08:39:16,"It allowed the federal government to look at those states, any laws they wanted to pass in terms of what? Our rights. If they had a history of, disenfranchizing blacks. So, what the Shelby decision did is it just gutted the Voting Rights Act. It took away the requirement that any time states with this history tried to pass new voter restrictions, the federal government could look at it.",
Caroline Heldman,[00:08:39:21],00:09:06:19,"It just took away that federal oversight. And so what we saw with when the Supreme Court, made the Shelby decision, which I'm sure Doctor Adler will be talking about in great detail, what we saw immediately was, over 30 states, put in voter restrictions. I mean, within weeks of the Shelby with within weeks of the Shelby decision and the Voting Rights Act being gutted, then what we saw is, voter ID laws passing.",
Caroline Heldman,[00:09:06:19],00:09:30:18,"And at 36 states from 2013 to 2017, and we can have a long conversation about what voter ID laws do. On their face, they seem very innocuous, right? You use your ID when you go to get alcohol, you use your ID, when you apply for things. But the issue is that for voting, ID, there are a lot of folks who are less likely to have identification.",
Caroline Heldman,[00:09:30:20],00:10:06:14,"So, for example, transgender Americans are less likely to have identification that matches their identity. Older adults, perhaps adults who don't drive any more or less likely to have ID, black Americans are less likely. Latinx Americans are less likely to have IDs. So what these voter ID laws did is essentially, even though they seem innocuous and they seem pretty basic for folks, you know, middle class folks who can pay, you know, 80 bucks to get a new ID they actually ended up being highly discriminatory in, in terms of who they turned away from the polls.",
Caroline Heldman,[00:10:06:16],00:10:33:24,"But the bigger issue was voter ID laws, which a lot of us have been talking about for over a decade now, is the fact that they are addressing a non problem. So voter ID laws, when they were initially the first wave that passed in 23, 2013, right after the Voting Rights Act was gutted with the Shelby decision. What happened immediately, is that states started implementing these new laws and they cost, that one year alone, $20 million to implement.",
Caroline Heldman,[00:10:33:24],00:10:52:17,"So you would think at the state level, if you're spending $20 million to change your laws, it's got to be addressing a problem. But the issue is that, voter fraud is actually not a problem in the United States. In fact, you are 37 times more likely to get struck by lightning than you are to engage in an act of voter fraud.",
Caroline Heldman,[00:10:52:19],00:11:22:24,"And this is not my data. This is actually data coming from the Bush administration. So when George W Bush was, in power, he directed, the Department of Justice to look at voter fraud. And they did a five year study, and they found that voter fraud was negligible. It's simply non-existent. While there were a handful of cases, most of them were a mother who thought that she could go and vote for her daughter, who was away at college using her daughter's ID these sorts of instances where people were simply unaware of what they were doing.",education
Caroline Heldman,[00:11:23:01],00:11:45:22,"Voter fraud is not an effective way to throw elections, right? It would just require an extraordinary amount of, coordination, which would very easily be picked up by election officials. So there's a reason why, you know, voter fraud is not an issue. And we used to know this and we used to know that it was very expensive to address a problem that wasn't a problem.",
Caroline Heldman,[00:11:45:24],00:12:06:10,"But today, we now have 36 states that have passed voter ID laws, which are relatively still expensive to implement to address a non problem. So you have to look at this and say, well, what's happening it. Why pass laws to address a non problem. What's what's really going on here. And what we know is that the states that have passes is a very partizan measure.",
Caroline Heldman,[00:12:06:10],00:12:24:11,"Right. So whether you're a Democrat or Republican, I think we can all get behind the idea that, folks should we should be enabling voting. Folks should be able to vote. It's part of being a citizen in the United States. It's part of, you know, strengthening our democracy. I don't think anyone has can really push against that.",
Caroline Heldman,[00:12:24:11],00:12:56:15,"And so any restraints on voting, I think should receive really strict scrutiny, especially things like voter ID laws, which end up being highly discriminatory in how they're implemented, what's happening right now in 2020 is, we all just lived through the last year of the big Lie that the election was fraudulent. Again, we know that it was not, not only do we have 60 plus court cases, many of which were overseen by Trump appointees, that dismissed the idea that there was fraud in the election.",
Caroline Heldman,[00:12:56:19],00:13:31:11,"We also have a number of Republican states and state Republican state election officials who are pushing back against the narrative of the big Lie that the election was fraudulent, that however, has not stopped, the 44 states where Republicans have proposed over 250 very stringent voting restrictions. So, to rephrase what I said, at the start of this, we are in an era where, we are passing more restrictions on voting rights than, than any time in the modern era.",
Caroline Heldman,[00:13:31:11],00:13:51:18,"And it looks very similar to what was happening after the Civil War amendments passed. So shifting really, quickly here to what the real problem is in the United States, a problem that was not a problem in 2020, low voter turnout. So we don't have an issue with voter fraud in the United States. We actually have an issue with voter turnout.",conflict
Caroline Heldman,[00:13:51:20],00:14:18:13,"And it started in the 1960s. And we can unpack some of the reasons here. But the biggest reason, as identified by Robert Putnam, is the advent of television. So television did something really interesting. So the way so voting is, very much predicted by how connected you feel to your community. And the idea is that the more you connect with your community, the more likely you are to turn out to vote in an election because you feel more a part of your community.",
Caroline Heldman,[00:14:18:13],00:14:38:22,"And this is again, Robert Putnam found this in his classic book, Bowling Alone. And so he's scratching his head and saying, well, why? Why is voting declining? There are people feeling less connected. And he found that indeed they were. That what television did? Was it privatized our free time. So we were no longer hanging over, the fence and talking to our neighbor.",
Caroline Heldman,[00:14:38:22],00:14:58:00,"We were no longer going to the PTA meetings at the same rate we were. Instead of joining bowling leagues, we were bowling alone. The title of his classic book. And so political scientists and others who care about democracy have long been kind of pulling out their hair to say, how can we get people to turn out and to vote in elections?",
Caroline Heldman,[00:14:58:00],00:15:27:19,"Well, if you look at the, 2020 election, you can see that something very important happened during this global pandemic. It's a very, very small sliver of a silver lining on a dark cloud in that we relaxed voter, rules and processes, meaning we made it easier to vote. And guess what happened? More people voted. So you can see this long decline starting in the 1960s that has a couple of peaks with some high profile, contentious elections.",
Caroline Heldman,[00:15:27:21],00:15:56:22,"But look at that number in 2020. That's what happens when we actually enable American citizens to participate in their democracy. And I'll end with a quote from Stacey Abrams. It brings it back to the original design of our democracy. Right. So if you look at how far back we've how far we have come since our founding, when we very clearly excluded various groups from full participation in our democracy, we baked that into the American experience.",
Caroline Heldman,[00:15:57:03],00:16:09:01,"And it is really disheartening to see in 2020, that we are trying to roll back the experience of democracy by limiting the vote. And I will pass the baton now to Doctor Adler.",
David Adler,[00:16:09:03],00:16:31:10,"Well, thank you, Caroline. Those, those data points in that historical timeline analyzes were superb and really helped to facilitate this conversation. Just picking up on a couple of the excellent points that you made. A couple of themes leap out at me. The first, of course, as you said, is that at the beginning very few people could vote.",
David Adler,[00:16:31:12],00:16:57:24,"And it reminds me of a classical, political theme, which is to say those in power don't want others participating. Because of course, it would undermine their own ability to set the agenda. So by disenfranchizing various groups at the beginning, it made it easier for a small group of people, in this case white men, to control politics in America, to promote their own interests.",
David Adler,[00:16:58:01],00:17:45:06,"The only the only way then, for people to gain some footing, to be able to participate effectively in American politics, or any country for that matter, is to fight for their rights. And that becomes an emerging theme across the course of American history, where all those groups that finally did win the right to vote, did it as a result of strenuous efforts, whether we're talking about the 19th amendment, for example, or the right of 18 year olds to vote, which came as a result of of a nation, feeling the, conscience pangs of sending young men to war 8000 miles from home, but not allowing them to vote, in the system, or",conflict
David Adler,[00:17:45:06],00:18:16:24,"certainly with the with the hard earned. Right, for black Americans to win the right reflected in the 15th amendment. So that reminds us that benefits, including the great right to vote are seldom handed to people. People have to fight in politic. Which then raises an interesting question for me, and that is that because voting is the most fundamental right in a democracy, it bears a reiteration.",
David Adler,[00:18:16:24],00:18:50:01,"It is the most fundamental right in a democracy. If we as a nation aspire to be democratic, why do we see people, particularly people in power, working hard to make voting more difficult or in fact, to deny people the right to vote? And it seems to me that there's a very clear answer. It's the old political theme. The more people that participate, the more difficult it is to win power and to promote one's agenda.",literature
David Adler,[00:18:50:06],00:19:26:06,"Which is another way of saying here in America that those who are currently involved in the efforts as you pointed out, in the passage of some 250 bills and 44 states, to make voting more difficult, are fundamentally opposed to the expansion of democracy. That might sound shocking to a lot of people, but that's the reality. You can't assess it any other way, particularly because, fraud is a non problem, as you so nicely pointed out.",
David Adler,[00:19:26:06],00:19:59:07,"So they contrive the existence of a problem so as to justify voter suppression, which, as you noted, applies, with great force to particular voting groups, minorities, the elderly, the poor, and, and not necessarily to those whom they believe will support their own candidates and causes. Those are just some of the themes that, that emerge immediately, that suggest that democracy is in great peril.",
David Adler,[00:19:59:09],00:20:29:19,"If in fact, our most fundamental right is under attack as opposed to making it easy to vote, which is what we assume people who are pro democracy would want to do. And isn't it interesting, Caroline, that often those very same people that want to make voting very difficult are the first to say, don't throw down any hurdles in our path to exercising, for example, our Second Amendment right.",
David Adler,[00:20:29:21],00:21:09:17,"We don't want background checks, we don't want a delay. And by buying guns, they'll say we don't want our gun rights to be restricted in any way or, as it happens here in Idaho, a lot of the people who oppose wearing masks, for example, are among those who advocate restricting the vote and the same ones who were angry when, they were denied, what they perceive to be an absolute right to gather in houses of worship again uttering the refrain, don't try to restrict the exercise of our right.",religion
David Adler,[00:21:09:17],00:21:32:10,"So it's, it's an interesting paradox in our system that those very people who would make voting difficult, and thus undermining the very foundation of democracy, don't want their own causes restricted in any particular way.",
David Adler,[00:21:32:12],00:22:18:04,"Yeah. And so the concern I have. And let me ask you, for your thoughts about this, Caroline, the concern I have is what will be the success of the efforts at the state level to accomplish voter suppression? And does that make it all the more imperative for Congress, for example, to enact, what was passed by the House in early March, H.R. one, for the people before the people act, now, before the Senate and exercise, what is a clear congressional power to regulate elections in the face of the, in the face of the, opposition?",
David Adler,[00:22:18:06],00:22:25:08,That would say Congress shouldn't encroach on state authority to regulate elections.,
Caroline Heldman,[00:22:25:10],00:22:47:03,"Well, David, I would love to hear your analysis of of whether you think these, efforts will be successful, but so H.R. one, for folks who are not familiar, is, a voting rights act that essentially restores all of the erosion that has happened since the Voting Rights Act was gutted in 2012, 2013. All of those efforts that started at that point in time.",
Caroline Heldman,[00:22:47:05],00:23:15:17,"And that means, that same day registration, is would would be the law of the land. It means that, mail in ballots would be easily accessible. It also allows, the gathering especially, which is especially important, in places like Arizona and rural areas where you're more likely to have Native American and Latinx folks, who, you know, don't want to travel long distances or might not be able to do that.",culture;agriculture;indigenous
Caroline Heldman,[00:23:15:17],00:23:36:24,"And so, you know, one person in the community could gather all of those ballots and take them then, so it's an extension. It basically takes how we made things easier in 2020 and makes that the law of the land. I think that the Senate so it's unlikely to pass the Senate unless the filibuster is, eradicated.",
Caroline Heldman,[00:23:36:24],00:24:00:08,"Right. So, I think that's probably likely, which means that we will enter a whole new era of divisive politics, the likes of which, I mean, we've seen a bit of it with Mitch McConnell, where he would bend the rules, the Senate rules quite a bit. And I think Mitch McConnell bending the Senate rules is actually why we will not see this ultimately be successful.",
Caroline Heldman,[00:24:00:08],00:24:22:07,"And that's because the Supreme Court has a packed supermajority. And I say pact, because Mitch McConnell bent the rule during the last, year of the Obama presidency and said, no, he would not, host a hearing for, Merrick Garland, who's now our attorney general. So essentially, that seat that was supposed to go Democratic.",
Caroline Heldman,[00:24:22:07],00:24:43:07,"And there's a reason why, you know, the court, why presidents appoint. Right. And then the Senate confirms, because we elect folks of different parties, and they're supposed to be able to put their person in. And the Senate having to confirm that means that person is going to be somewhat in the middle, right? You're not going to get these extremists on the court.",
Caroline Heldman,[00:24:43:07],00:25:06:00,"It's very rare that you would get an extremist approved on the court. And so what happened is Mitch McConnell bent the rule and really upset the Partizan balance of power. And I say this because, the Republicans now have an additional seat on the Supreme Court that technically they're not supposed to have. They have it because Mitch McConnell bent that rule and the last year of the Obama presidency.",
Caroline Heldman,[00:25:06:04],00:25:31:09,"And then when Ruth Bader Ginsburg passed in the last year of the Trump presidency, all of the Republicans who said use the excuse that they wouldn't confirm they the made up rule, that they wouldn't confirm a Supreme Court justice in that final year. They all scrambled and confirmed Amy Coney Barrett within weeks of an election. So forget an election year, within weeks of an election, they completely did a 180 on their reasoning.",
