speaker,timestamp,End Time,words,tags
,,,,
Johanna Bringhurst,[00:00:00:00],00;00;29;06,"Hello everyone, and welcome to Context. This program is brought to you by the Idaho Humanities Council with funding from the National Endowment for the Humanities. The views expressed here today do not necessarily represent those of the Ahrq or the NIH. My name is Johanna. Bringhurst. And joining us today is Doctor Dr. Russell Meeuf. Doctor Meeuf is a professor in the School of Journalism and Mass Media and the director of the Film and Television program at the University of Idaho.",
Johanna Bringhurst,[00:00:29:08],00;01;06;24,"He received his doctorate from the University of Oregon and specializes in research on popular media and culture. In particular, his work focuses on celebrity culture, popular cinema, masculinity studies, and disability studies. His writings have appeared in journals reflecting these interests. He's the author of several books on media culture, including White Terror, the Horror Film From Obama to Trump, Rebellious Studies, Stardom, Citizenship, and the New Body Politics, as well as John Wayne's World Transnational Masculinity in the 50s.",
Johanna Bringhurst,[00:01:06:26],00;01;15;04,"He is also the coeditor of several collections on film and popular culture. Doctor Meeuf, thank you for joining me today.",
Dr. Russell Meeuf,[00:01:15:06],00;01;16;26,Thanks. Happy to be here.,
Johanna Bringhurst,[00:01:16:29],00;01;28;04,We're so excited to have you. And I have to ask. It's not typical for a scholar to get to study film and television. What about that area really captured your interest?,
Dr. Russell Meeuf,[00:01:28:07],00;01;49;12,"Yeah. So I mean, as a kid, I was always fairly movie and TV obsessed. I think, you know, back in the 90s, you could always find me in an independent, video rental store, lurking the aisles, trying to find new movies that I hadn't seen. And, just, you know, really kind of spending a lot of time with movies, watching movies with my friends, watching movies with my family.",cinema
Dr. Russell Meeuf,[00:01:49:14],00;02;08;13,"So I was really, a young cinephile who was really fascinated by film and, film history and, kind of histories of Hollywood and popular culture. When I went to school and decided kind of what I wanted to study, I was really interested in storytelling and thinking about the relationship between storytelling and our world. Right.",cinema;education
Dr. Russell Meeuf,[00:02:08:14],00;02;28;09,"Why is it that we tell certain types of stories in certain historical periods? How do those stories reflect what's happening in our world, not just what's happening in them? And so it's kind of a natural fit for me to want to study film and study film history and think about popular culture. And so when I decided I wanted to, do that for a living and teach and research, the film seemed like the right choice for me.",education;cinema
Johanna Bringhurst,[00:02:28:11],00;02;41;01,"Yeah, that sounds like the origin story of, like, Steven Spielberg or a scholar at the University of Idaho. How did you become interested in horror, specifically?",
Dr. Russell Meeuf,[00:02:41:03],00;03;08;04,"Yeah. So my interest. So, I mean, I'm interested in film broadly, and popular genres in particular, and thinking about the ways that, Hollywood tends to tell certain types of generic stories that we, tell, you know, action films we tell, you know, romcoms, we tell, melodramas, we tell, horror films. And thinking about that kind of the rituals, nature of genre storytelling, this idea that we can go and we can watch a new slasher film and we kind of know what's going to happen.",cinema;culture;environment
Dr. Russell Meeuf,[00:03:08:04],00;03;29;27,"We have a sense of what the rules are, what our expectations are, and thinking about why it is that we tell that story over and over and over again. So I'm really interested in genre and how genre functions. And then I really got it working on this horror project, because I was teaching a class, on horror film, me and a colleague, had developed, this, class for, freshmen at the University of Idaho.",cinema
Dr. Russell Meeuf,[00:03:29:27],00;03;50;04,"That was designed to introduce them to a topic where we could have, you know, big interdisciplinary conversations about history, about culture, about society. And we thought horror films would be a great way to do that, to think about, why, why we tell scary stories, and why students scary stories got told at certain historical moments.",
Johanna Bringhurst,[00:03:50:06],00;03;57;18,Why do you think it's important for scholars to study how we tell stories and why they're important to us?,
Dr. Russell Meeuf,[00:03:57:20],00;04;27;13,"Yeah. So for me, I think, storytelling is one of the quintessential things that makes us human. That distinguishes us as a species is the idea that we tell stories, whether we're talking about fictional stories that we've made up, mythological stories, true stories about the world, histories, which are just a kind of form of stories. I, I'm fascinated by the idea of, storytelling, as this kind of, fundamentally human endeavor that we use to connect with one another and that we use to help us understand our world.",
Dr. Russell Meeuf,[00:04:27:16],00;04;42;24,"So I think for me, that's kind of the driving factor is thinking about that idea of how we can it can help us understand our place in the world. It can help us understand what's happening in our world. And, yeah, really just get us thinking about what it means to be human.",
Johanna Bringhurst,[00:04:42:26],00;04;56;23,One way that we see that is that film has become a way to critique our politics and the way we organize ourselves socially. Power. So how does horror play into that?,
Dr. Russell Meeuf,[00:04:56:25],00;05;22;21,"Yeah. So like, like a lot of popular genres, horror is, always political in that it's always about, our world around us. Whether we're talking about like, really overtly political horror, like something made by Jordan Peele or whether we're talking about something that seems apolitical, or is, is and has always been about, politics, about the things that, in our world that we want to talk about, that we have fears about.",
Dr. Russell Meeuf,[00:05:22:21],00;05;51;12,"So things about the family, ideas about the family or, about our the structures of our society, about our houses, about how we live in the world. So we talk about the, you know, horror and, and politics, largely because we see a certain kind of waves in horror filmmaking and in particularly, film scholars noted, like in the late 60s and early 70s, we saw this wave of horror storytelling that was very, very invested in interrogating, what they saw as kind of, you know, the degradation of American culture.",cinema
Dr. Russell Meeuf,[00:05:51:12],00;06;13;17,"So thinking about Romero's work with night of the Living Dead, or, Tobe Hooper with, Texas Chainsaw Massacre, William Crain with Blacula. You know, there's a, there's there's a kind of wave of films there, like Wes Craven with The Last House on the left, is going to great kind of, set of films that are coming out in the midst of the youth counterculture, the Vietnam War protests.",conflict
Dr. Russell Meeuf,[00:06:13:23],00;06;38;00,"That was very much about the idea of taking a hard look at American institutions and American families, and thinking about, what has become of them and a very kind of dark and grisly way and so there's there's going to really great example of horror films that are overtly political, that are asking hard questions about the things in American culture that we take for granted that we don't want to talk about death, violence, our institutions.",
Dr. Russell Meeuf,[00:06:38:03],00;07;08;13,"You know, the structure of the family, but at the same time or also has a capacity to really be also very conservative as well, that even though we have these stories that are very much engaged with, kind of what we would think of the kind of, you know, political, you know, leftist political structures, there's often a lot of horror storytelling that is, essentially about people's fears of the other about, fears that things are changing too fast, that, that there's something bad in our society that has to be contained.",
Dr. Russell Meeuf,[00:07:08:15],00;07;32;18,"So I think horror is great for this because, it's so invested in, these questions of how we organize ourselves. And I think one of the big things about it is, you know, horror, I think more than most genres is about the past. About past-ness, this idea that something happened in the past, some terrible, horrific, traumatic, violent thing happened and it lingers in our present.",
Dr. Russell Meeuf,[00:07:32:23],00;07;56;26,"And that people in the present have to grapple with those histories. And sometimes that can be a very kind of, critical perspective on things that have happened in the past. And sometimes, it's very much about like, oh, how can we move past this? How can we contain it? And kind of, ignore that history. And so for me, the politics of horror is tied up in that idea of it's, it's concerned with past-ness and how we grapple with our own histories.",
Johanna Bringhurst,[00:07:56:28],00;08;11;18,"It strikes me that horror is kind of unique in that way where it's not just a tool of conservatives or liberals. It's reflective of who we all are. And it's kind of a snapshot of our country on all sides.",
Dr. Russell Meeuf,[00:08:11:20],00;08;29;05,"Yeah. And I think part of that is, you know, the other unique thing about horror is that, as you know, it's a genre that has a a different relationship with pleasure than other genres. If you watch a rom com, you're supposed to feel warm and fuzzy inside. You know, you watch a melodrama and you're supposed to have this kind of emotional catharsis.",
Dr. Russell Meeuf,[00:08:29:08],00;08;46;09,"Horror as a genre is designed to make us uncomfortable, to write stories that are explicitly, about our fears, our anxieties, our tensions. And so it's a really fascinating genre. And that front end. Yeah, it can be put in a lot of different ways, right. Can, reflect fears from a lot of different political perspectives.",
Dr. Russell Meeuf,[00:08:46:09],00;09;04;28,"And I think that's generally true of Hollywood filmmaking in general. I think Hollywood kind of gets this rap is this bastion of leftist filmmaking where every, you know, trying to, you know, tell, you know, indoctrinate the youth. But for film scholars and film historians, we tend generally tend to scoff at that because the history of Hollywood is actually quite conservative.",cinema
Dr. Russell Meeuf,[00:09:05:01],00;09;16;16,"And the stories that Hollywood tell, get pulled in all sorts of different political directions, and often veer towards affirming, a more conservative status quo than they do towards challenging one.",
Johanna Bringhurst,[00:09:16:19],00;09;45;03,"Absolutely. You meet a really unique argument to use argue that the horror scene in films during the Obama era embodies the fears of white Americans, white Americans struggling with a perceived loss of social and or economic standing. These cultural fears led half of the American voting public to vote for a candidate who is openly racist, xenophobic, and sexist.",
Johanna Bringhurst,[00:09:45:05],00;09;50;03,How did you come to this thinking? How did you develop that argument?,
Dr. Russell Meeuf,[00:09:50:06],00;10;12;01,"Yeah. So the the origin of the book, I think, comes to the class I was teaching on horror film. We were looking at us history and horror, and we were kind of asking this question about why certain kind of traumatic moments in US history yielded certain kinds of horror stories. So we would look at, you know, the Great Depression and the racial politics and racial anxieties of the 1930s in America.",cinema
Dr. Russell Meeuf,[00:10:12:01],00;10;33;28,"And ask, what about that moment yielded a film like King Kong? Or we would look at the Red scare and McCarthyism and immigration fears and xenophobia in the 1950s and ask, why does that yield a film like Invasion of the Body Snatchers? Or look at the Reagan era and think about, you know, the rise of Christian conservatism and how does that yield Nightmare on Elm Street?",cinema;migration;conflict
Dr. Russell Meeuf,[00:10:34:01],00;10;58;14,"So when we get to the end of that class, because it's kind of a historical survey, it's always this question of how you historicize that present moment. How do you kind of step back and think about what's happening right now? What's the kind of quintessential horror film or genre that really captures a particular moment? And invariably a lot of the students in our discussions would come to haunted house films and films like The Conjuring, which were very, very popular, in the 20 teens.",cinema
Dr. Russell Meeuf,[00:10:58:16],00;11;24;25,"And that they saw as kind of quintessentially the quintessential horror films of that moment. And so we were thinking about what it is about our moment that yielded those types of films. And so one of the obvious answers was the housing crisis, right? That the house went through this very tumultuous, crisis in housing. And so it's not surprising that we would then see all of these films, about, people's anxieties about homeownership and about what it means to own a house.",
Dr. Russell Meeuf,[00:11:24:28],00;11;44;02,"But as we talked about it and discussed it more, it became clear how much whiteness was a very much a big part of that as well, that, you know, in both in horror storytelling and in national news media, the story of the housing crisis often focused on middle class white families and the kind of the economic precarity that came from these crisis.",
Dr. Russell Meeuf,[00:11:44:09],00;12;12;18,"But the research really indicates that the the demographics that were hit the hardest by the housing crisis were, families of color. But those stories were often absent from the ways that we talked about it as a culture, and that the ways, that it gets reflected in horror storytelling. So that led me thinking about this idea of, whiteness as, a kind of a core part of that narrative of the contemporary haunted house film that's not just about haunted houses, but particularly about the white haunted house.",education;literature;cinema
Dr. Russell Meeuf,[00:12:12:20],00;12;40;17,"And I think the more I kind of explored that idea and thinking about, the centrality of whiteness to that narratives, and let me think, oh, okay, this isn't just about the housing crisis. This is also about the broader questions of white economic anxiety, of white cultural anxiety. And a part of that, too, was also thinking about the missing histories of those stories that haunted house films, by definition, are about something that happened bad, something bad that happened in that, in that house in the past.",
Dr. Russell Meeuf,[00:12:40:19],00;13;03;09,"And, and they ask these questions about bad things that have happened in US history. But you look at haunted house films and it's very rare to see it, particularly in the Obama era, a story about a haunted house film that actually engages with racial violence, that engages with the horrific histories of, you know, genocide of native folks in, in this country, with, the, you know, the horrific slavery, histories of slavery.",cinema;conflict
Dr. Russell Meeuf,[00:13:03:12],00;13;20;10,"So thinking about those absences, really kind of pushed me down this road to think about the idea of or mainstream horror in this period in general as really invested in white anxiety, white resentment, and kind of perceived white fragility. So I think that's kind of what led me into that, that argument.",
Johanna Bringhurst,[00:13:20:12],00;13;39;28,"I should say. Doctor Meeuf's book is called White Terror, the horror Film From Obama to Trump. And it is a fascinating read. How is race and more specifically, the idea of whiteness at the core of American horror or storytelling?",
Dr. Russell Meeuf,[00:13:40:00],00;14;02;10,"Yeah. And I think I think a clarifying point I would want to make here is, I think for mainstream US horror, and I want to put the mainstream in there to emphasize that horror storytelling, it's a broad tradition. And so, while we can look at and I am looking at specifically kind of the most popular, horror films or horror films that did well enough at the box office to say, like, okay, this is the kind of an example of mainstream horror storytelling.",culture
Dr. Russell Meeuf,[00:14:02:12],00;14;36;08,"There's always been, alternative, horror storytelling that has been more apt to, to tackle those kinds of questions and to think more critically about race or gender sexuality. But I'm really interested in that, that idea of the kind of the horror that really resonated with audiences in that period. And so I think one of the things that I did in the book was think about the demographics of who is being represented, and kind of comparing how horror storytelling in that period reflect reflected, national demographics and also the demographics of what's happening in Hollywood.",
Dr. Russell Meeuf,[00:14:36:10],00;15;01;00,"And as far as population rates go in this period, horror storytelling absolutely lagged behind, the already kind of dismal record of Hollywood in representing, other, you know, more diverse, peoples on screen, that it was a very, very, very, very white, and so I think numerically, there's a, there's a sense that there was just an emphasis on whiteness and emphasis on white families.",
Dr. Russell Meeuf,[00:15:01:03],00;15;28;18,"And, so I'm going to get there. And so, I think there's that for me, there's those demographic questions. But then I think there's also kind of those cultural questions of thinking about, what are the stories essentially about. And so part of my methodology was really kind of parsing out those different stories within horror, and asking these questions about like, how, what kind of stories are we telling about white families, about white couples, about white folks who are putting these situations?",
Dr. Russell Meeuf,[00:15:28:18],00;15;53;03,"And so I think both numerically and culturally, there was this sense that these were stories about people with privilege, and people who were on the brink of losing that privilege. And that was kind of the greatest fear that was being manifested in these stories, this idea that people who had historically had certain privileges would have to interrogate those privileges and think about why they have those privileges.",
Dr. Russell Meeuf,[00:15:53:06],00;16;03;11,"And in the US, the biggest kind of form of privilege that we that has been the most historically significant are the privileges associated with race, in our kind of caste based race system.",
Johanna Bringhurst,[00:16:03:11],00;16;32;21,"So I really appreciated that you took, you're kind of that idea of whiteness even further raising. It's not just that white whiteness means being afraid of the other, but it's also fearing the failure of your own whiteness, meaning this false belief that you have that your race makes you supreme over other people or better, and other people.",
Johanna Bringhurst,[00:16:32:23],00;16;59;15,"You kind of made me think about James Baldwin in, in terms of the way that you wrote about, that feel that kind of moral cognition that you realize your moral failing is, is yourself relying on, race? How do you think that really, manifested itself in specific films? Do you have any examples that really just showcase what you're saying?",
Dr. Russell Meeuf,[00:16:59:17],00;17;22;08,"Yeah. So I think, absolutely. And I think part of this is, yeah, that idea that, particularly with horror and thinking about the past, that is not just about. Yeah, okay. There's this, you know, we're trying to maintain the sanctity of whiteness, but there's actually, a sense that for most horror stories dating back to the Gothic tradition, it means a reckoning with the past and understanding that past.",culture
Dr. Russell Meeuf,[00:17:22:09],00;17;55;18,"And so sometimes that can take a very kind of dismissive like, oh, let's just contain it. But oftentimes it takes a form where, the, the main characters in these narratives are asked to actually try to see about to come to grips with the privileges that they've had and the kind of the wealth that they've accumulated. I think, one film that comes to mind is, a small horror film called The Disappointments Room, about this couple that moves into this big estate that they're renovating, and, and they're recovering, because they had, lost a child to SIDs.",cinema
Dr. Russell Meeuf,[00:17:55:18],00;18;26;20,"And the mother blamed herself. And so they're taking on this new project and starting a new life, and she starts having these visions of the horrific things that the wealthy white family had done to their own, children, in that, in that, in that house in the past. And she had to both kind of forgive herself, for, this tragedy that happened to the, to them, but then also, like, distance themselves and come to grips with the horrific things that white people in the past have done to maintain their wealth, to maintain their privilege, to maintain a particular idea of what the family is.",
Dr. Russell Meeuf,[00:18:26:22],00;18;46;00,"So I think it's a good example of a film that's really about the kind of introspection of whiteness, around, this idea that, it's not just about the other, but about reflecting on oneself. And that's also a film, though, that also, like, absolves the family. By the end of the film, it's like, okay, you've grappled with this past, good job.",cinema
Dr. Russell Meeuf,[00:18:46:00],00;18;47;17,Move on. I think no.,
Johanna Bringhurst,[00:18:47:17],00;18;49;10,"No, no.",
Dr. Russell Meeuf,[00:18:49:12],00;19;09;01,"I think the films that are actually the most critical of this, are the home invasion films, which represented a kind of a small cycle in the Obama era, but a really kind of prominent one, which were they tended to be much more cynical and tended to really, explore this idea of kind of the degradation of kind of white wealth and white privilege, as characters had to deal with it.",conflict
Dr. Russell Meeuf,[00:19:09:01],00;19;31;16,"So a film like You're Next, where, a woman is, goes with her boyfriend to meet his family for, a holiday. And his family's very wealthy, and they go out to his estate, and the dad's made all his money off of, being a defense contractor. So he's made a fortune for himself, off of this idea of selling weapons to other people that are often being used in the Third world, in the Global South.",cinema;conflict
Dr. Russell Meeuf,[00:19:31:18],00;19;49;06,"But the family is then attacked seemingly randomly, by these masked intruders who are kind of picking people off one by one, and they're all stuck in the house and have to deal with these invaders. Luckily, the girlfriend that he had was grew up in the Australian outback as a survivalist and has a bunch of fighting skills.",
Dr. Russell Meeuf,[00:19:49:09],00;19;50;16,But.,
Johanna Bringhurst,[00:19:50:18],00;19;52;23,The. I'm loving this description.,
Dr. Russell Meeuf,[00:19:52:27],00;20;17;02,"It's it's a it's a lovely little film, with knife gore in it as well. But, the as it progresses, you recognize that the root of the attack is the greed of the family itself. And she's just kind of this bystander to this wealthy family, kind of, you know, kind of turning in on itself. And so these are the films that I think are really introspective, in a kind of a critical kind of fun way about, wealth.",cinema
Dr. Russell Meeuf,[00:20:17:05],00;20;33;11,"And I think you see it as well and like the really popular Purge films, particularly the First Purge, which is again, about, a wealthy white family who's made, their money off of exploitation, having to come to grips with what it means, to, like, have an obligation to other people rather than to just themselves.",
Johanna Bringhurst,[00:20:33:14],00;20;44;28,"I do think one of the fun parts of watching horror films is guessing in which order characters die or get picked off, and I'm going to guess that defense contractor was not long for this world.",
Dr. Russell Meeuf,[00:20:45:04],00;20;52;22,"No, right. Yeah. The there was a lot of good fighting, but there. Yeah. So it's a it's a fun film. It's one of my favorites for that from that cycle.",cinema
Johanna Bringhurst,[00:20:52:22],00;21;17;26,"So I will, I will add that to my list. You also a great about how these kind of festering fears that are at the core of horror films can partially be ascribed to a lack of open dialog in our culture about race, power, and history. And so we have to tell our stories this way to kind of reckon with the past.",
Dr. Russell Meeuf,[00:21:17:28],00;21;38;15,"Yeah. And that's kind of one of the kind of the goals, or kind of historical trajectories of horror films is that it's a kind of, a form of displacement where there's some sort of kind of trauma or past history that we're not comfortable with. And instead of looking directly at it and trying to, like, grapple with it in a meaningful way, we'll kind of shift it into something else, right?",migration
Dr. Russell Meeuf,[00:21:38:15],00;22;00;25,"Well, we'll tell a story about it. That's slightly off. In order to kind of exaggerate it, and help us process it, but without kind of looking at it directly in the ways that you could look at, you know, go to the Godzilla films as being about nuclear anxieties for, you know, Japan in the 1950s, but not overtly about nuclear anxieties as a way of tackling them without directly addressing them.",
