speaker,timestamp,End Time,words,tags
,,,,
Doug Exton,[00:00:00:00],00:00:14:14,This program is funded through a more Perfect Union initiative of the National Endowment for the Humanities.,
Doug Exton,[00:00:14:16],00:00:22:10,"All right. With me today is Raffi Andonian, celebrity historian to explore the American Dream.",
Raffi Andonian,[00:00:22:12],00:00:50:22,"All right, well, thank you to Idaho Humanities Council for doing this. I'm very excited to be here and to talk about the American dream across time. I am a celebrity historian. I have a history in the National Park Service, as you can see there in the photo of me years ago on a Civil War battlefield working. And of course, we have fought over the American dream so often, both bloody and not bloody, and including on these battlefields or sometimes in protests.",conflict
Raffi Andonian,[00:00:50:22],00:01:15:18,"So we're going to walk through a few centuries of seeing how the American dream came to be and what we're fighting over, and how it's contested. Looking back to 1607, what many consider the beginnings of the pre United States. Now, of course, in 1607 there was no United States. But this is the first permanent English colony which is Jamestown, Virginia.",
Raffi Andonian,[00:01:15:20],00:01:44:14,"And it started with the Virginia Company. The Virginia Company was a corporation. And that corporation had a royal charter with King James supporting it. But the corporation had investors that funded this colony to go across the Atlantic Ocean from England to the North American mainland and try to make a profit by bringing back resources, much like you would in a colony, to then, produce and manufacture in England.",
Raffi Andonian,[00:01:44:16],00:02:21:24,"Now, what's fascinating here is a couple of things in why you think of the beginnings of the American dream here. One is that you have this public private partnership, right? You have the king, the crown, and a corporation working together on this venture, hoping to make money. And two is once the folks that are here in Virginia or in Virginia, when I say here, here in North America, but particularly in Virginia, which you see some scenes of here with the James River, up in the upper left and a monument to John Smith, who we all know in the middle and on the right you see an archeological site that is still remaining from the",
Raffi Andonian,[00:02:21:24],00:02:43:10,"era in Jamestown, Virginia, today. But when the people were here, the Englishmen, they had a hard time surviving for several years. They needed the help of the local American Indian groups to get by the difficult winters and food supply, and just knowing the landscape and the environment around them, as well as diplomatically, because there are different groups that are not always friendly.",environment
Raffi Andonian,[00:02:43:12],00:03:18:01,"And so in that context, they first had to help of the indigenous people, but later eventually would no longer have that as they would continue to build rivalries and perhaps not exactly have great relations. Right between American Indian groups and Englishmen. But down south in Virginia is not the only place that this was happening. While in Virginia, it was a profit motive up in New England, particularly in Massachusetts, it was more idealistic, not so much the corporation, not so much about men, not so much about finding raw materials, but creating an idealistic society.",indigenous
Raffi Andonian,[00:03:18:03],00:03:44:19,"And here is where we often would look to for ideals of the United States. When we look backward on the left is John Winthrop. He gave a famous sermon in 1630, early in Massachusetts lifespan, that they that the United States, or what we consider United States today, but Massachusetts, particularly for him, this region would be seen as a city on a hill, a shining beacon in the darkness.",religion
Raffi Andonian,[00:03:44:21],00:04:05:16,"And you would later hear, for example, President Ronald Reagan referred to a city on a hill in the 1980s. So this still has staying power with us today. When we look toward what the United States has to offer, not just the economic opportunity that we see in Virginia, but the ideals of religious freedom and idealistic society where groups fit together.",religion
Raffi Andonian,[00:04:05:16],00:04:27:07,"Family structure a lot of these ideas come from the Puritans in Massachusetts in this period. Now go 100 years later in the same place in Massachusetts in 1749, you have Jonathan Edwards. He gives a sermon also. Now his sermon is called one of his many sermons. The famous one is called sinners in the hands of an Angry God.",religion
Raffi Andonian,[00:04:27:09],00:05:02:06,"And this is one of the key pieces of literature and, oratory that gives fire to what is now called the Great Awakening, which is a big religious fervor, a movement that takes place across, the North American English colonies in the mid-18th century. And in the process of doing so, there is this idea that while you might sin in the hands of an angry God, there is an opportunity for redemption and opportunity to redeem yourself and to improve and to be saved again.",literature;religion
Raffi Andonian,[00:05:02:08],00:05:39:15,"And these principles, to me, serve into the American dream later, because we often think of the United States as a place where you get renewal, a place where you can lead back the sins or the bad things, or the bad positions of the old world, and come back to the United States and visualize and dream all these things that we're seeing where there the economic opportunity that Virginia saw, whether it's a shining city on a hill, the land of opportunity that John Winthrop saw and for Jonathan Edwards, the opportunity to redeem yourself, to leave back your sins and to renew and rebirth as an American.",
Raffi Andonian,[00:05:39:17],00:06:02:21,"Now, these ideas, just a few decades under on the tail end of the Great Awakening, come together in the American Revolution. Now we all know Thomas Jefferson and the 4th July and the declaration independence, but there is some different origins there, and we can trace it in all kinds of places, but specifically in Virginia, going back, remember where the Virginia Company started there a century and a half prior?",conflict
Raffi Andonian,[00:06:02:23],00:06:23:08,"There is something called the Virginia Virginia Declaration of Rights. And now that Declaration of Rights was passed in the Virginia Convention, right there in that building, right in that building, which is the Capitol building in Williamsburg, Virginia, which is still there today. And the person who was the primary drafter for it was George Mason. What did you see pictured there?",
Raffi Andonian,[00:06:23:10],00:06:48:06,"That was issues, rights use language like talking about life, liberty, happiness, property. These are all things, concepts and words that would later be used by Jefferson in a variety of writings, of course, but especially in the Declaration of Independence. This is done just months prior to what? Later to later? to do, I should say months prior to the Declaration of Independence.",
Raffi Andonian,[00:06:48:06],00:07:08:19,"So of course, people at this point don't know the declaration had been coming. But later, with this fresh on their minds, this is what Jefferson is thinking about, among other things, to write what he does in there. For the first time in our conversation here, we see the birth and the notion of the United States. Remember, there was no United States in the prior examples.",
Raffi Andonian,[00:07:09:00],00:07:43:22,"But later on, when the United States comes about as a country, it leans on those ideas. It draws its history and identity backward to draw upon those stories, to help form its identity as a new nation. Because this part of how you get legitimacy as a country is to create some kind of common identity. But of course, in this process, not everyone was participating equally at the same time that you have these declarations of rights and these ideals, you have, of course, American slavery in what is now the United States.",
Raffi Andonian,[00:07:43:22],00:08:08:12,"By the 1770s. And that, of course, is one of the big contentions that comes into play for decades to come in the young country in the younger United States, not only limited to the South, where slavery existed as an institution, but including in New England, where they profited from the slave trade, trading across the Atlantic Ocean, so and not participating equally.",
Raffi Andonian,[00:08:08:17],00:08:35:00,"One way that we can look at this is manifest Destiny, as it was known, manifest Destiny as the term implies, is that it was obvious. It was clear it was manifest that the United States was destined to cross across North America. The continent, from sea to shining sea, from the east coast, and eventually to the west coast. That was obvious to the proponents of this ideology.",
Raffi Andonian,[00:08:35:02],00:09:03:23,"Thomas Jefferson on the left there, famous for the Louisiana Purchase, among other things. Right? The person who wrote the Declaration of Independence was visualizing a land of independent yeoman farmers. Yeoman farmers are middle class farmers, independent property owners, which, if you think about it to this day, we have that ideal. Right. And what happens when somebody comes out of school, they should, you know, come out of school and buy a house or get married and buy a house, right?",education
Raffi Andonian,[00:09:03:23],00:09:27:11,"We still identify buying a house and maybe the white picket fence with the American dream. And so that notion of owning your little piece of property, your little piece of land still exists with us today. Now, in the process of doing so, however, manifest Destiny is tied to groups that were not participating in it. Look at the painting on the right side.",
Raffi Andonian,[00:09:27:11],00:10:08:09,"They're very famous in the 1840s, circulating across the United States, depicting manifest Destiny, depicting Lady Liberty over there, depicted as a white angelic woman that is crossing the continent across the savages as they saw that were on the landscape, bringing civilization to the wild. Because we saw the West as wild, which we still to some extent do despite all the long history that is there of people not only from the Spanish colonial days of European descent, but of course, well before any Europeans had ever come to North America in the process of expansion.",history
Raffi Andonian,[00:10:08:13],00:10:38:08,"Intertwined with that was not only some kind of exclusion, if you will, of American Indian groups across the West and of Mexican and other Hispanic groups that were in that region, but also to exclude black Americans because there was a fight that eventually led to a civil war with a series of compromises. For example, the Missouri Compromise in 1820, or the compromise of 1850 or later on the Kansas-Nebraska act in 1854.",conflict
Raffi Andonian,[00:10:38:10],00:11:14:04,"All of these are pieces of legislation. The United States Congress, that are fought over by slave states and free states. That it states that support had slavery, and states that did not have slavery, that wanted their interests to expand out West. And these fights over whether the newest state and the latest state that is coming into the Union from the West should have slavery or not, were part of what eventually led to the Americans Civil War, so tied with this American dream of visualizing the opportunity that we see, both economic and idealistic, both of the farm and a civilization that we thought we were getting across from the East Coast.",labor;conflict
Raffi Andonian,[00:11:14:04],00:11:39:01,"If you are a English descendent or white American from the East Coast, tied with these is the exclusion and eventually the war. And so now, during the Civil War in the 1860s, shortly after that period of the big manifest destiny mentality, you have, of course, the battle of Gettysburg, one of the defining battles of the Civil War. Civil war, of course, is for four years.",conflict
Raffi Andonian,[00:11:39:03],00:12:07:14,"And there's two main objectives. First, of course, to preserve the Union as the southern states that formed a Confederacy had left the United States, but they had done so because they wanted to protect their interests in slavery, because they did not think that Abraham Lincoln or others in the North were willing enough to protect slavery, enough. And Lincoln and the beginning of the war did not always see slavery as an important cause to in during the process of the war.",labor;conflict
Raffi Andonian,[00:12:07:14],00:12:27:18,"However, during the war, he comes around and says, you know, we need to get to a root cause of this, in part because of Frederick Douglass being on his ear saying, you know, we should preserve the Union without ending slavery. You're going to have the same problem again in the future. So they add the objective of ending slavery to settle this and get this done.",conflict;labor
Raffi Andonian,[00:12:27:18],00:12:54:00,"So they don't have to deal with this again. Well, one of the big places that Lincoln helps announce this shortly after the Emancipation Proclamation that is legally trying to declare slaves free. What happens is he speaks at the Gettysburg Address after the Battle of Gettysburg just a few months later, when they established the National Cemetery, which you see images of right here on the screen and then upper right.",conflict
Raffi Andonian,[00:12:54:05],00:13:19:06,"What I particularly enjoy showing here that I appreciate is this is the graves of the unknown soldiers, because those graves are so small, because they're numbered. They do not have names. Men who sacrifice their identities in order to give what Lincoln called his Gettysburg Address the last full measure of devotion. But also in his Gettysburg Address, he refers to unfinished work.",
Raffi Andonian,[00:13:19:08],00:13:45:00,"The unfinished work he refers to is what he would call the new birth of freedom, right? In his Gettysburg Address. So what you see here is a civil war becomes this moment, this moment of thinking about who we are as a country and defining and redefining the American dream, the unfinished work that she saw that the country had to get that new birth of freedom.",conflict
Raffi Andonian,[00:13:45:00],00:14:09:15,"And you notice that the new birth of freedom sounds a lot like the man who gave the sermon, the sermon for sinners in the hands of an angry God with, of course, Jonathan Edwards talking about that opportunity for redemption. These ideas and these mindsets permeated would be the bedrock of how we thought about ourselves. Despite being decades or sometimes centuries apart.",religion
Raffi Andonian,[00:14:09:17],00:14:48:00,"One way I feel connected to this is with this pen right here. This is a pen made of the wood of a witness tree. A tree that is that witness that was next to Abraham Lincoln when he gave the Gettysburg Address. And to me, this is a very direct connection to that moment to understand that we still carry with us today this notion and fighting about the American dream and fighting what that new birth of freedom means, and debating what exactly these issues and how they should unfold, whether economically, ideologically, in our identity and even our history.",
Raffi Andonian,[00:14:48:02],00:15:14:23,"And this pen was right there to hear Lincoln say those words, not as a pen, as a tree at the time, but now in the form of a pen that I keep with me for my time. Having worked at the battlefield of Gettysburg and having led thousands of visitors across that very cemetery. Now the military is an important place where these things play out almost a century out of after the Civil War and after.",conflict
Raffi Andonian,[00:15:14:23],00:15:45:12,"Now we had a constitution that was reworked because of the 13th, 14th and 15th amendments that ended slavery. protected equal rights and equal access and of course, provided voting rights of meaning that they, prohibited discrimination based on race that was still only for men, not including women, but at least what happened in the process here is they tried to again uproot the causes of the Civil war, eliminate race based discrimination, at least legally.",conflict
Raffi Andonian,[00:15:45:14],00:16:26:17,"But it wasn't. Over almost 100 years later, these issues were still going on. And the reason I point out Harry Truman and World War Two is you see the images of a Second World War and Harry Truman himself here is because people often forget that in the Second World War, as we fought as an army of liberty, an army that brought liberation to the world from oppression, from Hitler, and of course, ending the war in the Pacific theater with the atomic bomb, justifying it because we were bringing our ideals and of course, eventually build allies with both Germany and Japan that we have to this day with the alliances.",conflict
Raffi Andonian,[00:16:26:19],00:16:56:17,"But we did that. The Army of the Liberation as segregated soldiers. Most people forget that the soldiers who fought in World War Two were segregated in white units and black units. That was common. That had been true since the civil War, when black soldiers were first allowed to enlist. And we had done that for all the wars since for almost a century, because we believed that black soldiers would not as capable of as white soldiers.",conflict
Raffi Andonian,[00:16:56:19],00:17:27:00,"But Harry Truman in 1948, with an executive order putting together a committee, ended that. And so it's only relatively recently in the context of history, when you consider that we had more decades of and more wars fighting with segregated soldiers than we have with integrated Army military units and Harry Truman address that, helping bring, if you will, access to the American dream through the military.",conflict
Raffi Andonian,[00:17:27:00],00:17:50:22,"And the reason I say access to the military American dream for the military. It's because many soldiers who fought, who were not white often did so to prove their patriotism, to prove that they too are full Americans, that they too are willing to commit and risk that sacrifice. And in recognition of that, Truman understood that and had this executive order.",conflict
Raffi Andonian,[00:17:50:24],00:18:15:01,"So the military is very much intertwined with notions of civil rights and participating equally in the American Dream. And so, speaking of participating equally in the American Dream, that leads us to the civil rights movement and Martin Luther King, I have his life span there because his life, of course, was cut short. He could still be alive today at the age of he would be 93 years old, younger than my grandmother.",conflict
Raffi Andonian,[00:18:15:02],00:18:38:01,"And Martin Luther King, of course, is that him by himself and doing this movement, you can see, you know, many people there on the Washington Mall. And of course, he was not the only leader, but we see him as the face of the civil rights movement. It's no surprise that the civil rights movement took place in the aftermath of World War two, because many soldiers as big as World War Two was.",conflict
Raffi Andonian,[00:18:38:06],00:19:04:11,"Many soldiers came home and they thought, well, why did I serve my country? And I'm treated as a second class citizen here. Remember, we still had Jim Crow segregation through and after the end of World War Two. It's not until Brown versus Board of Education, the Supreme Court decides in 1954 that legally ends segregation. Although take another 20 years to actually implement some of those laws.",conflict
Raffi Andonian,[00:19:04:17],00:19:26:01,"So you think about it. Yes. We may have integrated the military shortly after World War two, but society on the home front was still segregated to some soldiers and veterans in this case would come home and recognize that. And that ignited a certain passion and a certain movement to say, well, maybe we should do something about this. And many people came to the fore.",conflict
Raffi Andonian,[00:19:26:01],00:19:43:00,"But Martin Luther King, being one of the big figureheads that we remember today, and on the left there is a home that he grew up in. Another site that I used to work as a park ranger, as I did for the Civil War, and now here at the Civil rights, at a civil rights site right in downtown Atlanta.",conflict
Raffi Andonian,[00:19:43:06],00:20:03:01,"The home of Martin Luther King. As a child. I don't work there anymore. But what it did to me is it reminded me that how I was dealing with some of the same issues that I had seen from events that took place a century prior, historically, and a moment that I remember most transcends even people here in the United States.",
Raffi Andonian,[00:20:03:03],00:20:27:09,"I was standing there on that porch that you see with the door and the staircase, and I was leading a group of kids with a chaperon, kids between age nine and 13, scarred, some of them lashes on the neck. One of them had the skull pushed in. Clearly, these kids had been through a lot and they didn't really speak English.",
Raffi Andonian,[00:20:27:11],00:21:03:07,"In speaking to the chaperon, as I was on that porch walking up the stairs, a chaperon revealed to me that these kids were slaves. Escaped slaves. This is in 2010, escaped slaves in 2010, aged 9 to 13. So let's call it born around a year 2000 plus or minus. Their escape from the illegal human trafficking trade in Haiti and only recently come to the United States through this program that the chaperon helped lead, and this site that they said they wanted to see was the home of Martin Luther King.",
Raffi Andonian,[00:21:03:09],00:21:32:18,"To me, it was such a powerful example of two things. First, the power of place. They wanted to see the place to be there, to feel connected, as I did with this pen. And when I was at the National Cemetery at Gettysburg. But to the power of the American dream, to figure, like Martin Luther King, to transcend just those of us that live in the United States, to be global and across time.",
Raffi Andonian,[00:21:32:20],00:21:59:16,"Because remember, Martin the King was killed in 1968. These kids were born 30 plus years later and were in front of me, 40 plus years after Martin Luther King had been killed. And yet this legacy meant something. The American dream to them meant something. The land of opportunity. The image of it meant something to them, and they connected to it through history.",history
Raffi Andonian,[00:21:59:18],00:22:32:01,"More recently, when we look across these issues that we deal with, one way we think about the American dream and access to it is on our currency. What you see there is myself doing a TV program on a CBS station and the American Women Quarters program that is by the US mint, ongoing from 2022 to 2025, is the first year, 2022 that they did it, that is, that they have five women a year honored for four years.",
Raffi Andonian,[00:22:32:03],00:23:00:10,"So that is 20 women across the four years, five times four on the back of the quarter. And I brought this with me here today. You can see the quarters right here, that same prop that you see that is on the TV screen. These are the five women currently in 2022. And you can see that these five women who you can pull up if you just Google us, mint, American Women's Quarter Quarters program, you will find it.",
Raffi Andonian,[00:23:00:14],00:23:18:22,"Just make sure going to the US myGov website. So you're going to read to their website. And of course on the other side is George Washington. As you see here, and expand it on the screen, as I gave one example with Maya Angelou, who's one of the women who is honored. Now, I want to emphasize this. These are not commemorative coins.",
Raffi Andonian,[00:23:18:22],00:23:46:05,"They're not silver. They're not collector's items like my collecting, but they're not being made just for collecting. They are circulating in our pockets. You can go to your bank and ask for it. You can buy rolls of the quarter quarters from the US mint because currency money is used. Nations honor the heroes and it literally carries value because it's worth something and we carry it in our pockets.",
Raffi Andonian,[00:23:46:07],00:24:30:01,"And what you see on screen there is on par with George Washington, of course, another American hero, perhaps the American hero. And the other side is Maya Angelou, a poet, social activist of the 20th century, one of the most famous and transcendent folks to talk about and bring attention to so many social issues, both in Martin King's era all the way into the 2000, when she won multiple national awards, recognition from the United States presidents, multiple US presidents, speaking at Bill Clinton's inauguration, making history, being awarded a National Medal, National Medal of Freedom from President Obama.",
Raffi Andonian,[00:24:30:03],00:25:11:19,"What's interesting here to me is that it shows you that there are two sides to a coin, that there are multiple ways to look at the American dream. There are multiple access points, multiple people to consider, and different groups and experiences, whether it's that of George Washington and the leaders and the founders that established these ideals, codify them into laws for us to follow, for us to build upon, for us to take for granted and assume that everyone else did, which they didn't at the time, but also have the heroes that come in like Maya Angelou and others more recently who help tell us to complete the picture, complete the ideals that were in the",
