speaker,timestamp,End Time,words,tags
Dr. Erik Hadley,[00:24:23:15],00:24:51:06,"And Belgium will remain part of the French Empire, First Republic and then Empire until 1815 at the Battle of Waterloo. And initially they're very anti church and they come through revolutionaries. They burn churches, they destroy relics, they melt down all the metal, they close all of the monasteries, burn them down as well in some cases, and then forbid all rituals that have any religious, particularly Catholic, element to it.",conflict;religion;culture
Dr. Erik Hadley,[00:24:51:08],00:25:18:15,"And that affects all of these and much again, we're looking at the rich, the the post, the post revolutionary legacy. It takes 50 to 60 years for many of these, many of these rituals to recover back to and when they recover, they change. That's this reinvention process. They're not the same. There's something fundamentally different about these rituals in the late 19th century than them, how they had been practiced prior to the French Revolution.",history;culture;conflict
Dr. Erik Hadley,[00:25:18:24],00:25:38:13,"Here. This is, in the Belgian centenary, a 100 year centenary of the anniversary of its 100 year independence, you can see the combat of Saint George and the Dragon again. You can see this early version of this green dragon with this long tail. Saint George on horseback, a lot of people and watching as spectators kind of chaos, people falling down.",conflict
Dr. Erik Hadley,[00:25:38:13],00:25:59:11,"You see the chin chin with the kind of mock horse around their bodies. They're supposed to protect, Saint George against the wild men and against the devil's. Here's a 1858 version of the of the, dragon himself. You could see the white men carrying him, ... now dressed in plaid. You can see there.",
Dr. Erik Hadley,[00:25:59:16],00:26:18:04,"Eventually, they'll be up to 11 of these tensions. You can see the devils, which are, on the ground with their with their inflatable bags. And then, of course, the wild them with their clubs. And this again shows this is on the ground plus and more. And so it shows again the, the, what's called the muscle of the combat.",conflict
Dr. Erik Hadley,[00:26:18:06],00:26:39:00,"And this is a post-World War Two era version, 1949. But they use this, print multiple times. This is in 1962, and you can see it by this point it has been modernized. Now you see the Belgian flag all over the red, black and yellow flag of Belgium. You see the combat? See, many of these elements have been preserved.",conflict
Dr. Erik Hadley,[00:26:39:00],00:27:07:08,"So you get this notion that we have this continuity between 1795 and, nearly 100 years later, and then 100 years after that, and by 18, 1962, second of my rituals is in a nearby city of at at also a military city, a fortress city, also under the under the purview of the Council of Hainaut. They go in a different direction, but it's it follows a similar line in the 14th and early 15th centuries.",culture;conflict
Dr. Erik Hadley,[00:27:07:08],00:27:34:05,"They're also doing a du pass or Delicas. In this case, they're celebrating a couple saints. First, the saint of the city, Saint Julian, and then also, Saint from the Bible, Saint Christopher. Saint Christopher is typically associated with a great height or statues, etc.. And so, you see, the, the attempts by the local community, again, we see secular innovation into a religious, processional.",religion
Dr. Erik Hadley,[00:27:34:07],00:28:03:10,"They can begin making statues to commemorate both Saint Julian, but more so Saint Christopher. By around 1408, down by 1481. See the first mention of Goliath as a statue of the Old Testament, and of a mock again, a mock battle, much like we see in Mons, but this time in, with with a giant and someone playing David who throws rocks and, defeats Goliath.",conflict
Dr. Erik Hadley,[00:28:03:24],00:28:39:12,"We see the addition of, more, giants later in the 16th and 17th centuries. We see the in the records, both Samson appears, an eagle appears, and all of these, giants are being built by what we call a confraternity, which are basically lay brothers. Like, these are not religious people, but they have a religious association, almost like a masonic lodge today, but a Catholic association, and they were associated also with their guilds and in this case an ad because it was a military city with the defenders of the city, the guild of archers, the guild eventually of cannon years, the guilds of crossbowmen, who who defend the city",religion;conflict
Dr. Erik Hadley,[00:28:39:12],00:29:09:21,"itself and they build these, these these giants by the 18th century, we see the addition of a female character, Madam Goliath. And on the day of the of the festival, which is happens in late August, Goliath comes out and, he marries, madam Goliath. And so we have this mock marriage. And combined marriage is a sacrament in the Catholic Church, but between two artificial figures in this case and then subsequently, David is defeated.",religion
Dr. Erik Hadley,[00:29:10:02],00:29:35:05,"David defeats Goliath in a mock combat afterwards. There's another, picture of, of Goliath and his bride. And in this case, in 2012. Typically, David is played by a child, and typically a child of one of the groups that are associated with building and moving and maintaining the the, the, giants around the city. And so in this case, there's, David of 2012 proposes rocks.",conflict
Dr. Erik Hadley,[00:29:35:05],00:29:42:22,He has three chances to get it in this little hole in David's armor to to bring good fortune to the city.,
Dr. Erik Hadley,[00:29:42:24],00:30:10:09,"The giants meet the same fate, in the French Revolution in 1794, the revolutionaries invade. There's a popular society or revolutionary society in in in the city of at who petitions to to see religion removed from their, rituals. They want to go to more civic communal rituals. Like what associate with the French Revolution, celebrating the nation rather than celebrating, religious associations at a local level.",conflict;history;culture;religion
Dr. Erik Hadley,[00:30:10:11],00:30:40:09,"And so they burn all the giants, they're destroyed in an auto to say, you know, on the date that they should have been marching in August of 1794. But after, after Napoleon, ends the Republic and creates the empire. And in 1804, he also reaches a concordat with, with the Pope. And we see a slow restoration of Catholic practices and worship in France and in areas conquered by France, such as Belgium.",religion
Dr. Erik Hadley,[00:30:40:11],00:31:06:11,"And so the giants are rebuilt in 1806, and by 1809 you start to see, a reemergence of this ritual, but very tightly controlled. It doesn't look anything like what the old ritual, looked at like before the revolution. By 1843, we see a new Goliath in this picture, century later. This is Goliath with the same head, but changing body, types.",religion;conflict
Dr. Erik Hadley,[00:31:07:05],00:31:27:07,"In 1945 and now in today, if you go to the museum and, you can go it's called the Mason Dejounte or House of Giants. And you can see, the in the interim time they're not marching the Giants. You can go see how they're constructed. Here's a picture of my wife, with, Madame Goliath at the Mason.",
Dr. Erik Hadley,[00:31:27:08],00:31:53:09,"Dejounte. So that's the giant processional. What is notable about the giant processional is that, by the one notable difference after the French Revolution is that is no longer religious association with it. It's run by the city government. It's paid for by the city government. It's stored by the city government, the people who, work on the giants and carry the giants, do so, without any sort of religious connection.",conflict;religion
Dr. Erik Hadley,[00:31:53:09],00:32:16:08,"So it, it completely removes itself from the, the sacred religious elements that had been associated with it before the revolution. My third example. Come on, let's get through these pretty quickly. One of my favorites. When I did a lot of work on when I was in Belgium last, February and, January is the Carnival of Binche, and the carnival Binche.",religion;conflict
Dr. Erik Hadley,[00:32:16:22],00:32:37:01,"If you don't know, carnivals are kind of an anti ritual or, inverted ritual. They come, it comes right before lent. Lent, begins on Ash Wednesday and lasts for 40 days until Easter and the and the and lent in the Catholic liturgy is a what we would call a negative ritual. You you abstain from doing something.",religion
Dr. Erik Hadley,[00:32:37:01],00:33:02:14,"It's a it's a it's it's sacred, but negative meaning you don't do something like, for instance, give up fish or give up something else. As part of, of, as worshiping of Christ between Ash Wednesday and Easter, and Carnival emerges in the Middle Ages as the last great hurrah before this negative ritual happens. So in this case, carnival is a positive ritual.",religion
Dr. Erik Hadley,[00:33:02:14],00:33:37:06,"You are doing something, but it's profane. It's not run by the church at all. It's a popular ritual, typically celebrating what we call the lower body eating gluttony, drinking, music, dancing, sex. All of these things are celebrated in carnival. We see carnival celebrations all across Europe during this time. And in Belgium there were many different carnivals. And so the part of the whole story of this is why this carnival, how did it become the most important carnival and the single archetypal form of carnival that Belgium would then, celebrate in the 19th and 20th centuries?",religion;music
Dr. Erik Hadley,[00:33:38:07],00:33:57:10,"We we the earliest archival references to Carnival we have in Belgium are from the 14th century. You can see that it was run by the commune, the city government in some ways, and as this great celebration, leading right up to to lent, the in this picture is a picture I took, of the pyro.",culture
Dr. Erik Hadley,[00:33:57:15],00:34:17:19,"And this is a children's marching group, and this looks very much like a Venetian carnival scene. You can see the pointed hats, the black masks, the pastel colors. And this is one of the modern day groups that march, and they have a special day on, Sunday. So when we think of Mardi Gras, Fat Tuesday, that's the day before Ash Wednesday and, and typical carnival, it's not just that day.",
Dr. Erik Hadley,[00:34:17:19],00:34:39:02,"There's also the Monday to Sunday in the Saturday preceding it are also celebration days. Again, much like we see with the two previous festivals, it's on the Grand Plus in the center square. The highlight of of Carnival are really the jewels. And these are the jewels here. And they wear and part of the day they wear this mask, other parts of the way they don't have a mask on.",culture
Dr. Erik Hadley,[00:34:39:02],00:35:00:10,"And so they have this very famous headdress. And the deals to be a jewel, you have to be what? Used to be a native born son of the town of ash. Nowadays, if you just live in Binche for five years and are a man, you can participate as a Jew. It's a very expensive, endeavor. Jewels are typically from the or drawn from the bourgeoisie.",
Dr. Erik Hadley,[00:35:00:18],00:35:28:08,"The middle class. This was a, initially a Guild City. It had a lot of textiles. Eventually it would become a mining city in the 19th century and still had a fair amount of wealth. So the jewels wear this last wax mask that's from the 19th century, has eyeglasses and a very 19th century mustache. But another part, later in the day, they will take the masks off and wear this, famous headdress, made of ostrich plumes.",mining
Dr. Erik Hadley,[00:35:28:10],00:35:48:21,"And they will march through the city. And this very famous, distinctive medieval costume, and they will throw oranges to the spectators. And, you're considered lucky if you catch one. They have to actually put chicken wire up over all of the windows in the ground. Plus, for fear of breaking it, we're talking thousands and thousands of oranges being thrown through the city.",
Dr. Erik Hadley,[00:35:48:23],00:36:08:03,"You can't throw them back at the jewels, by the way, it's forbidden. So today they're about, a dozen different societies of jewels. They all wear the same outfit on on Mardi Gras itself that Tuesday. They all follow the same ritual, and they all have to be native born sons of the town. That Fat Tuesday starts early.",religion
Dr. Erik Hadley,[00:36:08:03],00:36:22:20,"Early in the morning. It's a picture of me with two of these tools. This is taken at about five inches the morning. They wake up in the pre-dawn blackness. And the oldest jewel of each society is is, honored first. And a drummer will appear at his house in a fight for will appear at his house.",
Dr. Erik Hadley,[00:36:22:20],00:36:38:13,"And then he moves to the next house and he'll pick up the next oldest and then the next oldest until the entire group is assembled of it could be upwards of 80 different men. And then they will move into, the ground. Plus, by around 9 a.m.. And each house, they stop and they have a little tiny bit of champagne.",
Dr. Erik Hadley,[00:36:38:22],00:37:00:18,"It's forbidden to be drunk as a Jew. So it's kind of, in some ways an inverse of carnival. There's they're very, very, regulated, very standardized, very controlled and very, revered. And the girls, they dance in marching these very famous costumes. And then eventually they throw oranges in their fetid and celebrated through the town.",
Dr. Erik Hadley,[00:37:01:03],00:37:22:22,"On the day of Mardi Gras, the day ends after midnight. So they're up for it, and they're on their feet. They're not allowed to sit down or sleep. They're on their feet from about four in the morning all the way to midnight on the next day. So it's it's a pretty serious endeavor. This is, one of the last festivals that happened in Belgium before the shut down the carnival of, of 2020, in late February of last year.",culture
Dr. Erik Hadley,[00:37:23:15],00:37:44:24,"The carnival. We also can thank the French Revolution for understanding something about this carnival. It was it was also banned by the French revolutionaries. And a protest happened and a man named Francois Gaillard showed up in an archive, say, in the habit or manner of a girl, as in the costume of a jail. And that's the first reference we have to the jail is in around 1795, about the same year.",conflict
Dr. Erik Hadley,[00:37:44:24],00:38:11:24,"That picture of the, the combat of and of dragons and molds, and much like these other festivals, we see tight regulation. First, outright ban by the revolutionaries, then after Napoleon and the overthrow of Napoleon, a slow relaxation, but still continued, tight control of these festivals until around 1850. And then we see reinvention after that. This is a picture of the hats that are in storage.",conflict;culture
Dr. Erik Hadley,[00:38:12:01],00:38:33:01,"I had a chance to go meet this man, and it's called a Blue Eyes. Yeah. His name is called Kirsten. His family's been making and making these jewel costumes since the mid-19th century. And then you have this kind of historical commemoration of them. The girl in 1875. This is Auguste Guy, the nephew to that one who protested in the French Revolution.",conflict
Dr. Erik Hadley,[00:38:33:14],00:38:52:21,"This is a picture of him. It's a very formalized picture. You could see the hats holding the oranges and wearing the very famous, what they call the double hunchback outfit, where it's stuffed with straw and the front and the back. The curious origin story of the of the Jews really comes out in the late 19th century, and it relates back to what we call the Spanish legend.",
Dr. Erik Hadley,[00:38:52:21],00:39:09:06,"Remember I said Belgium was controlled by the Spanish, not the French, before the Revolution. And a woman named Mary of Hungary, she had married the King of Hungary. And after his death, she moved to Belgium as the regent of the little countries. She was sister to Charles the Fifth from the beginning of my slides. And she built a palace.",conflict
Dr. Erik Hadley,[00:39:09:06],00:39:40:15,"And back in 1549, that palace no longer exists today. And supposedly she had a festival there in the summer of 1549, a very famous festival. She invited her brother and nephew. The future King of Spain, and they, celebrated for two weeks. And during that, supposedly they either brought Incan warriors from the conquest of, of Peru into the palace, or they had local people dressed as Incan warriors to celebrate the conquest of Peru.",
Dr. Erik Hadley,[00:39:40:17],00:40:14:21,"And that's the explanation for the great hats these these plumed hats. And even they even go as far to say, looking at the costuming of the costume itself, with all of its very intricate detail work on the, on the, the tunic and the leggings, that these might represent the tattoos of a Native Americans. Now, of course, we have no historical evidence to suggest this is true or not, but what it tells you is this attempt in the late 19th century to find historical origins to these celebrations, which go back to the Middle Ages in some ways, because they're folkloric and because they're not as well documented, their loss to the annals of time,",
Dr. Erik Hadley,[00:40:14:21],00:40:37:00,"their oral traditions, passed down that are not documented. And so there's this work by folklorists and archivists and others in late 19th century to say, well, why do they wear these hats? Why do they throw these oranges? Where do they get these costumes? And this 1549 celebration of Mary of Hungary and Binche really stood out of the historical gloom as a likely possible source for this.",history;culture
Dr. Erik Hadley,[00:40:37:18],00:41:00:04,"You see this again? Which is my last try to finish this up in five minutes. I can take questions. The last of my examples. And these are the military marches of the East. Hanno, there are, as I said, almost 100 of them. Six of them were dedicated to, as UNESCO or acknowledges by Unesco. And I picked two of those, six to study.",conflict;education
Dr. Erik Hadley,[00:41:00:14],00:41:24:01,"They're both dedicated to Saint Roch. Saint Rock is the patron saint of disease. We see that, we've seen him appear before and Mons and to protect against the Black Death. And what happens in this area, this, of eastern, Belgium is, the plague breaks out in the 16th century, in 1636, to be very specific.",
Dr. Erik Hadley,[00:41:24:03],00:41:44:04,"And a bunch of chapels to Saint Rock are constructed, and they start doing processional with statues of Saint Rock to try to save the town from death. And of course, these towns are all dead. You know, it wasn't just in 1349 that the plague continues all the way to the 18th century, generate general ivory. Every 20, 30 years, another outbreak in every in the same town will occur.",
Dr. Erik Hadley,[00:41:45:23],00:42:13:06,"And so today, well, as I mentioned, beginning of the talk, they wanted to take the, the statue of Saint Rock out, and tour the town to give this prophylactic protection of the city by carrying it around the city limits and then throughout the city. But, they also wanted to protect the statue. So they started using city militias, carrying initially like, swords and, axes, but eventually, you know, muskets, to protect the statue.",
Dr. Erik Hadley,[00:42:13:06],00:42:31:14,"And so that's where they come. Military saint marches. It's not just the saint that does it. It's there's a military aspect to it. This is a picture of my son and wife, doing what's called the torch lit march. The of the night of the Saint Roch processional, where the whole town. Doesn't matter if you're a military member of one of these organizations or a member of the clergy.",conflict
Dr. Erik Hadley,[00:42:31:14],00:42:56:01,"Everybody has the right to take a torch. Even visiting Americans, it turns out, and walk and walk the the route that will be taken the following day by by the the marching organizations. And that's what's going on here. When the marchers appear, they're dressed in Napoleonic costumes. And this is one of my questions. If this march goes back to the early 17th century, shouldn't they be wearing 17th century costumes?",
Dr. Erik Hadley,[00:42:56:01],00:43:19:12,"Why are they all dressed up as if they were just came back from Waterloo? And, the story I was told was well, after the Napoleonic Wars, of which many Belgian men were conscripted into, they came back and they had their uniforms and they and they just use those uniforms to continue the Saint Roch march, which makes sense, except except for one big problem, and that is these marches were also banned by the French revolutionaries.",
Dr. Erik Hadley,[00:43:19:14],00:43:40:06,"And unlike the other examples I've talked about today, they did not come back after the war. After Waterloo, these marches were still banned until the 1850s, and the first reemergence of them is in the 1860s. So the next question is, well, then why Napoleonic uniforms? And these are gorgeous Napoleonic uniforms. You're talking 2000 men and women today.",conflict
Dr. Erik Hadley,[00:43:40:06],00:44:08:17,"Historically, this was that these were just men that marched. Women were given a special place, but it was a nonmilitary place. In the, in the, in the processional today, we've seen integration of men and women into, into the marches. And they organize much like the jails have different societies of jails, or in the combat of Mons, they have the different groups that hang out together the chin, chins and Saint George, the the white men and the leaf men, while men, they hang out socially and create organizations.",migration;conflict
Dr. Erik Hadley,[00:44:08:19],00:44:37:09,"Here we have different, marching groups, upwards of 15 to 20 depending on the march. And each of these marching groups also includes a band. And these are highly trained, musical, marchers. And then in this case, we can see a sapper regiment. A sapper regiment is basically a military engineering regiment that would create, for instance, trenches, redoubts and other aspects for, say, military, I'm sorry, artillery, combat.",conflict
Dr. Erik Hadley,[00:44:37:11],00:44:59:13,"And, that's where a lot of Belgian men found their place in the Napoleonic Wars. And then the last group, the people who are allowed to carry the statue of Saint Roch, are called the off. And as well as pontifical means the, the, the people's wealth. In this case, they're dressed as if they're North African, military units from the 19th century.",conflict
Dr. Erik Hadley,[00:44:59:15],00:45:26:11,"In fact, what happened was the Belgian, different Belgian groups sent assistance to the Pope in Rome during the Italian unification efforts in the late in the 1870s. And that reflects their, their military costume. And they carry the actual statue of Saint Roch, which you can see here. And each day it's returned back to its chapel and then, the march goes on for 4 or 5 days.",conflict
Dr. Erik Hadley,[00:45:27:11],00:45:48:21,"One interesting aspect to this and kind of close on this so I can take some questions, is how I much like what we see with the carnival about we see kind of a reinvention of tradition of, of the historical origins. And one of these examples in Taiwan, the city of Taiwan, they're in the in the late 19th century, early 20th century.",culture
Dr. Erik Hadley,[00:45:48:21],00:46:19:06,"They reinvent the origins of their march. You'll notice here this says this is in May 1907. Basically, pamphlet for the march and it says 40th anniversary, which would say that the first anniversary would have started in 1867, which it did of the modern March. So later on, by the within a ten years of this one, they will reconnect the march back to this the 17th century, and remove that that kind of interim period of the French Revolution to 1867.",conflict
Dr. Erik Hadley,[00:46:19:08],00:46:48:21,"And all of a sudden it's the 250th. When I last attended one of these marches, it was the 367th. And they ignore this big kind of gap, in the middle of, of the 70 year gap in the March. And they also relocated, the march itself from the outbreak of plague to a warfare example to to explain the military units, in 1654, the city of Taiwan was put under siege by the Spanish, and miraculously, disease struck the Spanish army.",conflict
Dr. Erik Hadley,[00:46:49:02],00:47:16:09,"And that was led to this commemoration of Saint Roch. Saint Roch, in this case protected the city by inflicting disease on the soldiers, and they reconstructed their history around that. That event of 1654, much like the 1549 event and Binche, became this moment of historical clarity for explaining the military uniforms as necessary for the Saint Roch processional. Here we see this sort of pontifical in 1920s.",conflict
Dr. Erik Hadley,[00:47:16:21],00:47:43:08,"You can see that it's not fully standardized yet. In this case, we have people, dressed in this would be like, pre-World War Two, the Belgian Congo. Military uniforms. In 1933, we see a marching band, we see this cannon, which the in historical tradition, the they say the the city of Taiwan is claimed from the Spanish, and they call this the the cannon Spanish Spaniel.",conflict;culture
Dr. Erik Hadley,[00:47:43:10],00:48:06:00,"But it turns out this cannon wasn't claimed by the Spanish. It wasn't even owned by the Spanish. Was in the city, inventory prior to the siege. So we have this kind of creation of tradition or creation of historical intervention in some of these, examples. So I'm going to wrap up there, I think the last thing I want to say is there's some common themes here.",culture
