speaker,timestamp,End Time,words,tags
Dr. Dan Prinzing,[00:27:05:19],00:27:34:21,"If you never witness me in some fashion stepping up to defend others, how dare I call myself an upstanding? So that is the acronym we as Act. And that's the message we're putting out in schools. I'm really excited with the new video we're shooting this month, because we're actually in a school and we're filming two scenarios. One, when the students hear injustice, the second scenario when they witness and it's that freeze frame moment in a video.",education;cinema
Dr. Dan Prinzing,[00:27:34:23],00:27:45:06,"Now, what am I going to do? It's my choice. What am I going to do? Well, obviously for the sake of our video, we're going to make the right choice both times.",
Doug Exton,[00:27:45:10],00:28:00:04,"That's really cool that you're expanding your reach further into the schools. Is that a statewide program? Is like, is the program being adopted by the Idaho Department of Education, or is it more of like a preschool based that this.",
Dr. Dan Prinzing,[00:28:00:06],00:28:27:20,"Yeah. More preschool. I wouldn't use the terminology of adopted by the state. That becomes a whole different process. And it's usually more in curricular materials, which I can speak to, because that was my role at the state when I worked there, many administrations ago. What we're really looking at is we produce resources, and we just because of our donor base, we're able to just send them out to the schools.",
Dr. Dan Prinzing,[00:28:28:02],00:28:49:20,"We also then conduct the training with them so that we can. We had a great, I might add, thanks to funding we had received from the Idaho Humanities Council and supporting through the CARES act, we were able to convert what we had been always are in person. Summer Institute for Idaho educators. And we did it online well and doing it online this year.",
Dr. Dan Prinzing,[00:28:49:20],00:29:15:14,"And the topic injustice to inclusion race. We actually reached into every corner of this state, every pocket with it online. Instead of teachers having to come to us for 3.5 hour, three and a half days, we went to them all online with it. And so we're appreciative of that funding opportunity that made it possible that that's what we're doing so much now is how do we make that outreach by mission.",culture
Dr. Dan Prinzing,[00:29:15:14],00:29:46:15,"We're dedicated to the students and teachers in Idaho. But the reality is our programing, our resources are in classrooms around the country. And because we're an active presence online, we also are reaching internationally. So the other program I would mention, right now and it is just exploding on is is our human rights certificate program. Now, this was specifically an initiative for the business community.",
Dr. Dan Prinzing,[00:29:46:17],00:30:13:06,"We had companies coming to us very active in diversity inclusion. They had policy. They had presence and programing for kind of that top down. And they came to us and they said, but how do we know that our workforce embrace that? How do we know that our workforce are committed to DNI? We are as a company, but how do we know that everyone who works for us is.",culture
Dr. Dan Prinzing,[00:30:13:08],00:30:52:21,"And so we actually received funding from Wells Fargo to develop our human rights certification program. This is a one of the kind in the country. It's a six hour online program that focuses on core human rights principles, diversity, inclusion, ethics, civility and respect. And we couple that with now being upstander in the workplace. You know, those conversations that take place at the watercooler, those things that are set off to the side, how can we then these principles of being an upstander in our community?",culture;labor
Dr. Dan Prinzing,[00:30:53:01],00:31:33:18,"How do we translate these into principles, into the workplace? Well, this is a programing. There's a set that it was just exploded that we went live to the public with the program on January 20th, 2020, Human Rights Day in Idaho, MLK birthday. We have had over 300 new users since January. And every week we get we're we're constantly having to open up new sections to a well, that speaks to me that now, and I would say a lot of it, it's it's coupled with the nationwide attention after the murder of George Floyd.",labor
Dr. Dan Prinzing,[00:31:33:20],00:32:08:09,"And we're looking at the historic roots of racial injustice. I think we have a lot of companies, nonprofits, a lot of organizations within the state that are saying we need to do something. We need to make a statement. We need to be on the forefront of the conversation. And many of them are starting it with the certification program, making sure that they've got a cadre of employees that are certified, making sure that the leadership team I'm loving it is a number of nonprofits are coming in, making sure that their board members are certified.",
Dr. Dan Prinzing,[00:32:08:13],00:32:30:14,"In other words, they're saying, this is who and what we are. This is what we believe in because the certification program is not about what the company needs to do. It's not that the company needs to do X, Y, and Z to promote diversity inclusion. It's what do I, as the employee, need to do to be committed and show.",culture;labor
Dr. Dan Prinzing,[00:32:30:18],00:32:55:09,"So even in the call to action, it's not what am I going to do down the road? It's what am I going to do tomorrow when I show up at work? How am I going to create this respectful, inclusive environment that recognizes the broader value of diversity in our workforce? And even that idea of inclusion, it's not that everybody has a seat at the table.",culture
Dr. Dan Prinzing,[00:32:55:09],00:33:30:13,"That's not enough. It's that everybody that is at the table is able to talk, have a voice, and that we all listen. And so it's those principles. It's that personal commitment. That's the basis of the certification program where folks can say, and literally, we did a number of focus groups in developing the program. And when we talked about what is certification and why be certified number, the employees that we were working with gave us the feedback, and they said, because I can put this on my resume and say, these are the values I believe in.",
Dr. Dan Prinzing,[00:33:30:15],00:33:55:17,"These are the values that when I apply to a company, I hope they uphold. But most importantly, this is who I am. And so that's this for us is a very exciting initiative, certainly expanding to much faster, than what we had even anticipated when we developed it. But you kind of begin to pick up here what we're finding in the work of the US center.",
Dr. Dan Prinzing,[00:33:55:17],00:34:16:11,"And I have to say, it's all borne out of the message in the memorial. That's where we're so tied together with the but rapid thing going real wide and thin with our programing. We have our core concepts that we're just going deeper with, and now we apply those in the classroom, we apply those in the business. We apply those in the community at large.",education
Dr. Dan Prinzing,[00:34:16:17],00:34:41:05,And that's what's real fun with it because the message is working. We have schools participating in our programs around the country. Now we're getting registrations for the human rights certification program from employees around the country. And we're getting questionnaires out of country because it is an online product or an online resource. It's attracting an international audience.,
Doug Exton,[00:34:41:07],00:34:55:09,With that international reach that you are having with this or with the certificate. How does the and Frank Museum in Amsterdam know about you guys here and what is it?,
Dr. Dan Prinzing,[00:34:55:11],00:35:21:10,"So yes, and we've always had a great relationship with it. Relationship. So now it's kind of a fun triad because we have the Anne Frank House in Amsterdam. So I will do special request to them. They to me, you know, as I say, when you are the only in the United States that helps with our credibility and presence with it, and so we'll make some direct contact.",
Dr. Dan Prinzing,[00:35:21:15],00:35:56:20,"But then we have this trade because we also have the Anne Frank center for Mutual Respect in New York. Now they are the direct conduit to the end. Frank House, we're not a chapter. We're not an affiliate. We're an independent but we collaborate. And so it's the programming that can generate among the three of us. And so we have had some great opportunities interacting with the and Frank center for Mutual Respect with, you know, when the memorial was vandalized in 2017, one of the first calls I got was from them.",
Dr. Dan Prinzing,[00:35:56:22],00:36:22:02,"And at that time, their executive director flew out here, brought actors from New York who actually did the production of letters from in and Martin, they wanted to support the community. They wanted to support us. They feature a lot of our work as an Anne Frank memorial. And what are we doing to share? Not only a and story, but it's that broader messaging of human rights with it.",
Dr. Dan Prinzing,[00:36:22:04],00:36:50:23,"And so it always creates this interesting kind of a symbiotic, organic relationship among organizations. I couple that with because we are recognized as an international site of conscience. Well, the headquarters for the sites of conscience are also in New York. And so we've done distinct programing with them where they will call upon us as a site. Last piece I did, since we created the spiral of injustice.",education
Dr. Dan Prinzing,[00:36:51:00],00:37:15:11,"And within the memorial we have the new statue of the other showcasing the spiral of injustice. So we developed a whole piece for them on how do you take a program idea that began at the Cosmos Center, translated into a physical, but became the statue and the memorial? And what is that messaging did in a much broader context?",
Dr. Dan Prinzing,[00:37:15:13],00:37:33:05,"So we're always looking at part know kind of it is the parts and parcel of working with other organizations. Our reality is there's no one out there quite like us because we have this physical memorial, plus then a comprehensive education center to couple it with.",
Doug Exton,[00:37:33:07],00:37:51:19,"Now, you mentioned like adding the statue, which represents the spiral of injustice you were quotation throughout the years of the memorial has been around like as you expanded it. Yeah. And do you plan on adding any given just the recent events throughout the US, but also Idaho?",
Dr. Dan Prinzing,[00:37:51:21],00:38:10:06,"Oh, I love your questions, Doug. With it. Yeah. You're stepping into our head of our day to day work with it. Yeah, a little bit of background with the the original quotes that were etched into the stone in the memorial. And there were over 60 some that were put before the memorial was expanded with the Marilyn Schuler classroom.",education
Dr. Dan Prinzing,[00:38:10:08],00:38:48:11,"Those were selected by a volunteer committee that worked for over two years. We know that words matter. We take words seriously. And this volunteer committee spent hours know thousands and thousands of quotes submitted that they reviewed. But then they were also looking at the context for the quote, who said, you know, we use the example. None of us want the Joe Paterno effect, a great legacy that's diminished or or really shadowed by another event that occurred that really then brings back down the structure of.",history
Dr. Dan Prinzing,[00:38:48:13],00:39:13:02,"And so the idea that these words had to stand and not only the importance but also frame the context of who said them. Well, because we are literally an environment where everything's carved in stone. When we added the Marilyn Schuler classroom, we gave us the opportunity to add seven more quotes. So what did I do? I went back to just like we did it in our origins.",education
Dr. Dan Prinzing,[00:39:13:02],00:39:38:15,"I went back to volunteer committee, some of the committee members for the second round, same that had been on that original committee many, many years ago with it. And we looked at a wide variety of quotes that it was kind of our opportunity to say, okay, the memorial was opened and dedicated to the public in 2002. My charge to the committee is what voices are missing.",
Dr. Dan Prinzing,[00:39:38:17],00:40:09:07,"And so then they took that as their charge and really identifying then their audiences updating, really adding in to. So I think we've got added some very poignant quotes to your question. We're doing it again because when we physically build a new US center for human Rights, there will be opportunity to add a couple more quotes, not only on the building itself, but also on the walkway that will link from the office into the memorial.",
Dr. Dan Prinzing,[00:40:09:09],00:40:36:13,"But this is a long process. I always like to joke on tours that when we talk about that original, community volunteer committee selecting the quotes, one would think that human rights people are always very kind and very considerate of one another. Yeah, until it came to their quotes. And then I'm heard that there are still some hurt feelings within the community of somebody, quote, got selected in somebody else's did not.",
Dr. Dan Prinzing,[00:40:36:19],00:41:00:06,"And in other words, we become very passionate about those words. You know, so on that note, we just created this summer working with Stephanie Inman, a local designer in town. I created a set of 52 cards, 52 quotations from the memorial. So literally now folks can purchase this set and display a quote a week for all year long.",
Dr. Dan Prinzing,[00:41:00:06],00:41:26:11,"And they all the quotes are featured in the memorial. Well, first of all, it was difficult because we went with just 52 cards and we've got over 80 some quotes in the memorial now. And so I'm always telling folks, I hope we selected their favorite, but it really was this chance to this power of those words and what we were hearing from teachers and folks and say, I want these quotes showcased in my classroom or in my office.",education
Dr. Dan Prinzing,[00:41:26:13],00:41:28:20,Added resource. Now.,
Doug Exton,[00:41:28:22],00:41:40:16,"Yeah, no. And I've been there multiple times, and every quote that is in the memorial is beautiful. So I want to congratulate you and everyone that served on this committee for selecting them.",
Dr. Dan Prinzing,[00:41:40:18],00:42:18:01,"You know, a good situation because, you know, certainly one of the strength of the backbone of our organization are the volunteers. Our docent committee is phenomenal. These are folks that dedicate time. Those hours and talent to give the tours and the memorial when we are in a non-pandemic time and we're actually giving tours. Yeah, we're we have tours for over 10,000 students a year where teachers, both K-12 and university, bring in students to really interact with the messaging in the memorial.",
Dr. Dan Prinzing,[00:42:18:03],00:42:38:18,"Well, what I always love is each docent has his or her favorite quote in the memorial. It's kind of like what grounds the space for them? And when I get asked that question, which is my I always go to the Confucius quote because it is such a wonderful starting point for discussion. So right there etched in the stone Confucius.",
Dr. Dan Prinzing,[00:42:38:20],00:42:58:12,"What you do not want done to yourself, do not do to others. Well, you and I know that quote we've heard that in other forms. That is that standard golden rule. With that, we just happened to go with the original source, who was Confucius. And I thought, what a wonderful. When I'm asked, what is the memorial mean to me?",
Dr. Dan Prinzing,[00:42:58:12],00:43:30:06,"Or what is the work of the Smithsonian all about? That's my go to. I said, this is what we stand. We are nonpolitical, non-governmental. We're a nonprofit education center committed and devoted to what? Well, by mission to promote respect for human dignity and diversity through education. Well, to me, Confucius quote says at all. Why would I do to you what I wouldn't want you to do to me?",culture;history;education
Dr. Dan Prinzing,[00:43:30:08],00:43:58:01,"That's also how we begin to build a community. That's how we begin to foster empathy. And that in our programing is becoming a major term. Such a difference from sympathy or, you know, sympathy basically. Yeah. It's a it's rough being you. Empathy. I understand. Yeah. Maybe that wasn't my battle, but I've had mine and I begin to identify with you.",conflict
Dr. Dan Prinzing,[00:43:58:05],00:44:06:02,Where do we begin to find that common humanity? That this is really a shared story?,
Doug Exton,[00:44:06:04],00:44:13:23,Yeah. Do you mind talking more about the design of the memorial as a whole?,
Dr. Dan Prinzing,[00:44:14:00],00:44:56:04,"Yeah. Yeah. Well, I know I think that's a it's important because I think a lot of folks don't recognize the purposefulness in the design. The, so certainly as the centerpiece is that bronze statue of Anne Frank. Had the memorial been just that statue, perhaps the amphitheater in front of it. And if you've noticed, behind the statue etched into the concrete the size of the secret annex in Amsterdam, had it been just that Anne Frank story right there?",
Dr. Dan Prinzing,[00:44:56:06],00:45:28:05,"It would have been the Holocaust monument, the Holocaust Memorial. We had a student years ago who was doing her graduate study at Yale. She was looking at Holocaust memorials across the United States in her study, she selected five that she wanted to personally visit. And we were one of the five. She looked at those who were kind of the unexpected in Holocaust memorials or monuments.",education
Dr. Dan Prinzing,[00:45:28:05],00:45:54:18,"If it is a community that has a large Jewish population, probably not a surprise. Yeah. So if you're up on the grounds of a synagogue, probably not a surprise. Boise, Idaho. Yeah, a major surprise. And so that's why she wanted to come here. And what caught her was just to your question. It was the design of the memorial itself.",religion;boise
Dr. Dan Prinzing,[00:45:54:20],00:46:26:05,"Because she echoed. Had it been just that Anne Frank piece that would have made it just Holocaust? But the moment and looks across the amphitheater, there's the Universal Declaration for Human Rights, born out of the ashes of the Holocaust. She said, now we've expanded that story. So in the design, it really the memorial is a journey. Not only is it an journey, but it's our journey.",conflict
Dr. Dan Prinzing,[00:46:26:07],00:46:58:21,"It's your journey. It's mine. It's I had one goal when we expanded with the addition of the classroom. I said I want everyone, anyone to come into the memorial and find the piece of timber there so that they are there. Their story is represented with it. And so that's what you get the design. So architecturally, do we have symbolically the Amsterdam skyline, the arches, the angles of all the walls and the roof line.",migration;education
Dr. Dan Prinzing,[00:46:58:23],00:47:22:00,"Amsterdam has the canals. We have the Boise River, Amsterdam has the bridges over the canal. We've got that great historic trestle bridge that enters into the memorial. You've got that vantage where? And looks out the window. Now, realistically, we know she didn't do that a lot. It would have been far too dangerous. So when they were in hiding.",boise
Dr. Dan Prinzing,[00:47:22:02],00:47:55:23,"But conceptually, it is her look out into the world. It is her longing. It is her inquisitiveness. It is her hope. But Elias, Anne's last immediate surviving relative, who was her cousin three years older, came to Boise in 2014. It was he. He was the director of the Friends of Anne Frank in Basel, Switzerland. They control anything and everything and Frank everything.",boise
Dr. Dan Prinzing,[00:47:55:23],00:48:20:05,"Anne Frank is under copyright. It was he who granted us the permission to use the Anne Frank quotes in the memorial. He had never been to Boise, Idaho. He was a professional actor in Europe is in addition to running the friends of Frank. Well, in 2014, at the age of 88, he was coming to the United States to speak in L.A. and he said, I'm going to fly up to Boise.",boise
Dr. Dan Prinzing,[00:48:20:07],00:48:47:11,"He came to the memorial. He came to that bronze statue of and he grabbed her elbow and he just started to weep. He said, this is my cousin, and there's nothing like this anywhere else in the world. He said, for what you have captured here in the design, it is and is complete story. Yes, it is the Holocaust, but it is her hope for humanity.",
Dr. Dan Prinzing,[00:48:47:13],00:49:14:12,"And he said that doesn't exist elsewhere. And that's what's so resonated with him. It was that much broader design when we added the Marilyn Schuler classroom. We had an educator that pointed out something I had not even realized in the construction. Initially, when the memorial was built, the statue of and kind of stood at the at the side margin dating from.",education;labor
Dr. Dan Prinzing,[00:49:14:12],00:49:56:11,"And then you went forward to the UTHR and then over to the quote circles. She was on the margin of the memorial. When we added the classroom, then all of a sudden she became in the center and the educator said, it is as if now the memorial has wrapped its arms around and she and I thought at the time how symbolic that is when we are working with those who have been identified or viewed as the other, when are they like and going to feel safe to come out of their hiding when they know they had been embraced by a community?",education;conflict
Dr. Dan Prinzing,[00:49:56:13],00:50:23:14,"When they know that there are arms of a community or wrapped around them to protect them. And I thought how visually symbolic now that the memorial is wrapping its arms around and say, you're safe here. When the memorial was vandalized in 2017 at a young man who texted me early one morning, me said, I feel like I need to just come down and stand by and I want to protect her.",conflict
Dr. Dan Prinzing,[00:50:23:16],00:50:37:07,"And I thought, there we go. That is what the memorial does, is we want to stand together. We want to protect one another. That's how we build a community.",
Doug Exton,[00:50:37:09],00:50:52:17,"Yeah. And I was in the industry about two years ago, visited the Anne Frank Museum. And I can definitely attest that the memorial here in Boise, it complements the museum. But they're they're very different.",
Dr. Dan Prinzing,[00:50:52:19],00:50:54:15,"And so, yeah.",
Doug Exton,[00:50:54:17],00:50:59:23,"And different in good ways. Not. Yeah, different in bad ways. Yeah.",
Dr. Dan Prinzing,[00:51:00:00],00:51:18:13,"I think it just tells more of the story, you know, that they become moments in time. I think what I appreciate so much and not only in my role at the center, but in, you know, I get the great pleasure is I get to step out to that memorial every day. You know, I always say the memorial is my office.",
Dr. Dan Prinzing,[00:51:18:15],00:52:04:02,"Yeah. And what gives me such pleasure is when you recognize that it is not just about a moment. I would say it's about a movement. It is about much more than ourselves. That it is much more about our aspirations, that it is much more of our vision for community. And how do we come to that? You know, I equate that a lot with what we're seeing nationally that will the murder of George, George Floyd and others that that are continuing is see in the news marking this that this is more than a moment that this is a movement for justice.",
Dr. Dan Prinzing,[00:52:04:04],00:52:35:16,"So back to your question a bit ago about new programs. We have a phenomenal committee this summer also working on. I said we had crafted our spiral of injustice to examine that revolution. This summer, we're working on the spiral of justice. How do we now begin? From the me space into something much larger than myself? To foster or to encourage a free and just society.",conflict
Dr. Dan Prinzing,[00:52:35:18],00:52:58:03,"So I'm really excited because this is going to be a wonderful companion piece with the spiral of Injustice. I think that's the key point in the center's work, is we never want to leave folks hopeless or leave in the negative, yet we want to feel the hope, and we want to feel the empowerment that I can make a difference.",
Dr. Dan Prinzing,[00:52:58:05],00:53:21:03,"I've been using a lot in presentations this summer, especially in our work as Upstander. It's not that you and I have to do the same thing. It's just that you and I do something. How you choose to be an upstander may look very different than how I do. That's what we're seeing in this movement rather than a movement.",
Dr. Dan Prinzing,[00:53:21:05],00:53:46:17,"Because what are folks doing? Yeah, some are writing checks to support the work. Some are marching in the streets. Some are doing a lot of education for themselves. Some are having some real tough conversations at home. But to me, that's all the hope. And that is what the memorial represents. That let's start that conversation. Let's begin to not only reflect act, but let's act.",
Dr. Dan Prinzing,[00:53:46:19],00:54:12:13,"I've often said to when we added the Maryland to the classroom, and it is really the example of who Maryland Shuler was in her career and in her influence in the state. She was also one of those visionary founders of the memorial. She was also always needling me. She would challenge me with it because her mantra was always, what are we going to do?",education
