speaker,timestamp,End Time,words,tags
Dr. Dan Prinzing,[00:54:12:15],00:54:37:05,"How could we step up? It's not enough to just talk about the issues, or to think about them or to reflect upon. She said, that's nice, but what are you going to do about them? What are you going to do to make your mark in the world as an upstander? And I so appreciated that challenge because what in fact she did was also craft part of the message of the memorial.",
Dr. Dan Prinzing,[00:54:37:06],00:54:53:17,"It is a call to action that in this moment, you have to each decide, what are we going to do? And if we choose to do nothing, that's also a choice. But is that the right choice in this time?",
Doug Exton,[00:54:53:19],00:55:16:20,"No. I think that's a very beautiful messaging, and I love how you're able to tie it back to Maryland. Yeah. All the way. Now, beyond the vandalism in 2017, that was all over the news. Have you either witnessed or heard or know anything about the response from hate groups that are still in Idaho? About the memorial?",
Dr. Dan Prinzing,[00:55:16:22],00:55:19:03,"Well, there is always.",
Doug Exton,[00:55:19:05],00:55:20:15,Any response from them.,
Dr. Dan Prinzing,[00:55:20:17],00:55:44:18,"Yeah. Well, you know, it's one of those that, you know, what a person should never do is Google their own name. Because you don't like to see what comes out. Yeah. And when I have done that where I have been cited and what sources have cited me and the accusations made not only about the vandalism or what the memorial, that can become a little disturbing.",
Dr. Dan Prinzing,[00:55:44:22],00:56:21:19,"So you should you should never do that. Okay. What is our reality? We know hate groups exist. You know, at this time they've also been emboldened that they have always existed. But now they've almost come to the forefront become mainstream. Yeah. I was, talking with a colleague today and we were looking at images that came out of San Diego of literally cars driving down the interstate with full scale large swastikas in the back made proclamation.",
Dr. Dan Prinzing,[00:56:21:21],00:56:44:23,"This is who and what they are with it. Okay. This attitude has been emboldened with it. Where we know that exists. Yes. But I'm going to take you back to, as you mentioned, the vandalism. I had a reporter, a national reporter called me and AP we the vandalism broke first locally, nationally and then went international. The reporter asked me the one question, which is this who and what?",
Dr. Dan Prinzing,[00:56:44:23],00:56:52:07,"Boise is? Well, that one hurt because she was immediately taking us back to that area and compound.",
Doug Exton,[00:56:52:09],00:56:53:01,You know.,
Dr. Dan Prinzing,[00:56:53:03],00:57:22:06,"My response to her at the time was, watch and listen to how the community reacts, not to the act of an individual or an individual that brought hate into the memorial. What how did the community react? Overwhelming. It was as if someone had broken into their homes. And that memorial is personal. What did they say? It was a ground.",
Dr. Dan Prinzing,[00:57:22:07],00:57:55:23,"You know, was the ground up effort. You know, and that's mine. How dare you step into that space that I helped funded with my pennies and nickels and dimes that came from students and businesses and individuals alike? And ultimately, when that reporter wrote her article, it was an article about how a community stands up to hate. Well, since that vandalism in 2017, we know that the community is watching over the memorial.",
Dr. Dan Prinzing,[00:57:56:00],00:58:30:23,"We know even that we officials in state government, whether at the municipality or at the state level, are watching this because as we started with, that memorial represents our shared values. This is who we are. So I'm going to always insist and some accused me, I have pink colored glasses or that I'm a little pollyannaish in my attitude with it, but I'm going to insist that the memorial represents more of us, of who and what we are, than that Aryan compound ever did.",
Dr. Dan Prinzing,[00:58:31:00],00:58:40:23,But that was a small band of people that had gathered together that just happened to get a lot of media attention. But that's not who we are.,
Doug Exton,[00:58:41:00],00:58:54:04,"Yeah, I feel like that touches to Idaho as well. I know as a whole isn't like that. There's just a few that end up getting the media coverage. Yeah, and make it look like that.",
Dr. Dan Prinzing,[00:58:54:06],00:59:22:09,"Exactly. And so I think it's a reputation that we're always going to be fighting. I think unfortunately out of that hearing compound we got branded. That's why I always get very excited when national media sources pick up on the memorial, when nationally were being looked at for that human rights certification program. Because to me this is a much better branding opportunity for the state.",
Dr. Dan Prinzing,[00:59:22:11],00:59:46:18,"Now, you know, when you have legislation that targets the transgender community, other pieces that were passed. Yeah, it kind of harkens back to what some folks think about us as a state. But I'm still going to push back and say it's not who we are. It's not who we are that we are. Just as that slogan from the early 90s.",
Dr. Dan Prinzing,[00:59:46:20],00:59:50:05,We are too great for hate.,
Doug Exton,[00:59:50:07],01:00:01:06,"And I think that is a gorgeous way to end tonight's talk, because we are unfortunately out of time. So thank you to everyone who attended and thank you, Dan, for having this talk with us tonight.",
Dr. Dan Prinzing,[01:00:01:08],01:00:03:19,Thank you. Thank you for the opportunity.,
Doug Exton,[01:00:03:21],01:00:10:18,"Yeah. Have a good night, everyone.",
