speaker,timestamp,End Time,words,tags
Dr. Erik Hadley,[00:48:06:00],00:48:34:16,"We see religious origins, particularly of disease and plague is a common element to the origins of these rituals. These communities are in crisis and strife. And, they they're looking for some control or agency over these events. And they turn to the two religious elements, particularly, saint worship. We see popular secular appropriation of these rituals, which leads to tension both with religious authorities and secular authorities over disturbances and civic problems, as well as public drunkenness and, fighting and dancing and things like that.",religion;culture
Dr. Erik Hadley,[00:48:34:18],00:49:10:07,"There are a lot of crossover elements of these rituals. We see wild men in the combat of malls, but also we see them actually a bit in acts with the Giants. We see Saint George in both of these. We see Saint Roch across all of them, many ways. The torchlight marches, which were part of the military marches, are then appropriated back by the, but the combat, in modes, we see this big crisis of the revolution and the post-revolutionary era, and then a recovery in the later 19th century and this turn to the creation of origin legends, often going back to the Spanish occupation.",culture;conflict
Dr. Erik Hadley,[00:49:10:09],00:49:37:23,"We see standardization, and in this case, the 1930 centenary is really important to standardize these rituals. There's crisis in the 1960s and 70s, particularly driven by economic crisis in Belgium as the decline of the coal and iron industry, but then recovery and, UNESCO status. And then we see new challenges, for instance, what status to women have in these typically exclusively male, rituals.",culture
Dr. Erik Hadley,[00:49:37:23],00:49:51:18,"And in the case of the military marches, we see an open acceptance of women into the ranks. So I want to stop there and leave about ten minutes for questions. So that's Doug. I'll turn it back to you. Thank you.",conflict
Doug Exton,[00:49:51:20],00:50:12:12,"Awesome. Well, thank you for all the information. It was quite a wonderful presentation. Definitely learned a lot. The first question I wanted to ask was in the military marches, there was kind of an obvious, influence from other, you know, people in other cultures. You know, case in point, the North African uniforms and the uniforms from Napoleon.",
Doug Exton,[00:50:12:14],00:50:25:14,"Was there other influences on these other festivals, even ones he didn't talk about since Belgium kind of acted as that, you know, battlefield for all of Europe just kind of, you know, navigate through.",
Dr. Erik Hadley,[00:50:25:16],00:50:45:03,"Yeah. I mean, for instance, in the Carnival of Binche, there's a lot of associations of the costume which are assumed in some people, some associations have been that they have these dramatically Spanish origins where they're getting the oranges from. Well, the assumption is they're getting them from Valencia, which is a Spanish province. They're being brought up into early spring, up into Belgium because of the Spanish trade networks.",
Dr. Erik Hadley,[00:50:45:03],00:51:07:10,"And the Spanish rode up to Belgium. And then they're they're seen as these like enormously treasured artifacts in a, in a pre-industrial world to have access in late winter to, to fresh oranges, which are then thrown by the community, by these deals, out to the community and, and the kind of exotic ness of the headdress itself as Native American, in fact.",
Dr. Erik Hadley,[00:51:07:10],00:51:31:12,"And that being said, there's been in the last 30 years, there's been a lot of research on this, and the jury's still out, but a lot of historians are pushing back against the Incan origin, concept and say, well, maybe, maybe it's more local. Maybe people in Binche, like did this on their own, but it's clear that it's because of this access to the Spanish trade, to a mediterranean trade, to have ostrich feathers, to have oranges.",education
Dr. Erik Hadley,[00:51:32:18],00:52:04:17,"That, that, that you can see the, the foreign, influences, in the, the Saint Roch marches with the Napoleonic uniforms. They, they're often dressing up as French regiments of, of the Napoleonic the most, the highest, like the Imperials and the Napoleon's Imperial Guard, are represented there. So on the one hand, they carry these Belgian flags, and the other hand they see themselves as part of the of the French Empire or are commemorating their their participation in the French imperial struggles of the early 19th century.",
Dr. Erik Hadley,[00:52:04:19],00:52:08:18,"So in those cases, yes, there are a lot of foreign elements.",
Doug Exton,[00:52:08:20],00:52:28:15,"And speaking of local, I'm wondering if you can talk about kind of using folklore as, you know, part of your identity, whether it's, you know, I was like a personal identity or from what I've kind of gathered is that all these cities have these festivals as part of what makes their city unique.",
Dr. Erik Hadley,[00:52:28:17],00:52:49:01,"It is it is central to their identity. I mean, even more in Boise, for instance, if you're from Boise, you probably know the Jaialdi Celebration, which is, I think every five years and every five years, 3 or 5 years, which is a Basque celebration in the Basque Quarter in Boise. And it's enormously influential and significant to the Basque community, but also to the city of Boise.",boise;culture
Dr. Erik Hadley,[00:52:49:03],00:53:15:17,"This is like that times a magnitude, you know, you have thousands and thousands of people that participate in each of these rituals. And, they're also major tourist draws. And what you see is a lot of cross-fertilization. Like when I was in Belgium last year, I became friends with a fifer in one of the military marches who was being hired by one of the, the Jills in Carnival to be his fifer for the carnival celebration.",culture;conflict
Dr. Erik Hadley,[00:53:15:17],00:53:52:08,"So the so he was going over to work in Binche as, for carnival. But then later on in the year, back in May, he would go back and be and wear his, his Napoleonic uniform and be in a marching band there as well. So I would argue, I had so much positive, interaction and response when I told people what I was doing in Belgium, there was this enormous kind of his gratitude towards me, but happiness that there was an international recognition of the folkloric significance of these traditions and that they that these could be shared beyond the kind of immediate French speaking world that they lived in.",history
Dr. Erik Hadley,[00:53:53:05],00:54:13:23,"And so I had a lot of doors open. I was invited to, all of these festivals, to, and to, to watch them firsthand, to meet the people of the organizations, to come into the museums and work in them. So I was I have a lot of gratitude towards the different Belgian organizations, but they have really taken folklore to a next level they make.",culture
Dr. Erik Hadley,[00:54:13:23],00:54:38:04,"This may have made folklore the centerpiece, the front and center, part of their civic identity and individual identity. I didn't get into some of the slides, but some of those later slides, they show, a grandfather and a grandson who are all who have been in the same regiment dating back to the 19th century and who's whose, son will be in the next level of the regiment and is already dressed in a children's uniform.",culture
Dr. Erik Hadley,[00:54:38:09],00:54:44:00,"So you see these these genealogies of people, that are attached to folklore.",culture
Doug Exton,[00:54:44:02],00:55:05:03,"And I was going to say you talked about, you know, that tradition with age and, you know, direct ties to the town. So definitely seems like, you know, who's been here the longest, really plays a role into that hierarchy, you know? And like you said, the child, you know, already being a part of it because the entire family has been there.",
Doug Exton,[00:55:05:03],00:55:08:09,"So that sense of pride there, I think that's really interesting and really cool.",
Dr. Erik Hadley,[00:55:08:11],00:55:33:21,"And they, you know, in some ways democratize these rituals. Some of them were seemed really elitist in the 1950s and 60s, and kind of old to a younger generation of really an Americanized generation, postwar baby boomer today generation who really the 1950s and 60s started to reject these rituals as kind of archaic and sexist and traditional, and in response to the folklore evolved in response to them.",culture
Dr. Erik Hadley,[00:55:33:21],00:55:51:24,"For instance, in molds, up until the 1960s, all of those people that acted on the combat were paid actors and typically lower class paid actors. And by the late 1960s, a certain the whole festival kind of started to get this CD aspect to it. A public drunkenness and kind of lower class interest. And like people didn't know what was going on.",conflict
Dr. Erik Hadley,[00:55:51:24],00:56:12:15,"They were just being paid. And so they renewed the whole festival in the 1970s and said, now we're no longer going to hire people to do this, and we're going to we're going to invite people to do this, and we'll take applications. And all of a sudden it wasn't just wasn't become class based, but it became much more people from lower classes and upper classes and the middle class all found, dignity and restraint in what they were doing.",
Dr. Erik Hadley,[00:56:12:21],00:56:31:13,"And you see that with the Jills who move Carnival in a very different direction in Belgium. And you see other places where there where the spectators can drink and dance and do these things. But the, the participants themselves are very, very, you know, very dignified. And you see the same generationally. You see that with the Jill's the son of a Jill.",
Dr. Erik Hadley,[00:56:31:13],00:57:12:03,"So Jill is a Jill, from a racial perspective, the first black Jill, a black man from the Congo who had moved to Belgium in the 1960s happened. And so you do see opening of doors. And it's not just about native born sons from a racialized perspective, that can be Jill's anyone. And they deal with the issue of gender by saying, in with the carnival, for instance, that every Jill has to have a woman, a woman who helps him through the week, who dresses in, who and, and that seems to our eyes, I think to some extent, not knowing how this works seems still seems kind of paternalistic and and perhaps",
Dr. Erik Hadley,[00:57:12:03],00:57:30:10,"it is, but the women that participate in this see this great dignity do to it. And testified before the UNESCO hearings to say no, we feel are we are equal actors in this in this ritual. We are it's inclusive to us. It couldn't happen without us. And so we're happy going forward not to be a Jill now.",religion
Dr. Erik Hadley,[00:57:30:10],00:57:33:13,We'll see. We'll see what happens in the next generation.,
Doug Exton,[00:57:33:15],00:57:57:12,"Yeah. And I think that's a really interesting point that you brought up, with the women that are involved is, you know, to us, from our perspective, it can seem very, you know, subservient, almost. But to them, you know, in their perspective, you know, like you said, they feel that they're equally involved, you know, in the customs. And I think that's just something that's really important to keep in mind, especially since we are becoming more of a globalized society.",
Doug Exton,[00:57:57:12],00:58:13:00,"And, look, you know, having access to all these customs like the one that you talked about, that normally we wouldn't you know, there's just as long as there, you know, okay with that and feeling recognized that, you know, that's what matters because it's from their perspective.",
Dr. Erik Hadley,[00:58:13:02],00:58:34:24,"Yeah. It's I mean, it's easy to judge. And so, you know, when I was in banished, I talked to a lot of women who and almost everyone I met was, in fact a woman of of of the Jill. And sometimes that she was woman. But it's weird because we use that term kind of a literal translation, but, Jill's woman could be a sister, a mother, a grandmother, a wife, of course, sometimes a daughter.",
Dr. Erik Hadley,[00:58:35:01],00:59:04:17,"And, typically it was family related, sometimes a friend. I knew, a woman who was a woman who. Who. And her husband, her husband was best friends with this Jill. And she became. But the Jill himself was single and didn't have, someone to help them. So she offered to be to be his, person. And so it does take some time to try to deconstruct and figure out, okay, at what level is this equitable and or what level is this not, and what role do I, as an outsider, have to say about that?",
Dr. Erik Hadley,[00:59:04:19],00:59:05:17,Yeah.,
Doug Exton,[00:59:06:06],00:59:15:01,"Looks like we are out of time and fortunately. But thank you again for all the information, wonderful presentation and everything you've been doing with the IAC.",
Dr. Erik Hadley,[00:59:15:03],00:59:27:13,"Thank you. Doug. Thanks to everybody who participated, who listened. Thank you for your questions. And I, I encourage you all to go visit Belgium when you can safely do so and, experiences for yourself. It's a really fun place.",
Doug Exton,[00:59:27:15],00:59:29:11,"Okay. We'll have a good one, everyone.",
Dr. Erik Hadley,[00:59:29:13],00:59:34:12,Thank you.,
