speaker,words,tags,timestamp
JE,"Yeah. Our farm was about three quarters of a mile north and east of the church up there, you had to go over that first ridge. That's where all of my wife's folks lived on that other little valley that goes down.",,
SS,How many familiee were there in the Norwogion community when you were a youngater?,,
JE,"Oh, there must have been forty or fifty families living in there. Well, you know, they only had 80 acres a piece. With thet exception of that 400 acre farm. Some had forty acres and some had eighty acres.",,
SS,I did some research on that church from a ninetieth anniversary issue of the church magazine.,,
JE,"Well, the early years was before my time. In 1878 I think it was, wasn't it?",,
SS,That's right. That's when they first started.,,
JE,1878.,,
SS,That was Our Savior's,,
JE,"Yeah, Our Savior's. That's eru WcrVr, of God. That's the upper church, we colled it. he lower church was the United.",,
SS,North of God was what you called the upper one?,,
JE,That*s what I colled it.,,
SS,"'Cause you belonged to the lower one, right?",,
JE,"No, I belonged to the upper one. It was funny. Most of those that belong to the lower church lived on the other aids of the upper church, so they had to pass, you aee, and it was quite a, whenever they passed one church, they had to look, the other way so they didn't even want to look at the church. And the ones up above, they had to go to the lower church and the lower ones had to go to the upper church. So they had to pass they church that they didn't like every time they went to church.",,
SS,Wbre they not suppose to associate with the members of the other church?,,
JE,"Well, it didn't matter. Course there was no low against it. But then, it was frowned opon anyway. But we didn't take, of course now, most of my uncles that lived there on the flat, belonged to the lower church and we belonged to the upper church. During Christmas we all got together.",,
SS,Why did your family belong to the upper church instead of the lower one?,,
JE,"Well, because that's the closest. And we thought it was awful if we ever went down to the other church. That's ths worse thing. But .you know, when you compare that tho salary? the ministertgot at that time and the salaries they get now, there's no comparison. I know Reverend Braddock, his salary was 150 dollars a year. And he had a crop thereof forty acres. For$y belonged to the parsonage. SO one day every spring all the parishoners would go over there and put the crop in. They'd go over there with four or five plows or a couple of harrows and a drill or two and do it all in one day.",,
SS,Then that crop was his?,,
JE,"That crop was his. But they didn't raise much. But he hed 150 dollars salary a year. And them the two offerings, the two holidsy offerings belonged to the minister. That was Christmas and Easter, jfook up a special offering on those days. But then, he had quite a family. He had four or was it five children? So I guess he didn't live too high.",,
SS,I guess not.,,
JE,On that salary.,,
SS,"What was the basis of the disagreement so that there were two churches instead of one, in the area?",,
JE,"Well they, it's from this statement in the Bibles'Many are called, but few are chosen.' Now in the United church down there, they claimed that they were the chossn ones. They couldn't agree on that.",,
SS,What did the other church say?,,
JE,"The United, or the Synod?",,
SS,Yeah.,,
JE,"Well, they claimed that anybody could, anybody if they believed they would be saved. But the other side said, only the ones that the Holy Ghost chooses, will be saved. Of course, that was handed down from the main church body you know. They were at odds too, same toe.",,
SS,"The ones that said about the Holy Ghost, was that Our Saviors?",,
JE,No.,,
SS,That was the other one?,,
JE,That's the other one.,,
SS,Then ...,,
JE,"Well, that's what the controversy was over, but the main controversy was every one wanted to be the head man, you see. The big one in the church. Now there's old man Kittling, he was the prime mover in the United church. And the Smiths were the main mover in the upper church.",,
SS,"So it got down more to two different factions, would that be acurate to say?",,
JE,"Yeah. It wasn't so much their creed, but that it was differences between the two factions. Both wanted to be the leaders. Nobody wanted to give in so they just split. In 1878, thst was long before my time. What was the name of, was that...",,
SS,That was..,,
JE,"Lebanon, wasn't it? Waon't it called the Lebanon church?",,
SS,"Well, I have it written down here. The first one t-jaa called Our Saviors Lutheran church. The second one was called the Lebanon Trinity church. And the first one was called Our Saviors.",,
JE,"Oh, the first church that was built. That's the one that was a barn. Did you ever see that barn?",,
SS,No.,,
JE,"Yeah, that was built first. That's when they had the split, you know.",,
SS,But you belonged to Our Saviors?,,
JE,Our Saviors Lutheran.,,
SS,Our Saviors said that anyone who believed would be saved?,,
JE,Yeah.,,
SS,"I read that there was a dispute, that Our Savior was aliened to the old country Norwegian church and also to ths Missouri Synod and the other became part of the anti-Missouri Synod, so that figured into it. Because, I read that when they agreed to combine into one Synod, that the same year, 1918, 1917...",,
JE,"1917, yeah...",,
JE,Side C,,
JE,"Now to make a go of it, they had to combine.",,
SS,"It oaid in this book that the young people were the leaders really, as far as breaking down the barriers between the churches. uo you rsmember?",,
JE,"Oh yes, they had the young people society you know, and they, that was mostly in the Our Saviors Lutheran, but then the young people from the United church, they called it the Trinity, the United Trinity, they'd come to our young people's society yoo know, because, we had a big society. I guess we had about seventy or eighty kids get together.",,
SS,What did you do when yoy got together?,,
JE,"Oh, they had their programs. And they played games. Had refreshments. I was president for one year Of our young people's oociety up there.",,
SS,"What would the program be, for example?",,
JE,"Oh, recitations and songs. It was mostly like another program, like thpy have school program or...(tape momentarily stops)",,
SS,Was the group mostly serious or fun for the kids?,,
JE,"Mostly fun. Well, there was several of 'em. There was one family that wouldn't have anything to do with them, you know. They wouldn't come out to anything. And you know, when they went together, the records of Our Saviors were lost soroewheres. Because « member of the lower group or what you'd call the United Trinity, got ahold of, they wanted to see the records of Our Saviors. And our secretary termed the records over to them end they disappeared, they couldn't find 'em again.",,
SS,Do you think it was a mistake or could it have been on purpose?,,
JE,"Well, Iwouldn't say for sure, but they were strictly for the Trinity church.",,
SS,Do you: remember what happened when the churches combined? How that worked?,,
JE,"Well, Iwasn't here at the time, ijuam in the service at the time. See, Iwent into the service in '17, and didn't get back til '19.",,
SS,When you came back there was just one congregation.,,
JE,"One congregation. It went alright. Same as they are now, I guess. Course, all the old warrior heads are gone.",,
SS,"When you were yoong, could you see any difference between the two choeches?",,
JE,"I couldn't see any differeoco, but it felt different. You could see the difference, you know.",,
SS,Do you know how the difference felt?,,
JE,"Well, you looked down upon the ones in the Trinity church. And Iguess they felt the same about the ones in Our Saviors church. But it finally had to ele out gradually.",,
SS,Why did you call it North of God?,,
JE,"It'a, it was just myself that called it that, you know. Same as the Methodist, Methodist church, the Methodist church north and the Methodist church south. So one is north of God and is south of God.",,
SS,I see. God's somewhere in between them.,,
JE,There is such a thing you know as the Methodist south and the Methodist north.,,
SS,"Yes, on American Ridge they had them both on different edges of the ridge. I know that Methodist north was on the south edge of the ridge and vice versa. I know a lady, when she was a girl, couldn't figure out why.",,
JE,"Well, when you have it that way, when you have a Methodiet north and a Methodist south, they have to be, somebody hao to be between the two of 'em.",,
SS,"These families that were big in the other church, were they leaders in the community?",,
JE,"They wanted to be, yes.This one up at Trinity, he wanted to be named king. And at Our Saviors church, they were mostly all related. See, the Teglons and the Smiths and the Bargons were all related. Inter-married.",,
SS,"I wonder if it was the same at the oouth church, if they were intermarried too.",,
JE,Not so much. Not so much.,,
SS,"Did they ever talk about the old ministers, Thormesgard and Christiansen?",,
JE,"No. They did mention in Oor Saviora, mention. Let's see, Thormesgard, Thormesgard, yeah, I was trying to think of the other one up at tw4hA church.",,
SS,Well Christiansen was the first...,,
JE,Yeah.,,
SS,He wes there til...,,
JE,Thormesgard came.,,
SS,In '84.,,
JE,"But when we came in '93, in Our Saviora, it was Tennyson.",,
SS,Yeah.,,
JE,Tennyson. And then Ithink It was Martin cSistiansen.,,
SS,That was the other Christionsen's son?,,
JE,"yeah. And by the time I was confirmed, it took three of 'em to confirmed. I started with Rev. Anderson, Christian Anderson, and when he left, he was called to another church back east, so we had Rev. Mohan come and rehearse, Rev. Mohan from Spokane and Rev. Bleckhardt from Rockford came down, they came down once a week. And by the time I was to be confirmed, they'd called a new minister, Rev. O.C. Helickson. So it took four of 'em to confirm me.",,
SS,You were a hard case.,,
JE,Must've been.,,
SS,How important was the church in the community to the people living there in the early days?,,
JE,"Well, I don*t think it was an important the as it is now. Course, they go out to church, go to communion in the morning and work the fields in the afternoon. And one farmer had his hired men stay at home, do the work, and he'd go to church, he'd go to communion. As far as that goes, oh, there might be a few of 'em that take it seriously now, but, but it's their standing in the community thet they figure on. Their prestige in the community, that's why, they attend church regularly.",,
SS,Nowadays?,,
JE,Yeah.,,
SS,You don't think it was that way in the early days?,,
JE,"Well, not so much. Because they hadn't quite got away from what they had in Norway, you know. Most of those old timers came from Norway in the first place. And anybody that belonged to the church, like a minister or a bishop,especially, if you happened to be out walking out on the road and you met the bishop or any of the county or precint, you had to step aside, step off the road and take off your hat and bow as he went by.(laughs) That's like the fella said back there, he would* take his hat off to the sheHff, he said, even if he had nothing but a ragged old cap on his head.",,
SS,Somebody said that in Genesee?,,
JE,"No, that was in the old country. In Norway.",,
SS,...go to church in those days and sit through the services?,,
JE,"Sure. You always stayed through the services. Well, all the kids'd go first you know, and thee they'd go home.",,
SS,Did everybody wear their best clothes to church?,,
JE,Yeah. Wte have to dress up to go to church.,,
SS,Would you say that it was quite a social occasion for the community? Or was it strictly religious?,,
JE,"Oh, they had social. If you'd call it social. I know at our place, all the bachelors there, foo© or five bachelors come over every Sunday and they'd all firing a full quart of alcohol along. They'd socialize for awhile, but after awhile, they got so they wasn't able to do anything. We had a nice place for em to meet. We had a square buiid, I wouldn't call it a building, but it was poles set up and down, you know, these, and it was planted hops all around in the summer that hops wouldtgrow up\all over there and you'd have a regular arbor in there.",,
JE,"No. This was at our homeplace. No, they had no, all they had at the church on Sunday was services. Services at 11 o'clock in the morning. And when the young people met, they'd meet out at different houses, for their social gathering. That lasted all the way from  o'clock til midnight.",,
SS,"What would people do there, dancing?",,
JE,"No, no dancing.",,
SS,No dancing. That was frowned upon?,,
JE,"hat was forbidden, to dance.",,
SS,"What could you do, play games?",,
JE,"They played games. Parlor games, parlor games, played them outside. The transpor tation in those days, well, they had a stage line from Spokane to Mt. Idaho. It run down through the valley about once a week or once every too weeks. Course, it took quite awhile Spokane to Mt. Idaho horses. I guess you heard of That's old stage driver.",,
SS,Do you remember him?,,
JE,"No, I was too young to remember him. I seen a picture of him.",,
SS,I want you to tell me about the two suicides on the same night.,,
JE,"Well, we were quite shocked. See, my sister was taking instructions to go to confirmation and she went out the morning of February the 14th, that's St. Valentine's day. And after she come home she was all out of breath to tell us the news, you know. one farmer had hung himself down at the barn and this other farmer had gone over to the barn belonging to this fella that hung himself at the other fella's barn.",,
SS,What was it happened to each of those men. Why did they kill themselves?,,
JE,"Why did they? Well this first one, he come out from North Dakota, he'd been a sheriff back there, and he'd quite a few men back there in Dakotas, where he was sheriff. He was quite a gambler. He'd been in town andfheJd gambled and he'd lost all his money and he also lost the family cow. To one of his neighbors. So when he went home that night, it was a little snow on the ground, and he'd been walking back and forth between his house and this other place where he hung himself. He had a solid trail through the snow where he'd been walking back and forth, studying about this all night, I guess. So when this farmer come to, down to his barn, he opened the door and there was the old man standing, he was dead but of course, he didn't realize it, 'cause this fella had long whiskers and it hid the rope. And his toes just about reached the floor. So he told him the night before, he took him home from town, that come down next morning and they'd go in and straiten things out. He grabbed ahold of his hand to say good morning, to shake hands with him and his hand was stiff. It give him quite a shock, he didn't live on that place long after that. He sold out. This other fella, he was 80 years old. And I guess he got pretty hard to take he'd overheard hie father and his father's wife discuss..",,
SS,You mean his son.,,
JE,"Yeah, his son had discussed with his wife, they didn't know what they should do with the old man because he was getting to be such a burden to 'em. And the old man had overheard that. So I guess he just figured if he was in the way, he'd fix it so he'd get out of the way.",,
SS,So he went down to the man's barn that had killed himself?,,
JE,Yeah. We often wondered what would have happened if they'd happened to meet. In one place.,,
SS,They didn't know about the other one?,,
JE,"Not at all. Oh no, didn't know about the other one at all.",,
SS,"The man that shook the dead man's hand, did you say he was a reverend?",,
JE,No.,,
SS,He was just going to help him out.,,
JE,He was just going to help him out. Go down and straiten things out next morning.,,
SS,What would straiten things out mean? Try to get a loan?,,
JE,"No, I don't know. They said he'd straiten it out. I don't think anybody'd loan him any money. 'Cause the first thing he'd do if he had any money, he'd go to the gambling table again.",,
SS,He had a wife and children?,,
JE,"Yeah, he had a wife. Let's see there,was Oscar and Elmer, I think he had fooo, four children.",,
JE,Were these too men very good friends?,,
JE,They didn't hardy know each other.,,
SS,But they were neighbors?,,
JE,"They were neighbors. No, when you get to be 80 years old, you don't get around very much. And one belonged to the Trinity Lutheran, the other ot Our Saviors Lutheran. So they didn't mingle much there either, going to church. Two different factions.",,
SS,What did people think about suicides in those days? Were they disturbed?,,
JE,"Well, yes. But that year there were so many of them that there was at least five suicides in Genesee that year, or in the country around.",,
SS,Do you remember what year that was?,,
JE,"1901. Because my sister was born in 1887 and she was going on fifteen, so 57, or '87 to 01 would be fourteen...",,
SS,"You mean, fifteen when she was confirmed?",,
JE,"Yeah, she was confirmed in the summer afterwards or late spring afterwards. So I guess it was about 1911. St. Valentine's day.",,
SS,Tell me about the other suicide.,,
JE,"That was in Genesee. And that's part of the Genesee valley too. I don't know what his trouble was. They found him sitting in a chair. He run a livery barn and they found him sitting dead in a choir, he'd shot himself.",,
SS,There was that other fella that you said killed himself over a girl,,
JE,"This was the one down at the livery barn. This other one had family troubles. And there was oo such a thing as getting divorce in those days, you know. If you had divorce you were disgraced forever. And now adays, it's a common thing. You know, there used to me two Genesees at one time. Town and new town. I told you how that happened.",,
SS,How did it happen?,,
JE,"It's when the railroad built in there. They asked too much for the land when they, old town was already started. So they just moved back a mile and started Genesee as it is now. Then they had to move all their old buildings from old town over to the new side.",,
SS,Who was it that asked for too much money?,,
JE,"The farmers around there. See, there was Mr. Wallby, he one of the farmers there. And Mr. jim Hanson was another one. So if they'd 've moved the depot over there it would have been e mile further east...(talks with his wife)",,
SS,So they pretty much had to rebuild the town?,,
JE,"Yeah. Well they moved some buildings over. Moved by oxen. Yoke of oxen. I know Hanson's father helped them move some buildings over. And there was no bridge across the creek there, they, house got stuck in the creek overnight. They just left it there and got drunk during the night, so Iguess they moved it next morning.",,
SS,Was that a store or a house?,,
JE,It was a store. I think it was old Rosensteins store.,,
SS,What was Jake Rosenstein like?,,
JE,"He was little, short, with a white moustache. Wore a pair of glasses. I was in his store several times. He had a son and two daughters. Mox, Mae Rosenstein and, (talke to wife) Mom, do you know the Rosenstein's girls names?",,
JE,Mrs.E: No. I didn't know 'em.,,
JE,"Well I knew both of 'em. But they moved to New York, the girls did, and the old man moved on to California, I guess. He came back to Genesee one time and he was talking about Genesee. He said,""All this town needs,"" he says,"" is a post office and a service station."" You know, when he left, there were eight or nine stores in Genesee. All kinds of businesses, but now there's nothing.",,
SS,Was he a very good business man?,,
JE,"He was a 3ew, they ought to be a good businessman. See, that town was settled by Jews. Old Simon Levi, he run the warehouse. I talked with a relation of hers that lived...he could, if he was alive he could tell you lots of stories. He lived to be 102. He came there in 1878 or '79. He passed away up at Cour d' Alene Home. He could tell you about old times.",,
SS,Did he know Levi?,,
JE,Sure he knew Levi. Jake Rosenstein and the other jews.,,
SS,"There was another Jew there, you mentined him before, a pioneer?",,
JE,The jews?,,
SS,"Yeah, you saidi somebody else.",,
JE,"Alex...there's one by the name of Alexander and London. They had a grocery store, Alexander and London. They were importers. And this old fella, you know, they had to haul their wheat clear to Lewiston. Before they got the railroad into Genesee. Their nearest trading place was Lewiston So he said, the 3ews mould stand down here on the sidewalk and had glasses, they'd see the formers coming up there, they'd get together and decide what they going to pay for the wheat. Got about twenty four cents a bushel, I guess. Twenty five cents a bushel and it took 'em two days to deliver a load.",,
SS,Two days to get here?,,
JE,Ome dey down and one day back.,,
JE,Side1 D,,
SS,reputation for being fair?,,
JE,Sure.,,
SS,Honest in Genesee?,,
JE,"Yeah. He'd...he'd never tell you the price of anything. You go in and look etc' an article and ask him how much he wanted Cor it.""Oh,"" he said,""it's reaeonable, it's reasonable."" That's the only answer you got out of him. ""It was reasonable.""",,
SS,Didn't he hatie the first safe in Genesee where people kept theio valuables?,,
JE,Urn-huh.,,
SS,I heard his son Moe was sort of a hell raiser.,,
JE,"Mox was, yeah. He'd go to Spokone, spend a week or so. And the ranchers knew when Mox went to Spokane, they'd come in and want to pay their bills. And made...old 3ake mad. He sure cussed that kid for running off. But then,you know was here they'd never show up to pay their bills. But they knew he was gone so,0""he was a bookkeeper, the old man couldn't do anything without Mox.",,
SS,Pretty smart.,,
JE,"I know one time, a Dutchman, whoever. He went to Moscow and bought a hack load of groceries. So then he come into Rosenstein next day and wanted to buy a sack of sugar. So he told Jake, he says,""I went to Moscow yesterday, I should have got the sugar up there,"" he said,""Out I had so much groceries in my hack, I didn't have room for the sugar."" So Jake says,""Yeah, that's the way, that's the way. You go to Moscow,"" he says,""spend your cash up there, then you come down here and ask me for a sack of sugar and charge it."" He was after the money.",,
SS,Where did most of the Norwegians trade?,,
JE,"At the Beehive. George Hobson. That was a cheap store, you know. You could get calico for 3 cents a yard, 5 cents. But then the big merchants were London. Alexander and London. But they sold out to Follet brothers. That's where we done all our trading, was Follet brothers. That's old Alexander and London's store.",,
SS,Did most of the Norwegians trade with the Beehive or Follets?,,
JE,Follets in later years. I told you about that guy that would pick out a coffee bean or split a sugar lump. That's the place.,,
SS,"We did they trade there instead of, say, Rosenstein's? Were the prices better?",,
JE,"Well, no,^they had a better stock. See, Rosenstein had a little lowdown store stuck way back in the hillside, and it was pretty dark in there, you couldn't see a darn thing in there. And these were brick buildings on Main street. Of course, he was on Main street, he was on the west end of Main. Right across from the livery barn. They had the livery barn on Main street. I guess they moved the livery barn brick there. They mow have an apartment house there.",,
SS,Did you spend much time in Genesee when you were a young man?,,
JE,"Oh, I spent most of my time out on the ranch. On the fiarra. I didn't go to town. Dad went - to work on the building this railroad up the river. He was gone for two or three weeks. I had to walk to town. I made quite a few trips walking to town. (Wife is talking to je). All she does is have coffee and yak.",,
SS,Is that different than it was in the early days with women?,,
JE,"No, they get together once in a while. Course, they, it wasn't quite as easy to get around as it is now. Just the nearest neighbors. Come and visit once in awhile.",,
SS,Was going to town much of an occassion in those days?,,
JE,No. Nothing special. Saturday afternoons mostly.,,
SS,Would they trade then?,,
JE,"Yeah, they'd trade. That's when they done their trading. After awhile we got so we'd go to Moscow. You could drive to Moscow in an hour and a half. If you had a fast team. No, they didn't drink coffee like they drink coffee now, you know. They'd make a pot in the morning and they'd drink on that all day long. When they got the final, fine squitts that's in the bottom of the can, that be just as black as tar. And they never throw the grounds out. They'd just put new coffee on the old grounds. Til the can got so many grounds in it it wouldn't hold any more water.",,
SS,What do you remember about the town of Genesee. What it was like when you were young.,,
JE,"When I was just a youngster, well, I didn't go to town very much, Out I know they had, let's see, one, two,three, four, five, six saloons. And they were all pretty well patronized. And they had7, they had 6 grocery stores and a couple of dry goods stores and 2 hardware stores, or 3, 3 hardware stores. And they had a jeweler and a millinery shop and real estate, insurance, and they even had a lawyer.",,
SS,Sounds like quite a town.,,
JE,"It was quite a town, yeah, it was a live town then. Especially at election time. These candidates would comedown, you see, and they knew they were going to be in town and all the ranchers would come in there because, then they'd follow the, it was all free drinks. From one ssloon to the other, he'd have this whole herd of farmers following him.",,
SS,The candidate would etand the drinks?,,
JE,Beg pardon?,,
