speaker,words,tags,timestamp
,Sam Schrager: What year were you born?,,
,John Eikum: I was born in 1888.,,
SS,And were you born here or back in the old country?,,
JE,"Back in Norway. I was born in Norway, October the 28, 1888.",,
SS,How old were you when your folks came over here?,,
JE,"Well, I lacked three months of being five years. We came to Genesee in 1893, the fifth day of August.",,
SS,Do you remeber anything about that trip over here from Norway?,,
JE,"Oh, not very much. I was only four years old. Little over four and a half years old. I remember coming through Montana. Wy mother bought a currant pie,and she opened it up to see what was inside of it, and she just threw it out the car window. And then she saw some Indians outside long that platform and she got so scared, we just hid under the seats in the train. We heard so many Indian stories, you know, about the atrocities that the Indians...",,
SS,Did your mother hide too? Hid the kids.,,
SS,Why/did ahe throw the pie out the window?,,
JE,She didn't know what it was. She said she wasn't about to eat anything like that.,,
SS,Do you know how your parents happened to wind up going to Genesee?,,
JE,"Well yes. You see, there vtfft$ four or five bachelors from the same piece in Norway as my folks and they came over here before and they wrote back what nice country it was out here so dad came over first. He came over in April, of 1893 and then he sent back and brought the family over. And mother had a time on the trip. She got one of her sisters and another girl that was going to Alma, Wisconsin and they both, to help care for the babies, you know, she had a four months old baby to take care of, and they got so seasick that they couldn't do a thing. So she had four children and her sister and this other girl to take care of. She didn't get seasick atall. So I guess that was a pretty good thing. And August fifthjwe landed in Genesee.",,
SS,"Did your father have a place ready for you, a home?",,
JE,"Well, he had bought eighty acres but then he had been hired out to one of the neighbors up there. So it was November before we moved into the place that he bought. That was that wet year, you know when they couldn't get their hatvesting done.",,
SS,Where did you live while you waited to move into your house.,,
JE,"Well we lived at the family where my dad was working. She had that baby about that time, she had a baby that first part of October so mother took care of the baby and he was, he cried a lot, you know, and mother fixed that. She mashed potatoes and butter together and she just fed that two week old baby all the butter: and potatoes he could eat. Then he seemed satisfied. And he's still living up there. He's eighty two years old now.",,
SS,What do you remember about that wet harvest?,,
JE,I remember it. I remember when we moved over to the 80 acres that dad had bought. It was a driving rain. We were just as wet as drowned rats were when we got over to the place. It was over a mile and a half. But you know travel in those daye was pretty slow.,,
SS,Did you have a wagon to travel in?,,
JE,"Yeah. He bought a wagon and three head of horses ftom one of the neighbors. That's all to start. Well in those days, the neighbors were all close together because they all had 80 acres apiece all down the valley, you know. That made it pretty thickly populated for a while. Now when you go back in the valley, you don't see but half of the buildings that were there at that time.",,
SS,"What happened during the 1893 wet harvest? Did many people go under in that? They all went under. All but two or three. Then they moved out.In 1895 they opened the Nez Perce Indian Reservation for settlement. Some of them went there and lots of 'em went up to Troy, settled around Troy. Well, it was pretty hard times. No money. They couldn't pay their debts. And there was no chance of borrowing any money in those days. See dad, when he bought 80 acres, and he had to go clear to Colfax to get a loan, to the Vermont Loan Company. And the same way when he paid it off, ha had to go clear to Colfax. That was...I remember the time he went to Colfax to pay off his debts. Course, he didn't pay much for it. He paid 700 dollars Cor the 80 acres.",,
SS,He paid the whole debt off at once?,,
JE,"Weil, not all at once. But the final payment, he had to go to Colfax. The Vermont Trust and Loan Company, they had offices in Colfax.",,
SS,Who got the land when people went under in that depression?,,
JE,"Well, John P. Vollmer got the most of it and the bank. Bank of Genesee got the four hundred acres I talked about the other day, you know.",,
SS,Which four hundred?,,
JE,Dust below the church. At that time it belonged to Sam 3ohnson. He went broke. He owed four hundred dollars at the store and the bank took over you see. They took the four hundred acres for the four hundred dollars store bill. They moved up over on the prarie.,,
SS,Things were that bad that he couldn't manage to come up with four hundred dollars?,,
JE,"Well, they didn't save a bushel of their grain that fall, you know. It just stood in the field and rotted. Wouldn't get no harvesting done..Course in those daya, they all had spring grain. There was no such a thing as fall grain, fall seeded grain. That made the hervest awful late. See, the first harvesting they tried to do was about the 10 day of September, that's when the wet weather Mstarted. It rained continually for six weeks. And they had a few steam thrashers but the ground was so wet they couldn't move the...I remember there were, my folks stayed, they got mired down on top of the hill, they were there for pretnear a week to get this, the tractor loose, steam engine. It was mired right down, you know. And I remember in 1894, I remember the first harvest that we had. We had some boats down on the flata, and we got our next door neighbor to get that with a reaper. Have you ever seen one of 'em?",,
SS,I've seen pictures of 'em. The old reapers.,,
JE,"They had no drapers, they had a platform and then they had an arm with four sweeps on and that would come down and it would sweep off the grain and leave it loose, it didn't tie it. Then of course you had to tie it by hand. I remember mother and I went out and tied it by hand. Everytime the sweep jould come around, they had four sweeps, you know, it would just sweep it off, you know, and leave it on the ground. Leave the bunches on the ground. Instead of tying it in bundles, we'd just left it loose.",,
SS,How much land did he have planted in oats that year?,,
JE,"Oh, about fifteen acres. Fifteen acres of oats down on the flat. And then the way they harvested, well, I guess I'm getting a little anead of the way they farmed. It was all foot burners or walking plows. Three head of horses and a plow. But the farms weren't very big. And there was no summerfallow either, in those days. It was all spring seeded. But after awhile the wild oats, got too foul with wild oats, they had to summer fallow. In order to kill the wild oats. You should have seen some of the fields at harvest time. Because, went out and cut for hay, they cut out the worst patches, you know, of wild oats, used that for hay. They had a great, patch here and there all over the field, cut out for the, there wasn't anything but wild oats.",,
SS,Did they just keep getting worse as the years went on?,,
JE,"Sure. Well you see, they used headers. You had to wait til the grain was dead ripe, like we called it. It had to be dry. And then the wild oats got ahead of the wheat and the wild oats would all scatter out, cover the ground again. I picked up a clod when I was plowing the next spring, I picked up a clod about that big, and there were fifty wild oats in that little clod. No, it got so bad. Then they got the binders. Then you cut the grain before it was entirely ripe, you know. So you got lots of wild oats out of there.",,
SS,About what year did they start summer fallowing?,,
JE,"Oh around the year 1900 or,it was in the 1900's ,they start summer fallowing. The way c!«$ worked it, see, well at that time in 1901 he bought an extra 40 sm he had 120. Of course he could have bought 80, he could have bought 80 acres three years before and he could've got the 80 acres for 1300. But he said he didn't want it at any price. Three years later he bought back half of 40 acres and paid 1600 for the forty acres.",,
SS,The land got that much more valuable that fast?,,
JE,"Yeeh. But it isn't compared to the price now, you know. They sold the Forest Ranch up there that I considered the pore forest, sold the other day for 1300 dollars an acre. But, he owned half of the country. Course, thet was, that bordered the Genesee valley but, it was also what they called the German settle ment. See, the way they settled that country, there's a valley that runs up from Genesee along the, well, you come down there now, the main highway down there from Moscow.",,
SS,"Yeah, the valley runs along the creek?",,
JE,"That's Thorn Creek. That was a German settlement. And the Cow Creek of the Genesee valley was all settled my Norwegians. And when you get over about a mile and a half further east, it was the Little Potlatch, that was all settled by Irishmen. So they had three settlements there, the Irish, and the Scandinavians and the Irish.",,
SS,"When they fire't farming there they didn't have to do too much clearing, did they?",,
JE,"There was no clearing at all, no timber at all. It was all open prairie, in the Genesee valley. Of course, over in the Linnville country, where the Irishmen settled down on the Little Potlatch, that was scattered timber. Bull pine mostly, what we call bull pine. The German settlement, that was open prairis too, til you got pretty close to Moscow.",,
SS,What was growing on that originally?,,
JE,"Bunch grass. You know, two sections out of every township was school land. Called that schooled section, two sections, section 16 and section 36. I remember that was open country til 1901. I had two uncles, they bought 80 acres a piece of that school land when it was open for sale. See the money derived from the school section and went to the school district.",,
SS,"This bunch grass, did it take much work to get it ready to plant?",,
JE,"No, you just run a plow through it. They had what they called a breaking plow. It was awful rich land, though. Course, in those days they raised all their crope without fertilizers, of any kind. And if they got fifty buehels they thought they had a bumper crop. The average was about thirty five bushels to the acre. But they had a different method of farming. You plowed it and scattered the seed, right, they had broadcast seeders, most of 'em, and broadcast right",,
SS,Broadcast by hand?,,
JE,"No. No, we had a seven foot, seven foot seeder, or they called it drills by this time. And they had tubes go down there and they'd head down and let it scatter. Little shoe, it looked like a little shoo down there when they hit the that, why you know, fly all over around in that so,,seeded broadcast. Seven and eight feet wide. It was quite awhile before I ever saw a grain drill. Dad didn't like it, he'd never liked a drill, because there was too much open ground in between the drill rows, where there was nothing growing, you know. So we had grain drill, one of those old seeders -Hi. It must have been 1918.",,
SS,"Dur ing the 1893 depression, did you tell me about them trying to foreclose on the farms in Moscow?",,
JE,"Oh yes, yeah, that was when 3udge Fiefer, he issued an order, if that order went into effect (Phone is ringing, interuption in conversation)",,
SS,What did he do?,,
JE,"He give an order that, if that order stood,it would mean that he'd have a... a receiver for every or every farmer on there. So the farmers all got together, went up to Moscow, they had a big crowd, they had a big crowd, it clear from Main street up to the courthouse, and that's quite a ways, you know. And they were going to hang the judge. They had the rope there and they were going to hang the judge unless he recinded the order, but they couldn't find the judge. He sent one of his clerks out to meet the delegation. But he recinded the order right away because, they would've hung him if they found him. Because they were determined to do that.",,
SS,Things bad that year?,,
JE,Things were that bad. That was in 1894.,,
SS,So they didn't recover right away after the bad harvest?,,
JE,"Oh, well, gradually. The ones, that could Ning on. Now there's several that hang on, now, the place that we stayed, at Hoveys, they hung on, he had quite a bit of land, he had about 240 acres. One of the bigger farms.",,
SS,Is that Hovey's father in-law?,,
JE,Yeah.,,
SS,That's the place that your father was working when you came over?,,
JE,"Well, that's where he was working.",,
SS,So they had a pretty good size farm already?,,
JE,"eah. Well you know in those days, you could take up a three quarter section. You could take it up on homestead, or you could take it up on premp-hon and you could take another quarter on timber claim. You had to plant so many trees if you plsnted so many trees, you got.So the first ranchers in there, they. I know Mr. Smith,, he uoed all three of his.",,
SS,What did Mr. Smith think when he lost all that land for so little money?,,
JE,"I don't know. You mean tho one that lost the four hundred acres? That was Johnson. Well,what coold he do? He spent all his money beforehand. He even had a negro cook, you know. He was one of the higher ups. No, he had a negro cook, he had all kinds of servants.",,
SS,Maybe he overspent then,,
JE,"Yeh, he overspent, that's it. Like some people do now you know, they overspend.",,
SS,"It seemed to me that later years, they seemed to carry farmers over til the next year.",,
JE,"Yeah, but there was no credit in those days. Unless the guy said, if you went down there and bought an item for 50 cents and asked for credit, you couldn't get it. I know mother went out one day, she had some eggs she aent in but she wanted a pound of coffee.that was twenty cents. And dad had loaddd up his load of wheat and she didn't know how she was going to get that pound of coffee. There she walked down a half a mile whore dad had aoaded up?  As she walked along, she happened toA a dime, in the dust. And she walked a little further, she found another dime. There she had her twenty cents to buy her coffee. No, they, they had to trade their butter and eggs for t£ieir groceries. But by 1901, everything was hunky-dory again. We lived in a little shack. It washroom and two little bedrooms off to the side. There was thirteen of us in there at one time. Ten children and two older folks and,my uncle stayed there too. Course we had, we had a, what we called a davenport, called it a sofa then we could open up, you know. That's where my uncle and I slept, in the living room, living room-kitchen, general utility room all in one.",,
SS,Where did the rest of the family sleep?,,
JE,"Slept like hogs. Some at the head or some at the foot. You know how. hogs sleep, Feet and feet together. Never built the, in 1909, dad built the house after all the family was ready to leave, some of 'em had already left. He put up a full two stories, full 18 foot to the beam, with five bedrooms, four upstairs and one down, and a parlor and a big diningroom, sixteen by iighteen, and a kitchen and a pantry. No bathroom in those days.",,
SS,Sounds like real luxury compared to what you had.,,
JE,"Well, you really got lost in there. And that's where I leerned papering. I put the wall cloth, papered all the rooms. This would be a good step because after I had my operation in Portland in '44, I couldn't do anymore farming, so I went...",,
JE,Side B,,
JE,...about 150 houses in the valley and it's all in Moscow and in Lewiston.,,
SS,What was it like for so many kids growing up in one small space?,,
JE,"They didn't all grow up. Course, they had to have big families in those days. They all had big families, ten was about the smallest number. Then it's from there up to twenty two. Twenty two children in a cabin, well, he lived east of Genesee, she had twenty two. And no twins in the family.",,
SS,How could you care for so many kids at once?,,
JE,"Well, they didn't get much care. But they had to have so many spares because there was sot many died off. Now, our neighbors, they lost six, six children with the croup and...",,
SS,Did they get tuberculosis too?,,
JE,"My sister, my oldest sister passed away with tuberculosis.",,
SS,Your oldest; sister died from turberculosis when she was young?,,
JE,She was 16 years old.,,
SS,Do you remember what happened to her. Did it just happen all of a sudden?,,
JE,"No, she had it for quite awhile and she was just about over it. Then she went to visit one of her friends, one of her girlfriodds that had, they had moved away, they were living, in Bedrock Canyon over here, you know where that's at? Bedrock Canyon? 0n the other side of Leland.",,
SS,Yeah.,,
JE,"That big cooyon that goes down there. And they were foolirtg around, you know, she was just about through with it, just about cured, and this girl, they were out there on the lawn, or out in the yard, fooling around, she turned the cold water hose on her. And her, my sister was so lonsry, she wouldn't go and change clotheo, you know, and she oeught an awful cold and that started it up again. I think she was the only one that passed away while we were iving down there. After we got up in the fejig house, why,I had a sister 16 years old pass away with a brain fever. They called it brain fever in those days.",,
SS,What was it?,,
JE,"Well, that's what they called it. Now, I don't know what they'd call it now.",,
SS,What happened to her?,,
JE,"She lost consciousness. Rust be kind of a hemmorage. She was going to school in town, to high school. I wasn't there at the time. I t was the time I was up on the reservation, on the homestead. But, I got a telegram one morning that she had passed away. That's the first I knew she was ailing. She got it suddenly.",,
SS,Were you the oldest of the kids in the family?,,
JE,"No, my sister that passed away of tuberculosis was the oldest.",,
SS,Were you the oldest boy?,,
JE,"Ygah. Well, there was only two boys and eight girls in the family.",,
SS,"Did you have a lot of responsibiliy, being the oldest boy?",,
JE,"Well, I started hauling the footburner when I was fourteen years old. So, I done practically all the farm work after I was fourteen. But when I was 21 I took up a homestead and moved away.",,
SS,Did your father supervise you when you were working on the farm?,,
JE,"No. Oh, he'd help. He always liked to do the seeding or the drilling himself. But I had to do all the plowing and preparing the ground. So I done lots of walking in my time.",,
JE,"Oh, pretty fair. There wasn't any of that prepard stuff to buy at the store, those days. Everything was in bulk, you know. Coffee come in great big, big sacks, about 200 pounds. And they'd put it on the floor of the store, it would be open, you know, If you wanted any they'd weigh out a pound or two, whatever you wanted, and put in a big coffee mill they had there and grind it for you. And you didn't get any of the extry. I know the store keeper up» there,^kind of a crippled fella, he'd weigh out the doffee, and if it weighed a little bit over, he'd pick out one bean, one coffee bean to make it balance. Same way with sugar lumps. You see, the Norwegians, they're great on that sugar lump. If it weighed too heavy, he'd take a lump out and it wouldn't be quite enough so he'd just take a knife and he'd cut the lump in two. That made it balance. It had to be everything exact. He walked with e cane. There were three brothers there.",,
SS,Which store was this?,,
JE,At that time it was Follet's. Fallot brothers.,,
SS,"Were your parents pretty strict with the kids, or did they let them do what they wanted to?",,
JE,"No, you had to tow the line. Well, I was the same way, after I got married and they grew up, when I come to the house, I heard the kids, Well here comes dad!"" And they'd run and hide. Well, you had to be strict. Course we had ceiling lights, you know, that looked like a big bowl, and they used that for a basket ball basket.",,
SS,Was your mother easier going than your father?,,
JE,"She was easier going. No, dad was pretty strict. He only hit me once. I supposed to feed the chickens early in the morning and I didn't go out there as fast as he thought I should, so he give me a cuff ling side of the ear. And I was strict with the kids, just about as strict as he was, and I think it's paid off. Thaw* all doing pretty well.",,
SS,Did your parents treat the girls differently than the boys?,,
JE,"No. Nope, about the same.",,
SS,Did you speak English before you started school?,,
JE,"No. It was pretty hard, you know, because when yoo was at home you used Norwegian. When you went to school, you used English. But then, it was just two months in the fall and two months in the spring. That's all the schooling you had. Now they don't get any schooling atall. It's all ath letics.",,
SS,Did you learn much when you went to school?,,
JE,"Yeah. All that I ever knew. I could outfigure anybody in school. They had a long row of figgers, about that long, as a test. And the teacher said,""The first one that got his answer up to the desk and had it right, would get a nickel. So I took it home and i figured it out. But then he ployed a trick on her you know. The. next morning he sold to taki^a certain figure out of there and then figure it out, see. So I just subtracted the figure he told me to take out. I wound up with the number 1. Well right now, if I could see, I con outfigure any college graduate. And I learned that when I played pinochle, you know, I could, ..just as fast as I could shuffle the cards out, I cofeld count 'em and you count every point, like jacks and queens, the jacks are two and the queens are three and the kings are four.",,
SS,Wer you playing pinochle when you were a kid?,,
JE,"Oh, yes, well it waan't pinochle, it was the old Norwegian game of 'Whist'. Old Norwegian 'Whist'. But I was too loeky at cards. We hadjone of mother's brothere came out from Canada and a cousin came from Minnesota. They visited there one winter, and we played 'Whist' my dad and his partner and Mr. Brown and I, that was ma's cousin* were partners. And we beat every game in 'Whist'.",,
SS,Were you betting?,,
JE,"No. No betting. That's whare dad mode the remark about me. I was just a kid, I guess I was about seventeen or eighteen. Dad got disgustod, said,""The devil helps his own. (laughs)",,
SS,Did you and your dad get along a little rough at times?,,
JE,"Yeah. After I grew up. I know one time, after we got the derrick, after we built the new barn, got a cable and derrick in there and he was supposed to drive the derrick horse. Well, it was just a young colt, a three year old. And he'd never been, single and dad, dad lost his temper. And he jerked on the lines SO hard that he broke the line. I kind of lost my temper. And he says, ""Now,"" he says,""you go down there,"" he says,"" and you run your pitchfork right through that so and so!""",,
SS,The colt?,,
JE,"Yeah. So I just told him, I says,""Dad,"" I says,""you better look out or you might get a taste of the pitchfork yourself."" He sure was awful quick tempered Well, he caulda led the horse to start with, you know, so he knew what to do after he got used to it, why, it went fine and dandy.",,
SS,Do you think it was hard for him to have so many kids and try to make a living from such a rough start?,,
JE,"Yeah. He wasn't used to that, you know. Now in Norway, he never done any farm work. He had, he was always in the government, local government. Same as a county commissioner out here or, he never was home. He had all hired help. But you seo, that land he had back there, it was a little bigger than a whole township. But there wasn't much farm land on it.",,
SS,Why did he leave that for a little homestead in America?,,
JE,"Well, it was too heavy a responsibility, because there, you see, the oldest son always took over. And then he had to take care of his parents, his grandparents and his great-grandparents. That's quite a load. And there wasn't much land he could farm, it was mostly grazing land. That was quite a chore. Because you couldn't get off the farmstead back there unless you went. Go and transport your cattle up through summer grazing up on top, you had to take 'em all in a boat.",,
SS,Where was this in Norway?,,
JE,"Sugnen ford.(sp) You've heard of the Sugnen ford, haven't you?",,
SS,I'm not sure if I've heard of that one or not. what's the nearest town?,,
JE,"The nearest big town is Bergen. And this was about 32 Norwegian miles, northwest of Bergen. But you know, 32 Norwegian miles, a mile in Norway was equivalent to 7 miles in this country.",,
SS,Ed Ramsdale told me he came from an area not too far from there. Bergen was the nearest town for his parents too.,,
JE,"Well, they had little groceries and stuff like that in pretnear every community you know. Now mother was roised further in. Fufcthor in the fiord, the fiord goes way into Norway, pretnear cutstit in two. And her dad was a merchant, called him a merchant. He had a store where they sold everything. Even sold whiskey.",,
SS,So it was quite a change for them to be farming in Genesee?,,
JE,Yeah.,,
SS,"Was the land that your father had, how did it compare in how good it was to the other places it was around?",,
JE,"Oh, it was just as good. Of course the land in the valley itself, that was, mostly bottom land, you know. Well, you know how it is up there when you go down through the volley. We lived across the hill further east, you know where the church is up there?",,
SS,Yeah. We're talking about Cow Creek..,,
