speaker,timestamp,words
W. J. Gamble,0:00:00,"Well, anything holds you up while you're pretty serious. Then on top of that, the greater Lambda Livestock Company, who we used to deal with, they have their men along with the train. And they plan on getting into the Chicago market on a certain day because of price fluctuations, you know. And that's the reason for a lot of that stuff on sheep, especially in the fall when they ship the lambs. So everything has to click, you know."
Sam Schrager,0:00:44,About how often do they have to get off to be watered?
W. J. Gamble,0:00:48,Every 18 hours.
W. J. Gamble,0:00:54,"Of course, what we had to do was do a load them at Bovill. We had to make Missoula, Montana. It's the only feeding spot. When you're held up someplace, that's pretty bad. That's the reason we had to unload them at Palouse. We had to load them, feed them down there so as the Northern Pacific could get them into Missoula in 18 hours."
Sam Schrager,0:01:22,"I guess that to be in the railroad business, you've got to be exact and on time. Yeah, well, there's a lot of things involved, but it's just part of the game."
Sam Schrager,0:01:38,"Well, I've got a lot of information that I have found, except yourself, who was, I think, so closely involved with the potlatch management, who is still around. And one question that I would like someone who is closer to the management to talk about is the background of warehouse or interests coming to Idaho from the Midwest."
Sam Schrager,0:02:08,What's your understanding of the process that was involved there?
W. J. Gamble,0:02:14,I think this will answer that question.
W. J. Gamble,0:02:19,The Decker article here.
W. J. Gamble,0:02:23,Yeah.
W. J. Gamble,0:02:24,I know they came out a few years before you did.
W. J. Gamble,0:02:29,"That kind of goes into all the cutting out of the timber in Wisconsin and Minnesota. And all these stockholders had their money in that thing back there. And when a timber is cut out, that's why Mr. Weyerhaeuser used to call it sugaring off. That's when they make their money, winding the thing up."
W. J. Gamble,0:03:05,"So when they quit back there, these stockholders had plenty of money, and they weren't looking for investments. And they sent their cruisers out into Idaho here, and that was the way they got out here. The Weyerhaeusers didn't own all this timber by any means. They were owned by various groups of people. But the Weyerhaeusers manufactured it for this group. I see. I see."
Sam Schrager,0:03:32,Was there an unmet demand at the time they came out here? Was there becoming a shortage of timber in the Midwest to fill the new economy?
W. J. Gamble,0:03:42,"Well, it was just opening up out here at that time."
W. J. Gamble,0:03:46,"And a lot of this stuff, they had no idea of the value of this timber out in this country to start with until they got their cruisers out here and got to looking around. Then they threw their money into the picture. For instance, the Clearwater timber company, that timber was held down there for 20 years, I guess, after it was bought before the Los Angeles started."
W. J. Gamble,0:04:21,"They had bought way along ahead. The same morsel brought the coast, and the west coast, the Tacoma. That was, well, I guess they're still buying. The side -hoast stuff was, well, the first, they went into Bonners Ferry and Sand Point. That was their first operations in Quine Lane. They bought their first timber up there. That's what started in Idaho, because they got into this Idaho white pine, which is a very valuable timber, and very few stands of it anymore around the country. This part of Idaho is the only place it grows."
W. J. Gamble,0:05:11,Biscuit. Just that one.
Sam Schrager,0:05:15,"Do you know, was there much competition at the time in the Idaho to get ahold of the buildings?"
W. J. Gamble,0:05:23,"These stockholders, they were pretty much all grouped together, and they all threw their money into a pot, and they had certain timber companies that they invested in. But in the end, a warehouse were manufactured it for them. Oh, a warehouse were owned some timber themselves, too, but never most of it."
Sam Schrager,0:05:55,"These other interests, are they, for example, the Lairs and the Nortons, and those people, or are they part of the, are they just?"
W. J. Gamble,0:06:02,"No, Lairs, the Nortons, and the Thatcher's, well, all, they were all, they all had retail lumber yards along the Mississippi River."
W. J. Gamble,0:06:21,"Lochman's, and all those, Director's Meeting was quite a group. But there was no very dissension among them."
W. J. Gamble,0:06:38,"They trusted Warehauser, and he's the man that kept the timber."
Sam Schrager,0:06:47,Do you know about when the first cruisers came into this part of Idaho looking at the timber?
W. J. Gamble,0:06:58,"No, I don't. I do not."
Sam Schrager,0:07:03,Was Derry among the first? Huh? Was Derry one of the first men who came out here?
W. J. Gamble,0:07:07,"No, there were cruisers out here before Derry."
W. J. Gamble,0:07:11,"Bill Helmer, and I fella down the Clearwater."
W. J. Gamble,0:07:17,"Oh, what the heck was his name?"
W. J. Gamble,0:07:20,"I've forgotten now. But they were all early day pioneers out here. Bill Derry came out here to build sawmills. He put the thing in operation. He was only one woman, of course. But he came out after the timber, a large amount of the timber had been bought."
W. J. Gamble,0:07:52,And he formed the St. Joe Boom Company and all that kind of stuff. Built Potlatch and Elk River and Coeur d 'Alene.
Sam Schrager,0:08:07,Was most of the timber bought from the state or bought from private individuals in this area?
W. J. Gamble,0:08:17,"Indeed, I don't mean exactly, but."
W. J. Gamble,0:08:27,"A part of it was, and a part of it was individual holdings. There was individuals that owned timber, still owned timber that they couldn't sell, and that they lost their shirt, of course, because they couldn't get it logged."
W. J. Gamble,0:08:49,No.
W. J. Gamble,0:08:58,"There was one other interest besides the warehouses, which was a group of Pennsylvania lumbermen that opened up Spirit Lake. Oh, yes, you mentioned that to me when I was here. Yeah, that was an entirely different group. They were lumbermen out of Pennsylvania. Well, it was the same idea that they run out of timber back there, got cut out, and they wanted to invest, and so they brought their money west. And they were, shall we say, late comers. They come in late, and they didn't get there as much, but they got all that timber off Spirit Lake."
Sam Schrager,0:09:42,"What do you know about the decision to build the railroad, the WI&M, in the way that it was built as far as where it goes, the loop that it takes?"
W. J. Gamble,0:09:55,"Well, to start with, for the lumber company set up their first mill in Palouse, you know. But they soon found out that they didn't have enough room down there for the size of the plant that they wanted to build, so they came up to Potlatch, where they bought land that was cheap, and they bought that whole site for the town site and mill and storage and everything else. That's what established Potlatch. Well, there was no railroad at that time. The northern Pacific had built into Palouse, and the lumber company wanted the northern Pacific to build from Palouse up into the timber. In other words, where the WI&M goes, no. But they couldn't make them see the value of a railroad into the timber. We couldn't induce them to build. They were invited to build their railroad. So, build area, the hell with you, we'll build our own. That's kind of a fellow you know. So, we built our own WI&M. We followed the drainage areas, which is, well, I think that's the way most of the railroads are built. They followed the drainage areas,"
W. J. Gamble,0:11:37,"the valleys, that's where they got to put their railroad, same as the highways. And we followed up to only one way to get to Potlatch, of course, just follow the Palouse River up. We followed that to Harvard. Then we had to get into this other ownership up toward Bovill, off -rovers, so we had to go over the divide into the Potlatch drainage area. We followed that area into Bovill. Their intent was to build on into Montana."
W. J. Gamble,0:12:18,"But about that time, the Milwaukee started building west, and the Milwaukee built from St. Mary's down to Bovill, and we induced them to build from Bovill to Elk River. So, I stopped the building up, WI&M any further than it was. But it was built and conceived as a bumper road, just the kind of it is. And we wanted different connections. We had connections at both ends, Milwaukee at one end, and Great Northern and Northern Pacific at the other. We had to do that in order to get into the different territories of selling our lumber. We had our own sales company at that time. And of course, during those days, our most good bit of our lumber went into the building up of the west, that is the west as far as Dakota's and Montana's concerned. A great deal of our lumber went into that area."
Sam Schrager,0:13:28,But does that get built up while we start branching out and just clear to the east coast?
W. J. Gamble,0:13:36,So we had to have good railroad connections in order to do that.
W. J. Gamble,0:13:46,"And we did, the railroad was a very good and prosperous railroad."
Sam Schrager,0:13:52,"The length of time that it took to construct the railroad, do you know about how long? How long it took?"
W. J. Gamble,0:14:07,"I think it started in 1905, in about two years, in 1907 I think. The saw mill started in 1907, and we had the railroad built as far as Harvard. We was getting our timber out of the Harvard area. And we kept on building. We didn't build it, we had a railroad construction outfit built for us. We paid them for it."
Sam Schrager,0:14:37,Who was this outfit?
W. J. Gamble,0:14:38,"Do you remember who they, then that's something I had never known, that it was. Well, I forgot the name of the outfit."
Sam Schrager,0:14:49,"The people that did the building, the crews, there were a lot of foreign workers among them, weren't there?"
W. J. Gamble,0:14:58,"Well, these big construction crews, yes, sure. That's all we had out here. We got mostly Japanese to start with, and Chinese. They were the laboring people nearly days in the west, even in the mines and stuff like that. They were all orientals."
W. J. Gamble,0:15:19,I've heard of Italians also in the area working out there.
W. J. Gamble,0:15:26,"Then as the saw mill started operation, the Swedish people followed west from Minnesota. They were saw mill people, and woods people."
Sam Schrager,0:15:40,"That's the band, yeah, most of our, well, take these formative we got there, all of the Swedes, they had to be able to talk Swedish, you know?"
W. J. Gamble,0:15:54,"And the same way as our saw mill, the part on the part that showed about half Swedes that I came there, they were saw mill men from back in Minnesota. They followed the lumber industry out."
W. J. Gamble,0:16:10,"And they were very good, reliable people too. That's one thing that Potlatch to start with, was blessed with, was a good, honest, reliable people. They took an interest in their work."
W. J. Gamble,0:16:31,The company took an interest in them too. That's the reason we had a company town for one reason.
W. J. Gamble,0:16:47,"We, Mr. Werhauer told me once, he says, demo, I want a good school run here, says our men and our children are entitled to a good education. That was in the company town, of course. The reason he told me that, I was chairman of the school. But the foremen, the different heads of different outfits had to take the place of like city council and school and all that kind of stuff in a company town."
W. J. Gamble,0:17:19,"So, because the company run it, you know?"
W. J. Gamble,0:17:22,"And each one of us had, my lot came to the school."
W. J. Gamble,0:17:29,And we did have one of the best grade high schools in the state of Idaho.
W. J. Gamble,0:17:38,We run that the same as Della Sano.
Sam Schrager,0:17:41,How was that?
W. J. Gamble,0:17:43,"We run it, the teachers didn't run it."
Sam Schrager,0:17:48,"What was, what makes you say or know that it was of such good quality, the school? What makes you say that it was of such good quality in the school?"
W. J. Gamble,0:18:00,"Well, because we made it that way and we paid higher money for good teachers than these other towns are out or even Moscow. But we reserve the right to fire and hire teachers as if they didn't fit the bill too. The teachers weren't telling us what to do as they are now."
Sam Schrager,0:18:22,"Well, who made up your board, the school board, besides yourself?"
W. J. Gamble,0:18:27,"Well, I had two other men on. One was the cashier of the bank and the other was the land agent for the lumber company. We had to comply with the laws of Idaho, of course. We had a little election that nobody voted that. Vaught twenty -two voted, elected these three men every year. And I'm not a school man, but I run the school. And the way I run it was this. I hired a superintendent to do as he was told kind of a school we wanted to run. And every year, well, the Idaho Board of Education will send the group in from Boise to see if we qualified for Idaho schools. And besides that, there's a group of instructors in Portland, I think, the Northwest Educational Association. They sent, we hired them to send a group of three men in every two years to check our curriculum and our teachers and see if they were getting good education. And on top of that, every five years, we sent to Iowa State and got that group to come out here. They spent a week with us, five men, looking over our schools. Now, that's how I run the school. I didn't know about this, but I hired men that could tell me what to do. And the company paid the bill. That's the reason we had a superior school."
W. J. Gamble,0:20:26,We built the schoolhouse ourselves. We furnished them ourselves. The people paid no school taxes of any kind.
W. J. Gamble,0:20:37,"And there's some of these other towns around here are a little bit jealous of us, but that doesn't make any difference to us. We did that because of our men, and we wanted to keep them happy. We did, we had good family relationships. And the school was one of them. Store was another, like you buy things at the company store, cheaper than you could over here in Moscow. But as I look back on that now, all that stuff,"
W. J. Gamble,0:21:12,people gradually take all those things for granted. They never miss it until they have to go someplace else to find out.
W. J. Gamble,0:21:27,"That seems like human nature. The grass is always greener. Yes, that's right, that's right."
W. J. Gamble,0:21:34,"But it did hold our men. They were happy to live in Potlatch. They lived the way they wanted to. They had cheaper rents. They had a place else, the United States, electric, telephone, everything else. We owned all that stuff."
W. J. Gamble,0:21:53,"And we owned our own hospitals, even the churches."
W. J. Gamble,0:22:01,So really the company pretty much provided for the social life and the educational life and all phases of life for people.
W. J. Gamble,0:22:12,"That was all a part of different outfits duties, part of their duties on their job. I afterwards, of course, as you know, I afterwards got out of the school business and got into politics and taxes for the lumber company. But again, that was a part of my job other than running an railroad."
Sam Schrager,0:22:40,Was Mr. Laird very deeply involved in the running of the town of Potlatch?
W. J. Gamble,0:22:46,"Oh, 100%, yes, yes. Very, very strict disciplinary end. But he wanted everything done for the benefit of the employee. But he was very strict. And first, nobody can sell liquor in Potlatch or anything like that. I don't say it wasn't brought in, but."
W. J. Gamble,0:23:23,"No, and oh, he took an interest this way. Just an illustration of how you asked the question, how he's interested. At one time, to start with, he was the head of the schools. Of course, this thing grew so much that he had to get rid of some of those jobs. But to start with, he was the head of the schools."
W. J. Gamble,0:23:56,"And he hired, he interviewed every teacher that was hired. The superintendent hired a teacher, but the next comes he was to Laird."
W. J. Gamble,0:24:13,"Every, for every teacher that was hired was a Sunday school teacher too."
W. J. Gamble,0:24:23,"Well, that was a part of their job, extra job, to keep the church going. We had three churches and a Catholic church and a little sweet church and a church for everybody else. They all, the company built them and heated them very slight water for them, but the people had to take care of the minister's salary and all that. Anything else they spent."
Sam Schrager,0:24:58,"Well what was Mr.Laird's title there in his?"
W. J. Gamble,0:25:00,Mr. Laird was General Manager.
Sam Schrager,0:25:04,He succeeded Bill Derry?
W. J. Gamble,0:25:07,"He succeeded Bill Derry. When Bill Derry was here, he was General Manager and Laird was Assistant General Manager. No. The Laird was not a lumberman. He was a banker, but he knew enough to hire a good lumberman. Bill Derry was a lumber logger, a lumberman. Laird was very successful in running the company. He had a very good reputation out among the other lumbermen and other people he had to contact. I think if you'd go up around Spokane and find the men that were instrumental in building Cooley Dam and the Ilden Railroad and all that kind of stuff, you'd find that they'd say, Mr. Laird was a very fine gentleman."
Sam Schrager,0:26:16,"When Bill Derry and Mr. Laird were both there working together, what was the division of responsibility?"
W. J. Gamble,0:26:23,Was Mr.
Sam Schrager,0:26:23,Laird's responsibility the town?
W. J. Gamble,0:26:26,"Oh, Laird took out the financial end of it, yes."
W. J. Gamble,0:26:34,"Bill Derry didn't think about figures. Didn't want to, but all the, and Laird looked, I think he, I don't recall it, he had charged the sales department too, but not the manufacturing end of it, or the logging end of it. But we had our own bank and he had charges out, he had charges at town site, he had charges of the taxes and the politics and everything else. He took care of all that."
W. J. Gamble,0:27:17,I take it too that he was probably rather well educated.
W. J. Gamble,0:27:23,"He was a little better educated than Bill Derry was, yes. I don't know the extent of his education, I don't know that."
W. J. Gamble,0:27:34,"Bill Derry, I always hear people talk about him, they always say, boy, he was a rough, tough lumberjack."
Sam Schrager,0:27:44,"And I'm wondering what his character was like. Was he a very blunt man, very direct? Was he short with people?"
W. J. Gamble,0:27:50,"Oh, yes, yes, yes."
W. J. Gamble,0:27:54,"He was one of these self -made men. He had to fight for a living when he was a kid, I imagine, because, well, he was brought up as a lumberjack in the woods of Minnesota, Wisconsin, and on the river, and the sawmills. He knew these things by first -hand knowledge."
W. J. Gamble,0:28:23,"Planning ahead, I doubt if he was very capable of anything of that kind. He knew what kind of saw money he wanted to build, and all that kind of stuff. He knew what was, what could make money and what couldn't. Only he made one heck of a mistake when he built Elk River."
Sam Schrager,0:28:46,Why was that a mistake here?
W. J. Gamble,0:28:49,"Well, the lotus could have been brought into potlatch and cut in lumber a lot cheaper than they did to Elk River. First place, Elk River is a snow belt, and it was pretty tough operating up there, very expensive. Matter of fact, that was the days before dry kills, and it was so wet, and the snow lasted so long that you couldn't get the lumber dried in the yard, piled it in the yard to dry. All that was a complete flop."
W. J. Gamble,0:29:29,But...
Sam Schrager,0:29:29,Is that the reason that the mill lasted such a short time there?
W. J. Gamble,0:29:32,"Yes, yeah. It really wasn't turning a profit to justify the expensive operation."
W. J. Gamble,0:29:42,"Oh yes, it was an expensive operation, and it should never have been."
Sam Schrager,0:29:49,"Well, did Bill Derry take advice from many people, or did he make all the decisions himself?"
W. J. Gamble,0:29:54,Himself.
W. J. Gamble,0:30:03,"Then after... He'd give a man a job to do. That's the last he'd ever hear of Bill Derry, unless the job went somewhere, then you'd hear it from right now. But he didn't want anybody to come in and bother him about it, or anything of that kind."
W. J. Gamble,0:30:22,And he... They didn't make money on that St. Joe Boom Company up there at Coeur d 'Alene.
W. J. Gamble,0:30:36,"But it took that kind of a person to put the thing across to start with. You'll find, I think you'll find the same type of man in the early days of mining in this country. Practically the same kind of a man. These early -day men that developed some of these mines."
W. J. Gamble,0:31:02,"I mean, a pioneer or somebody who wouldn't let anything... obstacles stand in his way like... That's right."
W. J. Gamble,0:31:09,That's right.
Sam Schrager,0:31:24,What kind of... Confidence do you think that the...warehouse or interests had in Derry? Was it a complete confidence? Did he make all these decisions?
W. J. Gamble,0:31:28,"Oh, yeah, yeah, she bet. Yeah. Uh -huh. He wasn't... expected to explain or represent why he was doing what he was doing very much."
W. J. Gamble,0:31:45,"Oh, he... No, they placed all the confidence in the world in the bill, especially in the timber area. Logging."
W. J. Gamble,0:32:00,And he's one of these fellas that... can fight at the drop of the hat. He was really pretty rough.
W. J. Gamble,0:32:11,You wouldn't think of somebody in higher level of management having to fight about anything anyway. He's not going to have somebody coming up and giving.
W. J. Gamble,0:32:24,Well...
Sam Schrager,0:32:26,"Or wasn't it like in the old days, when that kind of thing happened more than it would today?"
W. J. Gamble,0:32:32,"Well, you... The kind of men he was dealing with, you had to... They had to know that he could take care of himself, too."
Sam Schrager,0:32:45,"Was he a big man, physically?"
W. J. Gamble,0:32:49,"Not tall, but he was big, yes, yes."
W. J. Gamble,0:33:01,"Now... For instance, Bill used to say, oh, the early days, Saturday night, you'd come and you'd get on horses and ride the pollution or something, you'd get on to a dance and... Do a little raking and one thing or another. They used to, well, they used to run a passenger train from here to Palouse on a Sunday to bring the crew home from Saturday night."
W. J. Gamble,0:33:32,"Well, Bill's idea was this. He says, if you want a drink, get the hell out of town, go do it in town."
W. J. Gamble,0:33:43,"And that was his way of expressing himself with just so many words, too, and he mattered. Same way with Princeton up here. He was pretty rough -tolerant one time. And we had... We had to keep our men out of there, if we could."
W. J. Gamble,0:34:07,"And of course, construction, real construction, used to be pretty rough stuff all the way."
W. J. Gamble,0:34:20,"No, he hired a man that built sawmills. He told one kind of a sawmill he wanted and a man named Horst Cutty built it."
W. J. Gamble,0:34:37,"And he built two or three mills for the company, matter of fact. He built the... He built Cornell Lane, he built Albert."
W. J. Gamble,0:34:51,"I don't think he was in on long view, I don't believe so. But he was a sawmill construction man and of course, they were dealing with men of that kind. And he was a good man."
Sam Schrager,0:35:09,Did that mill go up fast from when they started to when they could start?
W. J. Gamble,0:35:13,"Oh, yes, yes."
W. J. Gamble,0:35:25,"Yeah, they do what they want, of course. All they had to do was put it together. Of course, they owned this sawmill down at Palouse and they sawed all our timbers and everything for this mill down at Palouse. We used to ship the locks down the river to Palouse."
Sam Schrager,0:35:51,Was it the largest sawmill in the world?
W. J. Gamble,0:35:55,"It was the largest white pine sawmill in the world at one time, yes. There were larger sawmills on the coast because the requirements over there for the handling larger timber. But as far as white pine is concerned, it's the largest white pine sawmill."
W. J. Gamble,0:36:20,"Well, talking about the character of the country is being pretty tough then. I've heard that the conditions were pretty tough too in the camps when they first started."
Sam Schrager,0:36:36,In the camps?
W. J. Gamble,0:36:36,"Yeah. Well, yes, they were because they didn't know anybody."
W. J. Gamble,0:36:46,"We improved all things and all lines of work while we improved our camp conditions too. But I think to start with, I would say that the camps, the Partlatch Woods were about the same as they were in the Wisconsin and Minnesota woods. Matter of fact, they were patterned after that. And they were pretty crude, yeah, that's right. But in the end, they were pretty good too. They had very good living conditions in the woods when I left."
W. J. Gamble,0:37:31,"That was just a case of natural improvements, you know."
W. J. Gamble,0:37:38,Working conditions of all kinds have improved over a period of years. That's all I wanted too.
W. J. Gamble,0:37:47,"The men that worked constructing that came into the country, it seemed like so many of them just disappeared. No trace of them anymore."
Sam Schrager,0:37:58,What's the story on that? What kind of construction you ever approached?
W. J. Gamble,0:38:01,"I'm thinking of the building of the railroad, the main."
