speaker,timestamp,words
W. J. Gamble,0:38:05,"Well, naturally, the Transcontinental Lines, they followed the line of rails one end or the other. And they never, as a matter of fact, there were temporary camps all along the whole building of the road. On the WIM here, we had a camp at Potlatch to start with. The next one was at Harvard, the next one was Yale, the next one was at Derry. We set those camps up for maybe six month duration or something of that kind, you know."
W. J. Gamble,0:38:44,"I wanted to try to talk to someone who was Italian who had been working in the camp. I found one old Greek who had stayed in Elk River, Dementus, I don't know if you knew John Dementus, but they're these foreigners, Eastern Europeans, and certainly the Chinese or Japanese laborers are just terribly hard to find. Well, that's first from the, Potlatch Bill first started."
W. J. Gamble,0:39:17,"We had a contractual agreement with the Japanese agency in Seattle to furnish us with labor. And we had a regular Japtown at Potlatch, so it was trying to separate from the rest of the town. In other words, we didn't want to get the people mixed up. And they would even, this fellow of course,"
W. J. Gamble,0:39:44,"he was a rustless, jap, he'd bring a bunch of men in and he'd tell them what to do and that was that. They didn't do what was right, because we'd send them back and oh, he was tough with them. And all our groceries had to be bought through him and all that kind of stuff. He just said he had a monopoly on labor, on Jap labor. Of course, we got rid of that as soon as we possibly could. It was replaced with Greek labor."
Sam Schrager,0:40:22,What did they do? What was the laboring work that they were supposed to do in Potlatch? Common labor?
W. J. Gamble,0:40:30,"Oh, there's a lot of common labor around the sawmill. Just a lot. Gosh, all the, now gauge track work to keep up through there, gauge lumber road, buggies in the lumber yard. We had miles of it in there. And any of this common labor stuff. There was common labor in the sawmills and the firehole and all that kind of stuff. Oh, just a lot. On the railroad, our section crews, they were all Japanese. We dealt with that Jap for a while."
W. J. Gamble,0:41:14,Do you know about when the - Yeah.
W. J. Gamble,0:41:19,"Once a month, a payday. The four women committed to Spokane going to Jap Town. Stayed for three nights."
Sam Schrager,0:41:33,"Were they Japanese, these women?"
W. J. Gamble,0:41:35,No.
Sam Schrager,0:41:40,"Do you know about when they went out and you got Greeks in, take their place?"
W. J. Gamble,0:41:48,"Mm, I was a gradual thing. The end of the Japs was of course during the war. We had to let them all go. But they had been down to Pigner and Nothing before that. There were a few left. Oh, I had, it was a Jap, Jallers are at the store and there was a Japanese gardeners. And no, there was probably a dozen when the war broke out. But they all had to get out."
Sam Schrager,0:42:23,Did they mix very much with the townspeople when they were there?
W. J. Gamble,0:42:26,"No, no, no."
W. J. Gamble,0:42:30,"Although the kids went to school, they were all right. They had to get in."
Sam Schrager,0:42:38,"Did most of them speak English, the adults?"
W. J. Gamble,0:42:41,"The kids did, the parents didn't, all those. We had one that the Jap Jallers, the store, there's some questions about the fellow. Whether or not he might have been sent in here. Of course, everybody was under suspicion during the war. But this fellow in particular, I think he was planted here."
Sam Schrager,0:43:08,You mean as some kind of an agent?
W. J. Gamble,0:43:13,All that feeling ran pretty strong during the war.
W. J. Gamble,0:43:17,"It got quite a bit of feeling at one time, yeah, on those fellows."
Sam Schrager,0:43:25,Was there a similar feeling about Eastern Europeans at that time too?
W. J. Gamble,0:43:33,"Because it seemed like a lot of them, I've been told, disappeared at World War I. They thought they went back to Eastern Europe. The Germans, yeah, the Germans and the Italians."
Sam Schrager,0:43:48,What was the management view of all the IWW agitation that was going on?
W. J. Gamble,0:43:57,That was the start of unionism.
W. J. Gamble,0:44:00,"That was the start of the unions coming into the woods. It started with the war. And IWW was a kind of a, oh, it was a fringe organization. It was"
W. J. Gamble,0:44:20,"mostly to see how much commotion they could cause. I think it was a part of the war deal to start with. But they got into the woods and they were pretty strong at one time. And we had quite a bit of trouble with them, yes. And they developed into a labor organization. And of course, they didn't last very long as such because they were too radical."
Sam Schrager,0:44:52,"When you say part of the war deal, are you thinking, meaning that they were part of the opposition to World War I and are fighting in the war?"
Sam Schrager,0:45:07,What did they do mostly?
W. J. Gamble,0:45:09,"Was it, I've heard a lot of different things about what they may have done or didn't do."
Sam Schrager,0:45:15,And did they disrupt? Did they stop?
W. J. Gamble,0:45:20,"They were mostly located in the woods, in the woods operation. And they would, all their drive nails and logs and stuff like that, you know, and you couldn't find them, put them through the band mill. The first thing you know, you'd rip the teeth off a band saw. And things of that kind. They were destructive, no question about it."
Sam Schrager,0:45:45,Did they ever strike the camps in the woods? Ever what? Did they strike the camps in the woods around here?
W. J. Gamble,0:45:54,"Well, not exactly a strike, but they were infiltrated in there that we had to send some of our own men in to combat it. Mostly talk and this little things that I say, drive nails and logs, they'd induce somebody to think that he was being mistreated, you know, and anything to get members."
Sam Schrager,0:46:25,Did they have much influence in potlatch as compared to what they had in the woods? Did they have much influence on it?
W. J. Gamble,0:46:31,"No, no, they didn't."
W. J. Gamble,0:46:33,"No, no, we had a, we had an organization in potlatch."
W. J. Gamble,0:46:43,"No, we were armed, pretty near a National Guard."
Sam Schrager,0:46:54,"Did that, did it, what did that group do?"
W. J. Gamble,0:46:57,"We organized that on the face of it to train men who were going to be drafted into the Army. And we had an ex -West Pointer there that got kicked out of the Army, but he was a good drill master. And we had quite a company there. Oh, I'd want to it. And we'd drill every so many nights a week. And, but it was, to start with, it was started out to these young fellows that were susceptible to the draft. And by the way, most of those fellows who were drafted were taken into the regular Army as corporals. They had that much military training and they, we were proud of that."
Sam Schrager,0:47:57,Did you have standing as a National Guard unit or?
W. J. Gamble,0:48:00,"No, we bought our own guns and the company bought them."
W. J. Gamble,0:48:04,And we belonged to the National Rifle Association.
Sam Schrager,0:48:08,Do you think that that?
W. J. Gamble,0:48:10,"That did have its influence on keeping the IWWs out of potlatch. It did, definitely."
W. J. Gamble,0:48:17,"And there were a fair number of the, of the members of the group were, were sawmill workers."
W. J. Gamble,0:48:23,"Oh yes, yes, yes. Just the citizens of potlatch."
W. J. Gamble,0:48:28,"And what happened,"
Sam Schrager,0:48:33,"When did this, the 4L begin as a, the 4L as a?"
W. J. Gamble,0:48:38,"That was the first real labor organization that developed, that was to combat the IWW, to start with. We had, there was a man that was connected with the, all the lumber companies. He organized that thing over at Seattle. And that was to combat the IWW. And of course it developed into a labor organization. I don't see any existence now because it was, it was conceived and organized by the lumber companies."
W. J. Gamble,0:49:26,No.
W. J. Gamble,0:49:27,"Did it get, It was a very popular organization too."
W. J. Gamble,0:49:31,It would give them a chance to belong to something so that an organizer couldn't come in and call him a scab.
W. J. Gamble,0:49:43,"And it was, it served its purpose."
Sam Schrager,0:49:47,"Was it, did that become the labor union of the mill and potlatch at the time?"
W. J. Gamble,0:49:54,Yeah.
W. J. Gamble,0:49:58,"And of course, they, I think, see, I think we had a strike, 4L strike. And that kind of fizzled out, then that was about the end of the 4Ls. And the national organizations came in after that."
W. J. Gamble,0:50:17,"That was a striking potlatch. I know, I know, Hap Moody told me about an early, some early strike when he was dead. Oh yeah, Hap was, Hap was sheriff and he came over and deputized."
W. J. Gamble,0:50:31,I was a deputy sheriff. We were all deputized.
Sam Schrager,0:50:38,Was that part of that 4L strike you think that?
W. J. Gamble,0:50:54,"Yeah. When Mr. Laird became the general manager, is that about when T .P."
Sam Schrager,0:51:02,Jones became part of the company operation?
W. J. Gamble,0:51:07,"No, Jones came out here with Dury."
W. J. Gamble,0:51:12,Yeah.
Sam Schrager,0:51:14,So he'd been around?
W. J. Gamble,0:51:15,"He came out with Dury from back around Chippewa Falls or someplace where he was, yeah."
Sam Schrager,0:51:23,"Since Laird didn't know so much about the woods operation, did more of that fall on Jones's shoulders?"
W. J. Gamble,0:51:30,"Yeah, yeah."
W. J. Gamble,0:51:33,"Yeah, he was Wood's superintendent. Yeah, there was,"
W. J. Gamble,0:51:44,"he was in charge of the woods, no question about that, yeah."
W. J. Gamble,0:51:51,Mm -hmm.
Sam Schrager,0:51:53,"Well, as far as the way decisions were made on the running and operation of the railroad, how did the chain of command work? How did the chain of command work for the running and operation of the railroad?"
W. J. Gamble,0:52:09,"I assume as general manager of the railroad, you were at the top and had to final say on the basic decisions of the railroad."
W. J. Gamble,0:52:17,"Well, the railroad was entirely separate corporation from the lumber company. No connection between them at all. Well, there's a connection in that the lumber company paid for the building of it and then took stock and bonds for their expenditure because so they owned the stock and bonds of the railroad company, the lumber company did."
W. J. Gamble,0:52:49,"But we had to operate under the rules, the interstate commerce commission, the same as any other railroad. And of course, that was one of the things they finally had to find out the hard way that they had to get some money in and do something about a railroad. To start with, the first year of the operation of the railroad, they owned a bunch of lumbermen and some of the people left over from the construction crew and it was kind of a haphazard thing. But they soon found that they had to."
W. J. Gamble,0:53:24,You told me before that some guys got thrown in jail for not knowing the way things ought to have been done. Oh yeah.
Sam Schrager,0:53:32,"I was wondering, what were the kind of violations that you could get into if you didn't know the way to do things?"
W. J. Gamble,0:53:42,"Well, for us, it's a site one illustration. The first place we built our stations and we built grain warehouses at each station and we run these warehouses, grain warehouses. Well, we soon found that we should get out of the warehouse business. So we leased the warehouses to a man named Mark P. Miller, here in Moscow. He owned a flour mill there and he run the grain warehouses. Well, we didn't pay much attention to Mark until one day an interstate communist man came in and says we're you're indicted, Mark Miller's indicted."
Sam Schrager,0:54:29,What for?
W. J. Gamble,0:54:30,"Well, Mark was shipping stuff out of Derry that and misquoting it. He didn't, he had stuff in the car and he shouldn't have and didn't declare it and was getting it shipped over to Moscow at a cheap rate. Well, of course, we didn't know anything about it because Carlo'd ship it, we never expect. And so we got all of that went all right, but Mark P. Miller got, then we had a superintendent to start with. He bought a, he wanted to go farming. He bought a farm up around Harvard and build a house, barns and everything else."
Sam Schrager,0:55:16,"And the interstate communist inspector come in one day and says, what you gonna do about this?"
W. J. Gamble,0:55:23,The old man's shipping stuff up there free.
W. J. Gamble,0:55:29,"So he was canned. And those are the things, yeah, those are."
W. J. Gamble,0:55:34,Conflict of interest.
W. J. Gamble,0:55:37,"Of course, I think perhaps in the early days, the first couple of years, there was a lot of that stuff done. Well, it's our railroad, we can do all the running with it. But they soon found out they couldn't do that with the railroad."
Sam Schrager,0:55:55,What was the personnel structure of the WI&M when you were the general manager? What was the chain of command within the railroad? Who were the?
W. J. Gamble,0:56:11,"Well, I had a master mechanic that took care of the mechanical work. I had a, I had a master mechanic dispatcher who took care of the operation of the trains. And I had a road master who looked after the maintenance of the road and the telephone company. We owned the telephone company in Potlatch, the railroad owned that and also owned the line from Potlatch to Arbogal to Palouse."
W. J. Gamble,0:56:47,"So I had to have a combination, man. I knew something about telephones and well, I made him."
Sam Schrager,0:56:56,What about the various depot agents? Were they directly under you or were there someone else in charge of them?
W. J. Gamble,0:57:04,"Well, the auditor took care of the depot agents."
W. J. Gamble,0:57:08,They come under the supervision of the auditor and we had an auditor. I'd forgotten about him. That's so evil.
W. J. Gamble,0:57:25,"No, I shouldn't have said that."
W. J. Gamble,0:57:28,You gotta have fiscal management. Someone's gotta.
W. J. Gamble,0:57:34,"So I had, I had my work pretty well distributed and I, all I had to do was after I got it organized was supervise it. I had had a lot of experience before I came here, of course."
Sam Schrager,0:57:52,Who went into that last time?
W. J. Gamble,0:57:56,"You know, the size of the trains is something I was wondering about. I saw one picture labeled longest log train in the world. A hundred car log train, yeah."
Sam Schrager,0:58:07,What was the story on that particular train?
W. J. Gamble,0:58:10,"Oh, they just made that up for something to talk about. That wasn't a usual train. No, no."
W. J. Gamble,0:58:23,"And there was a lot of that stuff that was,"
W. J. Gamble,0:58:30,"shouldn't have been done, of course."
W. J. Gamble,0:58:36,"When I was operating, our trains would consist of about 60 cars. That was my opinion, good operation."
Sam Schrager,0:58:48,So you're talking about a hundred cars?
W. J. Gamble,0:58:50,"No, that was just a build up."
W. J. Gamble,0:59:00,"We had a, we had a, one of the better types of short line railroads."
W. J. Gamble,0:59:08,"There's something like over 350 short line railroads in the country. Most of them are in connection with some big industry, you know, like Christmas connection with the lumber company. Others are connection with the steel companies and the oil companies and what have you. Just a lot of them, 350 of them. They have quite an organization, America's Short Line Railroad Association. I have a president in Washington. I have a Washington office. I was vice president of the organization for some little time. And yeah, it's quite an institution. One short line railroad don't have very much to say when you're talking to these big lines. But 350 of them, if Poppas and Mamas like lumber companies and steel companies have quite a bit to say from political standpoint. And it was a very good organization, well -founded. We were not radical."
W. J. Gamble,1:00:16,"And we, well, we had to help our less fortunate short lines. We had to send a man here and there to kind of get him straightened out about something, you know, things of that kind. Because a lot of them were, you know, they didn't just didn't know what to do, I'll operate."
W. J. Gamble,1:00:42,"Matter of fact, I had a letter from a fellow back in Wisconsin the other day. They had the Libby Owens Glass Company, one of the biggest doctors in the United States, owns a short line railroad back there. This fellow sent me a little folder that they got out and told them about the railroad. It's very interesting."
W. J. Gamble,1:01:17,You talked to me a little about being in the legislature representing the North Idaho lumber.
Sam Schrager,1:01:28,"What was it, the North Idaho lumber?"
W. J. Gamble,1:01:31,North Idaho Forestry Association.
W. J. Gamble,1:01:34,"Yeah, I worked for them."
W. J. Gamble,1:01:38,"One thing that you talked about that happened before then was the creation of the forestry law for the state of Idaho, the writing of that law. Well, there was no connection between those things. Yeah. Yeah. That's right."
W. J. Gamble,1:01:58,"I was wondering about... This North Idaho Forestry Association was set up as a kind of a fact -finding organization for all the lumber companies of North Idaho. And they would meet every so often and express their opinions about maybe legislation or taxation or things of that kind. It had nothing to do with operation of lumber companies. But the nice thing about it was,"
W. J. Gamble,1:02:33,"as far as politics and taxes were concerned, there was no dissent. When I go to Boise, I was talking for all of them. Nobody... there was nobody telling me, well, I don't believe in this. I believe it's up and else. They were all in the court. It was easy to work for a plan of that kind. So they ironed out their difficulties in their office before it was headed to me."
Sam Schrager,1:03:08,"While you were representing them, what was the general nature of the interests, the kinds of legislation that they would favor, the kind that they would be opposed to?"
W. J. Gamble,1:03:22,"Well, on the taxes, timberland lumber taxes and sawmill taxes are pretty terrific. And we'd meet three times a year. I had to go to Boise at least three times a year to meet with the Assessors Association, if you please, the County Assessors Association. They had a lot to say about how some of this stuff should be taxed. I met with them. I went down in every August to the Board of Equalization, Tax Board of Equalization meeting, at which time you can express yourself as to what your taxes are and should be, compared to something else and all that kind of thing. So there was a lot on the taxes. Just as far as legislation was concerned,"
W. J. Gamble,1:04:19,"I was down there. I had two lawyers with me, one all the time and the other only part -time. One was a labor lawyer, but he was only there part -time. The other was a general counsel, Coeur d 'Alene. He kept me advised on the legality of things. And my job was to see that no adverse legislation was put through that would harm the lumber interest. And once in a while, we had something we wanted to promote, too."
Sam Schrager,1:05:00,"And now it's a form of lobbying, all right?"
W. J. Gamble,1:05:04,"There's no question about that, although I never ask a legislator to vote or not to vote for anything that I had thought of. You can't control legislation that way. I set up offices down there. More of an information bureau than anything else. And it takes a while to gain their confidence, but once you do that, they come to you and ask you how a bill will affect lumber companies. Most of the legislators don't want to do anything that will affect the industry and the state, you know. And if they can trust somebody, they'll come to them for their information, because they don't have time to get it themselves. They don't have time to read all these bills that are put through."
Sam Schrager,1:05:59,So you had to keep abreast of the legislation?
W. J. Gamble,1:06:01,"Oh, yes, yes, yes, yes. You probably had to research it yourself in some cases. Mm -hmm."
W. J. Gamble,1:06:09,"So, on the whole, we had a pretty good setup. At least I was never criticized. The fellow that followed me took my place, so I quit. He got halfway through the session, and they called him before the state senate and told him to get the hell out of town."
W. J. Gamble,1:06:37,"Well, the poor kid, he just didn't... He was just overpowered with his authority and all. Which we said."
Sam Schrager,1:06:50,"Were there interests in the state that ran in conflict with the lumber company interests as far as, let's say, promoting the legislation that you had to oppose?"
W. J. Gamble,1:07:02,"Yes, there were. There were the..."
W. J. Gamble,1:07:06,"Oh, you take the mines and the railroads"
W. J. Gamble,1:07:17,"and the telephone companies, power companies. We all have certain things in common. All like, say, safety rules."
W. J. Gamble,1:07:37,"Work with compensation. And all these social security things, they're all... affect all of us the same way. So, we had the... what was called a self -insurers. That's the self -insurers of the... We owned our own hospitals and our doctors and stuff like that. And when the state law says that we have to protect our men. So, we formed the self -insurers because our interests were all common. We worked through that organization for legislation along that line. Now, we didn't work on anything that would be... ...competitive with somebody else or anything like that. No, no, we just..."
Sam Schrager,1:08:34,Can you give me an example of the kind of legislation that you had to oppose? Because it would have hurt the lumbering industry in the state?
W. J. Gamble,1:08:44,"Yeah, well, sure."
W. J. Gamble,1:08:46,"Just comes to mind. This is kind of a funny one, too."
W. J. Gamble,1:08:53,I was opposing a bill that the drug people had introduced in the Idaho legislature.
W. J. Gamble,1:09:06,"All like the selling of aspirin in drugstores and stuff like that, you know. And all those minor things. They wanted to be a little more strict. You couldn't sell them in drugstores or grocery stores. And they had quite a bill. And I started to fight again. And I got a call one night about, oh, after midnight, something opened my door."
Sam Schrager,1:09:38,A gamble?
W. J. Gamble,1:09:39,"Yes. It says, well, I'm so -and -so from Seattle. Well, I said, I don't know you. Well, he says, I represent the drug company. He says, I'd like to talk to you. So I got up and let him in."
Sam Schrager,1:09:52,"He says, what the hell is a lumber company that's opposing our drug bill for?"
W. J. Gamble,1:09:58,"Well, I says, I'll tell you. I says, you know, we run camps out in the woods. Maybe 250 men in a camp. We have to keep a certain supply of different things in that camp. Old heavy clothing and tobacco. And among other things, aspirin and drugs of certain kinds that we dare handle. Cough drops and things of that kind. We have to have that in our supplies at these camps. I says, your bill would prohibit that."
Sam Schrager,1:10:34,"Well, he says, who the hell would ever have thought of that?"
W. J. Gamble,1:10:41,"Well, that's an illustration of one thing."
W. J. Gamble,1:10:50,"Another is a different angle. Oh, good, many years ago, we had an infestation of tussock moth. We've got another one now. In the woods. And it was something new in this country. And it got away from us. We lost a lot of timber. Died overnight. So the man from the federal government came out here and says, we got to spray. He says, we have to spray that will kill that. And they got to hire planes and spray the whole damn woods. Everybody's going to lose their trees. National government, the state government, lumber companies. Individuals, everybody. Says, it's got to be done and done fast. All right. We got the lumber companies to agree. And we got the state to agree. The federal government to agree. I'd have to go through Washington. This all takes time. And we had to rush a bill through the legislature authorizing the state of Idaho to come in on some basis and spray these trees. And we had to put a bill up that way. That is the only bill that I actually came out flat footed and asked legislators to vote for. And I had to be an agent of the legislators. And I had the biologists from Coeur d 'Alene come down there and give them a talk. I fed them. Give them what they wanted to drink. Made a party out of it."
W. J. Gamble,1:12:45,"And that had to be done that way and done fast. Now, that was one of the things that we were for. We handled it that way. It was rather a crude way, but you couldn't handle everything that way."
Sam Schrager,1:13:00,Do you remember about when that was?
W. J. Gamble,1:13:03,I forget what year that was. I really do.
W. J. Gamble,1:13:07,They come out the other day in the paper. They were supposed to have sprayed last fall. And they said then when the other— I don't remember. I don't know what year that was. That's been quite a while ago.
W. J. Gamble,1:13:28,That's been 30 years ago. You had to have that piece of legislation.
W. J. Gamble,1:13:35,So that's something that we were for and we're fighting for. We come out flat footed on it.
W. J. Gamble,1:13:41,"Was there ever any environmental list, environmental group opposition in the early days to— Not like there is now, to any kind of development."
W. J. Gamble,1:13:55,Nobody knew what environmental meant then.
