speaker,timestamp,words
W. J. Gamble,1:14:07,"I was wondering about the maintenance of the railroad and about the kinds of adversities that you had to put up with. One that strikes me that must have caused problems sometimes would be mudslides and the tracks washing out. Well, let's just keep an upper railroad. That's all."
W. J. Gamble,1:14:35,"Bridges have to be rebuilt. Sure, I rebalasted the whole railroad while I was there."
Sam Schrager,1:14:42,Re -ballasted?
W. J. Gamble,1:14:45,"I brought in a contractor from Spokane, crushed rock for a year, and give the track a lift of so many inches and put new ballast under it. When it was built, they tried to—which is all right, I guess— get their rock for ballast as close as possible. Well, the closest they got was a darn poor rock. It was a silica rock and it didn't hold up at all. The first thing you know, we was having trouble. We didn't have enough ballast under our rails. If we wanted to operate fast and heavy trains, so we had to rebalast. So I rebalasted the whole thing. I rebuilt all the bridges, 21 of them. That has to be done every year. Everything that's built of wood has only lasted so long. And it was just part of the railroad and that's all."
Sam Schrager,1:15:53,"When you rebalasted, where did the rock come from that time?"
W. J. Gamble,1:15:57,"Right this side of Beaudeville, we got a basalt rock up there."
W. J. Gamble,1:16:02,This stuff they got here is all up at Yale. It's all wet and pounding it into the— under the ties that'll dis -intrigaze. First thing you got is just kind of a soapy -like stuff.
W. J. Gamble,1:16:23,"The same way with a big fill we had that went out. I was down in Palouse one day and sectioned form and called me up and says, No trains today."
Sam Schrager,1:16:36,Why?
W. J. Gamble,1:16:38,"Fill bridge number so -and -so slid out. Well, what had happened, they had that— before I was in charge, we had a road master. He was a civil engineer too. And he decided that some of the bridges could be filled, cheaper than renewed. And he talked the boss into it and he filled them. There again, he took his fill material as close as he could get it, you know, to make it cheap. And he come into this silica again, as slippery as could be when it's wet. Well, you notice some of the concrete in Moscow here. And this was a bridge that was about 80 feet high"
W. J. Gamble,1:17:37,"and 500 feet long, he filled it. And what had happened, he had left the piling in the trestle and he filled it with dirt. And he put ballast on top of it. And he had a filled bridge. Fine, looked good. Had a concrete culvert under it. Over the years, as the snow fell and the rains came down, it would go in the top of this thing in the ballast, you know, the ballast would let water through. And this darn fill would hold that water like a pail, if you please. It got clay. And it got to the point where it became saturated, cleared onto the base. The top weight was too heavy for it."
Sam Schrager,1:18:38,What happened?
W. J. Gamble,1:18:39,Just went out like that. The whole damn works.
Sam Schrager,1:18:46,"Well, what to do?"
W. J. Gamble,1:18:48,"Gee, guys. Had a sawmill to keep going, the witch department to keep going. So he put in a steam shovel and some dump cars and started filling with rock. It took us two weeks to do it, but we did it. And the mill kept going. Didn't have to shut it down because we had enough locks. But those are some of the things that happened."
W. J. Gamble,1:19:21,"That sounds like a real crisis situation. Well, it was. It was. And it was a,"
W. J. Gamble,1:19:30,something that hadn't happened around this country before. And we had a lot of railroad men from other railroads come in to take a look at the thing to see what was happening. And it was quite a problem. They was taking it home to their own railroads because they had done the same thing.
W. J. Gamble,1:19:52,"But it all slipped now, I know that."
Sam Schrager,1:19:59,What was your attitude as a general manager toward the people that worked for you? Was there attitude?
W. J. Gamble,1:20:11,Your attitude towards what you expected from them and...
W. J. Gamble,1:20:17,"I'd never ask a man to do anything I couldn't do myself. I wouldn't do myself. I was all, I never criticized a man in front of other men."
W. J. Gamble,1:20:31,I had a crew of men that most of them never worked for anybody else in their life.
W. J. Gamble,1:20:44,"Talked to a man out here at a funeral the other day. A gentleman says, we looked back to the time we worked for you, he says we're glad of it. I know how to treat men. I know what to expect of them."
W. J. Gamble,1:21:07,I treat them fair. I never had any trouble. I like to make my own men.
Sam Schrager,1:21:16,What do you mean by that?
W. J. Gamble,1:21:19,"Well, I've taken kids that couldn't work for anybody else and made damn good railroad men out of them."
Sam Schrager,1:21:31,How does that work?
W. J. Gamble,1:21:33,Do you give them responsibility or...
W. J. Gamble,1:21:35,"No, I train them right. Yes, I give them responsibility as they are capable of accepting it, sure."
W. J. Gamble,1:21:49,But I'm not a person to go out and go downtown and see signs in the windows. I want an experienced clerk.
W. J. Gamble,1:22:04,Most times you have to retrain them the way you want things done. Even college students.
W. J. Gamble,1:22:14,Doesn't surprise me.
W. J. Gamble,1:22:19,What you learn in books isn't something you can take with you and apply a lot of the time.
Sam Schrager,1:22:31,"But did you expect your men to like Bill Derry not to come to you? Like Bill Derry, did you expect your men to take care of themselves and not come to you?"
W. J. Gamble,1:22:46,"If they, let's say, wanted advice, yes, sure. Sure."
W. J. Gamble,1:23:02,"I think the big thing in being a supervisor of men is to know the job yourself. The men recognize that in a supervisor. If you don't know your job, some of the men on the job will be the first ones to find it out. And I never hesitate about taking advice from a man regardless of how lonely he was on the echelon. No, I learn something every day for somebody. You bet."
Sam Schrager,1:23:50,Do you remember what Potlatch was like to town when you first came there? What it looked like to you? What the activity was like? What your feel of the place?
W. J. Gamble,1:24:00,You told me before when we talked you didn't expect to stay there very long. But I'm wondering what your impressions of the town were in 1910.
W. J. Gamble,1:24:13,"Well, it was pretty new then. There wasn't very much entertainment. There were no automobiles and no good roads. We had to make our own entertainment."
W. J. Gamble,1:24:28,"And we did. In the summertime, we had four baseball teams in Potlatch. There were good ones, too. People took an interest in it."
W. J. Gamble,1:24:43,"We conducted dances. We had an amusement hall. Oh, we'd have people come in and speak once in a while. Political talks had Bill Barr in a lot of times. And the hall would be crowded and come up to hear Bill talk. Politics or otherwise. And it was a big dance hall. It was accommodate a lot of people."
W. J. Gamble,1:25:14,We divided the town up into departments. We'll say like the railroad and the store and the sawmill and the lumber yard and the plenty mill.
W. J. Gamble,1:25:29,"And each one of them was responsible for a dance once a week. Every Saturday night I'd have a dance, a big dance. And this group, each group would have to be responsible for decorating the hall, furnishing, and getting the music, and all that kind of stuff. Those were the things we had to do ourselves in order to keep the people entertained."
W. J. Gamble,1:25:58,"And it was very successful. That then developed through baseball and other activity of athletics. And we had an old livery barn there. We quit riding horses. And we turned that into a gymnasium. We hired an instructor, if you please. We had a little basketball team there. We had gymnastics and boxing and all that kind of stuff. Then finally the company built this great big gymnasium, one of the finest in the country. We had the instructor there. We held the Idaho State Tennis Championship there one year and had tennis courts. A line of athletic activities all the way through. We had inside gymnastics, indoor baseball, all that kind of stuff. And we did that to keep the people happy and busy."
W. J. Gamble,1:27:18,"And I think they were happy. I don't know whether it would be, no, or not. Of course the automobiles made a big change in those things. Not very many automobiles in 1910."
Sam Schrager,1:27:35,Did Pilots have a pretty stable feeling to it as a town when you first came there? Or did it seem like there was a lot of turnover of people coming?
W. J. Gamble,1:27:44,"When I first came there, I came down there to play baseball."
W. J. Gamble,1:27:54,"And the actors got mixed up at the railroad. If anybody had told me I was going to stay there as long as I did, I would have told them it was crazy. But the longer I stayed there, the better I liked it. The more I got involved with the people and the company, the better I liked it. And it was just developed into a good place to be."
Sam Schrager,1:28:20,How did it happen that you became general manager?
W. J. Gamble,1:28:28,"Well, that's easy."
W. J. Gamble,1:28:35,I came down there to do a certain job. They kept the folks who had to get me. And one thing led to another.
W. J. Gamble,1:28:48,"I had had a lot of railroad experience. They knew that. And a lot of people, I can see where a company town is not a good thing."
W. J. Gamble,1:29:10,"Men grew up, and children grew up in a town like that, and had no responsibility to government of any kind. They accept everything as is. Now, when this town over here was changed to an open town, they were lost for a long time and maybe still are to a certain extent. They didn't know how to run their schools. They didn't know how to police their town. They didn't know how to keep up the town. And there were sewers and there were water and there were police protection and the whole damn thing. And they had a pretty rough period there for a while. Just because people didn't have to do those things, you know, they didn't know how to do it."
W. J. Gamble,1:30:02,"I think the time comes when the town should be made to town, but I think it should come gradually. I didn't believe the way it was done over there, but it had to be done some way. There were a couple other towns in the United States the same way. The town of Pullman, Illinois. Pullman Car Company was a company town. By the way, Potlatch was kind of pattern after that. We had a town down here at Shasta, right beside Shasta. It was a company town, a sawmill town. But it was a terrible comparison. Running down houses and all, the company didn't pay any attention at all. And I can see where a company town could be a big disadvantage. If the company were inclined to take advantage of things, it might be the store, there would be higher prices. Ours was lower prices. The conditions under which people lived, if they didn't pay any attention to that, could deteriorate. To a big extent. We even papered the inside of people's houses over there for them when they wanted it done. We painted the inside of their houses for them. They had them on the outside too, as far as I could."
Sam Schrager,1:31:40,Where did this kind of benevolent policy come from?
W. J. Gamble,1:31:44,Was this Mr.
Sam Schrager,1:31:45,Weyerhaeuser's?
W. J. Gamble,1:31:45,"That was the principle of the Weyerhaeusers, that's right."
W. J. Gamble,1:31:50,"That was their principle. When I went down to Boise, to the representative, Mr. Weyerhaeuser came to me. He says, Gamley says, I can't tell you anything you want to do or want not to do down at Boise. He says, all I can say is this. He says, whatever is good for the state of Idaho is good for the pilot and slumber company. And I think that spells the attitude of the Weyerhaeusers."
W. J. Gamble,1:32:22,Which Mr.
Sam Schrager,1:32:23,Weyerhaeuser was this?
W. J. Gamble,1:32:25,Rudolph.
W. J. Gamble,1:32:30,"Yep. They were a great bunch of people. They were, well, when the original Weyerhaeusers came over here, they were just common German people, you know, that had a flame for mechanics and operated sawmills. All the boys were brought up the same way. Believe me, they didn't spend money foolishly. But I did the pilot up, for the fun of piloting it up."
Sam Schrager,1:33:13,Did the Weyerhaeusers maintain close contact with Potlatch and the lumber company here? Were they out here much? Did they have much to do with the oversight?
W. J. Gamble,1:33:26,"Sure, they always had their directors meeting at Potlatch. All the directors always came in at Potlatch."
W. J. Gamble,1:33:39,"And Rudolph, particularly, well, see, to start with, the old man, Weyerhaeuser, gave a sawmill to each one of his boys."
W. J. Gamble,1:33:51,"Charles Weyerhaeuser was supposed to run the Potlatch bill. And Rudolph Weyerhaeuser, the Coital Lane mill. And John Weyerhaeuser, the Coma mill. And Phil Weyerhaeuser, the Lewiston mill. And that was the way it was. But the one at Potlatch, he was on a trip to Europe and died. He didn't last very long at Potlatch, so Rudolph took over."
W. J. Gamble,1:34:18,"And they, as a family, the whole family is built around this sawmill. Every one of their family. Even the girls."
W. J. Gamble,1:34:37,"And it's a party. It's a party. It's kind of a tradition with them, in a way."
W. J. Gamble,1:34:45,I don't know what would happen if one of them would go haywire like some families do. I don't know what position the family would take. It would be a calamity. I know that.
Sam Schrager,1:34:56,"When you say haywire, what do you mean? You think, got rid of the business?"
W. J. Gamble,1:35:00,"Well, you've seen a lot of these people that their father had a lot of money and a lot of business and so forth. And didn't do them very much good."
W. J. Gamble,1:35:23,But what you're saying is that they knew the business and they knew what they were getting.
W. J. Gamble,1:35:30,"Mm -hmm. Mm -hmm. The whole family, the second and third generations, have been just the same. All right down the line."