speaker,words,tags,timestamp
WJG,"When I first came there, I come down there to play baseball and then afterwards got mixed up with the railroad.Jf anybody had told me I was But going to stay there as long as I did I'd a told em they was crazy, the longer I stayed there the better I liked it, the more I got involved with the people and the company the better I likedit, and it just developed into a good place to be.",,
SAM,How did it happen that you became general manager?,,
WJG,"Well, that's easy. I come dovm there to do a certain job, they come up to Spokane to get me and one thing lead to another. I had had a lot of railroad experience, they knew that and a people as i . . .",,
WJG,". . .and the evaluation of  was another thing. The Interstate Commerce Commission come out and revalued all the railroads in the United States. And they had a crew^ . they sent em out and the railroad was supposed to furnish a certain number of men toopnd it took about six months to evaluate our railroad with all the details they wanted. And I got in on that, and finally I took the sunerinte^ent's job. And from then on up I got to planning different things and so they gave me the whole works. If it hadn't a been me, it'd of been somebody else because they had to have somebody.",,
SAM,"Well, you stayed a long enough time to make me convinced that you must have been the man for that job.",,
WJG,"Well,you see when I was in the East I had had so many different kinds of jobs in railroading and for no particular reason I'd get tired of one place and go to aBther. And I'd had experience in the steel mills, and I had experience in iHrrimere. UocaMotnteA, in Philadelphia, and I had been on the Pennsylvania Railroad as a brakeman and a fireman and.on the New York Central in station work and telegraph operating and all that kJLnd stuff, so I had pretty wide experience. I was an operator and maintenance man both. That's the kind of a man you h«ve to have An a short line railroad for this reason: on a big railroad you'll find your heads have developed through certain channels. He might have been a traffic man or he might have been a mechanical man, but once they're in that line they usually stay in that groove. Whereas a short line railroad has to have one person had a lot of these experiences because they can't hire a head for everything. And I kind of lucky in a way that my work fit itno what they needed here.",,
SAM,There's one more thing I'd like to ask you about and that is along the lines of the changing market and going with the economy and some of the ups and downs that the economy has had. How did Potlatch react to what happened there in the repression? What happened in the town. . .?,,
WJG,In the Depression?,,
SAM,"Yeah, the 19. . .",,
WJG,In,,
SAM,Yes.,,
WJG,"Well, we shut down for three years.(Chuckles). And there was no place for the men to go; there was no work. They couldn't go anyplace else to go to work. $nd it was aoompany town and the company realized that they had to do something to take care of these men. And the idea was to keep em busy at something so that they didn't get off on the wrong foot on a lot of stuff. We jobs there that we*d do mechanically that we'd ask the men to do by ^and because it'd take em longer to do it and paid at a certain rate. And as far as their actual needs were concerned;througv our work.we plowed up acres of land so that they could raise their own vegetables and stuff for the winter and all that kind of stuff. And did. We gave every man a quarter of an acre of land and plowed it for him and harrowed it and give em the seed. And all they had to do was raise the stuff and they did. And for homes we forgot the rent and the electrifc light bill and stuff of that kind. After the Depression was over if they wanted to pick it up and pay it^all right. There was a few of em that did, a little self pride, y'know. Most of em didn't. That's all right, that was company. And that was part of my job to see that nobody got hurt. Oh, anybody's sick or anything|Like that, the doctor'd take care of em. We had our own hospital. And if they couldn't pay it, why the doctor wrote it off. The store—we extended credit to some people who were—we knew most of our people there. And they had pretty big bills at the end of three years, but most of em were all paid off. And to heat our homes, well that was eazy. We brought down a trainload of logs and dumped era off and gave bur men, not every man a certain number of saws and axes and they come down and maile their own wood. We all burnt wood in our stoves in those days, y'know. And they made their own wood. Any widow or somebody that was sick, why we mace them, cut wood for them too. It served two things: it kept them busy and we the wood  A group of women came to me one day and says,""Gamble, you've got to quit robbin me of all our clothes (Chuckles).In other words we was pickin up old clothes and re-workin em. But we helped ourselves and it was a good thing for Potlatch. We come out of it in good shape and the men had kept their self-respect and their self-pride, no charity as such.",,
SAM,So the Potlatch. . .,,
WJG,"Well, the company had to do that because it was a company town, y'know. And we had to do something of that kind. We couldn't throw these men out to the wolves. And they realized that, it made^ men. em.",,
SAM,"You know a lot of these towns in the rural county that depended on the WPA for their managing get through. That didn't happen in Potlatch very much, the WPA.",,
WJG,"No, no, no. I did get from the government,flour. We was puttin out flour, we didn't have any flour, but I A3 get flour from the government, yes. And they got material that women could makeK dresses and things like that. And of course that was the start of the milk program for the kids in school We made every kid drink a day. But I was glad to have been in on all that stuff. You make a few enemies. Mostly not, you always to tell somebody no.",,
SAM,Did the company try to be selective about who it would give credit to in the store?,,
WJG,"Yes, they did. They had to to a certain extent because some of them would have gone haywire, you know. Anything like drugs, anything of that kind, that was never refused.",,
SAM,Did most of the men who were in Potlatch stay through the Depression?,,
WJG,Um hum,,
SAM,Do you think they appreciated what the company did?,,
WJG,"Yes, yeah. At first, no, because they'd hear in the paper about all this stuff on the outside, WPA, and all this kind of stuff, somethin for nothing and they had to work for their's. They didn't appreciate that until it was pretty near over with. And one fellah says to me, he says,""I and can look anybody in the eye and tell em to go to hell.""",,
SAM,Could Potlatch ha^e gone after WPA if they wanted to?,,
WJG,"I don't think so, I don't think so. Oh we might have on the highway district, yes, we might have on the highway district. As a matter of fact we did have a little highway district work. But there again it was difficult to get men out very far, y'know, they needed transportation. We had a little hgihn-ay work, that's right, yeah.",,
SAM,And for three solid years you really didn't operate in any manner.,,
WJG,"Only about two and half, two and a half, yeah. Everything was down, absolutely down. Well, it was ro \ht I'll tellyou. No jobs anywhere, nobody was workin. *hat was the second one 1 was through. I was through one",,
SAM,"in 1908 too, just as bad. that's when you were still in Pennsylvania.",,
WJG,Um hum. Oh I had work. I always had odd jobs wven I wanted one. But I was not particular either.,,
SAM,Was there anything the company could do for all the men in the woods? What happened to all. . .,,
WJG,"No, well the lumberjack in those days we usually had three crews: one on the job, one comin, and one goin. That was the lumberjack, he was a traveler. That's right yeah. Had it not been for that I don't know what we would have done in the woods. We were doing nothing in the woods at all. Bovill ""was having a hard time, a lot of lumberjacks around Bovill. No, the lumberjack in the early days was usually a single",,
SAM,"I've never been able to understand although guys who work in the woods have told me about the way the lumberjacks used to work and stay in go and camps, get their stake, blow in and not have anything left afterwards and have to. . .",,
WJG,Christmas and Fourth of July.,,
SAM,"I just still can't figure why the men, everybody, almost all of them did that and couldn't save any money.",,
WJG,"Well, that's the way it was done. They kind of followed ""- precedent, I guess, that was set before.  look back on the time when my father who lived in Pennsyvania, he worked in a sawmill in the summertime, sawmill shut down in the winter. And in the winter he'd go into the woods and work in the woods all winter. In the spring he'd help dra^e Ahtn the logs down the river and.about that time the sawmill was started. was the regular rotation that they followed. was not, I suppose it was density of population to a certain extent that caused those things. There was not the amount of labor available that we have now at all in line of work that I know of. I know that this big outfit in Works, hired men. And I know we never had a surplus of men, always a shortage of men. Come over from Austria, yeah.",,
SAM,Maybe it was as the country was bein built up there just was so much more work to be done.,,
WJG,The whole thing was all different all right. The economy of the country and everything was entirely different. About the only thing a young person would do in a case of that kind if he couldn't get a job he'd join the army and stay in for a year and then come out.,,
SAM,"If you look back on it is there any one time in Potlatch as stands out as being really the best time in the town or the most active, the most going on, the best time?",,
WJG,"Well, of course the best time was when the mill was working two shifts everyday the week. Sure, when everybody was busy that was when times were good.",,
SAM,Was that before the Depression?,,
WJG,"Yes, yeah,before and after both, um hum. But before the Depression we had years of pretty good times. Work that anybody wanted to do, yes. And everything had a fair price, not big prices, no big prices of anything, No big price  where we are now, everything's up, don't mean a thing.",,
SAM,"Don't mean a thing because everything is up, is that what you mean?",,
WJG,"Yeah, we're no better off than we were then.",,
SAM,Do you think that the company town was worth it to Potlatch. . .,,
WJG,"To start with, yes, yeah, um hum. They would not as near as good a town if it had been an open town to start with, no question about that. Every house had water in it; every house had electricity; every house had a\telephone in it, and all that kind of stuff. We had good schools; we had good churches  And that would have had a hard time growing up naturally. And the families were just a lot better off under it those conditions than they would have been if had been an open town, ufe hum. I can see where a company town is not a good thing. Men grow up children grow up in a town like that and have no responsibility to government of any kind. They had to accept everything as is. Now when this town over here was changed to an open town they were lost for a long time and maybe still are to a certain extent. They didn't know how to run their schools, they didn't know how to police their town, they didn't know how to keep up the town. And their sewers and their water and^their police protection, the whole damn thing, and they had a pretty rough period there for a while. Just because people didn't have to do those things, y'know, they didn't kn w how to do it* I think that the time comes when the town should be made akown but t think it should come gradually. I didn't believe in it the way it was done over there, but it had to be done some way. There was a couple other towns in the United States the same way. The town of Pullman, Illinois. Pullman 6ar Company was a company town, ^y the way, Potlatch was kind of patterned after that. We have a town down here at Shasta, right this side of Shasta, it was a company town, a sawmill town. It was a terrible comparison. Rundown houses andoh, the company didn't pay any attention at all. And I can see where a company town can be a big disadvantage if the company were inclined to take advantage of things. It might be the store thqt would be higher prices. Ours was lower prices.  conditions under which people lived, if they didn't pay any attention to that it could serreate to big extent. We even papered the insides of people's houses over there for em when they wanted it done and painted the inside of their houses for them, on the outside too as far as that goes.",,
SAM,"Well, where did this kind of benevolent policy come from? Was this the Wferhaeuser's idea;",,
WJG,"That was the principle of the Weyerhaeuser's, that's right, that was their principle, urn hum. When I went down to Boise as a representative, Mr. Weyerhaeuser came to me, he says,""Gamble, I can't tell you anything what to do or what not to do down at Boise. All I can say is this, ""Whatever is good for the state of Idaho is good for the Potlatch Lumber Company."" I think that spells the atitude of the Weyerhaeiers.",,
SAM,Whic Mr. Weyerhaeuser was this?,,
WJG,"Rudolph, yep. Yeah, they were a great bunch of people. Well, when the original Weyerhaeusers came over here they were just common German people, y'know, that had a fling for mechanics and operated sawmills. And all the boys -were brought up tbu same way. Believe me, they didn't spend money foolishly. Nor did they pile it up for the fun of piling it up.",,
SAM,Did the Weyerhaeusers mntain close contact with the Potlatch and the lumber company here? Were they out here much? Did they have much to do with the mill site?,,
WJG,"Well, sure, they always had their directors' meeting at Potlatch. the directors always come into Potlatch. Well, see to start with, old man Weyerhaeuser gave a sawmill to each one of his boys. Well, Charles Weyerhaeuser was suprosed to run the Potlatch mill Rudolph Weyerhaeuser the Coeur d'Alene mill and John Weyerhaeuser, the Tacoma mill, andPhil Weyerhaeuser the Lewiston mill, and that was the way it was. But the one at Potlatch, he was on a trip to Europe and died. He didn't last very long at Potlatch so Rudolph took over. And they as a family, their whole family is built around this sawmill tving, every one of their family, e-en the girls. It's kind of a tradition with in a way. I don't know what would happen if one of em would go haywire like some families do. I don't know what position the family would take. It'd be a calamity, I know that.",,
SAM,"When you say haywire, what do you mean? If they got out of the business?",,
WJG,"Well, you've seen a lot of these people that their father had a lot of money and done a lot of business and so forth and didn't do em very much good.",,
SAM,But what you're saying is that they knew the business and they knew what they were getting.,,
WJG,"Um hum, um hum, um hum. The whole family, the second and third generations never have been just the same all ' down the line.",,
