speaker,words,tags,timestamp
WJG,"That was the start of unionism. That was the start of the unions ^ ^ ^ coming into the woods. It started with the war. And this was a, fringe organization that was mostly to see they could cause. I think it was  of the war deal to start with. But they got into the woods and they were pretty strong at one time. And we had quite abit of trouble with 'em, yes. They developed into ajLabor organization and of course they didn't last very long as such because they were too .",,
SAM,"When you say part of the war deal, are you thinking of, meaning that they were part of the opposition to World War Ior fighting in the war?",,
WJG,"Um hum, urn hum.",,
SAM,What did they do mostly? I've heard alot of different things about what they may have done or didnjt do. Did they disrupt? Did they. ..?,,
WJG,"They were mostly located in the woods, in the woods operation. And oh they'd drive nM logs and stuff like that, y'know. put And you couldn't find 'em, and^irst thing you know you rip the teeth band off A saw. And things of that kind. They were destructive, no question about it.",,
SAM,Did they ever strike the camps in the woods around here?,,
WJG,"Well, not exactly a strike, but they were infiltrated in ther had to send some of oiir own men in to combat it. Mostly talk, and just little things that I say, drive nails in logs. Thejd induce somebody to think that he was being mistreated, y'know. And anything to get members.",,
SAM,Did they have much influence in Potlatch as compared to what they had in the woods?,,
WJG,"No, no they didn't. No, we had an organization in Potlatch, they were armed, pretty near National Guard.",,
SAM,What did that group,,
WJG,"We organized that in the face of it to train men who were going to be drafted into thearmy* And we had an ex-West Pointer, ^ he got kicked out of the army but he was a good drill master. And we had quite a company there. Oh, I belonged to it. And we'd drill every so many nights a week. But to start with it was started out Is these young fellows that were susceptible to the draft. And by the way, most of those fellows that were drafted were taken into the regular army as corporals They'd had that much military training. And the^ were real proud of that.",,
SAM,Did -ou have standing as a)National Guard unit or. ..?,,
WJG,"No, we'd our own guns,the company bought em and we belonged to the National Rifle Association.",,
SAM,Do you think that that. . .?,,
WJG,"That did have its influence on keepin the IWW'S out of Potlatch. It did, definitely.",,
SAM,And fair number of the members of the group were sawmill workers.,,
WJG,"Oh, yes,yes yes, just the citizens of Potlatch.",,
SAM,When did the Four L begin?,,
WJG,"That was the first real organization that developed. That was to combat the 1WW to start with. There was a man that was with all the lumber companies, nonorganized that thing over at Seattle. And that was to combat the IVW. And of course it developed into alabor organization. And I don't think it's in existence now because it was conceived anc[organized by the lumber companies, yeah.",,
SAM,Did it get. . .?,,
WJG,"It was avery popular organization too,give the men achanne to belong to something so that an organizer couldn't come in and call him a scab. Anokt served its purpose.",,
SAM,Did that become the labor union of the mill in Potlatch at the time?,,
WJG,"Yep, yeah, uh huh. And of course, see Ithink we had astrike, four Lstrike. kind of fizzled but, then that was about the end of the Four L's. And then the national organizations came in after that.",,
SAM,That was the strike in Potlatch. Iknow Ha^oody told me about some early strike when he was kpH,,
WJG,"Hap was sheriff and he over and deputized, Iwas adeputy sheriff, we were all deputized.",,
SAM,Was that part of the Four L strike do you think?,,
WJG,Yeah.,,
SAM,"When Mr. Laird became the general manager, is that about when T. P. Jones became part of the company operation?",,
WJG,"No, Jones came out here with Deary, yeah.",,
SAM,So he'd been around.,,
WJG,He came out with Deary from back around  Falls or some place where he was. . .Yeah.,,
SAM,Since Laird didn't know so much about the woods operation did more of that fall on Jones' shoulders?,,
WJG,"Yeah, uh huh. Yeah, he was woods superintendent. Yeah, he was in charge of the wo£s there wasjio question about that, yeah.",,
SAM,"Well, as far as the way decisions were made on the operation of the railroadjhow did the chain of cummand work? Iassume that as general manager of the railroad you were at  top anc^ad the final say on the basic decisions of the railroad.",,
WJG,"Well, the railroad was an entirely separate corporation from the lumber company. There was no connection between 'em at all. Well, there was a connection in that the lumber company paid for the building of it anSHook stock and bonds for their expenditure becauseythey owned the stock ^nd bonds of the railroad company, the lumber company did. But we had to operate under the rules of the Interstate Commerce Commission, the same as any other railroad. Anfof course that was one of the things that they finally to find out. And the hard way was to get somebody to do somethin' about arailroad. To start with the first year of the operation of the railroad they. ..Oh, there was a bunch of lumbermen, some of the people left over from the construction crew and it was kind of ahaphazard thing. But they soon found that they had to.",,
SAM,You told me before that some guy^got thrown in jail for not knowing what ought to have been done. What were the kind of violations that you could get into if you didn't know the way to do things?,,
WJG,"Well, one illustration.' In the first place we built our staticns and we built grain warehouses at each station, and we run these grain warehouses. Well, we soon found that we should get o^t of the warehouse business. So we leased the warehouses to a man by the name of Mark P. Miller here in Moscow. He run a flour mill here. And he run the grain warehouses. Well, we didn't pay much attention to Mark until one day an Interstate Commerce man come in and says,""You're indicted and Mark Miller's indicted. Well, Mark was shippin'stuff out of Deary and be had stuff in the car that he shouldn't have and didn't declare^ and was gettin it shipped over to Moscow at a cheap rate. Well, of course we didn't know anything about it because carload shipment we never inspect. Am^feo we got over that one all right, but Mark P. Miller got. . .And then we had a superintendent to start with. He wanted to go farmin'ardVe brught a farm up around Harvard. And built ahouse and barns and everything else and the Interstate Commerce inspector came in there one day and says,""What you gonna do about this? The oldjnan's shippin' stuff up there free,H So he was earned.(Chuckles). And those were the things. . .",,
SAM,Conflict of interest.,,
WJG,"Urn hum. Of course I think perhaps in the early days , the first couple there was a lot of that stuff done. It's our railroad we can do what we wanta with it. But they soon found out they couldn't do that with the railroad.",,
SAM,"Well, what was the personnel structure of the WIM when you were the the general maflger? What was the chain of command within the railroad?",,
WJG,"Well, I had a master mechanic who took care of the mechanical work. I had a dispatcher who took care of the operation of the trainf And I had a road master who looked after the maintenance of the and the telephone company. And we owned the telephone company in railroad Potlatch, the owned that and also owned a line from Bovill to palouse. So I had to have a combination man who knew somethin' about telephones.",,
SAM,What about the various depot agents? Were they directly under you or was there someone else in charge of them?,,
WJG,"Well, the auditor took care of the depot agents. They come under the supervision of the auditor. And we had an auditor, I'd forgotten about him. Necessary evil. (Chuckles). No, I shouldn't have said that.",,
SAM,"Well, you've gotta Have physical management.",,
WJG,"So I had my work pretty well distributed and all I had to do after I got it organized was supervise it. I'd had a lot of experience before I came here, of course.",,
SAM,"We went into that last time. And you know the size of the trains i$ something I was wondering about. I saw one picture labeled ""Longest Log Train in the World.n What was the story on that particular train?",,
WJG,"Oh, they just made that up for somethin to talk about.",,
SAM,That wasn't a usual train.,,
WJG,"No, no. And t^ere was a lot of that stuff shouldn't has been done of course. When I was was operating, our trains would consist of about sixty cars. That was option a good operation. So you talk about cars—that was just a build-up.",,
SAM,Promotion.,,
WJG,Urn hum.,,
WJG,"We had one of the better tyoes of short line railroads. There was somethin like over three hundred and fifty short line railroads in the country. Most of era were connection with some big industry, y'know, like this connection with the lumber comrany. And others were connections with the steel companies and oil companies and what have you. And just a lot of em, three hundred and fifty of em, they have quite an organization, American Short Line Railroad Association,Had a president in Washington, had a Washington office. I was vice president of the organization for some little time, and it's quite an institution. One short line railroad don't have very much to say when you're talkin to these big lines. But three hundred and fifty of em with papas and mamas like lumber companies snd steel companies have quite a bit to say from a political standpoint. And it was a very good organization, well founded and not radical. And well, we h;d to help our less fortunate short lines. Once in a while we had to send a man here and there  straightened out about something, y'know and things of that kind, 'cause a lot of them didn't seem, to a fellah know what to do and how to operate. Matter of fact I had a letter from I back in Wisconsin the other day. The Libbey Glass Company, one of the biggest outfits in the United States owns a short line railroad oack there. This fellah sent me a little folder that they got out and about their railroad. It's very interesting.",,
SAM,"You talked to me a little about being in the legislature representing the, what was it? The North Idaho Lumber. . .?",,
WJG,North Idaho Forestry Association. I worked for them.,,
SAM,"One thing that you $ked about that happened before then was the creation of the forestry law for the state of Idaho, the writing of that law.",,
WJG,"Well, there was no connection between those things.",,
SAM,"Yeah, that's right. I was wondering about. . .",,
WJG,"This North Idaho Forestry Association was set up as kind of a fact finding organization for all the lumber complies of North Idaho. And tey would meet ever3/ so often and express their opinions about maybe legislation or taxation or things of that kind. It had nothing was do with operation of lumber companies. But the nice thing about it as far has politics and taxes were concerned, there was no dissent. When I would po to Bcise I was talkin for all of em and nobody would be tellin me, well, I don't believe in this, and some, I believe in somethin else. They were all in accord; it was easy to work for a that kind. So they ironed out their difficulties in their office before it was handed to me.",,
SAM,"Well, while you were representint them what was the general nature of the interests that, the kinds of legislation that they would favor or the kind that they would be opposed to?",,
WJG,"well, the taxes. Lumber taxes and sawmill taxes are pretty terrific. And we'd meet three times a year. I had to go to Boise at least three times a year to meet with the Asessors Assoefeation, if you please., the Assessors Association, they had a lot to say about how some of this stuff should be taxed, and met with them. I went down every August to the Tax Board of Equalization meeting at which time you can express yourself as to what your taxes are be and to compare them with something else and all that kind of thing. So there was a lot dn the tax interest and as far as legislation was concerned, I was down there, I had two lawyers with me—well, one all the time, the other only part time. One was a labor lawyer, but he was only there part time. The other was a general consul, Coeur d'Alene. He kept me advised on the legality of things. And my job was to see that no adverse legislation was put through that would harm the lumber interest. And once in a while we had something we wanted to promote too. And no, it's a form of lobbying all right-t there's no question about that. I never asked a legilator to vote or not to vote for anything that I had thought of. You can't control legislation that way. I set up offices down there and more of the information bureau than athing else. And it takes a while to gain their confidence but once £ou do that they come to you and ask you how a bill will affect the lumber companies. And most of the legislators don't want to do anything affect industry in the state,y'know. *nd if they trust somebody they'll come to thera for their information because they don't have time to get it themselves. They don't have time to read all these bills that are put through.",,
SAM,So you had to keep abreast of the legislation.,,
WJG,"Oh yes, yes, yes, yes, yes.",,
SAM,You probably had to research it yourself in some cases.,,
WJG,"Um hum. So on the whole we had a pretty good set-up. At least I was never criticized. (Chuckles). But the fellah thafollowed took my pkace when Iquit, he got half-way through the session and they called him before the state senate and told him to get the hell out of town. (Chuckles). Well, the poor kid, he was just overpowered with his authority, y'know. Went to his head.",,
SAM,Were there intWts in the state that ran in conflict with the lumber company interests as far as let's say promoting the legRation that you. .,,
WJG,"Well, yes there were. There were the, oh you take the mines and the railroads and the telephone companies, power companies. We all have certain things in common like say, safety rules and woman's compensation and all these social security things. They all affect all of us the same way. So we had what was calledthe self-insurers, that's the, we owned our own ;and our doctors and stuff like that. And the state law says that we have to protect our men. So we self-insurers because  worked through that organization for legislation along that line. No, we didn't work at anything that would be competitive with somebody else or anything like that, no we just.",,
SAM,Could you give me an example of the kino of legislation that you had to oppose because it would have hurt the lumbering industry in the state?,,
WJG,"Yeah, mre. This comes to mind and this is a kind of a funny one too. I was op -jesing a bill that the drug people had introduced into the Idaho legislature, oh like the selling of aspirin in drugstores and stuff like that, y'know.And all those minor things, they wanted to be a little more strict, couldn't sell em in drugstores or grocery stores. And they had quite a bill and I started out fighting it. And I got a call one night, about after midnight some night at my door. ""Gamble?"" ""Yes."" ""Well, I'm so-and-so from Seattle."" And I said,you."" Well, he says, ""I represent the drug company. I'd like to talk to you."" So I got up and let him in. He says,""What in the hell is the lumber companies apposing our drug bill for?"" Well, I says,""I'11 tell you. You know, we run camps out in the woods, maybe two hundred and fifty men in a camp. And we have to keep a certain supply of different things in that camp: heavy clothing, and tobacco and among other things, aspirin and drugs of certain kinds that we dare handle. Cough drops and things of that kind, we have to have that in our supplies at these camps. Your bill would prohibit that. "" And he says,""Who in the hell would have ever thought of that?"" And. that's an illustration of one thing. Another is a different angle. A good many years ago we had an infestation of tussock moth. We've got another one now in the woods. And it was something new in this country and it got away from us, and we lost a lot of timber. It died overnight. So a man from the federal government here and he says,""We've got sprays. We have a spray that will kill that. And they got the airplanes and they sprayed the whole damn woods or everybody's going to lose their trees: national government, the state government, the lumber companies, individuals—everybody. It's got to be done and done fast."" All right, we got the lumber companies to agree and we got the state to agree and the federal government to agree. That had to go through Washington, and all takes time. And we had to rush a bill through the legislature authorizing the state of Idaho to come in on some basis and spray those trees. And we har1 to put a bill up that way. That is the only bill that I actually came out flat footed and asked legislators to vote for. And I had a rc-eting of the legislators and I had the biologist from Coeur d'Alene come down there and give em a talk. I fed'em. a party out of it. And that had to be done that way and done fast. Now that was one of things that we were for and we handled in that way. It was ratver a r-rude way but you couldn't handle everything that way.",,
SAM,Do you remember about when that was?,,
WJG,"Iforget what year that was, Really do TheY come out the other dav in the paper, they supposed to have sprayed last fall and it said then when the other. . .1 don't remember, I don't know what year that was. That's been quite a while ago. such",,
SAM,"Well, that was vital piece of. . .",,
WJG,That's been thirty years ago.,,
SAM,You had to have that piece of legislation.,,
WJG,"Oh yes, yeah. That's something we were for a^ere fighting for and we come out flat footed on it.",,
SAM,"there ever any environmentalist, environmental group opposition in the early days to, not like there is now to any kind of development?",,
WJG,No.,,
SAM,I was wondering about the maintenance of the railroad and about the kinds of adversities that you had to put up with. One that strikes me that must have caused problems sometimes were the mudslides and the track washing out and the. . .,,
WJG,"Well, that's just keeping up the railroad, that's all. (Chuckles). Bridge* have to be rebuilt and sure, I reballasted the whole railroad while I was there.",,
SAM,Reballasted?,,
WJG,"Yes. Yeah, I brought in a contractor from Spokane and crushed rock for a year. And give the track a lift of so many inches and put new ballast under it. When it was built they tried to—which was all right, I guess— get their rock for ballast as close as possible. Well, the closest they got was darn poor rock. It was asilica rock and didn't hold up at all. The first thing you know we was having trouble; we didn't have enough ballast under our rails if we wanted to operate fast and heavy trains. So we had to reballast. So I reballasted the wvole thing and rebuilt all the bridges,twenty-one them. That has to be done every, everything is built of wood; it only lasts so long. And it was just part of the whole, that's all.",,
SAM,When  reballasted where did the rock come from that time?,,
WJG,"Right this side of Bovill. We got a basalt rock up there, Ahis stuff they got here now up at Yale that's—oh, gets it wet and pounding it the ties that kind of a soupy,-like stuff. Same way with a big fill that we had I went down into Falouse one day and a section foreman called me up and said,""No trains today. ""Fill bridge number so-and-so slid out."" Well, what had happened before I was in charge we had a roadmaster, he was a civil engineer too. And he decided that some of the bridges could, be filled cheaper than renewed. Andhe talked tie boss into it, and he filled em. There again Jnis fill material as close as he could get it, y'know, and make it cheap. And he come into this silica again. Gee, it was slippery as can be when it's wet. Well, you in some of the conrete in Moscow here. (Chuckles). And this was a bridge that was eighty feet high and five hundred feet long. He filledkt, and what had happen left the piling in the trestle and he filled it with dirt, and he put ballast on top of it, and he had a filled bridge. Fine, it looked good. Had a concrete culvert under it. Over the years as the snow fell and the rains came down to  the top of this thing in the ballast, y now, the ballast had let it through, let the . And this darn floor would hold that, water like a pail, if you please, got clay. And it got to the point where it became saturated clear down to the base and the top weight was too heavy for it, what happened? Just went out like that. The whole damn works.Well, what to do, ye gods. Wthe sawmill keep and the woods department keep going so we put in a steam shovel and some dump cars and started filling with rock. It took us two weeks to do it, but we did it and the mill kept going. We didn't have to shut it down because we had enough logs. Bat those were some of the things that happened.",,
SAM,That sounds like a real crisis situation to me.,,
WJG,"Oh it was, it was. It was something that hadn't happened around this country before, and we had a lot of railroad men from other railroads come in md take a look at the see what was happening. And it was quite a problem and they was taking it home to their own railroads because they had do ^ethe same thing. But it won't slip now, I know that.",,
SAM,(Chuckles). What was your attitude as the general manager toward the people that worked for } ou? What you expected from them and. . .?,,
WJG,"I never asked a man to anything I couldn't do myself, I wouldn't do myself. I resolved I'd never criticisejja man in front of other men. I had a crew of men that most of em never worked for anybody else in their life. Talked to a man out here at alfuneral the other day says,"" We look back to the time we worked for you we're glad of it."" I know how to treat men and wvat to expect of em. And I treat em fair. I never had any trouble. I like to make my own .",,
SAM,What do you mean by that?,,
WJG,"Well, I've taken kids that couldn't work for anybody else and made damn goad railroad men out of em.",,
SAM,How does that work? Do you give em responsibility or. . .?,,
WJG,"No, I treat em right. Yes, I give them responsibility as they're capable of accepting it, sure But I'm not a person to go out and go downtown and see signs in the window, I want an experienced clerk. Most of the time you have to re-train them the way you want things done, even with college students.",,
SAM,Doesn't surprise me.,,
WJG,(Ouckles).,,
SAM,What you learn in books isn't somethin you can take with you and apply a lot of the time.,,
WJG,"Yeah, yeah.",,
SAM,But did you expect your men like BilliDeary.not to come to you and take care of themselves?,,
WJG,"If they, wanted advice, yes,sure,sure, know the big thing in being a supervisor of men is the job yourself. Men recognize that in a supervisor. If you don't know your job, why some of the men on the job will be the first ones to find it out. Ind I never hesitated about taking advice from the men regardless of how lowly he was on the echelon, no.I learned somethin everyday from somebody, you bet. the, town",,
SAM,"Do vou remember what Potlatch was like.when you first came there, what it looked like to you,what the activity was like, what the feel of the place was? You told me before when we talked that you didn't expect to stay there very long, but I'm wondering what your impressions of the town were in 1910?",,
WJG,"Well, it was petty new then. There wasn't very much entertainment. There were no automobiles and no good roads. We had to make our own entertainment, and we did. In the summertime we had four basecall teams in Potlatch. They were good ones too. People took an interest in it. We conducted dances. We had an amusement hall. Oh, we had people come in and speak once in awvile, like oh, political talks, in a lot of times. An- the hall would be crowded, come up to hear Bill talk, politics or otherwise. nd it was abig dance hall to accomodate alot of people. And we divided the town up into departments, oh say, like the railroad and the store and the sawmill and the lumberyard and the planing mill. (Chuckles). And each one of em was responsible for a dance once a week. Every Saturday night we had a dance, big dance. And each group would have to be responsible for decorating the Kail and furnishing and getting the music and all that kind of stuf Those were the things we had to do ourself in order to keep the people entertained, and it was very successful. That developed through baseball or anything an activity of thirties. Wc had an old We quit ridin horses and we turned that into a gymnasium. We hired an instructor, if you please. We had a little basketball team there and we had gymnastics and boxing and all that kind of stuff. Then finally the company built this great big gymnasium,, , one of the finest in the country, and we had an instructor there. Well, we held the Idaho State Tennis Championship there one year and had tennis courts. There were an awful lot of athletic activities. We had inside gymnastics, indoor baseball, all that kind of stuff. And we did that to keep the people happy and busy. And I think they were happy. I don't know if they would be now or not. Of course a big change in those things. Wasn't very many automobiles in 1910.(Chuckles).",,
SAM,Did Potlatch have a pretty stable feeling to it as a town when you fist came there or did it seem like there was a lot of turnover of people coming and going?,,
