speaker,words,tags,timestamp
SS,farmers were real careful about saving and trying to get ahead?,,
GG,"You bet your life they were. They had to be. They didn't, as a rule,",,
GG,"have very big savings. They didn't have very much money in the bank,",,
GG,but they did try to know that there's going to be plenty of food and,,
GG,everything that they need to live has got to be there where they can put,,
GG,their finger on it as they need it. It was a must! And they did it.,,
GG,"Garden, stock, milk, cream, butter, eggs, chickens, flour all came in",,
GG,in the scheme of things and were planned from year to year and worked,,
GG,out as a schedule. They had to.,,
SS,"What about the kids, like you, start working out? Did you get to keep",,
SS,"the money that you made when you worked out, or did it go to the family?",,
GG,They never asked me to give 'em a dime butif they needed anything; it,,
GG,"there was some bill coming up that was going to be hard to pay, why, mon",,
GG,"ey didn't mean anything to us: ""Here Dad."" We all did that. Everybody",,
GG,"did. We'd buy our own clothes, the first thing. All our school clothes,",,
GG,all the clothes we'd need for the whole school year. And after that if,,
GG,"we had a dollar or two a week, that's all we needed. A dollar a week was",,
GG,"plenty. It was not uncommon for the boys to help Dad, all over the neighborhood,",,
GG,"place. Well, they were part of the machine just",,
GG,the same as any other member of the family. They considered themselves,,
GG,that way and the rest of the family considered it that way. Frugal. There,,
GG,"was no trying to splurge or put on a big front, you just put on the front",,
GG,that you had. All through that farming country there or here or anyplace,,
GG,"else, everybody was on the same plane, there was no distinction.",,
SS,What do you mean? Everybody was more or less in about the same well off?,,
SS,"Or even if people weren't the same, it didn't matter?",,
GG,"Well, there was a difference in the length of time that they'd been op",,
GG,"erating or how much success they'd had, there would have to be that.",,
GG,"But success didn't matter, they were all farmers, they were all neighbors",,
GG,and they were all grangers and they all went to the dance— there were,,
GG,no lines drawn between 'em. There were no rich farmers or poor ones.,,
GG,They were all the same.,,
SS,Do you think there was competition among the farmers? Or was it all just,,
SS,"strictly cooperative? I mean, were they competing with each other in",,
SS,fact at all?,,
GG,No. No.,,
SS,Nothing had to be done at the cost of the other guy?,,
GG,"No. Because your line fence, on both sides of your house was where your",,
GG,"jurisdiction stopped, what you should do. And your neighbor was the same",,
GG,"way. He could do just as he pleased, make any effort he wanted to and",,
GG,"the whole neighborhood'd help him if he needed it. No, there wasn't no",,
GG,"competition. No, not in that way.",,
SS,Was there competition ? I imagine everybody'd want to get ahead as,,
SS,"much as he could, I mean, get as well off as he could. But that wasn't",,
SS,a matter of competing.,,
GG,"No, there no competition. No. It was up to you to pull your self.",,
GG,Nobody tried to discourage you or hold you back. They were a darned sight,,
GG,"more apt to go and help you. No, there was no competition between the",,
GG,"farmers, because they sold their produce on the common market, to the",,
GG,"stockyards and the warehouses. No, there was nothing to compete for.",,
GG,"No. A man knew better than to make it at the expense of another person,",,
GG,because he had to live in that neighborhood and he knew what the neigh,,
GG,borhood's opinion was gonna be if he didn't behave himself.,,
GG,"fc$: I think probably the basic thing that they had was the land, gave 'em a",,
GG,degree of security. And they didn't feel that they had to cheat or lie,,
GG,or steal because they simply had the security of their own property.,,
GG,And that gave them a certain dignity.,,
GG,"No, if a man would lie or steal for the first sixty years of my life,",,
GG,"by golly, he was just automatically kind of put down. He was kind of",,
GG,ostracized against a little bit. He didn't have the confidence of the,,
GG,"whole neighborhood, that's what I mean. But they didn't— they wouldn't",,
GG,"lie to you. Dammit, a man's word was his bond, and that's all the bond",,
GG,he had.,,
SS,Ithink it must have than today.,,
GG,"Well, I'm sure of it. If a man's crooked, the whole neighborhood knew",,
GG,it and treated him as such. And sometimes it would go to the whole ex,,
GG,tent where it was the whole county. If your word was no good people knew,,
GG,that they didn't have much in that man to invest in Confidence was the,,
GG,"only thing that you had to deal on. Good, reliable, stable confidence",,
GG,was the biggest thing you could have.,,
SS,Do you think it's changed a lot?,,
GG,Sure has.,,
SS,"What would be the reason, would it be because they're not the same in",,
SS,the community any more?,,
GG,"Well, the community life has changed and the political aspect has changed.",,
GG,"The whole thing, I think, has changed from the bottom to the top; from",,
GG,one end of this nation to the other. Systems have changed. Some ways,,
GG,they're better and some ways I can't say that they are better.,,
SS,Do you think there was more democracy?,,
GG,"Oh, yeah, there certainly was. You know we reached the peak of something",,
GG,at the beginning of World War II and we went over that peak and I kind a,,
GG,"think that democracy, morals, honesty and integrity have all depreciat",,
GG,ed from that point down. That might just be my crazy idea but I think it.,,
SS,Do you have an idea why?,,
GG,"No. No, I can't pinpoint it. No.",,
SS,"What's funny about it to me is that in the early days, I think, people",,
SS,"tried to get— advance themselves and profit was important, you know",,
SS,"making something out of your work. But now, profit seems more important",,
SS,than it used to. Material things seem even more important than they used,,
SS,to to people. And it's funny about it because everybody's much better,,
SS,"off, too, than they used to be. There seems to be almost more devotion",,
SS,"to those material things, than there used to be.",,
GG,"Well, I think there is in a way. I don't know just how to get out a",,
GG,"comparison there, but, you know, when we were young— if we made three",,
GG,dollars a day we were making good money. And we had all the thing that,,
GG,"we needed. And now, if you're not making thirty dollars a day, you",,
GG,don't have all the things you need or want. Now there's a difference,,
GG,"there, too. There's a hell of a lot of difference between need and want.",,
GG,"Now there's two kinds of wants, too. Wanting something that's necessary",,
GG,"and wanting— well, pick off the top of the rainbow. (Chuckles) It's",,
GG,"a basic one, I mean. You know until 1930 a new family'd move into the",,
GG,"neighborhood and the neighbors'd watch 'em, closely. And if they thought",,
GG,they needed help— I've known 'em to just make the great big neighborhood,,
GG,party up at those people's places and everybody'd take 'em a present.,,
GG,"Maybe a sack of flour, or maybe a sack of spuds, or maybe a ham, or a",,
GG,"strip of bacon or a quilt the old lady'd made. And, God, I can just tell",,
GG,you all kinds of parties that they had of that kind. If a house burned,,
GG,"down, inside of a week they had a new one. And the carpentry didn't cost",,
GG,"'em a penny!! (Chuckles) One time there at Harvard, Elmer Roberts ' house",,
GG,"burned down, I don't know who owns it now.",,
GG,It used to be Chase then Roberts and then But,,
GG,that house burned down and they took up a collection to buy windows and,,
GG,nails and hinges. A neighborhood collection and they sent somebody to,,
GG,Potlatch to get that the next day. They sent everybody that could spare,,
GG,a dollar or two or had a few logs— they'd go out and cut these logs—,,
GG,"and everybody's pitch in. They had a team, maybe that could only haul",,
GG,"three or four logs, or maybe.haul seven or eight, but they took 'em to",,
GG,the mill and the miller didn't charge 'em a cent to saw that up into,,
GG,lumber. And as soon as it was sawed into lumber the farmers were right,,
GG,there to it back. And from the tree to that house that Robert's,,
GG,house is still standing up there and that lumber wasn't any of it a,,
GG,"week old, and it was lived in. (Chuckles) They just fixed him up good!",,
GG,"And it wasn't only there, it was up at Ray Smith's,Aover at Matt Barrigers.",,
SS,Did the men come and build the house up for 'em?,,
GG,"They not only built the house, they logged the logs and sawed them in",,
GG,"to lumber and furnished the hinges, nails and window glass. And it didn't",,
GG,"cost anybody only a dollar or two, and a day or two's work.",,
SS,And the family didn't feel like it was charity?,,
GG,"It wasn't!! It wasn't, it was an obligation.",,
SS,Do you think that the community people thought about did democracy,,
SS,have any particular meaning to people in those days?,,
GG,Naw. Did it?,,
AG,"Yes, more than it does now. I think people were more patriotic.",,
GG,"Well, that's true. How many times do you see a Fourth of July party now?",,
AG,"We used to always have one. I've heard about it, but I've never been to one.",,
AG,Or have a Fourth of July p-: ionic—,,
GG,"Well, I misinterpreted that different than you did. Democracy, to me,",,
GG,is a level of living and thought. It wasn't going to a celebration or,,
GG,having a big time. But if they did go to a celebration or party; democ,,
GG,"racy, yes, they were all one level.",,
SS,"Well, I meant living in thought to what you say, because it seems to me",,
SS,that it was very democratic in that way. If everybody was important—,,
SS,"If each person mattered— if a family mattered that much, it sounds",,
SS,pretty democratic. Maybe they didn't talk about democracy the way peo,,
SS,ple do today. But maybe it meant more.,,
GG,"It meant more, but it never was mentioned in that way. Oh, I don't know,",,
GG,"(sigh) Democratic, yes. People were democratic one hundred percent.",,
Hfi,I think people think more about it now because they're  to the,,
Hfi,government more.,,
AG,"Well, I think after Watergate people thought about it more, because they",,
AG,"were so jolted by what could have been done there, or what they could",,
AG,"have done without our knowing it, and did do without our knowing it, that",,
AG,I think it scared 'em.,,
AG,"When the people saw how bizzare Watergate is, the people involved in it",,
AG,"it shocked 'em, how close we came to having a dictator. Somebody up there",,
AG,where I work said that he thought that if Nixon hadn't been kicked out,,
AG,"or impeached, gotten out of the White House, that he would have been",,
AG,tor And that's really not too far off. We haven't had an elected,,
AG,one since and who knows if we will again. If Ford gets back in there—,,
SS,I wanted to ask you about that family that was different because the,,
SS,Mother was very odd. You know you were telling me something about that,,
SS,family? Remember that the people in it didn't have anything to do with,,
SS,the other folks. I forget the name.,,
GG,"Oh, Shallops?",,
SS,Yeah. What was the deal on them? They really were sort of cut off from,,
SS,the rest of the community because they kept so much to themselves?,,
GG,"Well, they just isolated themselves. I think they felt that they were—",,
GG,how would you say it? They felt that because she was radically insane,,
GG,"that it kind of put a stigma on 'em, or something. But, anyway, they",,
GG,"never— one girl married— no two girls married but the boys, none of",,
GG,'em did. And they just got their cabin back there and lived there.,,
GG,They tended to their own business strictly. If somebody needed help—,,
GG,my dad used to send me over there numerous times and want Bill or,,
GG,"Charlie or some of 'em to come over and help him a day or two, come wil",,
GG,lingly. But there was this much that they would do— they brought their,,
GG,"own lunch, they didn't go to the house, they didn't go in the house and",,
GG,"when quitting time come they just took off over the hill, and that was",,
GG,"all there was to it. But, actually, they were darn good people. Real",,
GG,good. Honest as the day is long.,,
AG,"You know, I never heard the end of it from your mother of those people.",,
AG,They were supposed to look into windows and they were supposed to do this,,
AG,and do that.,,
GG,Never.,,
AG,"I lived there from, what?— '34 to almost 1940 and I never saw a thing",,
AG,of them or never heard a thing and they never bothered in any way.,,
GG,"Never, in any way. Never.",,
AG,If they were bothering her it was because they—,,
GG,They never bothered her.,,
AG,"I know they didn't, but she thought they did. I don't know.",,
GG,No. They tended to their own business.,,
SS,They sound so shy though. The men in the family that they just didn't,,
SS,socialize.,,
AG,"Maybe at some time or other they did try, and maybe they thought people",,
AG,were looking at 'em.,,
GG,I Kwas all in their own mind. I don't think the neighborhood ever looked,,
GG,down on 'em.,,
AG,Somebody was telling after we moved away from there that they brought 'em,,
AG,"out to a nursing home or something, that they got along with them fine",,
AG,and they didn't see any reason for being worried about 'em or anything,,
AG,"else, and neither did we.",,
GG,"Well, they did land each one of 'em— John, Charlie and Bill, landed",,
GG,"in the hospital at different times, just once. John never shaved, and",,
GG,"he never trimmed his beard. He was shaggy. Well, he landed in the hos",,
GG,"pital up here, sick. And the nurses took him over, you know. And they",,
GG,lionized him. When they left him out of there he had the neatest Van,,
GG,"dyke you ever seen, and they had him all dressed up in a real nice suit;",,
GG,"all clean clothes, and John come out of there strutting just the same",,
GG,as anybody else would. (Chuckles) He went back home but he only lasted,,
GG,"two or three months and he passed away. Bill always wore a mustou che,",,
GG,"he always kept it neatly trimmed, and Charlie was always smooth shaven.",,
GG,And Ed kind of— sometimes he'd have a beard and sometimes he was smooth,,
GG,"shaven, and then the next time maybe he'd have a mustflt che. He just kinda",,
GG,"kidded himself along with it. They were good workers, all of 'em. They",,
GG,made a living trapping.,,
AG,"Well, they're quite a bit like I am, back there in the woods and didn't",,
AG,see any reason to get out. (Chuckles),,
SS,"Well, somebody said that if you did get to talking with one of the fel",,
SS,"lows that he really wanted to talk, that he had quite a bit to say.",,
SS,Do you remember that?,,
GG,That's right. Yes. Sociable.,,
AG,We used to send the papers up there.,,
GG,"Oh, they loved to get newspapers or magazines.",,
AG,Didn't get very many ourselves.,,
SS,But the mother lived there for many years and the kids took care of her?,,
GG,"Oh, yes. Yes, they took very good care of her. Yeah, they did alright.",,
GG,"Wonderful job. Now, they just slap 'em in an asylum and that's the end",,
GG,the end of it!!,,
SS,In those days that was fairly common that if a person was crazy that,,
SS,they just and/go live with the family.,,
GG,"Yeah. They took care of their own, they didn't ask help, unless— One",,
GG,"case up there where the fellow was— well, he was dangerous. He'd hit",,
GG,"anybody or anything like that, he was dangerous. Well, he went right",,
GG,"now!! To Orofino and he stayed there, or three or four months. Oh, he",,
GG,"died in three or four months. I think it was some kind of a brain tumor,",,
GG,possibly. But anyway he was dangerous. But they had to take him some,,
GG,"place, they had to do something with him. So that's what they did. But,",,
GG,"as a rule,.just rode it out with 'em; took care of 'em.",,
SS,I was going to ask you about the story of that fellow that disappeared.,,
SS,Was that Harris?,,
GG,"Yes, uh-huh. Well, he just disappeared. The family didn't know, nobody",,
GG,"knew. He just walked out. And the whole county turned out in force,",,
GG,I'll bet you there was seven or eight hundred people walked every inch,,
GG,"of that country back in there for days, and they couldn't find a trace",,
GG,"of him. We were up to Harrison and she ran into his sister, years and",,
GG,"years later, and he had been home— he'd been in touch with 'em, but it",,
GG,had only been the last year or two that he got in touch with his family.,,
GG,And then he passed away and that was the end of that.,,
AG,He must have thought he was about ready to—,,
SS,He must have thought he was about ready to die?,,
AG,"I didn't think so, I don't know. He just figured, I guess, that every",,
AG,body had forgotten or forgiven him or something. I don't know.,,
GG,"Oh, he was heavy in debt, I think.",,
AG,You way back when?,,
GG,Yeah.,,
GG,Don't you think that was ?,,
AG,"yes, he was. His family tried to buy all the land in the country, up",,
AG,"around that Gold Hill, and they just got in over their heads and couldn't",,
AG,"pay it. It must have been '23. Oh, about '21, '22 they had real high",,
AG,"prices on wheat, and then it went down and they had, not a depression,",,
AG,"a recession, I ' you'd call it, and he was about to lose his place",,
AG,and so I guess he thought there wasn't any use; he got out. Hit the old,,
AG,"folks kind of hard, because they lost their place and lost him and ev",,
AG,"erything all at once. They didn't have any idea, of course, what he had",,
AG,"done, they thought he died.",,
SS,"Oh, he was working with his family?",,
AG,"Yeah, uh-huh. Yeah, there was two boys— his next younger brother and",,
AG,"of his folksall working— instead of renting very much, why, they bought;",,
AG,"and they bought and bought. I was going to school with the two girls,",,
AG,we were in the same class. And someone got talking about how much land,,
AG,"b00$h+ they got and they started adding up, ""We got this place andthis place",,
AG,"and that, and even after that they bought more. They contracted for seven",,
AG,"or eight hundred acres,something like that, I don't know how much,",,
AG,"but around that. A lot, anyway, even for this country.",,
AG,Was he supposed to have gone off on a hunt or something in the hills?,,
AG,Was that the idea?,,
AG,"They were quite religious, I don't know what denomination or anything",,
AG,"like that, but they were quite religious, the whole bunch of the kids.",,
AG,"Well, he didn't go to church that day, but took off for a walk, I don't",,
AG,"know whether he had a dog along or not. Anyway, he started walking and",,
AG,"got on the train, I guess , around between Garfield and",,
GG,Uh-huh. Belmont.,,
GG,"And somebody saw him, but they didn't know for sure that they saw him,",,
GG,"they thought it was him, but they weren't sure. Until he",,
GG,"showed up again, why nobody knew— his sister said he'd been in almost",,
GG,"every state in the union, on the continent here, I don't know whether",,
GG,"he went to Alaska or not or Hawaii,",,
GG,"Well, they must have been pretty sure he was lost and not run away if",,
GG,they started a big search for him.,,
GG,"They certainly did search. No, they were positive that something had",,
GG,"happened to him; that he had got lost back in the woods, got hurt— No",,
GG,there was nobody ever dreamed that he just walked out.,,
GG,They had little mining holes and they thought maybe he had stumbled in,,
GG,"to one of those and just, you know, and nobne could see him.",,
SS,How long did they search for him?,,
GG,"By golly, it went on alternately, off and on, for a whole year. But",,
GG,this realbig search went on for a week or ten days. People in there by,,
GG,the hundreds.,,
AG,It was just before harvest?,,
GG,It was in harvest.,,
GG,"Anyway, they had quite a number of crews together that the whole crew",,
GG,went.,,
GG,We shut down our machine and the whole crew went.,,
GG,Wonder if he had amnesia or something?,,
GG,No.,,
GG,He told the family; he just wanted to get away from there and he went!,,
GG,"Well, he could see a darn dark time acoming. He was gonna lose everything",,
GG,he had and he just didn't have the guts to take it.,,
GG,Was he planning to get married at that time?,,
GG,Yeah.,,
SS,"He walked out on her, too?",,
GG,Uh-huh.,,
AG,I don t know whether he had 4 of knowing what happened back hereor,,
AG,"back there in Potlatch, but he sure never let anybody know until , oh,",,
AG,"it must have been twenty years or more— it must have been more than that,",,
GG,Yeah.,,
AG,"It happened in, let's see, '22 or '23, somewhere along in there.",,
AG,And he never got in touch with his folks until in the last five years,,
AG,or such a matter.,,
AG,"He knew w here they'd been buried. Anyway, I guess they went back to",,
AG,"Oregon. They had come from, oh, there's a/town named after the family,",,
AG,"Harrisburg— whether the old fokks were buried there or around Roseburg,",,
AG,"I don't know which it is, but anyway, he went back and looked up the",,
AG,"graves, and while he was there some of the family was there too and he",,
AG,asked and they knew who he was then .,,
SS,He actually spoke to the family members to find out?,,
AG,I guess so. Either a family member or somebody that knew the family.,,
SS,"So it sounds like it was, maybe, a matter of them finding out than him",,
SS,telling them?,,
AG,"Well, it might have been. But I kind of took it that he was ready to show",,
AG,up.,,
SS,Did you know the girl he was engaged to?,,
GG,"Oh, yeah.",,
AG,Yeah. I sat right behind her in school,,
SS,Do you remember how she felt after he was lost?,,
AG,"Well, no. I wasn't anywhere— She was teaching, I think. I think she",,
AG,was teaching.,,
GG,She'd taught a year or two.,,
AG,Where was she teaching at that time?,,
GG,"I don't remember, but it was around the neighborhood.",,
AG,She taught up there at—,,
SS,Cedar Creek?,,
AG,No.,,
GG,Timber Flat?,,
AG,No.,,
GG,Princeton?,,
AG,No. Up there by Johnson's.,,
GG,"Oh, That's right.",,
AG,That's where she started to teach.,,
GG,That's right.,,
AG,I didn't see her after.,,
SS,So you didn't know what effect that had on her?,,
AG,"Oh, I imagine it was quite a shock because they were intending to get",,
AG,"married, I'm sure of that.",,
SS,"Did you know how the family felt about this guy, all these years later",,
SS,"when he showed up? Did they say they were glad to see him, or wished",,
SS,they'd never heard about him!!,,
GG,"Oh, they were glad to see him.",,
AG,"I don't know, I -f really how she felt when I talked to her.",,
AG,"Part of the family had died, and of course the old folks had died,",,
AG,"sisters had died, two of 'em, I think.",,
GG,One or both brothers.,,
AG,Yeah. I think the oldest—,,
GG,Alfred?,,
AG,"Yes, is still alive.",,
GG,I don't know.,,
AG,I don't either. I never thought to ask her. He lived a long time after,,
AG,that. She didn't seem very emotional about it. She was the oldest girl,,
AG,that I talked to.,,
GG,"Well, they were just a bunch of",,
AG,"It's been almost fifty years, so how would you feel after that time?",,
AG,"even care too much I would be kind of resentful, in fact.",,
SS,I'm surprised that such a big effort was made to— was he an especially,,
SS,"popular person, or is that just what they'd do if anybody was lost?",,
GG,That's what they'd do if anybody was lost. Because Clavanaugh was lost,,
GG,up there a few years later and they did the same thing.,,
SS,"That was from Genesee, right?",,
GG,Right. They did the same thing. They went out there and it was snowing,,
GG,and blowing and raining and cold; hundreds on hundreds of 'em just spent,,
GG,days out there. And they got just as much satisfaction out of that trip,,
GG,as they did out of Harrises; they never found him or any trace of him.,,
AG,"Well, they figured",,
GG,"They figured here just the last few years that he did, but during the",,
GG,time they were making that search they did not turn up a single thing.,,
GG,"Well, then just in the last few years there was another man,— there was",,
GG,an old settler around Palouse and he had lived in Moscow the last few,,
GG,years— he disappeared. And the same thing. They hunted and hunted and,,
GG,"hunted for him. Well, then the next year there was somebody from Wal",,
GG,lace disappeared at Clarkia; and the same thing. They turned out by the,,
GG,thousands.,,
AG,They found him in a couple of months though.,,
GG,"They found him the next spring, up there on Mallory Creek.",,
AG,He had walked the wrong way. This Clavanaugh had walked the wrong way,,
AG,too. He was found—,,
GG,Ten miles. Farnsworth walked fifteen.,,
AG,Yeah. His name wasn't Farnsworth.,,
GG,"No, it wasn't Farnsworth.",,
GG,I had it in my mind a minute ago.,,
GG,Jody McCowen's father-in-law.,,
GG,Was there any method for the searching? When they searched for these,,
GG,people in the old days?,,
GG,Yes. They had crew leaders and they'd take a trail and they'd walk up,,
GG,to the top of the mountain and then they'd space out about every eight,,
GG,"feet, and every other man— one man'd go this way and the alternate man",,
GG,go this way.,,
GG,Opposite directions?,,
GG,And they'd search that country over every inch.,,
GG,There was a kid lost out here not too far away from here.,,
GG,Over at White Pine.,,
