speaker,words,tags,timestamp
GG,"And they did that and they walked right by him, and one guy— something",,
GG,was in the silt of his eye ofr something and he looked around at just,,
GG,the right time and they found him. He had fallen off a stump and shot,,
GG,himself as he fell.,,
GG,Now they have Search and Rescue. They do the same thing though,,
SS,"The first settlers, way back in the 1870's even, they used to come all",,
SS,the way out to the Hoodoos and up to the head of the Palouse River to,,
SS,huckleberry. They came in big parties.,,
GG,That's right.,,
GG,up into that country too to get wood too. I've heard,,
GG,some of 'em tell how they did.,,
GG,But they did that. They'd come from Palouse or snyplace. Maybe there'd,,
GG,"- op be two or three wagons with fifteen or twenty people in them,""[back up",,
GG,there and they had everything all equipped. They'd dry their berries,,
GG,and if they had jars they canned 'em right up there. (Chuckles) And,,
GG,boy! did they have a ball.,,
GG,I think they kind of made jam of them or something.,,
SS,"When you were young, did they used to do that too? Did you neighbors",,
SS,go up and—,,
GG,"Two or three families'd go together. Oh, we just had a big time!!",,
GG,We still do it when we can. We always get some of the neighbors to go,,
GG,with us. Frank Herog and his brohter-in-law— two of his brothers-inlaw,,
GG,"and his brother and my dad and my brother, they drove a team— each",,
GG,"had a team— there were three teams, and they drove in there at the head",,
GG,of the Palouse River and then we took a trail and went right up on the,,
GG,"top of Baldy, about two or three miles, and we'd stay up there over night",,
GG,and the second night my dad carried carried two of them old square oil,,
GG,"cans, ten gallons, five gallons on each side of him and us boys had all",,
GG,"the buckets we could carry, and we were just little fellows, come down",,
GG,"off there with— gee, we had berries. And that was just customary. One",,
GG,"year the Duntons, the Malcoms, the Barrigers and my folks, they all went",,
GG,in a group and they had a time up there berryingr We had a .22; somebody,,
GG,had shot enough pheasants for supper. And we just had 'em on the camp,,
GG,"fire frying out good and the ganfwarden, Ed Harris,came along. Oh, some",,
GG,"of 'em were just frantic, you know, that they was just really gonna get",,
GG,"pinched, andmy dad says, ""Come on, Ed, and have supper."" Ed come in",,
GG,and never said a word. Chicken to himl ! (Chuckles) The fire warden,,
GG,was game warden and the deputy sheriff in those days. He just rode into,,
GG,"camp on his old roan horse. I can see him coming. And then, sure, r",,
GG,"""What'll we do? What'll we do?"" (Chuckles) Dad says,and have supper.""",,
SS,Did your dad know him pretty well?,,
GG,"Oh, yeah, well, he just lived two or three miles from us. Yeah, we knew",,
GG,"him real well. Fact of the matter is, everybody in the party knew him.",,
GG,"But, you know, because he was a game warden, why, we had illegal game",,
GG,"but, he never said a word. He was a good old sport. And I think he ap",,
GG,"preciated that supper, he was still twelve miles from home and it was",,
GG,right in the shank of the evening. He was gonna get home in plumb dark,,
GG,and if he didn't get supper he was gonna be damn hungry.,,
SS,What was that story you told me about that mule trade over near Kennedy,,
SS,Ford? That really good story you told me! I don't remember all the details.,,
SS,There was this guymule trading with somebody else?,,
GG,Was he trading him that blind mule?,,
SS,Yeah.,,
GG,That happened just south of Linville but he lives in Palouse now. Let's,,
GG,"see, Sam was coming in up out of the canyon with six head, two and two,",,
GG,and he met somebody right at the top. A Neighbor that lived right at,,
GG,"the top of the grade going down, and the neighbor had a mule that looked",,
GG,"like one that was in Sam's string, they'd make almost identical mates,",,
GG,"so he wanted him. And Sam says, ""No, you don't want him, he doesn't",,
GG,"look good."" ""Oh, he looks alright to me."" Kept arguing, and convinced",,
GG,"Sam that he really wanted him, and 8am, as far as he was concerned, was",,
GG,"convinced that he didn't want him, so he traded with him. And a couple",,
GG,"of days later they met again and he says,to Sam, ""Why didn't you tell me",,
GG,"that mule was blind?"" Sam says, ""I did, I told you he didn't look good.""",,
GG,(Chuckles) That was the end of it.,,
SS,Did you tell me that that telephone there— who was it had the telephone in the,,
SS,country? In that area? By Kennedy Ford? Was that at the,,
SS,"Grange, the telephone? Or was it one of the farmers. There was that",,
SS,place that you went to make a telephone call.,,
GG,"oh to Effrige's? Oh,phones were pretty general, but we had been to",,
GG,the warehouse and my grandmother called the warehouse and wanted us to,,
GG,"tell Mrs. Effrige something, I don't remember what. But my uncle didn't",,
GG,"care who it was, if he could get a joke on him, he got a kick out of it.",,
GG,"So just before we got to Effrige's he took a chew of tobacco. Well, I",,
GG,"was a big shot about ten years old, I figured I had to have a chew too,",,
GG,so I got my chew and just got it good and juicy and come up to Mrs. Ef,,
GG,"frige' s gate and he said1,'How you go in and tell her what Grandma said.""",,
GG,"So I strutted off and walked, went up and knocked on the door and she",,
GG,"come to the door, and I had my mouth full of tobacco juice, couldn't say",,
GG,"a word! Rushed back off the porch and spit and went back, gave her the",,
GG,message and took off down the sidewalk.,,
GG,Were you embarrassed to have to do that?,,
GG,"No, hell, you couldn't embarrass me, I wasn't smart enough. (Chuckles)",,
GG,How did the two of you meet?,,
GG,"Grange, I guess.",,
GG,"Down at the Kennedy Ford Grange hall. That's where most people met, ev",,
GG,ery Friday night. (Chuckles),,
AG,"If it hadn't been for the Grange, I don't know.",,
GG,The Grange hall'd be so full of people you couldn't hardly dance. Tre,,
GG,mendous crowds in there. Two bits a ticket.,,
GG,Two bits a ticket?!,,
GG,Either that or it was completely free.,,
GG,"What time period was that, when you two met?",,
GG,Pardon?,,
GG,When was it that you met at the Grange? What time period was this?,,
GG,"Oh, about",,
GG,20's?,,
GG,"Yeah. Early 20's. '21 or'22, somewhere around there. I guess, wasn't",,
GG,"Yes, it would have to be along in there, I don't remember exactly.",,
SS,Did you know each other for very long before you started courting?,,
AG,"(Chuckles) Oh, about three or four years, I guess. We started going",,
AG,together in about '26.,,
GG,"Yeah, she went with me two years before we got married. Just about any",,
GG,way.,,
SS,What was it like then to go together? What did you do for—?,,
AG,"Went to dances, mostly.. Oh, shows, we had a picture show there in, Pot",,
AG,latch.,,
GG,"Dances, parties, picnics. Grange. We didn't miss anything.",,
SS,Sounds like there was really a lot to do.,,
AG,"Well, not much in the week times, but weekends were pretty well filled",,
AG,with something or other. Not like it is now.,,
GG,"Well, we just had to, more or less, the whole neighborhood created",,
GG,"their own amusement. Grange, dances, parties, picnics. You know they",,
GG,"used toin the horse days, they'd drive sled loads of people from Ken",,
GG,nedy Ford up to Harvard to Grange and drive from Harvard down to Kennedy,,
GG,Ford to Grange for dances.,,
AG,Spend the whole day going and more than half the night getting home again!,,
GG,"Weather thirty below zero, we were just as comfortable and had just as",,
GG,good a time as if the sun was shining!!,,
SS,Wrapped up pretty good?,,
GG,Yeah.,,
AG,We put a lantern inside and blankets over the—,,
GG,"And then go in great big parties, they had sixteen foot California racks.",,
GG,"And there was eight inch sides and then they put twelve, fourteen inch",,
GG,sideboards above that and then put in about that much fresh hay.,,
SS,A few inches?,,
GG,"And then put a big tarp over it, and a lot of these laprobes and blankets",,
GG,and such and such and put them over us and then a canvas tarp over the,,
GG,whole thing. And we'd just set in there and have a party going and com,,
GG,ing],,
GG,How many people could ride in the back of one of those?,,
GG,"Oh, fifteen, sixteen. Depend on how much we wanted to get crowded! Us",,
GG,"kidsliked to have 'em crowd pretty good, you know. Take a girl and go!!",,
GG,(Chuckles) The older folks'd get mad at us.,,
AG,"He was coming to Kennedy Ford, . he was going from Harvard",,
AG,"to Kennedy Ford, that was before he and Did many of the young folks get married ,",,
AG,like that?,,
GG,Sure. What else was there?,,
GG,"A lot of people were married just locally then? Just right in the area,",,
GG,didn't go that far to—,,
GG,"No, they were mostly local.",,
GG,"There were cars, but in the wintertime nobody used 'em. Put 'em up",,
GG,for the winter.,,
GG,They didn't have roads to use 'em on.,,
GG,"They didn't dig 'em out like they do now, you know, didn't plow 'em out",,
GG,like they do now.,,
GG,"I mean, a lot of the young people just got married right there. You",,
GG,didn't go to Moscow or Spokane to meet the girls?,,
GG,"No, hot as a rule.",,
GG,Some of them did.,,
GG,"Yeah, 'course.",,
GG,Iwas thinking here lately there's been several around that,,
GG,"way, either go to church the same place or school or something like",,
GG,"that, they're doing about the same as they used to, marry close to home",,
GG,"as they ever did. I've read about, say that there's more marriages made",,
GG,"in the same town than there are ever from away. 'Course, I suppose now",,
GG,"that the boys are in the army they do meet more girls, but as a rule,",,
GG,they are almost the same as—,,
GG,Did they get married pretty young?,,
GG,About the same.,,
GG,"About the same as now, you think?",,
GG,"Yeah, lots of 'em got married real young, and then— her and I— I was",,
GG,"twenty-six, I think, twenty-seven. She was two years younger.",,
GG,"Twenty-six when you got married, it was, oh, '25.",,
GG,Were you pretty concerned about having enough to set up a household when,,
GG,you got married? Was that a big concern?,,
GG,"Oh, no. I was baching before we got married, and Frank Kilmer was going",,
GG,"to leave the neighborhood and go down to Bend, Oregon, I think, and he",,
GG,"said, to Harold, he says, ""I want to sell this furniture, the whole",,
GG,"house full."" Took out a few pieces he wanted to keep and Harold says,",,
GG,"""How much you want for it?"" And he said, ""Ten dollars."" And Harold come",,
GG,"and talked to me about it and I think we each had five dollars, so we",,
GG,"bought it. So, it was no problem then. When we got married her mother",,
GG,"bought her a new bed; mattress and springs, and we were set up, we had",,
GG,everything. We had four old skates horses and two or three cows.,,
GG,Four old skate? What's that?,,
GG,"Weill, they was old horses, they'd passed their prime.",,
GG,"With that ten dollars you got some farm machinery, too, didn't you?",,
GG,No.,,
GG,You didn't?,,
GG,"No, we got farm machinery from Gus Clum, I think we give him",,
GG,twenty-five dollars. And at a sale I bought a plow and harness and we,,
GG,bought horses at a sale. Bought one of the cows over at Glen,,
GG,Emery's sale. I don't know where we got the other one. But we were,,
GG,on the road. Then after got married- my brother and Iused to keep,,
GG,"track of every damn penny we spent, and we put it in a book. So Igot",,
GG,"married andhe was gonna get married, so he made a deal to buy a little",,
GG,Place up there right by the  Hlt cemetery. Doesn't show there any,,
GG,"more. And he says, ""Who's gonna buy who out?"" And I said,""Well, it's",,
GG,"here, let me buy you out."" ""OK."" We took the book and added it up and",,
GG,"divided it in half and the whole deal took about ten minutes, and didn't",,
GG,involve a hundred dollars! (Chuckles),,
GG,So you bought the outfit that you'd been sharing?,,
GG,Yeah.,,
SS,Did you think you needed much to set up housekeeping in those days? I,,
SS,mean when you got married?,,
AG,"No. They giveshower and with afew wedding gifts, it was wU/ all",,
AG,Ineeded. I think soon afterward he bought that desk over there and we,,
AG,"had afew chairs. And, well, we had that outfit that he was telling you",,
AG,"about and it was enough. It could have been more, but then it was enough",,
AG,"to get by, so we did.",,
GG,It wasn't too fancy. (Chuckles) I got akick out of-- tMs spring.,,
GG,"We got married andRose Mary got married, and she had an entirely different",,
GG,deal.,,
AG,We looked for ajudge and got married. (Chuckles) It took about five,,
AG,minutes.,,
GG,The night before- I to get off work at three o'clock and she was,,
GG,"gonna meet me over at the mill, so she met me at three o'clock and we",,
GG,"never told her folks, my folks, or nobody else, we just drove over to",,
GG,Moscow to the justice of the peace and got married.,,
AG,Judge Nelson.,,
GG,Yeah. Come back and did our chores and had supper and went over to her,,
GG,folks and told them that we'd got married. Made her mother mad 'cause,,
GG,"we did it that way, just on general principles. (Chuckles) I thought",,
GG,"she never would make up with us, but she did, a couple of days.",,
AG,"Oh, she was okay, she got over it.",,
GG,Yup. Couple of days.,,
SS,Did you want to get married without telling 'em because you were worried,,
SS,that they'd want to make a big deal out of it?,,
GG,"No. No, we just didn't give a whoop. We wanted to get married and we",,
GG,"went over and got married. And, boy, the next night we got shivareed.",,
GG,And we had a house that didn't have any studding in it. It was not a,,
GG,"frame house, they called 'em a box. They just took the inside wall and",,
GG,the outside wall up just like that— a two-by-four at the top and one,,
GG,at the bottom and then two inch air space between. And we seen these,,
GG,cars coming in and we knew what was happening so we went outside. And,,
GG,that gang come up there and they started shivareeing us. And Ray Hanson,,
GG,and my brother and I guess one of the Walker boys got an old post and,,
GG,"went to banging on that wall. Hell, it'd shake it that far you know,",,
GG,"in and out, and I had just got through milking and carried a three gal",,
GG,lon bucket of milk in and set it on the drainboard by the sink and there,,
GG,"was another two gallon bucket of water setting on there. Well, they was",,
GG,they,,
GG,right behind that and kicked that off onto the floor. About that time,,
GG,we thought we'd better go inside. And there was that water an inch deep,,
GG,"all over the floor and that crowd just come right on in, didn't pay any",,
GG,attention to it. They swept it out a little and mopped it up a little.,,
GG,"But the next morning when she went to scrub the floor, why that milk had",,
GG,begun to sour! Guess she had quite a job!!,,
GG,"Got most of it out the first night, I think.",,
GG,"Swept all I could, but",,
GG,"So after they came in, what did they do, dance or what?",,
GG,No.,,
GG,Just a party?,,
GG,Yeah.,,
GG,"You were supposed to give 'em candy and cookies or whatever you had, oh,",,
GG,"gum. I don't know, they didn't ask for beer or anything like that, but",,
GG,they used to in the old days. They had to have beer.,,
GG,"No, we didn't have anything to drink, that night.",,
AG,"We had candy, but we didn't make coffee or anything.",,
SS,"You were ready for 'em? Yeah, we had to be ready for 'em.",,
SS,Did you have a little place ready to move into then?,,
SS,"OH, yeah. I'd been living on that place, baching for a couple of years.",,
SS,"Got tired of my own cooking!! In fact, I got tired of beans and fried",,
SS,eggs!! (Chuckles),,
SS,"Well, Harold was apretty good cook, better than Iwas at that time;",,
SS,We didn't have time to cook.,,
SS,Your brothers?,,
SS,Yeah.,,
SS,"You were working that hard, you didn't have time?",,
SS,We were both working at the mill.,,
SS,And farming.,,
SS,You hadn't had that much cooking experience at that time?,,
SS,I hadn't had a great deal. My mother thought she could do it better so,,
SS,she wanted to do it. (Chuckles) I didn't know how to cook meat or,,
SS,"make pies or biscuits. I had to learn all that after. I could boil potatoes, I guess.",,
SS,"She wasn't worried about teaching you those homearts, so you'd be able",,
SS,to catch yourself a handsome man?,,
SS,"No, she— what she liked to do, she did. She liked to make pies. She",,
SS,"didn't like to make cakes, so I'd make cakes and she made pies. And she",,
SS,"liked biscuits, so she made biscuits. So I had to sort of learn— of",,
SS,"course I knew how to do it because I'd watched her enough. So, I had a",,
SS,lot to learn.,,
SS,She learned it in a hurry. She only had two fizzles on her biscuits.,,
SS,One of 'em didn't rise only about that much and the other one rose up,,
SS,pretty darn nice and she burned it!!,,
AG,"Well, I dont remember it.",,
AG,"You mean, you forgot it. Do you think your mother was altogether sur",,
AG,prised when you came back married? Or do you think she really expected,,
AG,it?,,
AG,"Oh, I don't think she was too surprised. I don't think she liked it very",,
AG,well. she on.,,
AG,She didn't want to lose a daughter and she didn't particularly want to,,
AG,get another son! (Chuckles),,
AG,She worked hard and needed help. She was about -eight years old.,,
AG,"She was forty-four when I was born, so about the time she needed help,",,
AG,I got out and that didn't set right.,,
SS,"Well, I thought most mothers were so concerned about marrying their",,
SS,daughters off before they had to be old maids.,,
GG,"They used to claim that, but I don't know as it was really true.",,
AG,"Well, she worked hard. She milked half the cows, I guess, and that would",,
AG,"be from fifteen to twenty, I think, the way I remember it. And she'd",,
AG,milk her half and I helped with the rest of them. So when she had to do,,
AG,it all it was a little bit too much for her. Would have been for me I,,
AG,know.,,
AG,You were the only one left at home?,,
AG,"Well, my brother was there, but he never did milk. They had bought a",,
AG,"milking machine at that time, to go along and strip afterwards.",,
AG,Go along and what?,,
AG,Milk after the machine.,,
AG,"Oh, you had to strip after with those old first model-",,
AG,'Cause they didn't do very good job?,,
AG,"No, they didn't.",,
AG,Would you have to work most of the day to do the work you had to do,,
AG,around the house?,,
AG,"Oh, about a half a day— the morning, you know the morning, and a couple",,
AG,of hours at night. Help take care of the night milking.,,
AG,"Were you doing canning and all that stuff then, back then like you do",,
AG,now?,,
AG,"Sure, sure.",,
AG,"I can't remember my mother canning when I was a child, but in later years",,
AG,she canned everything she could get her hands on. She had lived in North,,
AG,Dakota and that was the worst place for— So when she came West to the,,
AG,Coast she canned everything she saw and a lot of stuff that really wasn't,,
AG,worth it but she thought she had to can it. It was kind of a compulsion,,
AG,with her.k We'd boil the fruit in the sugar and water enough to— we'd,,
AG,make this— can it in the kettle and then dip it out of the kettle inte,,
AG,the jars and sealed it and turji 'em upside down. Along about 1930 or,,
AG,'35 I started in canning like I do now. Put 'em in the jars and then,,
AG,poured the water over them and boiled them in the canner.,,
AG,And they called it cold packing then. And then we got a pressure cook,,
AG,er after while.,,
AG,"Well, I never pressure cooked fruit, just vegetables.",,
SS,"You learned to can from just watching them do it, when you were growing",,
SS,up?,,
AG,"UH-huh. It isn't hard. It's hard work, but then it isn't hard to can.",,
AG,Nothing complicated about it.,,
SS,Did she use a lot of old home remedies that you learned about when ?,,
AG,"Not a great deal. No. She had some cough syrup she made, that I used",,
AG,cold.,,
AG,"to love. Seemed like she used honey and butter and something else, I",,
AG,"u don't know what it was, but anyway it tasted good.' They boiled it up",,
AG,together. My dad used to take these bob,,
AG,he bought it and then he'd put some alcohol with it someway and we used,,
AG,"to take that for cough syrup, put it on sugar. I used to like to have",,
AG,cold for that. (Laughter),,
GG,"Well, we used to—",,
AG,A drop or two of it.,,
GG,Along about that time we still used mustard plasters and kerosene and,,
GG,"lard, it was kinda going out, but we still used it.",,
AG,"You know, that's something my folks never, fact is, never did use a",,
AG,"mustard plaster. I didn't use it on my own kids , either.",,
GG,"Well, I got my share of 'em plastered on me!! Every time we'd catch",,
GG,cold that's what we'd get.,,
AG,"Vaporub, we used Vaporub when our kids were little. Didn't want to get a cold",,
AG,very often;,,
GG,No. We didn't get colds,,
AG,Another remedy they used was a plaster on the chest,,
SS,In a poultice type thing?,,
SS,Yeah. I think you put it on a cloth and put it on your chest. I saw a,,
SS,woman fix a pan of onions and put it on a cow one time. The cow had a,,
SS,nail or something in her gullet or stomach. This woman thought that she,,
SS,had a cold so she fixed that up. But the cow died of this wire. Iryer,,
GG,She had a wire in her heart.,,
AG,"One time my brother, that was back in Wisconsin, was telling about that",,
AG,"he got an awful cold and she thought he had pneumonia real bad, so she",,
AG,put hot pancakes on his chest. And she was frying away and making new,,
AG,"ones, and she decided there was no need of making more pancakes, she",,
AG,took the ones that were already made and warmed 'em up and put them on,,
AG,his chest. It stopped the cold.,,
SS,"Oh, really! (Laughter)",,
GG,"Well, we was a long way from a doctor as a rule and we tried everything",,
GG,under the sun before we'd—,,
AG,"Well, some of those old methods were just as good as a doctor anyway.",,
AG,Anyway it worked. And I'm still around. (Chuckles),,
SS,"Was there any precautions that you were told, that you learned about",,
SS,when you were pregnant or,,
SS,ideas of ways to do thingswhen you were having a kid?,,
AG,"Well, we had one old wivejs' tales. Well, that was kinda before my time.",,
AG,"I had an old doctor book there, I used to— not here but there at Potlatch",,
AG,I used to that doggone doctor book and finally got the third one,,
AG,"and I didn't have to look at it any more. (Laughter) Got thrown away,",,
AG,"don't know where it is, but, boy, that really had some old wive stales",,
AG,in that. Curl your hair! (Chuckles),,
SS,Were there midwives when you were young in the area?,,
AG,My mother was about the same as an and she took care of babies if,,
AG,"the doctor didn't happen to be there in time why, she took care of 'ein,",,
AG,"went through the whole deal. That was over on the Coast, around Seattle",,
AG,"and Glenwood— it wasn't called Glenwood then, we called In fact, I think the doctor",,
AG,was just a little bit pokey and didn't care,,
AG,whether he got there. He always charged just the same but he didn't,,
AG,have to be there when she was there.,,
SS,I've heard stories like you had to watch out for the cats with a new,,
SS,baby because they'd try to scratch their eyes out or something like that.,,
AG,"And they did say they'd take their breath away. Well, what the cat was",,
AG,"trymg to do was to get warm, you know. The baby was warm; a cat'11 sit",,
AG,"on your lap or get on your chest, you know to keep warm, that was all. do",,
AG,"I don't think it ever hurt— it might have hurt a very young baby, but",,
AG,I don't think they ever bothered anything.,,
GG,Most people didn't let 'em get close enough to find out.,,
AG,Scream their heads off.,,
GG,"They still believed it, in a way.",,
AG,Well—,,
GG,I think I still do.,,
AG,"I don't want any cats around my kids, either, but it wasn't on that ac",,
AG,count. I never figured that there was any bother made.,,
AG,"Well, I suppose in a few cases they smothered 'em, but that wouldn't",,
AG,happen very often.,,
AG,I never saw a cat get any farther than just on a child's chest.,,
SS,What about this idea of a certain length of time that you were supposed,,
SS,to do nothing after you had a baby? What was that?,,
GG,That was about fourteen days that you were supposed to. in bed and,,
GG,then you could get up and go. I don't know why anybody would want to,,
GG,stay in bed two weeks. Now they get up about the third day at the very,,
GG,latest. And you weren't supposed to do anything for fourteen days.,,
SS,"Somebody told me once that that was a way that the women.working so hard,",,
SS,that that was the way to make sure that they didn't overdo it.,,
GG,"Well, there was a lot in it because they had to carry water and they",,
GG,did all kinds of outside things.,,
AG,"Well, at the same time they knew that the Indian women were getting up",,
AG,"the same day and if they could stand it the white women could have, but",,
AG,"they didn't want to, really. But they told you to stay down so most of",,
AG,'em did.,,
SS,I think you'd be awfully weak when you finally got up after that.,,
AG,"Yes, that was it. Your feet would feel like you had needles and pins",,
AG,in 'em.,,
GG,"I think, near as I can remember, you never got out of bed short of",,
GG,"seven, eight, ten days.",,
