speaker,timestamp,Endtime,words,tags
,,,,
Martha Tórrez,[00:00:01:27],00;00;28;22,"Yes. My name is Martha Tórrez. Today is March 16th, 1991. We're at the home of Mr. Henry Peña, and his address is at 315 Seventh Avenue North, Nampa, Idaho. It's approximately 1:17 p.m.. And, Mr. Peña, my first question that I'd like to ask you is where, when did you first come to the state of Idaho?",nampa;idaho
Henry Peña,[00:00:28:24],00;00;35;28,"In March of 1947. I think that's 47, 39.",
Martha Tórrez,[00:00:36:04],00;00;40;20,1939? Yes. Why did you come to the state of Idaho?,idaho
Henry Peña,[00:00:40:22],00;00;59;07,"Because of, we that came here on, trip, he came to freighter because he wasn't making enough money to support us in Colorado. He was earning a dollar a day for ten hours work.",
Martha Tórrez,[00:00:59:10],00;01;00;14,In Colorado and.,
Henry Peña,[00:01:00:14],00;01;41;17,"Colorado. So he decided to come here because he had a friend here that ... told him her daughter was making good money. And so he arrived in this, in that winter and, well, he left home on the last day of January, moved up this freight, and he told us he had froze to death, but he made it to whole working for there was farmers recruiting laborers for the next spring crop on the beach.",agriculture;recreation
Henry Peña,[00:01:41:19],00;02;10;23,"So he went to this farmer in Marsing, and Mr., what was his name? Hardin, I think, and Herschel, two farmers and they this farmer call and yes, he did come and work for him and. They said, okay, right away. He didn't even know that. And they told him, how much money do you need? And dad said, dollars.",marsing
Henry Peña,[00:02:10:25],00;02;27;22,"I think about $100 in those days, hundred dollars a month. And so he he said, well, do you need a truck? Do you need a car to bring your family? He said, no, I got a car back on that train trailer with and he got up to ride at home.",family;agriculture
Martha Tórrez,[00:02:27:24],00;02;35;05,So your father came first before you brought them. When you say that he just about froze to death. Was that on his way here?,family
Henry Peña,[00:02:35:05],00;03;09;28,"Yeah, on a freight train boxcar. Because I had no way to pay for any transportation. So that's what he done. And he had some relatives there in the outbreak in Utah. He stopped there and went to visit them. And I gave him some food and lunch so he could make it to Salt Lake. And there he had another friend that he came with him, can't remember his name, but they both came.",food and drink;recreation
Henry Peña,[00:03:09:28],00;03;26;02,"And, this farmer, like I said, this farmer offered everything he needed. So he went home and he told us, we want to go to Idaho. And we said, or is Idaho.",idaho
Martha Tórrez,[00:03:26:04],00;03;27;24,Had never heard of. No.,
Henry Peña,[00:03:27:26],00;03;57;17,"No, no. I said, well, it's way far. And that was for us. We never been out of state or nothin. So he said, well, pack up and leave. So we left and time that we left, we had quite a bit of trouble with the train. It took us seven days to get from there to here, and now it only takes us about 12 hours.",
Martha Tórrez,[00:03:57:19],00;03;59;18,What kind of trouble did you have?,
Henry Peña,[00:03:59:19],00;04;34;28,"Tires, flat tires and troubles with a little trailer. And that time we couldn't find a tires for that same mate as a trailer. So about ten miles that we had a lot of clothes and that said, well, fix that tire. So we patted him with old clothes and he made about ten miles, and we didn't get hardly that green river here till I got ten miles in the desert, so that we stayed till her brother Benny Low pitched.",agriculture;family
Henry Peña,[00:04:35:00],00;05;06;14,"He hitched a ride to the river and he found a tire. So we came back and hit another ride. And then he come. We put it on and it didn't work, but we had to get another tire and we were to make sure my dad wouldn't go over 30 mile an hour. And he had a big old and concert for so 32 of them tires were pretty huge, but it took us that long.",art
Henry Peña,[00:05:06:17],00;05;36;25,"We would travel back five six hours a day and then we'd camp out. We couldn't write down what it was, so we had to camp out and, Tomo, you call that here to Napa? That said, oh, all are about me marching 20 miles more. But, he said, we gotta stop past Napa. I need a way stop around for Lake View School with no.",recreation;education
Henry Peña,[00:05:36:27],00;05;52;25,"And we said, how far is it yet? So it's just over the hill. And it took just about another hour from there. And then it was up there and farmer had a place or it was a chicken coop, so.",food and drink
Martha Tórrez,[00:05:52:27],00;06;04;10,"Oh my goodness. Before, before we move on to that, Mr. Peña, those seven days that before you got to Nampa, it seems that money was a problem. What did you do for food?",nampa
Henry Peña,[00:06:04:12],00;06;14;27,"Well, we had thought we had beans and stuff that go by hand over there and stuff from them. Hundred dollars to get from the farmer.",food and drink
Martha Tórrez,[00:06:14:29],00;06;17;09,So when every time you camped out that's.,
Henry Peña,[00:06:17:11],00;06;42;27,"You know what you can we we made our own, we made our own food and all it by was bread or mom, her sister, she'd make tortillas out on the desert or just take us to Layton she didn't make and not. We found that, Marsh. And we still had money left.",food and drink;family
Martha Tórrez,[00:06:42:29],00;06;46;15,So was this during the winter that you were doing ...,
Henry Peña,[00:06:46:17],00;06;47;09,But March.,
Martha Tórrez,[00:06:47:09],00;06;47;25,That march.,
Henry Peña,[00:06:48:06],00;06;50;01,About time to start out and be.,
Martha Tórrez,[00:06:50:01],00;06;55;19,"Well, it was still kind of cold. So when, while you were getting on your trip to Nampa, how did you.",health;nampa
Henry Peña,[00:06:55:22],00;07;19;22,"All those times. By that time it was different weather. And now. Oh yeah, by April it was already warm. So you in March and wasn't? No, I was happy with that was an hour and a half picnic. That we got to march in that day and that's what we found. But it was still better than what we had in Colorado.",recreation
Henry Peña,[00:07:19:22],00;07;37;20,"We just had a house, but they just said room and kitchen. And, you know, that diner and kitchen were there. And the bedroom and that sleep over there was my home bed for my sisters and him and his wife.",family
Martha Tórrez,[00:07:37:23],00;07;42;11,But the first house that the farmer or the provided you with was a chicken coop.,food and drink
Henry Peña,[00:07:43:25],00;08;12;08,"Yeah. And there was another two families there afterward. Yeah. They got there. Oh right. And so let's start what was in the 1 or 2 days before we started working and dad said, well, can the family work here? A farmer said, oh yes, I had a hold on a ranch along Colorado. They wouldn't let you work out on the field.",family;agriculture
Henry Peña,[00:08:12:08],00;08;23;26,"Still, you was 14 or 16. What a way to I mean, I started working and that I only started making about $100 in a day.",
Martha Tórrez,[00:08:23:29],00;08;26;02,And for the whole family.,family
Henry Peña,[00:08:26:02],00;08;54;02,"Yeah, my whole family was me and my older brother and my sister and dad. Four of us, their sisters were on the school. Mary and. And know. Well, she was the only one. But, and when we start work and and like to work there all summer and hay and and all that, that farmer was real good.",family;education;agriculture
Henry Peña,[00:08:54:04],00;09;18;17,"He never did remind dad and daddy had to pay him that money, but dad paid it to like. And dad when we came, he didn't pay for his car. He said he did pay a payment or two and he knew he had made the payment. But them guys over there said no, you never saw. They came and compensated his car.",
Henry Peña,[00:09:18:20],00;09;26;17,"And dad said, I'm not going to give you no more money. So you know why I'm making enough now to buy two cars. Okay, so.",
Martha Tórrez,[00:09:26:24],00;09;27;28,So they came and they.,
Henry Peña,[00:09:28:00],00;09;28;08,Took.,
Martha Tórrez,[00:09:28:09],00;09;29;26,The car?,
Henry Peña,[00:09:29:29],00;09;54;28,"But he got them on right away. Better cars. Watch would have kept that car that was and take on the Lincoln said permission make your tires with spokes on it rather than cars was a lot of money, you know. But then that summer we worked there and then Colorado, we go back and Pat went on, what was it, 2 or 3 when we went back.",
Henry Peña,[00:09:54:28],00;09;56;26,And that's when.,
Martha Tórrez,[00:09:56:29],00;09;57;29,This is after you.,
Henry Peña,[00:09:57:29],00;10;26;25,"When you and, you know, you had gone before. So then dad bought a place here at 12 start stay in here for sure. And the following two years we never worked for them. Palmerstown mall walked around here in, this, seasonal work. Like they can be taking care and Scott no days plow can beat and all that.",health;agriculture
Henry Peña,[00:10:26:27],00;10;41;10,"And, was making $30 a day myself at that time. So when I got married, all that, I quit all that. And I started that one that same year.",
Martha Tórrez,[00:10:41:12],00;10;42;29,So that was two.,
Henry Peña,[00:10:43:02],00;10;43;18,47,
Martha Tórrez,[00:10:43:20],00;10;45;16,"47, you know.",
Henry Peña,[00:10:45:18],00;10;52;14,"So and, we got married in September and November of that year. I start where or.",
Martha Tórrez,[00:10:52:17],00;10;57;01,How did you how did you know about the railroad jobs? How did you.,railroads and transportation
Henry Peña,[00:10:57:01],00;11;36;22,"Well, dad, that had to work there. He was working and he told me that there was hiring. So I went to see I had to go to Lambda Idaho. I had an extra gang there, and we worked there all that winter. Kept on that extra K lay and steel and so switching track and things like that. Then next spring in 48, I started working here in New York and a section I same kind of work last year and taking care of maintaining the tracks.",labor;idaho;health
Henry Peña,[00:11:36:25],00;12;06;22,"And, then I got laid off by the winter and, I'd start looking for scrap and stuff and not sell, make it make ends meet. So that wasn't long before they called me back and worked up on, and they laid me off again. Right. I went on extra gang and we went to Crane work. And that winter in 48, or was it 50? 48.",
Henry Peña,[00:12:06:22],00;12;41;27,"I think the work there all winter and. The we just about froze there, freezing cold and all that had they sold more cash was I didn't have no contractor stuff. One day we went to get our checks to. Burn to Oregon. Was 50 below zero that we couldn't hardly walk. But Pearl was so good staying that they had sent the checks.",health
Henry Peña,[00:12:41:27],00;12;48;19,"I did, sending them to Ontario. To Oregon. They send them to Ontario, Canada.",canada
Martha Tórrez,[00:12:48:22],00;12;49;25,Oh.,
Henry Peña,[00:12:49:28],00;13;18;03,"So that good thing we did. Because if I start right out back to the camp, which was 30 miles, but what they gave us about 2 or 3 hours before they made us type guards. Bobcat. But and then, we thawed out and we'll look for contracts and papers to wrap around ourselves to head back. And,",recreation
Martha Tórrez,[00:13:18:06],00;13;22;23,What what kind of transportation were you using to get where you were going?,
Henry Peña,[00:13:22:25],00;13;24;00,The motor cars.,
Martha Tórrez,[00:13:24:00],00;13;24;26,The motor cars.,
Henry Peña,[00:13:24:26],00;13;40;26,"At and see to made out in that trailer behind. And, we'd get on there just on nail and I think there's a kitchen here. How it would.",agriculture
Martha Tórrez,[00:13:40:28],00;13;45;19,So the way this how was it that you kept warm just by using the newspaper?,
Henry Peña,[00:13:45:19],00;14;14;18,"Yeah. And they didn't have no heater, save that how we had to travel. I would just, open air there and nothing to cover ourselves with, but we had to find some place to get back a good thing that by that time, it must have been 1 or 2 by time we started back. And, by that time, it got about ten degrees warmer.",technology
Henry Peña,[00:14:14:20],00;14;49;02,"So we made it back and the good thing we had at camp Tanner, it had them all time bunk cars in the fire in the stove. So I was all right. And and that winter. And that spring came back and started working here in New York again. I worked pretty steady till 1950. I started working at Bank Idaho intersection there.",recreation;idaho
Henry Peña,[00:14:49:04],00;15;05;29,"I work there, but two years and then I moved down to. Hammett. I worked there about two years. Then by 1953 54, I worked for the state here in the yard.",
Martha Tórrez,[00:15:06:01],00;15;12;22,"Before you started working, you know. Steady. What did you do with that during the times of layoffs?",
Henry Peña,[00:15:12:24],00;15;40;02,"Well, I draw my unemployment and then I'd go out and do odd jobs, you know, and then write those time to give them good money for scrap iron and stuff. But cleaning this yard, this country here, then they buy bone and give you about 2.02 pounds a pound and anything to keep us going, you know. But we never suffered.",
Henry Peña,[00:15:40:03],00;16;08;16,"Once we left Colorado, we kind of made that hand over there when he was making just a dollar a day or. But I think it was probably about ten, 15 years in winter time or. Well, he didn't have enough to feed us, so he'd go out and hunt you know, the game warden, know what he was doing. So he knew that meat wasn't going to waste.",recreation
Henry Peña,[00:16:08:19],00;16;35;07,"So we had meat, beans, potatoes and rice and stuff like that. But we had meat. But once that away game warden retired, he didn't tell that no one what was going on. So on that no game warden while he took his guns away and said, you can have that. Tried to explain to him, but he didn't want to get that.",food and drink;recreation
Henry Peña,[00:16:35:07],00;16;44;09,I was like that. I had trouble. And so that's when I really got hard. And he said he had to do something. So that's when they came here.,
Martha Tórrez,[00:16:44:11],00;16;48;24,"So, Mr. Brennan, how would you describe your first memories of Idaho?",idaho
Henry Peña,[00:16:48:26],00;17;21;08,"I describe them as, you know, like when, like that saying from rags to riches. We thought it was for rich people, you know? So we got to Idaho. We had everything we needed. And that, took care of is my name on them for 2 or 3 years. We went to Arizona after that, after going to. That's when, Colorado, we'd go down there so on and passed away and all that.",idaho;health
Henry Peña,[00:17:21:08],00;17;31;10,"It was a money made of some money. So we always, happened to find jobs in Arizona to help us out more.",
Martha Tórrez,[00:17:31:10],00;17;37;07,So was that just to leave the hard winters in Idaho and go spend?,idaho
Henry Peña,[00:17:37:09],00;17;58;21,"Yeah. And so when I left, when we all got married and dad didn't have no other resorts, they just stuck to the railroad and he didn't have more help from us. No more. So that's why they don't tell he retired and that's. But I done up to that time I retired.",railroads and transportation
Martha Tórrez,[00:17:58:23],00;18;04;28,"Do you remember, other Hispanic families when you first came to Idaho?",idaho
Henry Peña,[00:18:05:00],00;18;27;05,"Well, the only ones we knew was, what was their name? There was from Colorado to. They. Okay. They had their last names now, but there was 2 or 3 families that there was there was. I was working that farm and machine.",
Martha Tórrez,[00:18:27:08],00;18;29;26,That were all right. They were already here in Idaho.,idaho
Henry Peña,[00:18:29:28],00;18;31;20,We know that was in Oregon.,
Martha Tórrez,[00:18:31:22],00;18;32;13,Oh.,
Henry Peña,[00:18:32:16],00;19;02;23,"Yeah. And I saw them. And then when we heard them on, dad went over and invite them to come and help them because this farmer needed more help. So when they heard that there was a place there, we told them what kind of place. So we don't mind as long as we make money. So they came down and that's the only family we went.",family
Henry Peña,[00:19:02:23],00;19;09;22,"No, I can't think of a man named. I know his name was Abraham. That first, first name.",
Unknown,[00:19:09:24],00;19;14;23,"And, and,",
Henry Peña,[00:19:14:26],00;19;25;09,"And I know he had three sons, Danny and, Leo and. But I can't think of that name.",
Martha Tórrez,[00:19:25:11],00;19;35;15,Can you give me a description of your living conditions? I know that you have described a chicken coop already. Can you describe the surroundings?,food and drink
Henry Peña,[00:19:37:23],00;19;39;19,"You like, you know, I mean, like.",
Martha Tórrez,[00:19:39:19],00;19;44;06,What kind of bedding or. What did you use for cooking? Did you have.,
Henry Peña,[00:19:44:06],00;20;19;16,"Oh, we had a regular wood stove. And then, table. They gave us some hay. No bed springs. We could just play them on the floor, sleep there, and, change like that and use them. Coach or or five year old was pretty clean, but he had, like, it used to be cold. We we don't mind sleeping during the winter, in spring time or summer, but, outside, of course, pasture, stuff like that.",agriculture;health
Henry Peña,[00:20:19:16],00;20;39;00,"But no animals that were on the Or stock, the farm, like, treat us. All right? We had anything we want to eat. Furnish eggs and milk. No, no, the money was making out in everything we needed to eat.",food and drink
Martha Tórrez,[00:20:39:03],00;20;44;01,How many people would you say lived in that coop at one time?,
Henry Peña,[00:20:44:03],00;21;20;28,"Well, we had two separate, rooms. One family there had two for. And another family. There was, three. Seven, seven and or three beds. Our boys slept together and and, sisters slept together. One and, on the other, usually crossways. So we rode left. We never. I don't remember being caught, as always. Like you sleep together.",family
Henry Peña,[00:21:20:28],00;21;48;21,"You never got caught. So. But, living conditions. I thought that was pretty fair. Not like in Colorado. Terrible. Where? There. And, and I know a lot of people in Colorado was going to the same time, so I thought I had a whole Paradise when we left Colorado. And but I heard about the people out there.",
Henry Peña,[00:21:48:21],00;22;21;26,"Sure. A happy place to live. Colorado. And most of us were from Colorado. That was here first. Then all the other people started coming around that place too close to 60, mostly from Texas, California, all them state, New Mexico and but, they all used to say, you go to Idaho, you can just read the money in the baskets.",mexico;idaho
Henry Peña,[00:22:21:26],00;22;37;11,"And so that's Idaho. That's what I think about my life. And I started to write a story. I don't know what I don't, but our journey to Idaho, that's about like what I was telling you.",idaho;migration
Martha Tórrez,[00:22:37:13],00;22;44;15,"Well, we sure like to see that when you're finished with it. Did you attend school here in Idaho? No, not at all.",education;idaho
Henry Peña,[00:22:45:00],00;23;24;11,"Just my smaller sister. No. Established. Getting school with all that money was make a that, the way it is. And in those years, you didn't think you know what's going on in school. I sure thought of that when I went out as a engineer for me to be here in Nampa, in my town of percent. And but, when, they sent me to China and to study, bought all the parts of a diesel engine or six brake wasn't going to help me.",family;education;railroads and transportation;nampa;china
Henry Peña,[00:23:24:14],00;23;48;09,So I told them I didn't come here to study about three ranges or part of it. I come here to run them engines and there's nothing to run in them. They get to know it's the rules and the written tests they gave me over there. That's where I failed in math test and stuff. But I did do pretty good.,education
Henry Peña,[00:23:48:11],00;24;02;29,"And like three points later, the engineer. But, me and done a lot of other things on the railroad farm and, and machine operator and things like that.",railroads and transportation
Martha Tórrez,[00:24:03:01],00;24;06;08,So what was the total of years that you spent with the road?,
Henry Peña,[00:24:06:10],00;24;06;28,42,
Martha Tórrez,[00:24:07:03],00;24;07;21,42,
Henry Peña,[00:24:07:27],00;24;38;18,"Or three. Yeah. Don't buy everything. 30 is there all but circle work? What I did do that when I was driving truck, I had to do another book called. And when I got into the last year of my career, I'd have to there in the office doing a lot of book work. I'm here was my school and I had, to do was don't go in.",education
Henry Peña,[00:24:38:20],00;24;42;21,I learned a lot by experience and.,
Martha Tórrez,[00:24:42:23],00;24;51;28,"Do you remember any other Hispanic men that were working men or women that worked with for the railroad, the time that you were working?",railroads and transportation
Henry Peña,[00:24:51:28],00;25;18;27,"Yeah, well, that's Mac López, my father in law. I didn't mention him. Get on that list. Yeah, he's. He worked with me a few years, and, he came here night or something like that. I don't remember, pardon me, but I think when he came here right away. Start working for the railroad, he didn't do nothing else.",family;railroads and transportation
Henry Peña,[00:25:18:27],00;25;27;23,"But, And there's Frank Chavez. They they weren't Christians there.",
Martha Tórrez,[00:25:27:26],00;25;33;21,"How old were you when you moved from field work? You know, farm work into the railroad?",railroads and transportation
Henry Peña,[00:25:33:23],00;25;59;25,"I was 22. Old. Yeah. So you remember. That's the same year, but married, but married in September. And I started working for him in November of 47.",
Martha Tórrez,[00:25:59:27],00;26;21;21,"Do you when you were moving back a little bit before you came into the railroad job, while you were doing migrant seasonal farm work? Do you remember any other people that were involved in the Bracero program or illegals that were working in the fields?",railroads and transportation;migration
Henry Peña,[00:26:21:23],00;26;49;09,"Well, I remember one. One year there was I was later going to fall. I drove a bus for a farmer and I was taken class. I don't know if I'd taken longer. I just stay in the bus waiting till I got up. Then I bring them back. But that was just a short time, maybe a month or two.",
Henry Peña,[00:26:49:13],00;26;57;00,Then they call me back on the railroad. Just a temporary layoff.,railroads and transportation;labor
Martha Tórrez,[00:26:57:03],00;27;03;02,Were you familiar at all with what the referral program was? And.,
Henry Peña,[00:27:03:10],00;27;27;15,"Well, I knew was they come to work and and then I go back home and, but I seen, that time they had to pay them good. They used to treat them right. And, they had better places, a state and some, people I knew around here. So I used to ask how they were treating them.",
Henry Peña,[00:27:27:15],00;27;57;11,"Right. They said, can we get everything we need? So that guy didn't work for them? Well, I didn't, you know, I didn't, bother to ask them a question. But that's why I got turned down. Because I could speak Spanish. You know, and anything they needed, they'd ask me to ask a farmer, and I paid one and more paper trail.",
Henry Peña,[00:27:57:11],00;28;07;20,"Been to wait a year to contact. Tell me to ask what kind of money? By myself. Care in whatever way you wanted, some work done.",health
Martha Tórrez,[00:28:07:20],00;28;14;15,And that being bilingual helped you get the job for working with the farmer?,
Henry Peña,[00:28:14:17],00;28;16;05,Yeah.,
Martha Tórrez,[00:28:16:08],00;28;25;03,Isn't there any other particular situations or experiences that you remember with the bracero program?,
Henry Peña,[00:28:25:06],00;28;53;20,"Well, when I remember one time, too, I think this was before I got married and needed interpretors at them stores. But there used to come down and, I worked from my work as an interpreter, and there wasn't long me there that time. All I've done was to ask them what they want, and they'd tell me and I'd go to the park.",recreation
Henry Peña,[00:28:53:20],00;29;08;02,"Park. So the thing I can remember about the program, generally time to time that work late to try and help them up, you know.",recreation
Martha Tórrez,[00:29:08:04],00;29;15;24,"What's the treatment? Do you remember any kind of, you know, how Mexicans were treated at that time?",health
Henry Peña,[00:29:15:26],00;29;45;06,"Well, at that time, no. Mears really was here for time. They had a lot of saying that. No match going to allow you and the first or no time. I don't know what happened, what made them change. But they did take them off in there. I know there was places ahead of time assigned and, I didn't mind at or someplace else.",
Martha Tórrez,[00:29:45:08],00;29;47;23,But not all businesses had them. Then.,
Henry Peña,[00:29:47:24],00;29;50;10,"You know this, sir, and certainly people.",
Martha Tórrez,[00:29:50:14],00;29;53;06,Are you referring to businesses like your restaurant?,
Henry Peña,[00:29:53:08],00;30;15;29,"Like a restaurant stores, barber shop mean? I don't remember no restaurant. I mean, the closest stores. To it. I didn't know that there was a barber shop here, and I seen that 1 or 2, and some other stores, I can't remember.",
Martha Tórrez,[00:30:16:01],00;30;21;15,How did you feel about that? ... personally? Yes.,
