speaker,timestamp,Endtime,words,tags
Martha Tórrez,[01:34:07:19],01;34;23;04,"Do you remember? I know you've described about the Mexican Revolution. Anything else about, like, any of the world wars, civil rights movements, anything like that that you recall.",mexico;conflict
Henry Peña,[01:34:23:06],01;34;30;24,And that about Lewiston... I think we've done a good thing. We're standing out now.,
Martha Tórrez,[01:34:30:27],01;34;31;24,That Martin Luther King.,
Henry Peña,[01:34:31:27],01;34;43;14,"Yeah, I think that's a standing thing that stood up for and that.",
Henry Peña,[01:34:43:24],01;35;24;17,"To do with that change in the world, you know, that this country is back in Europe, or are they changing from communist to democratic, their choice? Well, I think this has got to do with, you. In this war and, golf, I can see where you. I think President Bush done good for what he stood up for in that the whole saying was so.",conflict
Henry Peña,[01:35:24:20],01;35;55;02,"And they believe that God was with him. How could that be? Was a man that local people and kill people? I don't see that. And that's why I know that that the whole world was praying for a true, God hears prayer and I know that that's what gave us victory. You know, that's got a lot to do with so World war.",religion;conflict
Henry Peña,[01:35:55:02],01;35;59;08,"But no, I don't think it's gonna stop there either.",
Martha Tórrez,[01:35:59:10],01;36;08;29,"They you I hope so. I think everybody does believe that. You know, maybe there is something else is going to continue. But we all hope for peace.",
Henry Peña,[01:36:09:02],01;36;42;22,"You know that. But the good word say this when they talk about peace and and all that, when the destruction is going to come up on their show? I hope not, but that's what it says and we've seen it. I just hope that it left till I die. But I sure fear for my granddaughters like that of her, the ones that are going to suffer because of this.",
Henry Peña,[01:36:42:22],01;36;44;18,No more than.,
Martha Tórrez,[01:36:44:20],01;36;49;10,"That. You do believe that it's going to get worse. Yeah, yeah.",
Henry Peña,[01:36:49:13],01;36;58;21,I don't want it to. But what can we do? We got the power or the world on our hands.,
Martha Tórrez,[01:36:58:23],01;37;06;25,"So, Mr. Peña, is there anything else that I might have forgotten to ask you that you would like to add?",
Henry Peña,[01:37:06:27],01;37;41;05,"You know, I think very, very well. One point to what? All the events that I can remember, railroad kill there, which I think it was good for me. I learned a lot of things. I learned how to get along with my fellow man, how to work with people. I've been a foreman. Or, I mean, stuff like that.",railroads and transportation
Henry Peña,[01:37:41:05],01;38;01;09,"I've learned how to handle man, how to run crews and how to lay up a lot of plans on the work detail. For being a dummy, you know, I think I came down quite a bit in my lifetime.",
Martha Tórrez,[01:38:01:12],01;38;05;27,"And, you're very wise man. Mr.. Peña.",
Henry Peña,[01:38:05:29],01;38;14;17,"You know when, like I was saying, when I changed life, I didn't know how to read in Spanish, more or less in English.",
Henry Peña,[01:38:16:11],01;38;45;11,"I learned all that. I ask God for wisdom. And I believe he's the one that gave me all that. Because I know how to read and and try not to read language. Learn that type, know score. And, like, I was a leader in church and have been for some many years. You know, before I couldn't even speak in front of to people like you to.",art;religion
Henry Peña,[01:38:45:13],01;39;22;04,"I was, but I couldn't even speak. I was, tongue tied in no or no small. And I still was still, but, five, 11, 12 at time. I changed one. Has to think I am. I still ask for my protection in my life, even though I'm past 65. I know that small, but. That's a great change in my life.",
Henry Peña,[01:39:22:04],01;39;33;21,"Thank. I've learned a lot in the last 20 years. 30 years. I think I start marketing, I.",
Martha Tórrez,[01:39:33:24],01;40;01;03,"That's I think we all do. Well, every day is a, something a new learning experience for all of us. Well, at this time, I would just like to thank you again for your time. And I always ask this question is in this part of the interview, but it is something that I asked all of my interviewees and that is, what is your opinion of what we are trying to gather as far as history, Hispanic history?",education
Henry Peña,[01:40:01:06],01;40;36;11,"I think it's great. I think I to I think it's fun to do a lot of good and still and good people can wake up and see how people have been taught, how they've been raised, and what they've been through. And, and they'll learn what's gonna come in the future. I think it's a good program. And I sure wish that you can have a good, showing on it.",recreation
Henry Peña,[01:40:36:13],01;40;38;08,Yeah. Thank you. Well.,
Martha Tórrez,[01:40:38:11],01;40;40;03,"Well, thank you again.",
Henry Peña,[01:40:40:05],01;40;40;19,You're welcome.,
