speaker,timestamp,Endtime,words,tags
Henry Peña,[00:30:21:18],00;30;55;14,"Well, I don't know that of money here. I didn't put much attention to it and just thought that was something that they almost all didn't know. But I didn't think too much about it. But now that I see all this rationale stuff for the black people, I think that and say, no wonder they had them signs or offer, you know, and Indians, they never did used to sell them liquor because I wish they never called it breaking.",
Henry Peña,[00:30:55:15],00;31;01;27,"They want to kill. Maybe they thought that about when it occurs to them, but.",
Martha Tórrez,[00:31:01:29],00;31;12;24,"As a identity, did you identify yourself as Mexican or Mexican, American or Chicano? How do what how do you identify yourself?",mexico
Henry Peña,[00:31:12:24],00;31;20;09,"Okay, well, not what I always put white on every report I put...",
Martha Tórrez,[00:31:20:11],00;31;22;19,So when you're asked what nationality.,
Henry Peña,[00:31:22:21],00;31;40;05,"Sometimes I say Mexican. Most time I guess when I had to field, you know, farms or employment, I used to put a line, by the way, again, I have no right to reject.",mexico;economy
Martha Tórrez,[00:31:40:07],00;31;53;14,"Mr. Peña, we were just talking about when you were when you would apply for jobs, you would, as far as, when they ask you for nationality, you were you would identify yourself as a white person. What was the reason for that?",
Henry Peña,[00:31:53:16],00;32;06;19,"Because, maybe, I used to think, well, if they don't hire me, then that, you know, they never did question me about that. Never did.",
Martha Tórrez,[00:32:06:21],00;32;13;06,"Did you have experiences then when you did identify yourself as a Mexican, that they would reject your applications?",mexico
Henry Peña,[00:32:14:20],00;32;38;13,"I because nobody ever rejected. So I put in a lot of color, but I had to fill another application. I'll do the same thing. But, really? But when it came to relate to it, if I was from the United States to claim which match. Okay.",economy
Martha Tórrez,[00:32:38:15],00;32;46;17,Do you recall any experiences when you were treated differently or whatever the fact that you were Mexican.,mexico
Henry Peña,[00:32:46:19],00;33;28;07,"Or one time when you were able to take it on one job, they they gave this job to a white guy and they would collect seniority. And, he had less time or so I gave it to him because. So facial he, he like this kid. He's like his dad was a lot younger than me. And, I used to, you know, when the foreman was gone, they'd call me at all hours and I'd go out and do their very work.",
Henry Peña,[00:33:28:10],00;33;48;15,"And they depended on me a lot. And I say well. That's the way they're going to treat me. Well, I put this complaint against, too much. Right? Permission. Did they say no? Was there no right in, on that case? So it was discriminating against.",
Martha Tórrez,[00:33:48:18],00;33;51;02,So you took this case to court and you won.,
Henry Peña,[00:33:51:08],00;33;52;08,Yeah.,
Martha Tórrez,[00:33:52:10],00;33;55;10,They get did they give you the job and the result. Yeah.,
Henry Peña,[00:33:55:13],00;33;59;18,They gave me the job. And back difference in pay and stuff.,
Martha Tórrez,[00:33:59:19],00;34;07;07,I think that's great. It would would you say that was the only that experience you had that.,
Henry Peña,[00:34:07:07],00;34;50;08,"You know all that was in another case. But this was this other guy was, you know, he was a union. One was this union storage brother. And he knew that I put this application in for a truck driver. There was another truck driving job, so he found out from his brother. But my dad was that day I put this application in and so what they'd done, they said, well, what I'll do, I'll put an application 1 or 2 days.",labor;family;economy
Henry Peña,[00:34:50:11],00;35;21;25,"Oh, what? He put it. So he done that to that to don't. But I never did quite that because I know this guy. But, it was my friend and, and he, he showed me around about where all the men. I said, well, something happened. I'm a great believer in that. God kinda. I'm the same God and I'll carry revenge on him.",
Henry Peña,[00:35:21:28],00;35;32;15,"But this one time, just in God's hand, you know, run after me about a heart attack. You know, that day job. Oh, okay.",
Martha Tórrez,[00:35:32:17],00;35;35;07,So you felt. Did you feel angry or anything?,
Henry Peña,[00:35:35:07],00;36;00;24,"No, I don't feel angry. I just happened to think that last or that freedom to work here. Same thing that you believe it's possible or what? Change possible or man, it's possible or God shot. But there's one time or this other deal. Like I went ahead because I know what you're saying. Just. Yeah, to do it.",
Henry Peña,[00:36:00:24],00;36;06;08,"And this one guy, I could tell that he was prejudiced. I said, I'll tell him.",
Martha Tórrez,[00:36:06:08],00;36;08;17,I wish it was this in the railroad.,railroads and transportation
Henry Peña,[00:36:08:20],00;36;35;00,"Yeah, this. Yeah, it was true. And, you know, that's that time I did well, in that case, because I wouldn't do anything, you know that I know I don't know that I would have, you know, a test for me, but I truly that's what happened to this guy. And he was a foreman. And his grandfather, he's the one that I've done that.",education;family
Henry Peña,[00:36:35:00],00;36;44;21,But in the interstate gang. And I had the command that put the application that I had had to write.,economy
Martha Tórrez,[00:36:44:23],00;36;50;09,"When you referred to gangs, you mean what we would now call maybe a crew of workers?",crime
Henry Peña,[00:36:50:13],00;37;34;02,"Yeah. Crew. That's right. Gangs before nowadays they call the extra gang from eight man. From under that section in take care of certain miles of track. Extra gang. They go through the district and they have to go. They don't go over there that they leader goes down. So that's the way they work that. And now they got system gangs, which if you go on that gang, you've got to go from here down or Seattle and clear up then great for you people.",crime;health
Henry Peña,[00:37:34:04],00;37;36;08,So it's a system.,
Martha Tórrez,[00:37:36:14],00;37;52;19,"So these are the different categories of workers... Mr. Peña, as a result of the discrimination case, once you won and you were able to get that job, did you feel that you were treated any differently after you got that job?",
Henry Peña,[00:37:52:22],00;37;55;15,Yes. There was a change. There was a change.,
Martha Tórrez,[00:37:55:18],00;37;56;27,What kind of change?,
Henry Peña,[00:37:57:02],00;38;06;23,"Filed it or never tried to ask for a job or whenever I go to them, they agreed and.",
Martha Tórrez,[00:38:06:25],00;38;09;03,So the change was positive.,
Henry Peña,[00:38:09:05],00;38;39;10,"Yes. Okay. Yes. And they don't do that no more. Just like when I went out, engineering. That's why they done it, you know, because fake news. I think the government put a law in that they had to hire so many minorities. I think it's by not, retaining. So I was the first one here. So they call me me.",
Henry Peña,[00:38:39:16],00;39;07;10,"They didn't have no minorities on this book. Right? Mean there was some already work in my state. There was, college graduates. And I grew up in Spanish, too. And I really got in touch mentioning he's an engineer and he's, my nephew. She like me at school, high school education. I don't know if you went to college.",railroads and transportation;family;education
Henry Peña,[00:39:07:13],00;39;26;00,Remember? But he he was already working when they called me. And there was someone that I had to take their name there. One more Spanish or two more Spanish. Spanish.,
Henry Peña,[00:39:26:03],00;39;31;18,"And then from there on, they start hiring more minorities as well.",labor
Martha Tórrez,[00:39:32:08],00;39;49;15,"Do you recall any I know that you mentioned Mac Lópezand Frank Chavez also working for the railroad. Do you remember them ever having, a situation where they experienced discrimination, such as you did?",railroads and transportation
Henry Peña,[00:39:49:17],00;40;02;14,"No, I don't if they did, they know it came down in the, you know, did find out about it. So.",
Martha Tórrez,[00:40:02:16],00;40;24;25,"Well, Mr. Peña, moving along here, I'd like to go on into the different I know that your background is absolutely extraordinary, and I'd like to get, you know, a lot more about it, but I would also like to know a little bit about your education. You did attend school. How many years did you attend Second Doctor?",education;health
Henry Peña,[00:40:24:27],00;40;25;28,Six. Right.,
Martha Tórrez,[00:40:26:00],00;40;35;04,"And when you attended school, this was in the state of Colorado. Colorado? What do you remember about school? Can you describe your earliest memories about school?",education
Henry Peña,[00:40:35:04],00;41;09;01,"Well, I tell you what, I used to shoot a lot. And I think I thought I was smarter than a teacher. I guess when I had spelling or I know she'd have it down and order and, you know. So I copy the word from in my desk, and the question was given the word sorry, like I was frightened, you know, when she was then she'd say, okay, hand your papers, send them up the front row.",education
Henry Peña,[00:41:09:21],00;41;39;11,"That I dropped my mine, and I slid this one out and put this. So I did 100 every time, so that didn't help me much. So when I was on the street and honest, you have a story. By not learning to spell, I start. I learned that and, mathematics. I used to do my best by writing it to get a grade someday.",education
Henry Peña,[00:41:39:13],00;41;48;04,"I know that I had to use that sometime, but history, I damn state. Imagine. Madison.",
Martha Tórrez,[00:41:48:06],00;41;51;15,How would you say you get in school overall?,education
Henry Peña,[00:41:52:04],00;42;16;16,"Just to do, you know, an average, I'd say my dad pass every year. But one year that was scheduled from that 50 to 60. I was on six right when we came to Idaho. And in that calendar year I did pass. I used to play two nights in class.",idaho
Martha Tórrez,[00:42:16:18],00;42;19;24,"After you came to Idaho, you didn't attend school anymore.",idaho;education
Henry Peña,[00:42:19:29],00;42;51;15,And I went to a planning school at high school. But I was just short course. Why not trying to study because I until much I think I was doing good after that. I don't even know when I come back. They're still here and Nampa is engineer discussed in the case. I got 100 down there. That's what helped me to run their sentence for about six months.,education;nampa;railroads and transportation
Henry Peña,[00:42:51:17],00;43;23;29,"Year. I used to make trips from here in Boise and we which and that made it from here. That whole day on Marsing. So I was there six months and one day send me to Cheyanne, and I said, well, why don't you give me just a job here, maybe on the ranch as a hustler, you know, they also has such a straight range from the ranch house to where the freight trains are.",boise;agriculture;marsing
Henry Peña,[00:43:24:01],00;43;36;12,"I don't that anybody can do that in the yards. Just but 2 or 3. That was the more friendly lunch for us, which was a decent knowing. Is that or learning at all?",education
Martha Tórrez,[00:43:36:14],00;43;40;09,Did you have to go out of state a lot when you worked for the railroad?,railroads and transportation
Henry Peña,[00:43:40:11],00;43;52;13,"What are you doing on the.... When I was an ex trying to do better, go for went to Oregon.",
Henry Peña,[00:43:52:15],00;44;07;24,"That's one of their rules. They got to to go for that, which was one chatterbox. That, that school history. But.",education
Martha Tórrez,[00:44:07:27],00;44;15;24,Would you say that do you remember any of the other teachers that stand out in your mind and school?,education
Henry Peña,[00:44:16:27],00;44;19;11,"No, none of them, I hate them both.",
Martha Tórrez,[00:44:19:13],00;44;21;14,So you didn't you didn't like school?,education
Henry Peña,[00:44:21:29],00;44;55;14,"I guess not, I guess not.. But afterward, I did like it. Sometimes I felt like on that one day I can, I'll just, already gone this far. I'm sure I'll stay the course. I don't mind, college. I could see where school is. Good, but my boys go home. Is gone to college, and, O'Connor got a job.",education
Henry Peña,[00:44:55:14],00;45;30;12,"Was a railroad right of way. So he stayed within Asia. No more. No great migration. Or he went to a high school, but no college here on a tower over here. And then for Indian preachers, only 1 or 2:00. And it worked for I can read your books, but I wish one bank came. Boys. But I see work.",railroads and transportation;migration;education
Henry Peña,[00:45:30:14],00;45;56;24,"But they tell me, boy, we work hard. Our mind just too much pressure. And I show get schooled in the help. Too much so that I'd rather be working out there driving spikes and stuff to mind that bad. And this Ray he at that job in Omaha and they say, boy, that you say I hate this job. Yes.",
Henry Peña,[00:45:56:24],00;46;18;13,"So just sitting there and everything you say. But while your mind is, of course quiet or much both quiet and temperate stuff, he was in that right when I went to this engineer school. I used to get headaches and too much work.",railroads and transportation;education
Martha Tórrez,[00:46:18:14],00;46;25;21,"But when you went to engineer school, did someone provide that education for you?",railroads and transportation;education
Henry Peña,[00:46:25:28],00;46;53;04,"Yeah, right. Everything. I paid them for the railroad. Yeah, I think I was told stuff. That's why I went or else I wouldn't, never made it. And then, they, they said I could have gone back again, but took time, you know, stayed in the books and I could have, could be an engineer. But then they wanted that, touching.",railroads and transportation
Henry Peña,[00:46:53:07],00;47;21;14,"I was, but I am a great believer that I, I didn't want to leave my kids and my wife, but all I could have been Christian or Roadmaster or something, like making big money. But you're always that way. They never have. And I know and guys that are away from home and stuff, they always buy another woman. But, a whole lot of them to it.",family
Henry Peña,[00:47:21:17],00;47;45;24,"So I don't believe on that. That's why I know that. I learned earlier Spanish and American English and, mathematics. So I asked for this time in computer science, so I learned Spanish. I didn't know on the first time.",technology
Martha Tórrez,[00:47:45:27],00;47;50;09,Did you speak? What did you speak at home growing up?,
Henry Peña,[00:47:50:21],00;48;11;10,"Mixed English or Spanish? Most. Mostly. Okay. That's why I say why you people never talk Spanish. I probably don't talk, but I'm not trying to pretend. ... They say it's your fault so you can learn in that school.",education
Martha Tórrez,[00:48:11:13],00;48;16;08,I do believe that that knowing two languages is important.,
Henry Peña,[00:48:16:13],00;48;42;18,"It is, it is. I know it is the best I've learned. I think Spanish, I know a lot of Mexican people that I know why I think they're, you know, real quiet people in their top Spanish. You will have a pattern of that coming up. They're really mad, as I say. Yeah, but.",mexico
Henry Peña,[00:48:43:00],00;48;46;05,They they really surprise.,
Martha Tórrez,[00:48:46:08],00;48;58;19,What was the other subject I'd like to get a little information about? Is the community. Why did you choose to live in this community in Nampa? Yes.,nampa
Henry Peña,[00:48:58:29],00;49;27;26,"Because the way we was treated, people were friendly, you know, like some nice, clean little town. But now it's getting too crowded for me at that time was just about 9000 people. Right now, I don't know. I tell my wife, I want to get out here when, she retires for several months. Charities generally care for your kids.",family;health
Henry Peña,[00:49:27:26],00;49;38;05,Don't come and see us anyway. So I stay here. What are the ones that have to go on sale? They're converted into oil for that.,
Martha Tórrez,[00:49:38:08],00;49;40;10,Where would you go if you left Idaho?,idaho
Henry Peña,[00:49:40:12],00;49;54;14,"Yeah, well, I think I've gone to a nice, warm place like Saint George Street. It's an excellent place for. It's place like that, you know.",
Martha Tórrez,[00:49:54:17],00;49;56;22,Do you own your own home here?,
Henry Peña,[00:49:56:24],00;49;59;01,Yeah.,
Martha Tórrez,[00:49:59:04],00;50;03;14,Or do you belong to any organizations?,
Henry Peña,[00:50:03:17],00;50;24;23,"No. Just, belong to the old time all time. There seem to. Go to start church. And so they. You know, I'm still in the movement. Cleaning lady. It's about here.",religion
Martha Tórrez,[00:50:24:26],00;50;32;17,In the state of Idaho. Which would you. Which city would you say is the one that you would like to live in the most?,idaho
Henry Peña,[00:50:35:29],00;51;05;19,"I like third or fourth class. I like that place, but just seems to be too bad I left it once. I, what kind do I like to say? Well, kind of expect river fishing or. I like fishing a lot. That's. I want to make sure that anchor in the middle class or approach to them, that they're in one place.",recreation
Henry Peña,[00:51:05:19],00;51;08;27,But fishing is one of the.,recreation
Martha Tórrez,[00:51:09:00],00;51;10;13,So how did you learn to fish?,
Henry Peña,[00:51:10:20],00;51;11;15,,
Martha Tórrez,[00:51:11:18],00;51;13;11,How did you learn to fish?,
Henry Peña,[00:51:13:13],00;51;39;11,"Just by going out and watching people. Oh, we came to Idaho to ask me for their brand. We used to like fish there, but that time was a lettuce, so I stole it. I never leave it overnight in case the next morning. Which is real, I mean. But now they don't let you do that. But then I learn by watching people fish fishing.",idaho;recreation
Martha Tórrez,[00:51:39:13],00;51;42;26,It wasn't anything that you did as a child.,family
Henry Peña,[00:51:42:28],00;52;02;04,"No, we never had anything that that we couldn't buy stuff to do. It. We were all fishing. It had to be an open wash, regular stream and try it that way. But we never did it. No way to buy hooks first.",recreation
Martha Tórrez,[00:52:02:16],00;52;06;07,What do you remember playing? What kind of games you just play as a child?,family
Henry Peña,[00:52:06:10],00;52;16;24,"Well, we played cowboys and robbers, right? Hide and go seek... musical chairs.",
Henry Peña,[00:52:16:26],00;52;37;09,"Cowboys and a lot. I even showed my brother, you know, our heroes of one on in the paper. You heard about cowboy. You go on to tell my brother I didn't know that that was loaded. I guess that's where they got that song. I didn't know that much.",family
Martha Tórrez,[00:52:37:11],00;52;38;25,And what happened.,
Henry Peña,[00:52:38:25],00;52;55;06,In that one? My brother. Let's see who dies first. So I turned around the whole $1 trillion turn that I was a bullet in there. So I got it just one eighth of an inch and hit his heart. Just went through of space.,family
Martha Tórrez,[00:52:55:09],00;52;57;11,How old were you when this happened?,
Henry Peña,[00:52:57:14],00;53;02;26,I must have been a nine but ten years.,
Martha Tórrez,[00:53:02:28],00;53;04;06,And your brother?,family
Henry Peña,[00:53:04:09],00;53;10;14,"He was, Okay. 13, 12 or.",
Martha Tórrez,[00:53:10:17],00;53;12;15,What happened after he shot him?,
Henry Peña,[00:53:12:18],00;53;39;24,"Well, I got scared, so let's. And now you it go get a doctor within a local nurse. And I thought of the farmer's place. He lived about a mile, so I took off running. I got there and the doctor say, farmer seen me cry and say, I want it to. And I says, I shot my brother. And why is he dead?",health;recreation;family
Henry Peña,[00:53:39:24],00;54;07;18,"I said, no, he's not dead. Says Bleeding a lot. So I'll call the doctor saying, yeah, that's why I came over. Doctor took about an hour to get there from Carlisle Grand Junction. That was about eight miles out there in the farm. Seven thing. He got hit or bled to death, but he saved me. And, you know, that was.",health
Henry Peña,[00:54:07:21],00;54;35;12,"We don't play cops and robbers no more than my sister would had. I know well, sister. And they call it ... about sixteen feet deep and five feet wide. Yeah. And we'd play, you know, see, hold, hang their longest cheat fragments from our feet and anguish down looking at the water.",family
Henry Peña,[00:54:35:14],00;54;45;21,And we’de holler that’s enough and she would haul us out. And I say who on who stayed the longest call I get a drop dropped as they go down there.,
Martha Tórrez,[00:54:45:25],00;54;49;14,"Oh, those were scary games you played.",
Henry Peña,[00:54:49:17],00;54;54;29,And there we. We didn't know any better.,
Martha Tórrez,[00:54:55:01],00;54;56;13,Did your parents ever see.,
Henry Peña,[00:54:56:13],00;55;25;18,"That dad wasn't married yet? But after that was after mom died? No, they never seen us. Dad, I seen that doing that later. And he used to read as bankers. We when we used to do some naughty or play game. That's where somebody got hurt. We knew our sister was going to tell him. We know when it was going to get a spanking.",recreation;family
Henry Peña,[00:55:25:18],00;55;34;12,"So we get a promotion, right? And got it wrong and turnings all around us. So what occurred?",economy
Martha Tórrez,[00:55:35:11],00;55;37;02,How old were you when your mother died?,family
Henry Peña,[00:55:37:08],00;55;43;03,"Oh, no, I think I was, eight, 7 or 8.",
Martha Tórrez,[00:55:43:05],00;55;45;27,Then how did she die?,
Henry Peña,[00:55:45:29],00;55;58;05,And that she thought she was witchcraft? You know witches got her? Glad that woman died. They finally found out who the witch was.,
Martha Tórrez,[00:55:58:08],00;56;01;26,Why did she think that? Yeah. Why did she think it was?,
Henry Peña,[00:56:01:26],00;56;28;04,"It wasn't her. It was dad knew who this witch was. So one time we watched when she left home and they went through one of her trunks. She had all kinds of dolls in there with pins in it. So what dad was took out that trunk and burned it. And after that, nobody died, you know.",
Henry Peña,[00:56:28:11],00;56;47;11,And there was just a woman that night when we figured that she was jealous of those crazy good husbands. And that was right. All the the men that lost her might say it was good husbands. They never had no trouble with their wives.,
Martha Tórrez,[00:56:48:07],00;56;51;21,So your mother became ill. And what? In what way did.,family
Henry Peña,[00:56:51:24],00;57;19;25,"She, she start losing weight and, you know, like, person that got tuberculosis and stuff like that. Some think that that's what it was, but Dad thinks different. You know, that time there was a lot of that going there in Colorado. All right. And after that happened, but that done it all stopped",
Henry Peña,[00:57:19:27],00;57;35;25,"That's why he thinks that, you know. But the doctor never did say that he had that TB or. But that thinks that's what I was that’s where momma went.",health
Martha Tórrez,[00:57:35:27],00;57;44;07,You were fairly young. When this happens what do you what do you remember about those hard times after your mother died?,family
Henry Peña,[00:57:44:10],00;58;14;15,"Well, I know that we in our sisters, they took care of us for a while. My older sister was 14 or 15 and a sister, older than me. She was 9 or 10. And they learned to cook, you know, mama, children or a cook. And so they took our list of that back. Married. And we I talked and we, we sleep on the floor.",health;family
Henry Peña,[00:58:14:15],00;58;28;17,"You know, last mornings, all three of us would lay a horse blanket on the floor and we would cover ourselves. We horse blankets, okay.",wildlife
Henry Peña,[00:58:28:20],00;59;00;11,"And it's a hard time, but heck yeah, once stole for too long the whole house of Kokomo still. So at night we fire that up and got to the house from. That last till morning. And in the morning we had chance to get up and fired up. Okay. And get the house while she always got up and going about having food.",
Henry Peña,[00:59:00:16],00;59;34;23,"I don't remember starving yet. That always provided he he used to work like hard, kidney stone and pay day. You know what year was $30 a month? And used to go buy all that washers when needed and stuff. So it left till next payday. But he's back to make himself better. Safe or not, honey. And, Yeah, I don't remember starving.",food and drink
Henry Peña,[00:59:34:26],00;59;43;15,"You know, we had chickens and farmer gave us the milk, too. So we had our own age.",food and drink
Martha Tórrez,[00:59:43:17],00;59;47;10,What was your favorite food? Meal.,food and drink
Henry Peña,[00:59:47:13],01;00;00;03,"Mean meal? Potatoes. I still like potatoes, but candy? Now, kind of. Kind of my diabetic system. Potatoes, beans, and sopa.",food and drink
Martha Tórrez,[01:00:00:05],01;00;03;23,What kind of sopa?,food and drink
Henry Peña,[01:00:03:26],01;00;05;04,Let's see. They're yours.,food and drink
Martha Tórrez,[01:00:05:06],01;00;08;00,That's like the real thin spaghetti?,food and drink
Henry Peña,[01:00:08:00],01;00;17;13,"Yeah. And, Dad used to make it and sisters make it with hamburger, makes it. And that’s about it",food and drink
Martha Tórrez,[01:00:17:15],01;00;19;12,"So, did you eat a lot?",food and drink
Henry Peña,[01:00:19:14],01;00;24;26,"Yeah. No, not at all. Yeah. No bread. We couldn't afford,",food and drink
Martha Tórrez,[01:00:24:29],01;00;26;07,Bread was more expensive.,food and drink
