speaker,words,tags,timestamp
SS,There was a cookstove in there?,,
MLL,"There was a cookstove, but a wood burning stove and that's what most of the girls were used to, so that wasn't too bad. They all had to cook little dabs of stuff on this one stove. Because they didn't cook quantities, they cooked small amounts, you know. But they learned sti tches first, you know, how to sew, and using a thimble. And they had to wear an apron to cook with. And they had to learn- well, accepted customs that weren't always- and that was one of the problems of being ateacher. You had to remember things that their mother did. you mustn't talk down- that was important, like tasting out of aspoon you were stirring with. Most women did that in the homes, but then the girls had to learn you didn't do that; that wasn't sanitary and you didn't taste, you had aseparate spoon to taste with. And Idon't know how they came out at home. Ialways hoped they didn't criticize their mothers too much, because Iremembered about my Johnny cake and other things that Ididn't approve that my mother had done, you know. And that's abad age, that teenage group. But they learned to make basic- there were no package products in those days, we taught basic recipes. How to make everything- as we call it nowdays- from scratch. They learned to can.",,
MLL,"We always did that in the fall first and atown like and it must have been the same when my sis ter taught here- the problem of getting something to work with was very difficult because the stores didn't carry any fresh produce, you know, and getting something to can with was problem. Was canning by that time being done by the rural woman? Oh, yes. Gracious, women had always canned. The methods had changed alittle over the years. My mother canned what we called open kettle. When it was cooked in akettle and then poured into ahot jar with a knife stuck in the jar so you didn't break the jar and then sealed; and hopefully it kept. And that was fair- the jar was boiled firstit was fair sterilization. But in my teaching day then, we had pro gressed to the waterbath canning. And we just did fruits. We never taught them to can- I never taught them to can- - high school girls use the pressure cooker. Although the pressure cooker for vegetables was already the accepted way.",,
SS,The knife stopped the jar from breaking?,,
MLL,"Well, that was the theory. I guess it does do- what does it do? I don't know exactly what it does. Two-quart jars, you would put a silver table knit in there, and something about the metal-",,
SS,"Yes, I had heard it before.",,
MLL,That was an old accepted— But we taught waterbath canning. That is where you filled your jars and put on the lids and thftft boiled them. Brought the water to a boil and boiled them a certain length of time.,,
SS,It seemed to me that canning at some point got real popular. I don't know when that was.,,
MLL,"Well, canning goes way back, but it used to be more preserving because didn't know about sterilization. They used, oh, like some of these brownstone jars I have out here, were canning jars, and they were sealed with wax. In order to keep them it had to be pretty sweet, it be more like, a preserve. Or, they used lots of dried fruit in those days, too, way back then.",,
MARVIN L,Canning never got real popular til these jars come in.,,
MLL,"Well, but some of those jars were introduced in 18— what's that one that has the date on it? 188- something. '89. we have out here, right in the glass.",,
MARVIN L,Your selfsealing-,,
MLL,"Oh, well, there were lots of kinds of jars, of course, patented after wards. And now we use the selfsealing lid. But those others kept, too.",,
SS,Were they selfsealing at all then?,,
MLL,Yes. There was one called Economy jar? that had a clamp. That's been discarded since.,,
SS,Was that the common one at that time?,,
MLL,"That was one of them. That was a wide mouthed jar, that was very popular. And then there was the Schram jar, at the time I was teach ing, it had a selfsealing lid. And that one didn't last too long. And then the Kerr people came out with this two-piece lid, which is the one we still use. But the Mason jar that had the rubber and the zinc lids were the old-time and of course they can still be used.",,
SS,"Well, you mentioned the way that their mothers did- now I know this sounds kind of naive, but, I was thinking the way things were passed on in the early days- the earlier days- I would imagine the oldest kids would have grown up learning how to do- how to cook and how to sew just seeing their mothers do it. Isn't that true?",,
MLL,"Yes, that was true. But it improved over the years because companies would come out with something new and they would have instructionsfor instance, there was a steam cooker that was very popular over a certain period that you put on top of the stove and there was water in the base and it created steam. Conservo Cookers, they were called. Then later they were abandoned as not being a safe way to can things, but the waterbath was safer. But the company would come out with in structions and so then there was a new canning methody you was introduced by the company that sold this contraption. And that's one way.",,
MLL,"Like cooking, too. Didn't the kids come in knowing how to cook pret ty well?",,
MLL,"A lot of them didn't know very much about it. No. They had helped their mothers but they didn't know basic cooking very much. And we taught them a little bit of the chemistry side- you know very elemen tary, but understanding of baking powders and why jelly would jell and things like that, that maybe their mothers didn't understand either They just did it.",,
MARVIN L,Want to be careful how you talk now-,,
SS,What about the balance,,
MLL,"Yes, we did that, too, We studied— there were vitamins already when I started teaching. Not as many as we have new and not as great an understanding of them, but we knew the diseases that resulted from a lack of Vitamin C and Vitamin B and Vitamin A- those were t he three. And a little about Vitamin D. And we knew there was a Vitamin E, but there wasn't very much known about it yet, at the time I started tea ching. And now the B has been split up a lot and it's all different. It's quite a lot different now, nutrition is, but we knew- they had to learn that the protons and carbohydrates and fats made up the diet plus the citamins. Yes, that was all part of our study in 1924, when I started teaching.",,
SS,"Did you feel then, or were you taught on that, that the old ways were usually the best, or was it taught that there was a whole kind of new— a lot of new ways that were progressive, that should be done instead of the old ways?",,
MLL,"Well, a lot of- there were a lot of false ideas about foods- putting foods together and all in our college training. One of our teachers was real good, and so it was real good and made it interesting. All these things - and we grew up that way, too. My mother wouldn't let us eat cucumbers unless they were soaked in salt water, and you couldn't have cherries and milk together. Well, those things were all proven false, you see, they were old- theories- not theories, but old ideas that people believed in. And there were a lot of those things. We tried to teach, too, that those things had been accepted, but they had been proven false. Now, in a small school like either where my sister taught here or when I taught at Culdesac, you didn't teach just home economics. That was before any consolidation. It was,a small school, there were just four teachers in high school. And so we had to teach all kinds of things. And most of them we weren't very well pre pared to teach.",,
SS,"Like, what else did you teach?",,
MLL,"Well, I hate to tell you this, but I had to teach Latin. Had to have Latin in school then in those days, and all I had had was high school Latin. So it was pretty rough, because I wasn't a good Latin student, you know, just a couple of years in high school, you don't get too much and I hadn't had any since then. But, that was one of the things that was required in high school in order to go on to college. And a lot of these kids hoped to go on to school and they wanted Latin. You know it was a requirement, I think, if I remember. I had a big class. First year Latin wasn't so bad, but trying to teach Caesar was really something. Are inexperienced teacher like I was. But those are the kind of problems. I taught history; I taught one course in history, Now, I hadn't had any college history and very little high school his tory. And what else did I teach? I had girls' basketball and by then the girls had- were playing other teams in Idaho. We would go on trips. That was great fun. But I wasn't trained in physical education at all, just what I knew from my high school days, and then, of course, we had it in college, too, but that wasn't my major. And then I had— I taught glee club. And I had belonged to the women's glee club in college and I had taken some voice and had always sung in the church choir, and so that wasn't too hard to do in a small school like that. What they expected of you wasn't very difficult. Let's see, I taught something else, too- I can't think now what it was.",,
SS,"It sounds to me like taken together, having to do all these different activities- some of it you really weren't prepared for-must have made it a very demanding-",,
MLL,"Oh, yes, terrible. But you didn't know it at the time that that was terrible! (Chuckles) You just expected to do it. All the teachers were doing the same thing, and there was no one that was teaching just what they were trained in, I don't think. Possibly the English teacher had- she didn't have to teach anything else, the rest of us did.",,
SS,Did you feel sometimes that you were doing- that you were really not doing the job that you should have done?,,
MLL,"I was always terrified of this Latin. But I'll tell you somethingyou never know- you don't know what you're accomplishing when you work with young people that age. And it comes back to you fifty years later. I was to a reunion at Culdesac, a fifty year class reunion, and one of the boys I had had in Latin had gone on to college and had been teaching at Dayton. He was an English teacher and I said,- asked him how he liked teaching. He was a real nice boy and I'd been very fond of him and he said he liked it, it was just great. And I said, ""What do you teach?"" And he said he was an English teacher. But he said, ""I wouldn't have been able to teach English if I hadn't had that Latin class "" you."" Fifty years later he told me that. And all these years I had worried. Do you see what happens? You don't know. Ap parently I gave him something. Something that he needed to go on and understand- don't know whether he ever took any Latin in college. I didn't ask him that. But he was a bright boy and apparently he got something, even though I wasn't a good teacher. You don't know what influence you have on children. That's one of the great things about teaching. One of the greatest things about teaching. If you live long enough to see some of these students later. I got my first Christmas card today and we had attended a golden wedding this summer in the park of one of my students at Culdesac in the first year of teaching, and she said in this card, ""I'll never forget what you taught me in sewing."" And she said, ""I wish my granddaughter could have a teacher like you."" See, that makes it all worthwhile, even though you think you haven't accomplished a thing at the time, but you did. You influence them. I taught her remodeling and she needed that as her children grew up, she told me.",,
SS,Remodeling?,,
MLL,"Oh, that's make-overs, we called it. Making over clothing, to the ex- tent that all families did that in those days.^ So when she had a fa mily, she needed that because their income was low and she had learned that in my class, she says. That was one of the things that I knew how to do.",,
SS,"When you were teaching those kids, did you have any ideas in mind about how- what you were trying to accomplish? Whether or not you knew if they were learning and that sort of thing? Could you tell whether the kids were really learning what you wanted them to?",,
MLL,"Oh, I think so. I don't know. We didn't evaluate things quite like they do nowdays. But, yes, I think I knew. And you could tell in work where they clothing and in the foods work, you could tell the results, if they had learned it or it had turned out bad,^you could tell that, of course. But these testimonials fifty years later, that's convincing- that you really did something after all, when you thought well, maybe, did I help them? You're never sure.",,
SS,"Were they in groups as much as they seem to be now? You know, it seems like nowdays that they're really get together more than they are indi viduals, when they are at that age. At least that's how it strikes me. I just wondered.",,
MLL,"Well, in a little town they're all together; little town like that, the kids are real- they do everything together in school and out? you know. They have particular chums, but there would be two boys that would be pals, but then they did everything together. It was afun group. Oh, I thought it was great fun. I enjoyed it immensely; I was young, I was only twenty. (Laughter) Iwasn't much older, 1had one girl older than Iwas, in fact. Iwasn't much older than some of the kids.",,
SS,"Would you have one grade at a time? Would your class be one grade, or would they be two or three?",,
MLL,"Well, now like in Latin, the first year Latin was freshmen, but in home economics, it seems to me it was more mixed. I don't think it necessarily was just freshmen that would take the beginning work. It seems to me- I'm not real sure, I can't remember for sure about that. Was there more than one class in home economics that you taught? No, Ijust had one. It was just asmall school. And one year Ihad some boys that wanted to take it, I think Ihad four boys. And they were real good. They had to wear white aprons, too! (Chuckles)",,
SS,That's interesting.,,
MLL,"They wore sort of butcher- type white aprons. Of course, boys are taking it a lot nowdays.",,
SS,Do you think it courage in those days for boys to take it?,,
MLL,"I don't exactly remember why they took it, but they wanted to and the class wasn't filled up. It was such a small school that there weren't always enough girls to make afull class, and so we let the boys take it And they were real good at it. And of course, that doesn't hurt boys any to learn to- they didn't do much sewing, but they did the cooking part. Ican't remember much about the sewing part that I taught them. I taught them some things about pressing clothes and darning and things that boys would need to know, but clothing construction, I don t believe they did much of that.",,
SS,Were you shocked when you first got there and saw that you didn't have any equipment to work with?,,
MLL,"No, I don't remember that I was. I don't know whether I'd been prepared- I can't remember that I was prepared for that exactly. But I'd never seen a department where there wasn't anything. And I was always adven turesome and I was willing to try. I taught there three years and then I went to Omak and that was a much bigger school and they had had an economics teacher but they didn't have much of a department either, and they had me put in a good department. That was one of the things I did while I was there. We started a real good-",,
SS,They gave—,,
MLL,"Yes, equipped, well equipped. In this first instance t he school board had to be convinced first, you see,it was important to put up any money for anything. And I had to convince them that the electric sewing ma chine was needed.",,
SS,Did you have to go to the board yourself?,,
MLL,"Well, no. But then in a little town you soon got acquainted with them. The depot agent was one of them, and we all got acquainted real quick! And they knew the teachers, they saw to that that they got to know the teachers. You know, through the church and through the outside acti vities .",,
SS,You said when I was here before that the teacher in the community was very important.,,
MLL,"They expected you to stay there and work! I di .rected the choir in the church, extra. I'd always sung in church choirs, and that was fun, too. And we had a quartet. The druggist was the tenor, the banker was the bass and the superintendent's wife was a good soprano, and I sang alto. And we had a honey a quartet and it was great fun.",,
SS,Where would you sing?,,
MLL,"Oh, church. At the church. And sometimes other people would be in the choir, too. but when you had a basic choir like a quartet, you know, that we could all sing, it made it real interesting and nice. The men loved it; this banker and druggist, they always came to prac tise.",,
SS,Were there other activities that you were expected to take part in?,,
MLL,"Well, there was PTA, and that was a bitter headache in those days.",,
SS,I didn't even know they had it.,,
MLL,"Oh, yes, there was PTA and the teachers hated it, but it didn't amount to very much as far as was concerned. It was more just a social evening and teachers were bored to death. There was never any issues or discussions of any account. It was mostly the parents- it was a chance to meet the parents if they came. But we certainly didn't like it we had to go.",,
SS,There were parties and that sort of thing- were you expected to go to them?,,
MLL,"Well, there wasn't anything that you were expected to go to except the high school parties. And they had public dances and they didn't object to you going to those if you wanted to, but that wasn't- that was your own business. If you wanted to join a lodge; there were 1 odges. There was Rebecca Lodge. And we thought it was a good policy. We joined; we didn't know anything about it, we were too young to be good lodge members, but a couple of us did join it. And the Ku Klux Klan was quite strong and they sent us invitations. We were scared not to, and we were scared to-",,
SS,To what? To go?,,
MLL,"To join. Ku Klux Klan was real strong at that time around. But it was a two-sided proposition, you know. There were some people against it and some for it, and we were afraid we'd lose our jobs if we didn't, but we didn't. We never joined. But we got these invitations through the mail, and we didn't know what to do. We didn't know- you don't know who belongs 'We didn't know who to talk to about it and it was real tricky, but we ended up not joining; this other teacher and I that got invitations. Course now, Iwould know better how to deal with athing like that, but then we just wanted our jobs awful bad, and we were just going to or else.",,
MLL,But nothing ever happened? Nothing was ever said?,,
MLL,"No. No. No, they never followed up and forced us to join or anything. One person that I spoke to, that has really looked at it more in the way that you were saying that you had to try to do what you had to do to keep your job and to please them, and she made sound like it was really rather difficult sometimes to do that. To keep them satisfied. Inever had any trouble. Iliked all these people and Iliked all the kids and we had fun. And Iwas too far from home- Ilived at Pullmanbut it was too far in those days to go home except just for cations- Christmas vacation; Thanksgiving. So there was no problem with me staying there weekends, and it was fun to have things to , kids would take us on picnics and things, you know. Ihad areal good time. You didn't feel like your conduct was subject to too much inspection? but there was no problem because I didn't We knew very well it was, the things that they said you couldn't do. Ididn't smoke; not many girls did smoke yet, but there were some and they.would have been out if the school board knew they smoked. That wasn't allowed. But that was no problem with me because Ididn't. And they didn't object to us going to the public dances. Iboarded at aplace where there was quite agang and we'd all go together. And they didn't object to that. I did work in the church, which made me acceptable! (Chuckles) And they liked it because I was used to tioing that. But they did- there were things they would have censored you for.",,
SS,"How would the situation compare say, to the school at Quincy or at Pullman in-",,
MLL,"In that same time, you mean?",,
SS,"Yes,",,
MML,"Well, it compared-",,
SS,I mean when you were going to school.,,
MLL,"Well, at Quincy, I think they didn't have home economics, but schools about the same size- no, the Quincy school was smaller. The graduating if class at Culdesac were bigger than my sisters and brothers had gone through, but I was in a lower grade at that time. But the Pullman school was so much bigger that there was no comparison, really to ac tivities. The Culdesac had a strong athletic program, they'd hadbasketball was ajbig, they didn't play football, but basketball was big. And supported by the town and it had winning teams in the past, and it was the important thing, as it still is in many schools. And they had other activities; plays. Teachers had to take turns coaching plays. And I never coached a play. The faculty put on a play once and we all took part in it. But I never coached a play because I had this music part. Let's see, did I have that just one year or two years? They had mus|i£ teachers for the band and instruments, but it seems to me that I had the glee club two years. And then we would put on skits between acts of the plays, so that was my contribution, and I didn't actually coach a play, but some of the teachers had to do that. And programs for PTA, you had to help with those.",,
SS,"They didn't have the, oh, kind of just get-togethers at school anymore there; this was more of a—",,
MLL,You mean parents and all?,,
SS,Where the kids and everybody came?,,
MLL,No. No. I don't think so. They had school parties; I don't think they ever had school dances. I don't believe they danced but they had school parties where you played games and things sometimes.,,
SS,"By the way, when you mentioned the Klan; do you remember any of them doing anything around there? Burning crosses and that sort of thing?",,
MLL,"Yes, they burned crosses. Yeah, all through this country, they did that up here, too, But I don't know of any bad things they did, like we hear of in the South in the early days.",,
SS,I have heard of people around here that I mentioned the Klan and some of them mentioned that they were more anticatholic sometimes in some places.,,
MLL,"Well, there wasn't any problem there. The town wasn't on the reserva tion but the area around is the Indian Reservation, you know, but I don't think that was an issue with the Klan either. I don't think In dians were. That wasn't an issue down there. There weren't any Catho lics there. There were Catholics at Lapwai, but not at Culdesac. There were no Catholics or no church at Culdesac.",,
SS,"Well, from there: when did you first become home demonstration",,
MLL,"I think I was getting $135 at Culdesac, at the end, I think I got a raise. I think I started out at $l25 a month, that was for nine months. And I think I was getting $135 and I went to Omak at about $145, as I remember, it wasn't a big raise, but it was and it was a big ger school. And it was all working with girls; which is really what I was best trained to do. I was girls advisor and then economics classes and also taught girls' chemistry. And of course, I had had chemistry.",,
SS,Did you board at Culdesac?,,
MLL,"Yes. Teachers boarded, there were no apartments in those days.",,
SS,How about Omak?,,
MML,And the same at Omak; I boarded. I don't remember any teacher that had an apartment.,,
MARVIN L,What did you pay? About forty dollars a month?,,
MLL,"Well, I paid thirty-five at Culdesac, I think. I can't remember at Omak. was about the same, maybe forty a month.",,
SS,"Did that include your breakfast and supper, too? As a part of that?",,
MLL,Three meals.,,
SS,Three meals a day?,,
MLL,Uh-huh. We lived close enough to the school. And your room.,,
SS,Was that pleasant? Boarding with a family?,,
MLL,"Oh, yes, I lived with good families. Yes. I lived with a dentist's family in Omak, and it was very pleasant. There were two other teachers stayed there too. And we had washing privileges, you know. Do oor laundry and pressing.Sudn ftS-4hd we were just like members of the family, if we wanted to be. But the Omak school was much larger and progres sive. Very progressive would say. They had a class for the boys that was a combination of shop and agriculture, and then there was home eco nomics for the girls and they had a girls' league, that I was the spon sor of. And the superintendent was real interested in advancing that work in the school. It wasn't vocational, home economics yet, at that time, although we were qualified to teach vocational. We were trained you see at Pullman so that we could teach vocational home economics, but they didn't get federal help like we do now, or,, later. It wasn't strictly vocational work; it was coming toward that. And with our trai ning, teacher training and all, we were trained to teach vocational, if we got into a school where they had it.",,
SS,You say Girls' League; what was that?,,
