speaker,words,tags,timestamp
SS,Glen was just saying this morning that your store was really good for people for credit.,,
MARVIN L,"Yeah, we had abig district. See we traded. We bought and sold. It still belongs to my sister-in-law out here. The feed yard was this one right out of town here. Idon't know whether that sign's still out there or not. They took that down.",,
MARTHA LONG,"They used it on afloat, but Idon't know whether they put it back or not. That wask Holsum sign though.",,
MARVIN L,Yes.,,
SS,"From year to year, did you find that you could count on getting all the credit that you gave paid back? By the farmers?",,
MARVIN,"Well, of course, we had a charge off. We figured if we'd keep it under five percent we's doing alright. Idon't think we ever charged anymore than that off, probably. I don't know.",,
SS,Did you carry these folks for awhole year at a time?,,
MARVIN,"Sure, sure.",,
MLL,Longer than that.,,
MARVIN,"lf they had anything back of 'em. But that's where we made our money. We were dealing, trading, you know. Trading cattle and we'd take anything.",,
MLL,Dried prunes!,,
MARVIN,What?,,
MLL,Dried prunes! (Chuckles),,
MARVIN,"Dried prunes, yeah.",,
MLL,"Yeah, anything. Barter, lots of barter in those days you know. Had to be during this- these lean years. Had aprune ranch down the hill; dried the prunes. Family, had abig family of girls. We took enough prunes every year to take care of their account.",,
MLL,"Would you say that the proportion of the business that was trade in stead of cash, would it be as much as maybe aquarter of your sales?",,
MLL,"At one time, I imagine it'd be a half, Really? In the early days; this would be?",,
MLL,"Yeah, more in the early days.",,
MLL,"Hey, that's alot. Would you just pay like aregular market price on what— (too soft to hear)",,
MLL,"Our ranch. That's how we got our ranch. We got aranch out of the deal. We traded. We traded anything. He and his brother owned a ranch— on They took hay, they took everything. There was three of us boys and my dad; four of us. Had to. It was the only way they survived. That was the only way we could make any money, we had to barter. Ranch, or anything, we'd take anything. Wood. Cord wood.",,
MLL,Did you have trouble converting that into the money that you needed to pay the people- the companies- for their goods?,,
MLL,"Well, sometimes. We had aline of credit in those days, like with the big accounts, like we generally have with the dry goods outfit. With shoes and a lot of that stuff, and groceries. We„ran a line of credit with them. The guy that was running the Lewiston Merc at that time, he owned it,he had control of it and he was He financed us in the summertime. enough money to pay the others off, and0f course, we'd sign a note for his.",,
MLL,Was that Vollmer?,,
MLL,"No, no. Fellow name of Frank Thompson. He was awholesaler. Old Lewiston Merc down here. Of course you've heard of it.",,
MLL,"Yes, I've heard of it.",,
MLL,Lewiston Mercantile. He owned about half of this country at one time.,,
MLL,Half of this; quite abit of country if he owned half of this. Vollmer must have owned the other half!,,
MLL,I dont know.,,
MLL,Vollmer was earlier. This was through the Depression of the '20's.,,
MLL,Did they go back to bartering during the Depression?,,
MLL,"Oh, sure.",,
MLL,That's what mostly he's talking about.,,
MLL,"take in a whole carload of cattle and ship if they got up against it, that's at they did. Give 'em a credit slip for their cattle and ship the cattle,and that's what kept us in business Chickens, they'd take chickens and ship 'em up to Pullman to the City Market up there.",,
MLL,Was there a tight period in between the pioneering days and the Depres sion where people had money to pay?,,
MLL,"Sure, sure.",,
MLL,That's What I thought. So it just kind of reverted; went back to the way it had been? When the Depression hit?,,
MLL,"Well, depends on who it was, whether they went back or not. Some of 'em gained by it; some of 'em made a pile of money on it- the Depres- sion. Ranchers accumulated ranches. This Frank Thompson Iwas telling you about, he always took our notes. He'd take 'em because they was That's ""grocery stores bankable. That's how kept agoing. He kept them in finances. You know during the Depression there wasn't any money. You've heard of it haven't you?",,
MLL,"Did you get right up against the edge yourself, the store, of having to shut down? During that time? Or did you always have enough credit? They would limit your credit, too, right?",,
MLL,"Oh, sure. But we always had this edge, this leverage, see. We had this outside deal for when we got in a jam.",,
MLL,Which outside deal? To go and get cattle?,,
MLL,"Yeah. Wasn't many grocery stores could have a cattle business on the side. But I had abrother and a father, they didn't know anything about the stored didn't want to know. Never did know. Ihad another brother, older brother til he passed away.",,
MLL,So this cattle business; you kept butchering and you would sell meat and you kept selling meat through the store.,,
MLL,"Sure, and we shipped the cattle. Carloads. Sometimes acarload might go out of here every week.",,
MLL,"Take that any way we could get it to get hold of some cash, you know.",,
MLL,Did you used to drive around and sell meat to the farmers?,,
MLL,"Sure I used to when I was just big enough to go around and open gates, peddle the horse and buggy days, meat. That's the only way open them gates so get through. Me and my brother's drive this meat wagon— double decker and fill it up with ice torn of it, and you had two decks you could put the meat You know what the price of meat was? Six, eight and ten. Soup bone was two bits.",,
MLL,Where is that picture? We had a picture of him.,,
MLL,"When you said six, eight and ten; what did that mean?",,
MLL,A pound.,,
MLL,A pound?,,
MLL,"Six cents for boiling meat; eight cents for aroast, ten cents for steaks teebone steaks, any kind of steaks. Soup bones, if they wasn't trimmed were two bits.",,
MLL,"Yes he is. Ithink we have apicture of the old meat wagon, but Idon't know where it is. They had some ice when they would start out in the morning- and the women would come out with great big pans and get the hunk of meat and take it in and cook it because nobody had refrigeration, you know.",,
MLL,"Iimagine you'd be able to sell some of the threshing crews, too, right? Yes, that's when we did it.",,
MLL,"Yes, when they were threshing.",,
MLL,"During the harvest season, that's when we did that. We didn't do that the year around. When Ifirst started that deal I was just old enough to go along- couldn't drive the team, you know, I was just old enough to go along and open gates. LAUGHTER this meat; did your family raise alot of that meat themselves, a lot of that cattle or were they just mostly buying stuff that was already raised?",,
MLL,That's what they did.,,
MLL,"And then, of course, afterwards we got downtown here- belongs to my sister-in-law. my brother, they bought and sold cattle all time. They were shipping all time. Quick as they'd get a carload up, they'd ship it.",,
MLL,Would they butcher or ship 'emklive?,,
MARVIN L,Ship 'em alive.,,
MLL,"But they had aslaughter pen out there, they butchered for the shop. Tom was the meat cutter. He was a professional meat cutter.",,
SS,"You said to me, I think that you cooked in threshing crews? Didn't you?",,
MLL,"Oh, yeah.",,
SS,Was that just when you were living at home?,,
MLL,"Well, it was when I was living at Pullman that Iwent and did this, yeah. One summer. (Chuckles) Did we do that on that tape?",,
SS,"No, you just had mentioned to me that you did it one summer.",,
MLL,"Yes, the year Igraduated from high school. The year graduated from high school, Iwas sixteen and my chum was seventeen and her brother had a wheat farm down near La Crosse and he wanted cooks, so he was going to hire us. She was the chief cook and Iwas the assistant. And I was going to college that fall and Ineeded money real bad and so Iwas glad to get agood job like that. And it was out aways from La Crosse. And it seems to me that we had thirty men that we cooked for. And he drove the combine and then hired the other men. That would have still been horses, wouldn't it? I'm sure it was horses. In the days of horses. And so there was lots of work and they had to have lots of men. And my job was to set the table and peel the vegetables and wash the dishes and help her, whatever she needed. She was the head cook.",,
MARVIN L,"Now, there would be two or three men. Big outfit. Somebody run the combine and the other haul.",,
MLL,"Well, these combines- well, I said combine. Well, I think it was a combine. It was a combine. They didn't have a threshing machine.",,
SS,Did you find that work tend to be very exhausting?,,
SS,"Well, we were chums, you see, and it was great fun and then we run around all night with boyfriends and get up at the crack of dawn. We had to get up at five o'clock to get breakfast, you know. No. I don't know, it was just great. And then Ihad money enough to go to college that fall. You don't need much sleep at that age. (Chuckles) We had time in the daytime, we had some time to rest during the day, too. Oh, yes, we'd get our work done. We served three meals and some times we sent out alunch, but not always. Didn't always have to send out alunch. But we were so young, you know. And one time the Calu met Baking Powder Company came out with an ad- Calumet baking powder was new then- and they came out with this ad for making checker board cake. And, oh, that sounded like that was really something. I said to Anna let's try that for the threshers. And so we read the directions and we made checkerboard cake for it amounted to, you made abatter of chocolate and then you put it in apan in strips and you baked the two layers like that and then when you put them together you reversed one, so when you cut the was checkerboard. Really quite an elaborate idea. It isn't one,you would chose to serve threshers, but we did.",,
SS,Why not?,,
MLL,"Well, you go to all that trouble. You'd make an easy cake in aflat pan and cut it in squares and serve it to them. They,like it cooking. My mother had died - better. But you see, I was well, she died that spring, but she'd been ill along time and so been cooking at home.",,
MLL,(conversation about Pendleton coats has been deleted. Perhaps it should not have been),,
SS,When your mother was sick; that must have been areally difficult time for the whole family.,,
SS,"Well, it was. And my two older sisters graduated from college and went to teach, and then Iwas the oldest one lit home. And the next sister was five years- four years younger than I was. But we kept house for Dad and some of the boys were still home. And my oldest bro ther came back and worked and helped support the family, too. But all of us when we were going to college, we did all the work at home and went to college too. Canned in the summer and did what was necessary Mindhte never thought anything about it, just something we had to do.",,
SS,What was it she died of?,,
SS,"Cancer. And, you know that was in 1920 that she died and they didn't have all these new treatments.",,
SS,"You were going to high school and try^ keep house, too.",,
MLL,"Well, we did all the work at home through high school, yes. My oldest sister- my second sister was still at home when I was in high school, but she graduated in '21, so she one year after I started college.",,
SS,What was school like then for you in Pullman?,,
MLL,You mean college?,,
SS,"No, high school.",,
MLL,"Oh, well, Pullman had one high school, and it was just a few blocks from the house we lived in after I finished high school. I lived on the other hill. You know Pullman is built on three or four hills; really four hills, and^high school was on the one we lived on when I was college, and then Iwalked all that distance to college. But when I was in high school I lived over on the one that they call Pioneer Heights now. And then they had two grade schools, and then what they called Sunnyside School. It was a big, ornate building- kind of a Vic- torian building next to the high school. And at one time it had been the high school, too, I think. I know it had before they built the new high school, it had been in that building along with the seventh and eighth grades. And that's where I went to seventh and eighth grade in that building. And then there were two other grade schools. I started school at the Yensen (?) School which was on College Hill, that's when I was in the sixth grade. And then we had seventh and eighth in this building, and high school. There was no gymnasium; we went to the college for our, they had them in the college gym, our basketball games. Our high school physical education, such as it was- it wasn't regular classes, but we played basketball and that was in the top story of this old building. The third floor was turned into a- it was just a small- it wasn't regulation. So they couldn't have their regular basketball games there, but the girls had their games there. I played basketball on the girls' team, but just within the high school. We didn't play other schools. And then all of the plays, operettas, and commencement were held in the college auditorium. Because that high school didn't have an auditorium. It just had a big study hall. And it had a small stage, it was suitable for small plays and class day events and things like that.",,
SS,I was in Bryan Hall last night.,,
MLL,"But Bryan Hall is where I graduated from high school and college both. Because the high school at that time didn't have a gymnasium even, like most schools would have had to conduct it in.",,
SS,I was thinking of the home ec in high school when you were going there. Did you get that stuff in high school?,,
MLL,"Oh, yes. We had a real good laboratory at Pullman. Old fashioned. In my time it had progressed from domestic science to home economics ready It was called domestic science in the old days, you know. When it first started.",,
SS,What was the thinking of the change of the name?,,
MLL,"Well, I don't know exactly. But it started as domestic science. Just like the name implies. And then home economics was a 1ittle broader in concept. And we had even eighth grade home economics; once aweek. And I learned to make- of course, I cooked at home, but that's when I learned that some of my mother's New England terms were not the thing that you did! And it embarrassed me when Ifound out that Johnny cake was cornbread. And a spider was a frying pan. And Iwouldn't have ad mitted to anybody that that wasn't what we called 'em at home! So, I learned to make corn bread instead of Johnny cake. The family thought it was darn good and it tasted quite abit like my mother's Johnny cake! And now, Iappreciate those New England terms, you know. Which I think the South made corn bread or corn pone, but New England made Johnny cake. And those are lovely, those regional terms are lovely, aren't they? Ididn't appreciate that as a teenager, you know. That's the age when you become- oh, lots of people become ashamed of their parents' old-fashioned ways"" But I never did admit it to the teacher that I was accustomed to eating Johnny cake.",,
SS,"Was there clothing and textile stuff in high school, too?",,
MLL,"Well, it was called cooking and sewing. The classes^you took were coo king and sewing. And they had avery good old-time style cooking labo ratory, which was a hollow square and it had a zinc metal tops on the-",,
MARVIN,: Didn't call it home economics then.,,
MLL,"Yeah, I think they did when Iwas in- seems to me they did when Iwas in high school. It had zinc metal for the counter tops, which was used quite abit, even in home kitchens. And in the corner of this hollow square there was asink; asmall sink in each corner. And then on each side there would be two pairs of students, so that four girls were using the sink you see,* And then we had hotplates. And then there was a stove for baking. I don't remember whether it was an electric- I think it was an electric stove. It was just about the time the ele ctric stoves were coming in. We had two burner hotplates. And the combination of this plumbing in the corner and electrical units and the zinc top- when the teacher would leave the room, the girls would- We'd take hands- hold hands clear around the hollow square, we were on the outside of it and somebody would rub that zinc and you'd get areal old shock! (Chuckles) Of course, we weren't supposed to do that, but when the teacher was out we used to do that. And that was because of the grounding some way.",,
MLL,Uh-huh. The person on the end would rub the zinc and it would go through everybody.,,
MLL,"Uh-huh. And it would go clear around the circle! Oh, the teacher'd catch us sometimes. We weren't supposed to do that. Probably a littel dangerous. Idon't know, we never got abig enough jolt to hurt us.",,
MLL,"Like in sewing; were there certain styles that the kids were being taught to do like the modern, or was it more-",,
MLL,"Well, in high school we didn't get very far into actual clothing. We learned stitches, you know. And we made aprons. I know I made an apron and Ibought checked gingham. My mother knew that there was checked gingham down at Emmerson's store for five cents ayard, and that's about all the money we had to spend for it and she sent me to get ayard of this checked gingham. And it was the cheapest material there was and it was a real fine check and it hurt the teacher's eyes and she complained about it. She had no understanding that some child had to buy that just because it was cheap, and Idid cross-stitching on these checks, see, that was the project that Ihad chosen and i made areal attractive apron but it hurt her eyes to help me witty . And, of course, she didn't understand that there was such a thing asAsomebody had to buy a nickel apron.",,
SS,What did she want kids to use for their aprons?,,
MLL,"Well, it could be any kind of gingham, but a little better quality that the patterns wouldn't have affected her that way. She was agood teacher.",,
SS,Seems stuffy to me.,,
MLL,"Well, she just didn't understand the problems of a poor family. The teacher always wore white aprons. And she wore a uniform maybe, in Pullman High School. When I went out aprons, Ialways did. And the girls wore aprons, but not big coverall aprons.",,
SS,"The teacher, did she wear a coverall apron?",,
MLL,"Well, she wore a uniform, I think, she was a fulltime home economics teacher in school.",,
SS,When you say uniform- like nurses?,,
MLL,Yes. Like a smock.,,
SS,Were there very strict you went to high school in Pullman.,,
SS,What the high school students should wear?,,
SS,"I don't think it ever came up. The styles were not,- there wasn't any thing- any reason for it, really. I don't remember of anything like too short a skirt or anything. Skirts were way down below your knees. And nobody ever thought of having, yde, we and I don't think there were anything like wearing pants or anything. Girls didn't do that.W- 'em to hike in and you had gym bloomers. And boy, were they something! The ones I had in college even- The ones we had in high school, we made out of black sateen. They were big and full, because they weren't supposed to look like pants, of course, and then they had a band just below your knee, but because putting elastic in there would restrict your blood supply, and that wasn't healthy, they had tapes inside these bloomers from the band up to your waist and it was quite a trick to get into those things and have the tapes in the right places. You know you'd get all twisted up. And if you were in a hurry, that was a real trick! That's the kind that I wore in college for physical edu cation classes.",,
SS,The tapes were to hold them up?,,
MLL,"Hold them up, because otherwise they would have fallen down straight and you wanted them blousy, so they looked like a skirt. They were sort of pleated at the waist line, and you wore a white middy with that.",,
MARVIN L,"In other words, you used garters with it.",,
MLL,"No, there wasn't any garters. It wasn't a garter, it was just plain cotton tape to hold that up.",,
SS,Held it right up to the waist.,,
MLL,They held the cuff so that they bloused,,
SS,Did the tape- did it fasten or-,,
MLL,"No, it was just stitched to the band so that it made them look like a pleated skirt at a glance and then they were- they gave you the freedom to modestly play games and play basketball. wore those all through my college days in gym class. And stockings. There were no shorts or anything like that yet for girls.",,
SS,"It was never appropriate for a girl to wear pants, in those days?",,
MLL,"Well, we did wear hiking pants a little later perhaps. But I don't think at that time I did.",,
MARVIN L,Bloomers.,,
MLL,"Yeah, bloomers. Black sateen.",,
SS,What was black sateen like?,,
SS,"Black sateen was a fabric. It's acotton fabric that has something like satin weave, but it's cotton and it has amost peculiar odor. That's typical of sateen, Idon't know why it has, but it does and it never gets over it. The more you wash it the more it smells life that.",,
SS,"You mentioned, too, that you girls went through college but the boys didn't finally. Did that mean that the boys were actually helping to put you through college? You girls?",,
SS,"No. It was because girls couldn't -one thing was that- my oldest bro ther had two years of college and then the war came; First World War, and he went to the navy, and then my mother got this cancer and when he came back then he couldn't go on. He had to help the family. And he got ajob and started work in the post office. And my second brother was just- it was partly because of Mother's illness, he lost his inter est in school, you know, as teenagers often do. And then my youngest brother, well just needed more guidance, but they all turned out real good. And had good jobs. My youngest brother ended up in the State Highway Department at Olympia. They're all dead now. But the girls couldn't get jobs, for one thing, you know. If you could train to teach, then you could get agood job, but if you- the boys could get better jobs; that was partly the reason, too. So it was more attrac tive to not go on to school, to quit.",,
MARVIN L,They could get work.,,
SS,"All the girls in your family, they all went to college.",,
MLL,"They all graduated from WSC, it was in those days. They all took home economics. They all taught. Was it part of their thinking that they all wanted to be able to make agood for themselves? To be sure they had",,
MLL,"What else? Yes, it was to earn money, of course. We worked to go through but we had to do- oh, we worked- several of us worked in the telephone office, that was one job you could get in Pullman. And you could do housework for women and you could babysit.",,
SS,"That was a four year program; home ec, at that time?",,
MLL,"In college, are you talking about?",,
SS,Yes.,,
MLL,"Oh, yes! Pullman'had started as an agricultural college and then it had become a state college at the time we attended, and home economics was one of the big departments. They had a good department.",,
SS,"So it sounds to me like- I would think now, if you were doing that, that a lot of people would do it feeling that it was going to be a career.",,
MLL,"Well, sure, sure. Teaching.A We were all training to be teachers. And that was the field we chose. And it was just opening up in high schools, too. A lot of high schools were just putting it in.",,
SS,Home ec?,,
MLL,Yes. In those years. But my oldest sister taught here in 1918. And then it was just a beginning thing. And I went to Culdesac; was my first school.,,
MARVINL,"I guess that was the first time they ever had it here, wasn't it?",,
MLL,I don't know. I rather think it might have been. And it was at Cul desac. They didn't even have any equipment.,,
SS,They didn't?,,
MLL,"No. They just knew that they wanted home economics, and they didn t know- they wanted this for the girls, but they didn't - the school board di t understand that there had to beany laboratory or anything. And there was a room set aside for this and in that room- I don't know what they'd been using it for, because they hadn't had a home economics teacher, but they had an old wood burning cookstove and a cupboard full of odds and ends of dishes that people had donated and lots of them were chipped, and a pedal sewing machine. And that was it. And I was supposed to teach home economics! And they finally got me a- I donlt think they ever got an electric range, I can't remember if they did. They finally got a- there were no measuring cups or measuring spoons.",,
MLL,"And we were taught how to do it that way. You measured, you didn't do it with a handful of flour and a pinch of salt and all thatthat wasn't the way we were taught home economics. That wasn't home economics; that was the way your mother and your grandmother cooked. And they were good good cooks but then that what we were sent out to teach. And they didn't have;any of those things, and they final ly that year, they got me some. We had just a big long table, but there was no laboratory setup, but they did have a big table that was suitable so that the girls could stand around it and prepare the re cipes for the particular day. And it was also used for sewing work, where they could cut out their garments on this big table, too. They did finally get me an electric sewing machine, and that was quite a help. Although I always made the girls learn boarb because at home a lot of them had treadle machines and they needed to know how to use a treadle machine. That was in 1924. And electric sewing machines were just coming into the homes, I guess. But they learned.",,
