speaker,words,tags,timestamp
SS,Was the idea to try to get it so that you couldn't tell that it was a remake?,,
MLL,"Oh, why, of course, nobody wanted a remade if they could disguise it. It was not always possible, but if it was still useable then they didn'tthey were glad to have something to wear.",,
SS,Were the farm women doing this- I mean were they very actively involved in this?,,
MLL,They're the ones I'm talking about.,,
MARVIN L,They had the time.,,
MLL,"Well, the group in town had the time but they didn't have the ambition. But we did some work with them, too. This group that I mentioned that were out of work and wereAso down and out. They were discouraged.",,
SS,They were really laboring people. They weren't farmers.,,
MLL,"No. No. No. I don't know what kind of work they had done, but they were just discouraged people. There were lots of them there in Wenat chee, in a town like that, because there was lots of that kind of la bor, you see when the warehouses were all working.",,
MARVIN L,"Transient labor, wasn't they?",,
MLL,Not these people that had homes weren't.,,
MARVIN L,There was a lot of 'em.,,
MLL,"Yes, there were lots of transient workers, but I don't know what kind of work— they had worked in the warehouses. There was all kinds of work in the orchards and warehouses, you know when they were flourishing.",,
SS,"Did you feel because of the difficulties that you had growing up and that you grew up without a great deal in Quincy and had to make-do there, that was- did that come in real handy, your background?",,
MLL,"Of course. If I had never lived that way, I wouldn't have understood the problems, and I couldn't have handled them. I knew all about it, that's the way I had always lived. I could live better without money than I could with, see, because I'd never had any, That makes a difference. If you've always had it you don't know how to get along without it. So then I could help these people better. We put emphasis on beauty, too, not just utilarian things, but we stu died the art side of home furnishing and flower arranging and harmoni zing colors in the rooms. And there was big emphasis on that. Well, it's a lot easier to teach it than to practice it sometimes, you know, too.",,
SS,"Sounds like real practice to me, teaching.",,
MARVIN L,did,,
SS,"No, I hadn't even noticed it, until I just came in and sat down.",,
MARVIN L,Did she?,,
SS,I know I'd seen that house someplace before.,,
MLL,"You're sitting in it. It's our house. One of the garden club women painted that for the flower shoto/ this year. Our house had been chosen you know for that Bicentennial project and so this was part of the staging at the flower show and then, she cu watercolor and she gave it to us.",,
SS,Beautiful.,,
MLL,And we finally got it framed just this fall.,,
SS,It's lovely.,,
MLL,Be nice to have it for the neices and nephews to fight over some day.,,
SS,Was it really for you to spend money when you got it?,,
MLL,"On, no, no. No, I didn't mean that.",,
SS,I thought you said it was easier for you to-,,
MLL,"I knew how to live without, was what I was saying, so I could help these people, 'cause I knew that they didnt' have any.",,
SS,Was their situation similar to the one that you had experienced in Quincy?,,
MLL,"No. No, not exactly, no. I don't think it was very much like it. It wasn't like pioneering. The need for these same practices like making goaf anything that you could do that didn't cost you anything, if you could provide your laundry soap- they made good laundry soap, and we taught them to make toilet soaps, scented and soaps too. One of the women at Pullman, one of the women, one of the women who had charge of our teacher training had worked out some recipes and had experimented a good deal herself and had worked this all out andphen we'd go to conference she'd have a class for us and teach us this and so we could teach them to make toilet soaps and some of the women did make very satisfactory ones. But they could all make good laundry soap. And was quite a saving you know because they had some waste fats. It wasn't the same if they didn't butcher, as it was id they butchered, but they got so that they began keeping animals and butchering and then you had . waste fats. That's when you oould really make soap.",,
SS,Did you have a'MmfliS in Quincy?,,
MLL,"Oh, yes, we always had a cow and raised a calf to butcher, one or two. And we always raised hogs, and chickens.",,
SS,Why was it so different? What made it really different there as com pared to pioneering?,,
MLL,"Well, one of the differences, perhaps, or maybe it wasn't so differentbut y, hadn't thought of it just that way- that these people had had good times, you see financially. And my folks had come out there with nothing to take up a homestead to get free land, see, it was a diffe rent start entirely.",,
SS,Did they expect the good times to come back again pretty soon?,,
MLL,"Oh, at Wenatchee, you mean? Well, they hoped, but when a depression hits you don't know how long it's going to last. Fortunately, it didn't last too long. So most of them saved their orchards and it's a flou rishing business again. And some of those same people are living there.",,
SS,This aesthetics that you talked about. Was that something you tried to consider in all different projects that you could? To be artistic?,,
MLL,"Oh, of course, that's what homemaking's all about, isn't it? It's got to be nourishing but it must be attractive and appealing. Foods must be served attractively and a table must be set attractively. It isn't just enough to get food, you've got to ; the soul as well as the body, you know. Oh,yes, it went through all phases of our work, of course. But we actually applied our principles more to horn efurnishing but it carried over. A salad could be a work of art just as much as a piece of needlework or a rug or anything else.",,
SS,About the last thing you said to me when I was here before was that your mother had tried to instill a sense of beauty in the kids on the homestead. Is that right? I think you said that.,,
MLL,"Oh, sure.",,
SS,So that you saw the beauty in the world when you were growing up.,,
MLL,"Oh, yes. Yes, probably more than lots of families did. I'm sure that was true. She enjoyed beauty in many forms. Poetry was great thing in her life. And she had a good sense of color and knew something a bout art, but not the same way that I did with my training in home economics. I mean, I don't suppose she knew what the primary colors are, or that part, I don't think she'd ever had any training in that direction. But we taught our women that. foostly through clothing and home furnishings; but also in foods, it has to be.",,
SS,"Well, I kind of had the idea that it was less of a practical matter when you were growing up and more one of value, what you think is im portant.",,
MLL,"It took so much out of you, just the practical side- took so much out that there wasn't much energy or time left for the other, but it was always important.",,
SS,"I was going to ask, too, whether this work in home furnishings was that something that was important in a program? Did you really teach fur niture making or repair or—?",,
MLL,"We taught- The thing was that their homes had become a little bit run down, you see, and some of them very much so, and some of them had had real nice homes, but they hadn't been able to keep them up and we tried to teach them things like recovering chairs, upholstered furniture, we worked with that. Because they did have pieces that had been good, they had a davenport that had been a good piece but it was all worn out and we had work in reupholstering and recovering. Slipcovers, espe cially. They could afford to buy some material for slipcovers where they couldn't afford new davenports. And then we taught rug making, as I said, which brightened up their homes considerably and was practical as well as ? It was enjoyable work that they could do in their leisure time.",,
MARVIN L,They didn't make 'em quite this big. They didn't have enough rags.,,
MLL,"And let's see what other kind- The refinishing; we had them go into their attics and drag out their old chairs and we taught them to refinish furniture,. a lot of them made cane chairs. I taught them to cane chairs. I didn't know how but I taught myself those kind of things.",,
SS,Refinishing in what way? Like this?,,
MLL,Yes. They'd have an old painted chair like this on the back porch.,,
SS,Take the paint off?,,
MLL,"And we would study the chair and if it was worth it they would take the paint off and refinish the wood. And I mostly taught them the lin seed oil and turpentine rubbing method, which was acceptable.",,
SS,It's interesting to me that that was part of the- time of restoring the wood- and was real important then.,,
MLL,"Oh, in the East in extension work, they had excellent bulletins from a lot of the midwest counties that had big extension programs^more ad vanced than we had it out here. And they had excellent bulletins of this so we could get their bulletins to guide us in methods. And the girls did this too, the 4-H girls, they'd find an old chair and they would redo it for their room. That was part of their room improve ment project, see. They would make a valuable- now, of course, they're antiques. They weren't so interested in them as antiques then as get ting an interesting, useable chair and we would study the lines, and if the chair was worth redoing, if it was an attractive chair and a comfortable Ghair.",,
SS,"But the value of the wood, the original wood was appreciated - they thought it was better to have the wood than the paint.",,
MLL,"Well, there was nothing wrong- sometimes they did paint furniture, too. They painted furniture. But the refinishing of good hardwood^ was part of the study, too. And they could do a real good job and their hus bands sometimes helped with it.",,
SS,Now what were you going to say about the sage on the homestead?,,
MLL,"Oh, at Quincy, and this is just from our family standpoint we had kinds of sagebrush in that valley, in that Quincy Valley, and we had our own names for them and I thought maybe that was kind of interesting And the one was the regular gray sagebrush that you usually think of as sagebrush that's everywhere where there is sagebrush. And it has a kind of a little yellow blossom in the spring and very fragrant and bees make honey that someplaces they have sage honey they sell, you know. That was the predominant kind that was cleared, but amongst that gray sage there was there was three other kinds that we called sagebrush. And one we called prickly sagebrush, and it had actual thorn^ on the stems and it grows about the same size as the gray sagebrush and it had afoot a flower- I find now that .studying flower books, that it did have a little flower chat was mostly stamens, and then it had bracts that were different from leaves that came out and they were somewhere between a quarter and three-quarters of an inch sometimes, they were kind of big, and they made a cluster which at a distance kind of looks like flowers and they were different colors, they were shading from lime green as they matured I think they changed ft orange and red so they were rather colorful.",,
MLL,"And as a child I tasted everything. Nowdays there's supposed to be a lot of poinsonous plants but fortunately I guess I never hit one because I always tasted everything and these bracts had kind of a sour-like- like miner's lettuce, "" has a bit of an oxalic taste to it, you know. That's what they tasted like. Now in the flo wer book that bush is not a sagebrush, it has a name. I think it's called hopsage maybe it is hopsage. I had it in a book, I'll look. I was quite excited to find it did have a name because we didn't know that we just named Jy, , you know. Yes, hopsage, it was called. And then the purple sage was the third one that we had and it was - the flower was very much like the garden sage. It had a big bunch of pur pie flowers- that's the way it looked. And it was very fragrant and the bees loved it. And the plant itself was not as gray as the gray sage. We never used it for anything, but it was great fun to run around through the sagebrush and find these different kinds when they bloomed. Then the fourth kind we called featherbe^d sagebrush. And it was a yellow plant. And now I find that it isn't sagebrush at all either, but it's called rabbit brush in the desert country, but we didn't know that, we called it featherbed. And the reason we called it featherbed sagebrush was because it went to seed; made a fluffy, plari went to seed, and when the men went out on the road to work and slept under the wagon with their bedroll they would- there were no pine boughs or fir boughs like the people in the woods to make a bed you know, like when you go camping and make your bed on boughs. There were no evergreens, so the men would gather this- what we called featherbed sagebrush and put it under their beds and it was real soft and suggested a featherbed.",,
SS,Did you call it purple sage at the time?,,
MLL,"We called that one purple sage, yes, but-",,
SS,Just the other name for it.,,
MLL,"But because it was so purple- the flowers were just like that and it looked like our garden sagebrush, but the leaves didn't taste like that, they tasted more like sagebrush, and it is a sagebrush, I guess. We didn't have greasewood- I notice in that book there's greasewood, but I used to think later- I wondered if this prickly one was grease wood, and it wasn't until I got this book that I knew for sure what it was. But those were the four that we used to have fun looking for in the fields around us.",,
SS,Were they the main vegetation?,,
MLL,"Yes. There were wild flowers amongst the sagebrush. Lots of wild flowers and some grass. There was a little grass that came up in the spring called sheep grass because occasionally there'd be herds of sheep go through and eat it in the early spring, but it was a real fine litlte grass and it dried up early in that country. In the summer there wasn't any grass. And then there was- in the draws where there was some mois ture, there was this big rye grass. And then there was bunch grass. There was some bunch grass yet, too. But there had been lots in the real early days, but we could still find bunch grass.",,
SS,D°es that mean that the bunch grass disappeared when it was grazed over?,,
MLL,"Yes. I think it was grazed away. And then the sagebrush takes over and the bunch grass recedes. I don't know how far back, there might have been lots of bunch grass.",,
MARVIN L,"They wouldn't be together, would they?",,
MARVIN L,"Yes  there was bunch grass growing around through the sagebrush, too. Yes, there was still some, but it was pretty much grazed off.",,
SS,1 did want to ask you one other thing about here; and that is what your impression was when you first came here to the house and if the house really was as striking to you when you first saw it as it is to me when I come by here now.,,
MLL,"No. To be truthful, that wasn't the case. I was just newly married and Marvin's mother; this was her house. She loved this house and she was becoming elderly and Marvin had been looking after he r and that was still necessary and the store was in bad circumstances. There wasn't a lot of money and we considered building a house and then we would still be looking after her. But this great big house with just her living in it- and so I don't know which- I suppose it was my sug- gestion- that maybe we could make an apartment upstairs. No, I didn't like this house. I thought it was ugly. I didn't like Victorian ar- chitecture at all. And it wasn't the house that appealed to me, it was the family I was marrying into and I liked his mother and she needed us. And so, I talked it over with her first when we were mar ried and she felt that was a real good idea and she just turned over the rooms up there and let me have them fixed anyway I wanted them, and we fixed them real nice. Had a real nice little apartment. They've kind of gone back in the meantime, they aren't like we had 'em, but it was real pretty. Wasn't it?",,
MARVIN L,Uh-huh.,,
MLL,"We had nice drawdrapes at the windows and we had a nice rug on the floor. And I collected a lot of this old furniture, partly because I was interested in it, but it was a way to get the furnishings that I could live with on the amount of money we had to spend. We could have bought new furniture but I wouldn't have been happy with the kind we would have had to buy. And I was happy with this. I refinished and caned and so forth. So that's the way it came about. And now the house is so full of memories now, that, of course, I love it very dearly. But I'm not in love with Victorian architecture.",,
SS,you still aren't.,,
MLL,"No. I still think the Mc Connel mansion is ugly and I think this house is ugly, architecturally speaking. But younger people are just crazy about it, and I don't know why. We had to study architecture in our college course- I know you asked me^what I took- that was one of our courses, we had to have a year in the architecture department.",,
MARVIN L,"You shouldn't a took it, should you?",,
MLL,"Well, those teachers by that time in the '20s' they weren't considering Victorian architecture beautiful either. It was ornate, see, and we were being taught simpler- Yes, this house was Victorian architecture, sure. It's an interesting house. And the young people are just mad for it. Lee wants this house so bad, you know, that he could die. What use he'd ever put it to, I don't know, but he could sure have it-; And the girl across the street, she's got a good job back in Philadel phia and she's just mad for this house, ""Don't ever let anybody have that house fixed."" A lot of young people; they like them. And it's been fun living here. We've had great fun. And then after his mother died we moved downstairs and remodled again, we're still remodeling. But we've never done as much as we should. We never put in a proper heating system.",,
SS,"When you married and came here, you didn't work? Is that right?",,
MLL,"No. No, I helped at the school- I taught school- I guess you'd call it teaching. It was a nightmare. But I helped at school one year during the war, they had hired a man and he was called to the army just as school started and they were desperate and so I was certified. I had an Idaho certificate and I helped 'em out that year. But it wasn't a very good experience. I had some work with the seventh and eighth grades, which I knew nothing about. That was worse than teaching Latin. And then the science class in high school. That wasn't so bad because I'd had quite a lot of science, of course. But seventh and eighth; I knew nothing about seventh and eighth grades. It wa s terrible, and that's the most difficult age as far as boys are concerned. I've al ways been crazy about boys, but is's a difficult age- you don't get very well acquainted. I was just teaching them half a day. And we never had any real trouble, we got along, but I wasn't a good teacher. I wasn't happy doing it.",,
SS,Did you miss not having a career like you had before?,,
MLL,"No, no, I was so busy.",,
MARVIN L,She had a career.,,
MLL,"I'll say I did. I was trained in homemaking, see. I think most home economics women-",,
MARVIN L,She was A specialist. You can call that a career.,,
SS,"Oh, yeah, I meant after she married, then she didn't have that career, you were her career.",,
MLL,"I think, looked forward to homemaking. And some of them did both. Our home administration agent here now, you know, at Moscow just had a baby- took time off and had a baby- but, of course, that wasn't done in my day. I mean, you didn't even get married and stay on the job. There were a few married women, widows, though, mostly. I don't think there were any married women that had jobs. Mrs. Ander son at Moscow.",,
SS,Would you tell me rather briefly about this that you had afterwards?,,
SS,"Well, in the state office there were specialists in each field. There was a nutritionist and one clothing and did home furni shing, too, and then there was one in home management. She had a separate job. But mine included both home furnishing and clothing. And I worked with the 4-H club leaders out in the counties and mostly with the home demonstration agents. I didn't work with - I would go in and work with them and put on demonstrations for women's groups, but mostly through local leaders. We would train the leaders, help them train the leaders in the counties. The work had progressed in most of the counties to that point where they were working through local leaders. That was true in both home demonstration clubs and in the- now they don't call it that anymore, they call it all extension clubs, but we would train 4-H leaders and we worked in lots of counties that had just county agents, they didn't have any women, and then we could help them more and then we both women's groups and 4-H groups. But we set up a program^and then they would choose what they wanted in either field. And we traveled out of Pullman all the time. We tra veled at least two weeks out of every month and usually more. And went from county to county; a few days in each county.",,
SS,"Was that traveling part- that sounds like kind of the center of the job, was that contact work that you did. That was sort of the main—",,
MLL,"Yes, that's what it was, you didn't work in Pullman. You worked in the counties.",,
SS,Did you find the traveling difficult?,,
MLL,"Yes, very difficult. It was more lonesome than the work in a county, even, you see, you spent your nights on the train going across the state in a sleeper, or you spent it getting in late to a hotel in a strange town where you didn't know anyone. And some of them worked long enough at it that they did work.recreational and social contacts, but it was pretty hard to do. And of course,when you were working with the home demonstration agents, then sometimes there would be things you could do with them, and that was better. But you were almost always along. Once in a while you and the nutritionist would be working together on some program andftbe traveling at the same time, but it didn't very often work out that way. That was the hardest part. Some of the girls liked it; I never did. It was interesting, you learned a lot about the Gouw-ky . You had lots of strange experiences. Small hotels and they were always cold; you always slept cold. Never slept warm a night the whole time I did it. Always had cold feet. Didn't have enough sense to carry a hotwater bottle.",,
SS,Did you find people in the small towns who didn't know you to be reser ved?,,
MLL,You never got acquainted with the people in town. You went there and the county agent took you out to a meeting the next morning at eight o'clock and brought you back at four and you caught another bus down to the next place you were going to work. And you didn't get acquain ted in the towns at all.,,
SS,"That would be difficult, I think.",,
MLL,"Unless you already knew someone. If you had an old friend that lived there would invite you out to dinner. And of course, the county agent's wife sometimes would invite you out, but mostly you were just— and you had to eat the same old string beans, at the small hotels every day! (Chuckles) I don't know why they always had string beans! But they did. We had lots of meals at our meetings. We had potluck meals at our meetings. We had lots of jello. Jello was one of the big items of our diet. Potlucksn always jello. And so that was our lunch quite often and those kids of meals, potluck meals the women served. They were good enough, and then in the evening we were usually on our own, unless we had a meeting. But the work itself was real interesting. We had to write bulletins and they were published there at the print shop in Pullman. We had to give radio talks. On",,
SS,"Was it your responsibility to say, in the job with the clothing, to make decisions about what would be the new ideas presented to the state?",,
MLL,"Well, yes, I guess so. We worked with the home economics department in Pullman as much as we could. We were part of that. We were part of the home economics department at the college, so that the clothing in structors there or the people in the textile and clothing field would help us if we needed help. And they sometimes had suggestions, and this woman, this Katherine Brighton , was the- did the teacher trai ning, she worked with us a lot on a lot of practical things. Crafts work and all, she was interested in that. She taught a lot of those things that were helpful in 4-H club work. Bookbinding, soap making and candles and things like that that made the program more interes ting and fun for the kids. And then the counties themselves, set up programs and we had to work with them in deciding what we were going to do. It was joint decision. We would make suggestions and then they would have needs that they wanted us to work on, too, and we would work it out together that way. Because it varied a great deal.",,
SS,"I've heard a lot about that in the early days that women were often considered by men to be not as intellectual and not as- you know, sort of like women belong in women's sphere, that old idea that some people had before. But what I was wondering is- did you run into that as a professional, working around the state, whether there were times wh en men that were kind of working above you-",,
