speaker,words,tags,timestamp
,"This conversation with CATHERINE MAHON took place at her home in Clarkston, Washington",,
,"on Sept. 20, 1976. The interviewer is SAM SCHRAGER.",,
CM,"They had come to Leuiston to proveAor something. It was the river,",,
CM,it was on the Palouse River. But it's really I think in Idaho.,,
SS,Do you know how he wound up coming to Palouse?,,
CM,"Oh yes. Ho came to America from France. He was really from Luxembourg, but",,
CM,"he came here from France for the gold rush. And coming from France, he sailed",,
CM,"through La Havre, I think. And landed in New Orleans and went up to, oh, what",,
CM,"was the place they always went to, St...",,
SS,St. Louis.,,
CM,"Yeah, St. Louis. Lip in there. And then came west from there. However, he did",,
CM,"cross Texas to get to California, some way. And I know he told about going,",,
CM,"he had to go one distance on foot. Or maybe horseback. Anyway, he was traveling",,
CM,"alone, I think, this one section. And all the money he had with him was in",,
CM,"20 dollar gold pieces. Which of course, you could carry and they carried money",,
CM,that way. And he was vdry hungry. And he went to this farmhouse. And he couldn't,,
CM,"speak English, he spoke French. And he tried to motion and offer the money,",,
CM,and she just screamed and covered her ears and barricaded the door and he,,
CM,"I would have paid 20 dollars very gladly for some ham and eggs."" But",,
CM,no way. 5o he had to go on quite a^bit farther 'fore he got to a place where,,
CM,"he could. And he was in California about gold rush time. He didn't get there,",,
CM,"he wasn't a '49'er. I think he probably got there about '50, maybe not before",,
CM,Someplace in theses and he tried mining. He'd run out of money and he'd,,
CM,"go to work and wages were very high you know, because everybody was",,
CM,"to mine. He said,""We just had sense enough to keep working."" Because he wasn*t",,
CM,"much of a miner. He didn't hit it that way. But finally then, he drifted",,
CM,North Oregon. And he was around in the Roseburg country. Out from,,
CM,"Roseburg. And Looking Glass, in there. And that was where he met my grandmother.",,
CM,"In there. And they were married. Then they lived for a time at Marshfield,",,
CM,which was on Coos Bay. And then back at Looking Glass. And by this time he,,
CM,"had become a stagecoach driver. And he bid for contracts, and carried",,
CM,the mail. And pick up passengers and so forth. And he was making his living,,
CM,"that way when somebody underbid him. And he knew they couldn't do it, the",,
CM,"price they bid, but then, just the same, they got the bid. So another man",,
CM,"from there,^hTt Roseburg country had come up to Palouse and was running a",,
CM,stagecoach from Dayton to Colfax to Palouse. And they were friends and he,,
CM,"wrote and he couldn't handle it alone. So my grandfather decided to come, ty",,
CM,"a half interest. And he came, oh, probably a year ahead of his family. They",,
CM,"spent one winter, Ithink probably some or most of the time, in Sodaville",,
CM,in Oregon.,,
CM,"Sodaville. And my mother always had great faith in the water, of Sodaville,",,
CM,they would cure almost anything. And it was quite aplace at that time for,,
CM,this sort of thing. People drank the waters and felt that would help them.,,
CM,"Like the spas and you know, different places. And my, they were worried, she",,
CM,"said, about him coming up, it was kind of crossing the Cascades of course.",,
CM,And he was bringing horses. But he made it and she remembers they buried some,,
CM,money right in the middle of the dvi*W*V which w«M packed solid. But they,,
CM,"all knew where it was. So if anything happened to any one of them, they",,
CM,"could get it. But it was later that my grandmother came with children, about",,
CM,a year later. And just why they decided to live in Palouse instead of Colfax,,
CM,"but they just did. It was the smaller town, although it was",,
CM,quite alively place. It had five banks and I don't know how many saloons.,,
CM,Great name and it hdd quite a few mills. But Colfax was the bigger town.,,
CM,"And when they got to, they went to Portland, and Portland wasn't nearly as",,
CM,"big as Lewiston is now. Portland was a smaller town and their hospital was,",,
CM,"nearly lftke our St. Soscph's, even though the St. Soseph's enlarged, you know,",,
CM,just small. And they had bben told to stay in a certain hotel. And it was,,
CM,probably the second best hotel in Portland. The second largest. And it was,,
CM,full of bedbugs. And mother said they spent the night struggling with bed,,
CM,bugs. And..,,
SS,This was on their way out.,,
CM,On their way out from Looking Glass by Sodaville and tft Palouse. And that,,
CM,And bedbugs were quite a common thing in those,,
CM,"days, it was in the wood, you see. New houses had never been lived in had",,
CM,"bedbugs. Because they didn't cure the oood the same as they do now and so,",,
CM,"I guess, I don't know they're still left in the raw wood or not. But anyway",,
CM,"at that time, the first log house, you had to de-bug it before you could move",,
CM,"in. But anyway, they struggled with bedbugs somebody had left bedbugs or",,
CM,something.,,
SS,How would people stay in the hotel with bedbugs?,,
CM,They fought them off. They didn't sleep. She said there was no sleep by the,,
CM,Berns family. That was my grandfather's name. Bernes. And next morning they,,
CM,left. I don't suppose my grandmother knew where to go. You know. And so there,,
CM,they just sat up and fought bedbugs. She said it was quite a deal. Well anyway,,
CM,"they got to Dayton, and at Dayton I think they must have stayed all night",,
CM,"there. Eaten at least two meals. And she saw her first time, that she saw",,
CM,"a printing press work. Dayton was quite a little town early, you know. Dayton",,
CM,was settled quite early. And then they were to get the stage onto Palouse.,,
CM,And they came to collect for it and they had the stage fare..Grandma,,
CM,stage fare. Because we own half the line. And in the argument they thought,,
CM,she wasn't going to pay any_ of it. So finally they decided that they'd let,,
CM,"her go. And then she realized,""Oh no, I paid the hotel bill."" You know.""I'm",,
CM,"just not paying the stage fare because that's our stage."" So they came oat",,
CM,"to Palouse and were met by my grandfather. And they built a house, he did",,
CM,"for them, on the Palouse River. I think they just had sort of a tent or",,
CM,something to begin with. And they built on the river because you were handy,,
CM,"to water. You know, you'd go out and dip up water. But the horses were right",,
CM,by the river and everything was there. Pretty soon my grandmother realized,,
CM,that my mother was sometimes taking the horses to water. And she was twelve,,
CM,at the time. And one of them was a very unsafe horse. They were quite fond,,
CM,"of old  but very strong, and I guess a very lovely horee in a way. But",,
CM,he couldn't be trusted at all. He'd bit Anything that got within biting range.,,
CM,Kicked whenever he could get a chance. But he could pull better than anybody,,
CM,on the stagecoach and they worked him a little bit more than they did the,,
CM,the Arabian that was usually paired with him. Das given more rest. The Arabian,,
CM,"so gentle. Prince was a gentle, goodnatured horse. Ha was an Arabian. And",,
CM,I don't know what Meg was.,,
SS,Meg?,,
CM,Urn hm. That was his name. I think probably was a black horse.,,
SS,was that M-e-g?,,
CM,I think so. I just heard the name. Inever saw if  And they built,,
CM,"house that for many years, I don't know whether its still there or not. It",,
CM,was the office for a lumber yard there on the river. Later they lived farther,,
CM,up on the hill in Palouse.,,
SS,Did she forbid your mother to...,,
CM,"Oh no,the talked to.,my grandfather,""You don't let that child get near that",,
CM,"horsei"" And he got fenced in very quickly. So the horses could go to water",,
CM,"without her taking them. She had been very careful, she said. But that wasn't",,
CM,"rather, enough. Mo, my grandmother was^hose things would probably be a person child",,
CM,Was not going to get near that horse. Naturally.,,
SS,What do you think your grandparents ideas about obaidience were.,,
CM,Oh I don't know. They always behaved. You just knew that you obeyed. But they,,
CM,"loved their children. They were very, very fond of them. It was a very tender,",,
CM,"loving home, that way. There had been three children. Mother had an older",,
CM,sister. And there had been a 'brother. And they all adored that brother.,,
CM,"Thought that he was just, he was everything to them. And one thing my mother",,
CM,and sister agreed was that he was awonderful boy. And he died with diptheria.,,
CM,"And when he was about twelve. And their life was just, well, they were horrified,",,
CM,"just ruined. You might say they never got over, don't think either one of",,
CM,"them ever got over grieving for that, for Willy. That was his name. And they",,
CM,"had planned on how he would be educated. He was bright in school, better than",,
CM,"most of the other boys there, or any of the other children, I guess. And they",,
CM,were going to send him on to school. Then there was an academy. Ceetain he,,
CM,"would go there for a time, but oh yes, Ulty to college and college was rare",,
CM,"in those days. There werentt, you know colleges out here. But all their hopes",,
CM,and plans were for Willy. And mother had the kindest of rememberances. She,,
CM,"said,""He was so good to his sisters. He always did things for them. He'd work",,
CM,one day and he'd run into some money and he'd spend it in a day on gifts.,,
CM,"But he was always nice to them. And, oh yes, their brother was perfect.",,
CM,To the whole family. So evidently thece was a lot of love.,,
SS,Do you think that affection was actually shown?,,
CM,"Oh yes. Oh very much. I don't know how much my grandfather(noise) much, exactly",,
CM,"but they respected him. And, Pap, they called him, I think, and he was Uncle",,
CM,"Pete to most people in town, that way, but to their mother, very dear. And",,
CM,their mother had Quaker ideals. So it was a strict household. She was horrified,,
CM,by her sister. She didn't like the way her sister had been raised. And her,,
CM,sister did things that were frowned upon in the '80's. She married and divorced,,
CM,"and married and divorced, so forth.",,
SS,was she raised in a separate family?,,
CM,"No. But they were both kidnapped. No, the sister wasn't kidnapped, but they",,
CM,"were raised by an aunt. My grand mother was kidnapped, she wasn't supposed",,
CM,to be with that family. They took her too to have the two together. She was,,
CM,supposed to go with the other part of the family. And this branch was not,,
CM,"a Quaker, wasn't anything. And she would blame it on them.",,
SS,Kidnapped. Sounds pretty serious.,,
CM,It was serious. It was serious. My grandmother was kidnapped. They had lived,,
CM,"in Kansas, it was a Quaker family. And their father was killed in one of the",,
CM,"border fights. The type of thing where they came to the door and said,""Are",,
CM,"you North  If you're Southern sympathizers, Because",,
CM,they were just robbing people. But he was killed and he had had several wives,,
CM,"because they had died of malaria, and that's a common thing, you see, they",,
CM,had so many diseases and plagues and things.They didn't have modern medicine.,,
CM,"And the family was to be divided, because, and my grandmother was so close",,
CM,to her half brothers and sisters. Really more than she was to her baby sister.,,
CM,"And she was to go with them back east, I think, I don't know it was clear",,
CM,to Pennsylvania or one of the other Quaker settlements. But they were dofinetely,,
CM,"Quaker. And they hadn't quite arrived and they were, the baby was to go, with",,
CM,an aunt. Baby's aunt. That was Dell who was quite young. And they decided,,
CM,"to take Elma too. And they started out real early in the morning and my uncle,",,
CM,my mother's uncle Cyrus tried to stop them and he chased them  his,,
CM,"across the, in the covered wagon, but he couldn't and the other relative:",,
CM,didn't get there in time. They got there later in the day. And they were gone.,,
CM,"And they had had Elma stay with them, Elma, my grandmother, that night. For",,
CM,"the last night to be with her sister, is the excuse. And they just left before",,
CM,dawn. this covered wagon.  I don't know they were sorry of,,
CM,"their bargain or not, but she always regretted it very much. 'Cause they were",,
CM,very different in outlook. She didn't want to be with them. She didn't like,,
CM,anything about them.,,
SS,She wanted to be with the Quakers.,,
CM,Oh yes.  much she did. She despised her aunt. She hated her uncle thoroughly.,,
CM,And they weren't good to her. They worked her very hard and she had little,,
CM,chance at education. He was the kind that taught school if there was a school,,
CM,"to teach. Maybe two months, you know. And he'd say,""Well you don't need to",,
CM,"go the first day in the week only, you can stay and help with the wash. Because",,
CM,there's nothing that first day. And don't need to go Friday because she was,,
CM,"too big for her classes, couldn't read with the others. Then she'd stay. Got",,
CM,ashamed. So she educated herself after her marriage. Mostly by correspondence.,,
CM,"And took courses, things. And was really self-educated. She was, my grandmother",,
CM,had it in her to be a businesswoman. They say I'm a little bit like her. And,,
CM,"I think I understand how she felt. And she married, probably the first decent",,
CM,"man that they didn't like and that didn't like them, because she wouldn't",,
CM,do anything to please them that way. They played cards. She never allowed,,
CM,"ploying cards in her house. And there was drinking and she abhorbd it. Remember,",,
CM,"this was in Victorian times. You know, and very,uery strict now, my grandmother",,
CM,"had very, very strict ideas, some of which OT CoorSe, I don't understand",,
CM,at all. She wouldn't read Tom Parne because people who read Tm Peine sometimes,,
CM,"lost their faifeh. Well if any book was going to make me lose my faith, I'd",,
CM,"have to see what it was, because of having something, you know, but I'm different",,
CM,"from her in that respect. But, poor Tom Paine was blamed for a lot of things",,
CM,"I can't understand. But anyway, she was sort of a throwback and I think port",,
CM,"of it she so much, the family their ideas",,
CM,"and the lack of ideals, which were true. She ran away at least twice. And",,
CM,could very easily stay with somebody else. They liked her in the community,,
CM,"and they didn't, these people were not very well liked.",,
SS,Was this the community in Oregon?,,
CM,"Yes. Down in section, different little towns around in there. And, but they",,
CM,generally send her sister to get her back. And she'd go back. And when she,,
CM,married it was understand her sister could live with her. She,,
CM,wanted a home for her sister away from that. But her sister and my grandfather,,
CM,"didn't get along very well, because he would lay down the law,""You can't do",,
CM,"this, or that. And her sister would do it anyway.",,
SS,How much younger was this sister?,,
CM,"Well, I think she was I don't know, three years probably.",,
SS,Was...,,
CM,"Rachel vino, I imagine.",,
SS,Rachel?,,
CM,Delvino. Quaker name. But she wasn't raised Quaker although in late years,,
CM,she did live with some of them. But she kept my grandmother perfectly horrified,,
CM,"of couree, for a while. Except that her house, she was always her sister and",,
CM,"no, she was very tolerant that way. But she was called aunt Del. My mother",,
CM,"remembers her as rather easy going and good natured. And, but my grand mother",,
CM,"had, as I say, rather, she was rather firm in some ways. She was quite a",,
CM,lot younger than my grandfather. I think he adored her. I think he absolutely,,
CM,adored her. And she was good looking. She was very good looking. I have a,,
CM,"little, I have tintype pictures of her. Her hair parted in the middle, combed",,
CM,"in the Civil War style. And the full sirts, probably hoops. And that, bat",,
CM,"she was, she was a real beauty. And, but much younger. And my mother said it",,
CM,"never occured to her that her mother was younger than her father. She was,",,
CM,"but these was probably, that wasn't the best thing, but her brother corresponded",,
CM,when he was able and he went back to the family farm in Kansas and took it,,
CM,"up again. He regained the section. He couldn't get the pre-empted land,",,
CM,could homestead some and pre-empt others. And he couldn't establish ownership,,
CM,"and there was a on that, had been quite valuable,but he did get the",,
CM,"farm and as it was customary, you know, there was a lot of, they buried their",,
CM,families in their hearts. And he said he thought he knew right where those,,
CM,graves were. He knew the house had been burned. But he thought he could go,,
CM,"right there, he said he couldn't find it. The trees had been changed and everything,",,
CM,so he probably planted wheat over it many times.The old cemetery where his,,
CM,"parents, so many of them were buried. 'Cause there were so many deaths in",,
CM,families in those days. Malaria and typhoid and diptheria and things like,,
CM,"that, would just wipe out people.",,
SS,Do you know what your grandmother's ideas about what social justice were?,,
CM,"Rather advanced, I would say. I don't know too much.",,
SS,I just remember reading the were so anti-slavery.,,
CM,"Oh yes they were, I think she was, perfectly terrible. And she was rather,",,
CM,probably wanted equality for women. She was rather strongly that way. She,,
CM,admired women who did things. And I think she was rather modern in those,,
CM,"Quite, would have been quite a modern person. No, I think she was rather true",,
CM,to the Quaker ideals. She didn't follow the Quaker religion. She joined the,,
CM,"only church in town, after she was married. And never changed to another church,",,
CM,"although when they moved to Palouse, it wasn't there. I think it was a Baptist",,
CM,"church. Palouse had everything else, but no Baptist. But she rather respected",,
CM,"most religions. But I think all of them, practically. But no, I think she",,
CM,"was, there was a woman doctor, you know, in Roseburg, in the very early",,
CM,"and I can't think of her name, I've been trying to, but I know Sally Banson",,
CM,knows it. She started to stay and be a doctor. And my mother had great respect,,
CM,"her, having learned to be a doctor and practiced. And she was, she was one",,
CM,"of the very early pioneer women doctors. Back in the that was something. And she,",,
CM,"its quite a colorful story, her life. And was interwoven",,
CM,because her son married somebody in Palouse. The doctor. The lady doctor.,,
SS,She had a successful practice.,,
CM,She had quite a successful practice.,,
SS,They would go to her as well.,,
CM,"Oh she probably had quite a lot of hardships, but she did establish herself.",,
CM,There and in Portland. It was not easy I don't imagine. I think she probably,,
CM,"had, well, pionsring, groundbreaking. I imagine there was quite a bit. Maybe",,
CM,"some women were more inclined to go, I don't know. Because our women had",,
CM,that feeling that it was kind of nice to go to a lady doctor. Although some,,
CM,"of them  accept , either. But it was so hard getting in schools and",,
CM,so hard to get through. Actually I think their problems were more in the,,
CM,"begining when first branched off, you still were in the '30's. Because",,
CM,"Seanette Rankin, the first woman Congress man of Idaho had a niece in Lewiston,",,
CM,"Banet Kinney, and she wanted to be a doctor and she did become a very fine",,
CM,"doctor. And, but there weren't too many girls in medical school at that time.",,
SS,I would imagine most medical schools wouldn't let women in. I know with lawyers,,
SS,there were few places that a woman could go to college.,,
CM,They made it very tough on her. They deliberately made their language rather,,
CM,"vulgar, in the begining and this and that. And they made things very tough.",,
CM,"And then as she got farther in, now this was in pre-med, but the farther in",,
CM,"she got, professors and students alike made it hard then, but as she got",,
CM,"farther, it all disappeared.",,
SS,Rankin?,,
CM,"No, Janet Kinney, her niece, who was her niece. And when she was in medical",,
CM,"school, no problems at all. They accepted her, but you wore on the higher,",,
CM,"you were with more professional and the better, there wasn't the same com",,
CM,"petition. They weren 't being put out by her, she was just another student.",,
CM,"But the others felt threatened. You see.""Maybe she'll get in and I won't.",,
CM,"So we'll get rid of her.""",,
SS,This was as late as the '30's?,,
CM,"As late as the '30's. She told me aboctl in the begining, but then afterwards",,
CM,"just fine. After she was in medical school,no problems. And the boys that",,
CM,"uere in it were very proctectiva and chivalrous and every possible, they",,
CM,"were perfect gentlemen. And when she would be home on a vacation in Lewiston,",,
CM,"the doctors in Lewiston, when they had an interesting surgery they'd say,""Do",,
CM,"you want to come and watch?"" She was a student. They were very nice to her",,
CM,"and she wanted to intern in Cook county, in Chicago and did. And they would",,
CM,"be sent sometimes down in the slums. Well I think this was before, I think",,
CM,"this was when they were senior, year. And they would be sent to do things.",,
CM,And they never let her go alone. Two or three of the boys would go uith her.,,
CM,"And help, you know, it was her turn. And look out for her because theee",,
CM,were kind of dangerous slums. And they would go and maybe deliver a baby or,,
CM,something. She told me about it. She said the big problem would be to clear,,
CM,the room. She said maybe you'd have 30 people in an 8x10 room. They'd make,,
CM,"'ern get out, and then they, take paper, newspapers and spread it, cover",,
CM,everything. They wouldn't have time to clean. But newspapers do. They carry,,
CM,"disease. But she said, oh no she had no problems then. Its just in the begining",,
CM,"when you're first doing. You, its in the pre-med and I think there's more",,
CM,"struggles to get into, into that. People, for instance, now, its very hard",,
CM,"to get into a vet school. But once you're in, I think you're alright. You",,
CM,know. There they're more accepted. But they'll do everything to discourage,,
CM,somebody,,
SS,"Your grandmother sounds like she was an independent person,",,
CM,"And yet, very, very proper. As I say, she was horrified of her sister. My",,
CM,"mother said she overheard her say to a friend,""I don't think they have a",,
CM,"Bible in the house.""(laughs) She was very proper, but still, yes, independent.",,
CM,"You know, I mean, those first women that were working for women's rights,",,
CM,"and I'm sure she respected every one of them and admired them, they were",,
CM,very proper people . They almost balanced irregularities otherwise. Buu of,,
CM,"course, anything she did or said was alright with my grandfather. He just",,
CM,"thought she was wonderful. But when her brother came to visit us, as I",,
CM,"started to say, he had his wife, Rachel, was with him. And Rachel was also",,
CM,quite a bit younger than . And there was a picnic someplace. And,,
CM,"that was one of the big celebrations of the time, you know. There wasn't",,
CM,"very many things to do for entertainment. And Cyrus, my grandfather, I think,",,
CM,"I don't know if he was there or not, he might have on a trip. But anyway,",,
CM,"""Oh, we won't bother to go."" And that was so like my grandfather, too, might",,
CM,"have said that. You know, he wouldn't bother. And my grandmother looked at",,
CM,"her brother and she said,""Oh yes you will. Now look here, Rachel is a whole",,
CM,lot younger than you are. And she will enjoy going. And she needs an outing.,,
CM,"You will just take her! You will go!"" And of course, a sister could say it",,
CM,"to her brother, a wife didn't feel like saying to her husband.Mother said,",,
CM,"""I was grown before I realized that probably she was speaking for herself,",,
CM,"too.''There had been lots of times that she had wanted to, and of course they",,
CM,"wouldn't bother, and she'd to her husband, she might not object, but",,
CM,"when he was gone she used to go and take the children, to picnics and things.",,
CM,And Fourth of Buly celebrations and so forth,,
SS,Hob much age difference do you think there was.,,
CM,"Quite a bit. Twenty years, I think.k Quite a bit. Oh yes it must have been",,
CM,"that. Now, he was, oh yes, at least 20 years, I think.",,
SS,How old do you think she was when she was kidnapped?,,
CM,She was about eight.,,
SS,Twenty years difference...,,
CM,"Its quite a difference, you see. And he had had this adventurous life, 'cause",,
CM,"he had run away from home. My grandfather, they lived in Luxembourg. And",,
CM,"father ran a distillery, and then like most Luxembourg families, they",,
CM,to the city. But they had a farm out from there too. His mother was dead and,,
CM,"his father had a housekeeper. I think she kept probably the family clean, fed",,
CM,"them. But his father was very busy and there were other brothers and one sister,",,
CM,He was the youngest brother. And they sort of picked on him. He got tired,,
CM,"of that, and he run away to Holland. And he had to work one year^two doll",,
