speaker,words,tags,timestamp
CM,"anyway, in the family. And he had become a Catholic and was disowned. And",,
CM,he had written his sister and told her to scudy: it and she did. She became,,
CM,"a Catholic. And her mother was disowning.And so then, she wanted to be a",,
CM,"nun, thought she did at that time. But she was sick and she was at this",,
CM,hospital. And she did beautiful paintings. And she said Dr. Frank was always,,
CM,buying some of her paintings to help her out into a way. And things that way.,,
CM,"And she'd give him one and,""Oh don't do that, I'll buy it from you."".He was",,
CM,"so nice to everybody. And she said he was tall, wore a Van Dyke beard. Very",,
CM,"dignified, I think. But she said if Jesus had been a brunette, he looked like",,
CM,you mould have imagined he would look very much like probably the real Jesus,,
CM,"would have looked, because I don't think, since he was undoubtedly Jewish",,
CM,"I doubt if he was a blonde. But anyway, she said he looked, except for that,",,
CM,"and they all liked him very much. And he was the head surgeon, and they had",,
CM,other doctors in this. And of course they were some interns and their being,,
CM,"there, why they played tennis with the interns, and they really had quite",,
CM,a time. And there was girls there for different reasons and one of them I,,
CM,guess was there because she was inclined to drink. And mother went with her,,
CM,"shopping sometimes, once and somewhere she pulled a faint and got a drink.",,
CM,And mother had an awful time getting her back and they were pretty angry at,,
CM,her. And then she wrote to her family and she wanted some money and they wouldn't,,
CM,"let her have any money. And she wanted certain things, so they, she got her",,
CM,brother to send^to mother. And she bought her this fancy work and all that.,,
CM,"But finally, the second largest hotel in Chicago at the time, We forgotten",,
CM,"the name of it, wasn't the Palmer House, it was another one. Evidently went",,
CM,on a drunk. And she arrived to be sobered up with her maid! And they put her,,
CM,"in a certain room and they had had her before. And someway or other, this",,
CM,"Amanda and she were kindered spirits about drink. And so she got some money,",,
CM,"some.-of this money, anyway they got some drink. And mother had a very angry",,
CM,sister facing her about that money. 'Cause she wasn't supposed to do that.,,
CM,Well she accounted for every bit of it back and they had quite,,
CM,a time. And there was a famous surgery case of  brain surgery and she,,
CM,was in on that. Went with the girls some places and went around Chicago with,,
CM,"different ones, different things, seeing different things. Went with this",,
CM,"one that thought she wanted to be a sister one time, to another place and",,
CM,"she said to her, these were so old fashioned. They dressed, everything was",,
CM,"out of style and dowdy. And she said, ""This girl is calling a sister."" And",,
CM,"she said,""But, oh yes, they belong to an order England, where they were",,
CM,"persecuted if they were Catholics. If they were sisters they would be hung.""",,
CM,"So they didn't wear the habit^and they wore, she said, the most, kind of trains",,
CM,"and old fashioned things, but oh so dowdy looking. And she says,""Seems so",,
CM,"strange to have them called sisters.""But St. Elizabeth was not the big hospital",,
CM,"they later became. They had insane people there, one woman that always thought",,
CM,"she would starve to death, and so all her food, she was always hiding it.",,
CM,And she would stuff the hem of her dresses and everything and every so often,,
CM,one sister would go in. You didn't see her but mother said she undoubtedly,,
CM,vhad red hair and she'd go and clean her up. And one that always put the furniture,,
CM,"up on top of each other. She stacked it and stood on top of it. She would be,",,
CM,a chair on top of a dresser and a stool on top of a Ard one that always,,
CM,"came out and said,""All is tote."" That meant, all is dead.",,
SS,What?,,
CM,Au is toch(see tape for coreect pronounciation) Everyting was dead. That was,,
CM,"what it meant in her, and they...",,
SS,And toch meant...,,
CM,"Evidently. And they had somebody stay with her and the family, which was evidently",,
CM,"wealthy and they had a girl who spoke her language stay with her, but once",,
CM,"in awhile she'd be out of the way, and she'd get away and she'd run into the",,
CM,"other rooms and grab them and say,""Au is toch."" Mother said, it's scare you",,
CM,"to death, almost doming out of ether or something. And they",,
CM,"found out that aha/' e^her, but that she swallowed her;tongue. And",,
CM,"Iguess anybody^wallows their tongue always swallows their tongue,under anesthetic",,
CM,"and she did always, all her life.",,
SS,Who?,,
CM,"My mother. She'd swallow her tongue. And she told, she had other surgery,",,
CM,"she told the doctor, I remember as a child,"" I swallow my tongue."" He said",,
CM,"""Good thing, we'll watch it."" And certain people do. I have a friend who",,
CM,always swallowed her tongue and they have very sore tongues afterward.,,
SS,Its interesting that at the Chicago hospital they,,
SS,the hospital too.,,
CM,"Yes. They wouldn't now, but it wasn't that busy.",,
SS,I know over here it was Orofino...,,
CM,"But these were wealthier people and they, their family, it was like a private",,
CM,"sanitarium, part you see. And there were several wealthy people there. Older",,
CM,"women. And most of them spoke another language. A lot did. But as I say, people",,
CM,from business that they would sober up once in awhile. Well they do that,,
CM,"once in awhile in a hospital now, I guess. I've known of that happening in",,
CM,"St. Joseph's in the old days. I don't know what they do now, but of course",,
CM,I was quite familiar with St. Joseph's as a child. Climbed in back of the,,
CM,pendulum in their big clock once. And I was quite small. Tried to get in.,,
CM,"I don't think I got very far, but I tried. And my father was operated on there",,
CM,"when I was four years old, for appendicitis and he had gangrene. He came",,
CM,"through fine, which was quite a deal in those days, in 1910. And he was in",,
CM,there a long time. You were hospitalized a long time. And any time my mother,,
CM,wanted to go to the hospital she took me and I meddled with the sisters house.,,
CM,"They took care of me. Always, that was one reason when she had an eye infection",,
CM,she debated about going to Spokane or going to Lewiston. And if she'd gone,,
CM,"to Spokane she would have gone to Dr. Hopkins, who was married to a Vollmer.",,
CM,"I think was a very good doctor, I think she would have been better off with",,
CM,him. But she decided it would be so easy to come to Lewiston. My father was,,
CM,"very busy, it was a busy time in the cannery and he wouldn't hve much time",,
CM,"to look out for me and in Lewiston, she used to bring me along. My folks'",,
CM,sister's house. They looked out for me. Now of course it's not a bit like,,
CM,"that. It's tfery institutionalized, but in those days.",,
SS,Your mother was Catholic?,,
CM,"My father was, and she converted and they were married in a church. And one",,
CM,"time my mother, and they always did a lot of things for the sisters. They,ee",,
CM,had an acreage and the fruit and the vegetables was always given to the hospital.,,
CM,Most of that was from our place for years. And they never accepted pay. So,,
CM,the sisters felt very loyal to us. I can remember staying with them back as,,
CM,a child. Mother Borgia . I had feeling you know. But I know,,
CM,that when I was six years old was very sick. Dad was out of town and we were,,
CM,"on, we weren't living in Clarkston. We owned thase places over here, but they",,
CM,"had had the cannery, the company had had a cannery on Snake River Avenue.",,
CM,And we had stayed across the street in the Pierces. And the Millers. Miller,,
CM,grade's named for. And was old time Lewiston. Snake River was begining,,
CM,"to be very down then, commercial and not nice. But Edna still lived there",,
CM,"and she was, as I say, contemporary to the Vollmer girls and all that, and",,
CM,"accepted by everybody. And it was perfectly, my mother went otfer and we stayed",,
CM,"at Edna's. And it was at her house, and mother was very sick. She was just",,
CM,having a terible time. She couldn't breathe. So she almost choked to death,,
CM,one night and so she decided that she needed She went up to the hospital,,
CM,"she said,""I want to be put to bed and taken care of."" ""Who's your doctor?""",,
CM,"I don't want a doctor, I just need nursing!"" ""Mrs.  we're gonna lose",,
CM,"our if we do that.""",,
CM,"Finally they couldn't turn Mrs* down, so they kent Mrs. and they",,
CM,had a sign on the door and l went as usualy over to the sisters house. And,,
CM,every sister came in and did something for her. She had her throat sprayed,,
CM,and she had a gargle and she had this and she had that. I think they all did,,
CM,"everything they could think of to do, because cause they would",,
CM,"lose their right to practice if they did that. I mean, to run the hospital.",,
CM,They would lose their license. She was in there without a doctor.,,
CM,They would be in real trouble. So they all worked on her very hard and they,,
CM,liked her. So in a few days she was better. We came home and she started to,,
CM,"whoop. She had whooping cough in about four days, and she had been very sick",,
CM,"of course, with whooping cough. So I had whooping cough too.",,
SS,Is that what she had had?,,
CM,"Yes. It was whooping cough. But she hadn't whooped yet, you see. She didn't",,
CM,"do it until after she'd come home. They didn't know, they thought she had",,
CM,"croup or bad cold or something, you know, wrong with her, but it loosened",,
CM,"up, you see, with all this attention. Oh, nose sprays, throat sprays, you",,
CM,"name it, she had it for awhile I know. And she said,""All I need is good nursing.""",,
CM,And she got it.,,
SS,You said before she had a great attraction to cures and remedies.,,
CM,"Oh yes. She went to the osteopaths and she, there weren't chiropractors in",,
CM,"those days, but all those rub doctors. I was drug to every one of 'em. And,.,",,
SS,"Is that what a chiropractor was, an osteopath in those days?",,
CM,No. They weren't. We didn't have chiropractors. That came later. They were,,
CM,"osteopaths and different kinds of homopathic, you name it. But osteopath was",,
CM,"best trained of any of them, but there were others. And mother had great faith",,
CM,"in alot of that. Along with being very, very strict on good doctoring because",,
CM,she'd had this background at St. Elizabeth's. The best of surgery and the,,
CM,best of that. And complete faith in and then she'd fall for all these,,
CM,other things too. And every fad that came along and diet or anything else.,,
CM,And always oould fast and starve and Ithink caused alot of her later trouble,,
CM,"by, oouldn't too much strong willpower about that. It was quite afad to fast",,
CM,and mother would always fast longer than anybody else. Wasn't muoh you oould,,
CM,"do ebout it. She was anything like that. She, went through the whole bit.",,
CM,"And, oh yes, she was...",,
SS,Was it because of her bad health when she was-growing up?,,
CM,Idon't know. She just got interested and she was pliable. Quite,,
CM,a little bit gulliable on that. I think.,,
SS,All those old patent remedies...,,
CM,"She didn't take much of that, no.",,
SS,But that had been so popular.,,
CM,"Qh yes. You see, people died so, so many things. No, she didn't like the patent",,
CM,"medicines. She knew agirl who blamed pink pills for pale people, her mother",,
CM,"had taken them and died, 'cause she didn't get proper medical attention. The",,
CM,"Pills didn'.t kill her, but it was the medical attention that she didn't get,",,
CM,"that was the main thing, the trouble was. value for",,
CM,"certain things. But it didn't do half what it claimed it did. You name it,",,
CM,it cleared baldness and kidney trouble and fallen arches and the whole bit.,,
CM,"It straightened out your spine, took care of your stomach. And no medicine",,
CM,did all that. And mother was quite advanc on that. In the early times,,
CM,in Lewiston she stayed at Piersdorfs after she left the Thatcher home. She,,
CM,"was at, when she came to Lewiston she went to the Raymond House. And that",,
CM,was fifty cents ameal. She couldn't stay there very long. So she stayed at,,
CM,Thatcher's and then at Piersdorfs. And Nrs. Piersdorf had adaughter who,,
CM,"had, was deaf. And probably deaf from diptheria or something, that had not",,
CM,"had good attention and it affected her ears.Infection, they didn't know what",,
CM,"to do in those days. And she'd gone deaf, Laura. Her name was Laura like my",,
CM,mother's. And Laura had an infection in her hand. And their family doctor eas,,
CM,"a very good doctor, but not modern at all. And he didn't know what to do for",,
CM,infections. He knew measles when he saw them and scarlet fever and smallpox,,
CM,"and chicken pox and those things, he was pretty good on 'em. But he didn't",,
CM,"know, probably was pretty good on diptheria and typhoid, as good as they were.",,
CM,"But he didn't know what to do on infection. And he was Mother knew it was wrong, because",,
CM,that wasn't the way they did it at St.,,
CM,"Elizabeth's. They didn't do things like that at all! It was very different,",,
CM,she knew that. And the hand was getting worse and infection was going and,,
CM,so Dr. Shaft was a more modern doctor. And was her doctor. And so she just,,
CM,"knew that child should go to a better doctor. She'd lose her hand, she'd lose",,
CM,"her arm, might lose her life. She got very worked up. So she talked to Grandma",,
CM,Piersdorf about it. Well Grandma didn't like to change doctors because he'd,,
CM,"been such a good doctor to her family and she said,""Well but you can't.this",,
CM,"is just too much."" ""Well alright Laura, if you feel that way you can take",,
CM,"her.""She wanted to take her, she says,""I'11 take her."" So then she had to",,
CM,"argue with Shaft.""You're Morris' patient,""he wouldn't touch her.""Well I have",,
CM,"permission to take her to you. That's alright."" ""Well, no."" She says,""Look",,
CM,"doctor, he's poulticing it. With bread and milk."" ""What?"" She described it.",,
CM,"Well that wasn't right. She says,""Now look here. That giro's already deaf.",,
CM,"Do you want her to be one armed?"" ""Well bring her in."" And of course he, I",,
CM,don't know why he didn't do something very different and cured it. And she,,
CM,"said if it had been the other way around, Dr. Morris didn't speak to her for",,
CM,"months. But if had been Dr. Shaft in the position, he never would've spoken",,
CM,"to her again, but Morris couldn't stay mad longer than that. He was a different",,
CM,"turn, you know, but the two doctors didn't get along. They didn't. But...",,
SS,Do you know how the deaf Laura got along?,,
CM,"Oh yes. fine. She grew up, she talked this way and read lips beautifully and",,
CM,"her children, she had grandchildren who are doctors now in Spokane. Very fine",,
CM,doctors. Some of the best. She married and her children talked to her this,,
CM,"way, you know, with the hand. My mother did. They could talk one hand or both.",,
CM,I don't know. I couldn't do it. I know I and few things. But I couldn't,,
CM,"begin to, but mother always could talk to her. And they always were friends.",,
SS,She could make herself understood to your mother?,,
CM,"Oh yes. She talked, but she couldn't hear.",,
SS,She lost her hearing after she knew how to talk?,,
CM,"Oh yes, afterwards. And it was some childhood sickness or something. Probably",,
CM,something with the throat and your ears are so easily affected. She went,,
CM,"deaf. She wasn't born deaf. And she raised a family, very nice family. She",,
CM,did very well. And her children were very fine. Irene de Sac and her children went,,
CM,to Harvard Medical school. They did alright.(laughs),,
CM,But it would.ihave been too bad if she'd lost her arm. Would have been another,,
CM,handicap.,,
SS,What did you think of those naturopaths?,,
CM,"Well I didn't like them much and now, my mother was very strict on some of",,
CM,them. There were some that were not really what you'd call the rub doctors,,
CM,"but the other kind. Sort of pills, oh, they got their diplomas in, by the",,
CM,"mail, by paying so much money and like this business of the ministers we've",,
CM,"just been hearing about, they got their thing for fifty dollars. And mother",,
CM,was quite horrified. A lot of that and of course I always was. And she said,,
CM,"she kind of got in trouble with one time. She, one of them, she thought very",,
CM,"unscrupulous in Lewiston. And she, a very attractive young woman was in there",,
CM,with her son. And he was not doing well at all. And they ateAthe same hotel,,
CM,"a few times, 'cause mother often ate out, working. And that was down at the",,
CM,"DeFrance. And she said,""Well why don't you take him to a good doctor?"" She",,
CM,"said she had a good doctor. And of course, very indignant. Wasn't anything",,
CM,"more, and the boy died. But she married the doctor. And mother felt he was",,
CM,just completely beyond the pale and I know Dr. Shaft and some of 'em thought,,
CM,"he be^run out of town. He wasn't recognized in the medical profession,",,
CM,but they had a lot of that around* Now I don't know. Moxley may have had,,
CM,"training as a doctor and he was the druggist. And he, Moxley building is over",,
CM,"there in the Moxley sisters, he has sisters still here and I read something",,
CM,"about, he had more training and he was a druggist too. But I know, and this",,
CM,"was one unusual thing. My mother got a felon, that's a bad infection on the",,
CM,"finger. And I was just horrified. I was only six years old, but I was scared",,
CM,"of people got blood poisoning and people died. My mother must die. Mother's,",,
CM,you know. And I was just very upset and I thought she should go to the best,,
CM,"doctor, we usually went to Shaft who gave you the most bitter medicine ever.",,
CM,"The worse it tasted, the better it was for you, was his theory. Otherwise,",,
CM,"he was nice. I liked him. But, no, she said,""I'm going to Doc Moxley."" Always",,
CM,called him Doc Moxley. And it was rather an oldfashioned drugstore by that,,
CM,"time. It was down, the Moxley Building is sbhere. And there were more herbs",,
CM,"and things around, a little bit than some of them. And Lwent with her and",,
CM,I was quite fearful. He gave her some pink pills. And she got better immediately.,,
CM,Everybody that had anything wrong wrong with their fingers in Lewiston went,,
CM,to Dr. Moxley. And I know I've talked about some of theseAsecond generation,,
CM,"people from some of the oldtimers, they say,""Oh you always went there for",,
CM,"fingers."" And he had something that he gave people for infection in fingers.",,
SS,He was a druggist?,,
CM,"He was a, well he may have, he was more of a doctor, certainly that these",,
CM,others were. But he practiced more as a druggist. But they called him Doc,,
CM,and he may have uhad some doctar training. I think he did. From what his sister,,
CM,"said, he must have had, training in that line.",,
SS,But he ran a drugstore?,,
CM,"He ran the drugstore, that was his main...",,
SS,He practiced medicine on the side.,,
CM,"Yes, a little bit. ut his main thing, what ever he could give, he had something",,
CM,"that, I don't know whether he had penicillin without knowing it or what. Or",,
CM,"something that he gave. He knew some drug for that, that was just evidently,",,
CM,"oh yes, you always went to him for fingers. No matter what else you did otherwise.",,
SS,Your mother knew his reputation.,,
CM,"She knew his,""I'll go to Doc Moxley.""",,
SS,id he give everyone the same thing?,,
CM,"I don't know, something for infection, evidently.",,
SS,Did you mother ever deal with Foster?,,
CM,Yes. That was how the cannery got in Juliaetta. She heard about Dr. Foster.,,
CM,"And so she decided.""I*must go to Dr. Foster. I wasn't quite that well. AcutuaHy",,
CM,I wasn't really very sick either.,,
SS,You?,,
SS,"CM; Yefs So she took me up to Dr. Foster. And I think I went mostly to Dr. Marsh,",,
SS,"who was an osteopath graduate. And when we were in Juliaetta, she decided that",,
SS,was a very good place for a cannery. There was a lot of fruit. And she,,
SS,"came back and that was my father, the canneries were big business in those",,
SS,days. And so they talked about it and he was with the Cherry Growers Association,,
SS,and they decided to build a cannery in Juliaetta. Because my mother had taken,,
SS,"me up to Dr. Foster. And so the cannery, Dr. Foster left, and came down heee.",,
SS,"But they built the cannery. And that gave Juliaetta, after they lost Foster.",,
SS,Because when Foster was there everybody who wanted to keep a boarder kept,,
SS,a boarder. Or rented a room. And gave a little money in the town. As well,,
SS,"as the hotels. And^they were just going to starve to death, there was no",,
SS,business. They eere so mad at Foster for leaving. But the cannery came. And,,
SS,then they all worked in the cannery. They could all make a little money.,,
SS,Juliaetta's always been a little lucky.,,
SS,What was Foster like?,,
CM,I think he used a kind of acid to remove skin cancer. Now I doubt if he did,,
CM,anything beyond that. But did work on skin cancer in the early stages like,,
CM,"they use electric needle and that now. He had what would be considered, what",,
CM,"my mother always called a power of suggestion. He wasn't quite a faith healer,",,
CM,and yet almost. And did he have a cefctain something. A magnitism and he could,,
CM,"read your mind, apparently, because I got very panicky down here when I realized",,
CM,"I might have a goiter. And to me a goiter was very bad. You had a goiter,",,
CM,"you mere operated on, you died. Because one girl, the only one we knew had",,
CM,"had a goiter operation and she died. And that, even to this day I would be a very",,
CM,bad goiter operation patient because I still remember this girl that died,,
CM,"and it would be very, Iknow I said to a friend of mine, I think of her and",,
CM,"she died.(laughs) I couldn't help it, she says ""I know better, but I still",,
CM,"do it5 We know that that isn't necessary, but it still would be... And so",,
CM,at fifteen I went saying Ihad agoiter and it's not very noticable. Idon't,,
CM,suppose you've noticed I have a goiter. But it iaa't exterior. Well I was,,
CM,"quite upset. So mother took me to Foster. And he looked at me and said,""You're",,
CM,"pretty healthy outside of that goiter."" Just like that. One other doctor has",,
CM,"since, he said,""That'a a peculiar goiter."" And only two doctors, the other",,
CM,was an MD. And he gave me something to put on it that I don't think did a,,
CM,"bloomin' thing for it, it was iodine and water and sand, I think. It spoiled",,
CM,a lot of bedclothes for a while.,,
SS,"When you went to see Foster, what was it for?",,
CM,"For the goiter. Before I ever told him, he knew pretty well, except for the",,
CM,goiter.,,
SS,This power of suggestion...,,
CM,"He had this certain way, now he wouldn't call himself a faith healer, but",,
CM,"he would say to you,""You're going to be better or something, "" and you generally",,
CM,"were. I don't know. It's something there. And he had a daughter my age, I",,
CM,went to school with. And she was very much like her father.^The other children,,
CM,weren't. They were all their mother's children. But Leva was her father's,,
CM,"and very, very close to him. And he always blamed himself for her death. He",,
CM,was drining and he did That was his besetting sin. And he said,,
CM,"he didn't take care of her. And she died, got pnumonia and died. Whether or",,
CM,"not, I think she probably had care. But maybe he could have done something,",,
CM,"who knows? Anyway, from that time on Dr. Foster, he gave up, you might say.",,
CM,He drank too much.,,
SS,After she died?,,
CM,After she died he was never the same fella. He never got over grieving for,,
CM,Leva. She was my age. We were in the same class in high school. Been in the,,
CM,grade schools together. And she was more his child. Now I think he was horrible,,
CM,"man for his wife to live with. But, and she was a nice person. But and he",,
CM,had two boys that I knew in school. Bob aas a little older and Bob became,,
CM,"some kind of a doctor. He's in Portland. And Charley too, worked with his",,
CM,"father some. And they studied and went off and studied, became some of",,
CM,sanipractic or something. And not that then licensed to practice. Bate lives,,
CM,in Lewiston now.,,
SS,Babe?,,
CM,"UH huh, the younger girl.",,
SS,His daughter?,,
CM,Uh huh. Her husband is one of the partners in bhe Greyhound bus depot.AMr.,,
CM,Nelson and whatever his name is. And his wife is Babe. We talked about him,,
CM,"not long ago. She was in helping out in the resturant there, they own. She",,
CM,"doesn't work there very much, but she did a little bit, I said, I'll aways",,
CM,"remember something your father told me. He said, I had said if I were them",,
CM,"I'd do so and so.""Don't you ever say that! Don't you ever say if you, you",,
CM,"don't know their pressures, you do probably just what they do. Don't say that!""",,
CM,"And she laughed, she said,""Yes he said that to me so many times,""Don't you",,
CM,"ever say that!"" If I weee them, I'd do so and so, because you don't know what",,
