speaker,words,tags,timestamp
SS,"I was born in Dayton, Washington, but my family moved there and put",,
SS,a gristmill in.,,
SS,In Lapwai?,,
SS,In Lapwai. And they had no high school and I had finished eighth,,
SS,"grade when my family moved in there, so Ihad to leave to go to school",,
SS,because there was no high school at that time. But I think the Indians,,
SS,resented thetpeople coming in there on the reservation.,,
SS,Were most of the business people in Lapwai white people at the time?,,
SS,"Oh, yes. There was the postmaster and he had a store there in connec",,
SS,"tion. And then there was- let's see, when we came there- they had a",,
SS,"general store, a livery stable right on Main Street, and a grade school.",,
SS,"That's all they had in schools. And Indian Agency, they did have",,
SS,the Indian Agency up there. Superintendent and a doctor. And the,,
SS,children came in for their education and their treatments for their,,
SS,health; they had good care. The government took good care of the child,,
SS,ren.,,
SS,But no high school education and all.,,
LM,"They had the agency there; Lord, the sanitarium they had there for—",,
HBM,No high school there.,,
LM,Quite a payroll then.,,
HBM,"Oh, yes.",,
LM,"Good for that little old town. We had how many stores? Thrifty stores,",,
LM,"too. One, two, three, four five-",,
HBM,"Well, I was trying to think.",,
HBM,There was about six or eight stores there.,,
HBM,A drugstore-,,
HBM,"A thrifty burg in 1912- '11, '12, '13, '14, til the road changed. The",,
HBM,"highway finally just passed, and cars came. And the agency left. They",,
HBM,"picked it up and brought it up to Moscow; okay, we had no pay from",,
HBM,"that anymore. The Indian, when he'd get his money up there, before",,
HBM,he got home it was all spent either in Moscow or Lewiston before he,,
HBM,"ever got back. And the town just fell to pieces in just a short while,",,
HBM,too. Went down that way.,,
SS,The old road had gone right through Lapwai?,,
LM,"Well, the new highway just went by the side of it. But they didn't",,
LM,"bother my business; our business, we depended on farmer area around",,
LM,"there. Repair work, such as shoeing horses and setting tires. I",,
LM,was setting there right in the horse age then.,,
HBM,They had the Presbyterian Mission there. The MacBeth sisters were,,
HBM,there as missionaries.,,
SS,When you were there?,,
HBM,When we were there. Very fine friends of ours. And I knew Aunt Kate,,
HBM,MacBeth real well.,,
SS,Can you tell me some of how you remember her?,,
HBM,"I remember her so well. In fact, I have a book in here. Mrs. Clyde,",,
HBM,I've given Mrs. Clyde quite a little bit.,,
SS,"Oh, really? I know her very well.",,
HBM,I've given her a few notes on the Mission. But Aunt Kate MacBeth was,,
HBM,"Scotch, rather heavyset, blue hat, always wore that on the back of her",,
HBM,"head and a . on her arm, and she'd come down for the mail every",,
HBM,"day. Very strict. The Indians, why, they wouldn't think of buying",,
HBM,"anything on Sunday! They'd go to church and come home, they'd go without",,
HBM,"food/ wouldn't stop and buy anything on Sunday, because Aunt Kate",,
HBM,"said it wasn't right. They had that,buckskin horse, and drove the",,
HBM,horse hitched to a little old buggy back and forth to Spalding after,,
HBM,"you came, didn't they?",,
LM,Yeah. Put shoes on the horse a number of times.,,
HBM,Every Sunday they'd go down to Spalding.,,
SS,Every Sunday?,,
HBM,"Drive over Thunder Hill, conduct their meetings. Things would be",,
HBM,sent from far away places to the Mission for the Indians. And I,,
HBM,spent a lot of time up at the Mission. And one time there was boxes,,
HBM,"of hats sent from New York. So Aunt Kate and Miss her niece,",,
HBM,decided they'd distribute those hats among the Indian women. So the,,
HBM,"next Sunday morning, here they came all decked out in those hats!You",,
HBM,"never saw anything so funny in your life! She said, ""Well, I think",,
HBM,"you'd better go back to your handkerchief, you look more at home in",,
HBM,your handkerchief! (Chuckles) And they'd tell that story and just,,
HBM,"laugh! Oh, that Sunday morning with those Indian women all decked out",,
HBM,"in those fancy hats from New York! She said, ""I guess you can put",,
HBM,"your handkerchief back on, you look more at home in your handkerchief!""",,
SS,"Did they do schooling, too? Was that part of their mission work?",,
HBM,"Yes, they taught principally their Bible. They, adults and trained",,
HBM,men for the ministry. That was really their business; training the—,,
HBM,And they did a good job of that until the board got so strict they,,
HBM,wouldn't accept Aunt Kate's ministers as ordained ministers.,,
SS,You mean the Nez Perce ministers? The Indian ministers?,,
HBM,"Yes, they wouldn't accept her training- the ministers she trained,",,
HBM,they wouldn't ordain the ministers she trained finally. And then they,,
HBM,closed the mission.,,
SS,"Is that the reason why, do you think?",,
HBM,"Yes, more or less. The Church Board wouldn't accept her ministers,",,
HBM,as ordained ministers without going through the Board.,,
SS,As I remember there'd been a large number of Indian ministers.,,
HBM,"Oh, yes, thew ""have a lot of Indian ministers who were trained",,
HBM,right there at that mission. But they got so strict about it that,,
HBM,they- the Indian men had to go through a certain schooling in order,,
HBM,to be ordained.,,
SS,Do you know if the sisters traced the history of their mission work,,
SS,back to Spalding and his work in the very early days?,,
HBM,Not too much. They didn't do that too much. You didn't hear much,,
HBM,"about Spalding through them. I don't know when Aunt Kate came, I",,
HBM,"don't know the dates that she came there. But the neice, Elizabeth",,
HBM,and Mazie Crawford came in 1904. They came up the river on a boat.,,
HBM,That's how they came into Lewiston.,,
LM,Now Mazie came - when did you say? 1904?,,
HBM,Uh-huh. That's when the Crawford girls came in 1904.,,
LM,Mazie and what was the other one?,,
HBM,Elizabeth. But Aunt Kate came before that.,,
SS,"When you say fantastic stories, you're thinking of Mazie Crawford's",,
SS,stories?,,
HBM,"Oh, I wish I could remember some of the stories she told about her",,
HBM,boat trip up the river.,,
SS,"Oh, her boat trip? I see.",,
HBM,She told some wonderful stories. And I have her book. Just a little,,
HBM,paperback.,,
SS,"Was it a very strong influence, do you think, the presence of the",,
SS,mission on the people?,,
HBM,"Yes, I think so. With the Indian people?",,
SS,Yes.,,
HBM,"Yes, oh, yes. Yes, 'p think so.",,
HBM,They depended a great deal on tha'mission. And they had a great in,,
HBM,fluence among them. I think. They respected them very highly and the,,
HBM,lady there who has the post office spoke the Nez Perce language just,,
HBM,as well as any Indian I ever heard. Spoke it beautifully. And that's,,
HBM,where I learned most about the Indians as they would come in and talk,,
HBM,"with her, they took her advice, you know. ..They didn't go to the mis",,
HBM,"sion, they would come to Jennie, and Jennie would always help them out",,
HBM,"with whatever it was; their renters or their money or an ything, they",,
HBM,could come to her and she would advise them and could tell 'em in their,,
HBM,own language; explain. But the mission had a great influence.,,
SS,How do you think she learned the language? Was she raised there?,,
HBM,"Well, her uncle was up at the agency. Mr. Barton- let's see, Whitman",,
HBM,was an uncle of her's.,,
SS,Which Whitman?,,
HBM,Marcus.,,
SS,"Oh, really? And her name was Jennie?",,
HBM,"Jennie Barton, but her name was Whitman. Oh, I just wish I could",,
HBM,speak it like she could!,,
SS,So it sounds like she cared very much for the Nez Perce people.,,
HBM,"Oh, yes, very fond of them. They had a store and-post office; grocery",,
HBM,"store, and blankets and shawls and,silk handkerchieves and the beads.",,
HBM,"And the Indian women would come in there and say, Jennie.",,
HBM,"And Jennie'd come out and they'd explain what they want, talk things",,
HBM,"over with them. Oh, it was so interesting to hear them because Mrs.",,
HBM,Barton just spoke it so well.,,
LM,"You worked for them there in the store, didn't you?",,
HBM,"Yes, I worked in the post office and then I'd help out in the store.",,
HBM,"On my vacations, during my vacations, I'd come home and help her in",,
HBM,"the store. But they fascinated me, I was very fond of them, they fascinated me. I",,
HBM,liked to wait on them. They'd buy something for a dol-,,
HBM,"lar and a half, they knew what And the women",,
HBM,carried their money tied up in a red handkerchief tied to their belts.,,
HBM,"Well, if they'd buy three yards of material for a dress, they'd pay",,
HBM,"for that, but they'd turn around this way, get their money out dfow",,
HBM,"they'd pay a dollar and a half. Then they'd buy something else, may",,
HBM,"be, a package of beads and quarter. Turn her back again.",,
SS,They'd pay for each thing separately?,,
HBM,"Separately, then they could keep track of it better that way.",,
LM,Back in that time that you're talking about the Indians really didV?,,
LM,know nothing about a penny or a nickle or a dime. It was ?,,
LM,What was that?,,
HBM,That was a dollar.,,
LM,Wait a minute- what's a quarter?,,
HBM,They called it a quarter.,,
LM,"No, they didn't. Two bits. Four bits. Six bits. They didn't know",,
LM,anything about making change at that time. And really you never saw,,
HBM,No paper money.,,
HBM,nickels in those days. Down in our country there was,,
HBM,"more quarters, because the Indians, they didn't know anything else in",,
HBM,"figures but two bits was twenty-five cents; four bits was fifty cents,",,
HBM,Six bits then a ? . So the stores worked on a pretty good margin,,
HBM,"all the time. (Chuckles) When we came there, I never saw a penny.",,
HBM,"For years there we never saw a penny, when we first to this counttry.",,
HBM,"And very few nickels, and especially where we were down there.",,
HBM,"Two bits, four bits, six bits.",,
SS,What did you say if you wanted a blanket?,,
HBM,Shawls and blankets. You tell 'em ? That's ten dollars. And,,
HBM,they had money. They never came in there to buy unles they had money.,,
HBM,She did trust some people. She never kept books; Jennie never kept,,
HBM,"any books. When she'd ask me to help her in the store, I'd say, ""Well,",,
HBM,"Sophie bought a blanket."" ""That's alright, she'll come in and pay it",,
HBM,"next week "" They had no books, never did keep books. Those Indian",,
HBM,"people would buy those things and '"" knew and trusted them. They d",,
HBM,"come next week or whenever they promised, they'd come in and pay her.",,
HBM,"I'd say, ""How can you do that? You don't have books."" She had a",,
HBM,good memory and she knew all those Indian women and she knew they'd,,
HBM,pay.,,
SS,It sounds like also that she was very accepted by them.,,
HBM,"Oh, wonderfully. Yes. They knew that she was a Whitman, you know.",,
HBM,A descendant of Marcus Whitman. They trusted her. They'd go to Jen,,
HBM,"nie or they'd go to the Presbyterian Mission there. The missionaries,",,
HBM,"too, they trusted them.",,
SS,Do you remember any of the kinds of matters that she did help people,,
SS,"with? Say, like allottments and that sort of thing?",,
HBM,No the most help that I can remember that she'd give 'em would be in,,
HBM,"their buying, you know, their shawls and handkerchieves and their",,
HBM,bead work. They always kept a lot of nice beads for them. And they,,
HBM,"would ask her advice about property, I suppose, more or less, butho",,
HBM,specific thing.,,
LM,"Yeah, all that old timber is gone. That old timber that we're tal",,
LM,"king about now. That's all gone, see.",,
HBM,"Corbett Lawyer was the last one to go, and he was just bundles of in",,
HBM,formation that he could have talked with you. He was ninety-eight,,
HBM,when he died.,,
LM,"Yeah, I think he was, pretty close to that.",,
HBM,And he was just bundles of information of all kinds. He'd been at,,
HBM,"the agency, worked there.",,
LM,That was quite a loss to them.,,
HBM,So that was quite a loss.,,
LM,"You talk about the old timber that's gone, it's like I am, I'm the",,
LM,last apple hanging on my tree and she and her sister that lives over,,
LM,here is the last two apples hanging on their tree.,,
SS,Can you tell me some about what smithing you did? What the blacksmith,,
SS,business was like? The kind of work you did back in the early days,,
SS,here?,,
LM,"When we started there in Lapwai, it was in the horse age then. See,",,
LM,"we didn't have any automobiles til 1915, was the first automobiles",,
LM,"that came into Lapwai. So we were there, started in our business in",,
LM,"'13; really in the horse age. So out?, business was shoeing horses in",,
LM,the harvesttime when they hauled all the wheat and everything up over,,
LM,"the hills there and bring it down to Lapwai,'our business was to shoe",,
LM,"horses and repair the wagons, set the tires and any repair work that",,
LM,"might be needed on equipment that they used in those days. Then about,",,
LM,"oh, along in '15, '16 in there, why things began to change from the",,
LM,horse age into the mechanized machinery.,,
SS,Were you pretty aware of that at the time that there was a change on,,
SS,the way?,,
LM,"Well, yes, I was aware of it. I was among the first, and I'm not saying",,
LM,"this to stick my chest out, but I was among the first to put in acetylene",,
LM,welding; among the first when acetylene was first developed. And thgjf'd,,
LM,try to sell it to a blacksmith because he was supposed to know a little,,
LM,something about heat and so on. And I was among the first when arc,,
LM,welding came in. So we progressed as thing; went on.,,
SS,What kind of equipment did you have there when you first started?,,
LM,When we first starteed?,,
SS,Yes.,,
LM,"Well, I'd say we had two forges in my old shop, always had a hired",,
LM,man as a general rule. And we had a tire setting machine and a drillpress,,
LM,and emery wheel. And that's about the extent of it. Worked,,
LM,"nine hours a day, six days a week, and so on.",,
SS,What was most of your business?,,
LM,"At first it was horseshefcing. Well, in fact, when I first started in",,
LM,"I just put a sign out, ""We shoe everything that passes, horses, mules",,
LM,"and Jackasses."" And by gosh, they kept me busy. And I've got pic",,
LM,tures that shows sometimes if you want to see 'em.,,
LM,That's what the sign said? You'd shoe everything that passes?,,
LM,"Yep, we did, too! A horse never came into my shop if there wasn't",,
LM,iron on him or shoes on him that he went out with shoes on. Never!,,
LM,"Didn't matter if we had to tie him down, rope him, they never did.",,
LM,"Now, you'd bear me out on that one, too! Never! So, our business at",,
LM,first was practically all horseshoeing.,,
HBM,Did you tell him about the hooks that you made for 'em?,,
LM,"Yeah, for the Indians?",,
HBM,The tools for digging camas?,,
LM,"Yes, I've made many of the camas digging tool, which was just a kind",,
LM,"of a curved tool, pointed at each end, you know, when the Indian",,
LM,women would dig- is it camas or ?,,
HBM,Camas.,,
LM,And then when the river was- the Clearwater River every spring was,,
LM,"running high, why, I used to make hooks out of old discarded rake",,
LM,"teeth, and I worked out quite a deal on the thing, so they could throw",,
LM,it— I designed this myself; welded a little weight on the end of the,,
LM,"hook so when they throwed it, it would always go over the- and tip",,
LM,right down over the log. I made hundreds and hundreds of them in the,,
LM,"spring of the year when the water was high. Gosh, I'd sell them for",,
LM,six bits apiece. And just about the time that it was running good,,
LM,"I'd rake a whole armful down at Spalding, and they were running out",,
LM,of hooks. Lost 'em. So that was part of my business. And I had a,,
LM,"lot of friends among the Indians. I don't know- I had so many friends,",,
LM,"among the Indians. It was nothing unusual in the summertime, the",,
LM,"squaws would go to the mountains huckleberrying and so on, I'd usually",,
LM,fix up their old hack or set the tires and shoe the old horses and so,,
LM,"on. It was nothing unusual, that when they got back; we never bought",,
LM,"any huckleberries, they was all given to us!/ And they were always",,
LM,"a friend. And if you were a friend of an Indians, they were always",,
LM,friends.,,
SS,Tell me about the horseshoeing that you did. How did you deal with,,
SS,"problem horses? Did you have a pretty good way with horses, yourself",,
SS,to get them to take it?,,
LM,Have a pretty good what?,,
SS,Have a pretty good way with them? I would think that's a typical pro,,
SS,"blem, I understand. Some horses just won't take being shod.",,
LM,"It's like any other business or any other trade,you learn how to",,
LM,handle the horses. When they come in there they want their shoes onthe,,
LM,person wants their shoes on- it's up to you to know how to get 'em,,
LM,"on. So, if they were unruly, and I never could afford a pair of",,
LM,stocks to put 'em in. If they were unruly and we couldn't handle them,,
LM,"any other way, we'd just simply rope 'em and throw 'em down and tie",,
LM,em up in such a way we could put the iron on without getting hurt,,
LM,ourself. And we had not too many. I just always think that I was,,
LM,"just a little bit lucky, understood from my training from a boy how",,
LM,"to do the job, and how horses are smarter than a lot of people think",,
LM,they are. They realize the minute if you know your business or you,,
LM,"don't. Now that may sound,"" , but it's a fact. If you know your",,
LM,"business and you go up to that horse right, he won't give you much",,
LM,trouble. But they sense in a minute if you don't know and they'll,,
LM,"give you a bad time, a lot of 'em.",,
HBM,Tell the tobacco story.,,
HBM,"Yes. Lot of tricks, you know, you learn as you go along. They had",,
HBM,an old ornery stud horse up at the government; he was just an ornery,,
HBM,old cuss when you'd go to shoe him. He'd lay down or he'd jerk you,,
HBM,and all this and that. And I had a Missourian working for me and he,,
HBM,"was a darn good horseshoer, too, but he took a dislike to him. And",,
HBM,"whenever he came in there, why, Charley'd just throw up his hands",,
HBM,"because he just give him a bad time. But you know, that old horse",,
HBM,"loved me. I'll tell you how I got along with him. That big, old rascal'd",,
HBM,"come in there, I'd say, ""Charley you fit the shoes today and",,
HBM,"I'll put the shoes on."" I'd go over and get my plug of tobacco out",,
HBM,and cut a chunk off of it and hold it and he'd take that and the slob,,
HBM,"bers 'd run out of his mouth, and I'd pet him and he'd let me put on",,
HBM,"all four shoes. Now, this is telling the truth; and they discovered",,
HBM,"that, the fellow that drove him a lot of times, and they drove him",,
HBM,"in teams, you know,-and what was their names? But anyhow, the fellow",,
HBM,"drove him, he says, ""That old stud horse, when he'd get in sight of",,
HBM,"that when they come down through Lapwai to go somewhere delivering,""",,
HBM,"he says, ""his old mouth would just slobber."" Thought he was going",,
HBM,"to get down to the shop to get shod, I guess. Well, that sounds",,
HBM,"foolish to you, doesn't it?",,
SS,"If it works, it doesn't sound foolish, if it works! (Chuckles)",,
LM,"Well, I guess I only been kicked once, is all. And all the shoeing",,
LM,"that I did, I got kicked once, and that was my own fault. A horse,",,
LM,"they don't give 'em credit, they're pretty smart.",,
SS,"How did you get kicked, the time you got kicked?",,
LM,"Well, he was an old- you've heard of the Strawberry Roan, haven't you?",,
LM,"Old, lopeared, about as ornery damned horse that ever come in the shop,",,
LM,"Looked like he didn't have sense to pound sand in a rat hole, and mean",,
LM,"disposition, he was, just didn't want to- that kind of horse, that",,
LM,he didn't want anybody- he wanted to do just what he wanted to do.,,
LM,"Well, to get shoes you've got to perform a little so you can— But",,
LM,"anyhow, he was one of them kind that every move you made he kept his",,
LM,"eye on you, watching you. When I had three shoes on and the fourth",,
LM,"shoe on the right hand side, when I was clinching, my gosh, but he",,
LM,hauled off you know and just jerked that leg away and let me have it!,,
LM,"That was the first time I was kicked, because I thought I had the job",,
LM,"almost finished. That old devil, anyhow, he kicked me and kind of",,
LM,laid me up for a few days. (Chuckles) But otherwise than that- you,,
LM,learn as you go along.,,
SS,Did you do a fair bit of work on the old farm equipment to keep it,,
SS,running?,,
LM,"Oh, yes. It was a general repair shop, was what we did.",,
SS,Did you fashion a lot of your own parts?,,
LM,Yeah. Make rem; not only that but I designed one of the finest hit,,
LM,ches that was ever made. But there isn't a hitch made today that beats,,
LM,the hitch that I designed and patented. That's for the equipment we,,
LM,"have today, pulling say fifty or sixty feet of harrow- you know what",,
LM,I'm talking about. A big hitch for three or four seaters.,,
SS,What kind of a hitch did you design?,,
LM,"Well, it was a dream that I had. And, oh, hitches that are made even",,
LM,"today still got a solid tongue, and I designed one that had a- sector",,
LM,"gear, which was set just like the front of an automobile wheel, that",,
LM,"every move the tractor made , why, the tongue would work with it. On",,
LM,"a hillside or on a corner, instead of dragging the hitch around",,
LM,"and the machinery, why the wheels turned and we wheeled around",,
LM,"a corner. And on a steep hillside the tractors always working uphill,",,
LM,"well, my tongue pulled the wheels off so the wheels was.",,
SS,"Was he a pretty good blacksmith, eh? Spunds to me like he was.",,
HBM,"Well, he should have been, he took that training from a man that knew",,
HBM,the business.,,
SS,That is who he was apprenticed to back East?,,
HBM,In Pennsylvania.,,
LM,"I learned my trade from a Dutchman, a little old shop on the four",,
LM,"corners of the road; not the city, out on the road. And we did every",,
LM,"thing the hard way. We had no equipment, no power equipment. Every",,
LM,"thing was done by hand. There wasn't such a thing as power, those",,
LM,days. The old bellows you know what a bellows is?,,
HBM,They got one out to the museum.,,
SS,And when did you start? When were you apprenticed?,,
LM,I was thirteen years old when they throwed me in the blacksmith shop.,,
LM,"Had a third grade education and what education I got after that, why,",,
LM,I got by experience.,,
SS,How many years was an apprenticeship for?,,
LM,years. They throwed me in the blacksmith shop when I was thirteen and I left,,
LM,home when I was sixteen; three years.,,
SS,What did you do? Would you be mostly watching him do the laboring,,
SS,jobs?,,
LM,"No. Hell no.when you come three years of apprentice, .1 could shoe",,
LM,horses just as well as when I left home. We had to be pretty good,,
LM,shoers if if they put on more shoes than I could in a day. And I,,
LM,"learned, too to twist iron around in the forge and so on. Oh, yeah",,
LM,"three years of apprentice, you're right in the shop where you see it",,
LM,~ and you do it. Don't do that any more.,,
SS,"Uh-huh, not at all. But the blacksmithing is becoming a lost art,",,
SS,anyway.,,
LM,"Well, yes, to a certain extent. But many a welder has told me,""I'd",,
LM,give my left arm if I just knew a little bit about the forge work.,,
SS,I was just going to ask you if there were any experiences that you,,
SS,had in Lapwai that really stand out to you?,,
LM,"Yes, during the Depression I burned out. Things got so doggone bad",,
LM,we couldn't pay our premium. After paying it how many years?,,
HBM,During that Depression you couldn't collect anything. Farmers could,,
HBM,"give you potatoes and wood and what have you, but, money, no. So we",,
HBM,"lived through that, you see. That Depression; no money.",,
SS,So you burned out when you had no insurance?,,
HBM,Yes.,,
SS,"Oh, that's terrible!",,
HBM,We had a family of seven.,,
HBM,h,,
SS,Children?,,
HBM,"No, my parents were with us and we had three sons and then ourselves.",,
HBM,"And, we had to start in all over again. And that was in '23 that we",,
HBM,"moved down there- oh, between '23 and '30, 1930.",,
HBM,We burned out.,,
LM,"You'll have to have my wife help me out a little bit, bear me out on",,
LM,"some of the things, I may get a little radical on that. During the",,
LM,"Depression, 1930 wasn't it?",,
HBM,"I was telling him that that fire must have been between 1925 and 1930,",,
HBM,because we had moved down on the acreage. It would have been about,,
HBM,1930.,,
LM,"That's right, about that.",,
HBM,Father was still alive.,,
LM,"If you know what hard times is, and I'll bet you don't. But during",,
LM,"that '30, was really rough. It was rough. We never lived any better",,
LM,"since or before- before or since, I mean to say- because I could trade",,
LM,"my work for stuff to eat, alright. But that depression was a blow to",,
LM,"us. It got so that we just couldn't get money enough, we couldn't",,
LM,"pay our premium. And it went along, but anyway a fellow called me",,
LM,"from Genesee here to come up and shoe his stud horse, and I hesitated",,
LM,because the darned old devil always hurt me every time that I'd shod,,
