speaker,words,tags,timestamp
,This conversation with LEWIS MESSERSMITH and HAZEL BRAMLETT MESSERSMITH took,,
,"place at their home in Genesee, Idaho on January 21, 1975. The interviewer",,
,was SAM SCHRAGER.,,
,"LEWIS MESSERSMITH: As I recall the time I've lived in Lapwai, I have little",,
,story - I'm just going to use his first name- Len- his name is Len,,
,Henry; he used to come down through town there and he could cross,,
,his legs and sit down and tell you more doggone stories1 history,,
,"and things that he'd done, and he was a good storyteller.",,
,"A number of us there in town, we saw where there was an ad or",,
,something in the paper that they were putting on aLiar's Club down,,
,"in California, so a lot of us knew that Len Henry told a lot of good",,
,stories and we decided to kind of get together and raise enough money,,
,"to send him down there to this contest. And by gosh we did, he got",,
,to go down there and this was his story:,,
,"When he came back he says that, ""Yes,"" he says, ""It was wonder",,
,"ful. But,"" he said, ""the last night we were there, we got in the ho",,
,tel and got to meeting with different ones that was in this contestin,,
,"the Liar's contest."" ""So,"" he said, ""I met a Texan."" So Len asked",,
,"the Texan, ""Oh,"" he says, ""we never go out with anything but a bow",,
,"and arrow."" M0h, that must be a lot of fun."" And after so long a time",,
,"the Texan asked Len, he says, ""How do you fellows- I hear so much about",,
,that hunting that you do up there in Northern Idaho. How do you,,
,"fellows hunt up there? What do you use?"" ""Oh,"" Len says, ""we never",,
,"go huntin' up there with anything else but ahuntin' knife."" So, the",,
,"party broke up that night and after about two years, why, the Texan",,
,"got to thinking about this, and he thought, ""Gee, that would be a",,
,"thrill to go up to Idaho from what Len told us, and to go on one of",,
,"those huntin' trips with him."" So he came up and he hunted up Old",,
,"Len, and sure enough, Len had a few mules and he did a little packing",,
,"and so on and he knew the mountains and so on. So, he said, ""Okay,",,
,"we'll go up on the Craig Mountains area, I think you're just about",,
,"right   do some hunting up there."" So, they packed up and took a",,
,little grub along for a few days supplies. And when they got up there,,
,"Len knew where there was an old cabin that was kinda not occupied,",,
,"but thought they'd go up there. And when they got there, they be",,
,"gan to unpack the old mules and put the supplies in on the table,",,
,"and finally Len says, ""Now, Tex,"" he says, ""you kind of straighten",,
,things up around here a little bit and I'll go out and see if there's,,
,"any signs of game here."" He went on up the trail, he says it was in",,
,the summertime and huckleberries was ripe and bugging along up through,,
,"the trail, and he says?'a bear just flashed right up in front of my",,
,"eyes. The meanest lookin' thing I ever saw. And Len he says, ""I",,
,just took on down the trail as fast as I could run and that bear right,,
,after me. And he was right on my heels by the time I reached the,,
,"cabin door,"" he says, ""when I run through the cabin door,"" he says,",,
,"""that bear followed right in."" He says, ""I run around the table and",,
,as I got out through the door I slammed the door shut and hollered,,
,"back to Tex, ""Skin that damned thing out, I'll go out and get the",,
,"other one!"" (Chuckles) And then the next day or two they decided",,
,to maybe go down a little lower country and see what the game was,,
,"there. So, went down there and they set up camp again and Len says,",,
,"when they got camp set up, ""We'll go up here and see what we can find",,
,"in the way of game."" And Tex said, ""Wait aminute, Len, I'm going",,
,"right with you."" ""Okay."" They started up the trail and after while",,
,"Len being in the lead, all at once he just stopped in the trail and",,
,"backed right up, belly right against his back, and looked over and",,
,there was the biggest damn rattlesnake that he ever had seen. Stood,,
,"there for a while, just quiet, never saying a word. Finally, Tex",,
,"said, ""Len,"" he says, ""are you going to do anything?"" ""Just aminute,""",,
,"he says, ""I think Ihave.""--Now if you can figure that one out!",,
SS,(Laughter) That one flew by me! Len brought the rattlesnake out?,,
LM,No. Didn't we get that across right? That's the best part of it.,,
SS,What did Len do?,,
LM,Len hesitated on the track because there was arattlesnake right in,,
LM,"the trail, see, and Tex as walking along right back of him and he",,
LM,"walked right up against him; his belly right up against Tex, see,",,
LM,"and they were standing there looking at that rattlesnake, just arattlin'",,
LM,"to beat hell! And finally Tex said, ""Len,"" he said, ""Are you",,
LM,"going to do anything?"" He hesitated for quite awhile, he says, ""I",,
LM,"think I have!""",,
SS,I see. (Chuckles) This all comes out.,,
LM,You may have to this whole damn thing!,,
SS,"That's okay, that's okay. We just take the best stuff.",,
LM,I'm not a writer.,,
SS,"Well, this is different. This is the way we talk, not the way we",,
SS,"write! But Iguess Len always told his stories, he didn't write 'em",,
SS,down did he?,,
LM,No. (Laughter) He didn't write 'em down. He was a squaw man. Len,,
LM,"Henry was asquaw man; he married an Indian woman, and they're called",,
LM,a squaw man. And maybe that should be put in somehow. But he was,,
LM,"quite a character, and there's a lot of kids down there, good kids,",,
LM,"too, of the Henry kids. Lot of good kids. But he could come in and",,
LM,"cross his legs and sit down and tell the most ridiculous, damn stories!",,
LM,And just keep you entertained for hours.,,
SS,Can you tell me another one of the stories that he told?,,
SS,"The Indians was always after him, see. He always had his chest out",,
SS,"on being a teamster, driving eight horses, packing things back in the",,
SS,"mountains. And he had a dog, and he says one time he was driving",,
SS,"those eight horses down around a damn trail, he says, and he got the",,
SS,"eight head of horses around the darn curve and when he looked back,",,
SS,"he said his dog was back there with a cramp in him, he couldn't get",,
SS,around that curve! And that would just go on for hours like that.,,
SS,Did he tell one about changing his mind when he was in the middle of,,
SS,crossing a creek or river or something like that?,,
SS,Yeah. Yeah. And that time there was a rattlesnake on the other side,,
SS,and he just turned around and went back.,,
SS,How would he tell that one?,,
LM,He'd tell it that he was going to cross a stream and when he jumped,,
LM,across the stream he jumped out there and he saw a great big rattle,,
LM,"snake coiled up, and he just turned around and went back!",,
LM,Like one time he was riding his horse down the trail and Indians,,
LM,"got after him, and boy, they were just about to get him he says, ""And",,
LM,"I throwed the lariat out across one of the rocks out there,"" he says,",,
LM,"""and hooked it on, and I spurred the old horse and just swung it",,
LM,"right across the cliff on the other sidel"" (Laughter) He put a",,
LM,halfhitch around the saddle horn!,,
LM,"The Indians I take it, didn't try to follow him.",,
LM,"Oh, no. They couldn't get across there.",,
LM,How did he tell stories when he told them? Was he poker-faced?,,
LM,"Yeah. I think that Len Henry told those so many times, these stories,",,
LM,"so many times that I actually think, and I've talked to a good many",,
LM,"more that's heard him, that he's told it so many times, that he thought",,
LM,"they was the truth. And by gosh, if you would question it he'd get",,
LM,indignant. He was ready to fight you if you'd just question any of,,
LM,his stories!,,
SS,Did he know a lot of 'em?,,
LM,"Oh, hell, he could set there for hours and tell you just one ridicu",,
LM,lous story after another that Couldn't be possible.,,
SS,Did people try to match lies with him?,,
LM,"Yeah, they did when they sent him to California. They tried to match",,
LM,"him and he came back, I don't know if he got anything out of it. We",,
LM,just paid his fare so he could go down there and got him back home,,
LM,again. (Chuckles),,
SS,What did Len Henry do to make ends meet?,,
LM,"There was abig family of 'em, and of course in those days the Indians",,
LM,they had an allotment coming- they had a little money coming every,,
LM,"month through the agency. All of 'em had a little land, you know,",,
LM,and they leased it to the white men and they had a little money co,,
LM,"ming every month; enough to keep 'em going. Some of 'em quite abit,",,
LM,"who had their land, enough, leased to the white people. And they",,
LM,didn't live like people; didn't have to have the things that we have,,
LM,nowdays.,,
SS,Looks like your wife getting home.,,
LM,"But there was really no other characters there, that there was sto",,
LM,"ries, that you know of?",,
LM,"HAZEL B. MESSERSMITH: No. He was the storyteller, alright, but I don't know",,
LM,too many of his stories. Did you tell him about the dog that-,,
LM,That couldn't get around the curve? The bend in the trail or the,,
LM,road? Put an eight-horse team around there and his dog got cramped,,
LM,on it! Maybe you can think of some of 'em.,,
HBM,"The old-time stories, my father disapproved of a lot of them. He",,
HBM,"says that these stories they write, the pictures they show of the",,
HBM,West were exaggerated. And he crossed the plains and he said they,,
HBM,didn't   a lot of the things that they picture and he kind of com,,
HBM,"plained about it, that it was wrong to mislead people like that.",,
SS,"I think that's true, it is. That's something that Westerners, a lot",,
SS,of us know that other people don't know.,,
HBM,"They don't know whether it's true or not. But, he didn't approve of",,
HBM,"it because he said the stories were all exaggerated and.,",,
SS,"Did he think that a real, true story was a good story to tell?",,
HBM,"No, he didn't tell too many stories. They lost, in crossing the plains,",,
HBM,"a member of their family. And the hardest part of that, he said was",,
HBM,"iust burying a member of your family just out in the wild, and going",,
HBM,on without them. He said they did have that trouble And he said that,,
HBM,"was the hard part of it for them, they had to bury a member of their",,
HBM,family right out there; wild and open spaces.,,
SS,Where did he come to?,,
SS,"From Illinois he came to Columbia County Washington, down around",,
PVM,Walla Walla.,,
PVM,Did he homestead there?,,
HBM,His father homesteaded there. And you've heard him tell how they came,,
HBM,into Lewiston. They freighted from Walla Walla up to Lewiston. And,,
HBM,"Father was quite a teamster, he loved horses, and they frighted from",,
HBM,"Walla Walla and into Lewiston,it was just nothing but bunchgrass. He",,
HBM,said he could have bought the whole- where the city is for a song and,,
HBM,a dance! That was the only way they had of getting freight in there.,,
HBM,I'm not a very good storyteller.,,
SS,"You express yourself very well, I think.",,
SS,Her parents is more pioneer than I was. Ileft home in Pennsylvania,,
SS,"at fifteen years old as agreen country kid; came out to Portland,",,
SS,Oregon. But her folks were regular old pioneers that came out here,,
SS,to this country.,,
HBM,I'll say they were.,,
LM,"And, you won't find very many people, Idon't suppose, that's any older",,
LM,that would be able to go back any further than we are. She's eighty-five,,
LM,"and I'm going to get up to her in age, February the 15th, and",,
LM,"then Iget to take over again, I'll be in charge then after the 15th",,
LM,of February eighty-five years old.,,
LM,But she'll be ahead of you again beforemuch longer.,,
LM,"I'll have the pleasure of being general manager, you know, from Feb",,
LM,ruary til next November again!,,
LM,"Tell me this; was Len- he was really well known for his sotries, for",,
LM,his lies when you were around Lapwai.,,
LM,Yes. but we - Lapwai people didn't have much to do with that class.,,
LM,"It just happened that you'd run into him someplace, but, really, the",,
LM,white people didn't associate too much with the higher class of In,,
LM,dians. And the Indians had very little respect for a white person,,
LM,that would marry an Indian.,,
LM,"Yes, and he was a squaw man.",,
LM,"And he was supposed to be a white man and he lived with the Indians,",,
LM,"you know, married an Indian. They raised quite afamily of boys.",,
LM,"And the little kids turned out well, too.",,
LM,"Yes, they did pretty well. Those boys did pretty well, but they did",,
LM,"it on their own, they didn't do it from any help from him, because he",,
LM,just didn't have it. Isn't that funny now that he would become popu,,
LM,"lar just because- he didn't amount to anything, but just a...",,
SS,I'll tell you why; because he was a good liar and there aren't very,,
SS,"many left. And I don't know of a one in this county, of all the peo",,
SS,ple that I know in the early days. I know one guy that used to like,,
SS,"to tell lies, but his reputation was very low, I don't think many peo",,
SS,ple knew about him; just a few people around- right around where he,,
SS,"grew up. So, I don't know, Len Henry seems to be known as quite a",,
SS,"character, and I don't know why. He didn't seem like quite a charac",,
SS,ter to you.,,
HBM,"Somebody that you just wanted to stay away from, you know.",,
LM,He wasn't what you'd call boring; he'd come into the store there in,,
LM,Sweetwater and just set down and cross his legs and if anybody'd listen,,
LM,"to him, he'd just set there and entertain you, but I didn't have",,
LM,time to listen to all of 'em.,,
SS,He came right in the blacksmith shop where you were working?,,
LM,"Oh, yeah.",,
HBM,Did he get horses shod?,,
LM,I don't think he ever spent a dime.,,
HBM,I don't think he had a dime to spend.,,
SS,Your blacksmith shop was a place where guys used to get together?,,
LM,"Oh, no. These are stories that I've told you that somebody else told",,
LM,me.,,
SS,I was thinking that maybe it was a place where guys would congregate.,,
HBM,Not around his place.,,
LM,"No, it just seemed as though he had nothing else to do and if anybody'd",,
LM,"listen to him, he'd set down in a store or anyplace, you know. When",,
LM,"he was in the shop there, I was busy, I didn't have any time to lis",,
LM,"ten to him, but if somebody else would, he'd set and entertain 'em.",,
HBM,"I never heard him talk. I've seen him and I thought- ooooh, how",,
HBM,could anybody live like that?,,
SS,He was pretty dirty?,,
HBM,"I don't know, you'd think of him as being pretty dirty. But the In",,
HBM,dians to me were very clean or very dirty. Exceptionally bright or,,
HBM,"very stupid. I taught there, just Indians , one winter, just substi",,
HBM,"tuting and filling in for a government teacher, and the Indian child",,
HBM,"ren were either exceptionally bright or exceptionally stupid, there",,
HBM,were no mediocre classes of children.,,
SS,I wonder if there were just like two classes?,,
HBM,I can't account for that. I don't really know. Now I know sisters,,
HBM,"who married and have families and one of them I Slikpoo woman, Nancy",,
HBM,"Slikpoo was very clean; her floors were just spotless, and her sister",,
HBM,"was the dirtiest- Of course, I was always rather fond of Indian peo",,
HBM,"ple. I like them, I like their history.",,
LM,"I did, too. The Indians have always had my sympathy, always. And",,
LM,still have. I've lived with them there twenty-seven years from the,,
LM,"time that we first landed in there with the old blanket Indians, you",,
LM,know.,,
SS,What are the old blanket Indians?,,
HBM,They didn't wear pants.,,
LM,"Well, they were the original Indians that was allotted a certain amount",,
LM,of land on the Nez Perce Indian Reservation. And their land was lea,,
LM,"sed by the white people, and their money was handled by the agency",,
LM,there at Lapwai. And every month their rent money was prorated and,,
LM,they'd go up and get their money the first of each month. And they,,
LM,were a wonderful class of people. They were like the people of to,,
LM,day that's on Social Security. They knew they were going to get a,,
LM,"check at the end of the month and they spent it, and th ey were",,
LM,"honest. If they told you, ""I'll pay you next month-"" I never had",,
LM,a one beat me out of an account. They were there and paid it. But,,
LM,you had the next generation then. Then the Indian got up to the place;,,
LM,"some of 'em, that they were called ""class"". First class, second",,
LM,"class and third class. Now, your first class began to get the deed",,
LM,"for the land. Now, the Indian never could cope with the white people,",,
LM,"so the white people beat 'em out of the land\ But anyhow,",,
LM,"your next generation then, that was all split up whether there was",,
LM,"two people, two kids or maybe five or maybe ten, til, good gosh, they",,
LM,"didn't have anything to live on in the second generation. So, I",,
LM,"don't know, they blame the Indian for a lot, but they got my sympathy.",,
LM,"""They never was trained to work because their fathers didn't know how",,
LM,to work; didn't know how to do anything.,,
SS,"When you say first class, second class, where did that come from,",,
SS,this idea?,,
LM,"The government. The government, after they got educated well enough",,
LM,"and understood enough, why, they would give fem a deed to their- to",,
LM,this piece of property of 160 acres.,,
SS,Then oftentimes that land would be bought by Whites? Then they'd,,
SS,lose it?,,
LM,Yeah.,,
LM,They leased a lot of it. The white men leased a lot of their land.,,
LM,There's very few of the Indians anymore that anyfland. We've,,
LM,got a few up in here that are still holding onto their land and taking,,
LM,"their lease money, and they played smart. Yeah, the Indians have got",,
LM,"my sympathy, and always have had.",,
SS,"Quite a few of the old-timers in Latah County out at Deary, Troy and",,
SS,the country through there feel very much that the Indians not only,,
SS,had a raw deal but that they took better care of the land than the,,
SS,white people do.,,
LM,"Oh, you bet they did.",,
SS,I've found that expressed often by old-timers. And just like you're,,
SS,"saying your father didn't like the way it was portrayed, well, you",,
SS,"know the pioneers are supposed to not like Indians, well, that's not",,
SS,exactly true from what I find. It's not true at all.,,
HBM,"Papa asked one time, he said- now wait, let me see if I can remember-",,
HBM,"Somebody said, ""Well, what about this property's it safe?"" Now I",,
HBM,"don't know whether it was horses and wagons or what it was, and this",,
HBM,"Indian said, ""No White man miles and miles."" So it was safe. But",,
HBM,"Father said- he'd tell this story, he said that was this property,",,
HBM,"whatever it was, wagons or horses safe here- ""No White Man, miles and",,
HBM,"miles., safe."" Dad was quite fond of them. He kind of liked 'em.",,
HBM,"When we came4here to Lapwai, they were just wearing their blankets,",,
HBM,"I think they wore long Johns, and then their blanket and the big black",,
HBM,hat with a feather in it. And they dressed that way for a long time.,,
HBM,I don't know when they made the change to white men's clothes.,,
SS,Did you ever get much of an idea of how the Indians there felt about,,
SS,"Joseph and the retreat, the war in 1877?",,
HBM,think they were very proud of Joseph. But I have never- The friends,,
HBM,we have who haji the most information have passed away just recently.,,
HBM,They had so much information. I think the Indians as a whole were,,
HBM,very proud of Joseph.,,
SS,You probably heard and know that at the time there was a pretty strong,,
SS,"split between the Indians on the reservation and the dreamers, they",,
SS,"called them, Joseph and those others that didn't want to go.",,
HBM,"I never heard them express themselves too much, except that he was",,
HBM,quite a hero to the Indians as far as we knew.,,
HBM,"I've often looked back now as I get older, I look back over life, and",,
HBM,"we have progressed so fast and progressed to the point, as Isee it,",,
HBM,that the Indian isjjway behind us. And Ihave always made the remark,,
HBM,"when I hear some people just demeaning the Indians; yes, they did this",,
HBM,"and that- Ijust kind of get red behind the ears, because I feel this",,
HBM,"way: If the Indians way back there in Columbus's time, when they first",,
HBM,"come if they'd had the same equipment, the guns and things that the",,
HBM,White man hadere'wouldn't be any White men in here today. But,,
HBM,"just imagine, all they had was just a spear to fight against the-",,
HBM,Y' train them to work. We're just geting to that place now. The,,
HBM,young kids go into high school and is realizing that they're going to,,
HBM,have to work and get this dollar. And you have to have that to buy,,
HBM,"things with. So, they're learning right now to live more or less like",,
HBM,the White man.,,
HBM,Too much so. When the White man came in- that's what started it. The,,
HBM,young people- Ihave some wonderful friends there among the young,,
HBM,people.,,
LM,"You bet, I do, too.",,
LM,And when the White man came in with his brand new cars and the liquorruined,,
LM,one couple that I just thought so much of. The finest young,,
LM,people. And they came in with liquor and sold them a car and they,,
LM,wound up in jail. Fine young couple.,,
LM,I read about the real efforts to keep liquor off the reservation.,,
LM,That was one of the most serious and usual problems that th ey had on,,
LM,"the reservation. And the court cases, half of them-",,
HBM,Indians cannot handle liquor. It just ruins them. My very best,,
HBM,friends among those young people; I just thought so much of those,,
HBM,young people there. I had the post office and I worked in the post,,
HBM,"office, and those young fellows,they came back from school, back East,",,
HBM,"you know and they were just- they would just help you, they'd do any",,
HBM,"thing in the world for you. If they liked you, they'd do just any",,
HBM,thing in the world for you.,,
LM,"Our Nez Perce Indians, especially, I think are a wonderful tribe. And",,
LM,I think now that they are making progress there at Lapwai.,,
LM,Have you been down in there; know anything about the area?,,
SS,"A little, yes.",,
LM,I think they're making progress. They are now training them to live,,
LM,"like White people. They have built, I don't know how many, homes around",,
LM,Lapwai. And they didn't build them for 'em. They had what they,,
LM,called an engineer- what was it? But anyway they had help- it was,,
LM,up to the Indian to help to build this home. They put 'em right in,,
LM,"on the project. ""We're going to built this house, but you're going to",,
LM,"help."" And down there and see the whole darn family, maybe,",,
LM,"up on the roof there, putting the roof on and so on. Well, now, they'd",,
LM,"never been able to learn that before, because their forefathers didn't",,
LM,do such things. But I think they're living now more like the White,,
LM,"people, especially. the Nez Perce tribe down there. They're",,
LM,training (them) their kids has gone to a school and changing to the,,
LM,place that they know they've got to work somehow to make the dollar.,,
LM,They never were trained to use their land. You take a lot of 'em,,
LM,"down there still got maybe two and a half or maybe five or six acreswell,",,
LM,"you give that to a Chinaman or a Jap, they'd make a living, but",,
LM,the Indian has never been trained to do that.,,
SS,"I'd like to ask you about when you first came to Lapwai, how it was;",,
SS,what it was like there and was it hard for you to get established there,,
SS,in town? Was it a friendly place? What was it like?,,
HBM,"The Indians resented you, didn't they? Didn't the Indians resent",,
HBM,more or less?,,
LM,"No, never did. When I came in there, I'm a stranger from the East,",,
LM,"see, and she was born and raised right in this area. Maybe she can",,
LM,answer your question better than I can.,,
SS,You both can.,,
HBM,"I don't think- I think that the regular old Indian was not too friendly,",,
HBM,"they were suspicious, I think of us, more or less. And I don't know;",,
HBM,they didn't accept us. They became athletes after the high school,,
HBM,"came in. They were athletic people. And they were artists, natural",,
HBM,artists. In school the little tots could draw their animals and they,,
HBM,make their own designs for the bead work. And I think they resented,,
HBM,us coming in.,,
LM,"I think, as I recall it, as I say, I come in here as a stranger, you",,
LM,"were more or less born in that area over there, but I came in there",,
LM,"as a stranger and I didn't feel out of place. Lapwai, to me, was",,
LM,just a little thrifty town. It was just thrifty as the dickens when,,
LM,I came in there and I bought this little business. It was a thrifty,,
LM,"town for the simple reason the agency for the Indians was there, se e,",,
LM,and every month the agency of the Indians got their paycheck. So,,
LM,the stores all did well and everything was just going fine.,,
HBM,That was in 1910-'12. I was here in 1903.,,
LM,"Yeah, way back then. Yeah, what happened-",,
SS,You were here in 1903?,,
HBM,Yes.,,
LM,And I came in there in 1912. We were married in 1913.,,
SS,You were living there for all those years before he came then.,,
SS,She was born and raised up in the Gifford country. Country folks.,,
