speaker,words,tags,timestamp
LM,"him. So I begged off and I said, ""No, I won't shoe him."" ""But I don't",,
LM,"want anybody else to shoe him."" ""Well,"" I said, ""I can't come up there",,
LM,"for the price that I've always come. I'll come up ,"" I says, ""and",,
LM,"shoe him for fifteen dollars."" Well, fifteen dollars, was really some",,
LM,"thing if I'd get this cash. He says, ""You come on up I don't want any",,
LM,"body else to shoe him."" So, I got my oldest son, I told him about it",,
LM,"and he was pretty good help by that time. I said, ""Let's go up Sunday",,
LM,"morning and shoe that old devil."" Which we did, and we went on back",,
LM,home and instead of me going up to the shop and putting my tools away,,
LM,"like I usually did. My brother-in-law and sister,, they went along down followed",,
LM,"us on down- and we had dinner, played pinochle after dinner",,
LM,"and so on. And after dinner, they beat the devil out of me, and after",,
LM,"dinner I said, ""Come on, go outdoors while the womenfolks are cleaning",,
LM,"up the dishes and you can't beat me on a full stomach."" And we got",,
LM,"outside and the smoke was rolling out uptown, I says, ""My God, there's",,
LM,"a fire uptown!"" And we took off up there and my shop was on fire from",,
LM,"one end to another. So, we were in pretty bad shape now I want to",,
LM,"tell you. I think we had twelve dollars and fifty cents in the bank,",,
LM,wasn't it? Two dollars and a half in my pocket.,,
HBM,But an Indian saved your books.,,
LM,Yes.,,
SS,Really?,,
LM,Yes. There was an Indian who broke through the front window and got,,
LM,"my ledger out. Oh, it didn't amount to too much for the simple reason",,
LM,"that.nobody come to pay me even then, because they couldn't.",,
LM,That left us in pretty bad shape.,,
LM,"As I said, I'm going to make a long story short; the next day",,
LM,after the fire we had a little old T Model Ford and she and I went up,,
LM,to Soldier's Canyon road where we'd go up there with  .22 and shoot,,
LM,"groundhogs and so forth, and we drove it up there and drove it into",,
LM,"the camp in the evening and set there and bawled like two kids. Now,",,
LM,"if you want to know the truth! Well, after so long a time she said,",,
LM,"""This isn't going to get us anywhere."" ""Hell, I know that, we got to",,
LM,"get down there and think what we're going to do."" Well, in the Mean",,
LM,"while, the garage, it was during the Depression and they went broke,",,
LM,"absolutely broke, and that building was vacant right next to me and",,
LM,"I saved the building by getting on top during that fire, I and another",,
LM,"feller, and what little water we had we shared over the top",,
LM,"and saved their building. So we went over the next morning, we saw",,
LM,"the lady that owned it and she says, ""Come in, I was expecting you.""",,
LM,"And I asked her if she would rent her building. And of course, that",,
LM,was a garage and it had some tools and equipment in there. So she,,
LM,"rented the building to me, ""If the first month if you'll just put the",,
LM,"windows in that the kids broke out."" And they was just covered with",,
LM,"burlap and so on. ""You can have the first month's rent free. And until",,
LM,"you get on your feet,"" she says, ""I'll just you rent that to you for",,
LM,"five dollars a month."" Can you imagine that? So that started us.",,
LM,"Well, I could salvage quite a bit from the fire, such as the anvil",,
LM,and many of my tools that went through the fire that I could - once,,
LM,"I get a forge I could heat treat 'em, you know and put them back in",,
LM,shape. Which I did. So it took quite a while to get started again.,,
LM,"We made it, about ten or twelve days. I had some help. No one ever",,
LM,"came in to volunteer to give you a real lift, with the exception of",,
LM,"three fellows who did, oh, kind of cement work; Moreland brothers.",,
LM,"There were three brothers of 'em. Then after I got in the shop, in",,
LM,"a few days, I could see that the first thing I needed was a pair of",,
LM,"sawhorses built, to begin to make something, see. . Nothing came right",,
LM,"because my tools was all gone. As I was getting kind of sorry, why,",,
LM,these three brothers backed up their truck at my back door there at,,
LM,"the shop with a whole load of brick, and one of 'em said, ""Say, Lew,""",,
LM,"he says, ""where you want that forge?"" Aftd I says, ""What are you guys",,
LM,"doing? What are you talking about?"" They says, ""Where you want that",,
LM,"forge? We came up here to put you up a forge."" ""Now wait a minute,""",,
LM,"I says, ""I haven't got any money and I can't pay you guys."" ""Who the",,
LM,"hell'says anything about money? Where you want that forge?"" And the",,
LM,three of 'em got in there and by night they had the forge and every,,
LM,thing built for me! And I believe the next day or so some of the sales,,
LM,"men came along, and that's where I appreciated where I was really set",,
LM,"ting, was the fact that my credit was still good. The hardware sales",,
LM,"man came in,wanted to know if there was anything that I needed. And",,
LM,"I was just trying to get organized again. And I said, ""God, I need",,
LM,"so much stuff but I can't buy anything."" ""Now listen,"" he says, ""just",,
LM,"before I left down at the hardware, I had orders that anything that",,
LM,"Messersmith wants, you sell it to him."" ""Okay."" Give him a nine dol",,
LM,"lar order; a couple of bars of iron, sack or two of coal. (Chuckles)",,
SS,Sounds like you bounced back pretty well.,,
LM,"Well, that's quite a story. rfljH'y a Vtxh",,
SS,With no money I'm just thinking that's really something.,,
LM,But I was so anxious; that fifteen dollars that I got for shoeing,,
LM,"that stud horse- I overlooked a little bit there- that fifteen dollars,",,
LM,"I tell you, that was a biggest fifteen dollars I ever saw. That's",,
LM,what happened. That very day that I did that I burned out. And I,,
LM,"probably would a caught it had I gone to the shop like I should have,",,
LM,"and put my tools away. I'd a caught that fire before, because it",,
LM,really didn't get a good start until a long time in the afternoon.,,
SS,Do you know what caused it?,,
LM,"Oh, yes, I can tell just exactly what caused it. That Saturday, this",,
LM,called,,
LM,was on Saturday when they me and I was anxious to make this,,
LM,"fifteen dollars, and I knew just exactly the size shoe that was to",,
LM,"be made for the stud horse, that I got busy and fixed those shoes up",,
LM,"and I had done some acetylene welding that day, and it's an old wooden",,
LM,shop and I never left the shop without taking the hose and wetting,,
LM,"everything down, you know, there was manure and stuff underneath there,",,
LM,"but this time I was more or less excited, I was going to make fifteen",,
LM,"dollars, and I forgot to put that damn water on there. So evidently",,
LM,sparks or something from my acetylene welding got to the manure and,,
LM,"stuff and finally burned over to where they'd got air, and once it",,
LM,"got that, why, it was gone.",,
LM,"Now, that's quite a history, isn'it it?",,
SS,That's quite a story.,,
LM,"Well, that's not a story, it's a true story. We've been awful lucky",,
LM,in our life since. We're thankful. Every day we wake up and say we,,
LM,have so much to be thankful for. We live different than a lot of,,
LM,people.,,
HBM,I wouldn't take a lot for our experience in Lapwai-,,
LM,"Oh, no, I wouldn't either.",,
HBM,-because I really like the Indian people. I really like them. I,,
HBM,"didn't care so much for Old Len Henry, but the genuine Indians, I",,
HBM,liked- the Nez Perce Indians. They were interesting.,,
SS,TJhat do you mean by interesting? Could you expand on that a little,,
SS,bit? What was there about them that made them interesting to you?,,
HBM,"Well, they were attractive to me and their mode of living, and they're",,
HBM,", They cooked some very fine foods. And their knowledge of",,
HBM,"nature, you know. The foods that they dug out of the earth and the",,
HBM,berries; they way they can handle those things was interesting to me.,,
HBM,"And their bead work; that was all by hand, they didn't have any pat",,
HBM,terns for anything. Their patterns that they put on their baskets and,,
HBM,all were all original. They didn't have patterns like we have for our,,
HBM,crochet and our needlework. That was just natural them. What they,,
HBM,"could do with so little, is what interested me. And they got so much",,
HBM,good out of nature. f Nature provided for them.,,
SS,Did you ever go to any of the ceremonies?,,
HBM,"I went to their churches, yes, went to the Indian War Dances. We",,
HBM,often went to their war dances.,,
LM,"Well, we did go one time to their deal up there out of Craigmont.",,
LM,Yes.,,
HBM,every year they have a religious gathering; camp meeting they called it.,,
LM,Used to be Ilo and now it's Craigmont.,,
VZM,"They conduct that themselves. Fine meetings, speaking and singing.",,
VZM,And they have good voices. We had a quartet there in Lapwai that was,,
VZM,real good. They'd meet there and sing. Scared of going home at,,
VZM,night sometimes those fellows would sing all the way down the railroad,,
VZM,track. It was a good quartet. And they played musical instruments,,
VZM,too. Didn't they?,,
LM,"Well, yes.",,
HBM,"Those younger fellows went to college, they came home from college.",,
LM,"It wasn't high-class music like you hear on TV today, but they had",,
LM,their-,,
HBM,"Oh, no, but David played and quite a number of those fellows played",,
HBM,"musical instruments, cornets and saxaphones. They asked very little",,
HBM,help of anybody. And they still do quite a little bit of the corn,,
HBM,"husk work, they don't do so much bead work but they do make corn husk baskets. They",,
HBM,do a lot with husks. But the Indian women still,,
HBM,"wore the same old clothing. They had no patterns for anything, they",,
HBM,"make their dresses just the same way as they did then. Of course,",,
HBM,"the young people don't, but the older women make the same- use the",,
HBM,same materials and same patterns.,,
SS,I've heard that some of the young people are interested in the old,,
SS,ways of doing things. So maybe the arts won't die.,,
HBM,I'm afraid they will. I'm afraid that they will. They say on Tues,,
HBM,days the Indian women still demonstrate at Spalding there; some of,,
HBM,their work and how it's done. And I hope that they do that again this,,
HBM,summer because I want to take the family down there. And one Indian,,
HBM,"woman I still know, does that type of work, I want to see her and talk",,
HBM,with her.,,
SS,Did you see them work when you were down there? Or was that done usual,,
SS,"Well, when you were living down there yes.",,
HBM,"Oh, yes. I watched them do their work. And I hope that they will",,
HBM,"still be demonstrating at Spalding this summer. Because, as you say,",,
HBM,"it will be a lost art, the young people are not learning it. And",,
HBM,there's just a few of those older women left who do it. I want to,,
HBM,be sure and go down there.,,
HBM,I really think that they're working on that pretty strong. They're,,
HBM,trying to bring that back. Kind of interesting here- When did I,,
HBM,send that pair of gloves? Less than a week ago to my son- little,,
HBM,"short story here to tell you about. We had a pair of gauntlet""glo",,
HBM,"ves here— Well, to go back to the original, when I was running the",,
HBM,"shop there at Lapwai, there was a young Indian came in the shop one",,
HBM,"day; one afternoon, late; end of the week, and this was nothing unusual,",,
HBM,"and he said, ""Say, Mr. Messersmith would you loan me two and a half?",,
HBM,"I says, ""Hell, no, I'm no bank."" Something like that is about the",,
HBM,"way I told him, probably. ""Well,"" he said, ""I'll leave a little se",,
HBM,"curity, I need two and a half pretty bad this weekend."" And then he",,
HBM,showed me a pair of gauntlets that was the most beautiful piece of,,
HBM,"bead work you ever saw, and he says, ""I'll leave them til I get back",,
HBM,"Saturday and pick 'em up and give your money bank."" Well, okay, I",,
HBM,gave him two and a half and I throwed the gauntlets into the little,,
HBM,"office I had there, the desk I had, lifted the lid and threw it in",,
HBM,there. And those darn gauntlets was in there I guess six months and,,
LM,"he never did come back to pick 'm up. Beautiful piece of work. Well,",,
LM,"then they had an Indian lady there, well, we were just well acquainted",,
LM,"with her and we still don't know whether it was Mrs. Black Eagle, you",,
LM,say or-,,
HBM,"No, I don't think it was.",,
LM,But anyhow there was an Indian lady there that actually made buckskin,,
LM,"gloves, and she looked and she says, ""Oh, that's the most beautiful",,
LM,"work I have ever seen."" And it was, too. Bead work. She said, ""Let",,
LM,"me make you a pair of gloves for 'em."" Okay. So she measured up my",,
LM,"fingers and she made me a pair of gloves. Well, they were so beautiful, and I had",,
LM,"left home too long and I had a sister back in Pennsylvania, and I thought, now that",,
LM,would really be something to send,,
LM,"to her! And I sent 'em, plus three beaded moccasins, for her three",,
LM,"daughters not realizing, you know, that people back there- oh, just",,
LM,"no value at all, see. So, I seqt those gloves. Well, this summer one",,
LM,"of the daughters- conversation somehow, I don't know how it came about,",,
LM,but she brought up this subject about the gloves that we sent,,
LM,"back there to my sister, which is back there in 19- - what would you",,
LM,"say? 1926, along in there. That date don't matter anyhow. Finally",,
LM,"the daughter says, ""I don't remember a thing about 'em. Not a thing.""",,
LM,And she didn't even remember the moccasins that I sent to the three,,
LM,"girls; she was one of 'em, she was the youngest in the family. And",,
LM,"after so a long a time she says, ""That pair of gloves means so much",,
LM,"to your Uncle Lew,""— am I quoting this right? ""If they are still",,
LM,"there and nobody cares for that, I'll bet you your Uncle Lew would",,
LM,"sure like to have them."" ""Well,"" she said, ""when I get back home,",,
LM,"I'll sure look around."" 'Course, my sister's dead now, was at that",,
LM,"time, and for many years she's been dead. And sure enough, after",,
LM,"she was back there a month or so, I guess, here came a box with that",,
LM,"pair of gloves in there. And she had insured fem, I guess for two fifty,",,
LM,wasn't it?,,
HBM,I don't know.,,
LM,"Because we had made such a damn fuss about 'em, see. So, our youngest sol""",,
LM,"is kind of gathering that kind of stuff together, just a couple of",,
LM,days ago that we sent 'em to him. them to him in California.,,
HBM,Beautiful gloves.,,
LM,"Oh, beautiful, and I insured those things for $250 My oldest son,",,
LM,"he saw some in an antique shop somewhere up around Coeur d'Alene, up",,
LM,"there, and when he looked at 'em, he said, ""My God, they're prettier",,
LM,"than the ones that I looked at and they had a price on 'em of $1,500!",,
LM,(Chuckles) Too bad I don't have 'em here to show you. Just a few,,
LM,"days ago, we sent 'em.",,
HBM,Beaded bag.,,
LM,"Yeah, collecting that kind of things.",,
HBM,"I've just given everything away, because Dick really went to school",,
HBM,"there, and the Indian boy played the piano for him, he played the",,
HBM,"trumpet and the Indian boy played the piano, and he's very fond of",,
HBM,him. I thought that it would mean more to him than it would to any,,
HBM,one else in the family. We've tried to give him most anything we had.,,
HBM,(Left out a small bit of personal conversation},,
HBM,"The boys were athletic, the Indian boys were, and they played basket",,
HBM,"ball and were champions all the way through, but they weren't allowed",,
HBM,to take any part in the school affairs. A white girl wouldn't be al,,
HBM,lowed to dance with one of those boys or date them or have anything,,
HBM,"to do with them at all. And so, this one Indian boy was a neighbor,",,
HBM,"would come in our home and play the piano for our boys, and the boys",,
HBM,all had instruments and played at school. And this Indian boy was,,
HBM,"quite a musician and he sang, and our oldest sen and this boy put on",,
HBM,quite a duet and sang for school affairs. But they didn't play to,,
HBM,gether and work together like they do today.,,
SS,Did you tell your sons Indian stories when they were young? Bedtime,,
SS,stories and that sort of thing?,,
HBM,"No, not too much.",,
LM,"Well, you didn't have to because our oldest kid was born right up",,
LM,there- born and raised right there among 'em.,,
HBM,A little Indian boy came in one day and said; he was out in the yard,,
HBM,"playing with the boys, and he came in - oh, no, I happened to be out",,
HBM,"side and I heard this little Indian boy say, ""Mrs. Messersmit, Dick",,
HBM,"he cheat.marbles.""",,
LM,"Yeah, I remember that. (Chuckles)",,
HBM,"I told Dick about that when we were down there. ""Mrs. Messersmit,",,
HBM,"Dick, he cheat, marbles.""",,
LM,"Yeah, the Indian can't cope with with White men at all. (Chuckles)",,
HBM,But the boys played with them.,,
SS,What do you mean? White man is going to get away with whatever he,,
SS,wants to? Just can't deal with what he does?,,
LM,"Well, I'd say up to date, that the White man is just advanced a lit",,
LM,"tle farther, I guess than the Indian, and the White man takes advan",,
LM,tage of him.,,
SS,"Did you ever hear any of the Indian stories, like about the coyote?",,
HBM,I've got all of that. I have all of that in this little book. And,,
HBM,you're welcome to read it.,,
SS,I was just wondering if you actually heard those stories when you were,,
SS,down there; if the Indians eyer told stories about- like about coyotes,,
SS,and that sort of thing.,,
HBM,That story is in Miss Crawford's book. All those stories that they,,
HBM,"told. But,my association with them in the schoolwork or in the",,
HBM,church work. And those stories were not told.,,
SS,They didn't have dances around there like they had in some of the,,
SS,"pioneer places, where people just got together and had dances, like",,
SS,"at night in somebody's house, or that sort of thing?",,
LM,"Oh, Lord, no! Now, wait a minute, on New Year's night, yeah, the",,
LM,Indians-,,
HBM,They had their dance; we had our dance. Never mixed at all at that,,
HBM,time.,,
LM,"Down at the old Fenderson building on New Year's night- oh, they had",,
LM,"their regular war dances, you know.",,
HBM,Yes.,,
SS,But you had regular dances- you folks would have dances and get-to,,
SS,"gethers, the white people would?",,
LM,With the Indians?,,
SS,By themselves?,,
LM,"Yeah, sure. Sure, we had our dances and skating rink there at Lapwai",,
LM,"at one time. But the Indians never came to the skating rink, that I",,
LM,knew of. Did they?,,
HBM,"Well, an Indian woman said to me one time, she says, ""Doesn't it make",,
HBM,"you jealous to see your husband skate with all these pretty girls?""",,
HBM,(Chuckles),,
LM,"Yeah, the Indians had their dances there. Their dances on New Year's",,
LM,was quite an event.,,
HBM,Strictly war dance. Now they dance our style.,,
LM,"Yeah, now they-",,
HBM,"They have their war dances, too, but we call them heathens! The mis",,
HBM,sion people called them heathens. They didn't like these war dances,,
HBM,"and these stick games. They said, ""Those are the heathens.""",,
SS,"So, the religious Indians didn't take part in those?",,
HBM,"Oh, no! Oh, no! They called them heathens!",,
SS,So there was sort of a split between those that did?,,
HBM,Yes.,,
HBM,END OF TAPE,,
