speaker,timestamp,words
Harry Sampson,0:41:20,"He had eventually three sons in the store, but when I went in there, there were two sons. One operated the shoe department and the other the clothing department. It was only about three years or four. The son that was running the clothing department, I was home of David, he wanted to take charge of the women's reticure in the draggers department. He had that up. He turned the department then over to me, which I was about 19 or 20 at that time. But he would consult with me several years after I took it over. But after 19, I would say after 1921, he turned the whole thing over to me and I operated it until the time I quit in 1958."
Harry Sampson,0:42:37,"I'll have to admit I was rather successful operating it because in all the years that I was in the store, the men's department had the biggest volume and the most profitable during those years. I had the figures down in the basement. In the year I went in until the time I quit."
Sam Schrager,0:43:01,"I could ask you to what do you attribute that success, but I don't think I will because you probably would be too modest to want to tell me."
Harry Sampson,0:43:10,"No, never so."
Harry Sampson,0:43:15,"I gave them plenty. Plenty of my time. A 10 hour day didn't mean anything to me. In those days we went to work on 7 o 'clock and quit at 6. And we on Saturdays and holidays, they're not holidays, but when there was a fair or a chautauqua or any special event in town, we'd keep open until probably 10 o 'clock at night. So hours didn't mean anything to me and of course I was interested in seeing that the department improved all the time. So we were continually rearranging the department town. Senior Mr. David went right along with me. So you go ahead and do it. It remained a lot of new innovations."
Sam Schrager,0:44:12,Like what?
Harry Sampson,0:44:13,"Well, take the men's hats. We had to sell hats out of a hat box. A hat box held three hats. So you had a tremendous lot of hat boxes up there. And when you wanted to sell a hat, well you had to take a box down, get the hat off, and if you showed him more than one style, you probably had four or five boxes out there. It made a kind of a clutter. So I proposed that he let me put in a shelving and put these hats out of the boxes. Well, he went a little further than that. He even says, well, we'll put some glass over it. So that was one thing. Then a dressing room. The only way a man could try on a pair of trousers was to go up to the third floor. Well, that meant going up three sets of stairs to get up there, and it took you away from the department. Well, you were doing all that because you had to measure the trousers and all that. So I talked to him to let me put in a dressing room downstairs, and the only place that we had, and we'd only allow a space about four by four for a man to go in and put on a pair of trousers. Well, that helped an awful lot, and we used that for a good many years. Then our stock room was up on the third floor against the south wall, where we kept surplus of underwear and overalls and shirts and luggage and all that. So I proposed that he let us put in a balcony because the ceilings were about 18 feet tall. There was a ledge all around the side walls, so he allowed me to go ahead and put that in. We moved down a lot of, especially the soft guns, downstairs."
Sam Schrager,0:46:53,"Why did the balcony make that possible, putting in the balcony? Putting in the balcony, what was the reason to put it in?"
Harry Sampson,0:47:03,"So we could take some of the reserves stock upstairs and put it on the shelf. We wouldn't have to run up there every time we wanted something we didn't have down on the floor. We had just a ladder to get up there. It wasn't a stairway, it was just a ladder that went up there. Well, then when I first went in the store, a lot of the men's suits were folded with the pants and the vest put inside and put on the counter. You had one here and one here that folded over into this pile, and you had a stack about that high. You had it in sizes and different stacks, and if you wanted a certain pattern, you had to pull it out of the stack, which was a terrible nuisance, and it messed things up awfully. So I got them to get the plumber to make some racks out of the water pipe, and we hung the suits from then on racks."
Sam Schrager,0:48:18,Most of these ideas just came from your own observations of what the problems were.
Harry Sampson,0:48:24,"Yes, anytime that I took a vacation or made a trip anyplace, my main objective on the trip was to go into other stores and see how they arranged their merchandise and what makes the handles. In fact, I even shop window displays because each department had to trim their own windows. So I would observe their windows, and I took notes of what they had on their sign cards and their windows and all that in order to pass that on out of the store."
Harry Sampson,0:49:11,"And we did put in some pretty good windows because we had one line of clothing, Style Plus, which sold for $17, and they were giving a prize for the best window. Well, I did not realize that there were some big stores that had some elaborate windows, but I went in and decorated a window with all the material I sent, and I had the photographer take a picture of it and send it in. Well, I did not get a money prize, but I did get an honorable mention on it. So that was something. And then remember in the early merchandising business, you did not have janitors in the store. You swept the floor every night before you left or early in the morning when you came down. You shoveled the sidewalks off, snow in the wintertime, washed the windows, all that. There was no special one. We all did it. We all pitched in."
Sam Schrager,0:50:29,How many salesmen were there in your department besides yourself?
Harry Sampson,0:50:35,"There were three of us when I first went in there. And then we increased it to four. And then during World War I, because we had a tremendous lot of soldiers up here in all the dormitories and the fraternity houses and so on. And then when we started hiring students. And there have been times when I have had as many as four students in the department."
Sam Schrager,0:51:22,It sounds to me that probably you are more interested in advancing the business than you were in advancing yourself in a way or just making money.
Sam Schrager,0:51:34,Am I correct in feeling that way?
Harry Sampson,0:51:37,"Well, as I think of it now, I was so interested in my job and there was so much to learn and do that time didn't mean a thing. I just spent hours and hours, even over time, because I was interested in it. And I guess you would say I was more interested in the business than I was the money that I made. I was just looking the other day."
Harry Sampson,0:52:12,"In 1921,"
Harry Sampson,0:52:17,"2, and 3, I got $125 a month. And then I got up to $150 a month before the Depression started in 30. And then the Depression hit us so hard a year after it started nationally that they just got us together and said, This is about the only thing we can do. We are going to have to reduce salaries. And they reduced my salary to $125 and others accordingly."
Harry Sampson,0:53:04,"But along about $36, $35, I guess, things started to pick up. And of course, I want to try it on up. $175 a month. We had a tremendous increase in business after World War II. In fact, I had one of the biggest years I ever had right after World War II. I think it was in 1948 or 1949 in the department."
Sam Schrager,0:53:43,Was this year the year that everyone took a salary cut? Was that 1930 that year?
Harry Sampson,0:53:50,"I would judge it, presumably, in 1931 or 1902, because it was after Roosevelt got in."
Harry Sampson,0:54:00,"It hit merchants in the bigger communities, much worse than it hurt us to start out with. The Depression didn't get here until a year after the others were involved."
Sam Schrager,0:54:17,I wanted to ask you about Mr. David's possible running for governor that you mentioned.
Sam Schrager,0:54:25,Do you know what that situation was that he could have run if he wanted to?
Harry Sampson,0:54:33,"Well, he was offered it. I know that."
Harry Sampson,0:54:38,The only reason I can see why he didn't take it is that he didn't want to be involved in the campaign for it.
Harry Sampson,0:54:52,"His business meant a lot to him. It would take him away from the business. It's proven that in Governor McConnell. When he took governorship, the business went down. Eventually, he had to close out when he got back from his four years as governor. Do you know what role Mr."
Sam Schrager,0:55:22,David took in politics?
Harry Sampson,0:55:24,He and his sons both were tremendously interested in the university.
Harry Sampson,0:55:39,"At the time, Pocatello was interested in getting the university down there away from us. Every legislature had to fight that. Mr. David was very instrumental in the back room politics and contacting the legislature by phone from Moscow."
Harry Sampson,0:56:14,He was very political -minded and he was very aggressive in it. I guess today you would call him a semi -liberal because he was looking out for the interest in Moscow.
Sam Schrager,0:56:41,Why would he be liberal?
Harry Sampson,0:56:45,He was for things that a lot of people were against.
Sam Schrager,0:56:55,Do you think Moscow was divided?
Sam Schrager,0:56:58,There were a lot of people in Moscow who didn't really care about having the university here.
Harry Sampson,0:57:04,I don't think that.
Sam Schrager,0:57:06,What were the kinds of things?
Harry Sampson,0:57:08,The outside interests were trying to get it away from us.
Sam Schrager,0:57:11,What would some of the things be that he was for and that other people wouldn't be for?
Harry Sampson,0:57:24,"Well, this being an agricultural community, that was the main resource here for business because Moscow was kind of a trading point of this whole area."
Harry Sampson,0:57:42,"All his old cronies were interested in the university and that influenced him, I think some too. The university enrollment, when they started out, was very, very small. Even when I went into the store in 1910, I don't think the enrollment was over 650 to 700 students and it was building up."
Harry Sampson,0:58:20,"Of course, he had sons that he was interested in, education. Every one of them went through college."
Harry Sampson,0:58:30,"Three of them, three sons and a daughter, graduated from the university from 1902 to about 1909. Howard David, the youngest, I think, graduated from 1909."
Harry Sampson,0:58:56,"That was an incentive, of course, because he was interested in education."
Sam Schrager,0:59:03,What was your understanding about how the university got here in the first place?
Harry Sampson,0:59:09,"Well, of course, the old story is that we had the opportunity, or boys who had the opportunity of the penitentiary or the university and they picked the penitentiary. That's the old story. But I think it was through the efforts of some of our early politicians in the late 80s. I can't recall the names. McConnell was one, of course. And Willis Sweet is one. Yes. We had a push here to put that thing over where the other fellows didn't."
Harry Sampson,0:59:59,"It was through the people that we had here, living here at the time, Judge Forney, for instance, is another. He was the first appointed president."
Harry Sampson,1:00:16,He kept the ball rolling.
Sam Schrager,1:00:19,Do you subscribe to the idea that it was largely given to us to keep North Idaho as a part of the state so that they wouldn't go and join Washington?
Harry Sampson,1:00:33,"Well, that was brought up by, I don't know whether Sweet was one of them, but I'm sure the early educators or early politicians used that as a leverage on Southern Idaho. What they wanted to do was take in Spokane, let Spokane be the capital of the northern eastern Washington, northern Idaho, and western Montana. And the new state was to have been Lincoln."
Harry Sampson,1:01:06,"I think it was brought up more than once, as a threat."
Sam Schrager,1:01:12,"So it probably had quite a bit of support up north here, that idea."
Harry Sampson,1:01:16,You bet they did.
Harry Sampson,1:01:22,"Oh, yes, there were a lot of people who were in favor of that because it was a fight with the South all the time. And it's a funny thing. When Idaho was established, Northern Idaho was a progressive end of the state. Southern Idaho was nothing but sagebrush, and farming got started a little later, of course. And it got to be, in a Boise fell, it got to be quite an agricultural and fruit area."
Harry Sampson,1:01:57,"Now, I think it was due to the men, the politicians that we had here that got the unversed here, the penitentiary end of it, but I don't think it was in the picture at all."
Harry Sampson,1:02:18,"There was another book that I was going to ask you about, and that is the book that your mother gave you."
Sam Schrager,1:02:44,And is the book about pushing to the front?
Harry Sampson,1:02:47,"Well, it is how people became successful in their field."
Harry Sampson,1:03:02,"Oh, there are a lot of national figures in there, of course, that they use as examples."
Harry Sampson,1:03:14,"I think you'll find an article there on Benjamin Franklin. I wouldn't be surprised, even Napoleon's in there."
Sam Schrager,1:03:27,"It says, wanted a man, possibilities and spare moments. Choosing a vocation, the triumphs of enthusiasm, personality as a success asset. Do it to a finish."
Harry Sampson,1:03:50,The whole idea of the book was to put yourself into whatever you intended. Push yourself right along.
Harry Sampson,1:04:02,Don't let failure stop you from pursuing what you're interested in.
Sam Schrager,1:04:18,Was this book very important to you when you first had it?
Harry Sampson,1:04:23,"Oh, yeah. I read it through and through."
Sam Schrager,1:04:32,Give you more confidence that a young man could make good in.
Harry Sampson,1:04:36,"Sure did. When you could see what others did, you were able to go up to."
Sam Schrager,1:04:43,I see Cornelius Vanderbilt in here.
Sam Schrager,1:04:47,Is he?
Harry Sampson,1:04:48,We were through his mansion two years ago. The most beautiful mansion I've ever seen. A lot of marvel.
Harry Sampson,1:05:04,There was a place for entertainment. Had a big ballroom. Lots of bedrooms.
Harry Sampson,1:05:22,A lot of people were there.
Sam Schrager,1:05:31,"Was this book aimed at business or was it aimed at business, government and any career?"
Harry Sampson,1:05:39,Any career. It wasn't anything in particular. It was to instill in you to push yourself into whatever you attempted to do.
Sam Schrager,1:06:07,Do you remember the circuses coming to Moscow when you were a boy?
Harry Sampson,1:06:11,"Oh, yes. We had a circus, I would say, every year. I don't know that we ever had a Ringling Brothers circus here, but we had Cels Floto."
Harry Sampson,1:06:27,There was another one that used to come.
Harry Sampson,1:06:34,They usually sat up in the old fairgrounds down where Rosauers are. We have had circuses down at Ghormley Field. We've had some where they had to get out on the outskirts of town to perform. The city always got a little revenue off of circuses for use of ground.
Sam Schrager,1:07:03,"As a boy, did you want to go to those when you could?"
Harry Sampson,1:07:06,"Not only that, but I carried water to the elephants. I got many a pass into a circus. We'd always go down there early in the morning. We'd have to carry boards for the seats, things of that type. Many a time I carried water to the animals."
Sam Schrager,1:07:32,You returned for a pass?
Harry Sampson,1:07:34,"Yes, you didn't get paid for it. You just got a pass. You didn't have to work for long to get a pass."
Harry Sampson,1:07:49,Another place where they had circuses was down there where Mark IV was a circus ground.
Sam Schrager,1:08:04,Were they very large? The circuses?
Harry Sampson,1:08:08,Three rings.
Harry Sampson,1:08:13,"Once in a while a small water circus would come that would be mostly a dog hill or something like that. Most of the circuses are three ringed circuses, acrobats and everything."
Sam Schrager,1:08:28,Lions? Did they have lions?
Harry Sampson,1:08:32,"Yes, lions. I have a set of lions, tigers, horses, monkeys."
Sam Schrager,1:08:41,What about these chautauquas? Do you remember them? The chautauquas?
Harry Sampson,1:08:46,Yes. Very much so. They'd come for a week and sell season tickets before you had to buy a season ticket. I remember there were six dollars for a season ticket for a week. They set up in a tent just north of City Park. That was all open ground there then. Their program was both afternoons and evenings.
Harry Sampson,1:09:23,We had some nationally known figures at these chautauquas because chautauquas had some pretty fine programs. I'll never forget one program. Either a congressman or a senator was on the program. It was right before World War I.
Harry Sampson,1:09:59,There is no war coming up. These countries can't afford a war. Germany is broke. France hasn't got money enough to carry on a war. I'll be no war. He had an odd time of week. We had a war started. I'll never forget that.
Harry Sampson,1:10:26,They had some wonderful programs and wonderful entertainment. That was both musical and speech and lectures and whatnot. I was playing the cornet at an orchestra at that time. Egan's Hall was built somewhere around nineteen four or five. That's where the shopping center is on Third Street. He had a photographer gallery right on the corner. He built this big wooden building with a stage. It was a roller rink. People in town here roller skated for several years.
Harry Sampson,1:11:25,"We had dances there. During the chautauqua, our orchestra played for ten cent dances. That was the common thing in those days. You didn't go to a dance and pay a couple of dollars for the evening. It was a ten cent dance. After every dance, we felt like we were on the tickets. That was very profitable for us because there were some of those evenings that the place was so full that we made around twelve, fifteen dollars apiece. We were playing for those dances, which was a lot of money in those days."
Harry Sampson,1:12:09,"Then after that, the National Guard was formed here in Moscow. I was a member of it. We used the stage for the lockers to keep our guns in and equipment. I remember we used to drill up and down Main Street and Third Street. The only real activity I had in the National Guard was when the IWW uprisings were on. They were mostly lockers. They set up what they called a bull pen down in Ghormley Park. The fence around it regarded that fence so that they didn't break out. The thing was finally settled."
Harry Sampson,1:13:16,I think I served two years in the National Guard.
Sam Schrager,1:13:21,Do you know about how long they kept the bull pen?
Harry Sampson,1:13:25,"It wasn't very long, probably a week. That was settled."
Harry Sampson,1:13:33,Most of them were lockers from up in the camps that were causing the difficulty.
Sam Schrager,1:13:42,I wanted to ask you about the forming of the First Country Club. How that came about here.
Harry Sampson,1:13:56,"I think I gave you a lot of that. It was only just us talking. We didn't put it down on tape. I thought the story of that would be good. The beginning of golf in Moscow started with Albert Moody and myself down on the old fairground, which is now Ghormley Park. My brother did a lot of the labor on it. We put in six golf holes, sand greens,"
Harry Sampson,1:14:37,"and had them oiled and so on. It was pretty good. There were just enough people in Moscow that had played golf in other places before they came to Moscow. Around that nucleus, we got the thing going at a dollar per memory to put those greens in. We had no membership fee particularly. That was about it, one dollar for playing for the season."
Sam Schrager,1:15:14,Did you have any troubles laying out that golf course there?
Harry Sampson,1:15:18,"Yes, because we had one hole that was next to the Paradise Crick."
Harry Sampson,1:15:26,"A lot of golf balls were lost in the Crick, of course, until they got out of a floater golf ball. Whenever we on a second shot were afraid that it was going into the Crick, we always used a floater. That saved it. You did not get the distance on that kind of a ball that you did out of a regular golf ball. Well, from that, it progressed into wanting a nine -hole golf course. That was before World War I. We went out on the Gov mix place north of town where the KRPL station is now and laid out nine holes. They were sand greens, too."
Harry Sampson,1:16:22,"We only operated that. At that time, that is when we organized the Moscow Country Club, which took in both golf and tennis. The tennis courts were up on the corner of Hayes and B Street. I think we had three or four tennis courts. To become a member of both golf and tennis, you paid $15. If you only played one, you paid $10. I have a list of the names of all the original members of that course. Well, the war came along, and we were criticized so in developing a golf course, because it was not completed until yet. Of us putting in a golf course when they needed wheat so bad during that time. We even had our grass seed bought, all stacked up ready to plant the thing into greens and so on, and the fairway. Well, they got together, and I decided maybe they should give it up until after the war, which they did, but we still held a group together. Then, I had forgotten just what year it was, but I think it must have been around 21 or 22 when they bought this piece of ground for the golf courses now."
Harry Sampson,1:18:06,"I hired Mr. James, who was a golf expert in laying out greens. He came here and laid out the course. In order to develop that, we had to get a membership. We had over 100 memberships at $125 a piece, and that started the thing off. I think the green fees, or not the green fees, but even though you were a charter member, later on, your green fees were $60 a year. Well, that dropped a lot of the membership, and our membership went down. We hated to see the course go to the boards, and the Elks Temple at the time had slot machines, and they were making money hand over fist on their slot machines."
Harry Sampson,1:19:18,"We proposed to them, because a lot of our members were Elks, that we would give them, turn it over to them, if they wanted to operate it. They took us up, and it has been the Elks Golf Course ever since. The sad part of it, those of us that paid $125 as charter members of the course, never got any membership. We had to buy a new membership, just the same as we never owned it."
Sam Schrager,1:19:57,Were you still paying off the land? Is that why it became impossible to hold on to the course yourselves?
Harry Sampson,1:20:06,"Let's see now, it was 40 acres, and I don't think the land at that time cost over $100 an acre, so the 40 acres didn't cost over $4 ,000."
Sam Schrager,1:20:19,"But the problem was the upkeep was too much for you, too expensive."
Harry Sampson,1:20:24,"Yes, that was part of it. The factory just couldn't, there wasn't money enough taken in to operate it."
Sam Schrager,1:20:34,"Didn't you tell me that there was, in the early first days of golf here, there was a lot of people, especially businessmen, who just didn't think anything of the sport, didn't want to try it?"
Harry Sampson,1:20:48,"Well that was the original course down at the fairgrounds. In fact, I think I mentioned to you that it took us quite some time to get some of the older falls interested in it. And Mr. David Sr., who was up in years at that time, wouldn't be seen carrying a golf club out of the store or a golf bag. So I used to play with him, occasionally, and we would go out the back door of the store and put his golf clubs in the car and drive down there and play around and come back and bring them in the same way. So there were several of them thought it was kind of a sissy game, sickening up a ball and driving it and chasing it."
Harry Sampson,1:21:46,"But it got so that they got tremendously, well they had to get tremendously interested in it to what I put in a nine hole course out north of town. And it developed pretty fast after that."
Sam Schrager,1:22:04,Was it hard to come by golf clubs in the first days of golf around here?
Harry Sampson,1:22:09,"Now just as soon as we organized that first golf course, I put in an athletic department in the store. And I was the only one in town that had golf clubs to start out with. And in those days there were no steel shaft golf clubs. They were all wooden shafts, which were the kind they used in Scotland where golf originated. And a golf club in those days, I even have a listing of the clubs that I sold of various memories, would run two and a half a piece. A driver, a mauche, would cost three dollars. And golf balls, I remember, were from 25 cents to 50 cents."
Harry Sampson,1:23:09,"And I sold a lot of golf clubs in there. And from that way, we got interested in selling equipment to the university for their football and basketball and tennis and all that. And for a good many years, we were the suppliers for the university. Basketball and football came on their equipment. Uniforms, footballs, basketballs and all that."
Sam Schrager,1:23:45,Did men carry bags for the clubs in those days?
Sam Schrager,1:23:50,Oh yeah.
