speaker,timestamp,words
Harry Sampson,0:00:05,I was 10 years old or 9 years old when I came here in 1902.
Sam Schrager,0:00:16,"What do you remember about him, Wild Davey?"
Harry Sampson,0:00:20,"Well, all I remember was that we were, as kids, we were scared of him because he was kind of a recluse, I guess you'd call him. He was more or less considered him a hermit, sort of. And he had these dogs, which we were afraid of too. So that he was an individual. He was eccentric. People in town here knew of him."
Harry Sampson,0:01:05,"So he was, as I say, a character."
Sam Schrager,0:01:10,Did you see him mostly going by and on the street? Is that where you'd see him?
Harry Sampson,0:01:15,"Well, we'd see him down here. He lived right down here on White Avenue, kind of a shack down there. And by the way, too, at that same time, we had a Negro family lived right down in there. And that's the first Negro family that I know of that came to Moscow. And that was here, and they were here before 1902, I'm sure. Caris knows the name of a party, a Negro family, because they were real dark Negroes."
Sam Schrager,0:01:57,Do you know how he made a living?
Harry Sampson,0:02:00,"No, I don't."
Sam Schrager,0:02:04,Did their kids go to school here?
Sam Schrager,0:02:06,I was.
Harry Sampson,0:02:08,I don't know how many youngsters they had. I suppose she's taping out there. I'd go out and ask her now. I can't think of the name of it. It wasn't a big Negro family at all.
Sam Schrager,0:02:22,Who'll ask her later? Do you know if they stayed for very long? Do you know if they stayed for very long?
Harry Sampson,0:02:33,"As far as I know, I don't remember them ever leaving. They may be buried here in the cemetery, as far as I know."
Sam Schrager,0:02:42,"This Wild Davey, did he have any friends in Moscow?"
Sam Schrager,0:02:45,Yes.
Harry Sampson,0:02:46,"Mr. Creighton was a particularly good friend he has. And I wouldn't be surprised that he saw that he had clothing to wear. As Caris mentioned, the last time you were here, the hotel gave him food. At that time, the hotel was run by Mr. Gail, whose daughter married Govemex. Govemex was a Gail."
Sam Schrager,0:03:34,Do you have any idea why Mr.
Sam Schrager,0:03:36,Creighton and he were friends?
Sam Schrager,0:03:38,"No, I don't."
Sam Schrager,0:03:39,He just took an interest in the man?
Sam Schrager,0:03:42,"Evidently, no."
Harry Sampson,0:03:47,"Creighton was a man that had very few friends. He had special friends that he liked. He was interested in him because he was an immigrant. He was a boy from Scotland, came to the United States. In fact, as I understood it, his folks wanted to make a minister out of him. He didn't want to, and he immigrated to America. I don't know how old he was when he came here. How he happened to come to Moscow, I don't know."
Harry Sampson,0:04:28,"But I worked for Mr. Creighton from 1907 to 1910 while I was going to school. While I know he had special friends, he would send him to a liquor company and get very high -grade wines and liquors. He'd get a whole barrel full of this stuff. He had a little hideaway in the back of the store where he would invite someone that he wanted to talk to secretively. He had that barrel back there. Before Christmas, he would make up the packages of these different people that he would want to give those presents to. I'm sure Wild David probably was maybe one of them too, I don't know. But I know there was a banker in town. He was a special friend."
Harry Sampson,0:05:33,There were various ones. I delivered some of the packages for him.
Sam Schrager,0:05:39,"So really, he was the kind of man who didn't hobnob that much with all the businessmen, but kept mostly certain people as..."
Harry Sampson,0:05:50,He had definite friends.
Sam Schrager,0:05:56,"Can you tell me, I was thinking about how he was different from Mr. David in their ways of looking at business and at life."
Sam Schrager,0:06:12,"How were they different, those two men?"
Harry Sampson,0:06:16,"Well, Mr. David was a community -spirited man. He was interested in education, spiritual life of the town, political, politically. In fact, he could have been governor of the state if he'd wanted to run for it, but he turned it down. I don't know the reason for it, except that it took him away from his business or something."
Harry Sampson,0:06:50,"But Creighton was... He and his wife, he had a wife that was very eccentric."
Harry Sampson,0:07:00,"And she only had a very, very few friends too. So they were that type of people."
Sam Schrager,0:07:12,Would you say that the two men had a very different philosophy of business?
Harry Sampson,0:07:19,"Well, they got to be very competitive in years on. And I think that was one of the reasons probably that Mr. Creighton didn't want me to go down to David. Because when I left there, he never spoke to me for several years after I'd been down there. Even his wife wouldn't speak to me."
Sam Schrager,0:07:52,Would you tell me about what that offer was that you said he made you an offer when you came back to say that you were offered a job?
Harry Sampson,0:08:01,"Well, I was getting 25... I think it was $25 a month."
Harry Sampson,0:08:09,"And the opening down there was due to a young fellow that was living at my mother's place. But he and another fellow had a disagreement, and they both quit. So they needed somebody quick. So this fellow told me, he says, if you want the job, go down there and see Mr. David. And they're particularly interested in someone that can understand the Scandinavian people because this county was probably 60 % Scandinavian. So I went down there and I just got the job that quick. So I went back and told Creighton about it. And at first he just kind of blew up and wouldn't say anything. And I gave him plenty of time before I went down to David's."
Sam Schrager,0:09:07,"So eventually he came around and he says, will you stay if I boost your salary?"
Harry Sampson,0:09:17,"Well, he boosted it up to, I think it was $35 or $40 a month. And I had to tell him that I said my offer down there was better than that. And that I had already accepted the job so I couldn't refuse him. I was of that nature. At the same time, I had an offer from R .S. Shurphy who ran the bookstore. And he offered me the same amount, but I decided to go to Creighton's, or to David's."
Sam Schrager,0:09:56,Did Mr.
Sam Schrager,0:09:57,Creighton ever mention to you about his getting shot by Steffen back a few years before that?
Harry Sampson,0:10:06,"Not that I know of, but I knew of the incident. Because we came here the spring after all this happened. So I knew that Creighton was walking down the street and Steffen took a shot at him. And he was on Steffen's list. Creighton and Watkins, Dr. Watkins, and it seems to me the sheriff."
Sam Schrager,0:10:41,I think Jollie was on his list and also held if I'm mistaken.
Harry Sampson,0:10:49,"Yes, August held was on the list too."
Sam Schrager,0:10:52,"How did you hear, what was the talk when you came about what had happened? Did they have any motivation for Steffen's going after Watkins? Any reason, thought?"
Harry Sampson,0:11:09,"I really don't know. He was a little off -balanced, but he did have a grudge against Doc Watkins, all right."
Sam Schrager,0:11:23,"But for some reason or other, it was because of some medical, or what? Did they think that from what you heard that Steffen had had a history of being unbalanced, or was it something that just showed itself before the killing?"
Harry Sampson,0:11:43,"Well, evidently he showed some peculiarity because when he went on this rampage, he went on horseback."
Sam Schrager,0:12:00,"And as soon as it was all over, why he should go back to his mother's home, or he's living with his mother?"
Harry Sampson,0:12:09,"I don't know. He thought he'd hit out someplace, but he didn't. And then of course, then when they surrounded the place and tried to get him to surrender, and she finally came out of the house, and they had shot holes into the house. We saw holes in the house years afterwards, after he was shot. So we don't know whether he shot himself or he was shot by a bullet through the house, but he was killed right there."
Sam Schrager,0:12:44,Do you have any idea how the mother took it?
Harry Sampson,0:12:51,"Well, I suppose like any mother, she wanted to save her son, didn't want to see him killed, but took a lot of nerve for her to come out the door and try to get him to quit."
Sam Schrager,0:13:05,"What was she doing? Was she telling him he was dead, or she telling him?"
Harry Sampson,0:13:08,"No, as far as I know, I don't know."
Sam Schrager,0:13:11,"You think she came out to say, just tell him to stop shooting before he died?"
Harry Sampson,0:13:17,"Well, I suppose coming out of the house, she thought maybe that would stop the shooting. Well, there were a lot of men out there with guns, but they got from the hardware store and went out there and the whole sheriff set up. They were in the trenches in the Paradise Creek out there for protection."
Sam Schrager,0:13:49,Did the men who had been in the posse and some of those guys ever talk about it in the later years?
Sam Schrager,0:13:56,"Oh, the papers were full of it."
Harry Sampson,0:13:59,"My father was out here when it happened, and we were still back in Wisconsin. We didn't come out here until about the first of March. And of course he had papers that, oh, the big headlines. I imagine there's papers someplace at the university or someplace that show what happened."
Sam Schrager,0:14:25,"They have the Lewiston paper, but not the Moscow one. And the account, they have two accounts. I was just looking at this the other day. The one that came out right after he was shot the same day was quite different than the one that came out the next day. They looked it over and thought about it, and really a number of the details were different, whether he had killed himself or been killed, what had happened after he shot Watkins and some of the encounters that he had in Moscow, this sort of thing. The way you heard it was that the mother probably came out trying to get them to stop shooting while he was still defending himself."
Sam Schrager,0:15:10,Is that right?
Harry Sampson,0:15:13,"I would take it that was the reason she came out, yes."
Sam Schrager,0:15:18,"Yeah. See, they have that two ways too. She came out before or she came out after he was dead, one way or the other."
Sam Schrager,0:15:27,"But did the men talk about it in later years, the men who had been in the posse?"
Harry Sampson,0:15:32,"Oh, like any incident of that kind, it never dies down. Sometimes it gets magnified as to what all happened."
Harry Sampson,0:15:46,"I remember seeing some headline of what happened, all right, but I kind of forgot a lot."
Sam Schrager,0:15:56,"Did anybody want to take credit on what Clyde suggested to me that some of these guys had some doubts in later years, some of the guys that had been in the posse? Did you ever hear that, that they had doubts? Any guys say that they were sorry? Maybe that they handled it that way?"
Harry Sampson,0:16:19,"No, I don't remember seeing or reading anything about that. Oh, I was thinking in the talk, I don't think it would be something in print."
Harry Sampson,0:16:31,"No, I don't remember anything about that."
Sam Schrager,0:16:49,"I wanted to ask you about your mother's boarding house, about how that worked and what it was like."
Harry Sampson,0:17:01,"Well, after my father passed away in 1907, I think it was, he left her insurance, and she was advised to use that insurance to buy a home. She'd have a place to live because we were renting at that time. We had sold the home that we built in 1902, so that was for sale and we bought it back."
Harry Sampson,0:17:37,"And in order to, there were four of us youngsters, and I was the oldest at the time. In order to keep the family together, she decided to run a boarding house for students, which she did, and in order to do it, we had three bedrooms upstairs and one down, and a parlor, and she turned the parlor into a bedroom. So that gave her four rooms for students. Well, she had about six to eight students they slept to in her room, and she was a wonderful cook, and she boarded and roomed them for $20 a month, and she set a very, very good table. They all liked her food. Well, that left it pretty tough for us to, for sleeping quarters, so a brother and I, we slept in the dining room in a pull -down bed, which we had to put up every morning so that they'd have room enough to eat around a big dining room table."
Harry Sampson,0:19:14,"Then, as far as toilet facilities, of course we had a metal house. That was the only thing we had there. The old outhouse with a crescent over the door, and a series of robot catalogs, which the building had to be moved about every year or so. We had no water supply. We had to drill our own wells, so we had a pump, which we had to carry water into the kitchen for drinking and cooking and all that. We had no bathroom, and of all things, having students, younger fellows, they had to take a bath in the kitchen in a tub, a metal tub. The mother would have on the back of the stove a boiler boiling hot water, and they'd just take water out of there and put it in the tub, and that's where they took their bath. Well, we had an electrical engineering student stay there from Wallace. The mother wouldn't let him use very big light bulbs because electricity was rather expensive."
Harry Sampson,0:20:52,"He worked out a lot of where he could put a wire ahead of the meter and bring it into his room, which he did. As far as I know, that operated for years that way. We didn't know anything about it, but we found out afterwards."
Harry Sampson,0:21:20,"These fellows were all around 20, 21, 22, along in there. One was a mining engineer, one was an electrical engineer, two of them were civil engineers. It's remarkable we kept top of those fellows after they graduated and where they went, and every one of them made good."
Harry Sampson,0:22:02,"I remember Harry Driscoll for one, but she's an old -time family that he lived there."
Harry Sampson,0:22:13,"He operated a bean business out of Troy and made a metamunning on that. Another fellow was from Genesee, Oley Pauls. He wound up in the federal government with road construction and bridges and so on."
Sam Schrager,0:22:44,"Well, anyway, they all..."
Sam Schrager,0:22:47,"Did these fellows, most of them stayed for several years in the boarding house? Did they stay for more than one year?"
Harry Sampson,0:22:54,No.
Sam Schrager,0:22:54,"Oh, yes."
Harry Sampson,0:22:56,"She operated that for about six or seven years. In fact, I was working at Creighton's at the time when she started it. She carried it on even for several years after I went down to David's."
Sam Schrager,0:23:24,"Did the fellows date? Did they go out on dates in those days, these students? What were you about? The university women who were at the university at the time?"
Sam Schrager,0:23:36,Is that who they...
Harry Sampson,0:23:38,"Yeah. Yes, they were. I can tell you one incident, but it wasn't due to be recorded. One of the fellows stayed there."
Sam Schrager,0:23:53,Maybe you could tell it without using his name.
Harry Sampson,0:23:58,"Well, I'll take it from me. It's kind of an immoral thing."
Sam Schrager,0:24:07,Where the wood came from that you heated with?
Harry Sampson,0:24:12,"Well, we had a wood stove, both in the living room and dining room. A wood stove, wood and coal rains as she cooked on. We had what they called the people that lived out in the mountains. They called them wood rats. During the wintertime, they would cut four foot length timber and sell it then, the next summer. For the following winter's fuel. As I remember, my father used to buy eight cords of wood at a time. We had a wood shed, a pilot outside the wood shed. There was a fellow named Stanley who... Two of the sons who were still living in Moscow, Hubert Stanley and Rick Stanley. He had a saw machine put on the back of a truck."
Harry Sampson,0:25:37,He would cut these into 16 or 18 foot lengths. 16 foot lengths because it was four foot cordwood.
Harry Sampson,0:25:52,"Then both my sisters and brother, we piled the wood in the wood shed. Then later on, we mixed coal along with the wood to give more heat."
Sam Schrager,0:26:09,The general cost of things was very low then.
Harry Sampson,0:26:15,"As I remember, you would buy a cord of wood for around four and a half to six dollars a cord in those days."
Sam Schrager,0:26:29,Your mother could actually make a living by the rates that she was charging these fellas.
Harry Sampson,0:26:37,"I don't know how she did it, but she was interested in my two sisters taking music. She bought a piano on a monthly payment basis and paid that out and my two sisters learned to play the piano. As far as my brother and myself were concerned, at that time there was a man in the club organized in Moscow. A man from Spokane came down and gave lessons."
Harry Sampson,0:27:13,"The instructor was a guitar player. Then there was a man named Childers who run an ice cream parlor, played the guitar. Then I played the guitar, so there were three of us and about 25 mandolins. He furnished him a mandolin for nothing and gave him instructions. I think the course for six lessons was twelve dollars. When he finished the course, we gave a concert in the Methodist Church for the city."
Sam Schrager,0:27:58,People could play after six lessons then.
Harry Sampson,0:28:01,"Pretty good. After that, there were four of us formed a little mandolin club of our own and played at churches and lodges and different organizations around town. That group was, and I went down yesterday to see the Egan girl, who her cousin was one of the group. It was Signe Egan, Jenny Peterson, who was Klaus Peterson's daughter, and my sister Myrtle and myself. We played for a good many years after that. Really, our final playing was up at the Lutheran Church, which I was a member of. All our pieces were waltzes and two steps and things like that. We didn't play any religious hymns or anything like that. We had enough fundamentalists in the church that objected to having that kind of music in the church. We never played after that."
Sam Schrager,0:29:32,"You weren't playing at a church service just in the church, right?"
Harry Sampson,0:29:36,"It was an evening service of some kind. It wasn't a church service, but it was in the church. I didn't think that was the place for that kind of music. That was the days when we had a lot of people in Moscow that were against playing cards and dancing, both. A lot of them were Methodists. I think the Presbyterians were a little more lenient. Lutherans were against it, too."
Sam Schrager,0:30:14,I've been told that it was really those people who felt strongly that way that did bring about prohibition coming to Moscow when it came. That's right.
Harry Sampson,0:30:30,That's right.
Harry Sampson,0:30:34,We had prohibition pretty early.
Harry Sampson,0:30:40,Seems to me it was before World War I. I think it was.
Sam Schrager,0:30:45,Do you remember anything about a lot of temperance lectures? It was put on the ballot or what happened?
Harry Sampson,0:30:56,"It was on the ballot, of course. The WCTU were the instigators of the whole thing. They passed around a lot of propaganda. During prohibition, the little towns across the line, Union Town and Colton, most places, were still open. Washington didn't have prohibition. Of course, it was very easy to get liquor just going over there. It got to the point where the sheriffs would set up a posse out here on the South Main Street bridge and check cars that they thought were coming over from Union Town with liquor."
Harry Sampson,0:31:56,"Then when it got more severe, then the bootleggers came in here and they went around and took individual orders, never delivered right on the spot. They took orders and then it was delivered later. I remember a lot of incidents like that."
Sam Schrager,0:32:18,"When it got more severe, you mean when it was harder to get? You just couldn't go across to Washington and get it?"
Sam Schrager,0:32:27,I tried.
Sam Schrager,0:32:32,"Was it openly violated? It was done very quietly, but still it was pretty broadly disregarded?"
Harry Sampson,0:32:43,"Yeah, that was it. They knew that they were watching the liquor coming in."
Harry Sampson,0:32:57,But it got so common that they didn't enforce it very much.
Sam Schrager,0:33:05,I've heard it said that it brought about more drinking because it was illegal. More people got interested in it. It was forbidden.
Harry Sampson,0:33:15,"That's why prohibition is overturned, just for that reason, that there was more drinking. A lot of people were getting liquor from stills out in the mountains and people were operating stills, which were... Well, there were cases where people went blind drinking some of the liquor. It wasn't properly distilled."
Harry Sampson,0:33:46,"So that's what defeated prohibition when Roosevelt came in. I've forgotten what year he overturned that, but it must have been after the 30s."
Sam Schrager,0:34:02,"It was the early 30s. I wanted to ask you a little bit more about Mr. David, but first I was going to ask you about that book that you mentioned to me that was an influence on you in your early years."
Harry Sampson,0:34:27,"Well, Mr. David, Sr., Frank David took quite an interest in me. I was interested in my job. I did a lot of things that I wondered if I wouldn't do. He appreciated me doing more than I was expected."
Harry Sampson,0:34:47,"I showed quite an interest in selling. He realized that because I would tell him when I made a good sale and things like that. He had a book, really a book on psychology, because he said selling is all psychology, anyway. In this book, he took it rather seriously, too, himself. He said, you know, you can tell a customer by his handshake, whether it's a limp shake or a real hearty shake. I said, you can judge also a customer by the coarseness of his hair, things of that type."
Sam Schrager,0:35:42,What did coarse hair mean?
Harry Sampson,0:35:45,"Well, and I found this particularly true with a lot of customers. A person with coarse black hair normally bought coarse materials and clothing, like tweeds and things like that. It wasn't a thing for them to buy because it accentuated their hair."
Sam Schrager,0:36:15,But they were attracted to it because it was like their hair?
Harry Sampson,0:36:19,Evidently.
Sam Schrager,0:36:24,What was the handshake? What was a limp handshake or a strong handshake?
Harry Sampson,0:36:29,A very weak person.
Harry Sampson,0:36:36,"A strong person would be harder to wait on than the other. The weaker were more, easier, influenced into what you were trying to sell them. And even their walk and things like that. This was all those things that are in the selling."
Sam Schrager,0:37:04,This was a book about selling or a book about psychology or both?
Harry Sampson,0:37:08,It was Psychology of Selling.
Sam Schrager,0:37:12,"Did you find the book, that book, useful?"
Sam Schrager,0:37:16,Yes.
Harry Sampson,0:37:17,"Oh yes. I read that thing through and through, time and time."
Harry Sampson,0:37:26,"And then up at the university, they gave a night course in the business school and the psychology department. And I took that in for about three months, I guess."
Harry Sampson,0:37:49,We had a fellow come through here. But most of the business people on Main Street attended it.
Sam Schrager,0:38:04,What was the fellow that nationally advertised? Was that Dale Carnegie?
Harry Sampson,0:38:13,"Yeah, Dale Carnegie. That's it. And they sent a man in here and he set up a week's course on selling. And I think that was brought about by the business school at the university, which was very helpful."
Sam Schrager,0:38:31,Did you seek advice from Mr.
Sam Schrager,0:38:34,David very often about all the technique and the skills involved in the work?
Sam Schrager,0:38:41,Did you find him helpful in the...
Harry Sampson,0:38:44,"Very much so because he was a salesman himself. In fact, he was a good salesman. And he would come around and talk to me about selling. And naturally I would listen to him and probably ask questions from him about the technique of selling."
Sam Schrager,0:39:10,Did you have much opportunity to watch him working in action?
Harry Sampson,0:39:16,"Well, a senior, Mr. David, at the time I went in there, was more of a forewalker. He did very little selling, but he directed customers to people he wanted them to wait on him."
Harry Sampson,0:39:39,And he was a great storyteller.
Harry Sampson,0:39:47,"He would talk to the customers and he'd collaborate with them. With women that were good customers, he'd always go back and get a sack of candy and give it to them. When they paid their bill at the end of the year, the farmers around here and a lot of people had yearly accounts, he'd always bring them to me, to the men, and he says, I want you to fix John up with a good hat. He just paid his bill. So I gave away many a hat to people. At that time you could buy a Mallory hat made out of rabbits for three dollars. That was the price I remember now. A Stetson hat was five dollars."
Sam Schrager,0:40:46,"When you say he directed people to people we wanted to wait on, he had in mind, do you think, who would match his customers with his salesman?"
Sam Schrager,0:40:58,I think so.
Harry Sampson,0:41:00,I'm sure he did.
Sam Schrager,0:41:03,It sounds like a real good business sense to me.
Harry Sampson,0:41:06,"Well, he was. I consider him one of the highlights in making my career."
