speaker,timestamp,words
Harry Sampson,1:23:53,"And then of course when we started this course out here, some of those older fellows wanted somebody else to carry their bag. And that's when a lot of kids in town here went out there and acted as patties. And on my adopted son, I took him out, this was in the late 30s, I took him out to carry my bag for me and let him learn a little something about golf. Well, it didn't last very long because there were so many golf balls lost in the rough. But these kids were out there hunting these golf balls because you could turn them into the clubhouse if the ball was in good shape for 25 cents apiece. Well, I don't know how many dozens of golf balls that he picked up, but I lost my caddy."
Sam Schrager,1:24:53,"You know, I was going to ask you also along with talking about clubs, about the three clubs here in town, the major ones. And I know the main thing I was interested in was how they sort of came about. Now, the rotary was here first and the Kiwanis came later. And so the rotary was sort of looked at as the old man's club and then the Kiwanis was the young man's club."
Sam Schrager,1:25:27,"Well, and what about the coming of the lions and what you were telling me about the feeling that the town couldn't support them all?"
Harry Sampson,1:25:36,"Well, it seemed that both the rotary and Kiwanis were a little lax in taking on more members into their club. And evidently some national officer of lions came into Moscow and surveyed the community and thought the lions of the club should be organized here. So they got hold of a few of the younger fellows. They were doctors and bankers. They were working in banks and so on. And they had a meeting and decided to form a lions club. I think they had to have at least 25 men in order to form a club. Well, I heard about them organizing it and I heard about it a little too late. When I went to the president of the rotary club and I proposed to him, I said, let's go see some of these fellows that are on the list for the lions club. And you take half of them and the Kiwanis take half of them and we'll eliminate the club and the town. Because we didn't think three clubs, the town was big enough for three clubs. But it was too late. They had gone too far and they went ahead and organized. Well, I was there at the organization meeting by the way from Kiwanis as a representative of Kiwanis the night they initiated their officers. And they called on me to say a few words. Of course, I gave them all the praise in the world because there was no use doing anything else."
Harry Sampson,1:27:30,"So, it wasn't many years that their main project was to see how lions specialize on blind people, getting white canes and look after them. It wasn't long. They had several cases of that here. And they got a lot of publicity. Being a young club, they were just looking for community projects galore. And I don't know how it is now, but I would say for years."
Harry Sampson,1:28:18,And I guess they're still going to get there. There's more community service than either the Rotary or the Kiwanis Club.
Harry Sampson,1:28:31,And it's a good strong club tonight.
Sam Schrager,1:28:35,"What do you think was the big main difference between the Rotary and Kiwanis, those two clubs, the first clubs?"
Harry Sampson,1:28:44,"Well, naturally, Rotary being the first service club organized, they were a little jealous of their club. And I suppose they felt the same way when Kiwanis organized that they didn't want Kiwanis in Moscow. But they were a very active club when they started, too. And they performed a lot of community service."
Sam Schrager,1:29:16,Were you in on the organization of Kiwanis?
Harry Sampson,1:29:19,"I was within six months of it, yes. I'm not a charter member. I was opposed for membership because they take two of a business, Rotary take one. And I was approached on it, and I told them, I said, yes, I would be glad to belong, but the store would have to take care of the initiation fee and so on. Well, they saw the store, Homer David, particularly, and he was a Rotarian. And him being a Rotarian and his brother, two brothers with a Chamber of Cramers, they didn't think it was advisable. But in six months, they changed their tour room. I've been a member of the club since 1926. There was plenty of room then for a second club in town at that time. When I was president of the club in 1940, we had a membership of 50, and we kept building it up. We had 65, and then when I was Lieutenant Governor in 1952, I think it was, we got information from the National Headquarters, or the district here, that every club should increase their membership according to the population. And I went and built the club up to 85 members in that year. And of course, we took a lot of members in there that were enthusiastic to begin with, but a lot of them dropped out later on. We had some members that shouldn't have killed on ends at all. All service clubs had that trouble."
Sam Schrager,1:31:42,"Well, I want to think we should hit some more highlights of scouting, too. Now, we did talk about scouting some last time. Let me see what the car says."
Harry Sampson,1:31:55,Turn on.
Sam Schrager,1:31:59,You have down here on scouting.
Harry Sampson,1:32:08,"Well, one of the camps that we used out in the mountains before we built the one we finally used was Camp Conjagty, which was Eldridge's cottage home out in the mountains. And he allowed us to use it for overnight hikes and trips out there. And I remember one overnight hike we had out there. I don't know whether I told that to you before, but I had about 24 boys out there sleeping in their blankets. This was before the days of sleeping bags. And one of the boys started to break out and redetermine it. It must be measles. So there was a farm across the valley up there, and we went to there and called up his father and told him, he said, you've got a sick boy out here. You better come out and get him. So he came out and got him, and that's what he had was measles. The thing about it, there was a single boy who caught the measles from that contact out there, which we were glad about. You moved quickly, Alan."
Sam Schrager,1:33:35,"This camp in Jogadiy, you slept inside the cottage?"
Harry Sampson,1:33:39,"We slept both in and out. The cottage isn't very big, so it didn't hold for any boys. So we slept on the ground, and I think the patrol leaders and the scout officers slept in the cabin."
Sam Schrager,1:33:58,This was Dean Eldridge's?
Harry Sampson,1:34:00,Yeah.
Sam Schrager,1:34:01,And it was used frequently by those guys?
Harry Sampson,1:34:03,"Oh, that was for users a lot, because it was close. And of course, scouts, the early scouts loved hiking, and that was a big activity in scouting here, the early scouting. We did a lot of hiking. And in order to pass their first -class test, they had to take a 14 -mile hike. And out to Camp Jogadiy, it was seven miles out there, so they could go out there and come back. And on the hike, of course, they had to do a good turn and observe the landscape and animals and wildlife and all that on this hike, and then tell what they brought with them to cook, or the open campfire and so on."
Sam Schrager,1:34:56,"I want to ask you a little bit about that, since I've been looking at some of those themes, some of these reports that the scouts wrote after the hike."
Sam Schrager,1:35:10,"One thing I'm curious about is, was there a usual route that the boys hiked from here to there on, or were there a lot of different ones?"
Sam Schrager,1:35:20,"Oh, there were different ones."
Harry Sampson,1:35:23,"There were good many of them took that, but there were hikes all over. Some of them took them up to Paradise Mountain, Tomer's Butte. I think there's one hike that I gave you there, that they went out south of town and out towards the old Pullman Road and back in, which was longer than a 14 -mile hike. So, no, there was no particular place they had to go to. The main thing, they had to perform a good turn. They had to be 14 miles, and it was an observation test as much as anything. They practiced pacing on it, which was valuable to them in map making."
Sam Schrager,1:36:25,Would they stick to the roads mostly?
Sam Schrager,1:36:28,"Oh, no."
Sam Schrager,1:36:29,They'd go cross -country?
Harry Sampson,1:36:31,"Yeah, they'd cross -country. In fact, I was just reading one the other day where they went through a fellow's wheat field, and it was money, and how they had to clean their shoes off after they got out on the highway or the road. We had one hike. We started right here at the corner of the cemetery, County Road, a beeline hike. That was quite an event. We spotted a tree up here that was in the open up here on Paradise Mountain. We were supposed to make a beeline for that. It was called a beeline hike."
Harry Sampson,1:37:19,"I was on that hike, and I had an assistant scout master with me on that hike. The first obstacle we run into was this South Palouse Creek down here. The water was high."
Harry Sampson,1:37:37,"We couldn't go around, and we'd come back over here and then come back over. We had to go cross that creek. The assistant scout master, I always remember, his name was Cleek. He says, I'll get these boys across. He went out and waited the creek to see how deep it was. Well, it came up to about here on him. He took every one of those kids—I've forgotten how many—he was about fifteen. He took every one of those kids, taking that across that creek. We made our beeline hike up there, and we had our cooking along with us, and we had our meal up there. We waste -beaked that water. Yeah, it was cold. I don't know how he took it. He even took me across. He was a big man. He was a pretty husky man, yeah."
Sam Schrager,1:38:39,"Well, were the kids know the routes that they took on these fourteen -mile hikes? Have they been over the routes before?"
Sam Schrager,1:38:51,"I was going to have them run over and just— The trails were fairly well set in most places that kids would take, and they would know how to get a shortcut from one place to another."
Harry Sampson,1:39:02,No one got lost.
Sam Schrager,1:39:03,"People didn't get lost. The kids didn't get lost then. I was going to ask you about that, whether there were times when the scouts did get lost."
Harry Sampson,1:39:15,"I only had one case, and that was when Moscow Mountain was on fire, had a forest fire up there, and the whole community went out there to dig trenches and stop it. They needed somebody to patrol these trenches after they were dug, because the roots of the tree would go underneath and start a fire on the other side of the trench. So I offered my troop to go out there and patrol. I'd forgotten how many boys we had, but we used camp con -joc -ity as our headquarters for eating meals. I think there was some organization that brought out food for us. Well, we patrolled those trenches, and it was a good thing because we had any number of cases where the roots had gone across the trench and we were able to put them out. But this one boy named Harold Waters strayed off. There were trails like this all over the top there, and it was what they called a round top. All that round top, there were trails led in all directions. He ventured up to that round top, and he took the wrong trail back to camp con -joc -ity. He was lost there for several hours. He hadn't showed up, so we set out a search crew. We kept howering and howering and so on. He'd gotten away, caught a ways, because he took the wrong trail. But he finally heard us, and we stayed where we were and kept howering and he found us. That's the only time I ever had anyone lost."
Sam Schrager,1:41:17,"One feeling that I get from reading these things, which I think is so interesting, is this feeling that the country was so much more country in those days than it is today. The scouts would get out there just walking in and they'd be seeing wildlife, a lot of it."
Harry Sampson,1:41:36,It just sounds like there were a lot more trails around than we'd have any traces of these days.
Sam Schrager,1:41:44,Is that true?
Harry Sampson,1:41:44,"Well, remember this was in 1920, the 20s, 20s and 30s. A lot of towns people used to picnic out in the mountains. That was one of the favorite places to go for a picnic. A lot of the trails that are up there were made by logging, pulling logs out of the hills. If I'm not mistaken, in the early days they used to be grazing up there. They'd be sheep from down below Riparia and down in there. They'd go up into the mountains and stay for the summer. I'm picking up again in the wintertime."
Sam Schrager,1:42:35,Moscow was a lot closer to the real countryside than it is today.
Harry Sampson,1:42:41,"Remember, there was a road from here to Harvard over Moscow Mountain. I don't know if you've ever heard the name, Crumarine Gulch. That was the Crumarine Gulch Road. You could go right up over the top and down the other side. There was a sawmill over on the other side. I guess it was Princeton, not Harvard. It was a proposal by several Moscow men that had bought 40 or 80 acres up there on the big mountain. They proposed that we develop that Crumarine Quick Road. Up at the top, you'd turn to the right and go up to the big mountain and develop a park up there. Emmy Lewis was the instigator of that. He was a real estate man here in Moscow. He was a state senator and all that. He wanted to make it a city crowd. There was a county road back at the mountains that wound up over here in the Viola Grade. He had big plans of it being quite a tourist attraction. Abe Golf will land up there. Harry Powell owned a leaf burner on property up there."
Sam Schrager,1:44:40,"This was just in the higher reaches of Moscow Mountain. It was up the top there, the highest part of it."
Sam Schrager,1:44:48,What happened?
Harry Sampson,1:44:51,You couldn't get state funds for the road for some reason or other.
Harry Sampson,1:45:01,"I think the thing fell through because of financing, which a lot of us were sorry for because we thought that would have been a mighty good project. The Kiwanis Club was back at it. The Rotary Club was back at it. That it fell through."
Sam Schrager,1:45:22,"Would you tell me the story about your scout, the one who you have that letter from, from St."
Sam Schrager,1:45:29,"Anthony's, the scout that he tried to reform?"
Harry Sampson,1:45:35,"He was a scout with the pro -grade judge, Adrian Nelson. He was rather sympathetic for boys. He hated to send boys to the reform school. He came to me and says, I've got this boy. He's an illegitimate boy living with his grandmother."
Harry Sampson,1:45:56,"He's in difficulty. He'd been writing checks on her and buying stuff that he shouldn't, especially candies and things like that. He asked me if I would like to take him over, see what we could do with him. I proposed the name to the scout group and asked them if they would want to carry on a humanitarian project and see what we could do with him. Well, there were two or three of the older scouts thought it would be a good thing. So we took him along and all he was aggressive. He was just going to learn everything in scouting. He just did good turns and all that and looked like we were making a lot of headway."
Harry Sampson,1:46:58,"In fact, he was instrumental in this flagpole that I showed you the picture of here. He went out in the mountains and got that flagpole and peeled it and brought it into the church."
Harry Sampson,1:47:16,We raced it there up on the church.
Sam Schrager,1:47:19,This was the Presbyterian church?
Harry Sampson,1:47:21,"Well, years afterwards, after he was a colonel."
Harry Sampson,1:47:36,"After he was through scouting, he got into difficulty and he was sent again to reform school."
Harry Sampson,1:47:52,I guess he was there for a couple of years and they decided to pearl him out. He was on his way up here to Moscow and he and another pearl leave. They stopped in Boise and they sold a car.
Harry Sampson,1:48:15,"That put him back in the reform school again. I think he was there for another couple of years. They pearled him out and he came up here. He went to work for the Potlatch Lumber Company in what capacity I don't know. He came in one day to the store after he had been up there a while and told me how much scouting taught him in the use of knots. In his work up there, he needed the knowledge of knots. It wasn't enough. I was glad he was doing so well."
Sam Schrager,1:49:02,"About an hour afterwards, Judge Nelson came through the store and I told him, you know, who do you suppose I saw?"
Harry Sampson,1:49:13,"Dave Cott came in here and told me how well he was doing up at Potlatch. He said, if you want to see him again, he's up in the county jail right now. I've forgotten what he did to get in. I only heard about him years and years later, but he still came back up into this country and he's around here now. I would judge he's a boy of another man now of probably 60 years old."
Sam Schrager,1:49:56,The letter that he wrote to you from St. Anthony's was...
Sam Schrager,1:50:02,Did I get that?
Harry Sampson,1:50:03,You had that.
Sam Schrager,1:50:05,"The letter was very interesting because he was looking at you as a good friend and somebody had really helped him. He felt you really had helped him in scouting him. Oh, I'm sure, but he was too weak a character to stick with it."
Harry Sampson,1:50:26,"He's the only scout in all the scouting that I've gone through that's ever been sent to reform school, which is quite a record. While he's not the only boy we had difficulty with, this boy was never sent to reform school. I partly reformed him myself. He was a boy that sold spokesmen reviews and magazines on the street. I don't know if I told you this or not, but while he was on the scout troop, we had a program on where boys couldn't buy a uniform. We would try to raise through somebody a uniform so he could go to camp. Well, he approached the Moscow Hotel lobby. He says our scout troop is trying to raise money to get uniforms for some of the boys."
Sam Schrager,1:51:35,Would you like to contribute for it?
Harry Sampson,1:51:39,"Well, this fellow told him he happened to be the random hotel barber shop."
Sam Schrager,1:51:45,"He told him, he says, well, who's your scout master?"
Harry Sampson,1:51:48,"Well, he told him Harry Sampson. He says, well, I'll see him about it. See what they need. And the shop says, don't do that. He doesn't want to be screwed on. Well, this fellow that told me about it, and there were several things that piled up on him about the same time, he would sell these magazines and tell him, says, I need an extra 50 cents or a dollar."
Sam Schrager,1:52:19,Would you mind paying for your magazine a month in advance or your paper for a month in advance?
Harry Sampson,1:52:27,"And he collected quite a bit by that, and then he didn't deliver in the magazine. So I took him, when I found that out, I found out from him who the people were that he hadn't delivered the magazine. And I took him to every one of those and made him pay it back."
Harry Sampson,1:52:51,"Well, we didn't take him out of the troop or anything. We kept him on. And I remember years later,"
Harry Sampson,1:53:07,"we had William Gauss here in Moscow who was in the Air Corps, and he was ready for an advancement which required the FBI to investigate him. So they called on me to, because he gave me as a reference, to find out, or I sent in a reference about it, but they'd spelled the name wrong. This boy's name that we had trouble with was Quas. And Gauss, it's spelled the same way, it's G instead of a Q. Well, I made a mistake and made it G. So I couldn't recommend this boy for the position at all. And they couldn't understand it. So they sent a meth v. eye man over to the store to interview me, and he wouldn't talk to me in the store. He says, I've got my car out here. The curvie's just come out in the car. I want to talk to you. He showed me his bag of meth v. eye. So he showed me the recommendation or questionnaire that I had given. And when I saw him meeting him, I said, this isn't the boy that I had in the role of war for. And that kind of settled it. I said, well, this middle gal, he's the finest scout I ever had. I said, he's entitled to anything you can get. And that ended the interview."
Sam Schrager,1:54:53,"This boy that you had had trouble with, this boy, he did go straighter after that?"
Harry Sampson,1:55:00,"He moved from here over to Seattle. His sister lived over in Seattle, and he went over to live with her. And I never heard about him since."
Sam Schrager,1:55:13,You want to touch on a few more of these?
Harry Sampson,1:55:15,"Well, Ollie, I'd like to mention a few of the backers of scouting and early scouting that were tremendous help in putting scouting over in Moscow. And I would put at the head of the list Homer David, Hermann Wilson, John Hecithorn, Harry Whittier, Abe Gulf, Reverend Sessions, G .L. Luke, Colonel Crispman, J .G. Eldridge, R .K. and Oscar Bonnet."
Harry Sampson,1:56:00,"Henry Gauss, J .E. Rutherford, President Theophilus, H .H. Simpson, J .W. Barton, June Shoemaker, J .D. Davis, C .W. Hungerford, and I .C. Crawford. Those were all men that most of them were Kiwanis. And they did a tremendous job in backing the reorganization of scouting in 1926 and 7. It was through their help that I was able to organize five troops in Moscow. Got scout masters for all of them, got commitment for all of them, and merit badge examiners. So it was a real treat to have a backing of these men."
Harry Sampson,1:57:11,"There's one little project that we did in Moscow. Moscow had street signs made on wooden boards stenciled. They'd put in years and years before. And long about 1927 or 8, a lot of those signs were G -Hull, a lot of them faded out. And we proposed to the city, if they would get us a stenchling set and the paint and the lumber, we would re -sign the streets in town. Well, they did that. And they wound up, they gave us $75 for the job because we did a good job of it. But this first or second scout troop that I had did the job. We did paint them white, stenciled them black, and then to preserve them we put a coat of shellac on top of that and put them all over town. Now those were the street sign Jews in Moscow until the Lions Club took the project on putting up the metal signs. And I think that has only been maybe 15 years ago, or yes about 15 years ago. So those served for a long time. There's one thing I want to ask you about and I don't expect you to say more than a bit about it."
Sam Schrager,1:58:48,But you told me that 1925 scouting died and that's what it called a reorganization.
Sam Schrager,1:58:58,You said this was because of an individual who was a scout master?
Sam Schrager,1:59:03,Scout executive.
Harry Sampson,1:59:05,"We had a scout executive that was in the moral act that he did. And the financing had gotten in the bad shape too. And the whole thing together just fell apart. And there was no scouting in Moscow there for a year. And it was through the Kiwanis Club that I proposed that they wanted to get into Boys and Girls work. I would set up a scout program, which they did. And we were at that time under the Spokane Council."
Harry Sampson,1:59:57,"Before street signs were put in, we performed a traffic survey of the main thoroughfare. And the scouts for one whole week had a traffic up on the corner of 3rd, corner of 6th, and the corner of Washington. They directed traffic and they also took the number of cars that passed that intersection in a 10 hour period."
Harry Sampson,2:00:46,"They also cited violations, cars that didn't pay attention to them and they took their license number down."
Harry Sampson,2:00:58,"So I have the figures on the number of cars that passed the corner of 3rd and Main someplace. It's tremendous, the traffic even in those days. This was way back in 2008 or 2009."
Sam Schrager,2:01:20,Was there usually an officer directing traffic on the corner or was there usually no traffic?
Harry Sampson,2:01:26,"No traffic cop, no. There was no traffic cop there at all."
Sam Schrager,2:01:30,What was the purpose of the survey? Was it to see what the needs were for traffic control?
Harry Sampson,2:01:36,It was to show the city the amount of traffic that was on the main thoroughfare.
Harry Sampson,2:01:44,"I suppose to have stop signs and whatnot. But we chose the three most popular corners. If I'm not mistaken, as early as that, we'd have, it seems to me like there was 11, 12, 100 cars past the corner of 3rd and Main in 10 hours."
Sam Schrager,2:02:08,We're just about done. We've been waiting for those waffles.
Sam Schrager,2:02:15,"Alright, you got them on?"