speaker,timestamp,words
Sam Schrager,0:00:01,"This interview with Nellie Wood Smith took place at her Bovill home on November 13th, 1975. The interviewer is Sam Schrager."
Nellie Wood Smith,0:00:32,"I know them, know them well. In fact, they were running that paper when the piano contest was on, the popularity contest. I was entered in the contest when a friend of ours, well, I was boarding with us, so I was entered for competing in that contest. So, there was, well, I don't know how many of them, I think there was about twelve or more that were entered in the contest. And, so, and besides, I had been canvassing for an Eastern firm. I had, well, jewelry and kitchen utensils and silverware and all those certain things that I was canvassing for them and I'd deliver on the soft cashier. So, I was pretty well trained in  at that time, too. I serviced, or canvassed the town. Of course, it wasn't much of a job, it wasn't so big as all that, but I know. That was 1910. But, I can't think of that other, Carl."
Sam Schrager,0:01:45,Carl Peterson?
Nellie Wood Smith,0:01:47,"Sam and Carl and Homer, the three brothers. And, Sam married my great uncle, my mother's uncle. And, her name was then, her name was Angie Peterson, and she married Uncle Robert Smith, Angie Smith. She was buried up here at the Deary Cemetery. He died before she did, though, over in Oregon."
Sam Schrager,0:02:20,"Well, what was this popularity contest?"
Nellie Wood Smith,0:02:21,"Well, we had to get subscriptions for the Deary Enterprise and they would get so many points for each subscription. And then, when their paper came to them, there's a coupon in each paper. If you kept that coupon, there was another hundred or two, or whatever it was. Well, I walked, I think it was twelve miles, when I'd make a trip up into the woods. The lady lived across the, we lived right around that corner over there when I was a girl. And, that lady lived just across the road from me. Well, her husband was working in the woods, and the kids in school, and she took it on herself to go with me, you know, see me. You know, I didn't like to go in places like that alone, out in the camps. But, she went with me on my trips, and we walked as much as twelve miles a day, making the rounds of those trips to collect those coupons."
Sam Schrager,0:03:23,"And, sell subscriptions?"
Nellie Wood Smith,0:03:24,"Uh huh. Sell subscriptions and stuff. And also, there was coupons, trading coupons that you could buy with the dry goods store here. They were in on it, Grant and Giles, dry goods. And, you sold them a coupon for maybe ten dollars. I mean, it was a ten dollar coupon, but by selling them that coupon, they traded out, they got it for about seven and a half, or something like that. And, they got the value of it in the material."
Sam Schrager,0:04:04,"This was at the same bar, the same deal?"
Nellie Wood Smith,0:04:07,"Yes, and that is part of it, is this paper, and the subscriptions, and the coupons that were in the paper, and then the coupons, the cash coupons from the store down here, the dry goods store. And, I guess that was all that was concerned. And, it was the Derry newspaper. Yes, they were part of it. And, they were all combined into that get up, you know, then they were all, whatever you got from those people, was part of your coupon, your account."
Sam Schrager,0:04:41,You actually went around and sold to the Lumberjacks?
Nellie Wood Smith,0:04:44,"Yes. They all knew me. I remember they knew my dad, you know. You know, I told them who, I told them, explain what this is. Now, if there's anything they need to buy at the dry goods store, like if they handled all the men's fittings, you know, they worked clothes, and they didn't have, most of them didn't buy too many fancy clothes. They were busy working. They bought their shoes and their clothing, and they had a color of jewelry too. They could sell, they bought the coupons for the jewelry or their clothes, either one in the store, they're the same store. And, so, and you could sell that. Well, I had several jewelry coupons, and I sold several. And, anyhow, when the finals came, they was, I had about a million and a half points. And, it closed the next, the second one, it was about a million. So, I'm on the piano, and it sits over there in the corner now."
Sam Schrager,0:06:03,You won a piano?
Nellie Wood Smith,0:06:04,"Oh, yes, that's what the store thought. The winner would win a piano. And, it was sitting there in the store downtown, and you could all see what you were getting, see what you were looking at. So, that's how I got my piano, and I wouldn't have had one if it hadn't been for that, because, I know my dad was just working at Carpentries, working here and there, and it took about all that they had. And, sometimes, Mother would take in washing when he was out of a job. You know, some of her friends that just didn't, had youngsters, big family, and they'd have had Mother do part of the washing or something like that, or do some sewing. She, Mother, was quite a seamstress. And, this, well, Mrs. Anderson was one of them. One of the first ones we got acquainted with when we first came here. Her husband was Barbara. But, she just couldn't sew for sour apples, because she'd get her, you know, she'd try awfully hard, but she just didn't know how, and she'd find it, wind up with about, seam about that thick, you know, and then sew through it, and, you know, look about you."
Sam Schrager,0:07:18,"So, she asked your mother to do the sewing for her?"
Nellie Wood Smith,0:07:20,"She asked her, and her mother did, she asked her mother to do sewing for her, and both her, oh, something for herself, and mostly for the kids. You know, she tried hard enough, but she just didn't say anything. So, that was the story of the piano."
Sam Schrager,0:07:39,"When you were young, like, as a young person, with the family not making very much money, did you find there were things that you wanted that you couldn't have, that you liked?"
Nellie Wood Smith,0:07:53,"Oh, yes, there were plenty of things, but I was satisfied. I knew they couldn't be had. I thought, satisfied is what I got. Go ahead and make something that takes its place, or something like that. I was never all tied up and lamenting about something I couldn't have. I knew the folks couldn't, but I didn't want it. If they had to build out a pitch, you know, to get it, I wasn't interested in it. So, that didn't bother me much, because I thought, though, I was staying within our means line, and then I was always, I mean to brag, but I was always about the best dressed kid in the school. Both in Troy, we always schooled out at Troy, it's out there where the Spring Valley Road turns. My schoolhouse, I say mine, was right in that little three -cornered place, before that little barn sits and the road turns to the end of the highway. There's a little triangle there, that's where our schoolhouse sat. It was called the Free Coinage, and the kids nicknamed it the Three -Cornered Schoolhouse, instead of Free Coinage."
Sam Schrager,0:09:03,Why was it called Free Coinage?
Nellie Wood Smith,0:09:04,"I don't know, it was something that went back further than my time. I wonder if it had to do with the free silver or all that they talked about, they wanted money to be cheap. I don't know about that, but that was the name of it from the beginning. But that came there in 1903."
Sam Schrager,0:09:24,But you say you were about the best dressed kid there?
Nellie Wood Smith,0:09:26,"I was, not to mean to brag, and nothing that we did without, but the mother was, well, there was eight children there in her family, and there was four boys and four girls. The girls all, they weren't in the word elaborate at all, but they bought nice things, and they could wear them forever, and they never wore them out, or couldn't tell, until they'd get so tired of them, and finally they just rolled up a big bundle and sent it to Mother. Here, make the kids something out of these if you can. And that's how I had such good clothes, because we couldn't afford to buy the material that they had bought for their dresses. And so that's how I had such nice clothes. When Mother was an expert, you might say, at sewing."
Nellie Wood Smith,0:10:21,"So, that's the story of it."
Sam Schrager,0:10:23,"She would remake, she'd take the dresses and make new ones from you?"
Nellie Wood Smith,0:10:27,"Yes, she'd rip them up and make me clothes that fit me, and tailored, and looked as nice as, just arrived from Paris, I guess, just arrived from the store somewhere."
Sam Schrager,0:10:37,Do you think that most of the kids' or the kids' families put much emphasis on looking good in appearance at the schools in those days? Was that very important to many families?
Nellie Wood Smith,0:10:54,"It was just ordinary. It was just that I had nice materials that I didn't buy, and the folks didn't buy, they'd all give them to me. And somebody had a Mrs. Lisell Mudge, and he met her. And I want to say her mother was Mrs. Miller, and they lived on the homestead. I mean, we did. We lived on their little house there, probably built a little door place."
Sam Schrager,0:11:20,"Oh, you lived at their house?"
Nellie Wood Smith,0:11:22,"Well, they had a little house off from there, I guess. We got that, I don't know how it came that they had that place built. I think they kind of batched there themselves, fixed their own home."
Sam Schrager,0:11:33,So that was near your place?
Nellie Wood Smith,0:11:35,"It was right up in the orchard, just a little, maybe as much as a block from Miller's house. Three quarters of a mile from there was our place. We built our house, but we had to build a road up the hill and turn, and a few turns in it. It was kind of a long mile, but strictly I think it was about three quarters of a mile."
Sam Schrager,0:11:57,So you were starting to say about Lisell Mudge?
Nellie Wood Smith,0:12:00,"Well,"
Nellie Wood Smith,0:12:05,"my dad had met her father. He was a barber in Troy. And they have on those Troy Days, you know, celebrations, they have pictures of the old -timers there, and her father is on that picture. They had a very big, and I've seen it in the windows several times, I've been down there, on the celebration days. And the other fellow, he had an extra barber that worked for him. I could have told you his name, but I wasn't trying to. But anyway, a young fellow. And dad had met them. He met Mr. Miller and liked him, and they talked a lot. Dad invited him, but said, no, he hadn't been there for a very little while. He said that his wife wasn't acquainted with anybody. They were just kind of strangers there. Dad said, well, he said, well, come on out to our place on Sunday. We had no big way of getting in there. No transportation of any kind. And I said, come on and bring the wife out and spend the day for a break for her. It would be doer good. So he said, well, you just do that Sunday stays. So on Sunday, out to Kay, Mrs. Miller was expecting a, she had one little girl about, oh, maybe two years old, something like that. And she, that was Mrs. Love, Newzell's sister, was there first time. And she was expecting Newzell at that time. Most any time. It's almost time for her. So that's when I got acquainted with Millers."
Sam Schrager,0:13:59,Did this have to do with sewing somehow?
Nellie Wood Smith,0:14:02,"Well, I couldn't say that."
Sam Schrager,0:14:05,Or the clothes that people wore?
Nellie Wood Smith,0:14:07,"Yes. Oh, I could say there's one skirt that Mrs. Miller gave Mother. But she saw what she did. They got acquainted and were real good friends. And she, I guess, saw some of the things that Mother had made for me. And then Edna was just three and a half years younger, so that's part of what she could use for her. Anything that you couldn't make up for me would probably fit in. You'd get things out that would fit her. And I just want to say that I think I've got a picture on here somewhere with the skirt on, of Mrs. Miller. Gave Mother that time."
Sam Schrager,0:14:46,Were you living near Troy at that time?
Nellie Wood Smith,0:14:48,"We lived right there by the schoolhouse. Right, when the Millers came and visited. That's where the Dinsmoor Mill was. The Dinsmoor Mill was just up the road, or block maybe, from that turn there. And, uh, the, well, Miller was named after my uncle. That is my aunt's, my great aunt. The Dinsmoor Mill. The Dinsmores were relatives of ours. And when Homer, the Dinsmoor, their son, built the first garage, or service station. That service station there that stands just across from the bank. He put that in and ran it for years. And he was an un -legged man. He had the misfortune of, well, he got hit with a baseball and playing on the kneecap. And it started trouble. And then again, he was going with Florence McGarry, who, who set it up right close to where we were. And she was teaching school around different areas. At that time she was a wonderful teacher, too. And, uh,"
Sam Schrager,0:16:13,"say, you know about pictures of any of those, many of those people, right?"
Nellie Wood Smith,0:16:17,"A lot of them I have. But I was going to say it made me think of her. I have her picture, but she was teaching, you know, some of the photos. And her husband. Well, you say that he got hit with a baseball and his legs started getting bad. Yeah, and then he would, she was teaching then up to Helmer or someplace up in that area. And he was still living out there at the mill, you see, with his folks. And he was about 21, I think, or 19, or 20 something like that. And he used to drive up there with his horse and his team and buggy. And on the way back, coming back there from her place, he started, he had to get out and open the gate there at the Dry Creek Mill."
Sam Schrager,0:17:05,You know where that is?
Nellie Wood Smith,0:17:06,"Well, that's where my other cousins were living there. They were running the other mill, Dry Creek Mill. And so they, he got out and then he went back on the buggy and got his toe on that little round toe, that little round step. And it slipped off and that hit him on the knee again. And from then on he had trouble with it. And it got so, it got hurt so bad he just found he'd be living on it. And he was active, was a monkey. And he would,"
Nellie Wood Smith,0:17:46,"he would, he was sitting on the front porch or something like that. And they'd all get into a romp, you know, playing and chasing each other around or something. And wanted to do some dirty trick for, you know, to play some prank on the other one. And then they'd get it. The other one would take it after him. You know, that's always, there was a whole bunch of us young kids there. I was there visiting at that time. And so when he, someone I remember, he, when he'd, he'd sit and walk down the steps. He'd just leap over, you know, and go on. That was his style. I'd get to the fence and maybe jump over him. And he, I know I was there one day when he jumped off the porch, oh it was I guess it was any higher than this. He jumped off onto the grass and started to go on somewhere. And at that time, he just curled up in pain and agony and just hurt so bad that he wouldn't play with Maggie. He wanted him to go to the doctor who was living around him. Nope, he wasn't going to go to any doctor. So."
Sam Schrager,0:18:55,Why not?
Nellie Wood Smith,0:18:56,"Well, he just wasn't going to like the doctors. He didn't want to be petted or doctored at all. Like lots of men, I know. Most of them have to be ready to dive in there before you can get them to a doctor. And, God got one of them in there. But he's getting over that now. He's glad to see the doctor occasionally. So, then. He went to."
Sam Schrager,0:19:20,"So then he finally lost it, huh?"
Nellie Wood Smith,0:19:21,He found it a good time to go to the doctor then after that. He was having a real lot of pain at most all the time. He went up there. He was just too worried. Gular Losis had set in under the kneecap.
Nellie Wood Smith,0:19:36,"And so, they decided they had to be amputated. And soon, Dr. Crithers was running a hospital in Moscow there before Christmas time. And, he was in the hospital and they decided to check the leg. They said, that would have to come off. Homer Bult said, they were going to take his leg off. If he was going to die, he'd die all in one piece. He was going to have that leg taken off. He just couldn't imagine himself running around with one leg. You know, he didn't know much about it. So, they were going to take it off. But, that's up to there."
Nellie Wood Smith,0:20:23,"And, they operated. And, it happened. Well, at first they tried to scoop out the putrid material, you know, that had formed under there. And, they said you just could rake it out with your fingers. And, they tried that first, but when they opened up the bandages to inspect it, it had gone wild. And, they didn't take it off, but they came to investigate. It was taken off, I think four inches from the hip. Four or six, sorry, from the hip. But, they had an awful time. All of his relatives and everybody coaxed him and pleaded with him to have that removed. And, he was determined, he didn't want to. But, finally, this girl is going with her. And, his head set, and that had ended him in Florence. Because, he didn't want to. He wasn't going to be there. They were engaged. And, he wasn't going to be having a hobbling around. Oh, a hobby. Hippity Hop or something like that. He thought they'd be coming. Or, it was kind of a nickname, something they used to use."
Sam Schrager,0:21:37,Hop Along?
Nellie Wood Smith,0:21:39,"Well, yeah, something like that. He was afraid that there would come some hippie or something. They'd always hop, he'd go up. Hippity Hop. Yeah. So, but they found out, and then she coaxed him too. He had said he wouldn't have anything further to do with Florence after that. He didn't want to. He figured he'd be disgracing her, and she was a fine girl. And, she was a smart girl. And, he didn't want her tied to an old, hoby hop, you know, like heaps going to be. And, she just begged and pleaded with him to have that. Maybe that would turn out on him. And, there's lots of people running around in the Smutty Lake that are quite important to him. She finally convinced him. And so, then they finally did, he decided then to let the go -ahead not break. And, they took that leg off. But, she was sincere about it now. So, finally they were, after he got well, and kind of get over his shyness about that leg. And, the trouble he had, that leg was, I don't know, it was in the summertime. I think, but anyhow, that was removed. And, his family ordered him the best artificial that they could locate anywhere. They took almost several hundred dollars that they had to give for that leg."
Nellie Wood Smith,0:23:19,"And, then he worked there for a while. And, they walked around with them at home there. And, they looked like they were going to use their hands on the home anyway. And, witty as it could be. So, they finally decided on Sunday he was going to go on up to the Dry Peak Mill. And, see, Con and Jenny."
Sam Schrager,0:23:41,Who?
Nellie Wood Smith,0:23:42,"Con and Jenny, they call them. They live there in Moscow, were Moscow residents. They live right there on 3rd and, what's that street, 2nd from Lade."
Sam Schrager,0:24:01,Adams?
Nellie Wood Smith,0:24:02,"No, not Adams. I think it begins with A though. Well, it doesn't matter. Well, anyway, that's where they lived in Moscow. They did them in later. But, at that time, they lived up at the Dry Peak Mill. And, he would go up to see them. He had to go up and show off. He was getting along so good. He'd walk in on that leg and it just looked like he wouldn't know the thing that really mattered with him. So, he rode up. He was quite a horseback rider. For him, it was a tweeze. It was fussy. And, so he straddled his horse and started out for the Dry Peak. And, he rode up there in the back. But, on his trip up there, his stump, the leg, had, while they were riding with that saddle, it caused a rub. Oh, there's someone. Just a minute."
Sam Schrager,0:25:02,You want to turn off your machine?
Nellie Wood Smith,0:25:05,"Hi, now. Here's a tool I borrowed from Marvin. I'll bring it back."
Nellie Wood Smith,0:25:10,"Okay. Thank you. Okay, John. Thanks a lot."
Sam Schrager,0:25:12,What do you mean? Wayne? Huh? You mean Wayne?
Nellie Wood Smith,0:25:15,"Marvin. Now, Wayne. Yeah, I had Marvin. Uh -huh. I thought you meant Wayne. Yeah, I know. Okay. Thanks."
Sam Schrager,0:25:25,"So, he was riding along and his stump was rubbing?"
Nellie Wood Smith,0:25:29,"Uh -huh. He didn't realize it and all, but I think Roger Blister who did, you know, injured, he agitated that thing, some way or other. And, he would never put that leg on again. That ended that career. And, he went around with one crutch, had him reinforce crutch. And, later on, he got to be a heavy man. But, he already was dead from that time on. He was only 21 years old."
Sam Schrager,0:25:55,Did he use a peg leg at all or just a crutch? One crutch?
Nellie Wood Smith,0:26:00,He used a crutch and he would get around faster on that crutch than you and I could on three of them.
Sam Schrager,0:26:06,What happened with him and Florence?
Nellie Wood Smith,0:26:08,"Well, it wasn't so very long until they were married and they were happy as you please, you know. And, he finally got over his shyness, you know, and finally realized that he could be done and he made the best of it. And, they finally had, she went on teaching and they had a baby boy."
Nellie Wood Smith,0:26:34,"He now is in the Livid Water Power Company in Spokane. Fine, fine farm."
Sam Schrager,0:26:42,"So, she loved him and it didn't matter to her?"
Nellie Wood Smith,0:26:46,"No, it didn't matter to her because he was the same homer that she always had been in. And, so he, that's the way their story goes, but what was I... It must have been really hard for him to adjust. I can imagine it must have been tough. It was because he was one of these proud fellows. He was always spic and span and proud of the peacock. And, he just couldn't see himself hobbling around on my leg. But, he finally got over that and after he built that, after they were married and I guess when their baby was small probably,"
Nellie Wood Smith,0:27:36,they built that service station right at the bottom of the way. I guess the first was in Troy and it was quite a thing at that time. They were all so proud of that. I saw a big write up on the paper one time about that first service station in Troy. I think I have the paper somewhere.
Nellie Wood Smith,0:27:59,"And, he kept on with that one crutch. He had it reinforced until there was a big stop. That big at the bottom and it was all fixed to suit his case and he'd gotten kind of heavy at that time. After he was even long, he got quite a heavy man. He must have weighed, oh, 165 or 75 maybe. Even the Tuanahag. So, whenever he'd stop at the service station and someone would drive in, he'd go, Hi, there, bro. You know, he'd come out of highland and laughing and always greeted them. And, Holly took clean the windshield and just tell them a story. And, the paper said somebody, I don't think anybody ever drove away from his station that wasn't laughing. At the time, he was just kind of a clown anyway. He was just full of pepper and ginger. And, I just followed tricks and stories and things to make the people laugh."
Nellie Wood Smith,0:29:10,"One of the things that you mentioned when we were talking before that I was thinking about was, you said that when you first came to Bovill here, that there were some girls, when you were going to school with the guy, that there was some jealousy. And, I was wondering what they were jealous of."
Sam Schrager,0:29:32,"You told me they weren't that sharp and the teacher sort of favored them, but why were they jealous?"
Nellie Wood Smith,0:29:36,"Well, I guess they were average, but they were petted. She made pet him. She just took a fancy turn and she kind of made pets of them. But, she thought they were so very brilliant, so very smart, you know. But, they were just average, good, I guess good average kids as far as books concerned. But, their manners were rather poor. And, well,"
Nellie Wood Smith,0:30:08,"I began to go to the parties and the young fella that lived here in town, lived with his sister there, and he took a fancy to me some way or other and paid more attention to me than she liked him, the older girl. And, so she was always throwing up something to me and throwing him up to me, you know. Well, I didn't have any strings on him. I thought he was nice and pretty and nice. Oh, there's another break."
Nellie Wood Smith,0:30:46,Hi.
Sam Schrager,0:30:47,"Oh, my gosh, have you taken up residence here?"
Nellie Wood Smith,0:30:52,"Last time I was here, you were here."
Sam Schrager,0:30:55,"How are you? Fine, and you?"
Nellie Wood Smith,0:30:59,"Can't see, I'm frosting."
Sam Schrager,0:31:02,How are you?
Nellie Wood Smith,0:31:02,"Oh, fine. She threw it up to you, but..."
