speaker,timestamp,words
Nellie Wood Smith,2:21:48,"Well, he liked to get around the corner somewhere and he'd like to nip out somebody himself pretty well. I think that book tells something. It does tell something. I talked to John Miller when I talked to him about Pat, he said, well, you could probably never come to the end of the stories about Pat Malone. And I've found that to be true. Everybody seems to know different funny things about him. One time there was one good joke that they had yet to hand that wasn't a drinking man, I think. I had to go in and get a flask and I had to give him a flask and fill this tea at the restaurant. And give it to him and give him some, you know, I'm no doubt able to go in and get that for him. And I don't know if I can tell this story or not, but that's about the way that was. Anyhow, he was green to catch somebody who was bootlegging. And he was going to sell him this bottle for so much. And it turned out that he's the one that got stung in the long run because he was obviously on him. And I don't know what they did about the tea that he got instead of the whiskey. Yeah, I've heard that."
Sam Schrager,2:23:22,"Well, Pat, was Pat a soft guy or was he a rough guy or what?"
Nellie Wood Smith,2:23:31,"Well, you know, he's kind of easy going."
Nellie Wood Smith,2:23:36,"And Mr. Ellison, Mr. and Mrs. Ellison were in the hotel at that time and Pat hadn't had a room there for years. And they had a baby then. And when he got so he could walk while he was hanging around after Pat followed on, he saw Pat's boy."
Nellie Wood Smith,2:23:59,"And he'd, well, in effort to have Pat lay his pipe down and go do something on it, this little kid had it and David had that pipe and had it in his mouth. And he'd give him candies and things. And if his mother wanted to go somewhere to work hard prior to something other than an afternoon, Pat would babysit. And he'd watch that after going around. And he thought, I think it was much of Pat's to be his mother. But, they put it up for yourself. Pat just saw David."
Nellie Wood Smith,2:24:48,"But, I was going to say, no, there's this one. And my other son is in, I'm going to be in his restaurant there at the State House."
Nellie Wood Smith,2:25:08,"And he's a professional cook, a good one. He cooked when Leslie was to graduate. He's Leslie's father."
Sam Schrager,2:25:18,"You know who Leslie is, isn't she?"
Nellie Wood Smith,2:25:21,"And he's up here, in the corner. And when he was to graduate, Lloyd said, alright son, I'm going to do something other for you. He said, but it comes time for you. No, it's when he had furnished for the juniors, or giving the seniors a dinner, I guess it was, for their graduation. Anyhow, Lloyd told him that he would say, I'll furnish your dinner. He'd get the whole works. He said, I'll make up the dinner and furnish the things for you. And he did. And if it hadn't gotten done yet, he was raving to people that ate there that night, raving about the good dinner they had. And it was a smile. And he could really put it out. But, he had to watch himself that day. I think as soon as that dinner was over, he went to sleep. But, he could put out a wonderful dinner. But he drank, and he still does. He never comes home from the coast, hardly without going to town and getting swiped. And, apparently, I got so disgusted with that, after he'd done that several times, he said one time he told me he was going to come over about such and such a time. And that's after he'd been coming every once in a while to visit here. But he always managed to get the girls to come in and go to the first place. And, I said, he said he's coming over to stay a couple days. I said, no, that's alright. He comes over. But I said, Lloyd, don't come to your second, it's over. I said, stay sober while you're here, but..."
Nellie Wood Smith,2:27:26,"I guess that kind of hurt a little bit. I intended for it to. I said, because I'm here to see you, otherwise. And I said, I'd appreciate it if you'd come and sober by it, that's fine. So, he hasn't, he's been kind of particular. He came here not long ago, and he stops up at Lloyd's. I mean, I've got Leslie's. He spends most of his time up there with them. And he gets Leslie and they take off downtown and he gets Leslie drinking sometimes. Well, Leslie's learned to do pretty much of himself. Gangie runs with him, follows the birch with him, they stop every Friday evening after their work is finished, stop at the tavern, and the boss treats them all with their liquor. And maybe, like it's Leslie, you know, I've seen him pretty well jagged up. There's a joke about his. I was up there that evening and somebody brought Leslie home, I forgot the names, pretty well under. And he got as far as the front room floor and fell down. And she couldn't get him up to go to bed or move or do anything. And he was just freaking out. And we pulled on him and tried to get him up and everything and couldn't do anything with him and I said to him and I said, I'll get him up. And she had kind of given up. I went and got the broom and I was starting to know him. I just begged him for that broom and there's a joke and he said, I'll let the Lloyd out, get up. And he tells that joke and he said something about, don't let her see you, don't let her be there if you shoot the broom. He said, I haven't forgotten yet."
Sam Schrager,2:29:42,"Now, I just remembered, did you say to me once that at one point you gave Ernie a choice?"
Nellie Wood Smith,2:29:50,"Uh huh. I just jumped all year. When they said that's the only time in my life I think that I can remember, we sat down and talked a thing over. And so that's when the boys were about twelve or something, the older ones. And he'd been drinking pretty heavy then about that time. And he said, anyhow, we were arguing about it or talking about it, but we weren't arguing. But it kind of calmed me for some reason really. He was happy to be calm and let her talk. He never would pin him down to reasoning or talking or anything. He had something else to do with all of me. So, I told him about it and I said, no, I think we better have a talk about this thing. And I told him, I said, no, I've put up with this thing for years and I don't like it. And I said, that isn't the way we started doing it. We were totally going to quit drinking. And you haven't done it. And so, I've come to the conclusion, I'm just about to end my role, I said, if you keep this up, I'll stay with you until the boys are big enough to root for themselves. Until they make their own living and take care of themselves. And then, we're going to be done. It's going to be one way or the other. I said, you're going to quit drinking or else it's going to be us. And when they're able to take care of themselves, I'm gone."
Nellie Wood Smith,2:31:45,"Well, how was it?"
Nellie Wood Smith,2:31:46,I don't know if you got serious.
Nellie Wood Smith,2:31:48,"Well, now what did I do?"
Nellie Wood Smith,2:31:50,"I said, well, that's up to you. I'm done. And I wanted to take care of the bills and everything and I wouldn't know where to begin at. First time I knew I was so much, so valuable. But, anyhow, I just wouldn't know where to begin at. So, well, that's up to you. I said, you can take it or leave it. And so, I decided, and he didn't do it. He was a good dog, pretty much. And he only made it, oh, these last several years. It just, once in a while he had me get the big gang and different from tipsy to him. I get too much."
Nellie Wood Smith,2:32:47,"I think it's very, very hard once you start your drinking. It's like an addiction. It's not something you can kick easily."
Sam Schrager,2:32:58,Did you have a baby?
Nellie Wood Smith,2:32:58,"No, it's with him. He started it when he was just 17."
Nellie Wood Smith,2:33:08,"And the rest of the boys would be coming up to visit him. And a bunch of those young kids would come to his place. And they'd be running all over. He got started and they said, oh, I did it for him, mom. I can take it or leave it. I don't know. So, they would run and say, I don't have to keep it up. I said, yes, but they'll get you. And it would be, I don't know, I can take it or leave it. Just, nothing to it."
Sam Schrager,2:33:42,Do you think that's the first time that Ernie understood just how important it was to you when you told him you would leave him?
Nellie Wood Smith,2:33:50,"Yeah, I think so. I never said that he would leave him until that time."
Nellie Wood Smith,2:34:03,"And then, anyway, Nick said he could take it and leave it. Now you see how he did. Then you see he went into the service and grew into it too. And his deputy, he came back from the fix and he said, oh mom, I tried to stop Nick. No, I didn't bother him. He didn't see me bother anybody else."
Sam Schrager,2:34:32,"Do you think that many people held it against Pat that he didn't try to do a, try to stop him?"
Nellie Wood Smith,2:34:39,"No, I don't think so. They all just kind of laughed at him off as a joke. And I knew I was a little jax. He was always going to catch a big liquor, but he used to walk down the track and hide their bottles on the track or something. Or that they could go and find it, you know. So they couldn't have anything special to, I don't know, unless they started to pick him up."
Nellie Wood Smith,2:35:23,"I was going to ask you about one thing else, another thing, and that was about the depression here. I was going to ask you."
Sam Schrager,2:35:39,Did you stop the operation? Did that make a very hard time for your family?
Nellie Wood Smith,2:35:51,"It was pretty tough for everybody. We were all alive. But I don't know if it's really much worse than that. We give a little bag of sugar, about that high for $4 now. It was just about like that, you know. Well, we had to have our trading stamps to get the sugar. We had tickets. I mean, I've got some coupons. I've got a book of those yet. So many coupons for sugar. So many for meat. You had to have a different kind for meat. I think three different kinds of stuff. I guess there were coupons. Some of them were stamps and some were tickets, little round buttons, you know."
Sam Schrager,2:36:55,Was Ernie able to keep working then or did he get laid off too?
Nellie Wood Smith,2:36:59,"Oh, no, he was still working most of the time. He's never been out of work a whole lot. But one time when Wayne was a tiny baby, I took him to the specialist. He was about to lose him. I lost two others. And I saw Wayne came and I saw he was just following him right in the steps of the others. He was getting just like the others and gradually going down. He was losing about half a pound a week. And he wasn't only two months old. And that was enough of his total weight."
Nellie Wood Smith,2:37:43,"I said to Ernie, let's go take him to the specialist. We had him at the doctor here all the time. He's one of the best in the Northwest. But he didn't. I was nursing him. And he had, well my dad said, I said I don't think you're up to date with that baby. And I said, oh, it's, well it truly is. And the doctor said, it was alright, you know. The doctor, he don't pay a difference. And I didn't know how to meet him. So I asked Ernie to take him up to the specialist and spoke to him. I can't get away from work. I can't go to work. And of course I was thinking in those lines, in those terms, I was thinking baby first and then work. But he was so tied to his work he couldn't leave. And I said, nobody asked you to go. I said, I was saying that the baby should take him to the specialist. Well, if you want to, you want to go and take him by. I'm not here. You're going. If you want to. And I said, alright, that's what I want. I said, I see him feeling every day. And I said, he's just right in the tracks of the other side. I can see him kind of. And so he said, well you can take him up then. So I went to smoke again. It was right during Christmas time. Bad weather. I stayed all night with my mother. She was looking at him. And then I had an appointment. I called for an appointment. But I got in town."
Nellie Wood Smith,2:39:37,"And I went to the doctor the next morning. The first thing I was there by, I don't know, seven or eight o 'clock. I had an early appointment. I got there and there were several other people already there. It was awfully early. I must have been there at 7 .30 or 8. But anyhow, I knew enough not to nurse. And then he told me something. I'd have to wait but turns to don't nurse until we tell you to. And so he was crying. It was eating time and he was hungry. But I had to rock the floor with him and everything to try to ease him as much as possible until they could get them to see me and finally hung their tears. And they checked him. The top of his head did the sole of his feet. And he said, that was a wonderful specimen of the baby. He said, that is a wonderful baby. Apparently it's a metric that they didn't see anywhere. But I said, now we'll start on the other line. He said, now we'll start on the x -ray. You can nurse this baby for 20 minutes. And he was born out. He'd been sick for weeks, you know, gradually, sleeping. And he was born out. He'd nurse a little bit and then he'd just stand on the legs and fall asleep. And I said, so then, but he said, now nurse it. And since he'd been here, he'd come up from sleep on me. He said, well, you just keep picking it up and moving around and keep him at it. Keep him nursing for 20 minutes. And so I said, all right. And so he get, the nurse just took it and took it. He called it off and said, well, I, and he said, it's time. And I took him in and waited. And they had waited for the, for the nurse to take him back and wait on the scales again. And he'd gotten two ounces of milk in that 20 minutes."
Nellie Wood Smith,2:42:04,"And then I just thought I had plenty for him. And sometimes I'd have him really clean on my dress and eat me out. But he'd gotten just two ounces in the bottle. And then wait. So then he said, I don't think yours are trouble. He said, he told me to, he said, I don't mean that much to eat him, not by any means. But I said, well, there's milk that's too hard to duplicate to not use it. And he told me to fix him up a formula, told me how much patent growths they use, how much sugar, whatever it is they call it, the extra models, I guess it is. And I thought those were the potions I should use. And then he said, you take a common cow's milk and let it sit in the pan, open pan overnight. And then he'd tell me the cream rises on it and then skin that cream off the throat of the finger, whatever you want to do with it, put it in your coffee. And give him that blue milk. And he said, and mixed with those other things. And after the first feeding, the first feed after I had death, I was sitting right close by the heater and he'd slung his little hand around and burned the back of his hand. And I had to, should have made him off the cross and then pranked him. Because that was a nasty hurricane. He happened to have been fighting and kicking and just a little light. But I was close to the store to keep him warm while I made him. And after that first feeding, he went to sleep and he just cleaned that bottle out. He went to sleep and never woke up. He just was so hungry and so worn out. And never had another speck of chub. So you just didn't have the milk that it seems. And they tested mine. And the cow's milk usually is between two and a half and three percent fat. Mine was fourteen and two -fifths percent fat. And he was just poisoning it. He couldn't take it. There was nothing. He was living on fat. That's what they told him. They said just like he was living on fat without any bread or butter without potatoes or anything. It was great. And after they got that balance, there was nothing to it. Only on the way home. I was supposed to come home to be home for New Year's. And it was snowy and all the dust was stormy. And when the darkness broke in on that electric line, they were running then. And we got down to the base and they'd have to stop and put that pot of everything up on that line. They'd have jumped the track. And we'd have to sit there and let somebody put that trolley thing back on its track. And we'd come a little further and stop again. And I asked them all. I said, see I'd have to come as far as Palouse and then change cars and come on up here. And it was on Saturday."
Nellie Wood Smith,2:45:55,Saturday or Sunday. Saturday I guess it was.
Nellie Wood Smith,2:46:01,"And so I told them, I said, well, they get a lot of glass there."
Nellie Wood Smith,2:46:08,"I said, has anybody got the time?"
Nellie Wood Smith,2:46:10,"I asked him how much time. And I asked him about making this train that comes up here for the Pope. And I said, well, I guess we'll make it alright. And I said, I want to know. I've got a sick baby here. And I've got to be careful. I said, he's tiny and he needs a kiss then. And I said, if you don't get in there and Palouse at that certain time, then there's no train out on Sunday. And that'll be clear Monday then before I can get out. I said, if I try to put up at a hotel with this baby, I guess I can sit. And I said, I have to have a different plan than that. I said, if I'm not going to make it in time for this train, I don't want to get off of here at all. I'll have to go on through the Moscow. And I said, I have an aunt living there and I can get to her place and with the baby. And so that's when I went up there to the taxi and stayed with her. And then that's on Saturday."
Sam Schrager,2:47:25,Monday?
Nellie Wood Smith,2:47:28,"Monday morning. Yeah. And then Monday I go taxi to come after me and take me to the, to catch that train from out there Monday morning. And, uh, he's trying to work his way out of there, I think. And, uh,"
Nellie Wood Smith,2:47:54,"I saw this in the Pelican Town Academy. And as long as we were traveling through town up to that other end, it was to be up at the other end of town. Up until the other end of town."
Sam Schrager,2:48:08,Moscow?
Nellie Wood Smith,2:48:08,Uh huh.
Sam Schrager,2:48:10,"And, uh, just as I went along, we were kind of turning the corner and I said, what train is that going on up there?"
Nellie Wood Smith,2:48:17,"And he said, that's the, this bug kind of bus. I said, well that's the train I'm supposed to be on. And he said, yes, that's part of us. And I said, well, that's, you can just turn around and take me back where you got me. Because that's the train I'm supposed to be on. And so, he did, he took me back there and I had to start again the next morning. I was, two, three days getting home from, let's see, from Saturday morning early. Until Tuesday. Until Tuesday. I was getting home. Just spoke in. I was just spoke in down here. But he, and by the time I got home, he caught enough cold. So, I was standing there, fanning those doors around, stopping to put that, that trolley thing back on his line. And, um, he had caught enough of cold. And just about had pneumonia. So, when I got home early, wasn't working, he had, I don't know, laid off somewhere or other for a while. He wasn't very often, he had that way, but he wasn't working at that time."
Sam Schrager,2:49:25,"And I said, he said, well, we decided what do we do?"
Nellie Wood Smith,2:49:30,"And I said, well, if you take care of the baby, I can keep things going. He said, no. He said, you take care of him yourself and I'll do the work. I was thinking about doing a good ride. He said, I'll take care of the kitchen and you take care of the baby. So I steamed in there, put the big, fixed me a croup tent, and over here's a little cradle thing of a bed, crib, and then I put the sheet over and I stuck my head inside so I could see how strong it was. And I was getting him and watching him as an owner. And just tricky things like that."
Sam Schrager,2:50:17,Vapor? You used warm vapor?
Nellie Wood Smith,2:50:20,"I think we used, at that time, we used all the stuff we used to dress the poles. Here are the poles in the city yard."
Sam Schrager,2:50:31,"Oh, creosote?"
Nellie Wood Smith,2:50:32,"We used to steam them up and spread them out over time. After a few days, he was all glad to hear."
Sam Schrager,2:50:50,"During the Depression there, did Ernie work full time or was he on part time?"
Nellie Wood Smith,2:50:56,"No, I don't think he had any part times. It was, I guess, full time in October. But I don't remember."
Sam Schrager,2:51:05,Do you remember having to cut back on your usual way of living during that time?
Nellie Wood Smith,2:51:11,"Yes, you had to change your venues quite a lot. It was like it is, you know, we had to use, oh, we had to use lots of oatmeal and we used cornmeal and, oh, it just looked a lot like it is now. And raisins and things, you know, that the lettuce had. And something else. Anyhow, there were several things I can't remember just now about the dog. But they gave you certain things to make your cereal mush out of. And you had to use, not potato bread, but some kind of brown bread. And, oh, you know, just things like that were cheaper, I guess, and supposed to be stable, healthy things. Some of them had to fit because they had to use those other things that they didn't like. But I said, well, then you caught the storm. So I, so I, so I."
Nellie Wood Smith,2:52:32,"Gee, I see it's two o 'clock. I'm gonna have to go. You're probably gonna want to be eating lunch soon. But I have to, I have to eat some lunch and try to see somebody else this afternoon. I don't know who. I just wondered if Wayne's got lunch already. They did. Great -grandmother. And it was written to her during the Civil War. There was her grandfather, her husband, and he was, he and his buddy enlisted at the same time from, I guess they were living in Marceline, Missouri at that time. And they went to the war and along, well, I guess after he'd been in quite a while. But anyhow, they came, I guess he was with, I don't know the North or the South. I think they were with the North."
Nellie Wood Smith,2:53:47,"And they came along. The people from the South, about considering he's the North of the Northern area, they came along and they wanted to exchange prisoners then. And they, you have some of their prisoners and exchange them. And grandpa was drawn in that list. But his buddy wasn't. And they just took him right now. They calmed down so many men and took him and went on. And so grandpa told his buddy, he said, well, I've got to go now. And I haven't time to buy for anything."
Nellie Wood Smith,2:54:37,"And he said, will you please write her?"
Nellie Wood Smith,2:54:51,"And I said, I'll write her as soon as I can, if possible. So, I tell her to take good care of the babies when I'm gone. And she's the one that had the 12, you know, but she of course only had, I don't know how many at that time, she only had the 3 or 4 babies. But anyhow, I have the letter that he wrote to her. And I was just trying to figure out whether I could figure out who that was. And that letter was dated April the 7th, 1863."
Nellie Wood Smith,2:55:34,"Incidentally, you talk about the Civil War."
Sam Schrager,2:55:36,Do you remember Joe Wells?
Nellie Wood Smith,2:55:38,"Yes, I knew him well."
Sam Schrager,2:55:40,And his wife?
Nellie Wood Smith,2:55:41,"Yes, they were old -timers and they were there before Dewey had thought about being a town. And Joe used to go downtown and get to drink a little bit with the boys and all. And they'd all get to, you know, kid and wife and get to street like any other."
Nellie Wood Smith,2:56:11,"And Joe Wells and I, we were only quite in town, the rest were all Swedes."
Nellie Wood Smith,2:56:19,"And all that, that was a big joke."
Nellie Wood Smith,2:56:25,"And just recently, in the last few years, his son, Chuck, died, I guess over at the nursing home. And they had a daughter, Mary Wells, she lived there in Derry for quite a long while. And she married a man by the name of King. And she had a boy and a girl, and they went to school there in Derry for a long while. And I don't know, I think they say that the boy lives around this part of the country somewhere. Well, the girl lives in California and she's a rather well -respected educator in California. Well, Mary was a smart woman and Mary was smart, quite a brilliant person."
Sam Schrager,2:57:18,Do you remember what Lou was like? Joe's wife?
Nellie Wood Smith,2:57:22,"No, I didn't know her really very well. I've seen her, you know, but I didn't know her. She was, well, she stayed with Mrs. Lawrence."
Nellie Wood Smith,2:57:36,"No, not her, it was a daughter, Mary. When Mrs. Lawrence, the baby was born, Lawrence had the post office there and the grocery store between the helmer and Derry. And she had, Mrs. Lawrence was to have this baby and when it was born, Mary was staying there taking care of her. I guess she was midwife and all when the baby was born. And anyhow,"
Nellie Wood Smith,2:58:18,"she named, oh, she had a baby after, Mary had this baby girl after that herself and she named her Lou Easter."
Nellie Wood Smith,2:58:36,"And the Easter was after Esther Lawrence, Mrs. Lawrence's name. And I guess Lou was after her mother."
Sam Schrager,2:58:52,Did you know Mary?
Nellie Wood Smith,2:58:55,"Yes. Of course, I didn't get to be with her very often because they were, you know, they were endearing me, had no means of travel or anything. But I knew her and she was always at church down there and all, the famous, the rest of them, the people always, she was just one of a bunch. She lived there and she died a few years ago."
Nellie Wood Smith,2:59:34,"I imagine that Joe could have told you a whole lot of things, maybe even Mary."
Nellie Wood Smith,2:59:44,"I've been wondering if sometime now when I could get a hold of an ancient Idaho map, when there's still, still, what is it?"
