speaker,timestamp,words
Nellie Wood Smith,0:31:12,"I don't know, I just went ahead pretty much with my own business. I had my studies to keep going, you know, and I decided I didn't like to quarrel with her or have any words with her, but she moved her seat and sat behind the two of us. She and her sister were the same as me and my sister, about the ages, if I can compare. And, they moved their seat then, so they were sitting right behind Edna and I. And, Elsie and Althea were there. And, so, and then they'd sit there and tickle him, and they'd whisper, whisper, if you want to teach me to play. And, you couldn't study to save your neck, because all the neck get as loud as it could, and they'd call a whisper, and they'd teach you to just let them talk."
Nellie Wood Smith,0:32:13,"And, then, every once in a while, they'd bring in his name, Harry's name. And, about a while, she'd tell something about me. I think I was going after Perry, or Perry was running after me, or that she was going to be put on time or something, I don't know, just anything, sweeping, something along. But, you know, I wasn't interested, because, well, we were good friends, but we were just everyday acquaintances. But, then it got so that afterwards, he would come by and pick me up and the nights we'd go to the whole, when you go to party, you took the whole family. They'd just, and we'd all get in one somebody's house, and each one would come and bring their family. Big, little old and young. They had babies, so they took them in the bedroom, stuck them in the bed, and let them go to sleep. You know, and they played games, and had music, and in my place, they had the piano, at that time, and Dad played the violin, I played guitar, and my sister played the mandolin, so we had music. And then, some of the boys, they played the harp. And, we just had a grand old time, lots of old time fiddling contest. We'd have old time pieces, and all those that they played."
Sam Schrager,0:33:44,"Was there a lot of difference, was there much difference now between the get togethers in Bovill here, with the way they had them in the country, on the homestead? Was there much of a difference between the kind of entertainment?"
Nellie Wood Smith,0:33:59,"Well, nothing at the homestead. I thought you said before how the fellows used to come in, and they'd stay all... They did, that is, but we didn't have any parties, nothing like that, but they would just come in, you know, we knew they were coming, probably. Maybe they would be back next Saturday, or maybe they wouldn't be. They just... It was more just visiting than a party. Yes. Well, in Bovill here, these parties, you talked to me about them before."
Sam Schrager,0:34:30,"Did people get together for, would it be, would they go way into the night, that kind of thing?"
Nellie Wood Smith,0:34:36,"Oh, they'd been, they'd been probably maybe 11, 12 o 'clock maybe. That's about all. They'd break up, and some of them might be working, you know."
Sam Schrager,0:34:48,Were they all people who were close friends? How did the group form that they would get together?
Nellie Wood Smith,0:34:57,"Well, they just got acquainted with all their neighbors, and so they got to be a habit, and wherever they'd be next. They'd come to my house next Saturday or something like that, and that's about all that was to it, and everybody."
Sam Schrager,0:35:11,"So it was all the neighbors, everybody?"
Nellie Wood Smith,0:35:14,"Yes, everybody wanted to come, they were just as many more, and it was much more fun. And they played all those silly games, you know, that they used to play so much. Spin the pan, spin the bottle, they'd come, and they'd even play host office and all those things. Did much competition go on among the girls for the young men, or was there such a... No, there didn't seem to be much, except this one. They seemed to be kind of a prize or something. And this girl wanted them, and she was, oh, I don't know, she was just, wasn't it particularly..."
Sam Schrager,0:36:02,"Well, what is about to say?"
Nellie Wood Smith,0:36:06,"I don't know. She wasn't one that was particularly appealing to people. She had kind of a rude way with her sometimes, and kind of a haughty way, but if she could just... She kind of had bad boys of the night. And I didn't... Well, I'll come back to all of them, just to give the party, you know, just all the friends and all. She didn't come to that party so hardly ever."
Sam Schrager,0:36:42,Were young women supposed to be quite reserved?
Nellie Wood Smith,0:36:52,Well...
Sam Schrager,0:36:52,There weren't rules like that?
Nellie Wood Smith,0:36:55,"No, they were all kind of like home folks. We were all home folks together."
Nellie Wood Smith,0:37:05,"And I know that... And this one fellow, he was just sociable, like you walk down the street with him, you know, and that's the way we went together. And he was just a wonderful person. Anyhow, and he lived just right, just about the second door from us. And his sister and her two young children."
Nellie Wood Smith,0:37:34,And...
Sam Schrager,0:37:36,"Did he kind of get it? Okay, the medicine down, is that good?"
Nellie Wood Smith,0:37:45,"Mm. So, I went to... I don't know how long he'd be fine, so he'd come after me and they'd be going maybe next door, maybe two or three doors in the way, or whatever. It was just mostly that route and that end of town was mostly what I took in. So, it was the Hazes and the Rogers and the..."
Nellie Wood Smith,0:38:18,"Smiths and... I don't know, I don't know if you remember this. One of my girlfriend's schools was Florence Smith. She was Mrs. George Wiley. That's another one you would see. And she'd have to be down at Derry. And she used to live in Derry. And her husband was George Wiley. He was... I believe the post -master there in Derry, for violin. And he was an awfully nice kid. Real... Hell. Little thing. He was just a good, straight, honest guy. And one day, over we were all standing around the street in recess, early morning recess. That was when we were in ninth grade. And there was Florence and George and myself and Otto Krashe and I don't remember who all else were there. But we were standing around there, I think they had a room, talking. Some of them had left their lunches or something. And one of them was one of these tin boxes of wafers. These sugary kind of wafers. And George said, let's have a... Somebody said, let's sample those and let's have a lunch. They were all laughing at each other. And we ate those wafers. Most of them, anyhow."
Sam Schrager,0:40:02,"And then we said, well, now that's kind of sparrows, see? How are we going to get out of that?"
Nellie Wood Smith,0:40:11,"And he said, well, we don't want you going to pay for that. No, he said, no, he won't. The time you're doing this. And so he paid for the wafers. Told the teacher that he'd eaten those wafers. And offered to pay for them. I don't think the teacher even took any pay. But we figured maybe he'd left that and got that for his lunch. But I'll never forget that time. Really all the kids had to eat those wafers. That's when we were starved at all. That's when it was says."
Sam Schrager,0:40:42,Was it his lunch box?
Nellie Wood Smith,0:40:43,"I think it was in his lunch box. Probably didn't bring anything but that. I think he was going to eat it for his lunch. We always figured he was anyway. And after he got eaten, I thought, he's got to do something about that. We wanted to all go and tell him. We'd fess up if we wanted to tell him that we had eaten them. And George said, no, I'll go. I'll tell him. So I said, alright, the teacher just laughed and got a big joke. That was the kind of guys I jumped around with."
Nellie Wood Smith,0:41:27,"You know, you talk about the dances and that kind of thing."
Sam Schrager,0:41:32,What about the people who were on bug roll? The people who were the well -to -do?
Nellie Wood Smith,0:41:38,"That was up at the other end of town. Beyond up where the house, the living house up there is, you know, that was the hospital. After it was built there. That built for a hospital. But anyhow, the people, T .P. Jones, the wood superintendent, he was. And, well, the man, the banker and his wife, the banker Nelson."
Nellie Wood Smith,0:42:09,"I don't know, there's quite a lot of them kind of stuck up a little bit. They lived up in that end of town. We were just coming folks and we'd all have a lot more fun than they did. But they wouldn't get together with you down here. There wasn't that kind of mixing. No, they didn't. They didn't mix with us. They were just. And then later on they had what they called a, well, the 500 Club. They used to play 500. And then it got to be kind of a whole pulley one way or another. The ones that liked to play bridge or twist a lot. They kind of had a club of their own. And they didn't want to associate but they had, what was it, they called a, they called the other bunch, oh, some funny name, just a kind of hick name. Hay seeds. Well, something like that, you know. But I can't think of any of it. Anyhow, it finally got divided. The group bunch and the other group, they didn't like the, the lower bunch didn't like the other bunch really as well. And the others were, it was just mutual. The other group didn't like the razzabatazz kids or whatever they called somebody. I can't think of the name now but anyway, we didn't let them bother. They met some place after they got the meeting out, you know, playing cards or something. That was in later years."
Sam Schrager,0:43:58,"They had separate meeting nights and you're on your own, right?"
Nellie Wood Smith,0:44:01,"But some of them felt a little bit slighted because they could play bridge, you know, and play some of what the others played. And they weren't asked to join their club. They thought they were just a little bit snooty. But most of us didn't care. They didn't care. They had enough of their own in their own group. Just a little bit, when it came to the party, so the gatherings were just kind of a little bit aside from things of their own. But now when it came to mingling with them through town or something's going on in town for everybody's interested in, nobody was very sociable. Were the card clubs mostly, were they mostly for people who were the..."
Sam Schrager,0:44:58,The Bontons? Mostly for them?
Nellie Wood Smith,0:45:01,"No, it was just some of them decided they could have a little club of their own because they liked to play bridge. Well, bridge wasn't as common then as a pinnacle or something like that to them. Most of them could play some kind of card game or... They were a little bit... they common did, but they didn't go so much for 500 or... No, no, I mean... 500 or West or..."
Sam Schrager,0:45:34,What's that other one I named?
Nellie Wood Smith,0:45:36,"Bridge. Now something like that was their game. I see. Whereas the more... the ordinary folks played... were likely to play Pinochle and that kind of thing. Yeah, and hearts and, oh, you know, any kind of games, just common games. I don't think I played any of them because I didn't know how."
Sam Schrager,0:46:01,"But the people who were on Bug Row, do they call it Bug Row, by the way?"
Nellie Wood Smith,0:46:07,"They're kind of fond times. There's a Muck -E -Mucks or High Tones or something. It was something that, just speaking of it, sometimes they wanted to be a little bit nasty about it."
Sam Schrager,0:46:23,How did people know that these folks thought of themselves as being Muck -E -Mucks?
Nellie Wood Smith,0:46:30,"Well, I guess they didn't bother much. They thought that they were... They wanted to be... pay no attention to it."
Sam Schrager,0:46:41,"What I mean is, how did they know that these upper crust people thought they were upper crust in those days?"
Nellie Wood Smith,0:46:51,"Well... I mean, these days it would be you'd have a Cadillac or you'd have a fancy house. Well, they probably had a big house. They had mostly large houses in there and pretty nice furniture and pretty well fixed stuff. And the rest of them, well, they were very common, but most of them had things real comfortable and ordinary."
Sam Schrager,0:47:20,Do these well -fixed people actually talk down to people a little bit?
Nellie Wood Smith,0:47:24,"No, I don't seem to mean like they did. Sometimes I suppose they made remarks about the Rinky -Dinks. That's who they were when they got their car closed."
Sam Schrager,0:47:38,The Rinky -Dinks were the people who were the common people?
Nellie Wood Smith,0:47:44,"So they got in the 500s, the Rinky -Dinks. Well, but you say they... I just wonder how somebody who thinks he's superior shows it to somebody who he thinks he's better than. Well, they kind of splurged, they kind of dressed, kind of foxy, you know, kind of elaborate. And the Rinky -Dinks kind of thought it's kind of foolish just driving around dressed up in birdcages, but I guess that was their way of doing it. And then I guess they just could have forgotten they stayed within their reach, each one kind of minding their own business. But yet they'd all go to some kind of something that's going on for everybody, and they were nice neighbors, you know, but it's just the social clubs and all. They kind of made a separation. Now, Mrs. Ellison was in the social group, and Mrs. Nelson, and all, but they were just the nicest people here. So I just could meet them on the street, you know. I know they were always often nice to meet."
Sam Schrager,0:49:17,Were they mostly management people and the business people of the town? Is that who they were?
Nellie Wood Smith,0:49:24,"There was quite a few, yes, that way. It was the bankers, I said, and then the doctor's wife, and the..."
Sam Schrager,0:49:40,The logging bosses?
Nellie Wood Smith,0:49:42,"Yes, Mrs. Jones, and some of the kind of more upper -divine towns. That way, more than... But I don't think any of them really snubbed them exactly, the other. Just doing things like that, we just kind of each one took his own path and thought nothing of it. But when something unusual was going on, and everybody's business, you know, they all mangled, and there's always a meeting on the street, but they'd stop and talk to you, and they'd talk in chats, you know. They were just all nice common people. That card party kind of got...tried to make a split between them, but it didn't bother them."
Sam Schrager,0:50:38,"Were those the people who were more likely to be interested in politics and that kind of thing, too?"
Nellie Wood Smith,0:50:44,"I wonder if they were the ones who were the politicians and were trying to get into... I don't think any of them here were really running for any offices or anything like that. And I don't know, I never paid much attention to it because I didn't care much about politics, but I can't remember that they ever let politics get too deep into it. Now then, we were speaking about Mrs. Cryer and Mrs. Murphy and some of those. Now, they were in that group. They, oh, I don't know, later might have been in the other group, but they came from the east, Minnesota, I think it was. So they were in the group with our parties that we had."
Nellie Wood Smith,0:51:45,"I don't know, I guess the other folks invited those people to all their nice parties, you know, because their fathers or their husbands or somebody were connected with them. They were in the potlatch jobs, that is, the better jobs or the boss jobs or something like that. I think Mrs. Fisher was probably in that group, too, some more. Well, she was later. When she started teaching, she taught here for, well, she's been teaching for, I think, my finger, 20 years. And she was taught all the way from the primary corruptive high school. First one was Braden and then another. And today somebody was just saying, well, if your kid goes to school with Marie Fisher, he'll either know something or else he can't get it. She was pounding into him. She didn't know something when she gets through it. She was. She had a really good reputation as a teacher. Yes, she sat right down on him and she didn't get something. You had to have an awful good reason why you didn't."
Nellie Wood Smith,0:53:12,"Oh, I wanted to ask you about, I heard that there's a story that goes along with when you and Ernie got married and went on your honeymoon."
Sam Schrager,0:53:25,What's that?
Nellie Wood Smith,0:53:26,I've never heard anything about that. I think that was all in that book that the trees grew tall.
Sam Schrager,0:53:34,Have you ever had that?
Nellie Wood Smith,0:53:35,"Yeah, I've read that. I don't remember it in there. I don't know if he was in it or not, but he got everything like that he could. But we were going to be married. I don't know who started that, whether Ernie had suggested it or whether it was one way. His brother's wife's sister lived in St. Mary's and they called her Aunt Sadie. Her name was Sadie Fielding. They lived up there."
Sam Schrager,0:54:15,"It might be that she said, hey, when are you going to get married or something?"
Nellie Wood Smith,0:54:22,"Well, coming up to my place and going to my house or something like that. I don't know. Something like that might have been the trouble starter of it. Or maybe he just might have said, well, that's it. We have to go up to see you. I don't know how that... But anyway, it was arranged that we would go to St. Mary's. We married today at Sadie's. So, we went down and caught the train down here at, I think at four o 'clock in the afternoon. It was a passenger train."
Nellie Wood Smith,0:55:07,"It was kind of a dull date. I don't remember if I had to go in cloudy or something. But anyhow, we caught the train at four and his brother and his wife and the little girl, she was three, went with us."
Nellie Wood Smith,0:55:32,"We started out and went up the railroad to St. Mary's. When we got up to Clarkia or Fernwood, we were at Clarkia. That's only about 12 -15 miles from here. We got up there, we were stopped, and there was a log train off the track. The logger had gone up ahead of us, spilled up logs and tore up the track. And there we sat."
Nellie Wood Smith,0:56:13,"So, all we could do was just sit there and wait until it got fixed. We sat there for a couple hours or more. I don't know how long they'd been working on that wreck before we ever went up there and knew anything about it. When we got there, that's what we found. Louise from home. We waited and waited and finally things patched up so they let us by. We were supposed to be married at eight o 'clock. But that time it was pouring rain, just to pour it down. And St. D 'Nuckleville had been down to the depot to meet us at eight o 'clock and weren't there. And they said it would be delayed quite a while. They told them that the depot then had been delayed. Well, they came back after a while. A few minutes or half hours. They came back to that raid and met us again and they worked there. So, we didn't get in there until about ten o 'clock or something like that. It was pouring down rain and when they got there, the minister had been waiting at her place for quite a while then to marry us. And anyhow, he said, well I'll just have to go. I can't wait any longer because he promised to marry another couple up in the other end of town. And it was time for their appointment then. And he said, well tell the folks if they want to wait until this performance is over, I'll be back. And so we waited around after we got down to their place and we had to wait a while until he got his performance done for the other couple. And then he came back to us. And so that was, I don't know, there was somebody else."
Nellie Wood Smith,0:58:45,"And well I just found this again after this thing was lost and I was just having fits about it because I was so proud of it. I kept it so good. And then it finally came to light. And I don't know what that is. Something I've wanted to keep I guess. Yes, there's our picture. A lovely wedding picture."
Nellie Wood Smith,0:59:46,Why did you decide on St.
Sam Schrager,0:59:48,Mary's instead of Bovill?
Nellie Wood Smith,0:59:50,Well I don't know. Well there wasn't any place that I really wanted to see. Oh that's a play that we were in in later years.
Sam Schrager,1:00:01,A play in Bovill?
Nellie Wood Smith,1:00:02,"Oh yes, we had a home talent play here every once in a while. A bunch of us that come together."
Sam Schrager,1:00:11,What play was this?
Nellie Wood Smith,1:00:12,Oh we had several of them. The Great Winderson Mine and Biscuits and Bills. I don't know what the names of them were. This is Marvin. This is the one that she was married to. This is the second generation. See after Marvin had grown up. And the Barnacles. We had Barnacles bills they were. And I was placed up in a balcony. It's supposed to be. I fixed a balcony. And Leo Guilfoy.
Sam Schrager,1:00:52,How do you know?
Nellie Wood Smith,1:00:53,I sure did know him. He's one of the old timers and he's full of dibble.
Nellie Wood Smith,1:01:04,"And he sang the other part. He was singing to me. And I said, I'll come down and let you in. I'll come down and let you in. And I don't know how it all went but anyhow that was that part of it. Oh it all turned out funny in the long run. And then another play was The Great Winderson Mine. I was supposed to be a little schoolgirl."
Sam Schrager,1:01:35,The Great what?
Nellie Wood Smith,1:01:36,The Winderson Mine.
Sam Schrager,1:01:37,The Winderson Mine?
Nellie Wood Smith,1:01:39,And I was a little schoolgirl just staying with this old farmer and his family and going to school and working for La Vonde. And then Ernie's nephew Bill Smith was. And he was a great pal of mine. And he was sweet as could be. He's passed away now. But he said that he was supposed to be a schoolboy that was working for his board. They're doing the chores and all that. And going to school there. And of course he had a crush on me.
Nellie Wood Smith,1:02:24,"And there's another fellow that was John McGeary. I don't know whether you've heard of McGeary's mute when I was him. And he was supposed to be the city slicker. He came along and he of course was making a play for me to get other information about this old farmer's place. And I'd heard that he was mine on that. And so he was being nice to me. He'd get all the information he could. And that made Bill mad. He didn't like him at all. He'd do everything he could every time he'd see me talking to him. And so finally one time he came in just in time and Bill went and planned it in his play. And he went and opened the lid to a box or something. And he says, sick of it. And his dog jumped out there and ran off, chased him just across the stage. And that old invention boy had been saying that one of the other fellows, Hollenbeck, he was wacky over inventions. And so he said he invented a good invention. He said, you just lift up the lid and chuck in a hunk of beef or pork and turn the crank and out comes all the rest of the milling. And that spiel went with every time he'd seen a buddy. That same spiel went out."
Sam Schrager,1:03:51,Was it a real dog that jumped out? Did the dog chase him? The dog was trained to do that?
Nellie Wood Smith,1:03:58,"Yes. And Bill got his dog there, you know, and he knew. He said, sick of it."
Sam Schrager,1:04:05,Was it Bill's dog?
Nellie Wood Smith,1:04:07,And he chased John and put that off.
Sam Schrager,1:04:11,That was in the play?
Nellie Wood Smith,1:04:12,"Yeah. So, anyway, we used to have real good plays. We had the old man's convention here. And, well, that was the regular riot. They offered, everybody could see it as big crowd, and they offered, I don't know, double or something dollar ticket anyhow. They offered us extra if we put it on again the next day or two."
Sam Schrager,1:04:44,"So, you did?"
Nellie Wood Smith,1:04:46,I don't think we put it on again that day. We put on another one later on.
Sam Schrager,1:04:50,So what was the old maid's convention about?
Nellie Wood Smith,1:04:52,"That sounds like a pretty good one. Well, it was just all women there, and each they were having a big convention, and all these old maids came, and one of them was a woman, she was about eight feet tall, more or less. She was an awful tall woman. And they called her, her name was Tiny Short. And they know all of them with crazy names like that. And then I was Rebecca Stout, I think it was. And they were all there to work out ways and plans and means of getting a husband. They were all working to get a husband. And one had a way and idea, and then another one. And they were trying to decide what all to do about it. And then each one had to make their speech about what they thought would be the best way."
