speaker,timestamp,words
Sam Schrager,1:26:25,How would you say that your own attitude about the way to deal with the men working with you fit? What was that when you were a foreman and elite man? How did you look at it?
Arthur Sundberg,1:26:43,"Well, I had the opportunity right up until the time I retired of pretty much choosing anybody that worked in my crew. Although they did come through the employment office but I could either take them or leave them."
Arthur Sundberg,1:27:12,"And then every man that was hired in the latter years, he wasn't considered as a permanent employee until he put in 30 days."
Arthur Sundberg,1:27:31,"So if something would show up in a man's work or his qualifications within that 30 days, well then you could turn him back to the employment office. But that's something that didn't happen very often except where we had a big job and had a lot of extra men."
Arthur Sundberg,1:28:02,"I know we had to have some extra welders one time and so they sent some up from the plant at Lewiston to help us out. Well, there was one guy in particular that they sent up here that he was probably misinformed as to the job that we wanted him to do."
Arthur Sundberg,1:28:37,"But all he wanted to do was stand there with a stinger in his hand. And then he worked it and it would be done while somebody else had to do it. And then when they got it all laid down, then he would weld it. Well that didn't work out in what we wanted. We wanted men that could lay out steel, cut it, fabricate it, put it in place and weld it. So I sent him back to Lewiston. I couldn't use him at all because I had other men that was doing what we wanted to do and I couldn't have one man just standing there as a kingpin with just all he'd done with a stinger."
Arthur Sundberg,1:29:28,"And then we, you know, for tearing out timbers and stuff, we had a lot of bullgang work. It was just men that were just grunt men, you know. Some of them were real good and then others wouldn't qualify at all because of the fact that they were afraid. Things around them scared them and they'd just stand there. And they wouldn't touch a thing unless she was right there to tell them, take a hold of that and lift on that, see. Or help them men lift that timber. And you couldn't do that all the time. So what you had to do, you had to just weed them out. You had to have men that would, if there was timbers to be moved, if there was three men to do it, well then all three of them had to do the equal part."
Arthur Sundberg,1:30:29,"And those were some of the conditions, you know, that you would run into."
Sam Schrager,1:30:35,Did you think of yourself as being tough?
Arthur Sundberg,1:30:37,"No, no, never. Never because I worked, you know, I was just one of the workmen for so darn long that I don't think that you could go through some of the old timebooks and find some of these fellows and ask about them. And I don't believe that any of them would tell you that I was tough because that's something that I never wanted to be."
Arthur Sundberg,1:31:10,"I actually didn't, from the way you talk, I don't really think you would have been. I was feeling you'd be fairly understanding. Well, you know when you got men that are qualified to do the work, and they're journeymen, carpenters or welders or whatever it might be, well, you know, it just kind of falls into a routine there that every morning you would probably roll out some blueprints. And say, well now, this is it, we're going to do this today, this section right here. They'd understand what you're talking about and maybe there's some details there that they'd want to ask questions about. And during the day they'd want to come back and recheck on the blueprints and whatever the work might be and you just worked with them and explained to them what it was and everything was fine. They just went ahead with their work and everything was fine."
Sam Schrager,1:32:21,"What about your experience with the higher ups when you were, just back in the earlier days, I'm thinking in the 20s?"
Arthur Sundberg,1:32:30,"Well, I got along good with the lower echelons of the higher ups, but then the top brass I didn't get along with them at all."
Arthur Sundberg,1:32:47,"One reason for that was that, you know, going back to the days of the IWWs, you know, they were, I think possibly that they created a lot of difficulties, but then they were blamed for a lot of things too that they didn't, that they shouldn't have been blamed for. That was my personal belief."
Arthur Sundberg,1:33:18,"The Wobblies, as they were called, of course what they were trying to do was to organize men. They started out in the logging camps, you know, and of course they never really got down around the lumber mills much. But anyway, it put enough scare in the top management of the lumber industry to where the lumber industry formed and developed a union. It was run by management, but it was supposed to be a union for the men, see, because what they wanted to do was to keep organized labor out. So this union that was developed was called the Four Hells. The Loyal Labors of Lumber... The Loyal Region of Loggers and Lumbermen. That's what it was. Anyway, the Four Hells. Well, that was just 100 % controlled by the management, you know, and there was some representative of the management that sat in on every meeting. And of course they tried to make the men think, you know, that they had a union, you know, and they was running things. Well, then of course the... I believe the Supreme Court made a ruling after a few years, and it might not have been the Supreme Court, but anyway there was a ruling made that this Four Hells was illegal. Because it was... it had members of management as part of their governing board. Well, then they tried to develop another kind of a lumber union, and they operated that for a few years where management didn't take an active role in the meetings, but they did from the outside. And finally, they had men that represented them, so it was really not much difference in the Four Hells. So finally they organized labor. They come in and they tried to organize. And of course this town here, this company, was a closed town. You see, the company owned all the houses, they owned everything. So they wouldn't rent them a hall, these labor organizers, they wouldn't rent them a hall to meet in. So they went over here to Onaway to an independent -owned hall, and they advertised that they was going to have some meetings over there. So just through curiosity why most of the guys working here would go over there, you know, and hear what them guys had to say. And of course I was one of them. Well, it finally got down to where they took a show of hands as to whether or not the men in this hall at that particular meeting thought that they should try to organize. And of course, the hands went up all over the place, you know, so it made them think, you know, that they wanted a union. Well, then they come down to the point where they was going to choose somebody to represent them to the management, you know, as an organized union. Well, then everybody hung back. Nobody wanted that job, see. They all wanted to join, but nobody wanted. And so, I don't know, some of them, they pointed their finger at me and I said, no, I don't want it. And we'll elect somebody else permanently. And I said, well, if that's what you want, why, okay. Get the thing started. So I was appointed to represent the organized labor, and it was up to me to go and confront the top man, you know. So I asked for an appointment, and I called the secretary and I asked for an appointment to see him. And of course, you know, the work got there long before I did, you know, because, you know, there were stool pigeons all over the place. And so, of course, he didn't have anything, he couldn't help himself. He had to grant this interview, you know, because the law was starting to get tough. So when I come into his office there, he was sitting there at this big desk, and boy, his face was just white. He was so darned mad, you know."
Arthur Sundberg,1:39:52,"And so I talked to him and asked about wanting to rent a hall. So he couldn't refuse me because the law was on my side, see, in that respect. But, gosh, you know, he was just sitting there grittin' his teeth and he was just white. And so we got the thing started, and that's as far as I ever went. But from that day until the day that that man died, he hated my guts. But still, in all, I did raise up in job categories on the plant, but not because he wanted me to. It was just because of my own hard work and ability that put me up, not because he had anything to do with giving me any promotions at all."
Sam Schrager,1:41:00,"Is that all you spoke to him about, was renting a hall?"
Arthur Sundberg,1:41:04,"That's right, and then telling him that we were going to organize a union. But I was the fall guy right there. You know, somebody had to, if they was going to organize a union, somebody had to do it. But I was never elected to be the president of the union or nothing else. I was just appointed temporarily, see. But, boy, he hated my guts, I'll tell you. Because I was the one that brought the news to him that they were going to do that, and if I hadn't, somebody else would have eventually done it anyway, I suppose."
Sam Schrager,1:41:46,What year was this?
Arthur Sundberg,1:41:49,"Oh, gosh, I don't know."
Arthur Sundberg,1:41:57,It was about the time that they passed that Taft -Hartley law.
Arthur Sundberg,1:42:06,I can't tell you what year that was.
Sam Schrager,1:42:10,Was it before the Depression?
Arthur Sundberg,1:42:12,"No, no, it was after the Depression."
Sam Schrager,1:42:15,Was it the AFL? Or what was the big overall union that was coming in?
Arthur Sundberg,1:42:24,"The AFL is the one that started it, you know. There was men that represented the meat -cutters union in Spokane that come down here. And there was men that represented the steelworkers. And there was men from different groups of the AFL that come down here to organize this thing. And, boy, I'll tell you right now, when organized labor gets a bit in their teeth, they're going to do something. They're going to just about do it. Well, then, of course, they got this lumber union, IWA, something like that they call it. I don't know the name. But anyway,"
Arthur Sundberg,1:43:24,"It's affiliated with, it's strictly a lumber union, but it's affiliated with the..."
Arthur Sundberg,1:43:43,"Well, I don't want to spend too long since I've had anything to do with any of them that I've forgotten what..."
Sam Schrager,1:43:52,Was it hard for them to organize at that time when they came in here?
Arthur Sundberg,1:43:57,"No. No, it wasn't. You know,"
Arthur Sundberg,1:44:06,some missionary evangelist can come in and set up a tent or rent a hall. And people come there just through curiosity.
Sam Schrager,1:44:22,"And before the night's over with, why, maybe that evangelist has converted to a hundred people, see?"
Arthur Sundberg,1:44:27,"But then, maybe the next day, they've lost most of their conversion. And that's the way it is with organized labor. You know, they put up a few handbills here and there, and they get the word out they're going to have a meeting, and they want everybody to come out. Well, everybody's curious as to what they've got to say and what they've got to propose, so they come out and they tell them, you know, that... You've got to organize because if you don't, you're just going to work for these small wages the rest of your life. If you're ever going to get anywhere, you've got to organize. Well, sure, everybody will write their name down on their card and fine. It only costs you two dollars to join, and it only costs you a dollar and a half a month for dues, and, you know, nothing to it. Well, the average union member, all he contributes towards organized labor is paid dues. But it's these..."
Arthur Sundberg,1:45:44,"Well, the organizers and the officers of the union is the one that really does all of the work, and it gets all these raises, and it gets all these different benefits that men finally get. But the average union member, all he does is pay his dues. That's all he ever contributes to being a union member."
Sam Schrager,1:46:14,Do you know why you decided to take the ball in that case and go to that cheese?
Arthur Sundberg,1:46:22,"No, but I don't know. It's just... Some people are just born kind of cut out for doing things or moving things, you know. Somebody's got to be a prime mover on things, and it comes natural to some people. You take as far as being able to speak in front of an audience, that's something that never did bother me. I was always more or less of a good speaker in front of an audience."
Arthur Sundberg,1:47:04,"And, I don't know, it just kind of more or less comes natural."
Sam Schrager,1:47:10,Did you regret it after you saw the band?
Arthur Sundberg,1:47:13,"No, no, no, because I'm bullheaded too, you know, to a certain extent on some things, because once I make up my mind to do something, well then that's it. I won't back down from anyone. I'm still the same way, and I always will be."
Arthur Sundberg,1:47:39,But that was it though.
Sam Schrager,1:47:40,After that you didn't have anything more to do with the organization?
Arthur Sundberg,1:47:44,"No, no, that was the end of that part of it. And of course, you know, then, of course, my status with the company was so that I couldn't be a member of the union. Because I was representing the company, see, as a foreman. You were a foreman at the time you went to see the... ...all those duties that a foreman would do. And as a representative of the company, of course, I wasn't eligible to belong to any union. So, consequently, I never did belong to that union."
Sam Schrager,1:48:53,"Do you think that it, looking back at it, that it hurt you as far as advancement? Or did it hurt you and it didn't make any difference?"
Arthur Sundberg,1:49:03,"I don't know. I sometimes think that it did, and then other times possibly not."
Arthur Sundberg,1:49:18,"I...you know, I worked on a salary for a long time. Oh, a few years. And then when that depression come along, well then, of course, they cut down on everything, you know."
Arthur Sundberg,1:49:47,"But they...a good percentage of the people that worked here, they was given enough work, you know, so as to pay their rent and their hospital fee and their lights and water and so on."
Arthur Sundberg,1:50:08,"And so, you know, as far as cost was concerned, the company cut down their cost right down to the bone. So, of course, I was taken off in the salary and I was put on hourly rate. And, of course, my earnings on the hourly rate was just, you know, it was nothing..."
Arthur Sundberg,1:50:39,"Well, I had fairly consistent work, but the pay was...well, we only got 27 cents an hour. And probably four hours a day is all we got. Because they divided up what little work they had. They divided up as much as they could, see."
Arthur Sundberg,1:51:07,"So, when the things got better and they got to running steady again, well, I wasn't put back on that salary. I was kept on the hourly rate, although I would periodically get an increase."
Arthur Sundberg,1:51:31,"And so I never questioned it very much. But then they come out and they called a meeting down here at the Lewis and Clark Hotel in Lewiston with the top management of Potlatch Forest. And they called in all the supervisory personnel of the company from all their units. And they discussed a plan that they had been thinking about and was thinking about putting into practice. And they said, well, let's put this as a pension plan. And the original setup was that a man would have to be on a supervisory job for ten years in order to qualify for this company pension."
Sam Schrager,1:52:39,"And this company pension would amount to about...let's see, what was it?"
Arthur Sundberg,1:52:55,"I think it was 60 percent, I believe it was, of his salary would be paid out as a pension. That was including Social Security. So, time went on and on and, of course, they had changed management here several different times. But then they changed the rules and they made the rules that they would pay this pension to just salaried supervisory personnel. Well, I was an hourly paid supervisor. And so the manager come to me and said, well now Artie said we've been thinking about your retirement whenever the time comes. I hadn't long wasted a go yet. But if we put you on a salary, you'll have to take a cut and pay. Because, he said, we don't pay any of our salaried men in your category as much money as we pay you. He said, you're the highest paid man in your category that we've got anywhere in our organization. And I said, well, I don't want any cut. Well, he said, that's just the way it is. But still, he said, you've got to kind of look ahead to when you do retire. But it wasn't put to me, you know, to where it was very clear on this thing. Well, anyway, then they changed managers. The new manager, he called me in and he said, we've been checking up on your status here on this pension."
Arthur Sundberg,1:55:36,"And he said, it says a man has to be salaried for 10 years. But you've only got 9 and a half years to go to where you're retired."
Arthur Sundberg,1:55:51,"And I said, well, it was about all these other years. I said, don't they qualify?"
Arthur Sundberg,1:55:56,"Well, according to the rules that they've set up, boy, he says they don't. So, it wasn't long after that until he left and they got another manager in. And then he said, well, he looked into my pension. And he said, don't worry for a minute. He said, we're going to get it for you. Well, they changed managers three times."
Arthur Sundberg,1:56:53,"Four times. And every one of them was going to get it for me. But when I retired, I got the same pension as the run of the mill employees would get at that time. And it was $50 a month where I should have gotten at least $400. So, you see, it was just the, well, this started out with this manager that I told you hated my guts. It started out right there. And I blame him for just fixing it up so that it'd keep me off from it, you know. So, I'm losing,"
Arthur Sundberg,1:57:47,"oh, I'm losing at least $400 every month and have been now for over 11 years."
Sam Schrager,1:57:58,Was he still in the corporation?
Arthur Sundberg,1:58:02,"No, he was out."
Sam Schrager,1:58:03,"You mean the one that didn't like me? Yeah, he was out when they came up with their pension plan?"
Arthur Sundberg,1:58:08,"No, no, he was here, you see."
Sam Schrager,1:58:11,He was here then?
Arthur Sundberg,1:58:11,"Oh, yeah."
Sam Schrager,1:58:12,So you figured that there's a good chance that he had to do with taking the non -salary then?
Arthur Sundberg,1:58:18,"At least that's the way I always felt about it now. I could be wrong, but then that's the way I..."
Sam Schrager,1:58:23,Were there very few people in that class that you were in who were being paid an hourly wage?
Arthur Sundberg,1:58:29,"No, I was about the only one."
Arthur Sundberg,1:58:34,"That is, not only in this unit, but in the whole PFI organization. Everybody else had gone back on a salary. Yeah. Although, you take as long as I was on the job, I was making more money than any of them. Okay."
Arthur Sundberg,1:58:56,"That's really too bad. Well, we'll survive. But then, I think for the work that I'd done for the company..."
Arthur Sundberg,1:59:13,And I don't think I was treated right in that respect. Because I think you can go right down to Lewiston and check with any of the brass down there. And ask what they think about my work. And I think I'd get a pretty good rating from any of them. Top man down.
Arthur Sundberg,1:59:46,I want to ask you about that IWW activity some. We touched on it a little bit.
Sam Schrager,1:59:57,What's your understanding of what their aims were and what they did in the camps?
Arthur Sundberg,2:00:04,"Well, I'll tell you, to start out with, I think their principal aim at the beginning was to get clean beds and decent food in the camps. You know, at the time they started, before that, every man had to carry his own bedroll. They had wooden bunks built in the camps. But then every man would get down at the barn and get an armful of straw, bring it up and throw it in that bunk and spread his own blankets on it, and that was his bed."
Arthur Sundberg,2:00:52,"And the food, of course I can't tell you this from first hand because I wasn't there. But from all the men that I've talked to, was that the camp foreman, if he could run his camp at the least cost, he would raise himself up in the esteem of the company. But if he would raise the cost by ordering real good expensive food for the men, well then he didn't stay there very long as a foreman because it would cost too much to run his camp. They would buy the very best Timothy hay and they bought the very best grade of oats, and they hired the very best blacksmith to shoe their horses, and they bought the very best harness and equipment for their horses. But when they come to the feet of the men, well, of course there wasn't any of the camps that ever had any refrigeration, but nevertheless I know that there was meat that left this store down here. They wholesaled, you know, for all the camps. The meat was shipped out of here that actually maggots were crawling out of it, and they didn't want to cut it up for their meat market here so they shipped it to the camps. Well, you know, that word gets out and men put up an awful haul about that, and I know that in the camps as well as in some of the boarding houses, when the meat got tainted to where it would actually smell bad, well then the cook would throw in a bunch of saltpeter in the pot, you know, to kill that, and of course when you put a piece of meat on your plate, that meat was as red as it could be from that saltpeter. Whenever you get a piece of red meat after it's cooked, well that's saltpeter. And men would have dysentery and they'd be lined up there in a big line, you know, waiting to get into the john and running in every direction as far as that was concerned. So their food was, in some cases, pretty bad. Well that's one of the things that the IWWs was trying to eliminate. They wanted good food and they wanted clean beds, they didn't object to hard work, they didn't object to working in the mud or in the deep snow, or in the cold or in the heat. They didn't object to any of that, but they wanted, when they come in, they wanted a good meal and a clean bed, and that's what they fought for. So, you know, there wasn't anything wrong with that. But at the time,"
Arthur Sundberg,2:04:27,"I was asking for all these things, well then, they were radical men, see. Anybody that would ask for stuff like anything like that are radical. They're Bolsheviks, you know, they would picture them in cartoons in the newspaper with big horn -rimmed glasses and chin whiskers and a bomb in their hand, you know. That's the way the cartoonists would picture them, you know. Well, at the same time, that is the same period of time, the farmers around the country, there used to be an awful lot of smut in their wheat. Boy, I've seen blower on some of these thrash machines where it was just, you'd think that they were burning coal, there was a straw coming out, it was just a black cloud, it was smut. So every once in a while, there'd be a thrash machine that would explode and burn, well the IWWs done that, see. Well the IWWs didn't have anything to do with them farmers, they were up here in the woods. But nevertheless, in all the newspapers, if you go back into the archives of some of these newspapers, you'll see where this thrash machine, that wheat field burned, and IWWs done that. And this locomotive jumped the track, and IWWs done that. They got blamed for an awful lot of stuff that I don't think had anything to do with at all."
Sam Schrager,2:06:18,"Were the representatives, from what you've heard, of the IWWs in the woods, were they just, in a lot of cases, a lot with Jack?"
Arthur Sundberg,2:06:29,"Yeah, in all cases. They were men that, well, payday comes, most of the men would head for Spokane for the weekend, and get drunk and spend all their money and come back to Camp Broke. But, while they were in Spokane, or in Seattle, or in Portland, or wherever they might be, around the lumber industry, why, some of them were picked out as an individual by organized labor, to try to organize the men in the camp. Well, you know, organized labor, for a good many years before that period, sure had a rough road to hoe in the Midwest and in the East, around the steel mills and the coal mines and stuff. You know, it developed into a civil war back into that part of the country, you know, between laborers and management. And, of course, some of that, those representatives got out into this part of the country, and of course, at that time, lumbering was a pretty big thing all through Wisconsin and Minnesota, and then jumped way out here. But, it started out, it'd be just some guy probably pulling a crosscut saw in the woods, and he'd talk to his partners, and probably convert him, and then those two would talk to two others, and so on. And, pretty soon, why, they got together to where they began to make some demands that they was either going to get some clean beds, or they was going to strike, and they were going to tie up this camp to where you can't move along."
Arthur Sundberg,2:08:54,"So, what did they do? The management calls on the sheriff."
