speaker,timestamp,words
Arthur Sundberg,0:41:53,"Well, of course I don't know the percentage. I think the average person, if the opportunity was offered to him, he would probably like to at least try it because of the fact that he probably would get away from the hard work part of it. Because a foreman, he would be just patrolling in his department and seeing that everything was clicking the way it should be."
Arthur Sundberg,0:42:34,And then of course he had to be a man that would make some decisions.
Arthur Sundberg,0:42:48,"For instance, now the crew is loading out dry lumber in the lumber yard. They had just a little cubicle of a shack here at the center of the lumber yard. And there was a man that his job was to write out tickets for these units of lumber. And they were all written out in duplicate."
Arthur Sundberg,0:43:19,"Well, this hard sheet, I think I explained that to you once before, that they used on the boxcars where they loaded out. This hard sheet would come out to this man in the lumber yard. And this called for 20 ,000 feet of a certain size and a certain grade in a certain species of lumber, you see. And then it would maybe be another 10 ,000 feet of something else. Well, you could only load out about 2 ,500 feet on one of these cars. So consequently he would have to write out several tickets, you know, because there was one copy. That ticket had to go with the car, with the unit, into the planer. And, well, I said it was made in duplicate. I think it was made in about four copies because the crew that loaded it out, they would keep one copy. And then they would stick the rest of them between two boards in the load. See, they'd raise the board up and lay the tickets down and lay this on top. And then they'd indicate where the ticket was by either a stick or maybe if they had a crayon they'd make a mark there. Then when it got into the planer, they would keep one ticket. And then one ticket would have to go to the car where they loaded it. And of course these tickets all had to coincide, you know, as to... That way they kept track of what was going to the car, although the checker on the dock would... he would have to count the pieces in each load and put the exact scale down on this hard sheet as to what it was."
Arthur Sundberg,0:45:42,"But, uh... that's the way they handled that part of it, you know. But then the foreman, he had to make a decision sometimes because you and I was a crew, two men and a crew, stacking out lumber. So we'd go in there and this fella in there, he would hand us a whole stack of tickets, maybe enough to run us for the entire day. And so we'd look them over and this called for a certain specie and grade. And it would... this man in this little house there, he would have to put down the pile number because every pile in the lumber yard was numbered. So you would go there to this pile, that number that was indicated, and when you got there, why, maybe there wasn't enough lumber left in that pile to make it fill out that unit. So, you'd see the foreman going by, you'd holler at him, he'd come over and say, well here, we've got this ticket here for so much and there isn't enough in this pile there. So, he would give you authority to go to another pile of the same specie and grade and so on, you know. And then it was up to him then to go back and make this correction known to this man that was writing out the tickets, you see. And he had to make decisions, but they usually were small decisions, you know, there wasn't anything big. And then of course sometimes too, he had to intervene with... you take where crews were gyppoing, it was just dog -eat -dog proposition because, for instance, now these little railroad cars, they were quite heavy. They were made out of heavy timber and heavy cast iron wheels and all that, but they didn't have any power of their own. So, if you and I were, say, loading out, we had ten tickets here, we had to have ten of those cars."
Arthur Sundberg,0:48:40,"Well, we would go any place where we could find an empty car standing and grab that car, but if that car was in an alley and it had a stick stuck into it to indicate that it was really taken, you couldn't touch it. So, if you did, you got in bad. So, you'd probably have to go clear back to the loading dock where they was emptying these cars and you'd have to push them by hand clear out to the lumberyard. And these guys were eager beavers, you know, they would... were... two of those cars would probably be a good load for two men. They would probably take six or eight, you know, bump them right together and push the whole string up. Well, they had one man on the plant. It was his job to go around and oil these cars, you know, the journals on these cars."
Arthur Sundberg,0:49:53,"But, undoubtedly, he would miss some of them, you know, and sometimes those journals got pretty dry and they moved awful hard. But, you know, sometimes they'd get into a squabble over some of them being hog -ish and they would say there's ten empty cars on the dock and there was three crews looking for cars. One crew tried to grab them all, then there'd be a squabble, see. You had... supposed to share. Well, then it was probably up to the foreman to make a settlement there, you know. He'd have to intervene and... Because that's where it goes when they're gyppoing, you know, they get pretty eager."
Arthur Sundberg,0:50:44,"You know, we lived, as you're coming into town, you know, there's a row of houses out there on the flat there just opposite the lumberyard. And we lived there for a while and in the summertime we could hear them boards just slapping down in that lumberyard there at three and four o 'clock in the morning. And you could hear them out there at nine o 'clock at night. But they was working gyppo and some of them men were really tough. So in order to make what they thought was a lot of money, they'd be out there at three o 'clock in the morning either loading or unloading lumber and you could hear them boards just slapping down as they throw them down, you know. And instead of working a ten hour day, why they'd probably work fourteen, sixteen hour days. There was no limit, they didn't care. If you went out there and worked a double shift there, that was fine. There was lumber there to handle it."
Sam Schrager,0:52:08,What was the theory of gyppo?
Arthur Sundberg,0:52:18,I'm curious about that.
Sam Schrager,0:52:20,Was that a practice that was instituted after the mill had been going for a while?
Arthur Sundberg,0:52:26,"Oh yeah, yeah. Yeah, but it was put in as an incentive. You know, a gyppo crew is bound to be more productive in the course of a day than a crew that's working by the hour. Because a crew that's working by the hour, it's only reasonable to assume that wherever possible they'll drag their feet, you know. You take even a man that's working with machinery, now like a man that's feeding a machine, putting the lumber into a machine, and then there's another man that has to take it away from the machine. Well now that machine has to, that has to keep running. But they would have extra crewmen there that would, relief men that were supposed to relieve a man on the job without stopping the machine. Well, you know, a reasonable time of relief would probably be 10 minutes or 15 minutes at the most. But if they were, you know, working by the hour, well, that 10 or 15 minutes could drag into 20 or 25 or 30 minutes and longer, you know."
Sam Schrager,0:54:15,This was just for a break?
Arthur Sundberg,0:54:16,"Well, yeah, that was, you know, they would probably have to relieve themselves or, you know, go to the toilet or, and that was about the only excuse that you had to leave your post."
Arthur Sundberg,0:54:36,"But some of them really took advantage of it because I figured, oh well, I might as well be restful because John Doe, he's running it while I'm gone. Well, there was one bad thing about that, and that was that maybe they had one relief man in the department and he was supposed to relieve that whole department and, you know, maybe 10 or 15 men in there. But if several of them took too much time, then the others didn't get any time, see. And it was up to the foreman to kind of watch some of those things and see that they didn't get clear out of hand. Well, when they went on gyppo work and they got paid with a thousand feet of lumber for, that they handled, well, then they got eager and they didn't want any time off. And when the noon hour come, they'd gulp down a sandwich or two and then they wouldn't wait, they wouldn't take off the full noon hour, but they'd just eat a bite and then go right back to work, you see."
Arthur Sundberg,0:56:11,"And starting time in the morning, well, instead of starting at 7 o 'clock, well, they'd be down there at 6 and get squared around and then they'd start to work. And then quitting whistle and blow at night, they'd say, well, we've only got one unit left to go to finish out this bunch of tickets, so let's just stay and finish that out, see. That was the incentive that built up with this piecework, you see. But then these eager beavers cut their own throat and the others too because when they got to figuring out the payroll, if the average pay was, say, $2 .50 a day, and here was some men that was making $5 a day, well, then they'd say, well, we're paying too much for this gyppo. So instead of increasing the gyppo, they would probably cut it a little bit. Well, then they had to work that much harder in order to make that $5."
Arthur Sundberg,0:57:45,"Like I think I told you before that the time I loaded cars on the loading dock, we got 15 cents a thousand, and that was divided between two men. Well, now a thousand feet of lumber, it makes a pretty good -sized pile of lumber, and you had to push that into a boxcar and the man inside had to stack it up for 15 cents."
Arthur Sundberg,0:58:21,"But then, even there, loading cars, why, if lumber was run, waiting to be put in the car, there were some of those crews there that they'd put in several hours sometimes, overtime, you know. Well, then, making up the payroll right here was this crew here, look at how much money they're making. Well, they're paying them too much. You see, that's what would build up from that, you know."
Sam Schrager,0:59:00,Do you think that it discouraged the guys who were working on hourly wage to an extent?
Arthur Sundberg,0:59:07,"Oh, no, no. No, it didn't. It didn't run a brush off on them, I don't think, unless they wanted to transfer from a job on an hourly wage to a job that was on gyppo. And if they wanted to gyppo, well then, the reason they wanted to gyppo was they figured that they was just man enough to earn more money. But you had to earn it, there was no other way of getting it."
Sam Schrager,0:59:47,Do you know about when they started gyppo in Potlatch?
Arthur Sundberg,0:59:52,No.
Sam Schrager,0:59:53,They were doing it by the time you were 17?
Arthur Sundberg,0:59:59,"Well, no, well, yeah, they were. But then it was just... Of course, the gyppo, the only place they worked on gyppo was piling green lumber, loading out dry lumber, and loading the boxcars."
Sam Schrager,1:00:23,And they were floating wet?
Arthur Sundberg,1:00:26,And you take the pond and sawmill and green chain and...
Sam Schrager,1:00:34,And that's why they were sure to stay on board when you can't even walk this up and down?
Arthur Sundberg,1:00:37,"Well, they had part of the planer, they got that on gyppo, but it didn't stay as long as it did in these other departments because..."
Arthur Sundberg,1:00:57,"You take... your earnings in the planer was pretty much controlled because you were assigned to one machine. That was your station, you see. And you couldn't earn any more than what lumber was assigned to that machine, you see. So there was really not much incentive there for gyppo."
Arthur Sundberg,1:01:25,"And then, of course, the power departments, you know, the power plant, you know, that was... They worked now. The fact of the matter is you take the fellas that worked in the power plant in the early years. They worked twelve hours a day and seven days a week."
Arthur Sundberg,1:01:56,"No, no, no, it was just common play. And then the night watchmen..."
Arthur Sundberg,1:02:08,"The night watchmen... Well, there was three different routes."
Arthur Sundberg,1:02:19,"And the one that... part of his route took him through the sawmill, he could get in there out of the weather and probably get warmed up for a few minutes, once every hour. And then the one that went... that took in the planer... And, of course, the dry sheds and part of the lumber yard... Once every hour he could duck into the powerhouse at the planer to get warmed up for a few minutes. But then the watchman that was out in the lumber yard, he didn't have any shelter or no place to go to get warm because he was right out in the open. You see, all three routes took in part of the lumber yard, but then there was one route that took in the far part, see, so he never had... And he had to make his rounds once every hour. And each one of them was long enough so that just at a slow walk it took you a full hour to make a turn. And, you think, in the wintertime when the snow was deep, that one in the lumber yard, he had a pretty rough go because he had to make his own trail, you know, the snow kept piling up."
Arthur Sundberg,1:04:03,And that was 12 hours a day and 7 days a week.
Arthur Sundberg,1:04:10,"And then the men that worked in the pump house, of course that was a nice job because it was warm in there, they run these pumps by steam and everything was nice and warm. And their job consisted mostly of just keeping everything polished and wiped off nice and clean, everything was painted up bright, you know, red. But then they had to be there to see that everything was functioning right because these pumps, they worked on off the governor. And as the pressure would drop in the water mains, by then these pumps would increase, you know, with their speed. But anyway, there were two men that worked in the pump house, one on the day shift and one on the night shift, 12 hours a day and 7 days a week."
Arthur Sundberg,1:05:20,"And everybody was as happy as could be because they had a job, but nobody accumulated any money."
Sam Schrager,1:05:30,"Were there ever cases that you can remember where the foreman was so disliked by his men, by his crew that they managed to get rid of him? Or that he just killed in the eyes of management because he couldn't?"
Arthur Sundberg,1:05:49,"There was a good many cases, there was a few cases right here, but you take throughout the industry there was ever so many cases where the crew, someone in the crew would actually just beat the tar out of the foreman physically, black his eyes and beat him up so he couldn't walk."
Arthur Sundberg,1:06:14,"And some of these foremen were disliked just that much. And you take, I don't know whether you, in some of your interviews on the lumbering here, if you,"
Arthur Sundberg,1:06:37,"probably there's some mention made about Charlie Peterson that was the superintendent here for years. Well, when I first knew him, he was the yard foreman."
Arthur Sundberg,1:06:56,"And he was one of these brown -nosed eager beavers and he got to be superintendent. But there was more than once where he would wear black glasses for a week or two at a time because cover up these black eyes or somebody just beat the tar out of him. And I know there was for a long time there that he used to patrol the lumberyard there on the saddle horse. Because some guy would take after him while he'd get out running with the saddle horse, get out of his way. Well that's just how much they thought of him. But, anyway, he got up to be superintendent, that is a shipping superintendent. Of course he was the superintendent of everything outside of the sawmill. That is he was the superintendent of all the lumberyard and the planter and the shipping dock and all that. And he was the superintendent of all the lumberyard and the shipping dock and all that. And right at the last of his career was they moved him down to Lewiston as a consultant and he was a big shot down at the Lewiston plant. So as far as the company was concerned he really worked his way up in the eyes of the company. But as far as his education was concerned I know that I went to school with his oldest boy. He had two boys and it was common knowledge that these kids were teaching their dad how to read and write. But still he got to be the superintendent. And it was mostly just brown nose that got him there but then he was successful at doing it."
Arthur Sundberg,1:09:20,"I would think that if you couldn't get along too well with the men or if the men didn't respect him that would make it a lot more difficult. That didn't have anything to do as far as management was concerned. They didn't operate a corporation a long time ago like they do now. Now you know why this... any man in any branches of management is really screened as to his capabilities. And industry nowadays, every lead man, every foreman, every superintendent and every manager goes through a continual process of education and re -education. As far as getting along with people and being able to handle people and all that sort of thing. That's something that was never even dreamt of years ago. It didn't matter as far as the company was concerned. It didn't matter whether or not the qualities they were looking for in a foreman or superintendent were not necessarily ability to get along with the men. No, it was production."
Arthur Sundberg,1:10:55,"If they could point to the production sheet and say, look here now, we averaged 200 ,000 feet a day through this department at a cost of so many dollars. That was it. That never went any further than that. That was it. They didn't care whether John Doe didn't like the foreman or anything else. That didn't enter into it at all. It was so much production for so much cost."
Sam Schrager,1:11:42,"Did the foreman have a lot of directives, a lot of instructions on how to operate from the superintendents?"
Arthur Sundberg,1:12:07,"It might be private. It might be behind a lumber pile, but then it is still being private. It's hard to say what their conversations were all about. They might be talking about the score of the last Sunday's baseball game as far as I'm concerned."
Arthur Sundberg,1:12:28,"If a man was assigned a job as a foreman of a crew, then it was up to him to see that that crew turned out so much work and handled so much lumber."
Arthur Sundberg,1:12:53,"If he couldn't do it, then they would move him out and put somebody else in as foreman. When it got down to the foreman, in most cases, they got along pretty good because actually the foreman was just one of the crew."
Arthur Sundberg,1:13:26,Personalities didn't change very much. He was probably chosen to be a foreman because he showed some ability to lead and to carry on this particular job.
Arthur Sundberg,1:13:46,"Pay -wise, they would probably be two and a half cents an hour or five cents an hour at the very most. The difference between what the foreman got and what the man and his crew got. It was mostly just, you wasn't doing the physical labor probably that your crew was doing, but you didn't get much extra pay either."
Sam Schrager,1:14:19,Do you think the foreman were under much more pressure than the crew as far as the pressures?
Arthur Sundberg,1:14:46,"The foreman, he was right in the middle between the superintendent that demanded these things and the men that had to perform these things. He was right there in the middle and he had to try to make both of these groups happy."
Arthur Sundberg,1:15:13,The foreman was always under a lot more pressure that way.
Sam Schrager,1:15:22,"Would most foremen mind if the guys wanted to sneak a smoke, get off work, have a little rest?"
Arthur Sundberg,1:15:32,"Some of them, in order to further their own interests, they wouldn't have to see it or catch a man at it. But if some brown nose would even come and tell him that John Doe was out there in the can smoking. Well, he'd probably write out his time and give him his time. And then maybe another foreman, under the same circumstances, he would say, now listen, I know you're smoking out there and you know it's against the rules."
Arthur Sundberg,1:16:26,"But you better watch it and be there and be sure that nobody catches you at it because if this is reported another time or two, the only thing I can do is let you go. He would try to reason with the man. So there's a difference in personalities in that respect."
Sam Schrager,1:16:55,"But you wouldn't find a foreman who is likely to just approve it, say, to the man that's okay?"
Arthur Sundberg,1:17:23,"There was a lot of Bull Durham and Duke's mixture that was smoked. And you could smell that darn stuff for quite a ways. You take these toilets that they had around the plant, there was just a hole in the ground with a building set on top of it. And you sat down on a two -by -four and there was no partitions or no sign of any privacy at all. And then each one of them, these buildings, they had a cupola on top for a ventilator. But you could walk past one of those and you could probably be possibly in some cases up to a hundred feet away walking past. And you could smell this Bull Durham, you know. You know somebody was in there smoking."
Sam Schrager,1:18:44,Was there often pretty good friendships between the foremen and the men?
Arthur Sundberg,1:18:48,"Oh yeah, a lot of it. They had a few foremen around that got out a lot of production and still they got along so well with the men that the men would just actually literally lay their lives down on the line for them. They just liked their boss that much because he was just an awful nice fellow. This idea of a boss being a Simon LeGree, that was pretty much in the minority. And that wasn't really the thing that prevailed all over, but it did in some instances. But there was a lot of them that were just really good fellows. They were kind and considerate. And I think that it really paid off for them because the men didn't try to take advantage of them. Because they were considerate."
Sam Schrager,1:20:11,How was it that you got to become a foreman? How did that come about?
Arthur Sundberg,1:20:17,"Oh no, I didn't ask for it. I think it was just something that just kind of... just a ball having to roll and stop right there or something. But I think that a man's got to show some qualifications and some ability to lead. Now then, you know, when you start out, you take in my case, and I suppose with many others, where a person would start out just as a lead man, you know."
Arthur Sundberg,1:21:10,"And you probably have maybe one man working with you. And maybe even be several. But then anyway, the real foreman, or the superintendent, whatever that might be, would give the instructions to the lead man as to what he wanted. Then it was up to the lead man to understand exactly what he wanted and go ahead with it and put that theory over then to these men that were working with him. That made him a lead man, see. Well then, you know, you worked that way for a while, well then maybe something would come up to where there was some expansion. Then the lead man was made a foreman. And he had more responsibility, took in a bigger scope. Probably more men. And that's just the way it develops."
Sam Schrager,1:22:15,Is that something like what happened in your case?
Arthur Sundberg,1:22:17,I think so. At least that's the way I always felt about it.
Sam Schrager,1:22:28,What crew were you on when you became the lead man?
Arthur Sundberg,1:22:34,"Well, I was the steam fitter in the sawmill. And they had a big modernization program going on where they'd done a lot of new construction. And they had to make a lot of changes, you know, physical changes in the plant."
Arthur Sundberg,1:23:10,"And so being as I was a steam fitter,"
Arthur Sundberg,1:23:16,"well then there was a lot of, the fact of the matter is the whole sawmill was all completely repiped and changes put in. And they put in a big low pressure turbine for generating electricity."
Arthur Sundberg,1:23:38,"And so all this exhaust from all these different components in the sawmill that used steam. Take the shotgun that drove the carriages and all these steam cylinders, jump cylinders all over. They used the exhaust into the atmosphere. Well, all that exhaust had to be captured and put into a system that went to this turbine to generate electricity. So there was a big job come up, you know. And of course being as I was working as a steam fitter before this job come on, well then it was only natural that they put men with me, you know, to carry on some of this work. Well then it developed from that to bigger things and so on. The last job that I had done was to completely change the whole sawmill."
Arthur Sundberg,1:24:55,"And you take all this wooden structure that supported the sawmill, we took that out and put in steel. We took out all the wooden floors on the bottom and put in fills and concrete floors and all steel columns and steel beams. And changed the machinery around and took a lot of the machinery out and put other machinery in and rebuilt the entire sawmill."
Arthur Sundberg,1:25:31,And then I retired.
Sam Schrager,1:25:37,When was the first form of job that you had? When did this first changeover from the exhaust?
Arthur Sundberg,1:25:48,Well that was in 1924.
Arthur Sundberg,1:26:01,And then I retired in 1964 so that was a period of about 40 years that I put in as an elite man and foreman.
