speaker,timestamp,words

Sam Schrager,0:00:00,"This fourth interview with Arthur Sundberg is recorded at his home in Potlatch on August 1st, 1975."
Arthur Sundberg,0:00:26,"The first thing that I was thinking of asking you about was the question of working in the mill. You said to me once that it was an easy hire, easy fire policy. Yeah, each department in the mill, that is, the whole mill complex, it was divided up into quite a number of different departments. And, uh, I had a foreman in each department, and that foreman, he hired his own crew and he fired his own crew. That's the way it used to be. And, uh, there wasn't any unions or there was no recourse. Of course, if you was fired, you was fired, and that's it. Nobody ever thought about going on up, you know, to top management to complain or anything because that was, I never even heard tell of such a thing as that, you know. They just took it as a matter of course, you know. They'd hire you right on the spot without any interviews. They never, well, it was customary for a person, particularly a young person, asking for a job, foreman to kind of aim up and down and see how big he was and how strong he appeared to be. And, uh, if it was a job working with machinery, the foreman would probably say, well, that guy right over there, you go over there and he'll show you what to do. So, you'd go over there and that fellow, he would, you'd tell that guy, well, the boss sent me over here, you'd tell me, you're supposed to show me what to do. So, he'd probably handle a few boards and you'd do it like this and probably let you try it there for a minute or two and it looked like you could do it. But he'd just walk off. That was your breaking in period, see, and it was just up to you to do it. And, uh, there was undoubtedly some, you know, that had previous experience or at least had previous experience of being in the department even though they didn't work there. Because they didn't have any restrictions on visitors, you know, everybody and anybody, kids or anybody else could just come and go in around the mill. Nobody ever asked them any questions as to what they were doing there. So, consequently, kids that lived in that, around that industry, they got quite a bit of first -hand knowledge of what it was all about, you know, as they were growing up. I know kids would be seven, eight years old or probably younger than that, you know, running all over the plant down there. Kids 10, 11 years old are running all over the logs on the log pond and, you know, just trying to stump one another, running on the logs. So, the kids got quite a background knowledge of the industry, you know, before they went to work."
Sam Schrager,0:04:25,How many people would be in the average -sized crew? How many would the foreman be in charge of?
Arthur Sundberg,0:04:31,"Well, that would depend a whole lot on what department it was. Now then, you take, for instance, you'd start in, you know, well, the log pond had probably four or five men. Then when you get up into the sawmill, they probably had, oh, probably 40 or 50 men."
Sam Schrager,0:05:05,For a single foreman?
Arthur Sundberg,0:05:06,"Yeah. And then get out on the green chain, why, oh, there would be probably 20 men there, 10 men on each side of this chain pulling lumber, approximately that. Well then, in the days before they had the dry kill, the lumber used to go from the green chain directly to the lumber yard on these narrow gauge railroad cars. Well, they had, let's see,"
Arthur Sundberg,0:06:03,"I think they had eight electric locomotives. And these locomotives would haul, the green lumber, they would haul about six or eight big units of lumber at a time. They were coupled together by two and a half inch extra heavy pipe. And then had a flat coupler on the end. And each one of these cars had a cast iron or cast steel draw head on each end of the car. And they would put this pipe into that draw head and then the man had to drop a pin in that hole. Well, these bars were 20 feet long, so they were pretty heavy. Well, in making up a train, there was a motorman and a switchman on each one of the locomotives. And they carried these bars on the side of the locomotive on hangers."
Arthur Sundberg,0:07:35,"Well, they would have to take one of these bars, each one of them, and they'd go down along the string of cars that had to be pulled out. And they would stick one end of the bar into this coupler and drop a pin in it. And then the other end laid on the ground and they would do that for each car as many as they were going to haul. Well, then the motorman, the motor operator, he would move ahead a little bit and then the switchman, he would have to lay on the side of the track with this other end of this bar on his leg. And he would have to gauge that so that it would couple into this draw head on this car as he backed up on it. And then he'd drop the pin in and jump out and go to the next one. And that's the way they made up their train. Well, then they would take it out to the lumberyard. And, oh,"
Arthur Sundberg,0:08:51,"at that time, in the early days, there was about 26 or 28 alleys in the lumberyard. After that, it was made larger, but to begin with. And then there was double tracks in each alley. And all these alleys were about 1 ,800 feet long or something like that. Well, then this motor crew then, if, say, this tail end unit lumber, it had to go into alley 4 east. Well, they would throw the switch and they'd shove it into alley 4 east and uncouple it and take the bar out and hang the bar back on the Loki. Maybe the next unit had to go to alley 6 west, so they'd have to switch over and go down into alley 6 west and drop it off. Maybe there'd be two of them to drop off. And that's the way they used to distribute them. And then it got into that section of the alley. Well, then they had a man out there with a horse, and he would hook his chain onto that car, and he would pull that down and spot it in front of this pile where it was supposed to be piled. And then the piling crew, they might have to just push it by hand one way or the other, just get it spotted right. And then they would pile it. Well, then the, I think there was about five locomotives that were pulling green lumber. And there was three, I think it was, that were pulling dry lumber. But these locomotives that pulled the dry lumber in were, where they would haul six or eight units of green lumber, the same size locomotive, hauling dry lumber. They would haul 11, 12, maybe 14 units of dry lumber back in. Well, what they done then, when they brought it in, is they would pull it up behind the planer. And there was several tracks, there's a regular switch yard there. And they would just uncouple all of their units right there and stack their bars up on the Loki and then go back for another drag. But, like I told you, the planer, it had 22 machines in the planer. And there was a track going into each machine."
Arthur Sundberg,0:12:23,"And then there was two tracks going out from each machine. One track was for the lumber that was on grade for that particular order. And the other track was for what they called outs. You know, that was lumber that was either higher or lower grade than what was called for. And then that unit would be pulled out and go to the lumber shed for stacking up."
Arthur Sundberg,0:12:59,"But, uh..."
Sam Schrager,0:13:00,"So the lumber went through the planer then, just when it was on order?"
Arthur Sundberg,0:13:05,"Yeah, that's right. It all stayed in the lumber yard rough, except, as I say, the outs. That went to the lumber shed and, of course, it had an order for certain species and certain grade and dimension. But then, whatever they could of that order, they filled that out of the shed that was already surfaced. And then the remainder come from the lumber yard to be surfaced."
Arthur Sundberg,0:13:43,"But, oh, in the early years, they didn't do any remanufacturing. The only remanufacturing that was done with the surface lumber was that this lumber that came into the lumber shed for stacking up... Well, it was all graded again in the shed. And then it was stacked in different units in this shed, you know, for dimension and grade and so on. But, if they had a, say, a number three board, and it was a number three because it had a two -foot crack on one end of the board, you know, a check. That made it a number three board. Or otherwise, if that wasn't there, it could be a number one board. Well, maybe the man that was grading in the shed, each one of those graders in there had a handsaw. And he would saw off two feet off on the end of it by hand, see, and then stack it up. That would upgrade the board. But that's the only remanufacturing that was done in the early days."
Sam Schrager,0:15:05,"When you say that the planer mill surfaced the lumber, what do you mean by that?"
Arthur Sundberg,0:15:12,"Well, it was rough lumber when it come in there. When it come out, it was smooth lumber. You know, it was plain top and bottom and two edges, possibly. And a lot of the lumber in the early days was just, it was specified as two -side. Well, that meant that it was surfaced on top and bottom. And then, of course, you had other orders that was specified as four -side. That was top and bottom and the two edges were surfaced. But there was an awful lot of lumber shipped in the early years where the edges were never surfaced at all. Because, I think, the fact that there was a lot of that lumber that the purchaser would remanufacture it himself. And he would smooth up the edges. But, anyway, there was, oh, I'd say that it'd be 50 % of it or maybe more that was shipped just surfaced two sides."
Sam Schrager,0:16:20,What was the relation between the mill and the WI&M railroad as far as the transference of the finished lumber to the railroad for shipment and out? Was it really run as a separate operation?
Arthur Sundberg,0:16:38,"It was, but it was entirely owned by the lumber company. But then it was run as a separate industry. And they had their own method of hiring and operations. And, of course, they had to comply with the Interstate Commerce Commission rules on everything. And so, but it was owned entirely by the lumber company. But then it was run as an entirely separate industry, you see."
Sam Schrager,0:17:32,"Oh, and these foremen, if you wanted a job in the mill, you would go down there and speak to the foremen in the area where you thought you might want to work?"
Arthur Sundberg,0:17:50,"That's right. That's right. That's right. You would go to any, whatever department that you thought that you would like to work. Now, for instance, out in the lumber yard, they had a foreman for the green lumber pilers. And then they had another foreman for the dry, for the men that loaded dry lumber, loaded out. And then they had another foreman for the pickup. Now, that pickup was, it was probably, oh, anywhere from two or three to five or six men in that pickup crew. But they had a lead man that was, you know, called a foreman. And what they'd done was any lumber that was, had fallen off or was scattered or, and then all these cross pieces that was in the pile, you know, that each course of lumber that they stacked, it had these one by four cross pieces on there so it would make air circulation through the stack. Well, this dry lumber crew, it was loading out. Why, that was so, oh, shortly after, it wasn't too long after the mill started, where that went on piecework on the chippel, you see. And they got so much, a thousand for loading it out. So what they would do, they'd just throw them one by fours off the pile to get them out of the road, see. Well, this pickup crew, they would go up and down the alleys and see that those were all put back, put up to where they wasn't laying on the rails. And so, you know, it was just kind of a housekeeping tour. Well, that was another little department, see. Well, a man might go out in the lumber yard and ask the dry lumber foreman for a job. And he'd say, well, right now I'm filled up. You know, I just can't hire anybody right now. But, old Carl over there, he'd probably go over and see him. Maybe he needs a man. So he'd go over and see old Carl. He was upon the pickup crew. And, yeah, I can put you on. You can start in right away. And you'd work at that for a while. But then after, maybe in a short while, it'd be an opening in this, where you wanted to start in the first place, in this dry lumber crew. So then you would, they needed a man there, so then you would go over there and go to work, see. Well, then old Carl, he'd hire another man in his pickup crew. But each one, they hired their own crew, and as I say, if it was necessary, they would fire."
Sam Schrager,0:21:09,Wasn't it too hard to move from job to job once you were working in the mill?
Arthur Sundberg,0:21:15,"If you saw... No, I don't think so. Of course, you had to go and talk to that other foreman, you know, wherever you wanted to go."
Arthur Sundberg,0:21:26,"And he'd say, well, where you working now?"
Arthur Sundberg,0:21:30,"Well, I'm working up in the sawmill."
Arthur Sundberg,0:21:32,"Well, what's the matter with that?"
Arthur Sundberg,0:21:34,"He'd say, well, it's just too noisy. I just want to get out of there, see."
Arthur Sundberg,0:21:44,"And he might then, the first opportunity, ask the sawmill foreman about it and say, well, so and so asked me for a job."
Arthur Sundberg,0:21:57,What do you think?
Arthur Sundberg,0:22:00,"Well, go ahead and hire him. He's no good here anyway, and that's the way it goes, see."
Sam Schrager,0:22:07,"Then he wouldn't hire him, would he?"
Arthur Sundberg,0:22:08,"Oh, yeah, but he might be good in that other one because that's where he wanted to be, you see."
Arthur Sundberg,0:22:21,"It was a far cry from the way it's operated nowadays, you know."
Arthur Sundberg,0:22:29,"Nowadays, you have to first go to the employment office, and there you have to be interviewed as to past experience and all that. And then they might give you an aptitude test as to if they think that you can put a round peg in a square hole or a square peg in a round hole. And then, of course, now it's very seldom that you can go directly into a department or a division of the plant that you would like to go into right at the beginning. Because a big percentage of the new hires nowadays goes on an extra board list. And you're called out to day shift or night shift, and maybe one day you'll work in the power plant, and the next day maybe they'll call you out to work in the plating mill. So if you stay with it, you finally get to where you want to go."
Sam Schrager,0:23:58,"Would fellas want to move around very much in the old days, or would a guy get into the state in three years?"
Arthur Sundberg,0:24:05,"In fact, the matter is, you take the average person working in the lumber industry, my opinion is it was just a matter of a job, a matter of making a living for himself and his family, if he had one. And they would go through an awful lot of hardships just in order to keep their job and be able to provide a living. More so than anybody nowadays, you take anyone your age, I don't think that the person could paint a picture and really get the idea across as to what people actually had to go through. And I say had to go through, that's probably a good way to put it, but that was just the way things were done, and if she was going to survive, you had to do it, that is all. Now,"
Arthur Sundberg,0:25:33,"you take,"
Arthur Sundberg,0:25:37,"nowadays, you see these young people, young men, I know I used to get so disgusted with some of them, they'd come down to work in the morning and they'd have on a pair of jeans. No underwear, they'd probably just a t -shirt and shorts, and a little low pair of socks and a pair of oxfords, and they'd come down there and it'd be below zero. And there they'd stand and shiver and shake like that. Well, you know, no man can work dressed like that. You have to be comfortable if you're going to work."
Sam Schrager,0:26:28,"And, you know, in my crew, of course, my crew was maintenance and construction, but I had men in my crew that would come down dressed that way, and I used to tie into them and ask them, why in the world didn't you buy some clothes?"
Arthur Sundberg,0:26:47,"And they'd mumble something, but then I always kept a lot of my clothes there, you know, I had clothes enough there for half a dozen men of my own. You know, sheepskin, overcoats, and all kinds of rain gear, pants and coats and overshoes and everything else. Well, gee whiz, them guys were wearing my clothes all the time."
Sam Schrager,0:27:18,But what about back then? Were you talking about how what they had to put up with?
Arthur Sundberg,0:27:24,"Back then they used to dress, they knew they had to, and if they didn't, they'd just... You know, a foreman, if a fellow had the audacity to come down on the job in the early days like they do now, you know, dressed the way they do now, why, sure, the foreman wouldn't give one look if he was already employed, but he'd can him right on the spot. They wouldn't put up with anything like that. Them days you take in the cold weather,"
Arthur Sundberg,0:28:02,"there was, oh, I don't know, there was any number of different combinations of footwear that the men used to wear, trying to keep their feet reasonably warm."
Arthur Sundberg,0:28:20,"But there was a lot of them that wore these, what they called German socks. Well, they were just a felt boot, you know, they were not so thick. And they'd have on wool socks and then they'd have this thing on and then they'd have overshoes over the top of that. But, I guess personally I've tried every kind of a combination that's ever been thought of for the cold weather, and the best thing that I ever found was just a pair of low rubbers. Of course, they used to make them special for that, they don't make them anymore like that, but they were heavy, you know, but pliable. And then have, oh, maybe one or two felt liners, you know, insoles in there, see. And then maybe a pair of light socks and then a pair of heavy wool socks on that. Well, that was pliable and flexible, you see. Anything that's stiff on your feet, you'd freeze your feet, you know, because your feet wouldn't have a chance to flex. And then the same with your hands. I don't know whether I was probably among the minority, but I figured it out for myself a long time ago. It was customary for men to wear a pair of wool mittens, and those wool mittens would be inside of a pair of leather mittens. Well, I found out for myself, and I put a good many other men wise to it too, and they followed my theory, was that you could freeze your hands in that combination, because inside of this wool mitten, you had skin against skin on your fingers there, see, where you could just wear a cotton glove inside of that wool mitten and stay warm because you had insulation between your fingers, you see."
Arthur Sundberg,0:30:46,"Well, it is. But even right now, you go around in the wintertime and you'll see these guys, well, they got to get their hands warm, so they go and buy a pair of wool gloves and a pair of leather gloves. You know, they've got to have a leather glove or mitten to handle lumber with, you know. But their hands are cold, and it's just because your skin is coming in contact with the skin on the other finger, you see, where if you had some insulation between those fingers, well, then you would stay warm."
Sam Schrager,0:31:28,"How tough was it for these, for the guys in the crews with Foreman?"
Arthur Sundberg,0:31:36,"Were the Foreman, I've heard about brown nosing, for example. Well, that's true. There was, you would probably find in some crews, you know, might be one or two in the crew that there's always brown nosing around the boss, you know, trying to win favors, you know. They would, oh, every chance they got, they'd slip around to the boss and, oh, John Doe, well, there he'd done this or he'd done that, see. Trying to get that guy in trouble didn't make me a little higher in the steam of the eyes of the boss. But that wasn't, I wouldn't say that that was the prevailing thing. It is, you know, you'd find that maybe with some, and then some it wouldn't work at all, you know. Maybe there was some Foreman that just wouldn't put up with that kind of stuff. If there was any investigations as to anything that wasn't supposed to be, well, he figured out he'd find that out for himself. But then there was some Foreman that, well, they lacked the, the intelligence and the experience of a Foreman, so they relied on some of these other guys bringing stuff to them, you see. You know, if a person doesn't have the qualifications for a Foreman, well, then he might have to resort to some of that stuff, see. And then there was some Foreman that'd done an awful lot of brown nosing to the superintendent, too, you know. And, of course, that's as far up as they could go. They never got it up to the management, top management, but then the..."
Sam Schrager,0:33:58,Would that mean making themselves look good at the expense of the crew?
Arthur Sundberg,0:34:38,"Well,"
Arthur Sundberg,0:34:46,"you know, if that had... that would keep snowballing, pretty soon he'd be the superintendent, wouldn't he?"
Arthur Sundberg,0:34:55,"Because he'd be running the whole show. And there was men that had those ambitions. Of course, most of them was kind of picked in the bud. They didn't get too far, but they did, they did, oh, multiply a little bit, but they always stopped it before it got too far along, see. But if a man had a crew here, maybe of ten men, well, maybe he was capable of combining his crew with another crew and making it all in one. You know, there were some people that had the capability of doing that. And then there were probably some, too, that wanted to do that, and maybe they had an opportunity to do it. And then after they got it, they found out they couldn't handle it. Well, then they would get one of their subordinates to take over part of it, you see, part of the load. Oh, there were lots of different combinations, you know, that couldn't be worked out. Sounds like there was a fair degree of flexibility there in the set -up to permit that kind of thing. If you could have, actually, let's say, subdivide your crew, if you're the foreman and have one of your men run part of the crew, it sounds like it wasn't too highly structured, is what I'm saying. Well, that's true, but of course this subordinate to the foreman, he didn't get any recognition of being a leader or anything else. That was just between him and his foreman, you know. And he didn't get any extra pay. It was just kind of making him look good to his boss. That was all. It was just a glory thing, you know. He didn't get any extra compensation for it or anything of the kind. Well, I've heard it said that whether or not you had a good foreman was what made all the difference for you working. Well, that's very true. They did have some awful good foremen, and where they did, why, the only way that you could ever find an opening in that particular department would be that somebody would die. You know, it was a lifetime job for a lot of men. You know, they worked in one department their entire life, and that was it. They didn't have any desire to work anywhere else because they liked... John Doe was a foreman, and they got along good, and he was fair, and he never asked anything of any of his men that was unreasonable, and consequently they liked the work there, so they wanted to stay there. There was a lot of that, you know. It wasn't all this tooth and claw theory at all, you know. There was a lot of contentment, although they worked hard."
Arthur Sundberg,0:38:44,"But you know, the average man that worked in the industry in the earlier days,"
Arthur Sundberg,0:39:01,"the time he got his day's work in and he got home and he got his supper, he would probably sit down and read the newspaper for a few minutes and then pile in the bed, because he had her for that day because he was tired. He was tired right down to the bone. And then he would get up the next morning and do it all over again. And that was the routine of the average. And I don't think they complained about it too much because they didn't know anything different. It's the only thing they ever seen and it's the only thing they ever knew. That's the way their dad lived and that's the way their granddad lived. You know, it was sun up till dark and pile in the bed and the next morning start all over again. Most of these folks who were just working in the mill like that, I know I've asked you something like this before, but this makes me think about that again."
Sam Schrager,0:40:16,Did most of them make money while they were doing this? Were they saving?
Arthur Sundberg,0:40:20,"Very, very, very few. They had to be very frugal and the man and his wife had to work in very, very close harmony in order to save any money. For the average person in the industry, it was just a hand -to -mouth existence and that's the reason that they just couldn't afford to take any time off. And it was just almost entirely unheard of for anybody outside of, get up into the upper echelons of the industry or anybody ever taking a vacation. It was six days a week, ten hours a day. There were some men that had jobs that was seven days a week, twelve hours a day. And they just seemed to like it. It was just a way of life and they just keep going that way. It was twelve hours a day and seven days a week."
Sam Schrager,0:41:49,Did many people have ambition to become foremen?
