speaker,timestamp,words,End Time

Sam Schrager,00:00:03,"With Tom Wahl of Genesee, took place at his home in Pullman on March 10th, 1976. The interviewer is Sam Schrager.",00;00;22;23
Tom Wahl,00:00:22,"One of my earliest. My earliest knowledge of what the Genesee area was like originally is pretty well described by my father. Speaking of riding from our place six miles east of Genesee to Lewiston on a saddle horse without crossing a fence, and with the bunchgrass rubbing the horse's belly all the way down to the lower part of the Lewiston Canyon. This is something that I came too late to see. I was born in 1911, so my memory of that country, of course, is all fences and plowed ground and mud roads. Mud roads are a thing that very few people now experience, unless they make the wrong turn in the spring of the fall in our area and leave the gravel road. Then they find out what mud roads are. I was on the end of a mud road six miles away from the nearest town, and for certain stages of the year in this country, that's isolation. Your trips to town were a thing. Were infrequent enough that you considered that quite an event when you were a child in those days.",00;01;58;17
Tom Wahl,00:01:58,"There was one period of the year when you got to go to town often enough that it could have become monotonous, were it not for this contrast of the long period of isolation, the time you got to go to town when the crops were hauled into town and delivered. And then you got to go every day or maybe twice a day. And this was for a boy that was big enough to enjoy it and too small to work. This was quite an enjoyable thing.",00;02;32;03
Sam Schrager,00:02:32,You would just go in with your father on the on the wagon then?,00;02;35;16
Tom Wahl,00:02:35,Yes.,00;02;36;24
Tom Wahl,00:02:38,"Along with this same type of thing. You must realize that all of the heating of our homes for the winter was accomplished by burning wood, and in the Genesee area there never was any great amount of wood very close. Some of the canyons had trees in some of. Frequently some of this was used as fuel. And in my day it was supplemented somewhat. If you hadn't accumulated a big enough woodpile, it would be supplemented sometimes by buying coal in the nearest town. This coal, you can see, almost had to be hauled before the roads deteriorated to the point where it became a pretty difficult thing. So after the harvest, one of the last things you did in the fall was to try to accumulate enough wood to see you through another year of farming. You might think of this as a hardship, but really, this was like a vacation. We got our wood from Troy, or north of Troy, or near Troy, and one of the places where we frequently got the wood was from Oak Olson's sawmill, which was within, what would you say, a mile or two of Troy?",00;04;00;24
Sam Schrager,00:04:00,"Well, I'd say about the three.",00;04;03;03
Tom Wahl,00:04:03,"Three miles of Troy, and we would hold this home on a mud road, remember? But by this time, the road was either dry and dusty, or it would be a time when the road was frozen and hard, and we would leave our farm in the morning and we would go up to. We would go first in the direction of Juliaetta, and then take the first left hand road up a canyon that drains into the little Potlatch Creek. But we would this road. Turned to the left before you reached the Little Potlatch Creek. There is another road roughly parallel in it that is about a mile or so further down. When you turn off on it, and we would get up to the place where we loaded our would usually Oak Olson sawmill, and we would get there in time to load a load up that night, and we would cook our dinner and sleep overnight in a sleeping bag or before my time.",00;05;34;15
Tom Wahl,00:05:34,"Of course, the pioneers didn't have sleeping bags. It was more conventional bedding.",00;05;40;04
Sam Schrager,00:05:40,Would you stay right there at the mill?,00;05;41;20
Tom Wahl,00:05:41,"Yes. And I must say here that the Oak Olson family was a most hospitable family. We had never been there. But what? We were invited to share their meal with them. But I can only recall one time that we did this. Because, contrary to what you might think, pioneers were well aware of the trouble that another family might be put to where they're already feeding a large number of people to stretch the table for two more, and the next morning we would start out for home and get down at the farm in time to unload this load of wood. That was the routine.",00;06;32;08
Sam Schrager,00:06:32,How much would do you think you can get?,00;06;35;03
Tom Wahl,00:06:35,"When I was making these trips with my father, I believe the first one I made that stands out in my memory. I was big enough to drive a team with two horses pulling the wagon, and he drove a team with four horses pulling his wagon. And. I presume that the two of us. And this is just a real wild guess, but I presume that the two of us on the two wagons would haul more than a quarter of wood. As I say, this wasn't a hardship. This was a vacation. It was like a camping trip. Everything you saw was new. We would. I was going to describe the route we took. We would go up this road, up this canyon, across a little divide down into a second canyon, and we would probably go through or near to. Well, we went through what was then called Linville, which was a little settlement. There was a store and post office and schoolhouse and Cornwall or near what we speak of as Joel now, and from there on into Troy and the other side of ways, till we came to the sawmill.",00;08;06;12
Sam Schrager,00:08:06,"Would you make just one trip a year of this, or would it take him more than one to know?",00;08;12;04
Tom Wahl,00:08:12,"It would take several trips like this to get a year's supply of wood? I can't remember how much would it required, though, and it varied too. It would depend on the year. We usually would keep a backlog of some sort of fuel there, and there was always other sources of fuel, and if the weather wasn't suitable, you might not get to make this trip at all. You might have to burn refuse and what you had left. And there was two. You must remember in those days one method of taking up land by means of a timber claim wherein you planted trees, and these trees, as a general rule, were a pretty worthless type of a tree, and they'd no more than really come to. O appreciable size before the process of grubbing out these. Timber claim timber began, so they served a purpose of. Supplying some alternate fuel, and we relied on them frequently. And as I have said, you did supplement it with coal. And there were always the deteriorating fences with the resulting fence posts and so forth that had to be replaced. And the what was, what remained of the old principles could be burned.",00;09;40;28
Sam Schrager,00:09:41,"Well, how long could you anticipate that you would perhaps be socked in at, isolated at during one.",00;09;51;01
Tom Wahl,00:09:51,"Months, if we happened to have a muddy fall? The thing we look to look forward to with a great deal of anticipation was the good sleighing would be a year with good sledding. Sometimes it was and sometimes it wasn't, but this was a vast improvement. Snow covered roads were a vast improvement for a horse drawn economy over a muddy road. Muddy road. There are instances where a strong team of horses can't even move a wagon stuck in the mud. Not only a strong team of horses, a 2 or 3 teams of horses, you have no idea of how deep the mud in this country was, particularly in an area where it was traveled, or in a low area where the water didn't drain off. I've heard my mother tell of a team, or rather of a wagon that was stuck in the main street of Moscow for a long period of time. I don't believe I would be misquoting her if I said all winter.",00;11;11;11
Tom Wahl,00:11:11,"Of course, Moscow and the towns were the first settlements to pave certain streets, and my memory doesn't go back to the days of mud streets in Main Street of Moscow. Although I have been stuck with a model T within two blocks of Main Street. That was as late as… 1931… much mud roads were pretty plentiful here in Pullman. When I came here in 1945. I don't think you'd have to hunt too far to find mud roads yet. You looked in suitable.",00;12;05;00
Sam Schrager,00:12:05,"Plazas, kind of, buddy. We lived near the old Oak Olsen place. Oh, you do? Going going through that canyon. At this time of year, it's pretty muddy sometimes.",00;12;15;09
Tom Wahl,00:12:15,"There is a thing that would interest you a little bit, but in general, what we call those mountain roads, the mountain country there, in general, the road isn't as muddy. That is, the mud isn't as muddy as the loam and clay soil that most represents a great deal of the Palouse, those mountain areas where there is quite a bit of decomposed granite in the soil, didn't ever get as bad as the lower roads that I speak of, except in spots, of course.",00;12;54;12
Sam Schrager,00:12:54,"Well, let me ask you just a little more about this. This isolation, the winter isolation especially. But in isolation in general. What what did you, do to to pass the time in those months when you weren't?",00;13;10;12
Tom Wahl,00:13:10,"Your question is the question I would expect from someone who hasn't experienced much of the horse powered era. And what did we do? We tried to live. And that means we had to care for our animals. We had to feed our horses in order to live. We had to have a source of food. And part of this, a large part of this was supplied by cattle, meat and milk, and also chickens and fowls of other types. So all these things had to be cared for in the winter. You had to either have stockpiled or be able to get this food, animal food, when they needed it, and you had to distribute it to them every day. Now, usually the horses ran out without shelter and were fed at least once or maybe twice a day. Horses and cattle both. And then the cows that you are milking and the and any animals that needed care were stabled in the barn. It wasn't considered economical to try to put every animal you had in the barn in the first place. They wouldn't have survived as well in the second place. You didn't want to use this. Hey, that was under a roof because there wasn't enough of it.",00;14;58;07
Tom Wahl,00:14:58,"You were limited in the amount of hay under a roof, but hey, keeps properly stacked loose hay properly stacked. Keeps very well out in a haystack. And so during the haying season… june and July… you put up all the hay that you could put up. And there was quite a lot of it put up. People raised alfalfa and most all of the flat areas that are now plowed were in those days in Timothy Timothy flights. Timothy is an excellent horse food. So a lot of our time in the summer was spent in providing things that we had to have for use in the winter, and the isolated periods. We were kept real busy and incidentally entertained by surviving, by caring for the stock and so forth. We had to sort our pile of potatoes over several times. We had to sort our apples out and discard those that were rotting. We usually had.",00;16;17;14
Tom Wahl,00:16:17,"Old carrots, turnips, rutabaga, as well as potatoes, whatever we could have harvested from our garden and from our farm. Why these? We tried to preserve as well as we could along through the winter. It's a different type of life from that which we had now. It's considerably easier now, but we have lost some things to buy it. Now. We work more indirectly at our survival. But don't get me off on this. I have a do a lot of philosophizing about this, and I haven't organized it so that I can talk very coherent.",00;17;04;19
Sam Schrager,00:17:04,"But it sounds like an interesting contrast of it. You're just that you're just beginning to make. And, I think that's true. We did we do we do working directly, certainly to compare to what you're describing, that seems very directly related to immediate needs and, having enough to eat.",00;17;27;00
Tom Wahl,00:17:27,"Yes. Putting out your hand at eating implies a whole lot more than the simplicity of the statement might lead one to believe. But at least in this kind of a life, you don't have to be very old before you see the necessity of what you are doing. And although the work is hard, it becomes the thing you want to do because it means comfort. One example of this, when this was first called to my attention. In hauling this wood for fuel for the winter, although I regarded it as a vacation, one part of this that was not a vacation was loading and unloading these loads of wood as fast as you could, because the theory being, you could rest while you were riding back to get the next load. And I said I was protesting in somewhat ill Yuma and my father, at this hard work of unloading this wood, and I didn't I think I expressed a dislike for wood, and his answer to me was that would will look pretty good to you this winter when you're toasting your shins by it.",00;18;56;23
Tom Wahl,00:18:56,"So you you work very old because you began to, I mean, before you began to like to do what you were forced to do.",00;19;09;24
Sam Schrager,00:19:09,"You know, the description of of the things that that you were working on suggests to me a little more diversification than I, than I thought might be the usual case of a farmer's Appaloosas at that period of time. It sounds like you you were involved in the self-sufficiency to prepare, to grieve.",00;19;32;10
Tom Wahl,00:19:32,"Yes. There's a little parallel there that would interest you now, a farmer in the wintertime should whether he does or not, he should be overhauling and repairing his tractor and his machinery for the next season's operation. Most of them do. In those days you were caring for your horses, arming your harness, repairing it. There is a thing that might not occur to someone who has an experience. Is the amount of labor involved in keeping the harnesses that are necessary. When you use horses as a source of power, and keeping these harnesses in repair. And in those days, our breakdowns usually consisted of either the machinery machinery you were pulling or the rigging that you used to pull it with. And we made single trees and double trees and singletary hooks and clever and all of the things that are required to attach enough horses to a piece of machinery to move it. This took maintenance. We weren't board in the winter. We got lonely, and we welcomed a chance to meet our neighbors, or a chance to go to town and a chance to go to town when the sleighing got good.",00;21;07;13
Tom Wahl,00:21:07,"The sledding or sleighing, as you wish to call it. This was one of the things that that lightened up the chores of the winter. Always. We managed to get to town at least once, sometime before Christmas each year. Christmas was a pretty big event just for this reason, if none other.",00;21;36;20
Sam Schrager,00:21:36,"I'm curious about this going to town for where did you were you buying presents? And,",00;21;44;00
Tom Wahl,00:21:44,"This would be part. Of course, there were supplies you still needed, supplies that you might have overlooked getting in the summer. You needed kerosene, coal, oil. That's what we lighted our houses with. That's what we used when we went to the barn after dark to care for our animals. Kerosene was the principal. Ingredient that's been replaced by electricity. Now the principal essential ingredient. We had to have light. And yet this aspect of farming that you have shown an interest in, if you'd ask a farmer at that period of the year what he was doing, he would have told you nothing. Or he might have said just charring around. And even now, if a farmer isn't tilling or harvesting or planting or working the land, if you should ask him what he's doing, he'll say nothing. Occasionally in the early spring, he might have said fix and fence. He won't say that now either.",00;23;14;22
Sam Schrager,00:23:14,How close do you do you feel the connection was with with town? With the town of Genesee for your your family was or was it? Obviously there was a psychological importance that you're describing to me.,00;23;29;18
Tom Wahl,00:23:29,"In my lifetime, these towns were almost essential because they were the terminal of the railroads and everything we used that we couldn't produce for ourselves came by way of these railroads. And. I should go back a little bit. Anything that was within wagon driving distance, like the wood from Troy. Didn't come by railroad, but. All the things I remember getting, of course, things that we used to very our diet were cheese. We didn't make our cheddar cheese, but every store, any place you went had a large round, flat cylinder of cheese and a most interesting mechanism for cutting it and protecting it from the and cover for protecting it from the flies and cheese to any one of that day. And airy and time meant a slice of this yellow cheddar cheese. Of a wedge shaped at one end and a portion of a cylinder at the other. You still see these wedges of cheese occasionally yet, and if you asked for a pound of cheese, the grocer made an estimate of what he thought would be about a pound of cheese, and he cut it off. And then he weighed it. And you paid for what he cut.",00;25;28;14
Tom Wahl,00:25:28,"If he cut it away too big and you didn't want that much, he would probably have cut an edge off or another slice off and come a little closer. But usually his guess was pretty good, and you took it the more or less way that it came and paid for him. For the paid for the quantity. You got 4 pounds of cheese I can visualize. Yet this was a pretty common size because you didn't want to make a trip to town tomorrow to get a slice of cheese, because a trip to town tomorrow involved losing a half a day of whatever else you might have been doing. Another thing I liked about the wintertime. We had no refrigeration, remember? So the wintertime was the time when we butchered and there would be butchering day, maybe several, maybe more than one. Sometimes neighbors cooperated in these butchering. Oftentimes this job was really because of the people that cooperated and the companionship that you got. Butchering were a pleasure. They were an entertainment. They substituted for all of the time wasting entertainment that we used now. And.",00;26;50;02
Tom Wahl,00:26:50,"The neighbors would get together and butcher several hogs. Or maybe you and your father would butcher one hog. It varied depending on your needs and what other people were doing. And this meat was if it was hogs, you were butchering some of this meat. You ate without curing it. But always you cured a lot of it. And the hams that we made in those days, part of the curing process resulted from drying out as this salt penetrated the meat. A ham that you made in those days would last you from the time you butchered it. If you didn't eat, it would last you from the time you butchered it until the next winter when you butchered again. This is a vastly different thing from the ham you buy downtown that is sold to you with all the water in it that the law permits, and as little salt in it as your palate permits.",00;28;01;02
Tom Wahl,00:28:01,"The hams and the bacons of my memory didn't lack for salt. And I'll tell you, by the time the next butchering came around. You were pretty happy to see some fresh, uncured me.",00;28;20;03
Sam Schrager,00:28:20,Could you tell me if you're going to go to something else? I'm really curious about the about the butchering. Get together some how how that was arranged that that a number of neighbors would get together to butcher. How was that thing set up? Everybody met at one person's place with.,00;28;38;23
Tom Wahl,00:28:38,"No, it's a little different because of the distances involved and the difficulty in travel, our butchering, or at least the ones that I attended, didn't involve the big crowds. That might problem that I've heard described where travel was easier and people were closely neighbors were closer to each other. But our butchering usually would amount to a thing like this. One neighbor would say to his neighbor, I'm going to butcher a hog one of these days. Why don't you bring something up and we'll butcher them together, and maybe we'll see another neighbor and see if he wants to bring one. And so usually this would consist of 2 or 3 or maybe four neighbors. I can't remember a butchering where we had more than four people involved in butchering for. Families were a unit that were beginning to forget about now, but in those days, families was a unit. And if you invited a neighbor to come up to your house for dinner, that meant that he was going to come and his wife was going to come, and the babies were going to come, and the other kids were going to come, and the hired man would come.",00;30;08;29
Tom Wahl,00:30:09,"This wasn't it wasn't even necessary to specify this. This was what you meant when you said, come visit us. So these butcher rings, you might have quite a crowd involving maybe as many as four people for. I don't mean people. Families for families and for supplies of meat, for groups of animals. You might butcher each one hard. You might butcher each of you two hogs, or you might butcher as many as well, say 12 hogs at a butchering or even 20. And if you I could go into a little bit of the butchering.",00;30;53;23
Sam Schrager,00:30:53,Why don't you?,00;30;54;24
Tom Wahl,00:30:54,"Usually the butchering was held at a place where some farmer may be a little more enterprising than some of the others had of that in which to called the hogs. And this at our place consisted of a. Trough about a foot and a half deep, with a flat bottom of metal and sides of sides and ends of wood, part of which was covered by this metal. Sheet iron turned up to protect the lower edges of the wood from the fire which you built on her. You placed this vat over a a ditch that you dug, with the edges of the sides resting on the earth and the middle part of the bottom over this ditch. In this ditch you built a fire at one end of the trough. You left the ditch open, and at the other end you put in a stovepipe and closed it up with earth around it, so that the smoke from this fire went up this pipe, and which provided a draft. And you might have a sheet iron or something that you covered the open end with and used it to regulate the amount of air, and therefore the speed with which the fire burned, or the violence with which the fire burned, and the man at whose place the butchering was to take place would.",00;32;36;05
Tom Wahl,00:32:36,"Probably delegate one of his sons the job of getting this ready, while the father took care of the chores, or vice versa. You were always up early. You didn't get up early for a butchering. You got up early anyway. You did this preparation instead of some of your other chores. So in my time there was always an old fence post around. This made splendid kindling, not only because it burned good, but because cedar is easy to split. And that's what were made of. And it, fire place or ditch like this long kindling. And Longwood was the type of thing we burned. So we heated this water until it got to the right temperature for scalding a hog. And. The earliest butchering that I went to, you judged the temperature of this water without a thermometer. Thermometer for an immersion type thermometer was a luxury you didn't need, because the people that had settled this country, they didn't know when water was hot, they should have stayed in town. And one way of judging the time, or the temperature at which this water was just right for butchering, was to stick your finger.",00;34;11;07
Tom Wahl,00:34:11,"They swing your finger through this water three times. Now, the first time it you wouldn't think it was particularly hot. The second time you knew it was pretty warm. The third time, if you just felt like screaming, then you knew it was ready. Money. If you had left your finger in there any of these times, why the skin would eventually have swept off if the water was at the right temperature. But doing it quickly this way, it's a pretty effective way of judging temperature. If my memory serves me right, this corresponded roughly with 150°F, which we later had the luxury of owning a thermometer. That would take some of the guesswork out and save your finger.",00;35;02;16
Sam Schrager,00:35:02,"Well, what about immersing the the the hog itself? That sounds like a kind.",00;35;06;15
Tom Wahl,00:35:06,"Of that. Immersing the hog itself is, of course, the the thing you're getting ready to do. But oftentimes if your guess or your estimate of this temperature wasn't right, you could tell by the way in which the hair on the hog loosened, whether it was about right or not. If you got the water too hot, it would do what the old timers would call set the hair and it wouldn't scrape off good. If it was too cold. Why? You merely left it in the bat longer, with a fire burning under it, and gradually bringing the temperature up higher and higher, until you got to the point where you thought, well, reaching down and pulling out a wisp of the bristles from the Harwell. It's about right. Let's take him out and scrape him. This wasn't the chair that you would think it was. On each side of this vat, there was a platform just a little lower than the top edge of the vat, say 2 or 3 or four inches and clear across. There was a platform like this on always on one side of the that and frequently on both sides across the top of the vat and across these platforms.",00;36;29;14
