speaker,timestamp,words,End Time
Tom Wahl,01:44:22,"Edward Olson, Edward Olson, and Edward Olson, the Scandinavia, the Norwegian, and a man named Johnson, who was the Swede, showed up at our place 3 or 4 different years, maybe not consecutively, but one time or another. They had worked in this area before and had worked at a place where they had liked the the employer. Naturally, that would be the first place that they would apply for a job if the employer they had previously worked for didn't have a job, maybe he could suggest somebody that they would go to for a job. There never was any. Very seldom was there ever any correspondence ahead of time or even a phone call or anything. They just showed up at your gate someday, or you met them in town someday. And he asked you, are you going to need any help, this haying or this harvest? Why? That was how those arrangements were made oftentimes.",01;45;27;24
Tom Wahl,01:45:27,"Or maybe I shouldn't say oftentimes, but it was not unexpected. If a man who had worked for you one time came to your house looking for employment, or to visit you as a friend and stay overnight and talk about working and whether he was going to work. And these were acquaintances. They were friends. You… there was… i would I would like to say there was no social differences between you, but I can't say that there was a feeling of some aloofness between you and this migrant farm worker. True. He ate at your table. He slept in your house or in your bunkhouse or in your barn. He became well acquainted with the family. But if he was a man that went to town on Saturday night and got drunk, this was none of your business. As long as he did his work, it was none of your business. If the farmer. Was in the living room discussing things with his family, the hired man somewhat.",01;46;58;12
Tom Wahl,01:46:58,"Thoughtfully, or the. The hired man was sensitive enough that he didn't barge into this family room without an invitation, or without a reason, or without an invitation. Usually he was invited to come in and play cards or whatever you were doing or discuss.",01;47;23;20
Sam Schrager,01:47:23,"This would be true equally of hired men and migrant workers, or more so of migrant.",01;47;28;01
Tom Wahl,01:47:28,"Workers, more so of migrant worker than the hired, than the man that you called your hired man. Oftentimes a hired man, the one that I like to think of as the hired man. Oftentimes he was he was just like a member of your family. He was probably closer to you than many of your relatives. And he knew your problems and you knew his and you sympathized with each other. This was your local, the hired man.",01;47;59;17
Sam Schrager,01:47:59,"So perhaps a farmer would feel free to give him advice or tell him, or be concerned about his welfare if he was going into town and and maybe didn't see me in the best of shape.",01;48;10;24
Tom Wahl,01:48:10,"Unless the farmer was pretty much one to hit the cups himself, he wouldn't have ever become the hired man if he did this. That was the. There was a distinction between the hired man and the migrant worker.",01;48;26;26
Sam Schrager,01:48:26,"Well, did the migrant worker usually come as a single person or or did he come?",01;48;31;12
Tom Wahl,01:48:31,"They sometimes came as a pair of relatives of each other, not you, but of.",01;48;36;24
Sam Schrager,01:48:36,Each other. But they didn't travel in in groups.,01;48;39;12
Tom Wahl,01:48:39,"They sometimes did. One time we had a pair of men come a. Man and his son in law, and they may they they made a point of working at the same place together. And the son in law was a splendid worker, and my father would have been glad to have kept him. And the father in law was probably a burden to this son in law, and really didn't hold up his end at all, in my father's estimation, and my father decided not to keep the father in law and the son in law very politely and calmly, with no rancor, said, well, I'd like to stay, but I can't. I'll have to quit too. And so they did, and in my estimation, probably this son in law was by this method, by doing the most work that he could do, was able frequently to maintain his father in law in a job where he would be tolerated because of the virtues of the Son of Law. I think my father appreciated this, but didn't feel that he was in a position to subsidize.",01;50;07;25
Tom Wahl,01:50:07,He had his own. He had his own people that he was responsible to.,01;50;14;15
Sam Schrager,01:50:14,"Well, these men made top wages when they were because they followed the harvest.",01;50;18;29
Tom Wahl,01:50:19,"Yeah, the harvest season was a high praying season and the hard work, it was worth every bit they got. But, they worked long hours and.",01;50;27;22
Sam Schrager,01:50:27,"Still somehow I have the maybe it was a little different than. But the my idea of the migrant, the farm labor force now is that is that they are just really at the bottom as far as their, their, their own social conditions.",01;50;43;09
Tom Wahl,01:50:43,"This has been this viewpoint has been brought about by several things, in my opinion. One, of course, is the Chavez effort to organize farm labor. And of course, Chavez is talking about the orchard labor and yes, Mexican laborer. And I don't know anything about it and can't touch on it because I only know.",01;51;09;27
Sam Schrager,01:51:09,"Well, I'm not thinking about it now, really, I'm asking you whether really whether whether back then these men were economically.",01;51;17;27
Tom Wahl,01:51:17,"I think it's a different thing. I think it's a different thing than one of this. Most of these farm laborers, or many of them had a hope of accumulating some money. Usually they didn't. They ended the thing that destroyed the farm laborer, in addition to the changing conditions, was the attitude of the draft during World War Two toward the person that didn't have a steady job. Somehow, in the type of bureaucracy, bureaucratic stupidity that we're faced with so frequently, they never did recognize the migrant farm labor as laborer, as being an essential, steady, hardworking man, which he was. To get any kind of a draft deferment, you had to have, first of all, a steady job. And that right there destroyed or probably hastened the destruction or the end of a migrant farm labor force. Although the change in the machinery type of machinery has done just as much or more to it.",01;52;29;15
Sam Schrager,01:52:29,"Well, I would I would certainly think that that I mean, if you were to choose that, that being a hired hand would be referable to being migrant, although you might get more money as a, as a migrant place to place the, the changing all the time and the additional problems and all that going with that would be pretty, pretty difficult. Although I do understand that that, for example, I've heard about plenty of tramp lumberjacks too.",01;52;55;12
Tom Wahl,01:52:55,"Yeah, yeah, this is a part of the picture.",01;52;58;02
Sam Schrager,01:52:58,"And I suppose these folks were kind of kin in a way, because it's a related kind.",01;53;03;16
Tom Wahl,01:53:03,"Of I think. So I think, though, that I made a mistake by calling our laborers migrant farm laborers, because although this does describe them, it would better to use a separate term and call them the harvest tramp, because harvest was what they followed. Harvest was what they did. They might work at other jobs when there was no harvest to do. I don't know what some of their was. They might have been doing anything. One man that worked at our place had his other field was cutting cloth for clothes somewhere. This was his background. Others might on occasion have started as seafaring men part of the time or might. This was what made them interesting. They might have originated in anything, or they might have other skills that you wouldn't expect. But the the harvest tramp he harvested and might do most anything else the rest of the year, but he made this harvest season stretch out for a long time by moving right.",01;54;23;02
Tom Wahl,01:54:23,"That's there's a distinction between the Harvest Man and the lumberjack, although oftentimes it was one and the same man. He might have done one for a while. He might have done the other for a while. I've some of them mind. I've on our plates. We've had miners that had quit mining and taken up this other life outside of the earth rather than underneath. They might have quit mining for a reason, for this very reason that they got tired of it. There was one man that worked for us, one of the last migrant workers that worked for us. His name was Buck Lewis. Red Lewis had a very good sense of humor, and he was describing some of the work that he had done other than farming, and he described some mining that he had done down in southern or Southern California. I believe it was in Earth that was not like rock. You bored holes in it with an organ. And I having seen calico in Southern California, I presume it was in a area like this, a kind of an earthy rock or a soil, and told me of how much he made there, which was about three times what he was getting at our place.",01;55;42;03
Tom Wahl,01:55:42,"And it would be like now a man that here might be working for $3 an hour, putting it in the modern time and wage scale, I would say. Suppose he were working at our place at $3 an hour right now, and he would, in conversation, have said to me, well, I was making I was making $15 an hour, or I was making $10 an hour, and I couldn't afford to my fritter away my time like that, so I quit. Now that is the only explanation he ever gave to me as to why he had quit mining and started. Moving from farm to prime. Incidentally, this man had worked at our place two different times and one time this was during the depth of the depression. I offered him the. My father was dead by this time, offered him a chance to stay there all winter if he wanted to help me chore around doing nothing again. And we spent an enjoyable winter together with him in our family.",01;56;53;26
Tom Wahl,01:56:53,"And he here's an instance of a farm laborer that just fit right in, just like the hired man would if he was the hired man there when he was at our place. And I think perhaps the thing that endeared him to us was his sense of humor, which my family shared with anyone who exposed it. I'll give you just a few little incidents, although this is far from being history. It did happen back in the depression days though, so that's quite a little while ago. The 30s. And along with this chalking around and doing nothing that we did there for quite a long period of time, every day when the weather would permit, we would drive to town with a team of horses, two teams of horses and two sleds, and get a load of feed for all these animals and haul it out to feed the feet, to fill the feed bins so that we would have it there when work started in the spring and we had to use these horses in the field.",01;57;53;00
Tom Wahl,01:57:53,"You don't feed horses grain unless you're working them, and this was in preparation to getting ready to work the horses. Although these that were doing the hauling, they got grain. But the their fellow horses that were going to eat it in the summer didn't get to eat it in the winter. And this was in real cold weather when the sledding was good and it was darn cold and we were going to or from town. I got off and walked as far as you frequently do when you're driving horses and are cold while you walk, so you keep warm. And Buck said to me as I was doing this, he says, well, I'll sit here and freeze like a man before I'll get off and walk like a dog. Another thing that might be a little side light on some of the lighter moments. He had one bad habit he chewed Copenhagen. This was almost a common habit to most farm workers. Harvest tramps. Smoking would be almost forbidden. They most all of them chewed tobacco or chewed Copenhagen for a vice. And this man was helping me build a machine shed that winter.",01;59;15;27
Tom Wahl,01:59:16,"And so he was up on a ladder and with nailing some boards on and with his mouth full of nails. And I heard him mumbling through these nails, now got, dammit, you would want to chew a snooze. I can't remember too many of these little incidences.",01;59;45;10
Sam Schrager,01:59:45,Sounds like a very humorous.,01;59;46;27
Tom Wahl,01:59:46,"This is just typical of a relation that more often than not, I should say every time it was possible occurred between the farmer and his employee where you could. It lightened the day. It made it easier. It made it a pleasure. I think this is probably typical of what happened in many farm families, although as a farmer's son I never worked, but very little as a hired man. And so I can only speak firsthand of my own farm, my father's farm, and maybe of some of the close neighbors. But it would be typical of those, which. Sounds like that experience.",02;00;33;13
Sam Schrager,02:00:33,"With sounds like when when things were were maybe ideal, as you say. But the better the the better relationships. You put all the differences aside, and there was just a camaraderie between the people to get work done.",02;00;46;24
Tom Wahl,02:00:46,"It's as I have tried to point out to a man that doesn't want to work for somebody else. He resents working for somebody else. I told him, look at it this way you're fighting a common enemy, your allies, a thing that I have felt, and I think that these hired men felt was the hired man performs a service for his employer, and the employer performs a service for his hired man. He. You provide him the tools of production, and he provides you the man to run them. You guarantee him an income, and he helps you try to win one at a more chancy game. I wish that there were better relations all through labor and management, labor relations that parallel this because this is a situation that does exist, and it is one that it is not. To the interest of the managements of labor unions to foster. I have seen an instance or two where I think the answer to it would be cooperative enterprises, where the labor force are the stockholders and some of the stockholders are the management where it is mutually shared.",02;02;25;11
Tom Wahl,02:02:25,"But you don't want philosophy, you want desperation.",02;02;28;18
Sam Schrager,02:02:28,I think I think I ought to get.,02;02;30;11