speaker,timestamp,words,End Time
Tom Wahl,00:36:29,"You placed a rope. At a spacing that would permit you to lay a hog on the rope and have the ropes behind his front legs and in front of his hind legs. And this rope. This might be one rope with a that continued over across the that then back on the other side. Or it might be two separate ropes depending on what you had available. If you had a long rope, you didn't cut it for this purpose because that was waste. If you had two short ropes you used, that one man would get Ahold of each end of this rope. The hog would be placed on top of these two ropes on the platform. Then the two ends. That were the closest to the hog would be placed back across the hog, over on to the other side of the vat, or on or to the handed to the men on the opposite side of the vat from the hog. Then, if there were only two men butchering this hog, you probably held one end of the rope and stood on the other end. Usually this is the way it was done. You had one rope in your hands and one under your feet. Each man did. One rope ran from beneath your feet, across the that underneath the hog. Back up around the hog and back up to your hands.",00;38;14;19
Tom Wahl,00:38:14,"You pull on this rope and the hog falls into the vat. But before the hog falls into the vat, if you have four men, you, you you pull this hog up till he's pretty nicely balanced near the edge of the vat. Then the rope under your feet is handed to the man who is standing back on the other side of the hog. Remember one of these ropes and these pairs of men at each end of the hog? Now you have a hog with a rope that has a bite in it. If you know what a bite is, it's a loop. Like you like the letter, like the script letter E upside down the hog, his front quarters and his hindquarters sticking through this bite in the rope. The man on the opposite side of the vat pulls on his rope, and this rolls the hog. The two men on the opposite side of the. The two men opposite the hog on the other side of the bat, pull simultaneously on the rope that they have the two men that are on the same side of the vat as the hawk standing on this platform, hold their ropes tight and permit it to slacken. As the hog is pulled further and further over the edge of the bat, keeping the rope tight.",00;39;54;26
Tom Wahl,00:39:54,"As soon as the weight of the hog would tend to splash it down into the water. Splash this water, splashing this water all out all over you and scalding you all badly. The men holding this end of the rope where the hog is. Let the hog gently, easily and slowly down into the water, and nobody even thinks of the danger of getting scalded. Because you know how to do this, and it is done, usually without any mishap, and very satisfactorily. There isn't any great straining or lifting about it, of course, because you have enough men around to do the job you're going to do. Scalding a hog in a gasoline drum or a metal drum is another way of doing it, where one man or two men might want to scored a hog, where they stick it first one end and then the other in a drum or barrel of hot water. But two, the way of thinking of my family and most of the people in our neighborhood, this was a pretty slipshod and poorly planned butchering. If you did it this way. Later on, some enterprising neighbors of ours left an old bathtub permanently set up for the purpose of scalding hogs, and this makes a fairly good that, too, although it's rather small for a large hog.",00;41;23;04
Tom Wahl,00:41:23,"Hogs that you butchered might vary anywhere from 150 pounds. Well, I should say sometimes even a suckling pig, which is an altogether different thing. Clear up to a hog. That would way 400 600 pounds. And that's a big hog.",00;41;44;21
Sam Schrager,00:41:44,"Hell, after the after the..",00;41;46;13
Tom Wahl,00:41:46,"Then as you skull this hog, these ropes are still around him in this same position. One man on each side of the that at each end of the that or each side of. This is getting too wordy. I know, but. You have one man on each end of a rope and a rope looping in a shape of a letter E down around under the hog and up to the other man. Now, if you pull these ropes properly, you can roll this hog over and over in the water and the man on the other side, as you slack your ropes up, can pull the rope back under the hog without rolling the hog. So you have a choice. So you can roll this hog in either direction, and you can roll him at any speed you wish, or you can lift him out of the trough merely by the way in which you regulate the tension on these two ropes. And one of the things, one of the first indications that the hogs ready to come out of this, that is that the hair beneath these ropes, continually rubbed by these ropes, begins to disappear and float around in the that I've left out.",00;43;00;24
Tom Wahl,00:43:00,"One important thing that you should you might be interested in. This water that you use has to have some lie in it. But since lye cost in those days $0.05 for a can, you didn't go to the trouble. The expense of pouring lie in and lie is pretty wicked stuff anyway. You don't want to be spliced with a lie. You just put in ashes and you put in enough ashes so that the water feels slippery. And I think the roughness of the ashes in the bottom of the vat probably contributes also to the scraping off of the hair of the hog. The first thing after the killing of the hog is to scald him. First you kill him and bleed him and scald him and scrape off the hair.",00;43;54;11
Sam Schrager,00:43:54,"Let me just ask you, we didn't do it. Since the description is so good. I'm curious about the killing itself. What was the method of butchering? Killing? I mean, of killing. The killing the hog. Then.",00;44;05;00
Tom Wahl,00:44:05,,00;44;05;29
Sam Schrager,00:44:06,With these a knife?,00;44;08;28
Tom Wahl,00:44:09,"It's done in a number of ways. The method of killing a hog that is recommended by the Morton Salt people. And the method that is recommended and followed, and I believe yet followed by the packing plants, such as armors, which I have witnessed, is to kill the hog by cutting his jugular vein and letting him bleed to death. And in my mind and in the mind of my father and a lot of people, this is quite a cruel method of killing. The purpose of it is is not the purpose of cruelty. It's to get a good bleed of the hog. You meet. This better if the blood is removed. It keeps better. This meat is going to be cured and it should be well bled. And it will keep better. And it is more attractive to look at more palatable. In our family, we always shot it, shot the pig in the brain with a 22, which to my mind yet is one of the most humane methods commonly used. There is this hazard about shooting a hog. If you don't place that bullet just right, you won't kill the hog or even knock him down, and he'll run around squealing for a while, and you've got to try to get close enough to him again to do it.",00;45;33;03
Tom Wahl,00:45:33,"This occasionally happens and you can't. You don't want to shoot them with a high powered rifle that will go clear through him and ruin the meat. So the commonly used rifle is a 22 rimfire rifle, a small hog. Frequently you use a 22 short, but in a 22 short cartridge, which is not a very powerful cartridge. Ideally this the bullet when you shoot the hard, will go through the skull into the brain and not out of the other side of the skull. Another way commonly done requires a little skill, but it's probably a little safer in some ways is to hit him in the head with a hammer. Suitable size. This takes a little skill, and it's pretty easy to fail to hit that hog hard enough to do anything more than temporarily stunning, or scare him or hurt him. So either method that you use has the hazard of being more cruel, perhaps, than the knife.",00;46;47;20
Tom Wahl,00:46:47,"However, in our case, I preferred the use of a 22 long rifle much more than any other method that I have seen use.",00;47;00;17
Sam Schrager,00:47:00,And then you slip through it immediately after.,00;47;02;25
Tom Wahl,00:47:02,"This and shot. That is right. Properly done. Now, these hogs are not really gentle animals. They're not a fearful of you, but they are inclined to move around. Properly done. The heart will usually be. At the moment you're ready to kill him. He will be eating something that you've put down to attract his attention and make him stand still. And then you stand in front of him, ideally, perhaps at a distance of 3 or 4ft. You draw with his nose, with his nose pointed toward the ground. Draw an imaginary line between his ear and the opposite I between each of his ears and each of his opposite eyes. Where that line crosses. If you shoot him in a direction that is practically exactly perpendicular to the surface of his head, at that point he'll drop without ever knowing he was hit. And after the first, he doesn't even move for a few seconds. Then he goes through the spasms that are characteristic of death.",00;48;34;21
Tom Wahl,00:48:34,"Then as soon as he has, as soon as you can, immediately after you've shot him, preferably before he starts into these spasms, you stick a knife into his throat and try to cross these. Try to cut one of these forks of the blood vessels. I guess they are junior veins. I don't really know the proper name of them, but there seems to be a place that they fork right in the soft part. You can put your finger on the soft spot part of your own chest or throat, just above your chest. That is the point that you stick your knife in and aim for the pigs tail. And usually if you've done it right, you give the knife a little twist and pull it back out. Usually if you've done this right, a gush of blood will follow the knife blade on the way out, and it's just a very short time until he has bled. Clear out. This isn't a pretty picture. However, we all recognize the necessity of it and made what pleasure we could out of these butcher rings, and they were regarded as a thing of pleasure. But never at any time have I ever seen anybody. And joy, the taking of a life at one of these things. And always, if it isn't a clean, quick and painless death, there's always a sort of a cloud of unhappiness over this.",00;50;26;10
Tom Wahl,00:50:26,What has come to be regarded as a more or less of a festival.,00;50;34;20
Sam Schrager,00:50:34,"Maybe we should just finish up the description from, from the the end of the scalding of the hair to, to the cleaning, since.",00;50;43;08
Tom Wahl,00:50:43,This is getting too long.,00;50;44;22
Sam Schrager,00:50:44,"Well, I don't know. It's I enjoy this kind of detail because because it's, it's, I've only ever heard them butchering bees described very superficially, you know, never, never in.",00;50;59;17
Tom Wahl,00:50:59,That is because it is assumed that everybody knows everything I've told you.,00;51;05;09
Sam Schrager,00:51:05,"Well, it seemed. Well, I know little of it. People ask me to go. No. Even less.",00;51;10;10
Tom Wahl,00:51:10,"Yes. That's right, it's no longer done. Not even on the farms. Or if so, very, very rarely.",00;51;16;24
Sam Schrager,00:51:16,"If you want, you could just maybe go through it quickly and well on the rest of the rest of the the process.",00;51;23;24
Tom Wahl,00:51:23,"In a packing plant, many of the things are done mechanically. Right. But, with these same ropes that you've been that you put the place the hog in the trough and the same ropes that you, rolled him while he was in the trough. Then you take him out with these same ropes. Now, if you have a platform on each side of the vat, it doesn't make any difference which way you roll the hog out of the that. But at this point, you keep the rope that you have on your side and you reach over or have passed to you the rope that had previously been held on the man by the man on the opposite side of the vat. And you can put his rope under your foot if you're short of men, or you can give it to someone else who will hold it solidly. Or you could tie it to a stake, and then you pull on the rope you've been holding. There's one man on each rope now on the platform along one side of the vat. Then by pulling on this rope, you simply roll this hog up out of the back and onto this platform. There's only a very short distance that you're holding the whole weight of the hog, and that's when he's cleared out of the water because he is buoyed up while he's in the water, he's practically floating.",00;52;55;28
Tom Wahl,00:52:56,"And you can see here the reason why the ideal VAT will have a somewhat sloping side, although not really a low sloping side, but they're not vertical. And this is one of the drawbacks of using a bathtub is that it has a slippery vertical side, and it's too deep and it's too short and it's too narrow. As soon as you get him out, you all all the help that's available, come there around the hog with scrapers if you have them. But usually it's a knife and you scrape the hog with this knife, and as you scrape, the hair comes off and you keep on scraping the scarf. Skin comes off along with the hair. And after you've scraped all the hair off from him, you wash him in this somewhat dirty looking water. And lots of times you will have then, or you should have then after washing them, or rather sloshing him, I should say with this water and ashes. Then you rinse that off with some clear water, and frequently that clear water you rinse it, rinse him with is cold, or it can be cold because you've already accomplished the purpose that you wanted to accomplish with the hot water.",00;54;21;14
Tom Wahl,00:54:21,"You may then discover that you haven't scraped him as clean as you should have, and you go back and scrape a few more patches.",00;54;28;21
Sam Schrager,00:54:28,This scraping done by the women as well as the men.,00;54;31;09
Tom Wahl,00:54:31,"Are not in our country and at a butchering be at our time. There's no reason why a woman couldn't have participated in this, except for the fact that there's a big crowd of people there. And this is a day of festivity, and the women are all in the house making dinner. And also as soon as you get the first animal butchered, there are some of the early tidbits that could be even used at this dinner, although my appetite for these was much better a week after the butchering was over than it was the day of the butchering… my… my idea of a good meat dish at a butchering is a Swiss steak or a breaded steak, something that you don't associate with the animal you have just killed. There are many, many people that aren't bothered by this. Then after the hog scraped, you hang him up and remove his entrance. And.",00;55;41;11
Tom Wahl,00:55:41,"For that day, you're done. The weather school, you hang him up high enough so the dogs won't get him. It's cold enough so the flies won't blow it. And the next day or later, you couldn't take him down, cut him up into bacons and start the curing process, which lasts for weeks and weeks.",00;56;02;00
Sam Schrager,00:56:02,Would the neighbors take their hogs home and hang them.,00;56;06;01
Tom Wahl,00:56:06,"Or leave them at your place? No. Usually they could do them both, but usually they would hang them where you butchered them until they got stiff and. Cold, ready for the cutting up process. This thing is, I won't try to describe much more of this because this is a process, this meat process, along with your daily chart of taking care of your horses and cattle and milking the cows and gathering the eggs. If your hands are still laying and cleaning out the stables, chopping the wood or sawing it if you haven't sought it, or would usually was hauled and in the form of four foot cordwood. It's easier to load, easier to unload, quicker to handle. Then you had all winter to saw it up. So you filled some more of your day with the curing of this meat, and after sufficiently salted, then with the smoking of this meat and this preparing of the cured meat is a process that went on for a long, long time. It didn't take much time each day, but it took a lot of time.",00;57;31;18
Tom Wahl,00:57:31,"It fills your day when you were doing nothing. This is what was going on. Butchering day was a day you didn't say you were doing nothing. We're butchering. That was a day. That was a day when you did something. But the rest of the time, although you were just as busy, you still got up at 530, went out after supper and fed your animals and milked your cows. Still, if you'd finished your butchering, you weren't doing anything. You didn't say, I'm curing meat. You didn't say I'm milking cows. You didn't say I'm gathering eggs. Or do you might say, I'm doing chores. If you said you were doing chores or doing nothing, your neighbor knew what you meant.",00;58;11;26
Sam Schrager,00:58:11,"Well, what about the festivity after the the butchering itself? Or was.",00;58;16;20
Tom Wahl,00:58:16,"It the festivity consisted of going in and eating this. You'd say lunch. We called it dinner. There were three meals that farmers ate breakfast, dinner and supper. Breakfast came in the morning, dinner came at noon and supper came at night. Your main meal of the day was dinner. Supper wasn't a bad meal either, and breakfast was pretty hearty, too, because you had been up and done all your morning chores before you ate breakfast. You had three square meals a day. Sometimes in the winter when you were doing nothing, you just had two square meals, breakfast and dinner, and might have a light supper.",00;59;02;18
Sam Schrager,00:59:02,"But this this day, there would there would be neighbors there, and it would be the whole family. It would be quite a few people.",00;59;08;11
Tom Wahl,00:59:08,"The whole family would be there for this dinner and dinner. The noon lunch, that was the meal of the day. And you all enjoyed it. And you visited and you talked and you lingered around the table and you ate until you hurt. And if you had completed your butchering, you might then. Play some cards or just visit. But remember, this didn't last long. The noon meal. This was the festivity, really. The noon meal was the festivity. People had to go home and do their chores. They'd been neglecting them all day. They've been doing this butchering and they had to get back to doing nothing, which consisted of the chores, and they wouldn't be in bed till after dark. They had to go home and eat their supper, and then they had to go out and milk their cows. And if there were some animals that needed. Step back a little, you you usually tried to arrange these butchering at a time when you could pretty much minimize the chores that you had to do for that particular day. You might even do some of them early before you started. You might.",01;00;24;08
Tom Wahl,01:00:24,"Chose butchering at a time when the when you didn't have but very few animals to care for, or when there was still if it was cold enough early enough and the snow wasn't on the ground, your animals still might be making their own living picking it from the stubble, but you hadn't plowed yet. Or from the Timothy Meadows, which had had a fall growth of grass showing up on them. However, the nicest time to butcher is when there's snow on the ground. It's clean. Keeping this meat clean is kind of a problem. Butchering in the mud is not a pleasant job, although it's done often. I have seen men carrying a hog up to where you can put it in the vat, and slipping and sliding in the mud and falling down and getting maybe one. Usually. Usually the men don't all fall at the same time, but I've seen a man lying on his back in the mud with a hog and blood on top of it. This is mirth. This causes great mirth. And if somebody had the foresight to bring a flask of what in my day would have had to have been moonshine, this added to the mirth.",01;01;37;09
Tom Wahl,01:01:37,"And it didn't hurt your appetite any either. Nobody got drunk, but it made the suffering. I must say you did some. This was not easy. There was always some. Of the I don't call it unpleasantness. I search for a word. That's right. But I mean, somebody might slip and stick his foot into the vat of water and get it out again before he got burned. And this caused a lot of murder. Somebody might break a hole in the ice where he. If it was that cold and it was covered as a step into what remains of your early fall mudhole and get his leg wet. Clear up to the knee. This isn't comfortable, but he's busy. He's not going to go take his shoe and sock off or his pants off or anything, no matter which it was he stepped into. Unless he's really injured. He just accepts the laughs that come in his direction. And this is all part of the mercy that goes with butchering, which I think is probably artificially stimulated because of the rather abhorrence of causing a death that people, many people share with me.",01;02;58;01
Sam Schrager,01:02:58,"Well, I would think too, from from what you're saying, there weren't that many opportunities for men to work together because farming was mostly a solitary occupation. And and so this was a chance for that lived near each other and knew each other to spend time together.",01;03;16;19
Tom Wahl,01:03:16,"This is absolutely right. And this is one of the reasons why also, haying and harvest is remembered by most farmers as a pleasant time, although it is our two of the most exhausting types of work that I have ever engaged in. Still, this companionship of neighbor with neighbor and man with man, and frequently in the case of harvest and haying strangers, people that have traveled, we had in those days a source of labor. The migratory farm worker that was. Really an institution that I hate to see disappearing. Some of them in the harvest time were called harvest tramps, but they were far from a tramp. This was a profession they followed. They would start harvest at the earliest place they knew of, say, Southern California or Central California, worked their way up through this area. Maybe they might start harvests sometime in early June in California and be up here by August or September and end up in the snow up in Canada thrashing wheat and having spent the whole summer, these people were drawing the highest wages that farmer farm laborers get by following the harvest as long as possible.",01;04;55;06
Tom Wahl,01:04:55,"Hey, harvest was a time that people got together. This way you got to get acquainted with. Now remember the help we used farmers in those days, lived with you and ate with you and became a part of your family. And they were your friends. Usually. Sometimes because of the number of them, the the hired hands slept in a bunkhouse, which was really a good thing because they then got to associate with one another without the supervision or interference of their employer. They could discuss their grievances with one another without feeling like they were being listened in on in harvest time and in hating. Oftentimes the harvest hands and the hay hands slept in the barn. Oftentimes, the father and the owner of the farm and his son would sleep in the barn. This was not a hardship. This was a pleasure.",01;05;58;23
Tom Wahl,01:05:58,"You might sleep in nice weather right out under the skies. You enjoyed this. It's a new experience. It's pleasant. There are mosquitoes. There were flies. Something you might forget about. But all in all, for these short periods of time, our work was our pleasure. Or at least our work was related to our pleasure. And the sociability that you meant was the biggest part of it.",01;06;28;00
Sam Schrager,01:06:28,"I'm quite interested in the in what you remember about the harvest hands, the people that, well, all the harvest.",01;06;36;00
Tom Wahl,01:06:36,"One of the things that would interest you in your in your harvest help and your hey help. Lots of times your harvest hand was your hay hand. He came and stayed through both seasons because they overlap. And these were people that have had seen things that you never had seen, probably never would see. Oftentimes they were people from a foreign country, one of the most or two of the most interesting harvest tramps that we had that came to our place were from the Scandinavian countries. One was a Norwegian and one was Swedish, and there was a rivalry and a bickering between these two, and they were both intelligent men. I don't mean to say educated man. I suppose neither one of them had had any appreciable amount of schooling, and yet they had acquired a wisdom and an experience and some skills that perhaps were of more value to them then, than an education is to some of our educated people now.",01;07;55;20
Tom Wahl,01:07:55,"Some of these people had a musical skill, not a trained skill, but one that they had acquired in their homes or in their old company. One of the the Norwegian that I speak of his name was Edward Olson always carried a violin with him, and as music was a skill that I didn't have and very few of our family had, it was a great pleasure. If he was not too tired some evening, if he would take his fiddle out and play us some music. He also carried a flag elite and he would play it and he enjoyed this and we enjoyed it there. Sometimes in hay season one particular, one particular event sticks in my mind because I was a quite a young, impressionable boy at that time. I drove the Derrick team, the team that pulled the cable, that pulled the hay from the wagon up into the hay mile of the barn. And after the evening, quitting time had come when the horses were too tired to work anymore, and the men had an excuse for quitting and supper, while the supper bell hadn't quite rang yet, one of the men got out of Martha mouth harp, and sat up on a timber about 20ft from the ground.",01;09;27;22
